Sheet: PriorityQueue
A1: of:=15+[.N405] -> 15.5161290322581 | B1: Electorate | D1: Elec pts | E1: 2016 | F1: 2017 | G1: 2018 | H1: 2019 | I1: 2020 | J1: 2021 | K1: 2022 | L1: 2023 | M1: Outst pts | N1: 2016 | O1: 2017 | P1: 2018 | Q1: 2019 | R1: 2020 | S1: 2021 | T1: 2022 | U1: 2023 | V1: CTF pts | Y1: pdf kB | Z1: Filesize pts | AA1: Points | AB1: Rank | AD1: of:=ROUND(AVERAGE([.W2:.W399])+1.96*STDEV([.W2:.W399])) -> 44717
A2: Peterborough | B2: 134229 | C2: of:=IF(SUM([.E2:.L2])>0;[.B2];0) -> 134229 | D2: of:=[.C2]/[.C$401] -> 5.05559378483826 | I2: 1 | K2: 1 | L2: 1 | M2: of:=[.E2]*[.AC$11]+[.F2]*[.AC$13]+[.G2]*[.AC$15]+[.H2]*[.AC$17]+[.I2]*[.AC$19]+[.J2]*[.AC$21]+[.K2]*[.AC$23]+[.L2]*[.AC$25] -> 0.438376053895123 | N2: of:=IF([.E2]>0;1;0) -> 0 | O2: of:=IF([.F2]>0;1;0) -> 0 | P2: of:=IF([.G2]>0;1;0) -> 0 | Q2: of:=IF([.H2]>0;1;0) -> 0 | R2: of:=IF([.I2]>0;1;0) -> 1 | S2: of:=IF([.J2]>0;1;0) -> 0 | T2: of:=IF([.K2]>0;1;0) -> 1 | U2: of:=IF([.L2]>0;1;0) -> 1 | V2: of:=[.N2]*[.N$402]+[.O2]*[.O$402]+[.P2]*[.P$402]+[.Q2]*[.Q$402]+[.R2]*[.R$402]+[.S2]*[.S$402]+[.T2]*[.T$402]+[.U2]*[.U$402] -> 0.244939139266956 | X2: of:=[.$AD$1]*15 -> 670755 | Y2: of:=[.W2]+[.X2] -> 670755 | Z2: of:=[.Y2]/[.Y$401] -> 213.574557339546 | AA2: of:=[.D2]+[.M2]+[.V2]+[.Z2] -> 219.313466317546 | AB2: of:=RANK([.AA2];[.AA$2:.AA$399];0) -> 1
A3: Kent CC | B3: 1121803 | C3: of:=IF(SUM([.E3:.L3])>0;[.B3];0) -> 1121803 | D3: of:=[.C3]/[.C$401] -> 42.2515274241253 | J3: 1 | M3: of:=[.E3]*[.AC$11]+[.F3]*[.AC$13]+[.G3]*[.AC$15]+[.H3]*[.AC$17]+[.I3]*[.AC$19]+[.J3]*[.AC$21]+[.K3]*[.AC$23]+[.L3]*[.AC$25] -> 0.136078386768712 | N3: of:=IF([.E3]>0;1;0) -> 0 | O3: of:=IF([.F3]>0;1;0) -> 0 | P3: of:=IF([.G3]>0;1;0) -> 0 | Q3: of:=IF([.H3]>0;1;0) -> 0 | R3: of:=IF([.I3]>0;1;0) -> 0 | S3: of:=IF([.J3]>0;1;0) -> 1 | T3: of:=IF([.K3]>0;1;0) -> 0 | U3: of:=IF([.L3]>0;1;0) -> 0 | V3: of:=[.N3]*[.N$402]+[.O3]*[.O$402]+[.P3]*[.P$402]+[.Q3]*[.Q$402]+[.R3]*[.R$402]+[.S3]*[.S$402]+[.T3]*[.T$402]+[.U3]*[.U$402] -> 0.174691403761665 | X3: of:=[.$AD$1]*2 -> 89434 | Y3: of:=[.W3]+[.X3] -> 89434 | Z3: of:=[.Y3]/[.Y$401] -> 28.4766076452728 | AA3: of:=[.D3]+[.M3]+[.V3]+[.Z3] -> 71.0389048599285 | AB3: of:=RANK([.AA3];[.AA$2:.AA$399];0) -> 2 | AC3: Year
A4: Wirral | B4: 239107 | C4: of:=IF(SUM([.E4:.L4])>0;[.B4];0) -> 239107 | D4: of:=[.C4]/[.C$401] -> 9.00571309561511 | E4: 1 | G4: 1 | H4: 1 | I4: 1 | K4: 1 | L4: 1 | M4: of:=[.E4]*[.AC$11]+[.F4]*[.AC$13]+[.G4]*[.AC$15]+[.H4]*[.AC$17]+[.I4]*[.AC$19]+[.J4]*[.AC$21]+[.K4]*[.AC$23]+[.L4]*[.AC$25] -> 24.3728976153988 | N4: of:=IF([.E4]>0;1;0) -> 1 | O4: of:=IF([.F4]>0;1;0) -> 0 | P4: of:=IF([.G4]>0;1;0) -> 1 | Q4: of:=IF([.H4]>0;1;0) -> 1 | R4: of:=IF([.I4]>0;1;0) -> 1 | S4: of:=IF([.J4]>0;1;0) -> 0 | T4: of:=IF([.K4]>0;1;0) -> 1 | U4: of:=IF([.L4]>0;1;0) -> 1 | V4: of:=[.N4]*[.N$402]+[.O4]*[.O$402]+[.P4]*[.P$402]+[.Q4]*[.Q$402]+[.R4]*[.R$402]+[.S4]*[.S$402]+[.T4]*[.T$402]+[.U4]*[.U$402] -> 27.0957943222835 | W4: of:=612+637+8631 -> 9880 | Y4: of:=[.W4]+[.X4] -> 9880 | Z4: of:=[.Y4]/[.Y$401] -> 3.14588281341878 | AA4: of:=[.D4]+[.M4]+[.V4]+[.Z4] -> 63.6202878467162 | AB4: of:=RANK([.AA4];[.AA$2:.AA$399];0) -> 3 | AC4: 2019
A5: Wakefield | B5: 251674 | C5: of:=IF(SUM([.E5:.L5])>0;[.B5];0) -> 251674 | D5: of:=[.C5]/[.C$401] -> 9.47903590286289 | E5: 1 | G5: 1 | H5: 1 | I5: 1 | K5: 1 | L5: 1 | M5: of:=[.E5]*[.AC$11]+[.F5]*[.AC$13]+[.G5]*[.AC$15]+[.H5]*[.AC$17]+[.I5]*[.AC$19]+[.J5]*[.AC$21]+[.K5]*[.AC$23]+[.L5]*[.AC$25] -> 24.3728976153988 | N5: of:=IF([.E5]>0;1;0) -> 1 | O5: of:=IF([.F5]>0;1;0) -> 0 | P5: of:=IF([.G5]>0;1;0) -> 1 | Q5: of:=IF([.H5]>0;1;0) -> 1 | R5: of:=IF([.I5]>0;1;0) -> 1 | S5: of:=IF([.J5]>0;1;0) -> 0 | T5: of:=IF([.K5]>0;1;0) -> 1 | U5: of:=IF([.L5]>0;1;0) -> 1 | V5: of:=[.N5]*[.N$402]+[.O5]*[.O$402]+[.P5]*[.P$402]+[.Q5]*[.Q$402]+[.R5]*[.R$402]+[.S5]*[.S$402]+[.T5]*[.T$402]+[.U5]*[.U$402] -> 27.0957943222835 | W5: of:=83+1708+5151 -> 6942 | Y5: of:=[.W5]+[.X5] -> 6942 | Z5: of:=[.Y5]/[.Y$401] -> 2.21039660837583 | AA5: of:=[.D5]+[.M5]+[.V5]+[.Z5] -> 63.158124448921 | AB5: of:=RANK([.AA5];[.AA$2:.AA$399];0) -> 4 | AC5: Month
A6: Stockport | B6: 220640 | C6: of:=IF(SUM([.E6:.L6])>0;[.B6];0) -> 220640 | D6: of:=[.C6]/[.C$401] -> 8.31017300796931 | E6: 1 | G6: 1 | H6: 1 | I6: 1 | K6: 1 | L6: 1 | M6: of:=[.E6]*[.AC$11]+[.F6]*[.AC$13]+[.G6]*[.AC$15]+[.H6]*[.AC$17]+[.I6]*[.AC$19]+[.J6]*[.AC$21]+[.K6]*[.AC$23]+[.L6]*[.AC$25] -> 24.3728976153988 | N6: of:=IF([.E6]>0;1;0) -> 1 | O6: of:=IF([.F6]>0;1;0) -> 0 | P6: of:=IF([.G6]>0;1;0) -> 1 | Q6: of:=IF([.H6]>0;1;0) -> 1 | R6: of:=IF([.I6]>0;1;0) -> 1 | S6: of:=IF([.J6]>0;1;0) -> 0 | T6: of:=IF([.K6]>0;1;0) -> 1 | U6: of:=IF([.L6]>0;1;0) -> 1 | V6: of:=[.N6]*[.N$402]+[.O6]*[.O$402]+[.P6]*[.P$402]+[.Q6]*[.Q$402]+[.R6]*[.R$402]+[.S6]*[.S$402]+[.T6]*[.T$402]+[.U6]*[.U$402] -> 27.0957943222835 | W6: of:=600+756+9067 -> 10423 | Y6: of:=[.W6]+[.X6] -> 10423 | Z6: of:=[.Y6]/[.Y$401] -> 3.31877900448016 | AA6: of:=[.D6]+[.M6]+[.V6]+[.Z6] -> 63.0976439501317 | AB6: of:=RANK([.AA6];[.AA$2:.AA$399];0) -> 5 | AC6: 5
A7: Dudley | B7: 241166 | C7: of:=IF(SUM([.E7:.L7])>0;[.B7];0) -> 241166 | D7: of:=[.C7]/[.C$401] -> 9.08326316007944 | E7: 1 | G7: 1 | H7: 1 | I7: 1 | K7: 1 | L7: 1 | M7: of:=[.E7]*[.AC$11]+[.F7]*[.AC$13]+[.G7]*[.AC$15]+[.H7]*[.AC$17]+[.I7]*[.AC$19]+[.J7]*[.AC$21]+[.K7]*[.AC$23]+[.L7]*[.AC$25] -> 24.3728976153988 | N7: of:=IF([.E7]>0;1;0) -> 1 | O7: of:=IF([.F7]>0;1;0) -> 0 | P7: of:=IF([.G7]>0;1;0) -> 1 | Q7: of:=IF([.H7]>0;1;0) -> 1 | R7: of:=IF([.I7]>0;1;0) -> 1 | S7: of:=IF([.J7]>0;1;0) -> 0 | T7: of:=IF([.K7]>0;1;0) -> 1 | U7: of:=IF([.L7]>0;1;0) -> 1 | V7: of:=[.N7]*[.N$402]+[.O7]*[.O$402]+[.P7]*[.P$402]+[.Q7]*[.Q$402]+[.R7]*[.R$402]+[.S7]*[.S$402]+[.T7]*[.T$402]+[.U7]*[.U$402] -> 27.0957943222835 | W7: of:=65+1772+5250 -> 7087 | Y7: of:=[.W7]+[.X7] -> 7087 | Z7: of:=[.Y7]/[.Y$401] -> 2.25656594116386 | AA7: of:=[.D7]+[.M7]+[.V7]+[.Z7] -> 62.8085210389256 | AB7: of:=RANK([.AA7];[.AA$2:.AA$399];0) -> 6 | AC7: Day
A8: Wigan | B8: 235118 | C8: of:=IF(SUM([.E8:.L8])>0;[.B8];0) -> 235118 | D8: of:=[.C8]/[.C$401] -> 8.85547161569855 | E8: 1 | G8: 1 | H8: 1 | I8: 1 | K8: 1 | L8: 1 | M8: of:=[.E8]*[.AC$11]+[.F8]*[.AC$13]+[.G8]*[.AC$15]+[.H8]*[.AC$17]+[.I8]*[.AC$19]+[.J8]*[.AC$21]+[.K8]*[.AC$23]+[.L8]*[.AC$25] -> 24.3728976153988 | N8: of:=IF([.E8]>0;1;0) -> 1 | O8: of:=IF([.F8]>0;1;0) -> 0 | P8: of:=IF([.G8]>0;1;0) -> 1 | Q8: of:=IF([.H8]>0;1;0) -> 1 | R8: of:=IF([.I8]>0;1;0) -> 1 | S8: of:=IF([.J8]>0;1;0) -> 0 | T8: of:=IF([.K8]>0;1;0) -> 1 | U8: of:=IF([.L8]>0;1;0) -> 1 | V8: of:=[.N8]*[.N$402]+[.O8]*[.O$402]+[.P8]*[.P$402]+[.Q8]*[.Q$402]+[.R8]*[.R$402]+[.S8]*[.S$402]+[.T8]*[.T$402]+[.U8]*[.U$402] -> 27.0957943222835 | W8: of:=27+1850+5351 -> 7228 | Y8: of:=[.W8]+[.X8] -> 7228 | Z8: of:=[.Y8]/[.Y$401] -> 2.30146163718532 | AA8: of:=[.D8]+[.M8]+[.V8]+[.Z8] -> 62.6256251905661 | AB8: of:=RANK([.AA8];[.AA$2:.AA$399];0) -> 7 | AC8: 3
A9: Coventry | B9: 228089 | C9: of:=IF(SUM([.E9:.L9])>0;[.B9];0) -> 228089 | D9: of:=[.C9]/[.C$401] -> 8.59073174045827 | E9: 1 | G9: 1 | H9: 1 | I9: 1 | K9: 1 | L9: 1 | M9: of:=[.E9]*[.AC$11]+[.F9]*[.AC$13]+[.G9]*[.AC$15]+[.H9]*[.AC$17]+[.I9]*[.AC$19]+[.J9]*[.AC$21]+[.K9]*[.AC$23]+[.L9]*[.AC$25] -> 24.3728976153988 | N9: of:=IF([.E9]>0;1;0) -> 1 | O9: of:=IF([.F9]>0;1;0) -> 0 | P9: of:=IF([.G9]>0;1;0) -> 1 | Q9: of:=IF([.H9]>0;1;0) -> 1 | R9: of:=IF([.I9]>0;1;0) -> 1 | S9: of:=IF([.J9]>0;1;0) -> 0 | T9: of:=IF([.K9]>0;1;0) -> 1 | U9: of:=IF([.L9]>0;1;0) -> 1 | V9: of:=[.N9]*[.N$402]+[.O9]*[.O$402]+[.P9]*[.P$402]+[.Q9]*[.Q$402]+[.R9]*[.R$402]+[.S9]*[.S$402]+[.T9]*[.T$402]+[.U9]*[.U$402] -> 27.0957943222835 | W9: of:=472+1536+5047 -> 7055 | Y9: of:=[.W9]+[.X9] -> 7055 | Z9: of:=[.Y9]/[.Y$401] -> 2.24637684703133 | AA9: of:=[.D9]+[.M9]+[.V9]+[.Z9] -> 62.3058005251719 | AB9: of:=RANK([.AA9];[.AA$2:.AA$399];0) -> 8
A10: Sandwell | B10: 221165 | C10: of:=IF(SUM([.E10:.L10])>0;[.B10];0) -> 221165 | D10: of:=[.C10]/[.C$401] -> 8.32994657953015 | E10: 1 | G10: 1 | H10: 1 | I10: 1 | K10: 1 | L10: 1 | M10: of:=[.E10]*[.AC$11]+[.F10]*[.AC$13]+[.G10]*[.AC$15]+[.H10]*[.AC$17]+[.I10]*[.AC$19]+[.J10]*[.AC$21]+[.K10]*[.AC$23]+[.L10]*[.AC$25] -> 24.3728976153988 | N10: of:=IF([.E10]>0;1;0) -> 1 | O10: of:=IF([.F10]>0;1;0) -> 0 | P10: of:=IF([.G10]>0;1;0) -> 1 | Q10: of:=IF([.H10]>0;1;0) -> 1 | R10: of:=IF([.I10]>0;1;0) -> 1 | S10: of:=IF([.J10]>0;1;0) -> 0 | T10: of:=IF([.K10]>0;1;0) -> 1 | U10: of:=IF([.L10]>0;1;0) -> 1 | V10: of:=[.N10]*[.N$402]+[.O10]*[.O$402]+[.P10]*[.P$402]+[.Q10]*[.Q$402]+[.R10]*[.R$402]+[.S10]*[.S$402]+[.T10]*[.T$402]+[.U10]*[.U$402] -> 27.0957943222835 | W10: of:=470+1508+5454 -> 7432 | Y10: of:=[.W10]+[.X10] -> 7432 | Z10: of:=[.Y10]/[.Y$401] -> 2.3664171122802 | AA10: of:=[.D10]+[.M10]+[.V10]+[.Z10] -> 62.1650556294926 | AB10: of:=RANK([.AA10];[.AA$2:.AA$399];0) -> 9 | AC10: 2016
A11: Plymouth | B11: 187063 | C11: of:=IF(SUM([.E11:.L11])>0;[.B11];0) -> 187063 | D11: of:=[.C11]/[.C$401] -> 7.0455306988296 | E11: 1 | G11: 1 | H11: 1 | I11: 1 | K11: 1 | L11: 1 | M11: of:=[.E11]*[.AC$11]+[.F11]*[.AC$13]+[.G11]*[.AC$15]+[.H11]*[.AC$17]+[.I11]*[.AC$19]+[.J11]*[.AC$21]+[.K11]*[.AC$23]+[.L11]*[.AC$25] -> 24.3728976153988 | N11: of:=IF([.E11]>0;1;0) -> 1 | O11: of:=IF([.F11]>0;1;0) -> 0 | P11: of:=IF([.G11]>0;1;0) -> 1 | Q11: of:=IF([.H11]>0;1;0) -> 1 | R11: of:=IF([.I11]>0;1;0) -> 1 | S11: of:=IF([.J11]>0;1;0) -> 0 | T11: of:=IF([.K11]>0;1;0) -> 1 | U11: of:=IF([.L11]>0;1;0) -> 1 | V11: of:=[.N11]*[.N$402]+[.O11]*[.O$402]+[.P11]*[.P$402]+[.Q11]*[.Q$402]+[.R11]*[.R$402]+[.S11]*[.S$402]+[.T11]*[.T$402]+[.U11]*[.U$402] -> 27.0957943222835 | W11: of:=82+858+9194 -> 10134 | Y11: of:=[.W11]+[.X11] -> 10134 | Z11: of:=[.Y11]/[.Y$401] -> 3.22675874809574 | AA11: of:=[.D11]+[.M11]+[.V11]+[.Z11] -> 61.7409813846076 | AB11: of:=RANK([.AA11];[.AA$2:.AA$399];0) -> 10 | AC11: of:=EXP(([.AC6]-5)/12+([.AC8]-1)/365.2425+3) -> 20.1958232659268
A12: Bolton | B12: 196988 | C12: of:=IF(SUM([.E12:.L12])>0;[.B12];0) -> 196988 | D12: of:=[.C12]/[.C$401] -> 7.41934536119407 | E12: 1 | G12: 1 | H12: 1 | I12: 1 | K12: 1 | L12: 1 | M12: of:=[.E12]*[.AC$11]+[.F12]*[.AC$13]+[.G12]*[.AC$15]+[.H12]*[.AC$17]+[.I12]*[.AC$19]+[.J12]*[.AC$21]+[.K12]*[.AC$23]+[.L12]*[.AC$25] -> 24.3728976153988 | N12: of:=IF([.E12]>0;1;0) -> 1 | O12: of:=IF([.F12]>0;1;0) -> 0 | P12: of:=IF([.G12]>0;1;0) -> 1 | Q12: of:=IF([.H12]>0;1;0) -> 1 | R12: of:=IF([.I12]>0;1;0) -> 1 | S12: of:=IF([.J12]>0;1;0) -> 0 | T12: of:=IF([.K12]>0;1;0) -> 1 | U12: of:=IF([.L12]>0;1;0) -> 1 | V12: of:=[.N12]*[.N$402]+[.O12]*[.O$402]+[.P12]*[.P$402]+[.Q12]*[.Q$402]+[.R12]*[.R$402]+[.S12]*[.S$402]+[.T12]*[.T$402]+[.U12]*[.U$402] -> 27.0957943222835 | W12: of:=99+1895+6344 -> 8338 | Y12: of:=[.W12]+[.X12] -> 8338 | Z12: of:=[.Y12]/[.Y$401] -> 2.65489583990747 | AA12: of:=[.D12]+[.M12]+[.V12]+[.Z12] -> 61.5429331387838 | AB12: of:=RANK([.AA12];[.AA$2:.AA$399];0) -> 11 | AC12: of:=[.AC10]+1 -> 2017
A13: Walsall | B13: 198624 | C13: of:=IF(SUM([.E13:.L13])>0;[.B13];0) -> 198624 | D13: of:=[.C13]/[.C$401] -> 7.48096357657223 | E13: 1 | G13: 1 | H13: 1 | I13: 1 | K13: 1 | L13: 1 | M13: of:=[.E13]*[.AC$11]+[.F13]*[.AC$13]+[.G13]*[.AC$15]+[.H13]*[.AC$17]+[.I13]*[.AC$19]+[.J13]*[.AC$21]+[.K13]*[.AC$23]+[.L13]*[.AC$25] -> 24.3728976153988 | N13: of:=IF([.E13]>0;1;0) -> 1 | O13: of:=IF([.F13]>0;1;0) -> 0 | P13: of:=IF([.G13]>0;1;0) -> 1 | Q13: of:=IF([.H13]>0;1;0) -> 1 | R13: of:=IF([.I13]>0;1;0) -> 1 | S13: of:=IF([.J13]>0;1;0) -> 0 | T13: of:=IF([.K13]>0;1;0) -> 1 | U13: of:=IF([.L13]>0;1;0) -> 1 | V13: of:=[.N13]*[.N$402]+[.O13]*[.O$402]+[.P13]*[.P$402]+[.Q13]*[.Q$402]+[.R13]*[.R$402]+[.S13]*[.S$402]+[.T13]*[.T$402]+[.U13]*[.U$402] -> 27.0957943222835 | W13: of:=30+2009+5972 -> 8011 | Y13: of:=[.W13]+[.X13] -> 8011 | Z13: of:=[.Y13]/[.Y$401] -> 2.55077603424068 | AA13: of:=[.D13]+[.M13]+[.V13]+[.Z13] -> 61.5004315484952 | AB13: of:=RANK([.AA13];[.AA$2:.AA$399];0) -> 12 | AC13: of:=EXP(([.AC6]-5)/12+([.AC8]-1)/365.2425+2) -> 7.42962817706638
A14: Tameside | B14: 172482 | C14: of:=IF(SUM([.E14:.L14])>0;[.B14];0) -> 172482 | D14: of:=[.C14]/[.C$401] -> 6.49635270467985 | E14: 1 | G14: 1 | H14: 1 | I14: 1 | K14: 1 | L14: 1 | M14: of:=[.E14]*[.AC$11]+[.F14]*[.AC$13]+[.G14]*[.AC$15]+[.H14]*[.AC$17]+[.I14]*[.AC$19]+[.J14]*[.AC$21]+[.K14]*[.AC$23]+[.L14]*[.AC$25] -> 24.3728976153988 | N14: of:=IF([.E14]>0;1;0) -> 1 | O14: of:=IF([.F14]>0;1;0) -> 0 | P14: of:=IF([.G14]>0;1;0) -> 1 | Q14: of:=IF([.H14]>0;1;0) -> 1 | R14: of:=IF([.I14]>0;1;0) -> 1 | S14: of:=IF([.J14]>0;1;0) -> 0 | T14: of:=IF([.K14]>0;1;0) -> 1 | U14: of:=IF([.L14]>0;1;0) -> 1 | V14: of:=[.N14]*[.N$402]+[.O14]*[.O$402]+[.P14]*[.P$402]+[.Q14]*[.Q$402]+[.R14]*[.R$402]+[.S14]*[.S$402]+[.T14]*[.T$402]+[.U14]*[.U$402] -> 27.0957943222835 | W14: of:=159+646+9312 -> 10117 | Y14: of:=[.W14]+[.X14] -> 10117 | Z14: of:=[.Y14]/[.Y$401] -> 3.22134579183784 | AA14: of:=[.D14]+[.M14]+[.V14]+[.Z14] -> 61.1863904341999 | AB14: of:=RANK([.AA14];[.AA$2:.AA$399];0) -> 13 | AC14: of:=[.AC12]+1 -> 2018
A15: Hull | B15: 183269 | C15: of:=IF(SUM([.E15:.L15])>0;[.B15];0) -> 183269 | D15: of:=[.C15]/[.C$401] -> 6.90263368834993 | E15: 1 | G15: 1 | H15: 1 | I15: 1 | K15: 1 | L15: 1 | M15: of:=[.E15]*[.AC$11]+[.F15]*[.AC$13]+[.G15]*[.AC$15]+[.H15]*[.AC$17]+[.I15]*[.AC$19]+[.J15]*[.AC$21]+[.K15]*[.AC$23]+[.L15]*[.AC$25] -> 24.3728976153988 | N15: of:=IF([.E15]>0;1;0) -> 1 | O15: of:=IF([.F15]>0;1;0) -> 0 | P15: of:=IF([.G15]>0;1;0) -> 1 | Q15: of:=IF([.H15]>0;1;0) -> 1 | R15: of:=IF([.I15]>0;1;0) -> 1 | S15: of:=IF([.J15]>0;1;0) -> 0 | T15: of:=IF([.K15]>0;1;0) -> 1 | U15: of:=IF([.L15]>0;1;0) -> 1 | V15: of:=[.N15]*[.N$402]+[.O15]*[.O$402]+[.P15]*[.P$402]+[.Q15]*[.Q$402]+[.R15]*[.R$402]+[.S15]*[.S$402]+[.T15]*[.T$402]+[.U15]*[.U$402] -> 27.0957943222835 | W15: of:=66+2029+6601 -> 8696 | Y15: of:=[.W15]+[.X15] -> 8696 | Z15: of:=[.Y15]/[.Y$401] -> 2.76888633051516 | AA15: of:=[.D15]+[.M15]+[.V15]+[.Z15] -> 61.1402119565473 | AB15: of:=RANK([.AA15];[.AA$2:.AA$399];0) -> 14 | AC15: of:=EXP(([.AC6]-5)/12+([.AC8]-1)/365.2425+1) -> 2.73320746189078
A16: Swindon | B16: 168204 | C16: of:=IF(SUM([.E16:.L16])>0;[.B16];0) -> 168204 | D16: of:=[.C16]/[.C$401] -> 6.33522634441837 | E16: 1 | G16: 1 | H16: 1 | I16: 1 | K16: 1 | L16: 1 | M16: of:=[.E16]*[.AC$11]+[.F16]*[.AC$13]+[.G16]*[.AC$15]+[.H16]*[.AC$17]+[.I16]*[.AC$19]+[.J16]*[.AC$21]+[.K16]*[.AC$23]+[.L16]*[.AC$25] -> 24.3728976153988 | N16: of:=IF([.E16]>0;1;0) -> 1 | O16: of:=IF([.F16]>0;1;0) -> 0 | P16: of:=IF([.G16]>0;1;0) -> 1 | Q16: of:=IF([.H16]>0;1;0) -> 1 | R16: of:=IF([.I16]>0;1;0) -> 1 | S16: of:=IF([.J16]>0;1;0) -> 0 | T16: of:=IF([.K16]>0;1;0) -> 1 | U16: of:=IF([.L16]>0;1;0) -> 1 | V16: of:=[.N16]*[.N$402]+[.O16]*[.O$402]+[.P16]*[.P$402]+[.Q16]*[.Q$402]+[.R16]*[.R$402]+[.S16]*[.S$402]+[.T16]*[.T$402]+[.U16]*[.U$402] -> 27.0957943222835 | W16: of:=101+2051+7752 -> 9904 | Y16: of:=[.W16]+[.X16] -> 9904 | Z16: of:=[.Y16]/[.Y$401] -> 3.15352463401818 | AA16: of:=[.D16]+[.M16]+[.V16]+[.Z16] -> 60.9574429161188 | AB16: of:=RANK([.AA16];[.AA$2:.AA$399];0) -> 15 | AC16: of:=[.AC14]+1 -> 2019
A17: Derby | B17: 177213 | C17: of:=IF(SUM([.E17:.L17])>0;[.B17];0) -> 177213 | D17: of:=[.C17]/[.C$401] -> 6.6745408324024 | E17: 1 | G17: 1 | H17: 1 | I17: 1 | K17: 1 | L17: 1 | M17: of:=[.E17]*[.AC$11]+[.F17]*[.AC$13]+[.G17]*[.AC$15]+[.H17]*[.AC$17]+[.I17]*[.AC$19]+[.J17]*[.AC$21]+[.K17]*[.AC$23]+[.L17]*[.AC$25] -> 24.3728976153988 | N17: of:=IF([.E17]>0;1;0) -> 1 | O17: of:=IF([.F17]>0;1;0) -> 0 | P17: of:=IF([.G17]>0;1;0) -> 1 | Q17: of:=IF([.H17]>0;1;0) -> 1 | R17: of:=IF([.I17]>0;1;0) -> 1 | S17: of:=IF([.J17]>0;1;0) -> 0 | T17: of:=IF([.K17]>0;1;0) -> 1 | U17: of:=IF([.L17]>0;1;0) -> 1 | V17: of:=[.N17]*[.N$402]+[.O17]*[.O$402]+[.P17]*[.P$402]+[.Q17]*[.Q$402]+[.R17]*[.R$402]+[.S17]*[.S$402]+[.T17]*[.T$402]+[.U17]*[.U$402] -> 27.0957943222835 | W17: of:=684+1476+6224 -> 8384 | Y17: of:=[.W17]+[.X17] -> 8384 | Z17: of:=[.Y17]/[.Y$401] -> 2.66954266272298 | AA17: of:=[.D17]+[.M17]+[.V17]+[.Z17] -> 60.8127754328076 | AB17: of:=RANK([.AA17];[.AA$2:.AA$399];0) -> 16 | AC17: of:=EXP(([.AC6]-5)/12+([.AC8]-1)/365.2425+0) -> 1.005490833686
A18: Trafford | B18: 168646 | C18: of:=IF(SUM([.E18:.L18])>0;[.B18];0) -> 168646 | D18: of:=[.C18]/[.C$401] -> 6.35187380847531 | E18: 1 | G18: 1 | H18: 1 | I18: 1 | K18: 1 | L18: 1 | M18: of:=[.E18]*[.AC$11]+[.F18]*[.AC$13]+[.G18]*[.AC$15]+[.H18]*[.AC$17]+[.I18]*[.AC$19]+[.J18]*[.AC$21]+[.K18]*[.AC$23]+[.L18]*[.AC$25] -> 24.3728976153988 | N18: of:=IF([.E18]>0;1;0) -> 1 | O18: of:=IF([.F18]>0;1;0) -> 0 | P18: of:=IF([.G18]>0;1;0) -> 1 | Q18: of:=IF([.H18]>0;1;0) -> 1 | R18: of:=IF([.I18]>0;1;0) -> 1 | S18: of:=IF([.J18]>0;1;0) -> 0 | T18: of:=IF([.K18]>0;1;0) -> 1 | U18: of:=IF([.L18]>0;1;0) -> 1 | V18: of:=[.N18]*[.N$402]+[.O18]*[.O$402]+[.P18]*[.P$402]+[.Q18]*[.Q$402]+[.R18]*[.R$402]+[.S18]*[.S$402]+[.T18]*[.T$402]+[.U18]*[.U$402] -> 27.0957943222835 | W18: of:=56+2148+6723 -> 8927 | Y18: of:=[.W18]+[.X18] -> 8927 | Z18: of:=[.Y18]/[.Y$401] -> 2.84243885378436 | AA18: of:=[.D18]+[.M18]+[.V18]+[.Z18] -> 60.6630045999419 | AB18: of:=RANK([.AA18];[.AA$2:.AA$399];0) -> 17 | AC18: of:=[.AC16]+1 -> 2020
A19: N Tyneside | B19: 153637 | C19: of:=IF(SUM([.E19:.L19])>0;[.B19];0) -> 153637 | D19: of:=[.C19]/[.C$401] -> 5.78657564551025 | E19: 1 | G19: 1 | H19: 1 | I19: 1 | K19: 1 | L19: 1 | M19: of:=[.E19]*[.AC$11]+[.F19]*[.AC$13]+[.G19]*[.AC$15]+[.H19]*[.AC$17]+[.I19]*[.AC$19]+[.J19]*[.AC$21]+[.K19]*[.AC$23]+[.L19]*[.AC$25] -> 24.3728976153988 | N19: of:=IF([.E19]>0;1;0) -> 1 | O19: of:=IF([.F19]>0;1;0) -> 0 | P19: of:=IF([.G19]>0;1;0) -> 1 | Q19: of:=IF([.H19]>0;1;0) -> 1 | R19: of:=IF([.I19]>0;1;0) -> 1 | S19: of:=IF([.J19]>0;1;0) -> 0 | T19: of:=IF([.K19]>0;1;0) -> 1 | U19: of:=IF([.L19]>0;1;0) -> 1 | V19: of:=[.N19]*[.N$402]+[.O19]*[.O$402]+[.P19]*[.P$402]+[.Q19]*[.Q$402]+[.R19]*[.R$402]+[.S19]*[.S$402]+[.T19]*[.T$402]+[.U19]*[.U$402] -> 27.0957943222835 | W19: of:=44+2248+7305 -> 9597 | Y19: of:=[.W19]+[.X19] -> 9597 | Z19: of:=[.Y19]/[.Y$401] -> 3.05577301218422 | AA19: of:=[.D19]+[.M19]+[.V19]+[.Z19] -> 60.3110405953767 | AB19: of:=RANK([.AA19];[.AA$2:.AA$399];0) -> 18 | AC19: of:=EXP(([.AC6]-5)/12+([.AC8]-1)/365.2425-1) -> 0.369899405999412
A20: Gateshead | B20: 144592 | C20: of:=IF(SUM([.E20:.L20])>0;[.B20];0) -> 144592 | D20: of:=[.C20]/[.C$401] -> 5.44590525547634 | E20: 1 | G20: 1 | H20: 1 | I20: 1 | K20: 1 | L20: 1 | M20: of:=[.E20]*[.AC$11]+[.F20]*[.AC$13]+[.G20]*[.AC$15]+[.H20]*[.AC$17]+[.I20]*[.AC$19]+[.J20]*[.AC$21]+[.K20]*[.AC$23]+[.L20]*[.AC$25] -> 24.3728976153988 | N20: of:=IF([.E20]>0;1;0) -> 1 | O20: of:=IF([.F20]>0;1;0) -> 0 | P20: of:=IF([.G20]>0;1;0) -> 1 | Q20: of:=IF([.H20]>0;1;0) -> 1 | R20: of:=IF([.I20]>0;1;0) -> 1 | S20: of:=IF([.J20]>0;1;0) -> 0 | T20: of:=IF([.K20]>0;1;0) -> 1 | U20: of:=IF([.L20]>0;1;0) -> 1 | V20: of:=[.N20]*[.N$402]+[.O20]*[.O$402]+[.P20]*[.P$402]+[.Q20]*[.Q$402]+[.R20]*[.R$402]+[.S20]*[.S$402]+[.T20]*[.T$402]+[.U20]*[.U$402] -> 27.0957943222835 | W20: of:=115+2199+7867 -> 10181 | Y20: of:=[.W20]+[.X20] -> 10181 | Z20: of:=[.Y20]/[.Y$401] -> 3.2417239801029 | AA20: of:=[.D20]+[.M20]+[.V20]+[.Z20] -> 60.1563211732615 | AB20: of:=RANK([.AA20];[.AA$2:.AA$399];0) -> 19 | AC20: of:=[.AC18]+1 -> 2021
A21: Colchester | B21: 131340 | C21: of:=IF(SUM([.E21:.L21])>0;[.B21];0) -> 131340 | D21: of:=[.C21]/[.C$401] -> 4.94678264533489 | E21: 1 | G21: 1 | H21: 1 | I21: 1 | K21: 1 | L21: 1 | M21: of:=[.E21]*[.AC$11]+[.F21]*[.AC$13]+[.G21]*[.AC$15]+[.H21]*[.AC$17]+[.I21]*[.AC$19]+[.J21]*[.AC$21]+[.K21]*[.AC$23]+[.L21]*[.AC$25] -> 24.3728976153988 | N21: of:=IF([.E21]>0;1;0) -> 1 | O21: of:=IF([.F21]>0;1;0) -> 0 | P21: of:=IF([.G21]>0;1;0) -> 1 | Q21: of:=IF([.H21]>0;1;0) -> 1 | R21: of:=IF([.I21]>0;1;0) -> 1 | S21: of:=IF([.J21]>0;1;0) -> 0 | T21: of:=IF([.K21]>0;1;0) -> 1 | U21: of:=IF([.L21]>0;1;0) -> 1 | V21: of:=[.N21]*[.N$402]+[.O21]*[.O$402]+[.P21]*[.P$402]+[.Q21]*[.Q$402]+[.R21]*[.R$402]+[.S21]*[.S$402]+[.T21]*[.T$402]+[.U21]*[.U$402] -> 27.0957943222835 | W21: of:=300+1916+8486 -> 10702 | Y21: of:=[.W21]+[.X21] -> 10702 | Z21: of:=[.Y21]/[.Y$401] -> 3.40761516894816 | AA21: of:=[.D21]+[.M21]+[.V21]+[.Z21] -> 59.8230897519653 | AB21: of:=RANK([.AA21];[.AA$2:.AA$399];0) -> 20 | AC21: of:=EXP(([.AC6]-5)/12+([.AC8]-1)/365.2425-2) -> 0.136078386768712
A22: Calderdale | B22: 148886 | C22: of:=IF(SUM([.E22:.L22])>0;[.B22];0) -> 148886 | D22: of:=[.C22]/[.C$401] -> 5.6076342388711 | E22: 1 | G22: 1 | H22: 1 | I22: 1 | K22: 1 | L22: 1 | M22: of:=[.E22]*[.AC$11]+[.F22]*[.AC$13]+[.G22]*[.AC$15]+[.H22]*[.AC$17]+[.I22]*[.AC$19]+[.J22]*[.AC$21]+[.K22]*[.AC$23]+[.L22]*[.AC$25] -> 24.3728976153988 | N22: of:=IF([.E22]>0;1;0) -> 1 | O22: of:=IF([.F22]>0;1;0) -> 0 | P22: of:=IF([.G22]>0;1;0) -> 1 | Q22: of:=IF([.H22]>0;1;0) -> 1 | R22: of:=IF([.I22]>0;1;0) -> 1 | S22: of:=IF([.J22]>0;1;0) -> 0 | T22: of:=IF([.K22]>0;1;0) -> 1 | U22: of:=IF([.L22]>0;1;0) -> 1 | V22: of:=[.N22]*[.N$402]+[.O22]*[.O$402]+[.P22]*[.P$402]+[.Q22]*[.Q$402]+[.R22]*[.R$402]+[.S22]*[.S$402]+[.T22]*[.T$402]+[.U22]*[.U$402] -> 27.0957943222835 | W22: of:=1123+1375+5704 -> 8202 | Y22: of:=[.W22]+[.X22] -> 8202 | Z22: of:=[.Y22]/[.Y$401] -> 2.61159218984422 | AA22: of:=[.D22]+[.M22]+[.V22]+[.Z22] -> 59.6879183663976 | AB22: of:=RANK([.AA22];[.AA$2:.AA$399];0) -> 21 | AC22: of:=[.AC20]+1 -> 2022
A23: Southend-on-Sea | B23: 131160 | C23: of:=IF(SUM([.E23:.L23])>0;[.B23];0) -> 131160 | D23: of:=[.C23]/[.C$401] -> 4.94000313508546 | E23: 1 | G23: 1 | H23: 1 | I23: 1 | K23: 1 | L23: 1 | M23: of:=[.E23]*[.AC$11]+[.F23]*[.AC$13]+[.G23]*[.AC$15]+[.H23]*[.AC$17]+[.I23]*[.AC$19]+[.J23]*[.AC$21]+[.K23]*[.AC$23]+[.L23]*[.AC$25] -> 24.3728976153988 | N23: of:=IF([.E23]>0;1;0) -> 1 | O23: of:=IF([.F23]>0;1;0) -> 0 | P23: of:=IF([.G23]>0;1;0) -> 1 | Q23: of:=IF([.H23]>0;1;0) -> 1 | R23: of:=IF([.I23]>0;1;0) -> 1 | S23: of:=IF([.J23]>0;1;0) -> 0 | T23: of:=IF([.K23]>0;1;0) -> 1 | U23: of:=IF([.L23]>0;1;0) -> 1 | V23: of:=[.N23]*[.N$402]+[.O23]*[.O$402]+[.P23]*[.P$402]+[.Q23]*[.Q$402]+[.R23]*[.R$402]+[.S23]*[.S$402]+[.T23]*[.T$402]+[.U23]*[.U$402] -> 27.0957943222835 | W23: of:=52+44+9893 -> 9989 | Y23: of:=[.W23]+[.X23] -> 9989 | Z23: of:=[.Y23]/[.Y$401] -> 3.18058941530771 | AA23: of:=[.D23]+[.M23]+[.V23]+[.Z23] -> 59.5892844880754 | AB23: of:=RANK([.AA23];[.AA$2:.AA$399];0) -> 22 | AC23: of:=EXP(([.AC6]-5)/12+([.AC8]-1)/365.2425-3) -> 0.0500604408799853
A24: Wokingham | B24: 123251 | C24: of:=IF(SUM([.E24:.L24])>0;[.B24];0) -> 123251 | D24: of:=[.C24]/[.C$401] -> 4.64211898751462 | E24: 1 | G24: 1 | H24: 1 | I24: 1 | K24: 1 | L24: 1 | M24: of:=[.E24]*[.AC$11]+[.F24]*[.AC$13]+[.G24]*[.AC$15]+[.H24]*[.AC$17]+[.I24]*[.AC$19]+[.J24]*[.AC$21]+[.K24]*[.AC$23]+[.L24]*[.AC$25] -> 24.3728976153988 | N24: of:=IF([.E24]>0;1;0) -> 1 | O24: of:=IF([.F24]>0;1;0) -> 0 | P24: of:=IF([.G24]>0;1;0) -> 1 | Q24: of:=IF([.H24]>0;1;0) -> 1 | R24: of:=IF([.I24]>0;1;0) -> 1 | S24: of:=IF([.J24]>0;1;0) -> 0 | T24: of:=IF([.K24]>0;1;0) -> 1 | U24: of:=IF([.L24]>0;1;0) -> 1 | V24: of:=[.N24]*[.N$402]+[.O24]*[.O$402]+[.P24]*[.P$402]+[.Q24]*[.Q$402]+[.R24]*[.R$402]+[.S24]*[.S$402]+[.T24]*[.T$402]+[.U24]*[.U$402] -> 27.0957943222835 | W24: of:=161+273+9682 -> 10116 | Y24: of:=[.W24]+[.X24] -> 10116 | Z24: of:=[.Y24]/[.Y$401] -> 3.22102738264619 | AA24: of:=[.D24]+[.M24]+[.V24]+[.Z24] -> 59.3318383078431 | AB24: of:=RANK([.AA24];[.AA$2:.AA$399];0) -> 23 | AC24: of:=[.AC22]+1 -> 2023
A25: Blackburn with Darwen | B25: 101609 | C25: of:=IF(SUM([.E25:.L25])>0;[.B25];0) -> 101609 | D25: of:=[.C25]/[.C$401] -> 3.82699587185802 | E25: 1 | G25: 1 | H25: 1 | I25: 1 | K25: 1 | L25: 1 | M25: of:=[.E25]*[.AC$11]+[.F25]*[.AC$13]+[.G25]*[.AC$15]+[.H25]*[.AC$17]+[.I25]*[.AC$19]+[.J25]*[.AC$21]+[.K25]*[.AC$23]+[.L25]*[.AC$25] -> 24.3728976153988 | N25: of:=IF([.E25]>0;1;0) -> 1 | O25: of:=IF([.F25]>0;1;0) -> 0 | P25: of:=IF([.G25]>0;1;0) -> 1 | Q25: of:=IF([.H25]>0;1;0) -> 1 | R25: of:=IF([.I25]>0;1;0) -> 1 | S25: of:=IF([.J25]>0;1;0) -> 0 | T25: of:=IF([.K25]>0;1;0) -> 1 | U25: of:=IF([.L25]>0;1;0) -> 1 | V25: of:=[.N25]*[.N$402]+[.O25]*[.O$402]+[.P25]*[.P$402]+[.Q25]*[.Q$402]+[.R25]*[.R$402]+[.S25]*[.S$402]+[.T25]*[.T$402]+[.U25]*[.U$402] -> 27.0957943222835 | W25: of:=67+2513+8181 -> 10761 | Y25: of:=[.W25]+[.X25] -> 10761 | Z25: of:=[.Y25]/[.Y$401] -> 3.42640131125501 | AA25: of:=[.D25]+[.M25]+[.V25]+[.Z25] -> 58.7220891207953 | AB25: of:=RANK([.AA25];[.AA$2:.AA$399];0) -> 24 | AC25: of:=EXP(([.AC6]-5)/12+([.AC8]-1)/365.2425-4) -> 0.018416207015725
A26: Reigate and Banstead | B26: 105432 | C26: of:=IF(SUM([.E26:.L26])>0;[.B26];0) -> 105432 | D26: of:=[.C26]/[.C$401] -> 3.97098513676677 | E26: 1 | G26: 1 | H26: 1 | I26: 1 | K26: 1 | L26: 1 | M26: of:=[.E26]*[.AC$11]+[.F26]*[.AC$13]+[.G26]*[.AC$15]+[.H26]*[.AC$17]+[.I26]*[.AC$19]+[.J26]*[.AC$21]+[.K26]*[.AC$23]+[.L26]*[.AC$25] -> 24.3728976153988 | N26: of:=IF([.E26]>0;1;0) -> 1 | O26: of:=IF([.F26]>0;1;0) -> 0 | P26: of:=IF([.G26]>0;1;0) -> 1 | Q26: of:=IF([.H26]>0;1;0) -> 1 | R26: of:=IF([.I26]>0;1;0) -> 1 | S26: of:=IF([.J26]>0;1;0) -> 0 | T26: of:=IF([.K26]>0;1;0) -> 1 | U26: of:=IF([.L26]>0;1;0) -> 1 | V26: of:=[.N26]*[.N$402]+[.O26]*[.O$402]+[.P26]*[.P$402]+[.Q26]*[.Q$402]+[.R26]*[.R$402]+[.S26]*[.S$402]+[.T26]*[.T$402]+[.U26]*[.U$402] -> 27.0957943222835 | W26: of:=33+43+10101 -> 10177 | Y26: of:=[.W26]+[.X26] -> 10177 | Z26: of:=[.Y26]/[.Y$401] -> 3.24045034333633 | AA26: of:=[.D26]+[.M26]+[.V26]+[.Z26] -> 58.6801274177854 | AB26: of:=RANK([.AA26];[.AA$2:.AA$399];0) -> 25
A27: Eastleigh | B27: 98667 | C27: of:=IF(SUM([.E27:.L27])>0;[.B27];0) -> 98667 | D27: of:=[.C27]/[.C$401] -> 3.71618854322565 | E27: 1 | G27: 1 | H27: 1 | I27: 1 | K27: 1 | L27: 1 | M27: of:=[.E27]*[.AC$11]+[.F27]*[.AC$13]+[.G27]*[.AC$15]+[.H27]*[.AC$17]+[.I27]*[.AC$19]+[.J27]*[.AC$21]+[.K27]*[.AC$23]+[.L27]*[.AC$25] -> 24.3728976153988 | N27: of:=IF([.E27]>0;1;0) -> 1 | O27: of:=IF([.F27]>0;1;0) -> 0 | P27: of:=IF([.G27]>0;1;0) -> 1 | Q27: of:=IF([.H27]>0;1;0) -> 1 | R27: of:=IF([.I27]>0;1;0) -> 1 | S27: of:=IF([.J27]>0;1;0) -> 0 | T27: of:=IF([.K27]>0;1;0) -> 1 | U27: of:=IF([.L27]>0;1;0) -> 1 | V27: of:=[.N27]*[.N$402]+[.O27]*[.O$402]+[.P27]*[.P$402]+[.Q27]*[.Q$402]+[.R27]*[.R$402]+[.S27]*[.S$402]+[.T27]*[.T$402]+[.U27]*[.U$402] -> 27.0957943222835 | W27: of:=42+1360+9427 -> 10829 | Y27: of:=[.W27]+[.X27] -> 10829 | Z27: of:=[.Y27]/[.Y$401] -> 3.44805313628664 | AA27: of:=[.D27]+[.M27]+[.V27]+[.Z27] -> 58.6329336171946 | AB27: of:=RANK([.AA27];[.AA$2:.AA$399];0) -> 26 | AC27: of:=[.AC11]+[.AC13]+[.AC15]+[.AC17]+[.AC19]+[.AC21]+[.AC23]+[.AC25] -> 31.9386041792338
A28: N Herts | B28: 98685 | C28: of:=IF(SUM([.E28:.L28])>0;[.B28];0) -> 98685 | D28: of:=[.C28]/[.C$401] -> 3.7168664942506 | E28: 1 | G28: 1 | H28: 1 | I28: 1 | K28: 1 | L28: 1 | M28: of:=[.E28]*[.AC$11]+[.F28]*[.AC$13]+[.G28]*[.AC$15]+[.H28]*[.AC$17]+[.I28]*[.AC$19]+[.J28]*[.AC$21]+[.K28]*[.AC$23]+[.L28]*[.AC$25] -> 24.3728976153988 | N28: of:=IF([.E28]>0;1;0) -> 1 | O28: of:=IF([.F28]>0;1;0) -> 0 | P28: of:=IF([.G28]>0;1;0) -> 1 | Q28: of:=IF([.H28]>0;1;0) -> 1 | R28: of:=IF([.I28]>0;1;0) -> 1 | S28: of:=IF([.J28]>0;1;0) -> 0 | T28: of:=IF([.K28]>0;1;0) -> 1 | U28: of:=IF([.L28]>0;1;0) -> 1 | V28: of:=[.N28]*[.N$402]+[.O28]*[.O$402]+[.P28]*[.P$402]+[.Q28]*[.Q$402]+[.R28]*[.R$402]+[.S28]*[.S$402]+[.T28]*[.T$402]+[.U28]*[.U$402] -> 27.0957943222835 | W28: of:=50+2615+8028 -> 10693 | Y28: of:=[.W28]+[.X28] -> 10693 | Z28: of:=[.Y28]/[.Y$401] -> 3.40474948622339 | AA28: of:=[.D28]+[.M28]+[.V28]+[.Z28] -> 58.5903079181563 | AB28: of:=RANK([.AA28];[.AA$2:.AA$399];0) -> 27
A29: Elmbridge | B29: 98147 | C29: of:=IF(SUM([.E29:.L29])>0;[.B29];0) -> 98147 | D29: of:=[.C29]/[.C$401] -> 3.69660329139396 | E29: 1 | G29: 1 | H29: 1 | I29: 1 | K29: 1 | L29: 1 | M29: of:=[.E29]*[.AC$11]+[.F29]*[.AC$13]+[.G29]*[.AC$15]+[.H29]*[.AC$17]+[.I29]*[.AC$19]+[.J29]*[.AC$21]+[.K29]*[.AC$23]+[.L29]*[.AC$25] -> 24.3728976153988 | N29: of:=IF([.E29]>0;1;0) -> 1 | O29: of:=IF([.F29]>0;1;0) -> 0 | P29: of:=IF([.G29]>0;1;0) -> 1 | Q29: of:=IF([.H29]>0;1;0) -> 1 | R29: of:=IF([.I29]>0;1;0) -> 1 | S29: of:=IF([.J29]>0;1;0) -> 0 | T29: of:=IF([.K29]>0;1;0) -> 1 | U29: of:=IF([.L29]>0;1;0) -> 1 | V29: of:=[.N29]*[.N$402]+[.O29]*[.O$402]+[.P29]*[.P$402]+[.Q29]*[.Q$402]+[.R29]*[.R$402]+[.S29]*[.S$402]+[.T29]*[.T$402]+[.U29]*[.U$402] -> 27.0957943222835 | W29: of:=517+477+9560 -> 10554 | Y29: of:=[.W29]+[.X29] -> 10554 | Z29: of:=[.Y29]/[.Y$401] -> 3.36049060858521 | AA29: of:=[.D29]+[.M29]+[.V29]+[.Z29] -> 58.5257858376614 | AB29: of:=RANK([.AA29];[.AA$2:.AA$399];0) -> 28
A30: Halton | B30: 93006 | C30: of:=IF(SUM([.E30:.L30])>0;[.B30];0) -> 93006 | D30: of:=[.C30]/[.C$401] -> 3.50297294588105 | E30: 1 | G30: 1 | H30: 1 | I30: 1 | K30: 1 | L30: 1 | M30: of:=[.E30]*[.AC$11]+[.F30]*[.AC$13]+[.G30]*[.AC$15]+[.H30]*[.AC$17]+[.I30]*[.AC$19]+[.J30]*[.AC$21]+[.K30]*[.AC$23]+[.L30]*[.AC$25] -> 24.3728976153988 | N30: of:=IF([.E30]>0;1;0) -> 1 | O30: of:=IF([.F30]>0;1;0) -> 0 | P30: of:=IF([.G30]>0;1;0) -> 1 | Q30: of:=IF([.H30]>0;1;0) -> 1 | R30: of:=IF([.I30]>0;1;0) -> 1 | S30: of:=IF([.J30]>0;1;0) -> 0 | T30: of:=IF([.K30]>0;1;0) -> 1 | U30: of:=IF([.L30]>0;1;0) -> 1 | V30: of:=[.N30]*[.N$402]+[.O30]*[.O$402]+[.P30]*[.P$402]+[.Q30]*[.Q$402]+[.R30]*[.R$402]+[.S30]*[.S$402]+[.T30]*[.T$402]+[.U30]*[.U$402] -> 27.0957943222835 | W30: of:=45+26+10414 -> 10485 | Y30: of:=[.W30]+[.X30] -> 10485 | Z30: of:=[.Y30]/[.Y$401] -> 3.33852037436194 | AA30: of:=[.D30]+[.M30]+[.V30]+[.Z30] -> 58.3101852579252 | AB30: of:=RANK([.AA30];[.AA$2:.AA$399];0) -> 29
A31: Chorley | B31: 87432 | C31: of:=IF(SUM([.E31:.L31])>0;[.B31];0) -> 87432 | D31: of:=[.C31]/[.C$401] -> 3.29303411182366 | E31: 1 | G31: 1 | H31: 1 | I31: 1 | K31: 1 | L31: 1 | M31: of:=[.E31]*[.AC$11]+[.F31]*[.AC$13]+[.G31]*[.AC$15]+[.H31]*[.AC$17]+[.I31]*[.AC$19]+[.J31]*[.AC$21]+[.K31]*[.AC$23]+[.L31]*[.AC$25] -> 24.3728976153988 | N31: of:=IF([.E31]>0;1;0) -> 1 | O31: of:=IF([.F31]>0;1;0) -> 0 | P31: of:=IF([.G31]>0;1;0) -> 1 | Q31: of:=IF([.H31]>0;1;0) -> 1 | R31: of:=IF([.I31]>0;1;0) -> 1 | S31: of:=IF([.J31]>0;1;0) -> 0 | T31: of:=IF([.K31]>0;1;0) -> 1 | U31: of:=IF([.L31]>0;1;0) -> 1 | V31: of:=[.N31]*[.N$402]+[.O31]*[.O$402]+[.P31]*[.P$402]+[.Q31]*[.Q$402]+[.R31]*[.R$402]+[.S31]*[.S$402]+[.T31]*[.T$402]+[.U31]*[.U$402] -> 27.0957943222835 | W31: of:=124+2463+8332 -> 10919 | Y31: of:=[.W31]+[.X31] -> 10919 | Z31: of:=[.Y31]/[.Y$401] -> 3.47670996353438 | AA31: of:=[.D31]+[.M31]+[.V31]+[.Z31] -> 58.2384360130403 | AB31: of:=RANK([.AA31];[.AA$2:.AA$399];0) -> 30
A32: Winchester | B32: 89277 | C32: of:=IF(SUM([.E32:.L32])>0;[.B32];0) -> 89277 | D32: of:=[.C32]/[.C$401] -> 3.36252409188033 | E32: 1 | G32: 1 | H32: 1 | I32: 1 | K32: 1 | L32: 1 | M32: of:=[.E32]*[.AC$11]+[.F32]*[.AC$13]+[.G32]*[.AC$15]+[.H32]*[.AC$17]+[.I32]*[.AC$19]+[.J32]*[.AC$21]+[.K32]*[.AC$23]+[.L32]*[.AC$25] -> 24.3728976153988 | N32: of:=IF([.E32]>0;1;0) -> 1 | O32: of:=IF([.F32]>0;1;0) -> 0 | P32: of:=IF([.G32]>0;1;0) -> 1 | Q32: of:=IF([.H32]>0;1;0) -> 1 | R32: of:=IF([.I32]>0;1;0) -> 1 | S32: of:=IF([.J32]>0;1;0) -> 0 | T32: of:=IF([.K32]>0;1;0) -> 1 | U32: of:=IF([.L32]>0;1;0) -> 1 | V32: of:=[.N32]*[.N$402]+[.O32]*[.O$402]+[.P32]*[.P$402]+[.Q32]*[.Q$402]+[.R32]*[.R$402]+[.S32]*[.S$402]+[.T32]*[.T$402]+[.U32]*[.U$402] -> 27.0957943222835 | W32: of:=60+86+10202 -> 10348 | Y32: of:=[.W32]+[.X32] -> 10348 | Z32: of:=[.Y32]/[.Y$401] -> 3.29489831510704 | AA32: of:=[.D32]+[.M32]+[.V32]+[.Z32] -> 58.1261143446696 | AB32: of:=RANK([.AA32];[.AA$2:.AA$399];0) -> 31
A33: Preston | B33: 95562 | C33: of:=IF(SUM([.E33:.L33])>0;[.B33];0) -> 95562 | D33: of:=[.C33]/[.C$401] -> 3.59924199142297 | E33: 1 | G33: 1 | H33: 1 | I33: 1 | K33: 1 | L33: 1 | M33: of:=[.E33]*[.AC$11]+[.F33]*[.AC$13]+[.G33]*[.AC$15]+[.H33]*[.AC$17]+[.I33]*[.AC$19]+[.J33]*[.AC$21]+[.K33]*[.AC$23]+[.L33]*[.AC$25] -> 24.3728976153988 | N33: of:=IF([.E33]>0;1;0) -> 1 | O33: of:=IF([.F33]>0;1;0) -> 0 | P33: of:=IF([.G33]>0;1;0) -> 1 | Q33: of:=IF([.H33]>0;1;0) -> 1 | R33: of:=IF([.I33]>0;1;0) -> 1 | S33: of:=IF([.J33]>0;1;0) -> 0 | T33: of:=IF([.K33]>0;1;0) -> 1 | U33: of:=IF([.L33]>0;1;0) -> 1 | V33: of:=[.N33]*[.N$402]+[.O33]*[.O$402]+[.P33]*[.P$402]+[.Q33]*[.Q$402]+[.R33]*[.R$402]+[.S33]*[.S$402]+[.T33]*[.T$402]+[.U33]*[.U$402] -> 27.0957943222835 | W33: of:=39+2790+6460 -> 9289 | Y33: of:=[.W33]+[.X33] -> 9289 | Z33: of:=[.Y33]/[.Y$401] -> 2.95770298115861 | AA33: of:=[.D33]+[.M33]+[.V33]+[.Z33] -> 58.0256369102639 | AB33: of:=RANK([.AA33];[.AA$2:.AA$399];0) -> 32
A34: Slough | B34: 96820 | C34: of:=IF(SUM([.E34:.L34])>0;[.B34];0) -> 96820 | D34: of:=[.C34]/[.C$401] -> 3.64662323527732 | E34: 1 | G34: 1 | H34: 1 | I34: 1 | K34: 1 | L34: 1 | M34: of:=[.E34]*[.AC$11]+[.F34]*[.AC$13]+[.G34]*[.AC$15]+[.H34]*[.AC$17]+[.I34]*[.AC$19]+[.J34]*[.AC$21]+[.K34]*[.AC$23]+[.L34]*[.AC$25] -> 24.3728976153988 | N34: of:=IF([.E34]>0;1;0) -> 1 | O34: of:=IF([.F34]>0;1;0) -> 0 | P34: of:=IF([.G34]>0;1;0) -> 1 | Q34: of:=IF([.H34]>0;1;0) -> 1 | R34: of:=IF([.I34]>0;1;0) -> 1 | S34: of:=IF([.J34]>0;1;0) -> 0 | T34: of:=IF([.K34]>0;1;0) -> 1 | U34: of:=IF([.L34]>0;1;0) -> 1 | V34: of:=[.N34]*[.N$402]+[.O34]*[.O$402]+[.P34]*[.P$402]+[.Q34]*[.Q$402]+[.R34]*[.R$402]+[.S34]*[.S$402]+[.T34]*[.T$402]+[.U34]*[.U$402] -> 27.0957943222835 | W34: of:=36+2816+6086 -> 8938 | Y34: of:=[.W34]+[.X34] -> 8938 | Z34: of:=[.Y34]/[.Y$401] -> 2.84594135489242 | AA34: of:=[.D34]+[.M34]+[.V34]+[.Z34] -> 57.961256527852 | AB34: of:=RANK([.AA34];[.AA$2:.AA$399];0) -> 33
A35: Worcester | B35: 77683 | C35: of:=IF(SUM([.E35:.L35])>0;[.B35];0) -> 77683 | D35: of:=[.C35]/[.C$401] -> 2.92584830392531 | E35: 1 | G35: 1 | H35: 1 | I35: 1 | K35: 1 | L35: 1 | M35: of:=[.E35]*[.AC$11]+[.F35]*[.AC$13]+[.G35]*[.AC$15]+[.H35]*[.AC$17]+[.I35]*[.AC$19]+[.J35]*[.AC$21]+[.K35]*[.AC$23]+[.L35]*[.AC$25] -> 24.3728976153988 | N35: of:=IF([.E35]>0;1;0) -> 1 | O35: of:=IF([.F35]>0;1;0) -> 0 | P35: of:=IF([.G35]>0;1;0) -> 1 | Q35: of:=IF([.H35]>0;1;0) -> 1 | R35: of:=IF([.I35]>0;1;0) -> 1 | S35: of:=IF([.J35]>0;1;0) -> 0 | T35: of:=IF([.K35]>0;1;0) -> 1 | U35: of:=IF([.L35]>0;1;0) -> 1 | V35: of:=[.N35]*[.N$402]+[.O35]*[.O$402]+[.P35]*[.P$402]+[.Q35]*[.Q$402]+[.R35]*[.R$402]+[.S35]*[.S$402]+[.T35]*[.T$402]+[.U35]*[.U$402] -> 27.0957943222835 | W35: of:=75+2842+7440 -> 10357 | Y35: of:=[.W35]+[.X35] -> 10357 | Z35: of:=[.Y35]/[.Y$401] -> 3.29776399783182 | AA35: of:=[.D35]+[.M35]+[.V35]+[.Z35] -> 57.6923042394394 | AB35: of:=RANK([.AA35];[.AA$2:.AA$399];0) -> 34
A36: Hartlepool | B36: 70203 | C36: of:=IF(SUM([.E36:.L36])>0;[.B36];0) -> 70203 | D36: of:=[.C36]/[.C$401] -> 2.64412198911562 | E36: 1 | G36: 1 | H36: 1 | I36: 1 | K36: 1 | L36: 1 | M36: of:=[.E36]*[.AC$11]+[.F36]*[.AC$13]+[.G36]*[.AC$15]+[.H36]*[.AC$17]+[.I36]*[.AC$19]+[.J36]*[.AC$21]+[.K36]*[.AC$23]+[.L36]*[.AC$25] -> 24.3728976153988 | N36: of:=IF([.E36]>0;1;0) -> 1 | O36: of:=IF([.F36]>0;1;0) -> 0 | P36: of:=IF([.G36]>0;1;0) -> 1 | Q36: of:=IF([.H36]>0;1;0) -> 1 | R36: of:=IF([.I36]>0;1;0) -> 1 | S36: of:=IF([.J36]>0;1;0) -> 0 | T36: of:=IF([.K36]>0;1;0) -> 1 | U36: of:=IF([.L36]>0;1;0) -> 1 | V36: of:=[.N36]*[.N$402]+[.O36]*[.O$402]+[.P36]*[.P$402]+[.Q36]*[.Q$402]+[.R36]*[.R$402]+[.S36]*[.S$402]+[.T36]*[.T$402]+[.U36]*[.U$402] -> 27.0957943222835 | W36: of:=17+245+10306 -> 10568 | Y36: of:=[.W36]+[.X36] -> 10568 | Z36: of:=[.Y36]/[.Y$401] -> 3.36494833726819 | AA36: of:=[.D36]+[.M36]+[.V36]+[.Z36] -> 57.4777622640661 | AB36: of:=RANK([.AA36];[.AA$2:.AA$399];0) -> 35
A37: Hyndburn | B37: 62230 | C37: of:=IF(SUM([.E37:.L37])>0;[.B37];0) -> 62230 | D37: of:=[.C37]/[.C$401] -> 2.34382734901165 | E37: 1 | G37: 1 | H37: 1 | I37: 1 | K37: 1 | L37: 1 | M37: of:=[.E37]*[.AC$11]+[.F37]*[.AC$13]+[.G37]*[.AC$15]+[.H37]*[.AC$17]+[.I37]*[.AC$19]+[.J37]*[.AC$21]+[.K37]*[.AC$23]+[.L37]*[.AC$25] -> 24.3728976153988 | N37: of:=IF([.E37]>0;1;0) -> 1 | O37: of:=IF([.F37]>0;1;0) -> 0 | P37: of:=IF([.G37]>0;1;0) -> 1 | Q37: of:=IF([.H37]>0;1;0) -> 1 | R37: of:=IF([.I37]>0;1;0) -> 1 | S37: of:=IF([.J37]>0;1;0) -> 0 | T37: of:=IF([.K37]>0;1;0) -> 1 | U37: of:=IF([.L37]>0;1;0) -> 1 | V37: of:=[.N37]*[.N$402]+[.O37]*[.O$402]+[.P37]*[.P$402]+[.Q37]*[.Q$402]+[.R37]*[.R$402]+[.S37]*[.S$402]+[.T37]*[.T$402]+[.U37]*[.U$402] -> 27.0957943222835 | W37: of:=392+2096+8910 -> 11398 | Y37: of:=[.W37]+[.X37] -> 11398 | Z37: of:=[.Y37]/[.Y$401] -> 3.6292279663307 | AA37: of:=[.D37]+[.M37]+[.V37]+[.Z37] -> 57.4417472530246 | AB37: of:=RANK([.AA37];[.AA$2:.AA$399];0) -> 36
A38: NE Lincs | B38: 117099 | C38: of:=IF(SUM([.E38:.L38])>0;[.B38];0) -> 117099 | D38: of:=[.C38]/[.C$401] -> 4.4104103927674 | E38: 1 | G38: 1 | H38: 1 | I38: 1 | K38: 1 | L38: 1 | M38: of:=[.E38]*[.AC$11]+[.F38]*[.AC$13]+[.G38]*[.AC$15]+[.H38]*[.AC$17]+[.I38]*[.AC$19]+[.J38]*[.AC$21]+[.K38]*[.AC$23]+[.L38]*[.AC$25] -> 24.3728976153988 | N38: of:=IF([.E38]>0;1;0) -> 1 | O38: of:=IF([.F38]>0;1;0) -> 0 | P38: of:=IF([.G38]>0;1;0) -> 1 | Q38: of:=IF([.H38]>0;1;0) -> 1 | R38: of:=IF([.I38]>0;1;0) -> 1 | S38: of:=IF([.J38]>0;1;0) -> 0 | T38: of:=IF([.K38]>0;1;0) -> 1 | U38: of:=IF([.L38]>0;1;0) -> 1 | V38: of:=[.N38]*[.N$402]+[.O38]*[.O$402]+[.P38]*[.P$402]+[.Q38]*[.Q$402]+[.R38]*[.R$402]+[.S38]*[.S$402]+[.T38]*[.T$402]+[.U38]*[.U$402] -> 27.0957943222835 | W38: of:=47+56+4590 -> 4693 | Y38: of:=[.W38]+[.X38] -> 4693 | Z38: of:=[.Y38]/[.Y$401] -> 1.49429433637392 | AA38: of:=[.D38]+[.M38]+[.V38]+[.Z38] -> 57.3733966668236 | AB38: of:=RANK([.AA38];[.AA$2:.AA$399];0) -> 37
A39: Lincoln | B39: 60022 | C39: of:=IF(SUM([.E39:.L39])>0;[.B39];0) -> 60022 | D39: of:=[.C39]/[.C$401] -> 2.26066535661863 | E39: 1 | G39: 1 | H39: 1 | I39: 1 | K39: 1 | L39: 1 | M39: of:=[.E39]*[.AC$11]+[.F39]*[.AC$13]+[.G39]*[.AC$15]+[.H39]*[.AC$17]+[.I39]*[.AC$19]+[.J39]*[.AC$21]+[.K39]*[.AC$23]+[.L39]*[.AC$25] -> 24.3728976153988 | N39: of:=IF([.E39]>0;1;0) -> 1 | O39: of:=IF([.F39]>0;1;0) -> 0 | P39: of:=IF([.G39]>0;1;0) -> 1 | Q39: of:=IF([.H39]>0;1;0) -> 1 | R39: of:=IF([.I39]>0;1;0) -> 1 | S39: of:=IF([.J39]>0;1;0) -> 0 | T39: of:=IF([.K39]>0;1;0) -> 1 | U39: of:=IF([.L39]>0;1;0) -> 1 | V39: of:=[.N39]*[.N$402]+[.O39]*[.O$402]+[.P39]*[.P$402]+[.Q39]*[.Q$402]+[.R39]*[.R$402]+[.S39]*[.S$402]+[.T39]*[.T$402]+[.U39]*[.U$402] -> 27.0957943222835 | W39: of:=236+2386+8751 -> 11373 | Y39: of:=[.W39]+[.X39] -> 11373 | Z39: of:=[.Y39]/[.Y$401] -> 3.62126773653966 | AA39: of:=[.D39]+[.M39]+[.V39]+[.Z39] -> 57.3506250308406 | AB39: of:=RANK([.AA39];[.AA$2:.AA$399];0) -> 38
A40: Burnley | B40: 65190 | C40: of:=IF(SUM([.E40:.L40])>0;[.B40];0) -> 65190 | D40: of:=[.C40]/[.C$401] -> 2.45531262866896 | E40: 1 | G40: 1 | H40: 1 | I40: 1 | K40: 1 | L40: 1 | M40: of:=[.E40]*[.AC$11]+[.F40]*[.AC$13]+[.G40]*[.AC$15]+[.H40]*[.AC$17]+[.I40]*[.AC$19]+[.J40]*[.AC$21]+[.K40]*[.AC$23]+[.L40]*[.AC$25] -> 24.3728976153988 | N40: of:=IF([.E40]>0;1;0) -> 1 | O40: of:=IF([.F40]>0;1;0) -> 0 | P40: of:=IF([.G40]>0;1;0) -> 1 | Q40: of:=IF([.H40]>0;1;0) -> 1 | R40: of:=IF([.I40]>0;1;0) -> 1 | S40: of:=IF([.J40]>0;1;0) -> 0 | T40: of:=IF([.K40]>0;1;0) -> 1 | U40: of:=IF([.L40]>0;1;0) -> 1 | V40: of:=[.N40]*[.N$402]+[.O40]*[.O$402]+[.P40]*[.P$402]+[.Q40]*[.Q$402]+[.R40]*[.R$402]+[.S40]*[.S$402]+[.T40]*[.T$402]+[.U40]*[.U$402] -> 27.0957943222835 | W40: of:=79+105+10518 -> 10702 | Y40: of:=[.W40]+[.X40] -> 10702 | Z40: of:=[.Y40]/[.Y$401] -> 3.40761516894816 | AA40: of:=[.D40]+[.M40]+[.V40]+[.Z40] -> 57.3316197352994 | AB40: of:=RANK([.AA40];[.AA$2:.AA$399];0) -> 39
A41: Rochford | B41: 66319 | C41: of:=IF(SUM([.E41:.L41])>0;[.B41];0) -> 66319 | D41: of:=[.C41]/[.C$401] -> 2.49783522351123 | E41: 1 | G41: 1 | H41: 1 | I41: 1 | K41: 1 | L41: 1 | M41: of:=[.E41]*[.AC$11]+[.F41]*[.AC$13]+[.G41]*[.AC$15]+[.H41]*[.AC$17]+[.I41]*[.AC$19]+[.J41]*[.AC$21]+[.K41]*[.AC$23]+[.L41]*[.AC$25] -> 24.3728976153988 | N41: of:=IF([.E41]>0;1;0) -> 1 | O41: of:=IF([.F41]>0;1;0) -> 0 | P41: of:=IF([.G41]>0;1;0) -> 1 | Q41: of:=IF([.H41]>0;1;0) -> 1 | R41: of:=IF([.I41]>0;1;0) -> 1 | S41: of:=IF([.J41]>0;1;0) -> 0 | T41: of:=IF([.K41]>0;1;0) -> 1 | U41: of:=IF([.L41]>0;1;0) -> 1 | V41: of:=[.N41]*[.N$402]+[.O41]*[.O$402]+[.P41]*[.P$402]+[.Q41]*[.Q$402]+[.R41]*[.R$402]+[.S41]*[.S$402]+[.T41]*[.T$402]+[.U41]*[.U$402] -> 27.0957943222835 | W41: of:=47+2972+7152 -> 10171 | Y41: of:=[.W41]+[.X41] -> 10171 | Z41: of:=[.Y41]/[.Y$401] -> 3.23853988818648 | AA41: of:=[.D41]+[.M41]+[.V41]+[.Z41] -> 57.20506704938 | AB41: of:=RANK([.AA41];[.AA$2:.AA$399];0) -> 40
A42: Castle Point | B42: 68939 | C42: of:=IF(SUM([.E42:.L42])>0;[.B42];0) -> 68939 | D42: of:=[.C42]/[.C$401] -> 2.59651476158628 | E42: 1 | G42: 1 | H42: 1 | I42: 1 | K42: 1 | L42: 1 | M42: of:=[.E42]*[.AC$11]+[.F42]*[.AC$13]+[.G42]*[.AC$15]+[.H42]*[.AC$17]+[.I42]*[.AC$19]+[.J42]*[.AC$21]+[.K42]*[.AC$23]+[.L42]*[.AC$25] -> 24.3728976153988 | N42: of:=IF([.E42]>0;1;0) -> 1 | O42: of:=IF([.F42]>0;1;0) -> 0 | P42: of:=IF([.G42]>0;1;0) -> 1 | Q42: of:=IF([.H42]>0;1;0) -> 1 | R42: of:=IF([.I42]>0;1;0) -> 1 | S42: of:=IF([.J42]>0;1;0) -> 0 | T42: of:=IF([.K42]>0;1;0) -> 1 | U42: of:=IF([.L42]>0;1;0) -> 1 | V42: of:=[.N42]*[.N$402]+[.O42]*[.O$402]+[.P42]*[.P$402]+[.Q42]*[.Q$402]+[.R42]*[.R$402]+[.S42]*[.S$402]+[.T42]*[.T$402]+[.U42]*[.U$402] -> 27.0957943222835 | W42: of:=64+2945+6849 -> 9858 | Y42: of:=[.W42]+[.X42] -> 9858 | Z42: of:=[.Y42]/[.Y$401] -> 3.13887781120267 | AA42: of:=[.D42]+[.M42]+[.V42]+[.Z42] -> 57.2040845104712 | AB42: of:=RANK([.AA42];[.AA$2:.AA$399];0) -> 41
A43: Reading | B43: 111168 | C43: of:=IF(SUM([.E43:.L43])>0;[.B43];0) -> 111168 | D43: of:=[.C43]/[.C$401] -> 4.18702553004864 | E43: 1 | G43: 1 | H43: 1 | I43: 1 | K43: 1 | L43: 1 | M43: of:=[.E43]*[.AC$11]+[.F43]*[.AC$13]+[.G43]*[.AC$15]+[.H43]*[.AC$17]+[.I43]*[.AC$19]+[.J43]*[.AC$21]+[.K43]*[.AC$23]+[.L43]*[.AC$25] -> 24.3728976153988 | N43: of:=IF([.E43]>0;1;0) -> 1 | O43: of:=IF([.F43]>0;1;0) -> 0 | P43: of:=IF([.G43]>0;1;0) -> 1 | Q43: of:=IF([.H43]>0;1;0) -> 1 | R43: of:=IF([.I43]>0;1;0) -> 1 | S43: of:=IF([.J43]>0;1;0) -> 0 | T43: of:=IF([.K43]>0;1;0) -> 1 | U43: of:=IF([.L43]>0;1;0) -> 1 | V43: of:=[.N43]*[.N$402]+[.O43]*[.O$402]+[.P43]*[.P$402]+[.Q43]*[.Q$402]+[.R43]*[.R$402]+[.S43]*[.S$402]+[.T43]*[.T$402]+[.U43]*[.U$402] -> 27.0957943222835 | W43: of:=38+40+4681 -> 4759 | Y43: of:=[.W43]+[.X43] -> 4759 | Z43: of:=[.Y43]/[.Y$401] -> 1.51530934302227 | AA43: of:=[.D43]+[.M43]+[.V43]+[.Z43] -> 57.1710268107532 | AB43: of:=RANK([.AA43];[.AA$2:.AA$399];0) -> 42
A44: Runnymede | B44: 59794 | C44: of:=IF(SUM([.E44:.L44])>0;[.B44];0) -> 59794 | D44: of:=[.C44]/[.C$401] -> 2.25207797696935 | E44: 1 | G44: 1 | H44: 1 | I44: 1 | K44: 1 | L44: 1 | M44: of:=[.E44]*[.AC$11]+[.F44]*[.AC$13]+[.G44]*[.AC$15]+[.H44]*[.AC$17]+[.I44]*[.AC$19]+[.J44]*[.AC$21]+[.K44]*[.AC$23]+[.L44]*[.AC$25] -> 24.3728976153988 | N44: of:=IF([.E44]>0;1;0) -> 1 | O44: of:=IF([.F44]>0;1;0) -> 0 | P44: of:=IF([.G44]>0;1;0) -> 1 | Q44: of:=IF([.H44]>0;1;0) -> 1 | R44: of:=IF([.I44]>0;1;0) -> 1 | S44: of:=IF([.J44]>0;1;0) -> 0 | T44: of:=IF([.K44]>0;1;0) -> 1 | U44: of:=IF([.L44]>0;1;0) -> 1 | V44: of:=[.N44]*[.N$402]+[.O44]*[.O$402]+[.P44]*[.P$402]+[.Q44]*[.Q$402]+[.R44]*[.R$402]+[.S44]*[.S$402]+[.T44]*[.T$402]+[.U44]*[.U$402] -> 27.0957943222835 | W44: of:=66+2999+7593 -> 10658 | Y44: of:=[.W44]+[.X44] -> 10658 | Z44: of:=[.Y44]/[.Y$401] -> 3.39360516451593 | AA44: of:=[.D44]+[.M44]+[.V44]+[.Z44] -> 57.1143750791675 | AB44: of:=RANK([.AA44];[.AA$2:.AA$399];0) -> 43
A45: St Albans | B45: 107459 | C45: of:=IF(SUM([.E45:.L45])>0;[.B45];0) -> 107459 | D45: of:=[.C45]/[.C$401] -> 4.04732995496453 | E45: 1 | G45: 1 | H45: 1 | I45: 1 | K45: 1 | L45: 1 | M45: of:=[.E45]*[.AC$11]+[.F45]*[.AC$13]+[.G45]*[.AC$15]+[.H45]*[.AC$17]+[.I45]*[.AC$19]+[.J45]*[.AC$21]+[.K45]*[.AC$23]+[.L45]*[.AC$25] -> 24.3728976153988 | N45: of:=IF([.E45]>0;1;0) -> 1 | O45: of:=IF([.F45]>0;1;0) -> 0 | P45: of:=IF([.G45]>0;1;0) -> 1 | Q45: of:=IF([.H45]>0;1;0) -> 1 | R45: of:=IF([.I45]>0;1;0) -> 1 | S45: of:=IF([.J45]>0;1;0) -> 0 | T45: of:=IF([.K45]>0;1;0) -> 1 | U45: of:=IF([.L45]>0;1;0) -> 1 | V45: of:=[.N45]*[.N$402]+[.O45]*[.O$402]+[.P45]*[.P$402]+[.Q45]*[.Q$402]+[.R45]*[.R$402]+[.S45]*[.S$402]+[.T45]*[.T$402]+[.U45]*[.U$402] -> 27.0957943222835 | W45: of:=57+92+4635 -> 4784 | Y45: of:=[.W45]+[.X45] -> 4784 | Z45: of:=[.Y45]/[.Y$401] -> 1.52326957281331 | AA45: of:=[.D45]+[.M45]+[.V45]+[.Z45] -> 57.0392914654601 | AB45: of:=RANK([.AA45];[.AA$2:.AA$399];0) -> 44
A46: Brentwood | B46: 58815 | C46: of:=IF(SUM([.E46:.L46])>0;[.B46];0) -> 58815 | D46: of:=[.C46]/[.C$401] -> 2.21520497400161 | E46: 1 | G46: 1 | H46: 1 | I46: 1 | K46: 1 | L46: 1 | M46: of:=[.E46]*[.AC$11]+[.F46]*[.AC$13]+[.G46]*[.AC$15]+[.H46]*[.AC$17]+[.I46]*[.AC$19]+[.J46]*[.AC$21]+[.K46]*[.AC$23]+[.L46]*[.AC$25] -> 24.3728976153988 | N46: of:=IF([.E46]>0;1;0) -> 1 | O46: of:=IF([.F46]>0;1;0) -> 0 | P46: of:=IF([.G46]>0;1;0) -> 1 | Q46: of:=IF([.H46]>0;1;0) -> 1 | R46: of:=IF([.I46]>0;1;0) -> 1 | S46: of:=IF([.J46]>0;1;0) -> 0 | T46: of:=IF([.K46]>0;1;0) -> 1 | U46: of:=IF([.L46]>0;1;0) -> 1 | V46: of:=[.N46]*[.N$402]+[.O46]*[.O$402]+[.P46]*[.P$402]+[.Q46]*[.Q$402]+[.R46]*[.R$402]+[.S46]*[.S$402]+[.T46]*[.T$402]+[.U46]*[.U$402] -> 27.0957943222835 | W46: of:=64+3027+6999 -> 10090 | Y46: of:=[.W46]+[.X46] -> 10090 | Z46: of:=[.Y46]/[.Y$401] -> 3.21274874366351 | AA46: of:=[.D46]+[.M46]+[.V46]+[.Z46] -> 56.8966456553474 | AB46: of:=RANK([.AA46];[.AA$2:.AA$399];0) -> 45
A47: Pendle | B47: 66626 | C47: of:=IF(SUM([.E47:.L47])>0;[.B47];0) -> 66626 | D47: of:=[.C47]/[.C$401] -> 2.50939805488109 | E47: 1 | G47: 1 | H47: 1 | I47: 1 | K47: 1 | L47: 1 | M47: of:=[.E47]*[.AC$11]+[.F47]*[.AC$13]+[.G47]*[.AC$15]+[.H47]*[.AC$17]+[.I47]*[.AC$19]+[.J47]*[.AC$21]+[.K47]*[.AC$23]+[.L47]*[.AC$25] -> 24.3728976153988 | N47: of:=IF([.E47]>0;1;0) -> 1 | O47: of:=IF([.F47]>0;1;0) -> 0 | P47: of:=IF([.G47]>0;1;0) -> 1 | Q47: of:=IF([.H47]>0;1;0) -> 1 | R47: of:=IF([.I47]>0;1;0) -> 1 | S47: of:=IF([.J47]>0;1;0) -> 0 | T47: of:=IF([.K47]>0;1;0) -> 1 | U47: of:=IF([.L47]>0;1;0) -> 1 | V47: of:=[.N47]*[.N$402]+[.O47]*[.O$402]+[.P47]*[.P$402]+[.Q47]*[.Q$402]+[.R47]*[.R$402]+[.S47]*[.S$402]+[.T47]*[.T$402]+[.U47]*[.U$402] -> 27.0957943222835 | W47: of:=31+3136+5828 -> 8995 | Y47: of:=[.W47]+[.X47] -> 8995 | Z47: of:=[.Y47]/[.Y$401] -> 2.86409067881599 | AA47: of:=[.D47]+[.M47]+[.V47]+[.Z47] -> 56.8421806713793 | AB47: of:=RANK([.AA47];[.AA$2:.AA$399];0) -> 46
A48: Wyre Forest | B48: 76881 | C48: of:=IF(SUM([.E48:.L48])>0;[.B48];0) -> 76881 | D48: of:=[.C48]/[.C$401] -> 2.89564181936951 | E48: 1 | G48: 1 | H48: 1 | L48: 1 | M48: of:=[.E48]*[.AC$11]+[.F48]*[.AC$13]+[.G48]*[.AC$15]+[.H48]*[.AC$17]+[.I48]*[.AC$19]+[.J48]*[.AC$21]+[.K48]*[.AC$23]+[.L48]*[.AC$25] -> 23.9529377685194 | N48: of:=IF([.E48]>0;1;0) -> 1 | O48: of:=IF([.F48]>0;1;0) -> 0 | P48: of:=IF([.G48]>0;1;0) -> 1 | Q48: of:=IF([.H48]>0;1;0) -> 1 | R48: of:=IF([.I48]>0;1;0) -> 0 | S48: of:=IF([.J48]>0;1;0) -> 0 | T48: of:=IF([.K48]>0;1;0) -> 0 | U48: of:=IF([.L48]>0;1;0) -> 1 | V48: of:=[.N48]*[.N$402]+[.O48]*[.O$402]+[.P48]*[.P$402]+[.Q48]*[.Q$402]+[.R48]*[.R$402]+[.S48]*[.S$402]+[.T48]*[.T$402]+[.U48]*[.U$402] -> 26.8563843395295 | W48: of:=65+4727+4820 -> 9612 | Y48: of:=[.W48]+[.X48] -> 9612 | Z48: of:=[.Y48]/[.Y$401] -> 3.06054915005884 | AA48: of:=[.D48]+[.M48]+[.V48]+[.Z48] -> 56.7655130774772 | AB48: of:=RANK([.AA48];[.AA$2:.AA$399];0) -> 47
A49: Stevenage | B49: 63580 | C49: of:=IF(SUM([.E49:.L49])>0;[.B49];0) -> 63580 | D49: of:=[.C49]/[.C$401] -> 2.39467367588238 | E49: 1 | G49: 1 | H49: 1 | I49: 1 | K49: 1 | L49: 1 | M49: of:=[.E49]*[.AC$11]+[.F49]*[.AC$13]+[.G49]*[.AC$15]+[.H49]*[.AC$17]+[.I49]*[.AC$19]+[.J49]*[.AC$21]+[.K49]*[.AC$23]+[.L49]*[.AC$25] -> 24.3728976153988 | N49: of:=IF([.E49]>0;1;0) -> 1 | O49: of:=IF([.F49]>0;1;0) -> 0 | P49: of:=IF([.G49]>0;1;0) -> 1 | Q49: of:=IF([.H49]>0;1;0) -> 1 | R49: of:=IF([.I49]>0;1;0) -> 1 | S49: of:=IF([.J49]>0;1;0) -> 0 | T49: of:=IF([.K49]>0;1;0) -> 1 | U49: of:=IF([.L49]>0;1;0) -> 1 | V49: of:=[.N49]*[.N$402]+[.O49]*[.O$402]+[.P49]*[.P$402]+[.Q49]*[.Q$402]+[.R49]*[.R$402]+[.S49]*[.S$402]+[.T49]*[.T$402]+[.U49]*[.U$402] -> 27.0957943222835 | W49: of:=34+3191+5561 -> 8786 | Y49: of:=[.W49]+[.X49] -> 8786 | Z49: of:=[.Y49]/[.Y$401] -> 2.7975431577629 | AA49: of:=[.D49]+[.M49]+[.V49]+[.Z49] -> 56.6609087713275 | AB49: of:=RANK([.AA49];[.AA$2:.AA$399];0) -> 48
A50: Exeter | B50: 90042 | C50: of:=IF(SUM([.E50:.L50])>0;[.B50];0) -> 90042 | D50: of:=[.C50]/[.C$401] -> 3.39133701044041 | E50: 1 | G50: 1 | H50: 1 | I50: 1 | K50: 1 | L50: 1 | M50: of:=[.E50]*[.AC$11]+[.F50]*[.AC$13]+[.G50]*[.AC$15]+[.H50]*[.AC$17]+[.I50]*[.AC$19]+[.J50]*[.AC$21]+[.K50]*[.AC$23]+[.L50]*[.AC$25] -> 24.3728976153988 | N50: of:=IF([.E50]>0;1;0) -> 1 | O50: of:=IF([.F50]>0;1;0) -> 0 | P50: of:=IF([.G50]>0;1;0) -> 1 | Q50: of:=IF([.H50]>0;1;0) -> 1 | R50: of:=IF([.I50]>0;1;0) -> 1 | S50: of:=IF([.J50]>0;1;0) -> 0 | T50: of:=IF([.K50]>0;1;0) -> 1 | U50: of:=IF([.L50]>0;1;0) -> 1 | V50: of:=[.N50]*[.N$402]+[.O50]*[.O$402]+[.P50]*[.P$402]+[.Q50]*[.Q$402]+[.R50]*[.R$402]+[.S50]*[.S$402]+[.T50]*[.T$402]+[.U50]*[.U$402] -> 27.0957943222835 | W50: of:=172+23+4725 -> 4920 | Y50: of:=[.W50]+[.X50] -> 4920 | Z50: of:=[.Y50]/[.Y$401] -> 1.56657322287656 | AA50: of:=[.D50]+[.M50]+[.V50]+[.Z50] -> 56.4266021709992 | AB50: of:=RANK([.AA50];[.AA$2:.AA$399];0) -> 49
A51: Broxbourne | B51: 72112 | C51: of:=IF(SUM([.E51:.L51])>0;[.B51];0) -> 72112 | D51: of:=[.C51]/[.C$401] -> 2.71602246170542 | E51: 1 | G51: 1 | H51: 1 | I51: 1 | K51: 1 | L51: 1 | M51: of:=[.E51]*[.AC$11]+[.F51]*[.AC$13]+[.G51]*[.AC$15]+[.H51]*[.AC$17]+[.I51]*[.AC$19]+[.J51]*[.AC$21]+[.K51]*[.AC$23]+[.L51]*[.AC$25] -> 24.3728976153988 | N51: of:=IF([.E51]>0;1;0) -> 1 | O51: of:=IF([.F51]>0;1;0) -> 0 | P51: of:=IF([.G51]>0;1;0) -> 1 | Q51: of:=IF([.H51]>0;1;0) -> 1 | R51: of:=IF([.I51]>0;1;0) -> 1 | S51: of:=IF([.J51]>0;1;0) -> 0 | T51: of:=IF([.K51]>0;1;0) -> 1 | U51: of:=IF([.L51]>0;1;0) -> 1 | V51: of:=[.N51]*[.N$402]+[.O51]*[.O$402]+[.P51]*[.P$402]+[.Q51]*[.Q$402]+[.R51]*[.R$402]+[.S51]*[.S$402]+[.T51]*[.T$402]+[.U51]*[.U$402] -> 27.0957943222835 | W51: of:=19+12+5001 -> 5032 | Y51: of:=[.W51]+[.X51] -> 5032 | Z51: of:=[.Y51]/[.Y$401] -> 1.60223505234042 | AA51: of:=[.D51]+[.M51]+[.V51]+[.Z51] -> 55.7869494517281 | AB51: of:=RANK([.AA51];[.AA$2:.AA$399];0) -> 50
A52: Three Rivers | B52: 68421 | C52: of:=IF(SUM([.E52:.L52])>0;[.B52];0) -> 68421 | D52: of:=[.C52]/[.C$401] -> 2.57700483764625 | E52: 1 | G52: 1 | H52: 1 | I52: 1 | K52: 1 | L52: 1 | M52: of:=[.E52]*[.AC$11]+[.F52]*[.AC$13]+[.G52]*[.AC$15]+[.H52]*[.AC$17]+[.I52]*[.AC$19]+[.J52]*[.AC$21]+[.K52]*[.AC$23]+[.L52]*[.AC$25] -> 24.3728976153988 | N52: of:=IF([.E52]>0;1;0) -> 1 | O52: of:=IF([.F52]>0;1;0) -> 0 | P52: of:=IF([.G52]>0;1;0) -> 1 | Q52: of:=IF([.H52]>0;1;0) -> 1 | R52: of:=IF([.I52]>0;1;0) -> 1 | S52: of:=IF([.J52]>0;1;0) -> 0 | T52: of:=IF([.K52]>0;1;0) -> 1 | U52: of:=IF([.L52]>0;1;0) -> 1 | V52: of:=[.N52]*[.N$402]+[.O52]*[.O$402]+[.P52]*[.P$402]+[.Q52]*[.Q$402]+[.R52]*[.R$402]+[.S52]*[.S$402]+[.T52]*[.T$402]+[.U52]*[.U$402] -> 27.0957943222835 | W52: of:=33+95+4773 -> 4901 | Y52: of:=[.W52]+[.X52] -> 4901 | Z52: of:=[.Y52]/[.Y$401] -> 1.56052344823537 | AA52: of:=[.D52]+[.M52]+[.V52]+[.Z52] -> 55.6062202235639 | AB52: of:=RANK([.AA52];[.AA$2:.AA$399];0) -> 51
A53: W Sussex CC | B53: 648037 | C53: of:=IF(SUM([.E53:.L53])>0;[.B53];0) -> 648037 | D53: of:=[.C53]/[.C$401] -> 24.4076304639476 | F53: 1 | J53: 1 | M53: of:=[.E53]*[.AC$11]+[.F53]*[.AC$13]+[.G53]*[.AC$15]+[.H53]*[.AC$17]+[.I53]*[.AC$19]+[.J53]*[.AC$21]+[.K53]*[.AC$23]+[.L53]*[.AC$25] -> 7.5657065638351 | N53: of:=IF([.E53]>0;1;0) -> 0 | O53: of:=IF([.F53]>0;1;0) -> 1 | P53: of:=IF([.G53]>0;1;0) -> 0 | Q53: of:=IF([.H53]>0;1;0) -> 0 | R53: of:=IF([.I53]>0;1;0) -> 0 | S53: of:=IF([.J53]>0;1;0) -> 1 | T53: of:=IF([.K53]>0;1;0) -> 0 | U53: of:=IF([.L53]>0;1;0) -> 0 | V53: of:=[.N53]*[.N$402]+[.O53]*[.O$402]+[.P53]*[.P$402]+[.Q53]*[.Q$402]+[.R53]*[.R$402]+[.S53]*[.S$402]+[.T53]*[.T$402]+[.U53]*[.U$402] -> 8.81834755033414 | W53: 179 | X53: of:=[.$AD$1] -> 44717 | Y53: of:=[.W53]+[.X53] -> 44896 | Z53: of:=[.Y53]/[.Y$401] -> 14.2952990679403 | AA53: of:=[.D53]+[.M53]+[.V53]+[.Z53] -> 55.0869836460571 | AB53: of:=RANK([.AA53];[.AA$2:.AA$399];0) -> 52
A54: Nuneaton & Bedworth | B54: 97173 | C54: of:=IF(SUM([.E54:.L54])>0;[.B54];0) -> 97173 | D54: of:=[.C54]/[.C$401] -> 3.65991860815538 | E54: 1 | G54: 1 | I54: 1 | K54: 1 | M54: of:=[.E54]*[.AC$11]+[.F54]*[.AC$13]+[.G54]*[.AC$15]+[.H54]*[.AC$17]+[.I54]*[.AC$19]+[.J54]*[.AC$21]+[.K54]*[.AC$23]+[.L54]*[.AC$25] -> 23.348990574697 | N54: of:=IF([.E54]>0;1;0) -> 1 | O54: of:=IF([.F54]>0;1;0) -> 0 | P54: of:=IF([.G54]>0;1;0) -> 1 | Q54: of:=IF([.H54]>0;1;0) -> 0 | R54: of:=IF([.I54]>0;1;0) -> 1 | S54: of:=IF([.J54]>0;1;0) -> 0 | T54: of:=IF([.K54]>0;1;0) -> 1 | U54: of:=IF([.L54]>0;1;0) -> 0 | V54: of:=[.N54]*[.N$402]+[.O54]*[.O$402]+[.P54]*[.P$402]+[.Q54]*[.Q$402]+[.R54]*[.R$402]+[.S54]*[.S$402]+[.T54]*[.T$402]+[.U54]*[.U$402] -> 26.7871612557343 | W54: of:=1387+1311 -> 2698 | Y54: of:=[.W54]+[.X54] -> 2698 | Z54: of:=[.Y54]/[.Y$401] -> 0.859067999048975 | AA54: of:=[.D54]+[.M54]+[.V54]+[.Z54] -> 54.6551384376357 | AB54: of:=RANK([.AA54];[.AA$2:.AA$399];0) -> 53
A55: S Cambs | B55: 116463 | C55: of:=IF(SUM([.E55:.L55])>0;[.B55];0) -> 116463 | D55: of:=[.C55]/[.C$401] -> 4.38645612321941 | E55: 1 | G55: 1 | K55: 1 | M55: of:=[.E55]*[.AC$11]+[.F55]*[.AC$13]+[.G55]*[.AC$15]+[.H55]*[.AC$17]+[.I55]*[.AC$19]+[.J55]*[.AC$21]+[.K55]*[.AC$23]+[.L55]*[.AC$25] -> 22.9790911686976 | N55: of:=IF([.E55]>0;1;0) -> 1 | O55: of:=IF([.F55]>0;1;0) -> 0 | P55: of:=IF([.G55]>0;1;0) -> 1 | Q55: of:=IF([.H55]>0;1;0) -> 0 | R55: of:=IF([.I55]>0;1;0) -> 0 | S55: of:=IF([.J55]>0;1;0) -> 0 | T55: of:=IF([.K55]>0;1;0) -> 1 | U55: of:=IF([.L55]>0;1;0) -> 0 | V55: of:=[.N55]*[.N$402]+[.O55]*[.O$402]+[.P55]*[.P$402]+[.Q55]*[.Q$402]+[.R55]*[.R$402]+[.S55]*[.S$402]+[.T55]*[.T$402]+[.U55]*[.U$402] -> 26.5685746908999 | W55: of:=678+1563 -> 2241 | Y55: of:=[.W55]+[.X55] -> 2241 | Z55: of:=[.Y55]/[.Y$401] -> 0.713554998468775 | AA55: of:=[.D55]+[.M55]+[.V55]+[.Z55] -> 54.6476769812857 | AB55: of:=RANK([.AA55];[.AA$2:.AA$399];0) -> 54
A56: Fareham | B56: 90191 | C56: of:=IF(SUM([.E56:.L56])>0;[.B56];0) -> 90191 | D56: of:=[.C56]/[.C$401] -> 3.39694893836911 | E56: 1 | G56: 1 | I56: 1 | K56: 1 | M56: of:=[.E56]*[.AC$11]+[.F56]*[.AC$13]+[.G56]*[.AC$15]+[.H56]*[.AC$17]+[.I56]*[.AC$19]+[.J56]*[.AC$21]+[.K56]*[.AC$23]+[.L56]*[.AC$25] -> 23.348990574697 | N56: of:=IF([.E56]>0;1;0) -> 1 | O56: of:=IF([.F56]>0;1;0) -> 0 | P56: of:=IF([.G56]>0;1;0) -> 1 | Q56: of:=IF([.H56]>0;1;0) -> 0 | R56: of:=IF([.I56]>0;1;0) -> 1 | S56: of:=IF([.J56]>0;1;0) -> 0 | T56: of:=IF([.K56]>0;1;0) -> 1 | U56: of:=IF([.L56]>0;1;0) -> 0 | V56: of:=[.N56]*[.N$402]+[.O56]*[.O$402]+[.P56]*[.P$402]+[.Q56]*[.Q$402]+[.R56]*[.R$402]+[.S56]*[.S$402]+[.T56]*[.T$402]+[.U56]*[.U$402] -> 26.7871612557343 | W56: of:=82+2564 -> 2646 | Y56: of:=[.W56]+[.X56] -> 2646 | Z56: of:=[.Y56]/[.Y$401] -> 0.842510721083613 | AA56: of:=[.D56]+[.M56]+[.V56]+[.Z56] -> 54.375611489884 | AB56: of:=RANK([.AA56];[.AA$2:.AA$399];0) -> 55
A57: Cheltenham | B57: 88257 | C57: of:=IF(SUM([.E57:.L57])>0;[.B57];0) -> 88257 | D57: of:=[.C57]/[.C$401] -> 3.32410686713355 | E57: 1 | G57: 1 | I57: 1 | K57: 1 | M57: of:=[.E57]*[.AC$11]+[.F57]*[.AC$13]+[.G57]*[.AC$15]+[.H57]*[.AC$17]+[.I57]*[.AC$19]+[.J57]*[.AC$21]+[.K57]*[.AC$23]+[.L57]*[.AC$25] -> 23.348990574697 | N57: of:=IF([.E57]>0;1;0) -> 1 | O57: of:=IF([.F57]>0;1;0) -> 0 | P57: of:=IF([.G57]>0;1;0) -> 1 | Q57: of:=IF([.H57]>0;1;0) -> 0 | R57: of:=IF([.I57]>0;1;0) -> 1 | S57: of:=IF([.J57]>0;1;0) -> 0 | T57: of:=IF([.K57]>0;1;0) -> 1 | U57: of:=IF([.L57]>0;1;0) -> 0 | V57: of:=[.N57]*[.N$402]+[.O57]*[.O$402]+[.P57]*[.P$402]+[.Q57]*[.Q$402]+[.R57]*[.R$402]+[.S57]*[.S$402]+[.T57]*[.T$402]+[.U57]*[.U$402] -> 26.7871612557343 | W57: of:=605+1648 -> 2253 | Y57: of:=[.W57]+[.X57] -> 2253 | Z57: of:=[.Y57]/[.Y$401] -> 0.717375908768473 | AA57: of:=[.D57]+[.M57]+[.V57]+[.Z57] -> 54.1776346063333 | AB57: of:=RANK([.AA57];[.AA$2:.AA$399];0) -> 56
A58: Oxford | B58: 99729 | C58: of:=IF(SUM([.E58:.L58])>0;[.B58];0) -> 99729 | D58: of:=[.C58]/[.C$401] -> 3.7561876536973 | E58: 1 | G58: 1 | I58: 1 | K58: 1 | M58: of:=[.E58]*[.AC$11]+[.F58]*[.AC$13]+[.G58]*[.AC$15]+[.H58]*[.AC$17]+[.I58]*[.AC$19]+[.J58]*[.AC$21]+[.K58]*[.AC$23]+[.L58]*[.AC$25] -> 23.348990574697 | N58: of:=IF([.E58]>0;1;0) -> 1 | O58: of:=IF([.F58]>0;1;0) -> 0 | P58: of:=IF([.G58]>0;1;0) -> 1 | Q58: of:=IF([.H58]>0;1;0) -> 0 | R58: of:=IF([.I58]>0;1;0) -> 1 | S58: of:=IF([.J58]>0;1;0) -> 0 | T58: of:=IF([.K58]>0;1;0) -> 1 | U58: of:=IF([.L58]>0;1;0) -> 0 | V58: of:=[.N58]*[.N$402]+[.O58]*[.O$402]+[.P58]*[.P$402]+[.Q58]*[.Q$402]+[.R58]*[.R$402]+[.S58]*[.S$402]+[.T58]*[.T$402]+[.U58]*[.U$402] -> 26.7871612557343 | W58: of:=50+18 -> 68 | Y58: of:=[.W58]+[.X58] -> 68 | Z58: of:=[.Y58]/[.Y$401] -> 0.0216518250316272 | AA58: of:=[.D58]+[.M58]+[.V58]+[.Z58] -> 53.9139913091602 | AB58: of:=RANK([.AA58];[.AA$2:.AA$399];0) -> 57
A59: Hastings | B59: 63367 | C59: of:=IF(SUM([.E59:.L59])>0;[.B59];0) -> 63367 | D59: of:=[.C59]/[.C$401] -> 2.38665125542056 | E59: 1 | G59: 1 | I59: 1 | K59: 1 | M59: of:=[.E59]*[.AC$11]+[.F59]*[.AC$13]+[.G59]*[.AC$15]+[.H59]*[.AC$17]+[.I59]*[.AC$19]+[.J59]*[.AC$21]+[.K59]*[.AC$23]+[.L59]*[.AC$25] -> 23.348990574697 | N59: of:=IF([.E59]>0;1;0) -> 1 | O59: of:=IF([.F59]>0;1;0) -> 0 | P59: of:=IF([.G59]>0;1;0) -> 1 | Q59: of:=IF([.H59]>0;1;0) -> 0 | R59: of:=IF([.I59]>0;1;0) -> 1 | S59: of:=IF([.J59]>0;1;0) -> 0 | T59: of:=IF([.K59]>0;1;0) -> 1 | U59: of:=IF([.L59]>0;1;0) -> 0 | V59: of:=[.N59]*[.N$402]+[.O59]*[.O$402]+[.P59]*[.P$402]+[.Q59]*[.Q$402]+[.R59]*[.R$402]+[.S59]*[.S$402]+[.T59]*[.T$402]+[.U59]*[.U$402] -> 26.7871612557343 | W59: of:=43+3108 -> 3151 | Y59: of:=[.W59]+[.X59] -> 3151 | Z59: of:=[.Y59]/[.Y$401] -> 1.00330736286261 | AA59: of:=[.D59]+[.M59]+[.V59]+[.Z59] -> 53.5261104487145 | AB59: of:=RANK([.AA59];[.AA$2:.AA$399];0) -> 58
A60: Daventry | B60: 63923 | C60: of:=IF(SUM([.E60:.L60])>0;[.B60];0) -> 63923 | D60: of:=[.C60]/[.C$401] -> 2.40759240930213 | E60: 1 | G60: 1 | I60: 1 | K60: 1 | M60: of:=[.E60]*[.AC$11]+[.F60]*[.AC$13]+[.G60]*[.AC$15]+[.H60]*[.AC$17]+[.I60]*[.AC$19]+[.J60]*[.AC$21]+[.K60]*[.AC$23]+[.L60]*[.AC$25] -> 23.348990574697 | N60: of:=IF([.E60]>0;1;0) -> 1 | O60: of:=IF([.F60]>0;1;0) -> 0 | P60: of:=IF([.G60]>0;1;0) -> 1 | Q60: of:=IF([.H60]>0;1;0) -> 0 | R60: of:=IF([.I60]>0;1;0) -> 1 | S60: of:=IF([.J60]>0;1;0) -> 0 | T60: of:=IF([.K60]>0;1;0) -> 1 | U60: of:=IF([.L60]>0;1;0) -> 0 | V60: of:=[.N60]*[.N$402]+[.O60]*[.O$402]+[.P60]*[.P$402]+[.Q60]*[.Q$402]+[.R60]*[.R$402]+[.S60]*[.S$402]+[.T60]*[.T$402]+[.U60]*[.U$402] -> 26.7871612557343 | W60: of:=46+1418 -> 1464 | Y60: of:=[.W60]+[.X60] -> 1464 | Z60: of:=[.Y60]/[.Y$401] -> 0.466151056563269 | AA60: of:=[.D60]+[.M60]+[.V60]+[.Z60] -> 53.0098952962967 | AB60: of:=RANK([.AA60];[.AA$2:.AA$399];0) -> 59
A61: Adur | B61: 48792 | C61: of:=IF(SUM([.E61:.L61])>0;[.B61];0) -> 48792 | D61: of:=[.C61]/[.C$401] -> 1.83769924494579 | E61: 1 | G61: 1 | I61: 1 | K61: 1 | M61: of:=[.E61]*[.AC$11]+[.F61]*[.AC$13]+[.G61]*[.AC$15]+[.H61]*[.AC$17]+[.I61]*[.AC$19]+[.J61]*[.AC$21]+[.K61]*[.AC$23]+[.L61]*[.AC$25] -> 23.348990574697 | N61: of:=IF([.E61]>0;1;0) -> 1 | O61: of:=IF([.F61]>0;1;0) -> 0 | P61: of:=IF([.G61]>0;1;0) -> 1 | Q61: of:=IF([.H61]>0;1;0) -> 0 | R61: of:=IF([.I61]>0;1;0) -> 1 | S61: of:=IF([.J61]>0;1;0) -> 0 | T61: of:=IF([.K61]>0;1;0) -> 1 | U61: of:=IF([.L61]>0;1;0) -> 0 | V61: of:=[.N61]*[.N$402]+[.O61]*[.O$402]+[.P61]*[.P$402]+[.Q61]*[.Q$402]+[.R61]*[.R$402]+[.S61]*[.S$402]+[.T61]*[.T$402]+[.U61]*[.U$402] -> 26.7871612557343 | W61: of:=834+104 -> 938 | Y61: of:=[.W61]+[.X61] -> 938 | Z61: of:=[.Y61]/[.Y$401] -> 0.298667821759799 | AA61: of:=[.D61]+[.M61]+[.V61]+[.Z61] -> 52.2725188971369 | AB61: of:=RANK([.AA61];[.AA$2:.AA$399];0) -> 60
A62: Warrington | B62: 161313 | C62: of:=IF(SUM([.E62:.L62])>0;[.B62];0) -> 161313 | D62: of:=[.C62]/[.C$401] -> 6.07568409370265 | E62: 1 | I62: 1 | M62: of:=[.E62]*[.AC$11]+[.F62]*[.AC$13]+[.G62]*[.AC$15]+[.H62]*[.AC$17]+[.I62]*[.AC$19]+[.J62]*[.AC$21]+[.K62]*[.AC$23]+[.L62]*[.AC$25] -> 20.5657226719263 | N62: of:=IF([.E62]>0;1;0) -> 1 | O62: of:=IF([.F62]>0;1;0) -> 0 | P62: of:=IF([.G62]>0;1;0) -> 0 | Q62: of:=IF([.H62]>0;1;0) -> 0 | R62: of:=IF([.I62]>0;1;0) -> 1 | S62: of:=IF([.J62]>0;1;0) -> 0 | T62: of:=IF([.K62]>0;1;0) -> 0 | U62: of:=IF([.L62]>0;1;0) -> 0 | V62: of:=[.N62]*[.N$402]+[.O62]*[.O$402]+[.P62]*[.P$402]+[.Q62]*[.Q$402]+[.R62]*[.R$402]+[.S62]*[.S$402]+[.T62]*[.T$402]+[.U62]*[.U$402] -> 25.2808728951558 | W62: 120 | Y62: of:=[.W62]+[.X62] -> 120 | Z62: of:=[.Y62]/[.Y$401] -> 0.0382091029969893 | AA62: of:=[.D62]+[.M62]+[.V62]+[.Z62] -> 51.9604887637817 | AB62: of:=RANK([.AA62];[.AA$2:.AA$399];0) -> 61
A63: Gloucester | B63: 93002 | C63: of:=IF(SUM([.E63:.L63])>0;[.B63];0) -> 93002 | D63: of:=[.C63]/[.C$401] -> 3.50282229009772 | E63: 1 | I63: 1 | M63: of:=[.E63]*[.AC$11]+[.F63]*[.AC$13]+[.G63]*[.AC$15]+[.H63]*[.AC$17]+[.I63]*[.AC$19]+[.J63]*[.AC$21]+[.K63]*[.AC$23]+[.L63]*[.AC$25] -> 20.5657226719263 | N63: of:=IF([.E63]>0;1;0) -> 1 | O63: of:=IF([.F63]>0;1;0) -> 0 | P63: of:=IF([.G63]>0;1;0) -> 0 | Q63: of:=IF([.H63]>0;1;0) -> 0 | R63: of:=IF([.I63]>0;1;0) -> 1 | S63: of:=IF([.J63]>0;1;0) -> 0 | T63: of:=IF([.K63]>0;1;0) -> 0 | U63: of:=IF([.L63]>0;1;0) -> 0 | V63: of:=[.N63]*[.N$402]+[.O63]*[.O$402]+[.P63]*[.P$402]+[.Q63]*[.Q$402]+[.R63]*[.R$402]+[.S63]*[.S$402]+[.T63]*[.T$402]+[.U63]*[.U$402] -> 25.2808728951558 | W63: 110 | Y63: of:=[.W63]+[.X63] -> 110 | Z63: of:=[.Y63]/[.Y$401] -> 0.0350250110805735 | AA63: of:=[.D63]+[.M63]+[.V63]+[.Z63] -> 49.3844428682603 | AB63: of:=RANK([.AA63];[.AA$2:.AA$399];0) -> 62
A64: Neath Port Talbot | B64: 105729 | C64: of:=IF(SUM([.E64:.L64])>0;[.B64];0) -> 105729 | D64: of:=[.C64]/[.C$401] -> 3.98217132867833 | F64: 1 | J64: 1 | M64: of:=[.E64]*[.AC$11]+[.F64]*[.AC$13]+[.G64]*[.AC$15]+[.H64]*[.AC$17]+[.I64]*[.AC$19]+[.J64]*[.AC$21]+[.K64]*[.AC$23]+[.L64]*[.AC$25] -> 7.5657065638351 | N64: of:=IF([.E64]>0;1;0) -> 0 | O64: of:=IF([.F64]>0;1;0) -> 1 | P64: of:=IF([.G64]>0;1;0) -> 0 | Q64: of:=IF([.H64]>0;1;0) -> 0 | R64: of:=IF([.I64]>0;1;0) -> 0 | S64: of:=IF([.J64]>0;1;0) -> 1 | T64: of:=IF([.K64]>0;1;0) -> 0 | U64: of:=IF([.L64]>0;1;0) -> 0 | V64: of:=[.N64]*[.N$402]+[.O64]*[.O$402]+[.P64]*[.P$402]+[.Q64]*[.Q$402]+[.R64]*[.R$402]+[.S64]*[.S$402]+[.T64]*[.T$402]+[.U64]*[.U$402] -> 8.81834755033414 | W64: 1516 | X64: of:=[.$AD$1]*2 -> 89434 | Y64: of:=[.W64]+[.X64] -> 90950 | Z64: of:=[.Y64]/[.Y$401] -> 28.9593159798014 | AA64: of:=[.D64]+[.M64]+[.V64]+[.Z64] -> 49.325541422649 | AB64: of:=RANK([.AA64];[.AA$2:.AA$399];0) -> 63
A65: Glos CC | B65: 483120 | C65: of:=IF(SUM([.E65:.L65])>0;[.B65];0) -> 483120 | D65: of:=[.C65]/[.C$401] -> 18.196205509473 | F65: 1 | J65: 1 | M65: of:=[.E65]*[.AC$11]+[.F65]*[.AC$13]+[.G65]*[.AC$15]+[.H65]*[.AC$17]+[.I65]*[.AC$19]+[.J65]*[.AC$21]+[.K65]*[.AC$23]+[.L65]*[.AC$25] -> 7.5657065638351 | N65: of:=IF([.E65]>0;1;0) -> 0 | O65: of:=IF([.F65]>0;1;0) -> 1 | P65: of:=IF([.G65]>0;1;0) -> 0 | Q65: of:=IF([.H65]>0;1;0) -> 0 | R65: of:=IF([.I65]>0;1;0) -> 0 | S65: of:=IF([.J65]>0;1;0) -> 1 | T65: of:=IF([.K65]>0;1;0) -> 0 | U65: of:=IF([.L65]>0;1;0) -> 0 | V65: of:=[.N65]*[.N$402]+[.O65]*[.O$402]+[.P65]*[.P$402]+[.Q65]*[.Q$402]+[.R65]*[.R$402]+[.S65]*[.S$402]+[.T65]*[.T$402]+[.U65]*[.U$402] -> 8.81834755033414 | W65: 850 | X65: of:=[.$AD$1] -> 44717 | Y65: of:=[.W65]+[.X65] -> 45567 | Z65: of:=[.Y65]/[.Y$401] -> 14.5089516355318 | AA65: of:=[.D65]+[.M65]+[.V65]+[.Z65] -> 49.089211259174 | AB65: of:=RANK([.AA65];[.AA$2:.AA$399];0) -> 64
A66: Salford | B66: 174952 | C66: of:=IF(SUM([.E66:.L66])>0;[.B66];0) -> 174952 | D66: of:=[.C66]/[.C$401] -> 6.58938265088038 | E66: 1 | G66: 1 | H66: 1 | I66: 1 | K66: 1 | L66: 1 | M66: of:=[.E66]*[.AC$11]+[.F66]*[.AC$13]+[.G66]*[.AC$15]+[.H66]*[.AC$17]+[.I66]*[.AC$19]+[.J66]*[.AC$21]+[.K66]*[.AC$23]+[.L66]*[.AC$25] -> 24.3728976153988 | N66: of:=IF([.E66]>0;1;0) -> 1 | O66: of:=IF([.F66]>0;1;0) -> 0 | P66: of:=IF([.G66]>0;1;0) -> 1 | Q66: of:=IF([.H66]>0;1;0) -> 1 | R66: of:=IF([.I66]>0;1;0) -> 1 | S66: of:=IF([.J66]>0;1;0) -> 0 | T66: of:=IF([.K66]>0;1;0) -> 1 | U66: of:=IF([.L66]>0;1;0) -> 1 | V66: of:=[.N66]*[.N$402]+[.O66]*[.O$402]+[.P66]*[.P$402]+[.Q66]*[.Q$402]+[.R66]*[.R$402]+[.S66]*[.S$402]+[.T66]*[.T$402]+[.U66]*[.U$402] -> 27.0957943222835 | W66: of:=46+44+10079 -> 10169 | X66: of:=-[.$AD$1] -> -44717 | Y66: of:=[.W66]+[.X66] -> -34548 | Z66: of:=[.Y66]/[.Y$401] -> -11.0004007528332 | AA66: of:=[.D66]+[.M66]+[.V66]+[.Z66] -> 47.0576738357294 | AB66: of:=RANK([.AA66];[.AA$2:.AA$399];0) -> 65
A67: Surrey CC | B67: 861155 | C67: of:=IF(SUM([.E67:.L67])>0;[.B67];0) -> 861155 | D67: of:=[.C67]/[.C$401] -> 32.4344952713824 | J67: 1 | M67: of:=[.E67]*[.AC$11]+[.F67]*[.AC$13]+[.G67]*[.AC$15]+[.H67]*[.AC$17]+[.I67]*[.AC$19]+[.J67]*[.AC$21]+[.K67]*[.AC$23]+[.L67]*[.AC$25] -> 0.136078386768712 | N67: of:=IF([.E67]>0;1;0) -> 0 | O67: of:=IF([.F67]>0;1;0) -> 0 | P67: of:=IF([.G67]>0;1;0) -> 0 | Q67: of:=IF([.H67]>0;1;0) -> 0 | R67: of:=IF([.I67]>0;1;0) -> 0 | S67: of:=IF([.J67]>0;1;0) -> 1 | T67: of:=IF([.K67]>0;1;0) -> 0 | U67: of:=IF([.L67]>0;1;0) -> 0 | V67: of:=[.N67]*[.N$402]+[.O67]*[.O$402]+[.P67]*[.P$402]+[.Q67]*[.Q$402]+[.R67]*[.R$402]+[.S67]*[.S$402]+[.T67]*[.T$402]+[.U67]*[.U$402] -> 0.174691403761665 | X67: of:=[.$AD$1] -> 44717 | Y67: of:=[.W67]+[.X67] -> 44717 | Z67: of:=[.Y67]/[.Y$401] -> 14.2383038226364 | AA67: of:=[.D67]+[.M67]+[.V67]+[.Z67] -> 46.9835688845492 | AB67: of:=RANK([.AA67];[.AA$2:.AA$399];0) -> 66
A68: Wilts | B68: 366090 | C68: of:=IF(SUM([.E68:.L68])>0;[.B68];0) -> 366090 | D68: of:=[.C68]/[.C$401] -> 13.7883939289679 | F68: 1 | J68: 1 | M68: of:=[.E68]*[.AC$11]+[.F68]*[.AC$13]+[.G68]*[.AC$15]+[.H68]*[.AC$17]+[.I68]*[.AC$19]+[.J68]*[.AC$21]+[.K68]*[.AC$23]+[.L68]*[.AC$25] -> 7.5657065638351 | N68: of:=IF([.E68]>0;1;0) -> 0 | O68: of:=IF([.F68]>0;1;0) -> 1 | P68: of:=IF([.G68]>0;1;0) -> 0 | Q68: of:=IF([.H68]>0;1;0) -> 0 | R68: of:=IF([.I68]>0;1;0) -> 0 | S68: of:=IF([.J68]>0;1;0) -> 1 | T68: of:=IF([.K68]>0;1;0) -> 0 | U68: of:=IF([.L68]>0;1;0) -> 0 | V68: of:=[.N68]*[.N$402]+[.O68]*[.O$402]+[.P68]*[.P$402]+[.Q68]*[.Q$402]+[.R68]*[.R$402]+[.S68]*[.S$402]+[.T68]*[.T$402]+[.U68]*[.U$402] -> 8.81834755033414 | W68: 1568 | X68: of:=[.$AD$1] -> 44717 | Y68: of:=[.W68]+[.X68] -> 46285 | Z68: of:=[.Y68]/[.Y$401] -> 14.7375694351304 | AA68: of:=[.D68]+[.M68]+[.V68]+[.Z68] -> 44.9100174782676 | AB68: of:=RANK([.AA68];[.AA$2:.AA$399];0) -> 67
A69: Durham | B69: 384976 | C69: of:=IF(SUM([.E69:.L69])>0;[.B69];0) -> 384976 | D69: of:=[.C69]/[.C$401] -> 14.4997152099166 | J69: 1 | M69: of:=[.E69]*[.AC$11]+[.F69]*[.AC$13]+[.G69]*[.AC$15]+[.H69]*[.AC$17]+[.I69]*[.AC$19]+[.J69]*[.AC$21]+[.K69]*[.AC$23]+[.L69]*[.AC$25] -> 0.136078386768712 | N69: of:=IF([.E69]>0;1;0) -> 0 | O69: of:=IF([.F69]>0;1;0) -> 0 | P69: of:=IF([.G69]>0;1;0) -> 0 | Q69: of:=IF([.H69]>0;1;0) -> 0 | R69: of:=IF([.I69]>0;1;0) -> 0 | S69: of:=IF([.J69]>0;1;0) -> 1 | T69: of:=IF([.K69]>0;1;0) -> 0 | U69: of:=IF([.L69]>0;1;0) -> 0 | V69: of:=[.N69]*[.N$402]+[.O69]*[.O$402]+[.P69]*[.P$402]+[.Q69]*[.Q$402]+[.R69]*[.R$402]+[.S69]*[.S$402]+[.T69]*[.T$402]+[.U69]*[.U$402] -> 0.174691403761665 | X69: of:=[.$AD$1]*2 -> 89434 | Y69: of:=[.W69]+[.X69] -> 89434 | Z69: of:=[.Y69]/[.Y$401] -> 28.4766076452728 | AA69: of:=[.D69]+[.M69]+[.V69]+[.Z69] -> 43.2870926457198 | AB69: of:=RANK([.AA69];[.AA$2:.AA$399];0) -> 68
A70: Essex CC | B70: 1095849 | C70: of:=IF(SUM([.E70:.L70])>0;[.B70];0) -> 1095849 | D70: of:=[.C70]/[.C$401] -> 41.273997374049 | J70: 1 | M70: of:=[.E70]*[.AC$11]+[.F70]*[.AC$13]+[.G70]*[.AC$15]+[.H70]*[.AC$17]+[.I70]*[.AC$19]+[.J70]*[.AC$21]+[.K70]*[.AC$23]+[.L70]*[.AC$25] -> 0.136078386768712 | N70: of:=IF([.E70]>0;1;0) -> 0 | O70: of:=IF([.F70]>0;1;0) -> 0 | P70: of:=IF([.G70]>0;1;0) -> 0 | Q70: of:=IF([.H70]>0;1;0) -> 0 | R70: of:=IF([.I70]>0;1;0) -> 0 | S70: of:=IF([.J70]>0;1;0) -> 1 | T70: of:=IF([.K70]>0;1;0) -> 0 | U70: of:=IF([.L70]>0;1;0) -> 0 | V70: of:=[.N70]*[.N$402]+[.O70]*[.O$402]+[.P70]*[.P$402]+[.Q70]*[.Q$402]+[.R70]*[.R$402]+[.S70]*[.S$402]+[.T70]*[.T$402]+[.U70]*[.U$402] -> 0.174691403761665 | Y70: of:=[.W70]+[.X70] -> 0 | Z70: of:=[.Y70]/[.Y$401] -> 0 | AA70: of:=[.D70]+[.M70]+[.V70]+[.Z70] -> 41.5847671645793 | AB70: of:=RANK([.AA70];[.AA$2:.AA$399];0) -> 69
A71: Northumberland | B71: 240978 | C71: of:=IF(SUM([.E71:.L71])>0;[.B71];0) -> 240978 | D71: of:=[.C71]/[.C$401] -> 9.07618233826337 | F71: 1 | J71: 1 | M71: of:=[.E71]*[.AC$11]+[.F71]*[.AC$13]+[.G71]*[.AC$15]+[.H71]*[.AC$17]+[.I71]*[.AC$19]+[.J71]*[.AC$21]+[.K71]*[.AC$23]+[.L71]*[.AC$25] -> 7.5657065638351 | N71: of:=IF([.E71]>0;1;0) -> 0 | O71: of:=IF([.F71]>0;1;0) -> 1 | P71: of:=IF([.G71]>0;1;0) -> 0 | Q71: of:=IF([.H71]>0;1;0) -> 0 | R71: of:=IF([.I71]>0;1;0) -> 0 | S71: of:=IF([.J71]>0;1;0) -> 1 | T71: of:=IF([.K71]>0;1;0) -> 0 | U71: of:=IF([.L71]>0;1;0) -> 0 | V71: of:=[.N71]*[.N$402]+[.O71]*[.O$402]+[.P71]*[.P$402]+[.Q71]*[.Q$402]+[.R71]*[.R$402]+[.S71]*[.S$402]+[.T71]*[.T$402]+[.U71]*[.U$402] -> 8.81834755033414 | W71: 2454 | X71: of:=[.$AD$1] -> 44717 | Y71: of:=[.W71]+[.X71] -> 47171 | Z71: of:=[.Y71]/[.Y$401] -> 15.0196799789248 | AA71: of:=[.D71]+[.M71]+[.V71]+[.Z71] -> 40.4799164313574 | AB71: of:=RANK([.AA71];[.AA$2:.AA$399];0) -> 70
A72: Hants CC | B72: 1036259 | C72: of:=IF(SUM([.E72:.L72])>0;[.B72];0) -> 1036259 | D72: of:=[.C72]/[.C$401] -> 39.029602842029 | J72: 1 | M72: of:=[.E72]*[.AC$11]+[.F72]*[.AC$13]+[.G72]*[.AC$15]+[.H72]*[.AC$17]+[.I72]*[.AC$19]+[.J72]*[.AC$21]+[.K72]*[.AC$23]+[.L72]*[.AC$25] -> 0.136078386768712 | N72: of:=IF([.E72]>0;1;0) -> 0 | O72: of:=IF([.F72]>0;1;0) -> 0 | P72: of:=IF([.G72]>0;1;0) -> 0 | Q72: of:=IF([.H72]>0;1;0) -> 0 | R72: of:=IF([.I72]>0;1;0) -> 0 | S72: of:=IF([.J72]>0;1;0) -> 1 | T72: of:=IF([.K72]>0;1;0) -> 0 | U72: of:=IF([.L72]>0;1;0) -> 0 | V72: of:=[.N72]*[.N$402]+[.O72]*[.O$402]+[.P72]*[.P$402]+[.Q72]*[.Q$402]+[.R72]*[.R$402]+[.S72]*[.S$402]+[.T72]*[.T$402]+[.U72]*[.U$402] -> 0.174691403761665 | Y72: of:=[.W72]+[.X72] -> 0 | Z72: of:=[.Y72]/[.Y$401] -> 0 | AA72: of:=[.D72]+[.M72]+[.V72]+[.Z72] -> 39.3403726325593 | AB72: of:=RANK([.AA72];[.AA$2:.AA$399];0) -> 71
A73: Lincs CC | B73: 557226 | C73: of:=IF(SUM([.E73:.L73])>0;[.B73];0) -> 557226 | D73: of:=[.C73]/[.C$401] -> 20.9873298791638 | F73: 1 | J73: 1 | M73: of:=[.E73]*[.AC$11]+[.F73]*[.AC$13]+[.G73]*[.AC$15]+[.H73]*[.AC$17]+[.I73]*[.AC$19]+[.J73]*[.AC$21]+[.K73]*[.AC$23]+[.L73]*[.AC$25] -> 7.5657065638351 | N73: of:=IF([.E73]>0;1;0) -> 0 | O73: of:=IF([.F73]>0;1;0) -> 1 | P73: of:=IF([.G73]>0;1;0) -> 0 | Q73: of:=IF([.H73]>0;1;0) -> 0 | R73: of:=IF([.I73]>0;1;0) -> 0 | S73: of:=IF([.J73]>0;1;0) -> 1 | T73: of:=IF([.K73]>0;1;0) -> 0 | U73: of:=IF([.L73]>0;1;0) -> 0 | V73: of:=[.N73]*[.N$402]+[.O73]*[.O$402]+[.P73]*[.P$402]+[.Q73]*[.Q$402]+[.R73]*[.R$402]+[.S73]*[.S$402]+[.T73]*[.T$402]+[.U73]*[.U$402] -> 8.81834755033414 | W73: 146 | Y73: of:=[.W73]+[.X73] -> 146 | Z73: of:=[.Y73]/[.Y$401] -> 0.0464877419796703 | AA73: of:=[.D73]+[.M73]+[.V73]+[.Z73] -> 37.4178717353127 | AB73: of:=RANK([.AA73];[.AA$2:.AA$399];0) -> 72
A74: Lewisham | B74: 194999 | C74: of:=IF(SUM([.E74:.L74])>0;[.B74];0) -> 194999 | D74: of:=[.C74]/[.C$401] -> 7.34443177293785 | K74: 1 | M74: of:=[.E74]*[.AC$11]+[.F74]*[.AC$13]+[.G74]*[.AC$15]+[.H74]*[.AC$17]+[.I74]*[.AC$19]+[.J74]*[.AC$21]+[.K74]*[.AC$23]+[.L74]*[.AC$25] -> 0.0500604408799853 | N74: of:=IF([.E74]>0;1;0) -> 0 | O74: of:=IF([.F74]>0;1;0) -> 0 | P74: of:=IF([.G74]>0;1;0) -> 0 | Q74: of:=IF([.H74]>0;1;0) -> 0 | R74: of:=IF([.I74]>0;1;0) -> 0 | S74: of:=IF([.J74]>0;1;0) -> 0 | T74: of:=IF([.K74]>0;1;0) -> 1 | U74: of:=IF([.L74]>0;1;0) -> 0 | V74: of:=[.N74]*[.N$402]+[.O74]*[.O$402]+[.P74]*[.P$402]+[.Q74]*[.Q$402]+[.R74]*[.R$402]+[.S74]*[.S$402]+[.T74]*[.T$402]+[.U74]*[.U$402] -> 0.0208234179196155 | X74: of:=[.$AD$1]*2 -> 89434 | Y74: of:=[.W74]+[.X74] -> 89434 | Z74: of:=[.Y74]/[.Y$401] -> 28.4766076452728 | AA74: of:=[.D74]+[.M74]+[.V74]+[.Z74] -> 35.8919232770103 | AB74: of:=RANK([.AA74];[.AA$2:.AA$399];0) -> 73
A75: Isle of Wight | B75: 109390 | C75: of:=IF(SUM([.E75:.L75])>0;[.B75];0) -> 109390 | D75: of:=[.C75]/[.C$401] -> 4.1200590343626 | F75: 1 | J75: 1 | M75: of:=[.E75]*[.AC$11]+[.F75]*[.AC$13]+[.G75]*[.AC$15]+[.H75]*[.AC$17]+[.I75]*[.AC$19]+[.J75]*[.AC$21]+[.K75]*[.AC$23]+[.L75]*[.AC$25] -> 7.5657065638351 | N75: of:=IF([.E75]>0;1;0) -> 0 | O75: of:=IF([.F75]>0;1;0) -> 1 | P75: of:=IF([.G75]>0;1;0) -> 0 | Q75: of:=IF([.H75]>0;1;0) -> 0 | R75: of:=IF([.I75]>0;1;0) -> 0 | S75: of:=IF([.J75]>0;1;0) -> 1 | T75: of:=IF([.K75]>0;1;0) -> 0 | U75: of:=IF([.L75]>0;1;0) -> 0 | V75: of:=[.N75]*[.N$402]+[.O75]*[.O$402]+[.P75]*[.P$402]+[.Q75]*[.Q$402]+[.R75]*[.R$402]+[.S75]*[.S$402]+[.T75]*[.T$402]+[.U75]*[.U$402] -> 8.81834755033414 | W75: 532 | X75: of:=[.$AD$1] -> 44717 | Y75: of:=[.W75]+[.X75] -> 45249 | Z75: of:=[.Y75]/[.Y$401] -> 14.4076975125897 | AA75: of:=[.D75]+[.M75]+[.V75]+[.Z75] -> 34.9118106611216 | AB75: of:=RANK([.AA75];[.AA$2:.AA$399];0) -> 74
A76: Dundee | B76: 108089 | C76: of:=IF(SUM([.E76:.L76])>0;[.B76];0) -> 108089 | D76: of:=[.C76]/[.C$401] -> 4.07105824083754 | F76: 1 | K76: 1 | M76: of:=[.E76]*[.AC$11]+[.F76]*[.AC$13]+[.G76]*[.AC$15]+[.H76]*[.AC$17]+[.I76]*[.AC$19]+[.J76]*[.AC$21]+[.K76]*[.AC$23]+[.L76]*[.AC$25] -> 7.47968861794637 | N76: of:=IF([.E76]>0;1;0) -> 0 | O76: of:=IF([.F76]>0;1;0) -> 1 | P76: of:=IF([.G76]>0;1;0) -> 0 | Q76: of:=IF([.H76]>0;1;0) -> 0 | R76: of:=IF([.I76]>0;1;0) -> 0 | S76: of:=IF([.J76]>0;1;0) -> 0 | T76: of:=IF([.K76]>0;1;0) -> 1 | U76: of:=IF([.L76]>0;1;0) -> 0 | V76: of:=[.N76]*[.N$402]+[.O76]*[.O$402]+[.P76]*[.P$402]+[.Q76]*[.Q$402]+[.R76]*[.R$402]+[.S76]*[.S$402]+[.T76]*[.T$402]+[.U76]*[.U$402] -> 8.66447956449209 | W76: 89 | X76: of:=[.$AD$1] -> 44717 | Y76: of:=[.W76]+[.X76] -> 44806 | Z76: of:=[.Y76]/[.Y$401] -> 14.2666422406925 | AA76: of:=[.D76]+[.M76]+[.V76]+[.Z76] -> 34.4818686639685 | AB76: of:=RANK([.AA76];[.AA$2:.AA$399];0) -> 75
A77: Lancs CC | B77: 900009 | C77: of:=IF(SUM([.E77:.L77])>0;[.B77];0) -> 900009 | D77: of:=[.C77]/[.C$401] -> 33.8978902226679 | J77: 1 | M77: of:=[.E77]*[.AC$11]+[.F77]*[.AC$13]+[.G77]*[.AC$15]+[.H77]*[.AC$17]+[.I77]*[.AC$19]+[.J77]*[.AC$21]+[.K77]*[.AC$23]+[.L77]*[.AC$25] -> 0.136078386768712 | N77: of:=IF([.E77]>0;1;0) -> 0 | O77: of:=IF([.F77]>0;1;0) -> 0 | P77: of:=IF([.G77]>0;1;0) -> 0 | Q77: of:=IF([.H77]>0;1;0) -> 0 | R77: of:=IF([.I77]>0;1;0) -> 0 | S77: of:=IF([.J77]>0;1;0) -> 1 | T77: of:=IF([.K77]>0;1;0) -> 0 | U77: of:=IF([.L77]>0;1;0) -> 0 | V77: of:=[.N77]*[.N$402]+[.O77]*[.O$402]+[.P77]*[.P$402]+[.Q77]*[.Q$402]+[.R77]*[.R$402]+[.S77]*[.S$402]+[.T77]*[.T$402]+[.U77]*[.U$402] -> 0.174691403761665 | Y77: of:=[.W77]+[.X77] -> 0 | Z77: of:=[.Y77]/[.Y$401] -> 0 | AA77: of:=[.D77]+[.M77]+[.V77]+[.Z77] -> 34.2086600131983 | AB77: of:=RANK([.AA77];[.AA$2:.AA$399];0) -> 76
A78: Glasgow | B78: 464043 | C78: of:=IF(SUM([.E78:.L78])>0;[.B78];0) -> 464043 | D78: of:=[.C78]/[.C$401] -> 17.4776904148708 | F78: 1 | K78: 1 | M78: of:=[.E78]*[.AC$11]+[.F78]*[.AC$13]+[.G78]*[.AC$15]+[.H78]*[.AC$17]+[.I78]*[.AC$19]+[.J78]*[.AC$21]+[.K78]*[.AC$23]+[.L78]*[.AC$25] -> 7.47968861794637 | N78: of:=IF([.E78]>0;1;0) -> 0 | O78: of:=IF([.F78]>0;1;0) -> 1 | P78: of:=IF([.G78]>0;1;0) -> 0 | Q78: of:=IF([.H78]>0;1;0) -> 0 | R78: of:=IF([.I78]>0;1;0) -> 0 | S78: of:=IF([.J78]>0;1;0) -> 0 | T78: of:=IF([.K78]>0;1;0) -> 1 | U78: of:=IF([.L78]>0;1;0) -> 0 | V78: of:=[.N78]*[.N$402]+[.O78]*[.O$402]+[.P78]*[.P$402]+[.Q78]*[.Q$402]+[.R78]*[.R$402]+[.S78]*[.S$402]+[.T78]*[.T$402]+[.U78]*[.U$402] -> 8.66447956449209 | W78: 387 | Y78: of:=[.W78]+[.X78] -> 387 | Z78: of:=[.Y78]/[.Y$401] -> 0.12322435716529 | AA78: of:=[.D78]+[.M78]+[.V78]+[.Z78] -> 33.7450829544746 | AB78: of:=RANK([.AA78];[.AA$2:.AA$399];0) -> 77
A79: E Lothian | B79: 81158 | C79: of:=IF(SUM([.E79:.L79])>0;[.B79];0) -> 81158 | D79: of:=[.C79]/[.C$401] -> 3.05673051568516 | F79: 1 | K79: 1 | M79: of:=[.E79]*[.AC$11]+[.F79]*[.AC$13]+[.G79]*[.AC$15]+[.H79]*[.AC$17]+[.I79]*[.AC$19]+[.J79]*[.AC$21]+[.K79]*[.AC$23]+[.L79]*[.AC$25] -> 7.47968861794637 | N79: of:=IF([.E79]>0;1;0) -> 0 | O79: of:=IF([.F79]>0;1;0) -> 1 | P79: of:=IF([.G79]>0;1;0) -> 0 | Q79: of:=IF([.H79]>0;1;0) -> 0 | R79: of:=IF([.I79]>0;1;0) -> 0 | S79: of:=IF([.J79]>0;1;0) -> 0 | T79: of:=IF([.K79]>0;1;0) -> 1 | U79: of:=IF([.L79]>0;1;0) -> 0 | V79: of:=[.N79]*[.N$402]+[.O79]*[.O$402]+[.P79]*[.P$402]+[.Q79]*[.Q$402]+[.R79]*[.R$402]+[.S79]*[.S$402]+[.T79]*[.T$402]+[.U79]*[.U$402] -> 8.66447956449209 | W79: 62 | X79: of:=[.$AD$1] -> 44717 | Y79: of:=[.W79]+[.X79] -> 44779 | Z79: of:=[.Y79]/[.Y$401] -> 14.2580451925182 | AA79: of:=[.D79]+[.M79]+[.V79]+[.Z79] -> 33.4589438906418 | AB79: of:=RANK([.AA79];[.AA$2:.AA$399];0) -> 78
A80: Worcs CC | B80: 446494 | C80: of:=IF(SUM([.E80:.L80])>0;[.B80];0) -> 446494 | D80: of:=[.C80]/[.C$401] -> 16.8167258294971 | F80: 1 | J80: 1 | M80: of:=[.E80]*[.AC$11]+[.F80]*[.AC$13]+[.G80]*[.AC$15]+[.H80]*[.AC$17]+[.I80]*[.AC$19]+[.J80]*[.AC$21]+[.K80]*[.AC$23]+[.L80]*[.AC$25] -> 7.5657065638351 | N80: of:=IF([.E80]>0;1;0) -> 0 | O80: of:=IF([.F80]>0;1;0) -> 1 | P80: of:=IF([.G80]>0;1;0) -> 0 | Q80: of:=IF([.H80]>0;1;0) -> 0 | R80: of:=IF([.I80]>0;1;0) -> 0 | S80: of:=IF([.J80]>0;1;0) -> 1 | T80: of:=IF([.K80]>0;1;0) -> 0 | U80: of:=IF([.L80]>0;1;0) -> 0 | V80: of:=[.N80]*[.N$402]+[.O80]*[.O$402]+[.P80]*[.P$402]+[.Q80]*[.Q$402]+[.R80]*[.R$402]+[.S80]*[.S$402]+[.T80]*[.T$402]+[.U80]*[.U$402] -> 8.81834755033414 | W80: 264 | Y80: of:=[.W80]+[.X80] -> 264 | Z80: of:=[.Y80]/[.Y$401] -> 0.0840600265933764 | AA80: of:=[.D80]+[.M80]+[.V80]+[.Z80] -> 33.2848399702598 | AB80: of:=RANK([.AA80];[.AA$2:.AA$399];0) -> 79
A81: Warks CC | B81: 432472 | C81: of:=IF(SUM([.E81:.L81])>0;[.B81];0) -> 432472 | D81: of:=[.C81]/[.C$401] -> 16.2886019810665 | F81: 1 | J81: 1 | M81: of:=[.E81]*[.AC$11]+[.F81]*[.AC$13]+[.G81]*[.AC$15]+[.H81]*[.AC$17]+[.I81]*[.AC$19]+[.J81]*[.AC$21]+[.K81]*[.AC$23]+[.L81]*[.AC$25] -> 7.5657065638351 | N81: of:=IF([.E81]>0;1;0) -> 0 | O81: of:=IF([.F81]>0;1;0) -> 1 | P81: of:=IF([.G81]>0;1;0) -> 0 | Q81: of:=IF([.H81]>0;1;0) -> 0 | R81: of:=IF([.I81]>0;1;0) -> 0 | S81: of:=IF([.J81]>0;1;0) -> 1 | T81: of:=IF([.K81]>0;1;0) -> 0 | U81: of:=IF([.L81]>0;1;0) -> 0 | V81: of:=[.N81]*[.N$402]+[.O81]*[.O$402]+[.P81]*[.P$402]+[.Q81]*[.Q$402]+[.R81]*[.R$402]+[.S81]*[.S$402]+[.T81]*[.T$402]+[.U81]*[.U$402] -> 8.81834755033414 | W81: 100 | Y81: of:=[.W81]+[.X81] -> 100 | Z81: of:=[.Y81]/[.Y$401] -> 0.0318409191641577 | AA81: of:=[.D81]+[.M81]+[.V81]+[.Z81] -> 32.7044970143999 | AB81: of:=RANK([.AA81];[.AA$2:.AA$399];0) -> 80
A82: Ceredigion | B82: 51999 | C82: of:=IF(SUM([.E82:.L82])>0;[.B82];0) -> 51999 | D82: of:=[.C82]/[.C$401] -> 1.95848751922315 | F82: 1 | J82: 1 | M82: of:=[.E82]*[.AC$11]+[.F82]*[.AC$13]+[.G82]*[.AC$15]+[.H82]*[.AC$17]+[.I82]*[.AC$19]+[.J82]*[.AC$21]+[.K82]*[.AC$23]+[.L82]*[.AC$25] -> 7.5657065638351 | N82: of:=IF([.E82]>0;1;0) -> 0 | O82: of:=IF([.F82]>0;1;0) -> 1 | P82: of:=IF([.G82]>0;1;0) -> 0 | Q82: of:=IF([.H82]>0;1;0) -> 0 | R82: of:=IF([.I82]>0;1;0) -> 0 | S82: of:=IF([.J82]>0;1;0) -> 1 | T82: of:=IF([.K82]>0;1;0) -> 0 | U82: of:=IF([.L82]>0;1;0) -> 0 | V82: of:=[.N82]*[.N$402]+[.O82]*[.O$402]+[.P82]*[.P$402]+[.Q82]*[.Q$402]+[.R82]*[.R$402]+[.S82]*[.S$402]+[.T82]*[.T$402]+[.U82]*[.U$402] -> 8.81834755033414 | W82: 384 | X82: of:=[.$AD$1] -> 44717 | Y82: of:=[.W82]+[.X82] -> 45101 | Z82: of:=[.Y82]/[.Y$401] -> 14.3605729522268 | AA82: of:=[.D82]+[.M82]+[.V82]+[.Z82] -> 32.7031145856192 | AB82: of:=RANK([.AA82];[.AA$2:.AA$399];0) -> 81
A83: Herts CC | B83: 857068 | C83: of:=IF(SUM([.E83:.L83])>0;[.B83];0) -> 857068 | D83: of:=[.C83]/[.C$401] -> 32.2805627247745 | J83: 1 | M83: of:=[.E83]*[.AC$11]+[.F83]*[.AC$13]+[.G83]*[.AC$15]+[.H83]*[.AC$17]+[.I83]*[.AC$19]+[.J83]*[.AC$21]+[.K83]*[.AC$23]+[.L83]*[.AC$25] -> 0.136078386768712 | N83: of:=IF([.E83]>0;1;0) -> 0 | O83: of:=IF([.F83]>0;1;0) -> 0 | P83: of:=IF([.G83]>0;1;0) -> 0 | Q83: of:=IF([.H83]>0;1;0) -> 0 | R83: of:=IF([.I83]>0;1;0) -> 0 | S83: of:=IF([.J83]>0;1;0) -> 1 | T83: of:=IF([.K83]>0;1;0) -> 0 | U83: of:=IF([.L83]>0;1;0) -> 0 | V83: of:=[.N83]*[.N$402]+[.O83]*[.O$402]+[.P83]*[.P$402]+[.Q83]*[.Q$402]+[.R83]*[.R$402]+[.S83]*[.S$402]+[.T83]*[.T$402]+[.U83]*[.U$402] -> 0.174691403761665 | Y83: of:=[.W83]+[.X83] -> 0 | Z83: of:=[.Y83]/[.Y$401] -> 0 | AA83: of:=[.D83]+[.M83]+[.V83]+[.Z83] -> 32.5913325153049 | AB83: of:=RANK([.AA83];[.AA$2:.AA$399];0) -> 82
A84: Cambs CC | B84: 478414 | C84: of:=IF(SUM([.E84:.L84])>0;[.B84];0) -> 478414 | D84: of:=[.C84]/[.C$401] -> 18.0189589803963 | J84: 1 | M84: of:=[.E84]*[.AC$11]+[.F84]*[.AC$13]+[.G84]*[.AC$15]+[.H84]*[.AC$17]+[.I84]*[.AC$19]+[.J84]*[.AC$21]+[.K84]*[.AC$23]+[.L84]*[.AC$25] -> 0.136078386768712 | N84: of:=IF([.E84]>0;1;0) -> 0 | O84: of:=IF([.F84]>0;1;0) -> 0 | P84: of:=IF([.G84]>0;1;0) -> 0 | Q84: of:=IF([.H84]>0;1;0) -> 0 | R84: of:=IF([.I84]>0;1;0) -> 0 | S84: of:=IF([.J84]>0;1;0) -> 1 | T84: of:=IF([.K84]>0;1;0) -> 0 | U84: of:=IF([.L84]>0;1;0) -> 0 | V84: of:=[.N84]*[.N$402]+[.O84]*[.O$402]+[.P84]*[.P$402]+[.Q84]*[.Q$402]+[.R84]*[.R$402]+[.S84]*[.S$402]+[.T84]*[.T$402]+[.U84]*[.U$402] -> 0.174691403761665 | X84: of:=[.$AD$1] -> 44717 | Y84: of:=[.W84]+[.X84] -> 44717 | Z84: of:=[.Y84]/[.Y$401] -> 14.2383038226364 | AA84: of:=[.D84]+[.M84]+[.V84]+[.Z84] -> 32.568032593563 | AB84: of:=RANK([.AA84];[.AA$2:.AA$399];0) -> 83
A85: Somerset CC | B85: 419744 | C85: of:=IF(SUM([.E85:.L85])>0;[.B85];0) -> 419744 | D85: of:=[.C85]/[.C$401] -> 15.80921527854 | F85: 1 | J85: 1 | M85: of:=[.E85]*[.AC$11]+[.F85]*[.AC$13]+[.G85]*[.AC$15]+[.H85]*[.AC$17]+[.I85]*[.AC$19]+[.J85]*[.AC$21]+[.K85]*[.AC$23]+[.L85]*[.AC$25] -> 7.5657065638351 | N85: of:=IF([.E85]>0;1;0) -> 0 | O85: of:=IF([.F85]>0;1;0) -> 1 | P85: of:=IF([.G85]>0;1;0) -> 0 | Q85: of:=IF([.H85]>0;1;0) -> 0 | R85: of:=IF([.I85]>0;1;0) -> 0 | S85: of:=IF([.J85]>0;1;0) -> 1 | T85: of:=IF([.K85]>0;1;0) -> 0 | U85: of:=IF([.L85]>0;1;0) -> 0 | V85: of:=[.N85]*[.N$402]+[.O85]*[.O$402]+[.P85]*[.P$402]+[.Q85]*[.Q$402]+[.R85]*[.R$402]+[.S85]*[.S$402]+[.T85]*[.T$402]+[.U85]*[.U$402] -> 8.81834755033414 | W85: 912 | Y85: of:=[.W85]+[.X85] -> 912 | Z85: of:=[.Y85]/[.Y$401] -> 0.290389182777118 | AA85: of:=[.D85]+[.M85]+[.V85]+[.Z85] -> 32.4836585754864 | AB85: of:=RANK([.AA85];[.AA$2:.AA$399];0) -> 84
A86: Birmingham | B86: 717617 | C86: of:=IF(SUM([.E86:.L86])>0;[.B86];0) -> 717617 | D86: of:=[.C86]/[.C$401] -> 27.0282878148111 | G86: 1 | K86: 1 | M86: of:=[.E86]*[.AC$11]+[.F86]*[.AC$13]+[.G86]*[.AC$15]+[.H86]*[.AC$17]+[.I86]*[.AC$19]+[.J86]*[.AC$21]+[.K86]*[.AC$23]+[.L86]*[.AC$25] -> 2.78326790277077 | N86: of:=IF([.E86]>0;1;0) -> 0 | O86: of:=IF([.F86]>0;1;0) -> 0 | P86: of:=IF([.G86]>0;1;0) -> 1 | Q86: of:=IF([.H86]>0;1;0) -> 0 | R86: of:=IF([.I86]>0;1;0) -> 0 | S86: of:=IF([.J86]>0;1;0) -> 0 | T86: of:=IF([.K86]>0;1;0) -> 1 | U86: of:=IF([.L86]>0;1;0) -> 0 | V86: of:=[.N86]*[.N$402]+[.O86]*[.O$402]+[.P86]*[.P$402]+[.Q86]*[.Q$402]+[.R86]*[.R$402]+[.S86]*[.S$402]+[.T86]*[.T$402]+[.U86]*[.U$402] -> 1.5062883605785 | W86: 1434 | Y86: of:=[.W86]+[.X86] -> 1434 | Z86: of:=[.Y86]/[.Y$401] -> 0.456598780814022 | AA86: of:=[.D86]+[.M86]+[.V86]+[.Z86] -> 31.7744428589744 | AB86: of:=RANK([.AA86];[.AA$2:.AA$399];0) -> 85
A87: Edinburgh | B87: 366314 | C87: of:=IF(SUM([.E87:.L87])>0;[.B87];0) -> 366314 | D87: of:=[.C87]/[.C$401] -> 13.7968306528339 | F87: 1 | K87: 1 | M87: of:=[.E87]*[.AC$11]+[.F87]*[.AC$13]+[.G87]*[.AC$15]+[.H87]*[.AC$17]+[.I87]*[.AC$19]+[.J87]*[.AC$21]+[.K87]*[.AC$23]+[.L87]*[.AC$25] -> 7.47968861794637 | N87: of:=IF([.E87]>0;1;0) -> 0 | O87: of:=IF([.F87]>0;1;0) -> 1 | P87: of:=IF([.G87]>0;1;0) -> 0 | Q87: of:=IF([.H87]>0;1;0) -> 0 | R87: of:=IF([.I87]>0;1;0) -> 0 | S87: of:=IF([.J87]>0;1;0) -> 0 | T87: of:=IF([.K87]>0;1;0) -> 1 | U87: of:=IF([.L87]>0;1;0) -> 0 | V87: of:=[.N87]*[.N$402]+[.O87]*[.O$402]+[.P87]*[.P$402]+[.Q87]*[.Q$402]+[.R87]*[.R$402]+[.S87]*[.S$402]+[.T87]*[.T$402]+[.U87]*[.U$402] -> 8.66447956449209 | W87: 3830 | Y87: of:=[.W87]+[.X87] -> 3830 | Z87: of:=[.Y87]/[.Y$401] -> 1.21950720398724 | AA87: of:=[.D87]+[.M87]+[.V87]+[.Z87] -> 31.1605060392596 | AB87: of:=RANK([.AA87];[.AA$2:.AA$399];0) -> 86
A88: Leeds | B88: 552976 | C88: of:=IF(SUM([.E88:.L88])>0;[.B88];0) -> 552976 | D88: of:=[.C88]/[.C$401] -> 20.8272581093856 | G88: 1 | H88: 1 | I88: 1 | K88: 1 | L88: 1 | M88: of:=[.E88]*[.AC$11]+[.F88]*[.AC$13]+[.G88]*[.AC$15]+[.H88]*[.AC$17]+[.I88]*[.AC$19]+[.J88]*[.AC$21]+[.K88]*[.AC$23]+[.L88]*[.AC$25] -> 4.1770743494719 | N88: of:=IF([.E88]>0;1;0) -> 0 | O88: of:=IF([.F88]>0;1;0) -> 0 | P88: of:=IF([.G88]>0;1;0) -> 1 | Q88: of:=IF([.H88]>0;1;0) -> 1 | R88: of:=IF([.I88]>0;1;0) -> 1 | S88: of:=IF([.J88]>0;1;0) -> 0 | T88: of:=IF([.K88]>0;1;0) -> 1 | U88: of:=IF([.L88]>0;1;0) -> 1 | V88: of:=[.N88]*[.N$402]+[.O88]*[.O$402]+[.P88]*[.P$402]+[.Q88]*[.Q$402]+[.R88]*[.R$402]+[.S88]*[.S$402]+[.T88]*[.T$402]+[.U88]*[.U$402] -> 2.03350799196213 | W88: of:=1635+11165 -> 12800 | Y88: of:=[.W88]+[.X88] -> 12800 | Z88: of:=[.Y88]/[.Y$401] -> 4.07563765301219 | AA88: of:=[.D88]+[.M88]+[.V88]+[.Z88] -> 31.1134781038318 | AB88: of:=RANK([.AA88];[.AA$2:.AA$399];0) -> 87
A89: Isles of Scilly | B89: 1598 | C89: of:=IF(SUM([.E89:.L89])>0;[.B89];0) -> 1598 | D89: of:=[.C89]/[.C$401] -> 0.060186985436616 | F89: 1 | J89: 1 | M89: of:=[.E89]*[.AC$11]+[.F89]*[.AC$13]+[.G89]*[.AC$15]+[.H89]*[.AC$17]+[.I89]*[.AC$19]+[.J89]*[.AC$21]+[.K89]*[.AC$23]+[.L89]*[.AC$25] -> 7.5657065638351 | N89: of:=IF([.E89]>0;1;0) -> 0 | O89: of:=IF([.F89]>0;1;0) -> 1 | P89: of:=IF([.G89]>0;1;0) -> 0 | Q89: of:=IF([.H89]>0;1;0) -> 0 | R89: of:=IF([.I89]>0;1;0) -> 0 | S89: of:=IF([.J89]>0;1;0) -> 1 | T89: of:=IF([.K89]>0;1;0) -> 0 | U89: of:=IF([.L89]>0;1;0) -> 0 | V89: of:=[.N89]*[.N$402]+[.O89]*[.O$402]+[.P89]*[.P$402]+[.Q89]*[.Q$402]+[.R89]*[.R$402]+[.S89]*[.S$402]+[.T89]*[.T$402]+[.U89]*[.U$402] -> 8.81834755033414 | W89: 345 | X89: of:=[.$AD$1] -> 44717 | Y89: of:=[.W89]+[.X89] -> 45062 | Z89: of:=[.Y89]/[.Y$401] -> 14.3481549937528 | AA89: of:=[.D89]+[.M89]+[.V89]+[.Z89] -> 30.7923960933586 | AB89: of:=RANK([.AA89];[.AA$2:.AA$399];0) -> 88
A90: Dorset CC | B90: 331227 | C90: of:=IF(SUM([.E90:.L90])>0;[.B90];0) -> 331227 | D90: of:=[.C90]/[.C$401] -> 12.4753157854906 | F90: 1 | M90: of:=[.E90]*[.AC$11]+[.F90]*[.AC$13]+[.G90]*[.AC$15]+[.H90]*[.AC$17]+[.I90]*[.AC$19]+[.J90]*[.AC$21]+[.K90]*[.AC$23]+[.L90]*[.AC$25] -> 7.42962817706638 | N90: of:=IF([.E90]>0;1;0) -> 0 | O90: of:=IF([.F90]>0;1;0) -> 1 | P90: of:=IF([.G90]>0;1;0) -> 0 | Q90: of:=IF([.H90]>0;1;0) -> 0 | R90: of:=IF([.I90]>0;1;0) -> 0 | S90: of:=IF([.J90]>0;1;0) -> 0 | T90: of:=IF([.K90]>0;1;0) -> 0 | U90: of:=IF([.L90]>0;1;0) -> 0 | V90: of:=[.N90]*[.N$402]+[.O90]*[.O$402]+[.P90]*[.P$402]+[.Q90]*[.Q$402]+[.R90]*[.R$402]+[.S90]*[.S$402]+[.T90]*[.T$402]+[.U90]*[.U$402] -> 8.64365614657248 | W90: 94 | Y90: of:=[.W90]+[.X90] -> 94 | Z90: of:=[.Y90]/[.Y$401] -> 0.0299304640143083 | AA90: of:=[.D90]+[.M90]+[.V90]+[.Z90] -> 28.5785305731438 | AB90: of:=RANK([.AA90];[.AA$2:.AA$399];0) -> 89
A91: Craven | B91: 44353 | C91: of:=IF(SUM([.E91:.L91])>0;[.B91];0) -> 44353 | D91: of:=[.C91]/[.C$401] -> 1.67050898940565 | G91: 1 | H91: 1 | I91: 1 | K91: 1 | L91: 1 | M91: of:=[.E91]*[.AC$11]+[.F91]*[.AC$13]+[.G91]*[.AC$15]+[.H91]*[.AC$17]+[.I91]*[.AC$19]+[.J91]*[.AC$21]+[.K91]*[.AC$23]+[.L91]*[.AC$25] -> 4.1770743494719 | N91: of:=IF([.E91]>0;1;0) -> 0 | O91: of:=IF([.F91]>0;1;0) -> 0 | P91: of:=IF([.G91]>0;1;0) -> 1 | Q91: of:=IF([.H91]>0;1;0) -> 1 | R91: of:=IF([.I91]>0;1;0) -> 1 | S91: of:=IF([.J91]>0;1;0) -> 0 | T91: of:=IF([.K91]>0;1;0) -> 1 | U91: of:=IF([.L91]>0;1;0) -> 1 | V91: of:=[.N91]*[.N$402]+[.O91]*[.O$402]+[.P91]*[.P$402]+[.Q91]*[.Q$402]+[.R91]*[.R$402]+[.S91]*[.S$402]+[.T91]*[.T$402]+[.U91]*[.U$402] -> 2.03350799196213 | W91: of:=42+16459 -> 16501 | X91: of:=[.$AD$1] -> 44717 | Y91: of:=[.W91]+[.X91] -> 61218 | Z91: of:=[.Y91]/[.Y$401] -> 19.4923738939141 | AA91: of:=[.D91]+[.M91]+[.V91]+[.Z91] -> 27.3734652247538 | AB91: of:=RANK([.AA91];[.AA$2:.AA$399];0) -> 90
A92: Wandsworth | B92: 222899 | C92: of:=IF(SUM([.E92:.L92])>0;[.B92];0) -> 222899 | D92: of:=[.C92]/[.C$401] -> 8.39525586159967 | G92: 1 | K92: 1 | M92: of:=[.E92]*[.AC$11]+[.F92]*[.AC$13]+[.G92]*[.AC$15]+[.H92]*[.AC$17]+[.I92]*[.AC$19]+[.J92]*[.AC$21]+[.K92]*[.AC$23]+[.L92]*[.AC$25] -> 2.78326790277077 | N92: of:=IF([.E92]>0;1;0) -> 0 | O92: of:=IF([.F92]>0;1;0) -> 0 | P92: of:=IF([.G92]>0;1;0) -> 1 | Q92: of:=IF([.H92]>0;1;0) -> 0 | R92: of:=IF([.I92]>0;1;0) -> 0 | S92: of:=IF([.J92]>0;1;0) -> 0 | T92: of:=IF([.K92]>0;1;0) -> 1 | U92: of:=IF([.L92]>0;1;0) -> 0 | V92: of:=[.N92]*[.N$402]+[.O92]*[.O$402]+[.P92]*[.P$402]+[.Q92]*[.Q$402]+[.R92]*[.R$402]+[.S92]*[.S$402]+[.T92]*[.T$402]+[.U92]*[.U$402] -> 1.5062883605785 | W92: 720 | X92: of:=[.$AD$1] -> 44717 | Y92: of:=[.W92]+[.X92] -> 45437 | Z92: of:=[.Y92]/[.Y$401] -> 14.4675584406183 | AA92: of:=[.D92]+[.M92]+[.V92]+[.Z92] -> 27.1523705655673 | AB92: of:=RANK([.AA92];[.AA$2:.AA$399];0) -> 91
A93: Fife | B93: 278540 | C93: of:=IF(SUM([.E93:.L93])>0;[.B93];0) -> 278540 | D93: of:=[.C93]/[.C$401] -> 10.4909154715363 | F93: 1 | K93: 1 | M93: of:=[.E93]*[.AC$11]+[.F93]*[.AC$13]+[.G93]*[.AC$15]+[.H93]*[.AC$17]+[.I93]*[.AC$19]+[.J93]*[.AC$21]+[.K93]*[.AC$23]+[.L93]*[.AC$25] -> 7.47968861794637 | N93: of:=IF([.E93]>0;1;0) -> 0 | O93: of:=IF([.F93]>0;1;0) -> 1 | P93: of:=IF([.G93]>0;1;0) -> 0 | Q93: of:=IF([.H93]>0;1;0) -> 0 | R93: of:=IF([.I93]>0;1;0) -> 0 | S93: of:=IF([.J93]>0;1;0) -> 0 | T93: of:=IF([.K93]>0;1;0) -> 1 | U93: of:=IF([.L93]>0;1;0) -> 0 | V93: of:=[.N93]*[.N$402]+[.O93]*[.O$402]+[.P93]*[.P$402]+[.Q93]*[.Q$402]+[.R93]*[.R$402]+[.S93]*[.S$402]+[.T93]*[.T$402]+[.U93]*[.U$402] -> 8.66447956449209 | W93: 238 | Y93: of:=[.W93]+[.X93] -> 238 | Z93: of:=[.Y93]/[.Y$401] -> 0.0757813876106954 | AA93: of:=[.D93]+[.M93]+[.V93]+[.Z93] -> 26.7108650415855 | AB93: of:=RANK([.AA93];[.AA$2:.AA$399];0) -> 92
A94: Cardiff | B94: 242323 | C94: of:=IF(SUM([.E94:.L94])>0;[.B94];0) -> 242323 | D94: of:=[.C94]/[.C$401] -> 9.12684034540495 | F94: 1 | J94: 1 | M94: of:=[.E94]*[.AC$11]+[.F94]*[.AC$13]+[.G94]*[.AC$15]+[.H94]*[.AC$17]+[.I94]*[.AC$19]+[.J94]*[.AC$21]+[.K94]*[.AC$23]+[.L94]*[.AC$25] -> 7.5657065638351 | N94: of:=IF([.E94]>0;1;0) -> 0 | O94: of:=IF([.F94]>0;1;0) -> 1 | P94: of:=IF([.G94]>0;1;0) -> 0 | Q94: of:=IF([.H94]>0;1;0) -> 0 | R94: of:=IF([.I94]>0;1;0) -> 0 | S94: of:=IF([.J94]>0;1;0) -> 1 | T94: of:=IF([.K94]>0;1;0) -> 0 | U94: of:=IF([.L94]>0;1;0) -> 0 | V94: of:=[.N94]*[.N$402]+[.O94]*[.O$402]+[.P94]*[.P$402]+[.Q94]*[.Q$402]+[.R94]*[.R$402]+[.S94]*[.S$402]+[.T94]*[.T$402]+[.U94]*[.U$402] -> 8.81834755033414 | W94: 1035 | Y94: of:=[.W94]+[.X94] -> 1035 | Z94: of:=[.Y94]/[.Y$401] -> 0.329553513349032 | AA94: of:=[.D94]+[.M94]+[.V94]+[.Z94] -> 25.8404479729232 | AB94: of:=RANK([.AA94];[.AA$2:.AA$399];0) -> 93
A95: N Lanarks | B95: 254975 | C95: of:=IF(SUM([.E95:.L95])>0;[.B95];0) -> 254975 | D95: of:=[.C95]/[.C$401] -> 9.60336458804829 | F95: 1 | K95: 1 | M95: of:=[.E95]*[.AC$11]+[.F95]*[.AC$13]+[.G95]*[.AC$15]+[.H95]*[.AC$17]+[.I95]*[.AC$19]+[.J95]*[.AC$21]+[.K95]*[.AC$23]+[.L95]*[.AC$25] -> 7.47968861794637 | N95: of:=IF([.E95]>0;1;0) -> 0 | O95: of:=IF([.F95]>0;1;0) -> 1 | P95: of:=IF([.G95]>0;1;0) -> 0 | Q95: of:=IF([.H95]>0;1;0) -> 0 | R95: of:=IF([.I95]>0;1;0) -> 0 | S95: of:=IF([.J95]>0;1;0) -> 0 | T95: of:=IF([.K95]>0;1;0) -> 1 | U95: of:=IF([.L95]>0;1;0) -> 0 | V95: of:=[.N95]*[.N$402]+[.O95]*[.O$402]+[.P95]*[.P$402]+[.Q95]*[.Q$402]+[.R95]*[.R$402]+[.S95]*[.S$402]+[.T95]*[.T$402]+[.U95]*[.U$402] -> 8.66447956449209 | W95: 279 | Y95: of:=[.W95]+[.X95] -> 279 | Z95: of:=[.Y95]/[.Y$401] -> 0.0888361644680001 | AA95: of:=[.D95]+[.M95]+[.V95]+[.Z95] -> 25.8363689349548 | AB95: of:=RANK([.AA95];[.AA$2:.AA$399];0) -> 94
A96: Sheffield | B96: 401583 | C96: of:=IF(SUM([.E96:.L96])>0;[.B96];0) -> 401583 | D96: of:=[.C96]/[.C$401] -> 15.1252003583183 | G96: 1 | H96: 1 | I96: 1 | K96: 1 | L96: 1 | M96: of:=[.E96]*[.AC$11]+[.F96]*[.AC$13]+[.G96]*[.AC$15]+[.H96]*[.AC$17]+[.I96]*[.AC$19]+[.J96]*[.AC$21]+[.K96]*[.AC$23]+[.L96]*[.AC$25] -> 4.1770743494719 | N96: of:=IF([.E96]>0;1;0) -> 0 | O96: of:=IF([.F96]>0;1;0) -> 0 | P96: of:=IF([.G96]>0;1;0) -> 1 | Q96: of:=IF([.H96]>0;1;0) -> 1 | R96: of:=IF([.I96]>0;1;0) -> 1 | S96: of:=IF([.J96]>0;1;0) -> 0 | T96: of:=IF([.K96]>0;1;0) -> 1 | U96: of:=IF([.L96]>0;1;0) -> 1 | V96: of:=[.N96]*[.N$402]+[.O96]*[.O$402]+[.P96]*[.P$402]+[.Q96]*[.Q$402]+[.R96]*[.R$402]+[.S96]*[.S$402]+[.T96]*[.T$402]+[.U96]*[.U$402] -> 2.03350799196213 | W96: of:=2295+11745 -> 14040 | Y96: of:=[.W96]+[.X96] -> 14040 | Z96: of:=[.Y96]/[.Y$401] -> 4.47046505064774 | AA96: of:=[.D96]+[.M96]+[.V96]+[.Z96] -> 25.8062477504 | AB96: of:=RANK([.AA96];[.AA$2:.AA$399];0) -> 95
A97: Norfolk CC | B97: 676818 | C97: of:=IF(SUM([.E97:.L97])>0;[.B97];0) -> 676818 | D97: of:=[.C97]/[.C$401] -> 25.4916364888858 | J97: 1 | M97: of:=[.E97]*[.AC$11]+[.F97]*[.AC$13]+[.G97]*[.AC$15]+[.H97]*[.AC$17]+[.I97]*[.AC$19]+[.J97]*[.AC$21]+[.K97]*[.AC$23]+[.L97]*[.AC$25] -> 0.136078386768712 | N97: of:=IF([.E97]>0;1;0) -> 0 | O97: of:=IF([.F97]>0;1;0) -> 0 | P97: of:=IF([.G97]>0;1;0) -> 0 | Q97: of:=IF([.H97]>0;1;0) -> 0 | R97: of:=IF([.I97]>0;1;0) -> 0 | S97: of:=IF([.J97]>0;1;0) -> 1 | T97: of:=IF([.K97]>0;1;0) -> 0 | U97: of:=IF([.L97]>0;1;0) -> 0 | V97: of:=[.N97]*[.N$402]+[.O97]*[.O$402]+[.P97]*[.P$402]+[.Q97]*[.Q$402]+[.R97]*[.R$402]+[.S97]*[.S$402]+[.T97]*[.T$402]+[.U97]*[.U$402] -> 0.174691403761665 | Y97: of:=[.W97]+[.X97] -> 0 | Z97: of:=[.Y97]/[.Y$401] -> 0 | AA97: of:=[.D97]+[.M97]+[.V97]+[.Z97] -> 25.8024062794162 | AB97: of:=RANK([.AA97];[.AA$2:.AA$399];0) -> 96
A98: Havering | B98: 190501 | C98: of:=IF(SUM([.E98:.L98])>0;[.B98];0) -> 190501 | D98: of:=[.C98]/[.C$401] -> 7.17501934459374 | G98: 1 | K98: 1 | M98: of:=[.E98]*[.AC$11]+[.F98]*[.AC$13]+[.G98]*[.AC$15]+[.H98]*[.AC$17]+[.I98]*[.AC$19]+[.J98]*[.AC$21]+[.K98]*[.AC$23]+[.L98]*[.AC$25] -> 2.78326790277077 | N98: of:=IF([.E98]>0;1;0) -> 0 | O98: of:=IF([.F98]>0;1;0) -> 0 | P98: of:=IF([.G98]>0;1;0) -> 1 | Q98: of:=IF([.H98]>0;1;0) -> 0 | R98: of:=IF([.I98]>0;1;0) -> 0 | S98: of:=IF([.J98]>0;1;0) -> 0 | T98: of:=IF([.K98]>0;1;0) -> 1 | U98: of:=IF([.L98]>0;1;0) -> 0 | V98: of:=[.N98]*[.N$402]+[.O98]*[.O$402]+[.P98]*[.P$402]+[.Q98]*[.Q$402]+[.R98]*[.R$402]+[.S98]*[.S$402]+[.T98]*[.T$402]+[.U98]*[.U$402] -> 1.5062883605785 | W98: 60 | X98: of:=[.$AD$1] -> 44717 | Y98: of:=[.W98]+[.X98] -> 44777 | Z98: of:=[.Y98]/[.Y$401] -> 14.2574083741349 | AA98: of:=[.D98]+[.M98]+[.V98]+[.Z98] -> 25.7219839820779 | AB98: of:=RANK([.AA98];[.AA$2:.AA$399];0) -> 97
A99: S Lanarks | B99: 247833 | C99: of:=IF(SUM([.E99:.L99])>0;[.B99];0) -> 247833 | D99: of:=[.C99]/[.C$401] -> 9.3343686869292 | F99: 1 | K99: 1 | M99: of:=[.E99]*[.AC$11]+[.F99]*[.AC$13]+[.G99]*[.AC$15]+[.H99]*[.AC$17]+[.I99]*[.AC$19]+[.J99]*[.AC$21]+[.K99]*[.AC$23]+[.L99]*[.AC$25] -> 7.47968861794637 | N99: of:=IF([.E99]>0;1;0) -> 0 | O99: of:=IF([.F99]>0;1;0) -> 1 | P99: of:=IF([.G99]>0;1;0) -> 0 | Q99: of:=IF([.H99]>0;1;0) -> 0 | R99: of:=IF([.I99]>0;1;0) -> 0 | S99: of:=IF([.J99]>0;1;0) -> 0 | T99: of:=IF([.K99]>0;1;0) -> 1 | U99: of:=IF([.L99]>0;1;0) -> 0 | V99: of:=[.N99]*[.N$402]+[.O99]*[.O$402]+[.P99]*[.P$402]+[.Q99]*[.Q$402]+[.R99]*[.R$402]+[.S99]*[.S$402]+[.T99]*[.T$402]+[.U99]*[.U$402] -> 8.66447956449209 | W99: 257 | Y99: of:=[.W99]+[.X99] -> 257 | Z99: of:=[.Y99]/[.Y$401] -> 0.0818311622518853 | AA99: of:=[.D99]+[.M99]+[.V99]+[.Z99] -> 25.5603680316195 | AB99: of:=RANK([.AA99];[.AA$2:.AA$399];0) -> 98
A100: Bradford | B100: 358352 | C100: of:=IF(SUM([.E100:.L100])>0;[.B100];0) -> 358352 | D100: of:=[.C100]/[.C$401] -> 13.4969503161341 | G100: 1 | H100: 1 | I100: 1 | K100: 1 | L100: 1 | M100: of:=[.E100]*[.AC$11]+[.F100]*[.AC$13]+[.G100]*[.AC$15]+[.H100]*[.AC$17]+[.I100]*[.AC$19]+[.J100]*[.AC$21]+[.K100]*[.AC$23]+[.L100]*[.AC$25] -> 4.1770743494719 | N100: of:=IF([.E100]>0;1;0) -> 0 | O100: of:=IF([.F100]>0;1;0) -> 0 | P100: of:=IF([.G100]>0;1;0) -> 1 | Q100: of:=IF([.H100]>0;1;0) -> 1 | R100: of:=IF([.I100]>0;1;0) -> 1 | S100: of:=IF([.J100]>0;1;0) -> 0 | T100: of:=IF([.K100]>0;1;0) -> 1 | U100: of:=IF([.L100]>0;1;0) -> 1 | V100: of:=[.N100]*[.N$402]+[.O100]*[.O$402]+[.P100]*[.P$402]+[.Q100]*[.Q$402]+[.R100]*[.R$402]+[.S100]*[.S$402]+[.T100]*[.T$402]+[.U100]*[.U$402] -> 2.03350799196213 | W100: of:=472+17144 -> 17616 | Y100: of:=[.W100]+[.X100] -> 17616 | Z100: of:=[.Y100]/[.Y$401] -> 5.60909631995802 | AA100: of:=[.D100]+[.M100]+[.V100]+[.Z100] -> 25.3166289775261 | AB100: of:=RANK([.AA100];[.AA$2:.AA$399];0) -> 99
A101: Staffs CC | B101: 658766 | C101: of:=IF(SUM([.E101:.L101])>0;[.B101];0) -> 658766 | D101: of:=[.C101]/[.C$401] -> 24.8117269387596 | J101: 1 | M101: of:=[.E101]*[.AC$11]+[.F101]*[.AC$13]+[.G101]*[.AC$15]+[.H101]*[.AC$17]+[.I101]*[.AC$19]+[.J101]*[.AC$21]+[.K101]*[.AC$23]+[.L101]*[.AC$25] -> 0.136078386768712 | N101: of:=IF([.E101]>0;1;0) -> 0 | O101: of:=IF([.F101]>0;1;0) -> 0 | P101: of:=IF([.G101]>0;1;0) -> 0 | Q101: of:=IF([.H101]>0;1;0) -> 0 | R101: of:=IF([.I101]>0;1;0) -> 0 | S101: of:=IF([.J101]>0;1;0) -> 1 | T101: of:=IF([.K101]>0;1;0) -> 0 | U101: of:=IF([.L101]>0;1;0) -> 0 | V101: of:=[.N101]*[.N$402]+[.O101]*[.O$402]+[.P101]*[.P$402]+[.Q101]*[.Q$402]+[.R101]*[.R$402]+[.S101]*[.S$402]+[.T101]*[.T$402]+[.U101]*[.U$402] -> 0.174691403761665 | Y101: of:=[.W101]+[.X101] -> 0 | Z101: of:=[.Y101]/[.Y$401] -> 0 | AA101: of:=[.D101]+[.M101]+[.V101]+[.Z101] -> 25.1224967292899 | AB101: of:=RANK([.AA101];[.AA$2:.AA$399];0) -> 100
A102: Doncaster | B102: 225134 | C102: of:=IF(SUM([.E102:.L102])>0;[.B102];0) -> 225134 | D102: of:=[.C102]/[.C$401] -> 8.47943478053011 | F102: 1 | J102: 1 | M102: of:=[.E102]*[.AC$11]+[.F102]*[.AC$13]+[.G102]*[.AC$15]+[.H102]*[.AC$17]+[.I102]*[.AC$19]+[.J102]*[.AC$21]+[.K102]*[.AC$23]+[.L102]*[.AC$25] -> 7.5657065638351 | N102: of:=IF([.E102]>0;1;0) -> 0 | O102: of:=IF([.F102]>0;1;0) -> 1 | P102: of:=IF([.G102]>0;1;0) -> 0 | Q102: of:=IF([.H102]>0;1;0) -> 0 | R102: of:=IF([.I102]>0;1;0) -> 0 | S102: of:=IF([.J102]>0;1;0) -> 1 | T102: of:=IF([.K102]>0;1;0) -> 0 | U102: of:=IF([.L102]>0;1;0) -> 0 | V102: of:=[.N102]*[.N$402]+[.O102]*[.O$402]+[.P102]*[.P$402]+[.Q102]*[.Q$402]+[.R102]*[.R$402]+[.S102]*[.S$402]+[.T102]*[.T$402]+[.U102]*[.U$402] -> 8.81834755033414 | W102: 116 | Y102: of:=[.W102]+[.X102] -> 116 | Z102: of:=[.Y102]/[.Y$401] -> 0.036935466230423 | AA102: of:=[.D102]+[.M102]+[.V102]+[.Z102] -> 24.9004243609298 | AB102: of:=RANK([.AA102];[.AA$2:.AA$399];0) -> 101
A103: Aberdeenshire | B103: 200533 | C103: of:=IF(SUM([.E103:.L103])>0;[.B103];0) -> 200533 | D103: of:=[.C103]/[.C$401] -> 7.55286404916203 | F103: 1 | K103: 1 | M103: of:=[.E103]*[.AC$11]+[.F103]*[.AC$13]+[.G103]*[.AC$15]+[.H103]*[.AC$17]+[.I103]*[.AC$19]+[.J103]*[.AC$21]+[.K103]*[.AC$23]+[.L103]*[.AC$25] -> 7.47968861794637 | N103: of:=IF([.E103]>0;1;0) -> 0 | O103: of:=IF([.F103]>0;1;0) -> 1 | P103: of:=IF([.G103]>0;1;0) -> 0 | Q103: of:=IF([.H103]>0;1;0) -> 0 | R103: of:=IF([.I103]>0;1;0) -> 0 | S103: of:=IF([.J103]>0;1;0) -> 0 | T103: of:=IF([.K103]>0;1;0) -> 1 | U103: of:=IF([.L103]>0;1;0) -> 0 | V103: of:=[.N103]*[.N$402]+[.O103]*[.O$402]+[.P103]*[.P$402]+[.Q103]*[.Q$402]+[.R103]*[.R$402]+[.S103]*[.S$402]+[.T103]*[.T$402]+[.U103]*[.U$402] -> 8.66447956449209 | W103: 499 | Y103: of:=[.W103]+[.X103] -> 499 | Z103: of:=[.Y103]/[.Y$401] -> 0.158886186629147 | AA103: of:=[.D103]+[.M103]+[.V103]+[.Z103] -> 23.8559184182296 | AB103: of:=RANK([.AA103];[.AA$2:.AA$399];0) -> 102
A104: Kirklees | B104: 305722 | C104: of:=IF(SUM([.E104:.L104])>0;[.B104];0) -> 305722 | D104: of:=[.C104]/[.C$401] -> 11.5146968470921 | G104: 1 | H104: 1 | I104: 1 | K104: 1 | L104: 1 | M104: of:=[.E104]*[.AC$11]+[.F104]*[.AC$13]+[.G104]*[.AC$15]+[.H104]*[.AC$17]+[.I104]*[.AC$19]+[.J104]*[.AC$21]+[.K104]*[.AC$23]+[.L104]*[.AC$25] -> 4.1770743494719 | N104: of:=IF([.E104]>0;1;0) -> 0 | O104: of:=IF([.F104]>0;1;0) -> 0 | P104: of:=IF([.G104]>0;1;0) -> 1 | Q104: of:=IF([.H104]>0;1;0) -> 1 | R104: of:=IF([.I104]>0;1;0) -> 1 | S104: of:=IF([.J104]>0;1;0) -> 0 | T104: of:=IF([.K104]>0;1;0) -> 1 | U104: of:=IF([.L104]>0;1;0) -> 1 | V104: of:=[.N104]*[.N$402]+[.O104]*[.O$402]+[.P104]*[.P$402]+[.Q104]*[.Q$402]+[.R104]*[.R$402]+[.S104]*[.S$402]+[.T104]*[.T$402]+[.U104]*[.U$402] -> 2.03350799196213 | W104: of:=453+17319 -> 17772 | Y104: of:=[.W104]+[.X104] -> 17772 | Z104: of:=[.Y104]/[.Y$401] -> 5.65876815385411 | AA104: of:=[.D104]+[.M104]+[.V104]+[.Z104] -> 23.3840473423802 | AB104: of:=RANK([.AA104];[.AA$2:.AA$399];0) -> 103
A105: Notts CC | B105: 611659 | C105: of:=IF(SUM([.E105:.L105])>0;[.B105];0) -> 611659 | D105: of:=[.C105]/[.C$401] -> 23.0374914425376 | J105: 1 | M105: of:=[.E105]*[.AC$11]+[.F105]*[.AC$13]+[.G105]*[.AC$15]+[.H105]*[.AC$17]+[.I105]*[.AC$19]+[.J105]*[.AC$21]+[.K105]*[.AC$23]+[.L105]*[.AC$25] -> 0.136078386768712 | N105: of:=IF([.E105]>0;1;0) -> 0 | O105: of:=IF([.F105]>0;1;0) -> 0 | P105: of:=IF([.G105]>0;1;0) -> 0 | Q105: of:=IF([.H105]>0;1;0) -> 0 | R105: of:=IF([.I105]>0;1;0) -> 0 | S105: of:=IF([.J105]>0;1;0) -> 1 | T105: of:=IF([.K105]>0;1;0) -> 0 | U105: of:=IF([.L105]>0;1;0) -> 0 | V105: of:=[.N105]*[.N$402]+[.O105]*[.O$402]+[.P105]*[.P$402]+[.Q105]*[.Q$402]+[.R105]*[.R$402]+[.S105]*[.S$402]+[.T105]*[.T$402]+[.U105]*[.U$402] -> 0.174691403761665 | Y105: of:=[.W105]+[.X105] -> 0 | Z105: of:=[.Y105]/[.Y$401] -> 0 | AA105: of:=[.D105]+[.M105]+[.V105]+[.Z105] -> 23.348261233068 | AB105: of:=RANK([.AA105];[.AA$2:.AA$399];0) -> 104
A106: Manchester | B106: 362737 | C106: of:=IF(SUM([.E106:.L106])>0;[.B106];0) -> 362737 | D106: of:=[.C106]/[.C$401] -> 13.6621067185994 | G106: 1 | H106: 1 | I106: 1 | K106: 1 | L106: 1 | M106: of:=[.E106]*[.AC$11]+[.F106]*[.AC$13]+[.G106]*[.AC$15]+[.H106]*[.AC$17]+[.I106]*[.AC$19]+[.J106]*[.AC$21]+[.K106]*[.AC$23]+[.L106]*[.AC$25] -> 4.1770743494719 | N106: of:=IF([.E106]>0;1;0) -> 0 | O106: of:=IF([.F106]>0;1;0) -> 0 | P106: of:=IF([.G106]>0;1;0) -> 1 | Q106: of:=IF([.H106]>0;1;0) -> 1 | R106: of:=IF([.I106]>0;1;0) -> 1 | S106: of:=IF([.J106]>0;1;0) -> 0 | T106: of:=IF([.K106]>0;1;0) -> 1 | U106: of:=IF([.L106]>0;1;0) -> 1 | V106: of:=[.N106]*[.N$402]+[.O106]*[.O$402]+[.P106]*[.P$402]+[.Q106]*[.Q$402]+[.R106]*[.R$402]+[.S106]*[.S$402]+[.T106]*[.T$402]+[.U106]*[.U$402] -> 2.03350799196213 | W106: of:=69+10846 -> 10915 | Y106: of:=[.W106]+[.X106] -> 10915 | Z106: of:=[.Y106]/[.Y$401] -> 3.47543632676782 | AA106: of:=[.D106]+[.M106]+[.V106]+[.Z106] -> 23.3481253868012 | AB106: of:=RANK([.AA106];[.AA$2:.AA$399];0) -> 105
A107: Devon CC | B107: 610335 | C107: of:=IF(SUM([.E107:.L107])>0;[.B107];0) -> 610335 | D107: of:=[.C107]/[.C$401] -> 22.9876243782585 | J107: 1 | M107: of:=[.E107]*[.AC$11]+[.F107]*[.AC$13]+[.G107]*[.AC$15]+[.H107]*[.AC$17]+[.I107]*[.AC$19]+[.J107]*[.AC$21]+[.K107]*[.AC$23]+[.L107]*[.AC$25] -> 0.136078386768712 | N107: of:=IF([.E107]>0;1;0) -> 0 | O107: of:=IF([.F107]>0;1;0) -> 0 | P107: of:=IF([.G107]>0;1;0) -> 0 | Q107: of:=IF([.H107]>0;1;0) -> 0 | R107: of:=IF([.I107]>0;1;0) -> 0 | S107: of:=IF([.J107]>0;1;0) -> 1 | T107: of:=IF([.K107]>0;1;0) -> 0 | U107: of:=IF([.L107]>0;1;0) -> 0 | V107: of:=[.N107]*[.N$402]+[.O107]*[.O$402]+[.P107]*[.P$402]+[.Q107]*[.Q$402]+[.R107]*[.R$402]+[.S107]*[.S$402]+[.T107]*[.T$402]+[.U107]*[.U$402] -> 0.174691403761665 | Y107: of:=[.W107]+[.X107] -> 0 | Z107: of:=[.Y107]/[.Y$401] -> 0 | AA107: of:=[.D107]+[.M107]+[.V107]+[.Z107] -> 23.2983941687889 | AB107: of:=RANK([.AA107];[.AA$2:.AA$399];0) -> 106
A108: Swansea | B108: 173207 | C108: of:=IF(SUM([.E108:.L108])>0;[.B108];0) -> 173207 | D108: of:=[.C108]/[.C$401] -> 6.52365906540673 | F108: 1 | J108: 1 | M108: of:=[.E108]*[.AC$11]+[.F108]*[.AC$13]+[.G108]*[.AC$15]+[.H108]*[.AC$17]+[.I108]*[.AC$19]+[.J108]*[.AC$21]+[.K108]*[.AC$23]+[.L108]*[.AC$25] -> 7.5657065638351 | N108: of:=IF([.E108]>0;1;0) -> 0 | O108: of:=IF([.F108]>0;1;0) -> 1 | P108: of:=IF([.G108]>0;1;0) -> 0 | Q108: of:=IF([.H108]>0;1;0) -> 0 | R108: of:=IF([.I108]>0;1;0) -> 0 | S108: of:=IF([.J108]>0;1;0) -> 1 | T108: of:=IF([.K108]>0;1;0) -> 0 | U108: of:=IF([.L108]>0;1;0) -> 0 | V108: of:=[.N108]*[.N$402]+[.O108]*[.O$402]+[.P108]*[.P$402]+[.Q108]*[.Q$402]+[.R108]*[.R$402]+[.S108]*[.S$402]+[.T108]*[.T$402]+[.U108]*[.U$402] -> 8.81834755033414 | W108: 1004 | Y108: of:=[.W108]+[.X108] -> 1004 | Z108: of:=[.Y108]/[.Y$401] -> 0.319682828408144 | AA108: of:=[.D108]+[.M108]+[.V108]+[.Z108] -> 23.2273960079841 | AB108: of:=RANK([.AA108];[.AA$2:.AA$399];0) -> 107
A109: Highland | B109: 184981 | C109: of:=IF(SUM([.E109:.L109])>0;[.B109];0) -> 184981 | D109: of:=[.C109]/[.C$401] -> 6.96711436361118 | F109: 1 | K109: 1 | M109: of:=[.E109]*[.AC$11]+[.F109]*[.AC$13]+[.G109]*[.AC$15]+[.H109]*[.AC$17]+[.I109]*[.AC$19]+[.J109]*[.AC$21]+[.K109]*[.AC$23]+[.L109]*[.AC$25] -> 7.47968861794637 | N109: of:=IF([.E109]>0;1;0) -> 0 | O109: of:=IF([.F109]>0;1;0) -> 1 | P109: of:=IF([.G109]>0;1;0) -> 0 | Q109: of:=IF([.H109]>0;1;0) -> 0 | R109: of:=IF([.I109]>0;1;0) -> 0 | S109: of:=IF([.J109]>0;1;0) -> 0 | T109: of:=IF([.K109]>0;1;0) -> 1 | U109: of:=IF([.L109]>0;1;0) -> 0 | V109: of:=[.N109]*[.N$402]+[.O109]*[.O$402]+[.P109]*[.P$402]+[.Q109]*[.Q$402]+[.R109]*[.R$402]+[.S109]*[.S$402]+[.T109]*[.T$402]+[.U109]*[.U$402] -> 8.66447956449209 | W109: 263 | Y109: of:=[.W109]+[.X109] -> 263 | Z109: of:=[.Y109]/[.Y$401] -> 0.0837416174017348 | AA109: of:=[.D109]+[.M109]+[.V109]+[.Z109] -> 23.1950241634514 | AB109: of:=RANK([.AA109];[.AA$2:.AA$399];0) -> 108
A110: Derbys CC | B110: 607158 | C110: of:=IF(SUM([.E110:.L110])>0;[.B110];0) -> 607158 | D110: of:=[.C110]/[.C$401] -> 22.867966022356 | J110: 1 | M110: of:=[.E110]*[.AC$11]+[.F110]*[.AC$13]+[.G110]*[.AC$15]+[.H110]*[.AC$17]+[.I110]*[.AC$19]+[.J110]*[.AC$21]+[.K110]*[.AC$23]+[.L110]*[.AC$25] -> 0.136078386768712 | N110: of:=IF([.E110]>0;1;0) -> 0 | O110: of:=IF([.F110]>0;1;0) -> 0 | P110: of:=IF([.G110]>0;1;0) -> 0 | Q110: of:=IF([.H110]>0;1;0) -> 0 | R110: of:=IF([.I110]>0;1;0) -> 0 | S110: of:=IF([.J110]>0;1;0) -> 1 | T110: of:=IF([.K110]>0;1;0) -> 0 | U110: of:=IF([.L110]>0;1;0) -> 0 | V110: of:=[.N110]*[.N$402]+[.O110]*[.O$402]+[.P110]*[.P$402]+[.Q110]*[.Q$402]+[.R110]*[.R$402]+[.S110]*[.S$402]+[.T110]*[.T$402]+[.U110]*[.U$402] -> 0.174691403761665 | Y110: of:=[.W110]+[.X110] -> 0 | Z110: of:=[.Y110]/[.Y$401] -> 0 | AA110: of:=[.D110]+[.M110]+[.V110]+[.Z110] -> 23.1787358128864 | AB110: of:=RANK([.AA110];[.AA$2:.AA$399];0) -> 109
A111: Rhondda, Cynon, Taf | B111: 169968 | C111: of:=IF(SUM([.E111:.L111])>0;[.B111];0) -> 169968 | D111: of:=[.C111]/[.C$401] -> 6.4016655448628 | F111: 1 | J111: 1 | M111: of:=[.E111]*[.AC$11]+[.F111]*[.AC$13]+[.G111]*[.AC$15]+[.H111]*[.AC$17]+[.I111]*[.AC$19]+[.J111]*[.AC$21]+[.K111]*[.AC$23]+[.L111]*[.AC$25] -> 7.5657065638351 | N111: of:=IF([.E111]>0;1;0) -> 0 | O111: of:=IF([.F111]>0;1;0) -> 1 | P111: of:=IF([.G111]>0;1;0) -> 0 | Q111: of:=IF([.H111]>0;1;0) -> 0 | R111: of:=IF([.I111]>0;1;0) -> 0 | S111: of:=IF([.J111]>0;1;0) -> 1 | T111: of:=IF([.K111]>0;1;0) -> 0 | U111: of:=IF([.L111]>0;1;0) -> 0 | V111: of:=[.N111]*[.N$402]+[.O111]*[.O$402]+[.P111]*[.P$402]+[.Q111]*[.Q$402]+[.R111]*[.R$402]+[.S111]*[.S$402]+[.T111]*[.T$402]+[.U111]*[.U$402] -> 8.81834755033414 | W111: 1011 | Y111: of:=[.W111]+[.X111] -> 1011 | Z111: of:=[.Y111]/[.Y$401] -> 0.321911692749635 | AA111: of:=[.D111]+[.M111]+[.V111]+[.Z111] -> 23.1076313517817 | AB111: of:=RANK([.AA111];[.AA$2:.AA$399];0) -> 110
A112: Liverpool | B112: 320970 | C112: of:=IF(SUM([.E112:.L112])>0;[.B112];0) -> 320970 | D112: of:=[.C112]/[.C$401] -> 12.0889966931105 | G112: 1 | H112: 1 | I112: 1 | K112: 1 | L112: 1 | M112: of:=[.E112]*[.AC$11]+[.F112]*[.AC$13]+[.G112]*[.AC$15]+[.H112]*[.AC$17]+[.I112]*[.AC$19]+[.J112]*[.AC$21]+[.K112]*[.AC$23]+[.L112]*[.AC$25] -> 4.1770743494719 | N112: of:=IF([.E112]>0;1;0) -> 0 | O112: of:=IF([.F112]>0;1;0) -> 0 | P112: of:=IF([.G112]>0;1;0) -> 1 | Q112: of:=IF([.H112]>0;1;0) -> 1 | R112: of:=IF([.I112]>0;1;0) -> 1 | S112: of:=IF([.J112]>0;1;0) -> 0 | T112: of:=IF([.K112]>0;1;0) -> 1 | U112: of:=IF([.L112]>0;1;0) -> 1 | V112: of:=[.N112]*[.N$402]+[.O112]*[.O$402]+[.P112]*[.P$402]+[.Q112]*[.Q$402]+[.R112]*[.R$402]+[.S112]*[.S$402]+[.T112]*[.T$402]+[.U112]*[.U$402] -> 2.03350799196213 | W112: of:=3218+11429 -> 14647 | Y112: of:=[.W112]+[.X112] -> 14647 | Z112: of:=[.Y112]/[.Y$401] -> 4.66373942997418 | AA112: of:=[.D112]+[.M112]+[.V112]+[.Z112] -> 22.9633184645188 | AB112: of:=RANK([.AA112];[.AA$2:.AA$399];0) -> 111
A113: Aberdeen | B113: 159288 | C113: of:=IF(SUM([.E113:.L113])>0;[.B113];0) -> 159288 | D113: of:=[.C113]/[.C$401] -> 5.99941460339656 | F113: 1 | K113: 1 | M113: of:=[.E113]*[.AC$11]+[.F113]*[.AC$13]+[.G113]*[.AC$15]+[.H113]*[.AC$17]+[.I113]*[.AC$19]+[.J113]*[.AC$21]+[.K113]*[.AC$23]+[.L113]*[.AC$25] -> 7.47968861794637 | N113: of:=IF([.E113]>0;1;0) -> 0 | O113: of:=IF([.F113]>0;1;0) -> 1 | P113: of:=IF([.G113]>0;1;0) -> 0 | Q113: of:=IF([.H113]>0;1;0) -> 0 | R113: of:=IF([.I113]>0;1;0) -> 0 | S113: of:=IF([.J113]>0;1;0) -> 0 | T113: of:=IF([.K113]>0;1;0) -> 1 | U113: of:=IF([.L113]>0;1;0) -> 0 | V113: of:=[.N113]*[.N$402]+[.O113]*[.O$402]+[.P113]*[.P$402]+[.Q113]*[.Q$402]+[.R113]*[.R$402]+[.S113]*[.S$402]+[.T113]*[.T$402]+[.U113]*[.U$402] -> 8.66447956449209 | W113: 1018 | Y113: of:=[.W113]+[.X113] -> 1018 | Z113: of:=[.Y113]/[.Y$401] -> 0.324140557091126 | AA113: of:=[.D113]+[.M113]+[.V113]+[.Z113] -> 22.4677233429261 | AB113: of:=RANK([.AA113];[.AA$2:.AA$399];0) -> 112
A114: Carmarthenshire | B114: 140013 | C114: of:=IF(SUM([.E114:.L114])>0;[.B114];0) -> 140013 | D114: of:=[.C114]/[.C$401] -> 5.27344204751998 | F114: 1 | J114: 1 | M114: of:=[.E114]*[.AC$11]+[.F114]*[.AC$13]+[.G114]*[.AC$15]+[.H114]*[.AC$17]+[.I114]*[.AC$19]+[.J114]*[.AC$21]+[.K114]*[.AC$23]+[.L114]*[.AC$25] -> 7.5657065638351 | N114: of:=IF([.E114]>0;1;0) -> 0 | O114: of:=IF([.F114]>0;1;0) -> 1 | P114: of:=IF([.G114]>0;1;0) -> 0 | Q114: of:=IF([.H114]>0;1;0) -> 0 | R114: of:=IF([.I114]>0;1;0) -> 0 | S114: of:=IF([.J114]>0;1;0) -> 1 | T114: of:=IF([.K114]>0;1;0) -> 0 | U114: of:=IF([.L114]>0;1;0) -> 0 | V114: of:=[.N114]*[.N$402]+[.O114]*[.O$402]+[.P114]*[.P$402]+[.Q114]*[.Q$402]+[.R114]*[.R$402]+[.S114]*[.S$402]+[.T114]*[.T$402]+[.U114]*[.U$402] -> 8.81834755033414 | W114: 588 | Y114: of:=[.W114]+[.X114] -> 588 | Z114: of:=[.Y114]/[.Y$401] -> 0.187224604685247 | AA114: of:=[.D114]+[.M114]+[.V114]+[.Z114] -> 21.8447207663745 | AB114: of:=RANK([.AA114];[.AA$2:.AA$399];0) -> 113
A115: Renfs | B115: 138535 | C115: of:=IF(SUM([.E115:.L115])>0;[.B115];0) -> 138535 | D115: of:=[.C115]/[.C$401] -> 5.21777473558298 | F115: 1 | K115: 1 | M115: of:=[.E115]*[.AC$11]+[.F115]*[.AC$13]+[.G115]*[.AC$15]+[.H115]*[.AC$17]+[.I115]*[.AC$19]+[.J115]*[.AC$21]+[.K115]*[.AC$23]+[.L115]*[.AC$25] -> 7.47968861794637 | N115: of:=IF([.E115]>0;1;0) -> 0 | O115: of:=IF([.F115]>0;1;0) -> 1 | P115: of:=IF([.G115]>0;1;0) -> 0 | Q115: of:=IF([.H115]>0;1;0) -> 0 | R115: of:=IF([.I115]>0;1;0) -> 0 | S115: of:=IF([.J115]>0;1;0) -> 0 | T115: of:=IF([.K115]>0;1;0) -> 1 | U115: of:=IF([.L115]>0;1;0) -> 0 | V115: of:=[.N115]*[.N$402]+[.O115]*[.O$402]+[.P115]*[.P$402]+[.Q115]*[.Q$402]+[.R115]*[.R$402]+[.S115]*[.S$402]+[.T115]*[.T$402]+[.U115]*[.U$402] -> 8.66447956449209 | W115: 1047 | Y115: of:=[.W115]+[.X115] -> 1047 | Z115: of:=[.Y115]/[.Y$401] -> 0.333374423648731 | AA115: of:=[.D115]+[.M115]+[.V115]+[.Z115] -> 21.6953173416702 | AB115: of:=RANK([.AA115];[.AA$2:.AA$399];0) -> 114
A116: W Lothian | B116: 138222 | C116: of:=IF(SUM([.E116:.L116])>0;[.B116];0) -> 138222 | D116: of:=[.C116]/[.C$401] -> 5.20598592053814 | F116: 1 | K116: 1 | M116: of:=[.E116]*[.AC$11]+[.F116]*[.AC$13]+[.G116]*[.AC$15]+[.H116]*[.AC$17]+[.I116]*[.AC$19]+[.J116]*[.AC$21]+[.K116]*[.AC$23]+[.L116]*[.AC$25] -> 7.47968861794637 | N116: of:=IF([.E116]>0;1;0) -> 0 | O116: of:=IF([.F116]>0;1;0) -> 1 | P116: of:=IF([.G116]>0;1;0) -> 0 | Q116: of:=IF([.H116]>0;1;0) -> 0 | R116: of:=IF([.I116]>0;1;0) -> 0 | S116: of:=IF([.J116]>0;1;0) -> 0 | T116: of:=IF([.K116]>0;1;0) -> 1 | U116: of:=IF([.L116]>0;1;0) -> 0 | V116: of:=[.N116]*[.N$402]+[.O116]*[.O$402]+[.P116]*[.P$402]+[.Q116]*[.Q$402]+[.R116]*[.R$402]+[.S116]*[.S$402]+[.T116]*[.T$402]+[.U116]*[.U$402] -> 8.66447956449209 | W116: 1033 | Y116: of:=[.W116]+[.X116] -> 1033 | Z116: of:=[.Y116]/[.Y$401] -> 0.328916694965749 | AA116: of:=[.D116]+[.M116]+[.V116]+[.Z116] -> 21.6790707979423 | AB116: of:=RANK([.AA116];[.AA$2:.AA$399];0) -> 115
A117: Caerphilly | B117: 129964 | C117: of:=IF(SUM([.E117:.L117])>0;[.B117];0) -> 129964 | D117: of:=[.C117]/[.C$401] -> 4.89495705587257 | F117: 1 | J117: 1 | M117: of:=[.E117]*[.AC$11]+[.F117]*[.AC$13]+[.G117]*[.AC$15]+[.H117]*[.AC$17]+[.I117]*[.AC$19]+[.J117]*[.AC$21]+[.K117]*[.AC$23]+[.L117]*[.AC$25] -> 7.5657065638351 | N117: of:=IF([.E117]>0;1;0) -> 0 | O117: of:=IF([.F117]>0;1;0) -> 1 | P117: of:=IF([.G117]>0;1;0) -> 0 | Q117: of:=IF([.H117]>0;1;0) -> 0 | R117: of:=IF([.I117]>0;1;0) -> 0 | S117: of:=IF([.J117]>0;1;0) -> 1 | T117: of:=IF([.K117]>0;1;0) -> 0 | U117: of:=IF([.L117]>0;1;0) -> 0 | V117: of:=[.N117]*[.N$402]+[.O117]*[.O$402]+[.P117]*[.P$402]+[.Q117]*[.Q$402]+[.R117]*[.R$402]+[.S117]*[.S$402]+[.T117]*[.T$402]+[.U117]*[.U$402] -> 8.81834755033414 | W117: 1040 | Y117: of:=[.W117]+[.X117] -> 1040 | Z117: of:=[.Y117]/[.Y$401] -> 0.33114555930724 | AA117: of:=[.D117]+[.M117]+[.V117]+[.Z117] -> 21.610156729349 | AB117: of:=RANK([.AA117];[.AA$2:.AA$399];0) -> 116
A118: Gosport | B118: 61958 | C118: of:=IF(SUM([.E118:.L118])>0;[.B118];0) -> 61958 | D118: of:=[.C118]/[.C$401] -> 2.33358275574584 | G118: 1 | I118: 1 | K118: 1 | M118: of:=[.E118]*[.AC$11]+[.F118]*[.AC$13]+[.G118]*[.AC$15]+[.H118]*[.AC$17]+[.I118]*[.AC$19]+[.J118]*[.AC$21]+[.K118]*[.AC$23]+[.L118]*[.AC$25] -> 3.15316730877018 | N118: of:=IF([.E118]>0;1;0) -> 0 | O118: of:=IF([.F118]>0;1;0) -> 0 | P118: of:=IF([.G118]>0;1;0) -> 1 | Q118: of:=IF([.H118]>0;1;0) -> 0 | R118: of:=IF([.I118]>0;1;0) -> 1 | S118: of:=IF([.J118]>0;1;0) -> 0 | T118: of:=IF([.K118]>0;1;0) -> 1 | U118: of:=IF([.L118]>0;1;0) -> 0 | V118: of:=[.N118]*[.N$402]+[.O118]*[.O$402]+[.P118]*[.P$402]+[.Q118]*[.Q$402]+[.R118]*[.R$402]+[.S118]*[.S$402]+[.T118]*[.T$402]+[.U118]*[.U$402] -> 1.7248749254129 | W118: 480 | X118: of:=[.$AD$1] -> 44717 | Y118: of:=[.W118]+[.X118] -> 45197 | Z118: of:=[.Y118]/[.Y$401] -> 14.3911402346244 | AA118: of:=[.D118]+[.M118]+[.V118]+[.Z118] -> 21.6027652245533 | AB118: of:=RANK([.AA118];[.AA$2:.AA$399];0) -> 117
A119: Suffolk CC | B119: 563692 | C119: of:=IF(SUM([.E119:.L119])>0;[.B119];0) -> 563692 | D119: of:=[.C119]/[.C$401] -> 21.2308649529017 | J119: 1 | M119: of:=[.E119]*[.AC$11]+[.F119]*[.AC$13]+[.G119]*[.AC$15]+[.H119]*[.AC$17]+[.I119]*[.AC$19]+[.J119]*[.AC$21]+[.K119]*[.AC$23]+[.L119]*[.AC$25] -> 0.136078386768712 | N119: of:=IF([.E119]>0;1;0) -> 0 | O119: of:=IF([.F119]>0;1;0) -> 0 | P119: of:=IF([.G119]>0;1;0) -> 0 | Q119: of:=IF([.H119]>0;1;0) -> 0 | R119: of:=IF([.I119]>0;1;0) -> 0 | S119: of:=IF([.J119]>0;1;0) -> 1 | T119: of:=IF([.K119]>0;1;0) -> 0 | U119: of:=IF([.L119]>0;1;0) -> 0 | V119: of:=[.N119]*[.N$402]+[.O119]*[.O$402]+[.P119]*[.P$402]+[.Q119]*[.Q$402]+[.R119]*[.R$402]+[.S119]*[.S$402]+[.T119]*[.T$402]+[.U119]*[.U$402] -> 0.174691403761665 | Y119: of:=[.W119]+[.X119] -> 0 | Z119: of:=[.Y119]/[.Y$401] -> 0 | AA119: of:=[.D119]+[.M119]+[.V119]+[.Z119] -> 21.5416347434321 | AB119: of:=RANK([.AA119];[.AA$2:.AA$399];0) -> 118
A120: Northants CC | B120: 552844 | C120: of:=IF(SUM([.E120:.L120])>0;[.B120];0) -> 552844 | D120: of:=[.C120]/[.C$401] -> 20.822286468536 | J120: 1 | M120: of:=[.E120]*[.AC$11]+[.F120]*[.AC$13]+[.G120]*[.AC$15]+[.H120]*[.AC$17]+[.I120]*[.AC$19]+[.J120]*[.AC$21]+[.K120]*[.AC$23]+[.L120]*[.AC$25] -> 0.136078386768712 | N120: of:=IF([.E120]>0;1;0) -> 0 | O120: of:=IF([.F120]>0;1;0) -> 0 | P120: of:=IF([.G120]>0;1;0) -> 0 | Q120: of:=IF([.H120]>0;1;0) -> 0 | R120: of:=IF([.I120]>0;1;0) -> 0 | S120: of:=IF([.J120]>0;1;0) -> 1 | T120: of:=IF([.K120]>0;1;0) -> 0 | U120: of:=IF([.L120]>0;1;0) -> 0 | V120: of:=[.N120]*[.N$402]+[.O120]*[.O$402]+[.P120]*[.P$402]+[.Q120]*[.Q$402]+[.R120]*[.R$402]+[.S120]*[.S$402]+[.T120]*[.T$402]+[.U120]*[.U$402] -> 0.174691403761665 | Y120: of:=[.W120]+[.X120] -> 0 | Z120: of:=[.Y120]/[.Y$401] -> 0 | AA120: of:=[.D120]+[.M120]+[.V120]+[.Z120] -> 21.1330562590664 | AB120: of:=RANK([.AA120];[.AA$2:.AA$399];0) -> 119
A121: Falkirk | B121: 122282 | C121: of:=IF(SUM([.E121:.L121])>0;[.B121];0) -> 122282 | D121: of:=[.C121]/[.C$401] -> 4.60562262400518 | F121: 1 | K121: 1 | M121: of:=[.E121]*[.AC$11]+[.F121]*[.AC$13]+[.G121]*[.AC$15]+[.H121]*[.AC$17]+[.I121]*[.AC$19]+[.J121]*[.AC$21]+[.K121]*[.AC$23]+[.L121]*[.AC$25] -> 7.47968861794637 | N121: of:=IF([.E121]>0;1;0) -> 0 | O121: of:=IF([.F121]>0;1;0) -> 1 | P121: of:=IF([.G121]>0;1;0) -> 0 | Q121: of:=IF([.H121]>0;1;0) -> 0 | R121: of:=IF([.I121]>0;1;0) -> 0 | S121: of:=IF([.J121]>0;1;0) -> 0 | T121: of:=IF([.K121]>0;1;0) -> 1 | U121: of:=IF([.L121]>0;1;0) -> 0 | V121: of:=[.N121]*[.N$402]+[.O121]*[.O$402]+[.P121]*[.P$402]+[.Q121]*[.Q$402]+[.R121]*[.R$402]+[.S121]*[.S$402]+[.T121]*[.T$402]+[.U121]*[.U$402] -> 8.66447956449209 | W121: 101 | Y121: of:=[.W121]+[.X121] -> 101 | Z121: of:=[.Y121]/[.Y$401] -> 0.0321593283557993 | AA121: of:=[.D121]+[.M121]+[.V121]+[.Z121] -> 20.7819501347994 | AB121: of:=RANK([.AA121];[.AA$2:.AA$399];0) -> 120
A122: Bridgend | B122: 105653 | C122: of:=IF(SUM([.E122:.L122])>0;[.B122];0) -> 105653 | D122: of:=[.C122]/[.C$401] -> 3.97930886879524 | F122: 1 | J122: 1 | M122: of:=[.E122]*[.AC$11]+[.F122]*[.AC$13]+[.G122]*[.AC$15]+[.H122]*[.AC$17]+[.I122]*[.AC$19]+[.J122]*[.AC$21]+[.K122]*[.AC$23]+[.L122]*[.AC$25] -> 7.5657065638351 | N122: of:=IF([.E122]>0;1;0) -> 0 | O122: of:=IF([.F122]>0;1;0) -> 1 | P122: of:=IF([.G122]>0;1;0) -> 0 | Q122: of:=IF([.H122]>0;1;0) -> 0 | R122: of:=IF([.I122]>0;1;0) -> 0 | S122: of:=IF([.J122]>0;1;0) -> 1 | T122: of:=IF([.K122]>0;1;0) -> 0 | U122: of:=IF([.L122]>0;1;0) -> 0 | V122: of:=[.N122]*[.N$402]+[.O122]*[.O$402]+[.P122]*[.P$402]+[.Q122]*[.Q$402]+[.R122]*[.R$402]+[.S122]*[.S$402]+[.T122]*[.T$402]+[.U122]*[.U$402] -> 8.81834755033414 | W122: 1120 | Y122: of:=[.W122]+[.X122] -> 1120 | Z122: of:=[.Y122]/[.Y$401] -> 0.356618294638566 | AA122: of:=[.D122]+[.M122]+[.V122]+[.Z122] -> 20.719981277603 | AB122: of:=RANK([.AA122];[.AA$2:.AA$399];0) -> 121
A123: Pembrokeshire | B123: 90567 | C123: of:=IF(SUM([.E123:.L123])>0;[.B123];0) -> 90567 | D123: of:=[.C123]/[.C$401] -> 3.41111058200125 | F123: 1 | J123: 1 | M123: of:=[.E123]*[.AC$11]+[.F123]*[.AC$13]+[.G123]*[.AC$15]+[.H123]*[.AC$17]+[.I123]*[.AC$19]+[.J123]*[.AC$21]+[.K123]*[.AC$23]+[.L123]*[.AC$25] -> 7.5657065638351 | N123: of:=IF([.E123]>0;1;0) -> 0 | O123: of:=IF([.F123]>0;1;0) -> 1 | P123: of:=IF([.G123]>0;1;0) -> 0 | Q123: of:=IF([.H123]>0;1;0) -> 0 | R123: of:=IF([.I123]>0;1;0) -> 0 | S123: of:=IF([.J123]>0;1;0) -> 1 | T123: of:=IF([.K123]>0;1;0) -> 0 | U123: of:=IF([.L123]>0;1;0) -> 0 | V123: of:=[.N123]*[.N$402]+[.O123]*[.O$402]+[.P123]*[.P$402]+[.Q123]*[.Q$402]+[.R123]*[.R$402]+[.S123]*[.S$402]+[.T123]*[.T$402]+[.U123]*[.U$402] -> 8.81834755033414 | W123: 2744 | Y123: of:=[.W123]+[.X123] -> 2744 | Z123: of:=[.Y123]/[.Y$401] -> 0.873714821864488 | AA123: of:=[.D123]+[.M123]+[.V123]+[.Z123] -> 20.668879518035 | AB123: of:=RANK([.AA123];[.AA$2:.AA$399];0) -> 122
A124: Vale of Glamorgan | B124: 96218 | C124: of:=IF(SUM([.E124:.L124])>0;[.B124];0) -> 96218 | D124: of:=[.C124]/[.C$401] -> 3.62394953988756 | F124: 1 | J124: 1 | M124: of:=[.E124]*[.AC$11]+[.F124]*[.AC$13]+[.G124]*[.AC$15]+[.H124]*[.AC$17]+[.I124]*[.AC$19]+[.J124]*[.AC$21]+[.K124]*[.AC$23]+[.L124]*[.AC$25] -> 7.5657065638351 | N124: of:=IF([.E124]>0;1;0) -> 0 | O124: of:=IF([.F124]>0;1;0) -> 1 | P124: of:=IF([.G124]>0;1;0) -> 0 | Q124: of:=IF([.H124]>0;1;0) -> 0 | R124: of:=IF([.I124]>0;1;0) -> 0 | S124: of:=IF([.J124]>0;1;0) -> 1 | T124: of:=IF([.K124]>0;1;0) -> 0 | U124: of:=IF([.L124]>0;1;0) -> 0 | V124: of:=[.N124]*[.N$402]+[.O124]*[.O$402]+[.P124]*[.P$402]+[.Q124]*[.Q$402]+[.R124]*[.R$402]+[.S124]*[.S$402]+[.T124]*[.T$402]+[.U124]*[.U$402] -> 8.81834755033414 | W124: 2017 | Y124: of:=[.W124]+[.X124] -> 2017 | Z124: of:=[.Y124]/[.Y$401] -> 0.642231339541061 | AA124: of:=[.D124]+[.M124]+[.V124]+[.Z124] -> 20.6502349935979 | AB124: of:=RANK([.AA124];[.AA$2:.AA$399];0) -> 123
A125: N Ayrs | B125: 107402 | C125: of:=IF(SUM([.E125:.L125])>0;[.B125];0) -> 107402 | D125: of:=[.C125]/[.C$401] -> 4.04518311005221 | F125: 1 | K125: 1 | M125: of:=[.E125]*[.AC$11]+[.F125]*[.AC$13]+[.G125]*[.AC$15]+[.H125]*[.AC$17]+[.I125]*[.AC$19]+[.J125]*[.AC$21]+[.K125]*[.AC$23]+[.L125]*[.AC$25] -> 7.47968861794637 | N125: of:=IF([.E125]>0;1;0) -> 0 | O125: of:=IF([.F125]>0;1;0) -> 1 | P125: of:=IF([.G125]>0;1;0) -> 0 | Q125: of:=IF([.H125]>0;1;0) -> 0 | R125: of:=IF([.I125]>0;1;0) -> 0 | S125: of:=IF([.J125]>0;1;0) -> 0 | T125: of:=IF([.K125]>0;1;0) -> 1 | U125: of:=IF([.L125]>0;1;0) -> 0 | V125: of:=[.N125]*[.N$402]+[.O125]*[.O$402]+[.P125]*[.P$402]+[.Q125]*[.Q$402]+[.R125]*[.R$402]+[.S125]*[.S$402]+[.T125]*[.T$402]+[.U125]*[.U$402] -> 8.66447956449209 | W125: 1105 | Y125: of:=[.W125]+[.X125] -> 1105 | Z125: of:=[.Y125]/[.Y$401] -> 0.351842156763943 | AA125: of:=[.D125]+[.M125]+[.V125]+[.Z125] -> 20.5411934492546 | AB125: of:=RANK([.AA125];[.AA$2:.AA$399];0) -> 124
A126: Wrexham | B126: 100612 | C126: of:=IF(SUM([.E126:.L126])>0;[.B126];0) -> 100612 | D126: of:=[.C126]/[.C$401] -> 3.78944491786534 | F126: 1 | J126: 1 | M126: of:=[.E126]*[.AC$11]+[.F126]*[.AC$13]+[.G126]*[.AC$15]+[.H126]*[.AC$17]+[.I126]*[.AC$19]+[.J126]*[.AC$21]+[.K126]*[.AC$23]+[.L126]*[.AC$25] -> 7.5657065638351 | N126: of:=IF([.E126]>0;1;0) -> 0 | O126: of:=IF([.F126]>0;1;0) -> 1 | P126: of:=IF([.G126]>0;1;0) -> 0 | Q126: of:=IF([.H126]>0;1;0) -> 0 | R126: of:=IF([.I126]>0;1;0) -> 0 | S126: of:=IF([.J126]>0;1;0) -> 1 | T126: of:=IF([.K126]>0;1;0) -> 0 | U126: of:=IF([.L126]>0;1;0) -> 0 | V126: of:=[.N126]*[.N$402]+[.O126]*[.O$402]+[.P126]*[.P$402]+[.Q126]*[.Q$402]+[.R126]*[.R$402]+[.S126]*[.S$402]+[.T126]*[.T$402]+[.U126]*[.U$402] -> 8.81834755033414 | W126: 1127 | Y126: of:=[.W126]+[.X126] -> 1127 | Z126: of:=[.Y126]/[.Y$401] -> 0.358847158980058 | AA126: of:=[.D126]+[.M126]+[.V126]+[.Z126] -> 20.5323461910146 | AB126: of:=RANK([.AA126];[.AA$2:.AA$399];0) -> 125
A127: Perth and Kinross | B127: 115367 | C127: of:=IF(SUM([.E127:.L127])>0;[.B127];0) -> 115367 | D127: of:=[.C127]/[.C$401] -> 4.34517643858954 | F127: 1 | K127: 1 | M127: of:=[.E127]*[.AC$11]+[.F127]*[.AC$13]+[.G127]*[.AC$15]+[.H127]*[.AC$17]+[.I127]*[.AC$19]+[.J127]*[.AC$21]+[.K127]*[.AC$23]+[.L127]*[.AC$25] -> 7.47968861794637 | N127: of:=IF([.E127]>0;1;0) -> 0 | O127: of:=IF([.F127]>0;1;0) -> 1 | P127: of:=IF([.G127]>0;1;0) -> 0 | Q127: of:=IF([.H127]>0;1;0) -> 0 | R127: of:=IF([.I127]>0;1;0) -> 0 | S127: of:=IF([.J127]>0;1;0) -> 0 | T127: of:=IF([.K127]>0;1;0) -> 1 | U127: of:=IF([.L127]>0;1;0) -> 0 | V127: of:=[.N127]*[.N$402]+[.O127]*[.O$402]+[.P127]*[.P$402]+[.Q127]*[.Q$402]+[.R127]*[.R$402]+[.S127]*[.S$402]+[.T127]*[.T$402]+[.U127]*[.U$402] -> 8.66447956449209 | W127: 116 | Y127: of:=[.W127]+[.X127] -> 116 | Z127: of:=[.Y127]/[.Y$401] -> 0.036935466230423 | AA127: of:=[.D127]+[.M127]+[.V127]+[.Z127] -> 20.5262800872584 | AB127: of:=RANK([.AA127];[.AA$2:.AA$399];0) -> 126
A128: Dumfries & Galloway | B128: 114820 | C128: of:=IF(SUM([.E128:.L128])>0;[.B128];0) -> 114820 | D128: of:=[.C128]/[.C$401] -> 4.32457426022043 | F128: 1 | K128: 1 | M128: of:=[.E128]*[.AC$11]+[.F128]*[.AC$13]+[.G128]*[.AC$15]+[.H128]*[.AC$17]+[.I128]*[.AC$19]+[.J128]*[.AC$21]+[.K128]*[.AC$23]+[.L128]*[.AC$25] -> 7.47968861794637 | N128: of:=IF([.E128]>0;1;0) -> 0 | O128: of:=IF([.F128]>0;1;0) -> 1 | P128: of:=IF([.G128]>0;1;0) -> 0 | Q128: of:=IF([.H128]>0;1;0) -> 0 | R128: of:=IF([.I128]>0;1;0) -> 0 | S128: of:=IF([.J128]>0;1;0) -> 0 | T128: of:=IF([.K128]>0;1;0) -> 1 | U128: of:=IF([.L128]>0;1;0) -> 0 | V128: of:=[.N128]*[.N$402]+[.O128]*[.O$402]+[.P128]*[.P$402]+[.Q128]*[.Q$402]+[.R128]*[.R$402]+[.S128]*[.S$402]+[.T128]*[.T$402]+[.U128]*[.U$402] -> 8.66447956449209 | W128: 138 | Y128: of:=[.W128]+[.X128] -> 138 | Z128: of:=[.Y128]/[.Y$401] -> 0.0439404684465377 | AA128: of:=[.D128]+[.M128]+[.V128]+[.Z128] -> 20.5126829111054 | AB128: of:=RANK([.AA128];[.AA$2:.AA$399];0) -> 127
A129: Powys | B129: 100737 | C129: of:=IF(SUM([.E129:.L129])>0;[.B129];0) -> 100737 | D129: of:=[.C129]/[.C$401] -> 3.79415291109411 | F129: 1 | J129: 1 | M129: of:=[.E129]*[.AC$11]+[.F129]*[.AC$13]+[.G129]*[.AC$15]+[.H129]*[.AC$17]+[.I129]*[.AC$19]+[.J129]*[.AC$21]+[.K129]*[.AC$23]+[.L129]*[.AC$25] -> 7.5657065638351 | N129: of:=IF([.E129]>0;1;0) -> 0 | O129: of:=IF([.F129]>0;1;0) -> 1 | P129: of:=IF([.G129]>0;1;0) -> 0 | Q129: of:=IF([.H129]>0;1;0) -> 0 | R129: of:=IF([.I129]>0;1;0) -> 0 | S129: of:=IF([.J129]>0;1;0) -> 1 | T129: of:=IF([.K129]>0;1;0) -> 0 | U129: of:=IF([.L129]>0;1;0) -> 0 | V129: of:=[.N129]*[.N$402]+[.O129]*[.O$402]+[.P129]*[.P$402]+[.Q129]*[.Q$402]+[.R129]*[.R$402]+[.S129]*[.S$402]+[.T129]*[.T$402]+[.U129]*[.U$402] -> 8.81834755033414 | W129: 266 | Y129: of:=[.W129]+[.X129] -> 266 | Z129: of:=[.Y129]/[.Y$401] -> 0.0846968449766595 | AA129: of:=[.D129]+[.M129]+[.V129]+[.Z129] -> 20.26290387024 | AB129: of:=RANK([.AA129];[.AA$2:.AA$399];0) -> 128
A130: Leics CC | B130: 526523 | C130: of:=IF(SUM([.E130:.L130])>0;[.B130];0) -> 526523 | D130: of:=[.C130]/[.C$401] -> 19.83093375034 | J130: 1 | M130: of:=[.E130]*[.AC$11]+[.F130]*[.AC$13]+[.G130]*[.AC$15]+[.H130]*[.AC$17]+[.I130]*[.AC$19]+[.J130]*[.AC$21]+[.K130]*[.AC$23]+[.L130]*[.AC$25] -> 0.136078386768712 | N130: of:=IF([.E130]>0;1;0) -> 0 | O130: of:=IF([.F130]>0;1;0) -> 0 | P130: of:=IF([.G130]>0;1;0) -> 0 | Q130: of:=IF([.H130]>0;1;0) -> 0 | R130: of:=IF([.I130]>0;1;0) -> 0 | S130: of:=IF([.J130]>0;1;0) -> 1 | T130: of:=IF([.K130]>0;1;0) -> 0 | U130: of:=IF([.L130]>0;1;0) -> 0 | V130: of:=[.N130]*[.N$402]+[.O130]*[.O$402]+[.P130]*[.P$402]+[.Q130]*[.Q$402]+[.R130]*[.R$402]+[.S130]*[.S$402]+[.T130]*[.T$402]+[.U130]*[.U$402] -> 0.174691403761665 | Y130: of:=[.W130]+[.X130] -> 0 | Z130: of:=[.Y130]/[.Y$401] -> 0 | AA130: of:=[.D130]+[.M130]+[.V130]+[.Z130] -> 20.1417035408704 | AB130: of:=RANK([.AA130];[.AA$2:.AA$399];0) -> 129
A131: Conwy | B131: 89207 | C131: of:=IF(SUM([.E131:.L131])>0;[.B131];0) -> 89207 | D131: of:=[.C131]/[.C$401] -> 3.35988761567222 | F131: 1 | J131: 1 | M131: of:=[.E131]*[.AC$11]+[.F131]*[.AC$13]+[.G131]*[.AC$15]+[.H131]*[.AC$17]+[.I131]*[.AC$19]+[.J131]*[.AC$21]+[.K131]*[.AC$23]+[.L131]*[.AC$25] -> 7.5657065638351 | N131: of:=IF([.E131]>0;1;0) -> 0 | O131: of:=IF([.F131]>0;1;0) -> 1 | P131: of:=IF([.G131]>0;1;0) -> 0 | Q131: of:=IF([.H131]>0;1;0) -> 0 | R131: of:=IF([.I131]>0;1;0) -> 0 | S131: of:=IF([.J131]>0;1;0) -> 1 | T131: of:=IF([.K131]>0;1;0) -> 0 | U131: of:=IF([.L131]>0;1;0) -> 0 | V131: of:=[.N131]*[.N$402]+[.O131]*[.O$402]+[.P131]*[.P$402]+[.Q131]*[.Q$402]+[.R131]*[.R$402]+[.S131]*[.S$402]+[.T131]*[.T$402]+[.U131]*[.U$402] -> 8.81834755033414 | W131: 1171 | Y131: of:=[.W131]+[.X131] -> 1171 | Z131: of:=[.Y131]/[.Y$401] -> 0.372857163412287 | AA131: of:=[.D131]+[.M131]+[.V131]+[.Z131] -> 20.1167988932537 | AB131: of:=RANK([.AA131];[.AA$2:.AA$399];0) -> 130
A132: E Ayrs | B132: 94707 | C132: of:=IF(SUM([.E132:.L132])>0;[.B132];0) -> 94707 | D132: of:=[.C132]/[.C$401] -> 3.56703931773817 | F132: 1 | K132: 1 | M132: of:=[.E132]*[.AC$11]+[.F132]*[.AC$13]+[.G132]*[.AC$15]+[.H132]*[.AC$17]+[.I132]*[.AC$19]+[.J132]*[.AC$21]+[.K132]*[.AC$23]+[.L132]*[.AC$25] -> 7.47968861794637 | N132: of:=IF([.E132]>0;1;0) -> 0 | O132: of:=IF([.F132]>0;1;0) -> 1 | P132: of:=IF([.G132]>0;1;0) -> 0 | Q132: of:=IF([.H132]>0;1;0) -> 0 | R132: of:=IF([.I132]>0;1;0) -> 0 | S132: of:=IF([.J132]>0;1;0) -> 0 | T132: of:=IF([.K132]>0;1;0) -> 1 | U132: of:=IF([.L132]>0;1;0) -> 0 | V132: of:=[.N132]*[.N$402]+[.O132]*[.O$402]+[.P132]*[.P$402]+[.Q132]*[.Q$402]+[.R132]*[.R$402]+[.S132]*[.S$402]+[.T132]*[.T$402]+[.U132]*[.U$402] -> 8.66447956449209 | W132: 1142 | Y132: of:=[.W132]+[.X132] -> 1142 | Z132: of:=[.Y132]/[.Y$401] -> 0.363623296854681 | AA132: of:=[.D132]+[.M132]+[.V132]+[.Z132] -> 20.0748307970313 | AB132: of:=RANK([.AA132];[.AA$2:.AA$399];0) -> 131
A133: Gwynedd | B133: 82670 | C133: of:=IF(SUM([.E133:.L133])>0;[.B133];0) -> 82670 | D133: of:=[.C133]/[.C$401] -> 3.11367840178038 | F133: 1 | J133: 1 | M133: of:=[.E133]*[.AC$11]+[.F133]*[.AC$13]+[.G133]*[.AC$15]+[.H133]*[.AC$17]+[.I133]*[.AC$19]+[.J133]*[.AC$21]+[.K133]*[.AC$23]+[.L133]*[.AC$25] -> 7.5657065638351 | N133: of:=IF([.E133]>0;1;0) -> 0 | O133: of:=IF([.F133]>0;1;0) -> 1 | P133: of:=IF([.G133]>0;1;0) -> 0 | Q133: of:=IF([.H133]>0;1;0) -> 0 | R133: of:=IF([.I133]>0;1;0) -> 0 | S133: of:=IF([.J133]>0;1;0) -> 1 | T133: of:=IF([.K133]>0;1;0) -> 0 | U133: of:=IF([.L133]>0;1;0) -> 0 | V133: of:=[.N133]*[.N$402]+[.O133]*[.O$402]+[.P133]*[.P$402]+[.Q133]*[.Q$402]+[.R133]*[.R$402]+[.S133]*[.S$402]+[.T133]*[.T$402]+[.U133]*[.U$402] -> 8.81834755033414 | W133: 1316 | Y133: of:=[.W133]+[.X133] -> 1316 | Z133: of:=[.Y133]/[.Y$401] -> 0.419026496200316 | AA133: of:=[.D133]+[.M133]+[.V133]+[.Z133] -> 19.9167590121499 | AB133: of:=RANK([.AA133];[.AA$2:.AA$399];0) -> 132
A134: S Ayrs | B134: 90217 | C134: of:=IF(SUM([.E134:.L134])>0;[.B134];0) -> 90217 | D134: of:=[.C134]/[.C$401] -> 3.39792820096069 | F134: 1 | K134: 1 | M134: of:=[.E134]*[.AC$11]+[.F134]*[.AC$13]+[.G134]*[.AC$15]+[.H134]*[.AC$17]+[.I134]*[.AC$19]+[.J134]*[.AC$21]+[.K134]*[.AC$23]+[.L134]*[.AC$25] -> 7.47968861794637 | N134: of:=IF([.E134]>0;1;0) -> 0 | O134: of:=IF([.F134]>0;1;0) -> 1 | P134: of:=IF([.G134]>0;1;0) -> 0 | Q134: of:=IF([.H134]>0;1;0) -> 0 | R134: of:=IF([.I134]>0;1;0) -> 0 | S134: of:=IF([.J134]>0;1;0) -> 0 | T134: of:=IF([.K134]>0;1;0) -> 1 | U134: of:=IF([.L134]>0;1;0) -> 0 | V134: of:=[.N134]*[.N$402]+[.O134]*[.O$402]+[.P134]*[.P$402]+[.Q134]*[.Q$402]+[.R134]*[.R$402]+[.S134]*[.S$402]+[.T134]*[.T$402]+[.U134]*[.U$402] -> 8.66447956449209 | W134: 1164 | Y134: of:=[.W134]+[.X134] -> 1164 | Z134: of:=[.Y134]/[.Y$401] -> 0.370628299070796 | AA134: of:=[.D134]+[.M134]+[.V134]+[.Z134] -> 19.9127246824699 | AB134: of:=RANK([.AA134];[.AA$2:.AA$399];0) -> 133
A135: Angus | B135: 89627 | C135: of:=IF(SUM([.E135:.L135])>0;[.B135];0) -> 89627 | D135: of:=[.C135]/[.C$401] -> 3.37570647292089 | F135: 1 | K135: 1 | M135: of:=[.E135]*[.AC$11]+[.F135]*[.AC$13]+[.G135]*[.AC$15]+[.H135]*[.AC$17]+[.I135]*[.AC$19]+[.J135]*[.AC$21]+[.K135]*[.AC$23]+[.L135]*[.AC$25] -> 7.47968861794637 | N135: of:=IF([.E135]>0;1;0) -> 0 | O135: of:=IF([.F135]>0;1;0) -> 1 | P135: of:=IF([.G135]>0;1;0) -> 0 | Q135: of:=IF([.H135]>0;1;0) -> 0 | R135: of:=IF([.I135]>0;1;0) -> 0 | S135: of:=IF([.J135]>0;1;0) -> 0 | T135: of:=IF([.K135]>0;1;0) -> 1 | U135: of:=IF([.L135]>0;1;0) -> 0 | V135: of:=[.N135]*[.N$402]+[.O135]*[.O$402]+[.P135]*[.P$402]+[.Q135]*[.Q$402]+[.R135]*[.R$402]+[.S135]*[.S$402]+[.T135]*[.T$402]+[.U135]*[.U$402] -> 8.66447956449209 | W135: 1149 | Y135: of:=[.W135]+[.X135] -> 1149 | Z135: of:=[.Y135]/[.Y$401] -> 0.365852161196172 | AA135: of:=[.D135]+[.M135]+[.V135]+[.Z135] -> 19.8857268165555 | AB135: of:=RANK([.AA135];[.AA$2:.AA$399];0) -> 134
A136: E Duns | B136: 84680 | C136: of:=IF(SUM([.E136:.L136])>0;[.B136];0) -> 84680 | D136: of:=[.C136]/[.C$401] -> 3.18938293289903 | F136: 1 | K136: 1 | M136: of:=[.E136]*[.AC$11]+[.F136]*[.AC$13]+[.G136]*[.AC$15]+[.H136]*[.AC$17]+[.I136]*[.AC$19]+[.J136]*[.AC$21]+[.K136]*[.AC$23]+[.L136]*[.AC$25] -> 7.47968861794637 | N136: of:=IF([.E136]>0;1;0) -> 0 | O136: of:=IF([.F136]>0;1;0) -> 1 | P136: of:=IF([.G136]>0;1;0) -> 0 | Q136: of:=IF([.H136]>0;1;0) -> 0 | R136: of:=IF([.I136]>0;1;0) -> 0 | S136: of:=IF([.J136]>0;1;0) -> 0 | T136: of:=IF([.K136]>0;1;0) -> 1 | U136: of:=IF([.L136]>0;1;0) -> 0 | V136: of:=[.N136]*[.N$402]+[.O136]*[.O$402]+[.P136]*[.P$402]+[.Q136]*[.Q$402]+[.R136]*[.R$402]+[.S136]*[.S$402]+[.T136]*[.T$402]+[.U136]*[.U$402] -> 8.66447956449209 | W136: 1178 | Y136: of:=[.W136]+[.X136] -> 1178 | Z136: of:=[.Y136]/[.Y$401] -> 0.375086027753778 | AA136: of:=[.D136]+[.M136]+[.V136]+[.Z136] -> 19.7086371430913 | AB136: of:=RANK([.AA136];[.AA$2:.AA$399];0) -> 135
A137: Denbighshire | B137: 74087 | C137: of:=IF(SUM([.E137:.L137])>0;[.B137];0) -> 74087 | D137: of:=[.C137]/[.C$401] -> 2.79040875472001 | F137: 1 | J137: 1 | M137: of:=[.E137]*[.AC$11]+[.F137]*[.AC$13]+[.G137]*[.AC$15]+[.H137]*[.AC$17]+[.I137]*[.AC$19]+[.J137]*[.AC$21]+[.K137]*[.AC$23]+[.L137]*[.AC$25] -> 7.5657065638351 | N137: of:=IF([.E137]>0;1;0) -> 0 | O137: of:=IF([.F137]>0;1;0) -> 1 | P137: of:=IF([.G137]>0;1;0) -> 0 | Q137: of:=IF([.H137]>0;1;0) -> 0 | R137: of:=IF([.I137]>0;1;0) -> 0 | S137: of:=IF([.J137]>0;1;0) -> 1 | T137: of:=IF([.K137]>0;1;0) -> 0 | U137: of:=IF([.L137]>0;1;0) -> 0 | V137: of:=[.N137]*[.N$402]+[.O137]*[.O$402]+[.P137]*[.P$402]+[.Q137]*[.Q$402]+[.R137]*[.R$402]+[.S137]*[.S$402]+[.T137]*[.T$402]+[.U137]*[.U$402] -> 8.81834755033414 | W137: 1201 | Y137: of:=[.W137]+[.X137] -> 1201 | Z137: of:=[.Y137]/[.Y$401] -> 0.382409439161534 | AA137: of:=[.D137]+[.M137]+[.V137]+[.Z137] -> 19.5568723080508 | AB137: of:=RANK([.AA137];[.AA$2:.AA$399];0) -> 136
A138: Torfaen | B138: 69149 | C138: of:=IF(SUM([.E138:.L138])>0;[.B138];0) -> 69149 | D138: of:=[.C138]/[.C$401] -> 2.60442419021061 | F138: 1 | J138: 1 | M138: of:=[.E138]*[.AC$11]+[.F138]*[.AC$13]+[.G138]*[.AC$15]+[.H138]*[.AC$17]+[.I138]*[.AC$19]+[.J138]*[.AC$21]+[.K138]*[.AC$23]+[.L138]*[.AC$25] -> 7.5657065638351 | N138: of:=IF([.E138]>0;1;0) -> 0 | O138: of:=IF([.F138]>0;1;0) -> 1 | P138: of:=IF([.G138]>0;1;0) -> 0 | Q138: of:=IF([.H138]>0;1;0) -> 0 | R138: of:=IF([.I138]>0;1;0) -> 0 | S138: of:=IF([.J138]>0;1;0) -> 1 | T138: of:=IF([.K138]>0;1;0) -> 0 | U138: of:=IF([.L138]>0;1;0) -> 0 | V138: of:=[.N138]*[.N$402]+[.O138]*[.O$402]+[.P138]*[.P$402]+[.Q138]*[.Q$402]+[.R138]*[.R$402]+[.S138]*[.S$402]+[.T138]*[.T$402]+[.U138]*[.U$402] -> 8.81834755033414 | W138: 1683 | Y138: of:=[.W138]+[.X138] -> 1683 | Z138: of:=[.Y138]/[.Y$401] -> 0.535882669532775 | AA138: of:=[.D138]+[.M138]+[.V138]+[.Z138] -> 19.5243609739126 | AB138: of:=RANK([.AA138];[.AA$2:.AA$399];0) -> 137
A139: Monmouthshire | B139: 70585 | C139: of:=IF(SUM([.E139:.L139])>0;[.B139];0) -> 70585 | D139: of:=[.C139]/[.C$401] -> 2.65850961642274 | F139: 1 | J139: 1 | M139: of:=[.E139]*[.AC$11]+[.F139]*[.AC$13]+[.G139]*[.AC$15]+[.H139]*[.AC$17]+[.I139]*[.AC$19]+[.J139]*[.AC$21]+[.K139]*[.AC$23]+[.L139]*[.AC$25] -> 7.5657065638351 | N139: of:=IF([.E139]>0;1;0) -> 0 | O139: of:=IF([.F139]>0;1;0) -> 1 | P139: of:=IF([.G139]>0;1;0) -> 0 | Q139: of:=IF([.H139]>0;1;0) -> 0 | R139: of:=IF([.I139]>0;1;0) -> 0 | S139: of:=IF([.J139]>0;1;0) -> 1 | T139: of:=IF([.K139]>0;1;0) -> 0 | U139: of:=IF([.L139]>0;1;0) -> 0 | V139: of:=[.N139]*[.N$402]+[.O139]*[.O$402]+[.P139]*[.P$402]+[.Q139]*[.Q$402]+[.R139]*[.R$402]+[.S139]*[.S$402]+[.T139]*[.T$402]+[.U139]*[.U$402] -> 8.81834755033414 | W139: 1223 | Y139: of:=[.W139]+[.X139] -> 1223 | Z139: of:=[.Y139]/[.Y$401] -> 0.389414441377649 | AA139: of:=[.D139]+[.M139]+[.V139]+[.Z139] -> 19.4319781719696 | AB139: of:=RANK([.AA139];[.AA$2:.AA$399];0) -> 138
A140: Milton Keynes | B140: 194423 | C140: of:=IF(SUM([.E140:.L140])>0;[.B140];0) -> 194423 | D140: of:=[.C140]/[.C$401] -> 7.32273734013967 | G140: 1 | H140: 1 | I140: 1 | K140: 1 | L140: 1 | M140: of:=[.E140]*[.AC$11]+[.F140]*[.AC$13]+[.G140]*[.AC$15]+[.H140]*[.AC$17]+[.I140]*[.AC$19]+[.J140]*[.AC$21]+[.K140]*[.AC$23]+[.L140]*[.AC$25] -> 4.1770743494719 | N140: of:=IF([.E140]>0;1;0) -> 0 | O140: of:=IF([.F140]>0;1;0) -> 0 | P140: of:=IF([.G140]>0;1;0) -> 1 | Q140: of:=IF([.H140]>0;1;0) -> 1 | R140: of:=IF([.I140]>0;1;0) -> 1 | S140: of:=IF([.J140]>0;1;0) -> 0 | T140: of:=IF([.K140]>0;1;0) -> 1 | U140: of:=IF([.L140]>0;1;0) -> 1 | V140: of:=[.N140]*[.N$402]+[.O140]*[.O$402]+[.P140]*[.P$402]+[.Q140]*[.Q$402]+[.R140]*[.R$402]+[.S140]*[.S$402]+[.T140]*[.T$402]+[.U140]*[.U$402] -> 2.03350799196213 | W140: of:=451+17707 -> 18158 | Y140: of:=[.W140]+[.X140] -> 18158 | Z140: of:=[.Y140]/[.Y$401] -> 5.78167410182776 | AA140: of:=[.D140]+[.M140]+[.V140]+[.Z140] -> 19.3149937834015 | AB140: of:=RANK([.AA140];[.AA$2:.AA$399];0) -> 139
A141: E Renfs | B141: 72161 | C141: of:=IF(SUM([.E141:.L141])>0;[.B141];0) -> 72161 | D141: of:=[.C141]/[.C$401] -> 2.71786799505109 | F141: 1 | K141: 1 | M141: of:=[.E141]*[.AC$11]+[.F141]*[.AC$13]+[.G141]*[.AC$15]+[.H141]*[.AC$17]+[.I141]*[.AC$19]+[.J141]*[.AC$21]+[.K141]*[.AC$23]+[.L141]*[.AC$25] -> 7.47968861794637 | N141: of:=IF([.E141]>0;1;0) -> 0 | O141: of:=IF([.F141]>0;1;0) -> 1 | P141: of:=IF([.G141]>0;1;0) -> 0 | Q141: of:=IF([.H141]>0;1;0) -> 0 | R141: of:=IF([.I141]>0;1;0) -> 0 | S141: of:=IF([.J141]>0;1;0) -> 0 | T141: of:=IF([.K141]>0;1;0) -> 1 | U141: of:=IF([.L141]>0;1;0) -> 0 | V141: of:=[.N141]*[.N$402]+[.O141]*[.O$402]+[.P141]*[.P$402]+[.Q141]*[.Q$402]+[.R141]*[.R$402]+[.S141]*[.S$402]+[.T141]*[.T$402]+[.U141]*[.U$402] -> 8.66447956449209 | W141: 1216 | Y141: of:=[.W141]+[.X141] -> 1216 | Z141: of:=[.Y141]/[.Y$401] -> 0.387185577036158 | AA141: of:=[.D141]+[.M141]+[.V141]+[.Z141] -> 19.2492217545257 | AB141: of:=RANK([.AA141];[.AA$2:.AA$399];0) -> 140
A142: Tunbridge Wells | B142: 81708 | C142: of:=IF(SUM([.E142:.L142])>0;[.B142];0) -> 81708 | D142: of:=[.C142]/[.C$401] -> 3.07744568589175 | H142: 1 | I142: 1 | K142: 1 | L142: 1 | M142: of:=[.E142]*[.AC$11]+[.F142]*[.AC$13]+[.G142]*[.AC$15]+[.H142]*[.AC$17]+[.I142]*[.AC$19]+[.J142]*[.AC$21]+[.K142]*[.AC$23]+[.L142]*[.AC$25] -> 1.44386688758112 | N142: of:=IF([.E142]>0;1;0) -> 0 | O142: of:=IF([.F142]>0;1;0) -> 0 | P142: of:=IF([.G142]>0;1;0) -> 0 | Q142: of:=IF([.H142]>0;1;0) -> 1 | R142: of:=IF([.I142]>0;1;0) -> 1 | S142: of:=IF([.J142]>0;1;0) -> 0 | T142: of:=IF([.K142]>0;1;0) -> 1 | U142: of:=IF([.L142]>0;1;0) -> 1 | V142: of:=[.N142]*[.N$402]+[.O142]*[.O$402]+[.P142]*[.P$402]+[.Q142]*[.Q$402]+[.R142]*[.R$402]+[.S142]*[.S$402]+[.T142]*[.T$402]+[.U142]*[.U$402] -> 0.548043049303238 | W142: 44483 | Y142: of:=[.W142]+[.X142] -> 44483 | Z142: of:=[.Y142]/[.Y$401] -> 14.1637960717923 | AA142: of:=[.D142]+[.M142]+[.V142]+[.Z142] -> 19.2331516945684 | AB142: of:=RANK([.AA142];[.AA$2:.AA$399];0) -> 141
A143: Stirling | B143: 68246 | C143: of:=IF(SUM([.E143:.L143])>0;[.B143];0) -> 68246 | D143: of:=[.C143]/[.C$401] -> 2.57041364712597 | F143: 1 | K143: 1 | M143: of:=[.E143]*[.AC$11]+[.F143]*[.AC$13]+[.G143]*[.AC$15]+[.H143]*[.AC$17]+[.I143]*[.AC$19]+[.J143]*[.AC$21]+[.K143]*[.AC$23]+[.L143]*[.AC$25] -> 7.47968861794637 | N143: of:=IF([.E143]>0;1;0) -> 0 | O143: of:=IF([.F143]>0;1;0) -> 1 | P143: of:=IF([.G143]>0;1;0) -> 0 | Q143: of:=IF([.H143]>0;1;0) -> 0 | R143: of:=IF([.I143]>0;1;0) -> 0 | S143: of:=IF([.J143]>0;1;0) -> 0 | T143: of:=IF([.K143]>0;1;0) -> 1 | U143: of:=IF([.L143]>0;1;0) -> 0 | V143: of:=[.N143]*[.N$402]+[.O143]*[.O$402]+[.P143]*[.P$402]+[.Q143]*[.Q$402]+[.R143]*[.R$402]+[.S143]*[.S$402]+[.T143]*[.T$402]+[.U143]*[.U$402] -> 8.66447956449209 | W143: 1261 | Y143: of:=[.W143]+[.X143] -> 1261 | Z143: of:=[.Y143]/[.Y$401] -> 0.401513990660029 | AA143: of:=[.D143]+[.M143]+[.V143]+[.Z143] -> 19.1160958202245 | AB143: of:=RANK([.AA143];[.AA$2:.AA$399];0) -> 142
A144: W Duns | B144: 67662 | C144: of:=IF(SUM([.E144:.L144])>0;[.B144];0) -> 67662 | D144: of:=[.C144]/[.C$401] -> 2.54841790276115 | F144: 1 | K144: 1 | M144: of:=[.E144]*[.AC$11]+[.F144]*[.AC$13]+[.G144]*[.AC$15]+[.H144]*[.AC$17]+[.I144]*[.AC$19]+[.J144]*[.AC$21]+[.K144]*[.AC$23]+[.L144]*[.AC$25] -> 7.47968861794637 | N144: of:=IF([.E144]>0;1;0) -> 0 | O144: of:=IF([.F144]>0;1;0) -> 1 | P144: of:=IF([.G144]>0;1;0) -> 0 | Q144: of:=IF([.H144]>0;1;0) -> 0 | R144: of:=IF([.I144]>0;1;0) -> 0 | S144: of:=IF([.J144]>0;1;0) -> 0 | T144: of:=IF([.K144]>0;1;0) -> 1 | U144: of:=IF([.L144]>0;1;0) -> 0 | V144: of:=[.N144]*[.N$402]+[.O144]*[.O$402]+[.P144]*[.P$402]+[.Q144]*[.Q$402]+[.R144]*[.R$402]+[.S144]*[.S$402]+[.T144]*[.T$402]+[.U144]*[.U$402] -> 8.66447956449209 | W144: 1238 | Y144: of:=[.W144]+[.X144] -> 1238 | Z144: of:=[.Y144]/[.Y$401] -> 0.394190579252273 | AA144: of:=[.D144]+[.M144]+[.V144]+[.Z144] -> 19.0867766644519 | AB144: of:=RANK([.AA144];[.AA$2:.AA$399];0) -> 143
A145: Argyll & Bute | B145: 67295 | C145: of:=IF(SUM([.E145:.L145])>0;[.B145];0) -> 67295 | D145: of:=[.C145]/[.C$401] -> 2.53459523464147 | F145: 1 | K145: 1 | M145: of:=[.E145]*[.AC$11]+[.F145]*[.AC$13]+[.G145]*[.AC$15]+[.H145]*[.AC$17]+[.I145]*[.AC$19]+[.J145]*[.AC$21]+[.K145]*[.AC$23]+[.L145]*[.AC$25] -> 7.47968861794637 | N145: of:=IF([.E145]>0;1;0) -> 0 | O145: of:=IF([.F145]>0;1;0) -> 1 | P145: of:=IF([.G145]>0;1;0) -> 0 | Q145: of:=IF([.H145]>0;1;0) -> 0 | R145: of:=IF([.I145]>0;1;0) -> 0 | S145: of:=IF([.J145]>0;1;0) -> 0 | T145: of:=IF([.K145]>0;1;0) -> 1 | U145: of:=IF([.L145]>0;1;0) -> 0 | V145: of:=[.N145]*[.N$402]+[.O145]*[.O$402]+[.P145]*[.P$402]+[.Q145]*[.Q$402]+[.R145]*[.R$402]+[.S145]*[.S$402]+[.T145]*[.T$402]+[.U145]*[.U$402] -> 8.66447956449209 | W145: 1246 | Y145: of:=[.W145]+[.X145] -> 1246 | Z145: of:=[.Y145]/[.Y$401] -> 0.396737852785405 | AA145: of:=[.D145]+[.M145]+[.V145]+[.Z145] -> 19.0755012698653 | AB145: of:=RANK([.AA145];[.AA$2:.AA$399];0) -> 144
A146: Oxon CC | B146: 494203 | C146: of:=IF(SUM([.E146:.L146])>0;[.B146];0) -> 494203 | D146: of:=[.C146]/[.C$401] -> 18.6136350211089 | J146: 1 | M146: of:=[.E146]*[.AC$11]+[.F146]*[.AC$13]+[.G146]*[.AC$15]+[.H146]*[.AC$17]+[.I146]*[.AC$19]+[.J146]*[.AC$21]+[.K146]*[.AC$23]+[.L146]*[.AC$25] -> 0.136078386768712 | N146: of:=IF([.E146]>0;1;0) -> 0 | O146: of:=IF([.F146]>0;1;0) -> 0 | P146: of:=IF([.G146]>0;1;0) -> 0 | Q146: of:=IF([.H146]>0;1;0) -> 0 | R146: of:=IF([.I146]>0;1;0) -> 0 | S146: of:=IF([.J146]>0;1;0) -> 1 | T146: of:=IF([.K146]>0;1;0) -> 0 | U146: of:=IF([.L146]>0;1;0) -> 0 | V146: of:=[.N146]*[.N$402]+[.O146]*[.O$402]+[.P146]*[.P$402]+[.Q146]*[.Q$402]+[.R146]*[.R$402]+[.S146]*[.S$402]+[.T146]*[.T$402]+[.U146]*[.U$402] -> 0.174691403761665 | Y146: of:=[.W146]+[.X146] -> 0 | Z146: of:=[.Y146]/[.Y$401] -> 0 | AA146: of:=[.D146]+[.M146]+[.V146]+[.Z146] -> 18.9244048116392 | AB146: of:=RANK([.AA146];[.AA$2:.AA$399];0) -> 145
A147: Moray | B147: 72314 | C147: of:=IF(SUM([.E147:.L147])>0;[.B147];0) -> 72314 | D147: of:=[.C147]/[.C$401] -> 2.72363057876311 | F147: 1 | K147: 1 | M147: of:=[.E147]*[.AC$11]+[.F147]*[.AC$13]+[.G147]*[.AC$15]+[.H147]*[.AC$17]+[.I147]*[.AC$19]+[.J147]*[.AC$21]+[.K147]*[.AC$23]+[.L147]*[.AC$25] -> 7.47968861794637 | N147: of:=IF([.E147]>0;1;0) -> 0 | O147: of:=IF([.F147]>0;1;0) -> 1 | P147: of:=IF([.G147]>0;1;0) -> 0 | Q147: of:=IF([.H147]>0;1;0) -> 0 | R147: of:=IF([.I147]>0;1;0) -> 0 | S147: of:=IF([.J147]>0;1;0) -> 0 | T147: of:=IF([.K147]>0;1;0) -> 1 | U147: of:=IF([.L147]>0;1;0) -> 0 | V147: of:=[.N147]*[.N$402]+[.O147]*[.O$402]+[.P147]*[.P$402]+[.Q147]*[.Q$402]+[.R147]*[.R$402]+[.S147]*[.S$402]+[.T147]*[.T$402]+[.U147]*[.U$402] -> 8.66447956449209 | W147: 79 | Y147: of:=[.W147]+[.X147] -> 79 | Z147: of:=[.Y147]/[.Y$401] -> 0.0251543261396846 | AA147: of:=[.D147]+[.M147]+[.V147]+[.Z147] -> 18.8929530873413 | AB147: of:=RANK([.AA147];[.AA$2:.AA$399];0) -> 146
A148: Barnsley | B148: 181054 | C148: of:=IF(SUM([.E148:.L148])>0;[.B148];0) -> 181054 | D148: of:=[.C148]/[.C$401] -> 6.81920804833609 | G148: 1 | H148: 1 | I148: 1 | K148: 1 | L148: 1 | M148: of:=[.E148]*[.AC$11]+[.F148]*[.AC$13]+[.G148]*[.AC$15]+[.H148]*[.AC$17]+[.I148]*[.AC$19]+[.J148]*[.AC$21]+[.K148]*[.AC$23]+[.L148]*[.AC$25] -> 4.1770743494719 | N148: of:=IF([.E148]>0;1;0) -> 0 | O148: of:=IF([.F148]>0;1;0) -> 0 | P148: of:=IF([.G148]>0;1;0) -> 1 | Q148: of:=IF([.H148]>0;1;0) -> 1 | R148: of:=IF([.I148]>0;1;0) -> 1 | S148: of:=IF([.J148]>0;1;0) -> 0 | T148: of:=IF([.K148]>0;1;0) -> 1 | U148: of:=IF([.L148]>0;1;0) -> 1 | V148: of:=[.N148]*[.N$402]+[.O148]*[.O$402]+[.P148]*[.P$402]+[.Q148]*[.Q$402]+[.R148]*[.R$402]+[.S148]*[.S$402]+[.T148]*[.T$402]+[.U148]*[.U$402] -> 2.03350799196213 | W148: of:=54+18258 -> 18312 | Y148: of:=[.W148]+[.X148] -> 18312 | Z148: of:=[.Y148]/[.Y$401] -> 5.83070911734056 | AA148: of:=[.D148]+[.M148]+[.V148]+[.Z148] -> 18.8604995071107 | AB148: of:=RANK([.AA148];[.AA$2:.AA$399];0) -> 147
A149: Midlothian | B149: 71069 | C149: of:=IF(SUM([.E149:.L149])>0;[.B149];0) -> 71069 | D149: of:=[.C149]/[.C$401] -> 2.67673896620455 | F149: 1 | K149: 1 | M149: of:=[.E149]*[.AC$11]+[.F149]*[.AC$13]+[.G149]*[.AC$15]+[.H149]*[.AC$17]+[.I149]*[.AC$19]+[.J149]*[.AC$21]+[.K149]*[.AC$23]+[.L149]*[.AC$25] -> 7.47968861794637 | N149: of:=IF([.E149]>0;1;0) -> 0 | O149: of:=IF([.F149]>0;1;0) -> 1 | P149: of:=IF([.G149]>0;1;0) -> 0 | Q149: of:=IF([.H149]>0;1;0) -> 0 | R149: of:=IF([.I149]>0;1;0) -> 0 | S149: of:=IF([.J149]>0;1;0) -> 0 | T149: of:=IF([.K149]>0;1;0) -> 1 | U149: of:=IF([.L149]>0;1;0) -> 0 | V149: of:=[.N149]*[.N$402]+[.O149]*[.O$402]+[.P149]*[.P$402]+[.Q149]*[.Q$402]+[.R149]*[.R$402]+[.S149]*[.S$402]+[.T149]*[.T$402]+[.U149]*[.U$402] -> 8.66447956449209 | W149: 100 | Y149: of:=[.W149]+[.X149] -> 100 | Z149: of:=[.Y149]/[.Y$401] -> 0.0318409191641577 | AA149: of:=[.D149]+[.M149]+[.V149]+[.Z149] -> 18.8527480678072 | AB149: of:=RANK([.AA149];[.AA$2:.AA$399];0) -> 148
A150: Inverclyde | B150: 60014 | C150: of:=IF(SUM([.E150:.L150])>0;[.B150];0) -> 60014 | D150: of:=[.C150]/[.C$401] -> 2.26036404505199 | F150: 1 | K150: 1 | M150: of:=[.E150]*[.AC$11]+[.F150]*[.AC$13]+[.G150]*[.AC$15]+[.H150]*[.AC$17]+[.I150]*[.AC$19]+[.J150]*[.AC$21]+[.K150]*[.AC$23]+[.L150]*[.AC$25] -> 7.47968861794637 | N150: of:=IF([.E150]>0;1;0) -> 0 | O150: of:=IF([.F150]>0;1;0) -> 1 | P150: of:=IF([.G150]>0;1;0) -> 0 | Q150: of:=IF([.H150]>0;1;0) -> 0 | R150: of:=IF([.I150]>0;1;0) -> 0 | S150: of:=IF([.J150]>0;1;0) -> 0 | T150: of:=IF([.K150]>0;1;0) -> 1 | U150: of:=IF([.L150]>0;1;0) -> 0 | V150: of:=[.N150]*[.N$402]+[.O150]*[.O$402]+[.P150]*[.P$402]+[.Q150]*[.Q$402]+[.R150]*[.R$402]+[.S150]*[.S$402]+[.T150]*[.T$402]+[.U150]*[.U$402] -> 8.66447956449209 | W150: 1268 | Y150: of:=[.W150]+[.X150] -> 1268 | Z150: of:=[.Y150]/[.Y$401] -> 0.40374285500152 | AA150: of:=[.D150]+[.M150]+[.V150]+[.Z150] -> 18.808275082492 | AB150: of:=RANK([.AA150];[.AA$2:.AA$399];0) -> 149
A151: Blaenau Gwent | B151: 50567 | C151: of:=IF(SUM([.E151:.L151])>0;[.B151];0) -> 50567 | D151: of:=[.C151]/[.C$401] -> 1.90455274879434 | F151: 1 | J151: 1 | M151: of:=[.E151]*[.AC$11]+[.F151]*[.AC$13]+[.G151]*[.AC$15]+[.H151]*[.AC$17]+[.I151]*[.AC$19]+[.J151]*[.AC$21]+[.K151]*[.AC$23]+[.L151]*[.AC$25] -> 7.5657065638351 | N151: of:=IF([.E151]>0;1;0) -> 0 | O151: of:=IF([.F151]>0;1;0) -> 1 | P151: of:=IF([.G151]>0;1;0) -> 0 | Q151: of:=IF([.H151]>0;1;0) -> 0 | R151: of:=IF([.I151]>0;1;0) -> 0 | S151: of:=IF([.J151]>0;1;0) -> 1 | T151: of:=IF([.K151]>0;1;0) -> 0 | U151: of:=IF([.L151]>0;1;0) -> 0 | V151: of:=[.N151]*[.N$402]+[.O151]*[.O$402]+[.P151]*[.P$402]+[.Q151]*[.Q$402]+[.R151]*[.R$402]+[.S151]*[.S$402]+[.T151]*[.T$402]+[.U151]*[.U$402] -> 8.81834755033414 | W151: 1283 | Y151: of:=[.W151]+[.X151] -> 1283 | Z151: of:=[.Y151]/[.Y$401] -> 0.408518992876144 | AA151: of:=[.D151]+[.M151]+[.V151]+[.Z151] -> 18.6971258558397 | AB151: of:=RANK([.AA151];[.AA$2:.AA$399];0) -> 150
A152: Anglesey | B152: 50551 | C152: of:=IF(SUM([.E152:.L152])>0;[.B152];0) -> 50551 | D152: of:=[.C152]/[.C$401] -> 1.90395012566106 | F152: 1 | J152: 1 | M152: of:=[.E152]*[.AC$11]+[.F152]*[.AC$13]+[.G152]*[.AC$15]+[.H152]*[.AC$17]+[.I152]*[.AC$19]+[.J152]*[.AC$21]+[.K152]*[.AC$23]+[.L152]*[.AC$25] -> 7.5657065638351 | N152: of:=IF([.E152]>0;1;0) -> 0 | O152: of:=IF([.F152]>0;1;0) -> 1 | P152: of:=IF([.G152]>0;1;0) -> 0 | Q152: of:=IF([.H152]>0;1;0) -> 0 | R152: of:=IF([.I152]>0;1;0) -> 0 | S152: of:=IF([.J152]>0;1;0) -> 1 | T152: of:=IF([.K152]>0;1;0) -> 0 | U152: of:=IF([.L152]>0;1;0) -> 0 | V152: of:=[.N152]*[.N$402]+[.O152]*[.O$402]+[.P152]*[.P$402]+[.Q152]*[.Q$402]+[.R152]*[.R$402]+[.S152]*[.S$402]+[.T152]*[.T$402]+[.U152]*[.U$402] -> 8.81834755033414 | W152: 1276 | Y152: of:=[.W152]+[.X152] -> 1276 | Z152: of:=[.Y152]/[.Y$401] -> 0.406290128534653 | AA152: of:=[.D152]+[.M152]+[.V152]+[.Z152] -> 18.694294368365 | AB152: of:=RANK([.AA152];[.AA$2:.AA$399];0) -> 151
A153: Ches E | B153: 302040 | C153: of:=IF(SUM([.E153:.L153])>0;[.B153];0) -> 302040 | D153: of:=[.C153]/[.C$401] -> 11.3760181985454 | H153: 1 | L153: 1 | M153: of:=[.E153]*[.AC$11]+[.F153]*[.AC$13]+[.G153]*[.AC$15]+[.H153]*[.AC$17]+[.I153]*[.AC$19]+[.J153]*[.AC$21]+[.K153]*[.AC$23]+[.L153]*[.AC$25] -> 1.02390704070172 | N153: of:=IF([.E153]>0;1;0) -> 0 | O153: of:=IF([.F153]>0;1;0) -> 0 | P153: of:=IF([.G153]>0;1;0) -> 0 | Q153: of:=IF([.H153]>0;1;0) -> 1 | R153: of:=IF([.I153]>0;1;0) -> 0 | S153: of:=IF([.J153]>0;1;0) -> 0 | T153: of:=IF([.K153]>0;1;0) -> 0 | U153: of:=IF([.L153]>0;1;0) -> 1 | V153: of:=[.N153]*[.N$402]+[.O153]*[.O$402]+[.P153]*[.P$402]+[.Q153]*[.Q$402]+[.R153]*[.R$402]+[.S153]*[.S$402]+[.T153]*[.T$402]+[.U153]*[.U$402] -> 0.308633066549229 | W153: 18429 | Y153: of:=[.W153]+[.X153] -> 18429 | Z153: of:=[.Y153]/[.Y$401] -> 5.86796299276263 | AA153: of:=[.D153]+[.M153]+[.V153]+[.Z153] -> 18.576521298559 | AB153: of:=RANK([.AA153];[.AA$2:.AA$399];0) -> 152
A154: Bournemouth, Christchurch and Poole | B154: of:=143497+38865+115944 -> 298306 | C154: of:=IF(SUM([.E154:.L154])>0;[.B154];0) -> 298306 | D154: of:=[.C154]/[.C$401] -> 11.2353810248155 | H154: 1 | L154: 1 | M154: of:=[.E154]*[.AC$11]+[.F154]*[.AC$13]+[.G154]*[.AC$15]+[.H154]*[.AC$17]+[.I154]*[.AC$19]+[.J154]*[.AC$21]+[.K154]*[.AC$23]+[.L154]*[.AC$25] -> 1.02390704070172 | N154: of:=IF([.E154]>0;1;0) -> 0 | O154: of:=IF([.F154]>0;1;0) -> 0 | P154: of:=IF([.G154]>0;1;0) -> 0 | Q154: of:=IF([.H154]>0;1;0) -> 1 | R154: of:=IF([.I154]>0;1;0) -> 0 | S154: of:=IF([.J154]>0;1;0) -> 0 | T154: of:=IF([.K154]>0;1;0) -> 0 | U154: of:=IF([.L154]>0;1;0) -> 1 | V154: of:=[.N154]*[.N$402]+[.O154]*[.O$402]+[.P154]*[.P$402]+[.Q154]*[.Q$402]+[.R154]*[.R$402]+[.S154]*[.S$402]+[.T154]*[.T$402]+[.U154]*[.U$402] -> 0.308633066549229 | W154: 18570 | Y154: of:=[.W154]+[.X154] -> 18570 | Z154: of:=[.Y154]/[.Y$401] -> 5.91285868878409 | AA154: of:=[.D154]+[.M154]+[.V154]+[.Z154] -> 18.4807798208506 | AB154: of:=RANK([.AA154];[.AA$2:.AA$399];0) -> 153
A155: Dorset | B155: of:=331227-38865 -> 292362 | C155: of:=IF(SUM([.E155:.L155])>0;[.B155];0) -> 292362 | D155: of:=[.C155]/[.C$401] -> 11.011506530801 | H155: 1 | L155: 1 | M155: of:=[.E155]*[.AC$11]+[.F155]*[.AC$13]+[.G155]*[.AC$15]+[.H155]*[.AC$17]+[.I155]*[.AC$19]+[.J155]*[.AC$21]+[.K155]*[.AC$23]+[.L155]*[.AC$25] -> 1.02390704070172 | N155: of:=IF([.E155]>0;1;0) -> 0 | O155: of:=IF([.F155]>0;1;0) -> 0 | P155: of:=IF([.G155]>0;1;0) -> 0 | Q155: of:=IF([.H155]>0;1;0) -> 1 | R155: of:=IF([.I155]>0;1;0) -> 0 | S155: of:=IF([.J155]>0;1;0) -> 0 | T155: of:=IF([.K155]>0;1;0) -> 0 | U155: of:=IF([.L155]>0;1;0) -> 1 | V155: of:=[.N155]*[.N$402]+[.O155]*[.O$402]+[.P155]*[.P$402]+[.Q155]*[.Q$402]+[.R155]*[.R$402]+[.S155]*[.S$402]+[.T155]*[.T$402]+[.U155]*[.U$402] -> 0.308633066549229 | W155: 18893 | Y155: of:=[.W155]+[.X155] -> 18893 | Z155: of:=[.Y155]/[.Y$401] -> 6.01570485768432 | AA155: of:=[.D155]+[.M155]+[.V155]+[.Z155] -> 18.3597514957362 | AB155: of:=RANK([.AA155];[.AA$2:.AA$399];0) -> 154
A156: Rochdale | B156: 161945 | C156: of:=IF(SUM([.E156:.L156])>0;[.B156];0) -> 161945 | D156: of:=[.C156]/[.C$401] -> 6.09948770746732 | G156: 1 | H156: 1 | I156: 1 | K156: 1 | L156: 1 | M156: of:=[.E156]*[.AC$11]+[.F156]*[.AC$13]+[.G156]*[.AC$15]+[.H156]*[.AC$17]+[.I156]*[.AC$19]+[.J156]*[.AC$21]+[.K156]*[.AC$23]+[.L156]*[.AC$25] -> 4.1770743494719 | N156: of:=IF([.E156]>0;1;0) -> 0 | O156: of:=IF([.F156]>0;1;0) -> 0 | P156: of:=IF([.G156]>0;1;0) -> 1 | Q156: of:=IF([.H156]>0;1;0) -> 1 | R156: of:=IF([.I156]>0;1;0) -> 1 | S156: of:=IF([.J156]>0;1;0) -> 0 | T156: of:=IF([.K156]>0;1;0) -> 1 | U156: of:=IF([.L156]>0;1;0) -> 1 | V156: of:=[.N156]*[.N$402]+[.O156]*[.O$402]+[.P156]*[.P$402]+[.Q156]*[.Q$402]+[.R156]*[.R$402]+[.S156]*[.S$402]+[.T156]*[.T$402]+[.U156]*[.U$402] -> 2.03350799196213 | W156: of:=3901+14586 -> 18487 | Y156: of:=[.W156]+[.X156] -> 18487 | Z156: of:=[.Y156]/[.Y$401] -> 5.88643072587784 | AA156: of:=[.D156]+[.M156]+[.V156]+[.Z156] -> 18.1965007747792 | AB156: of:=RANK([.AA156];[.AA$2:.AA$399];0) -> 155
A157: Oldham | B157: 160195 | C157: of:=IF(SUM([.E157:.L157])>0;[.B157];0) -> 160195 | D157: of:=[.C157]/[.C$401] -> 6.03357580226452 | G157: 1 | H157: 1 | I157: 1 | K157: 1 | L157: 1 | M157: of:=[.E157]*[.AC$11]+[.F157]*[.AC$13]+[.G157]*[.AC$15]+[.H157]*[.AC$17]+[.I157]*[.AC$19]+[.J157]*[.AC$21]+[.K157]*[.AC$23]+[.L157]*[.AC$25] -> 4.1770743494719 | N157: of:=IF([.E157]>0;1;0) -> 0 | O157: of:=IF([.F157]>0;1;0) -> 0 | P157: of:=IF([.G157]>0;1;0) -> 1 | Q157: of:=IF([.H157]>0;1;0) -> 1 | R157: of:=IF([.I157]>0;1;0) -> 1 | S157: of:=IF([.J157]>0;1;0) -> 0 | T157: of:=IF([.K157]>0;1;0) -> 1 | U157: of:=IF([.L157]>0;1;0) -> 1 | V157: of:=[.N157]*[.N$402]+[.O157]*[.O$402]+[.P157]*[.P$402]+[.Q157]*[.Q$402]+[.R157]*[.R$402]+[.S157]*[.S$402]+[.T157]*[.T$402]+[.U157]*[.U$402] -> 2.03350799196213 | W157: of:=697+17885 -> 18582 | Y157: of:=[.W157]+[.X157] -> 18582 | Z157: of:=[.Y157]/[.Y$401] -> 5.91667959908379 | AA157: of:=[.D157]+[.M157]+[.V157]+[.Z157] -> 18.1608377427823 | AB157: of:=RANK([.AA157];[.AA$2:.AA$399];0) -> 156
A158: Merthyr Tydfil | B158: 43541 | C158: of:=IF(SUM([.E158:.L158])>0;[.B158];0) -> 43541 | D158: of:=[.C158]/[.C$401] -> 1.63992586539155 | F158: 1 | J158: 1 | M158: of:=[.E158]*[.AC$11]+[.F158]*[.AC$13]+[.G158]*[.AC$15]+[.H158]*[.AC$17]+[.I158]*[.AC$19]+[.J158]*[.AC$21]+[.K158]*[.AC$23]+[.L158]*[.AC$25] -> 7.5657065638351 | N158: of:=IF([.E158]>0;1;0) -> 0 | O158: of:=IF([.F158]>0;1;0) -> 1 | P158: of:=IF([.G158]>0;1;0) -> 0 | Q158: of:=IF([.H158]>0;1;0) -> 0 | R158: of:=IF([.I158]>0;1;0) -> 0 | S158: of:=IF([.J158]>0;1;0) -> 1 | T158: of:=IF([.K158]>0;1;0) -> 0 | U158: of:=IF([.L158]>0;1;0) -> 0 | V158: of:=[.N158]*[.N$402]+[.O158]*[.O$402]+[.P158]*[.P$402]+[.Q158]*[.Q$402]+[.R158]*[.R$402]+[.S158]*[.S$402]+[.T158]*[.T$402]+[.U158]*[.U$402] -> 8.81834755033414 | W158: 276 | Y158: of:=[.W158]+[.X158] -> 276 | Z158: of:=[.Y158]/[.Y$401] -> 0.0878809368930753 | AA158: of:=[.D158]+[.M158]+[.V158]+[.Z158] -> 18.1118609164539 | AB158: of:=RANK([.AA158];[.AA$2:.AA$399];0) -> 157
A159: Solihull | B159: 159515 | C159: of:=IF(SUM([.E159:.L159])>0;[.B159];0) -> 159515 | D159: of:=[.C159]/[.C$401] -> 6.0079643191 | G159: 1 | H159: 1 | I159: 1 | K159: 1 | L159: 1 | M159: of:=[.E159]*[.AC$11]+[.F159]*[.AC$13]+[.G159]*[.AC$15]+[.H159]*[.AC$17]+[.I159]*[.AC$19]+[.J159]*[.AC$21]+[.K159]*[.AC$23]+[.L159]*[.AC$25] -> 4.1770743494719 | N159: of:=IF([.E159]>0;1;0) -> 0 | O159: of:=IF([.F159]>0;1;0) -> 0 | P159: of:=IF([.G159]>0;1;0) -> 1 | Q159: of:=IF([.H159]>0;1;0) -> 1 | R159: of:=IF([.I159]>0;1;0) -> 1 | S159: of:=IF([.J159]>0;1;0) -> 0 | T159: of:=IF([.K159]>0;1;0) -> 1 | U159: of:=IF([.L159]>0;1;0) -> 1 | V159: of:=[.N159]*[.N$402]+[.O159]*[.O$402]+[.P159]*[.P$402]+[.Q159]*[.Q$402]+[.R159]*[.R$402]+[.S159]*[.S$402]+[.T159]*[.T$402]+[.U159]*[.U$402] -> 2.03350799196213 | W159: of:=3926+14340 -> 18266 | Y159: of:=[.W159]+[.X159] -> 18266 | Z159: of:=[.Y159]/[.Y$401] -> 5.81606229452505 | AA159: of:=[.D159]+[.M159]+[.V159]+[.Z159] -> 18.0346089550591 | AB159: of:=RANK([.AA159];[.AA$2:.AA$399];0) -> 158
A160: Sefton | B160: 213387 | C160: of:=IF(SUM([.E160:.L160])>0;[.B160];0) -> 213387 | D160: of:=[.C160]/[.C$401] -> 8.03699640886307 | G160: 1 | H160: 1 | I160: 1 | K160: 1 | L160: 1 | M160: of:=[.E160]*[.AC$11]+[.F160]*[.AC$13]+[.G160]*[.AC$15]+[.H160]*[.AC$17]+[.I160]*[.AC$19]+[.J160]*[.AC$21]+[.K160]*[.AC$23]+[.L160]*[.AC$25] -> 4.1770743494719 | N160: of:=IF([.E160]>0;1;0) -> 0 | O160: of:=IF([.F160]>0;1;0) -> 0 | P160: of:=IF([.G160]>0;1;0) -> 1 | Q160: of:=IF([.H160]>0;1;0) -> 1 | R160: of:=IF([.I160]>0;1;0) -> 1 | S160: of:=IF([.J160]>0;1;0) -> 0 | T160: of:=IF([.K160]>0;1;0) -> 1 | U160: of:=IF([.L160]>0;1;0) -> 1 | V160: of:=[.N160]*[.N$402]+[.O160]*[.O$402]+[.P160]*[.P$402]+[.Q160]*[.Q$402]+[.R160]*[.R$402]+[.S160]*[.S$402]+[.T160]*[.T$402]+[.U160]*[.U$402] -> 2.03350799196213 | W160: of:=796+10952 -> 11748 | Y160: of:=[.W160]+[.X160] -> 11748 | Z160: of:=[.Y160]/[.Y$401] -> 3.74067118340525 | AA160: of:=[.D160]+[.M160]+[.V160]+[.Z160] -> 17.9882499337024 | AB160: of:=RANK([.AA160];[.AA$2:.AA$399];0) -> 159
A161: Newcastle-under-Lyme | B161: 95295 | C161: of:=IF(SUM([.E161:.L161])>0;[.B161];0) -> 95295 | D161: of:=[.C161]/[.C$401] -> 3.58918571788631 | K161: 1 | M161: of:=[.E161]*[.AC$11]+[.F161]*[.AC$13]+[.G161]*[.AC$15]+[.H161]*[.AC$17]+[.I161]*[.AC$19]+[.J161]*[.AC$21]+[.K161]*[.AC$23]+[.L161]*[.AC$25] -> 0.0500604408799853 | N161: of:=IF([.E161]>0;1;0) -> 0 | O161: of:=IF([.F161]>0;1;0) -> 0 | P161: of:=IF([.G161]>0;1;0) -> 0 | Q161: of:=IF([.H161]>0;1;0) -> 0 | R161: of:=IF([.I161]>0;1;0) -> 0 | S161: of:=IF([.J161]>0;1;0) -> 0 | T161: of:=IF([.K161]>0;1;0) -> 1 | U161: of:=IF([.L161]>0;1;0) -> 0 | V161: of:=[.N161]*[.N$402]+[.O161]*[.O$402]+[.P161]*[.P$402]+[.Q161]*[.Q$402]+[.R161]*[.R$402]+[.S161]*[.S$402]+[.T161]*[.T$402]+[.U161]*[.U$402] -> 0.0208234179196155 | X161: of:=[.$AD$1] -> 44717 | Y161: of:=[.W161]+[.X161] -> 44717 | Z161: of:=[.Y161]/[.Y$401] -> 14.2383038226364 | AA161: of:=[.D161]+[.M161]+[.V161]+[.Z161] -> 17.8983733993223 | AB161: of:=RANK([.AA161];[.AA$2:.AA$399];0) -> 160
A162: Clacks | B162: 39062 | C162: of:=IF(SUM([.E162:.L162])>0;[.B162];0) -> 39062 | D162: of:=[.C162]/[.C$401] -> 1.47122905201821 | F162: 1 | J162: 1 | M162: of:=[.E162]*[.AC$11]+[.F162]*[.AC$13]+[.G162]*[.AC$15]+[.H162]*[.AC$17]+[.I162]*[.AC$19]+[.J162]*[.AC$21]+[.K162]*[.AC$23]+[.L162]*[.AC$25] -> 7.5657065638351 | N162: of:=IF([.E162]>0;1;0) -> 0 | O162: of:=IF([.F162]>0;1;0) -> 1 | P162: of:=IF([.G162]>0;1;0) -> 0 | Q162: of:=IF([.H162]>0;1;0) -> 0 | R162: of:=IF([.I162]>0;1;0) -> 0 | S162: of:=IF([.J162]>0;1;0) -> 1 | T162: of:=IF([.K162]>0;1;0) -> 0 | U162: of:=IF([.L162]>0;1;0) -> 0 | V162: of:=[.N162]*[.N$402]+[.O162]*[.O$402]+[.P162]*[.P$402]+[.Q162]*[.Q$402]+[.R162]*[.R$402]+[.S162]*[.S$402]+[.T162]*[.T$402]+[.U162]*[.U$402] -> 8.81834755033414 | W162: 59 | Y162: of:=[.W162]+[.X162] -> 59 | Z162: of:=[.Y162]/[.Y$401] -> 0.0187861423068531 | AA162: of:=[.D162]+[.M162]+[.V162]+[.Z162] -> 17.8740693084943 | AB162: of:=RANK([.AA162];[.AA$2:.AA$399];0) -> 161
A163: N Yorks CC | B163: 464221 | C163: of:=IF(SUM([.E163:.L163])>0;[.B163];0) -> 464221 | D163: of:=[.C163]/[.C$401] -> 17.4843945972286 | J163: 1 | M163: of:=[.E163]*[.AC$11]+[.F163]*[.AC$13]+[.G163]*[.AC$15]+[.H163]*[.AC$17]+[.I163]*[.AC$19]+[.J163]*[.AC$21]+[.K163]*[.AC$23]+[.L163]*[.AC$25] -> 0.136078386768712 | N163: of:=IF([.E163]>0;1;0) -> 0 | O163: of:=IF([.F163]>0;1;0) -> 0 | P163: of:=IF([.G163]>0;1;0) -> 0 | Q163: of:=IF([.H163]>0;1;0) -> 0 | R163: of:=IF([.I163]>0;1;0) -> 0 | S163: of:=IF([.J163]>0;1;0) -> 1 | T163: of:=IF([.K163]>0;1;0) -> 0 | U163: of:=IF([.L163]>0;1;0) -> 0 | V163: of:=[.N163]*[.N$402]+[.O163]*[.O$402]+[.P163]*[.P$402]+[.Q163]*[.Q$402]+[.R163]*[.R$402]+[.S163]*[.S$402]+[.T163]*[.T$402]+[.U163]*[.U$402] -> 0.174691403761665 | Y163: of:=[.W163]+[.X163] -> 0 | Z163: of:=[.Y163]/[.Y$401] -> 0 | AA163: of:=[.D163]+[.M163]+[.V163]+[.Z163] -> 17.795164387759 | AB163: of:=RANK([.AA163];[.AA$2:.AA$399];0) -> 162
A164: Ches W & Chester | B164: 272244 | C164: of:=IF(SUM([.E164:.L164])>0;[.B164];0) -> 272244 | D164: of:=[.C164]/[.C$401] -> 10.2537832685895 | H164: 1 | L164: 1 | M164: of:=[.E164]*[.AC$11]+[.F164]*[.AC$13]+[.G164]*[.AC$15]+[.H164]*[.AC$17]+[.I164]*[.AC$19]+[.J164]*[.AC$21]+[.K164]*[.AC$23]+[.L164]*[.AC$25] -> 1.02390704070172 | N164: of:=IF([.E164]>0;1;0) -> 0 | O164: of:=IF([.F164]>0;1;0) -> 0 | P164: of:=IF([.G164]>0;1;0) -> 0 | Q164: of:=IF([.H164]>0;1;0) -> 1 | R164: of:=IF([.I164]>0;1;0) -> 0 | S164: of:=IF([.J164]>0;1;0) -> 0 | T164: of:=IF([.K164]>0;1;0) -> 0 | U164: of:=IF([.L164]>0;1;0) -> 1 | V164: of:=[.N164]*[.N$402]+[.O164]*[.O$402]+[.P164]*[.P$402]+[.Q164]*[.Q$402]+[.R164]*[.R$402]+[.S164]*[.S$402]+[.T164]*[.T$402]+[.U164]*[.U$402] -> 0.308633066549229 | W164: 19211 | Y164: of:=[.W164]+[.X164] -> 19211 | Z164: of:=[.Y164]/[.Y$401] -> 6.11695898062634 | AA164: of:=[.D164]+[.M164]+[.V164]+[.Z164] -> 17.7032823564668 | AB164: of:=RANK([.AA164];[.AA$2:.AA$399];0) -> 163
A165: E Riding | B165: 265646 | C165: of:=IF(SUM([.E165:.L165])>0;[.B165];0) -> 265646 | D165: of:=[.C165]/[.C$401] -> 10.0052765540021 | H165: 1 | L165: 1 | M165: of:=[.E165]*[.AC$11]+[.F165]*[.AC$13]+[.G165]*[.AC$15]+[.H165]*[.AC$17]+[.I165]*[.AC$19]+[.J165]*[.AC$21]+[.K165]*[.AC$23]+[.L165]*[.AC$25] -> 1.02390704070172 | N165: of:=IF([.E165]>0;1;0) -> 0 | O165: of:=IF([.F165]>0;1;0) -> 0 | P165: of:=IF([.G165]>0;1;0) -> 0 | Q165: of:=IF([.H165]>0;1;0) -> 1 | R165: of:=IF([.I165]>0;1;0) -> 0 | S165: of:=IF([.J165]>0;1;0) -> 0 | T165: of:=IF([.K165]>0;1;0) -> 0 | U165: of:=IF([.L165]>0;1;0) -> 1 | V165: of:=[.N165]*[.N$402]+[.O165]*[.O$402]+[.P165]*[.P$402]+[.Q165]*[.Q$402]+[.R165]*[.R$402]+[.S165]*[.S$402]+[.T165]*[.T$402]+[.U165]*[.U$402] -> 0.308633066549229 | W165: 19354 | Y165: of:=[.W165]+[.X165] -> 19354 | Z165: of:=[.Y165]/[.Y$401] -> 6.16249149503109 | AA165: of:=[.D165]+[.M165]+[.V165]+[.Z165] -> 17.5003081562841 | AB165: of:=RANK([.AA165];[.AA$2:.AA$399];0) -> 164
A166: St Helens | B166: 137405 | C166: of:=IF(SUM([.E166:.L166])>0;[.B166];0) -> 137405 | D166: of:=[.C166]/[.C$401] -> 5.17521447679489 | G166: 1 | H166: 1 | I166: 1 | K166: 1 | L166: 1 | M166: of:=[.E166]*[.AC$11]+[.F166]*[.AC$13]+[.G166]*[.AC$15]+[.H166]*[.AC$17]+[.I166]*[.AC$19]+[.J166]*[.AC$21]+[.K166]*[.AC$23]+[.L166]*[.AC$25] -> 4.1770743494719 | N166: of:=IF([.E166]>0;1;0) -> 0 | O166: of:=IF([.F166]>0;1;0) -> 0 | P166: of:=IF([.G166]>0;1;0) -> 1 | Q166: of:=IF([.H166]>0;1;0) -> 1 | R166: of:=IF([.I166]>0;1;0) -> 1 | S166: of:=IF([.J166]>0;1;0) -> 0 | T166: of:=IF([.K166]>0;1;0) -> 1 | U166: of:=IF([.L166]>0;1;0) -> 1 | V166: of:=[.N166]*[.N$402]+[.O166]*[.O$402]+[.P166]*[.P$402]+[.Q166]*[.Q$402]+[.R166]*[.R$402]+[.S166]*[.S$402]+[.T166]*[.T$402]+[.U166]*[.U$402] -> 2.03350799196213 | W166: of:=4097+14834 -> 18931 | Y166: of:=[.W166]+[.X166] -> 18931 | Z166: of:=[.Y166]/[.Y$401] -> 6.0278044069667 | AA166: of:=[.D166]+[.M166]+[.V166]+[.Z166] -> 17.4136012251956 | AB166: of:=RANK([.AA166];[.AA$2:.AA$399];0) -> 165
A167: Eilean Siar | B167: 21649 | C167: of:=IF(SUM([.E167:.L167])>0;[.B167];0) -> 21649 | D167: of:=[.C167]/[.C$401] -> 0.815386763277409 | F167: 1 | K167: 1 | M167: of:=[.E167]*[.AC$11]+[.F167]*[.AC$13]+[.G167]*[.AC$15]+[.H167]*[.AC$17]+[.I167]*[.AC$19]+[.J167]*[.AC$21]+[.K167]*[.AC$23]+[.L167]*[.AC$25] -> 7.47968861794637 | N167: of:=IF([.E167]>0;1;0) -> 0 | O167: of:=IF([.F167]>0;1;0) -> 1 | P167: of:=IF([.G167]>0;1;0) -> 0 | Q167: of:=IF([.H167]>0;1;0) -> 0 | R167: of:=IF([.I167]>0;1;0) -> 0 | S167: of:=IF([.J167]>0;1;0) -> 0 | T167: of:=IF([.K167]>0;1;0) -> 1 | U167: of:=IF([.L167]>0;1;0) -> 0 | V167: of:=[.N167]*[.N$402]+[.O167]*[.O$402]+[.P167]*[.P$402]+[.Q167]*[.Q$402]+[.R167]*[.R$402]+[.S167]*[.S$402]+[.T167]*[.T$402]+[.U167]*[.U$402] -> 8.66447956449209 | W167: 1298 | Y167: of:=[.W167]+[.X167] -> 1298 | Z167: of:=[.Y167]/[.Y$401] -> 0.413295130750767 | AA167: of:=[.D167]+[.M167]+[.V167]+[.Z167] -> 17.3728500764666 | AB167: of:=RANK([.AA167];[.AA$2:.AA$399];0) -> 166
A168: Basingstoke & Deane | B168: 133043 | C168: of:=IF(SUM([.E168:.L168])>0;[.B168];0) -> 133043 | D168: of:=[.C168]/[.C$401] -> 5.01092434508367 | G168: 1 | H168: 1 | I168: 1 | K168: 1 | L168: 1 | M168: of:=[.E168]*[.AC$11]+[.F168]*[.AC$13]+[.G168]*[.AC$15]+[.H168]*[.AC$17]+[.I168]*[.AC$19]+[.J168]*[.AC$21]+[.K168]*[.AC$23]+[.L168]*[.AC$25] -> 4.1770743494719 | N168: of:=IF([.E168]>0;1;0) -> 0 | O168: of:=IF([.F168]>0;1;0) -> 0 | P168: of:=IF([.G168]>0;1;0) -> 1 | Q168: of:=IF([.H168]>0;1;0) -> 1 | R168: of:=IF([.I168]>0;1;0) -> 1 | S168: of:=IF([.J168]>0;1;0) -> 0 | T168: of:=IF([.K168]>0;1;0) -> 1 | U168: of:=IF([.L168]>0;1;0) -> 1 | V168: of:=[.N168]*[.N$402]+[.O168]*[.O$402]+[.P168]*[.P$402]+[.Q168]*[.Q$402]+[.R168]*[.R$402]+[.S168]*[.S$402]+[.T168]*[.T$402]+[.U168]*[.U$402] -> 2.03350799196213 | W168: of:=99+19035 -> 19134 | Y168: of:=[.W168]+[.X168] -> 19134 | Z168: of:=[.Y168]/[.Y$401] -> 6.09244147286994 | AA168: of:=[.D168]+[.M168]+[.V168]+[.Z168] -> 17.3139481593876 | AB168: of:=RANK([.AA168];[.AA$2:.AA$399];0) -> 167
A169: Shetland | B169: 17670 | C169: of:=IF(SUM([.E169:.L169])>0;[.B169];0) -> 17670 | D169: of:=[.C169]/[.C$401] -> 0.665521922819152 | F169: 1 | K169: 1 | M169: of:=[.E169]*[.AC$11]+[.F169]*[.AC$13]+[.G169]*[.AC$15]+[.H169]*[.AC$17]+[.I169]*[.AC$19]+[.J169]*[.AC$21]+[.K169]*[.AC$23]+[.L169]*[.AC$25] -> 7.47968861794637 | N169: of:=IF([.E169]>0;1;0) -> 0 | O169: of:=IF([.F169]>0;1;0) -> 1 | P169: of:=IF([.G169]>0;1;0) -> 0 | Q169: of:=IF([.H169]>0;1;0) -> 0 | R169: of:=IF([.I169]>0;1;0) -> 0 | S169: of:=IF([.J169]>0;1;0) -> 0 | T169: of:=IF([.K169]>0;1;0) -> 1 | U169: of:=IF([.L169]>0;1;0) -> 0 | V169: of:=[.N169]*[.N$402]+[.O169]*[.O$402]+[.P169]*[.P$402]+[.Q169]*[.Q$402]+[.R169]*[.R$402]+[.S169]*[.S$402]+[.T169]*[.T$402]+[.U169]*[.U$402] -> 8.66447956449209 | W169: 1306 | Y169: of:=[.W169]+[.X169] -> 1306 | Z169: of:=[.Y169]/[.Y$401] -> 0.4158424042839 | AA169: of:=[.D169]+[.M169]+[.V169]+[.Z169] -> 17.2255325095415 | AB169: of:=RANK([.AA169];[.AA$2:.AA$399];0) -> 168
A170: Orkney | B170: 17146 | C170: of:=IF(SUM([.E170:.L170])>0;[.B170];0) -> 17146 | D170: of:=[.C170]/[.C$401] -> 0.645786015204142 | F170: 1 | K170: 1 | M170: of:=[.E170]*[.AC$11]+[.F170]*[.AC$13]+[.G170]*[.AC$15]+[.H170]*[.AC$17]+[.I170]*[.AC$19]+[.J170]*[.AC$21]+[.K170]*[.AC$23]+[.L170]*[.AC$25] -> 7.47968861794637 | N170: of:=IF([.E170]>0;1;0) -> 0 | O170: of:=IF([.F170]>0;1;0) -> 1 | P170: of:=IF([.G170]>0;1;0) -> 0 | Q170: of:=IF([.H170]>0;1;0) -> 0 | R170: of:=IF([.I170]>0;1;0) -> 0 | S170: of:=IF([.J170]>0;1;0) -> 0 | T170: of:=IF([.K170]>0;1;0) -> 1 | U170: of:=IF([.L170]>0;1;0) -> 0 | V170: of:=[.N170]*[.N$402]+[.O170]*[.O$402]+[.P170]*[.P$402]+[.Q170]*[.Q$402]+[.R170]*[.R$402]+[.S170]*[.S$402]+[.T170]*[.T$402]+[.U170]*[.U$402] -> 8.66447956449209 | W170: 1314 | Y170: of:=[.W170]+[.X170] -> 1314 | Z170: of:=[.Y170]/[.Y$401] -> 0.418389677817032 | AA170: of:=[.D170]+[.M170]+[.V170]+[.Z170] -> 17.2083438754596 | AB170: of:=RANK([.AA170];[.AA$2:.AA$399];0) -> 169
A171: Leicester | B171: 245667 | C171: of:=IF(SUM([.E171:.L171])>0;[.B171];0) -> 245667 | D171: of:=[.C171]/[.C$401] -> 9.25278858026105 | H171: 1 | L171: 1 | M171: of:=[.E171]*[.AC$11]+[.F171]*[.AC$13]+[.G171]*[.AC$15]+[.H171]*[.AC$17]+[.I171]*[.AC$19]+[.J171]*[.AC$21]+[.K171]*[.AC$23]+[.L171]*[.AC$25] -> 1.02390704070172 | N171: of:=IF([.E171]>0;1;0) -> 0 | O171: of:=IF([.F171]>0;1;0) -> 0 | P171: of:=IF([.G171]>0;1;0) -> 0 | Q171: of:=IF([.H171]>0;1;0) -> 1 | R171: of:=IF([.I171]>0;1;0) -> 0 | S171: of:=IF([.J171]>0;1;0) -> 0 | T171: of:=IF([.K171]>0;1;0) -> 0 | U171: of:=IF([.L171]>0;1;0) -> 1 | V171: of:=[.N171]*[.N$402]+[.O171]*[.O$402]+[.P171]*[.P$402]+[.Q171]*[.Q$402]+[.R171]*[.R$402]+[.S171]*[.S$402]+[.T171]*[.T$402]+[.U171]*[.U$402] -> 0.308633066549229 | W171: 19689 | Y171: of:=[.W171]+[.X171] -> 19689 | Z171: of:=[.Y171]/[.Y$401] -> 6.26915857423101 | AA171: of:=[.D171]+[.M171]+[.V171]+[.Z171] -> 16.854487261743 | AB171: of:=RANK([.AA171];[.AA$2:.AA$399];0) -> 170
A172: Maidstone | B172: 121186 | C172: of:=IF(SUM([.E172:.L172])>0;[.B172];0) -> 121186 | D172: of:=[.C172]/[.C$401] -> 4.56434293937531 | G172: 1 | H172: 1 | I172: 1 | K172: 1 | L172: 1 | M172: of:=[.E172]*[.AC$11]+[.F172]*[.AC$13]+[.G172]*[.AC$15]+[.H172]*[.AC$17]+[.I172]*[.AC$19]+[.J172]*[.AC$21]+[.K172]*[.AC$23]+[.L172]*[.AC$25] -> 4.1770743494719 | N172: of:=IF([.E172]>0;1;0) -> 0 | O172: of:=IF([.F172]>0;1;0) -> 0 | P172: of:=IF([.G172]>0;1;0) -> 1 | Q172: of:=IF([.H172]>0;1;0) -> 1 | R172: of:=IF([.I172]>0;1;0) -> 1 | S172: of:=IF([.J172]>0;1;0) -> 0 | T172: of:=IF([.K172]>0;1;0) -> 1 | U172: of:=IF([.L172]>0;1;0) -> 1 | V172: of:=[.N172]*[.N$402]+[.O172]*[.O$402]+[.P172]*[.P$402]+[.Q172]*[.Q$402]+[.R172]*[.R$402]+[.S172]*[.S$402]+[.T172]*[.T$402]+[.U172]*[.U$402] -> 2.03350799196213 | W172: of:=620+18072 -> 18692 | Y172: of:=[.W172]+[.X172] -> 18692 | Z172: of:=[.Y172]/[.Y$401] -> 5.95170461016436 | AA172: of:=[.D172]+[.M172]+[.V172]+[.Z172] -> 16.7266298909737 | AB172: of:=RANK([.AA172];[.AA$2:.AA$399];0) -> 171
A173: Knowsley | B173: 117321 | C173: of:=IF(SUM([.E173:.L173])>0;[.B173];0) -> 117321 | D173: of:=[.C173]/[.C$401] -> 4.4187717887417 | G173: 1 | H173: 1 | I173: 1 | K173: 1 | L173: 1 | M173: of:=[.E173]*[.AC$11]+[.F173]*[.AC$13]+[.G173]*[.AC$15]+[.H173]*[.AC$17]+[.I173]*[.AC$19]+[.J173]*[.AC$21]+[.K173]*[.AC$23]+[.L173]*[.AC$25] -> 4.1770743494719 | N173: of:=IF([.E173]>0;1;0) -> 0 | O173: of:=IF([.F173]>0;1;0) -> 0 | P173: of:=IF([.G173]>0;1;0) -> 1 | Q173: of:=IF([.H173]>0;1;0) -> 1 | R173: of:=IF([.I173]>0;1;0) -> 1 | S173: of:=IF([.J173]>0;1;0) -> 0 | T173: of:=IF([.K173]>0;1;0) -> 1 | U173: of:=IF([.L173]>0;1;0) -> 1 | V173: of:=[.N173]*[.N$402]+[.O173]*[.O$402]+[.P173]*[.P$402]+[.Q173]*[.Q$402]+[.R173]*[.R$402]+[.S173]*[.S$402]+[.T173]*[.T$402]+[.U173]*[.U$402] -> 2.03350799196213 | W173: of:=399+18711 -> 19110 | Y173: of:=[.W173]+[.X173] -> 19110 | Z173: of:=[.Y173]/[.Y$401] -> 6.08479965227054 | AA173: of:=[.D173]+[.M173]+[.V173]+[.Z173] -> 16.7141537824463 | AB173: of:=RANK([.AA173];[.AA$2:.AA$399];0) -> 172
A174: City | B174: 6603 | C174: of:=IF(SUM([.E174:.L174])>0;[.B174];0) -> 6603 | D174: of:=[.C174]/[.C$401] -> 0.248695034316631 | F174: 1 | J174: 1 | M174: of:=[.E174]*[.AC$11]+[.F174]*[.AC$13]+[.G174]*[.AC$15]+[.H174]*[.AC$17]+[.I174]*[.AC$19]+[.J174]*[.AC$21]+[.K174]*[.AC$23]+[.L174]*[.AC$25] -> 7.5657065638351 | N174: of:=IF([.E174]>0;1;0) -> 0 | O174: of:=IF([.F174]>0;1;0) -> 1 | P174: of:=IF([.G174]>0;1;0) -> 0 | Q174: of:=IF([.H174]>0;1;0) -> 0 | R174: of:=IF([.I174]>0;1;0) -> 0 | S174: of:=IF([.J174]>0;1;0) -> 1 | T174: of:=IF([.K174]>0;1;0) -> 0 | U174: of:=IF([.L174]>0;1;0) -> 0 | V174: of:=[.N174]*[.N$402]+[.O174]*[.O$402]+[.P174]*[.P$402]+[.Q174]*[.Q$402]+[.R174]*[.R$402]+[.S174]*[.S$402]+[.T174]*[.T$402]+[.U174]*[.U$402] -> 8.81834755033414 | W174: 68 | Y174: of:=[.W174]+[.X174] -> 68 | Z174: of:=[.Y174]/[.Y$401] -> 0.0216518250316272 | AA174: of:=[.D174]+[.M174]+[.V174]+[.Z174] -> 16.6544009735175 | AB174: of:=RANK([.AA174];[.AA$2:.AA$399];0) -> 173
A175: Newcastle upon Tyne | B175: 179521 | C175: of:=IF(SUM([.E175:.L175])>0;[.B175];0) -> 179521 | D175: of:=[.C175]/[.C$401] -> 6.76146921937844 | G175: 1 | H175: 1 | I175: 1 | K175: 1 | L175: 1 | M175: of:=[.E175]*[.AC$11]+[.F175]*[.AC$13]+[.G175]*[.AC$15]+[.H175]*[.AC$17]+[.I175]*[.AC$19]+[.J175]*[.AC$21]+[.K175]*[.AC$23]+[.L175]*[.AC$25] -> 4.1770743494719 | N175: of:=IF([.E175]>0;1;0) -> 0 | O175: of:=IF([.F175]>0;1;0) -> 0 | P175: of:=IF([.G175]>0;1;0) -> 1 | Q175: of:=IF([.H175]>0;1;0) -> 1 | R175: of:=IF([.I175]>0;1;0) -> 1 | S175: of:=IF([.J175]>0;1;0) -> 0 | T175: of:=IF([.K175]>0;1;0) -> 1 | U175: of:=IF([.L175]>0;1;0) -> 1 | V175: of:=[.N175]*[.N$402]+[.O175]*[.O$402]+[.P175]*[.P$402]+[.Q175]*[.Q$402]+[.R175]*[.R$402]+[.S175]*[.S$402]+[.T175]*[.T$402]+[.U175]*[.U$402] -> 2.03350799196213 | W175: of:=132+11317 -> 11449 | Y175: of:=[.W175]+[.X175] -> 11449 | Z175: of:=[.Y175]/[.Y$401] -> 3.64546683510442 | AA175: of:=[.D175]+[.M175]+[.V175]+[.Z175] -> 16.6175183959169 | AB175: of:=RANK([.AA175];[.AA$2:.AA$399];0) -> 174
A176: Ryedale | B176: 41931 | C176: of:=IF(SUM([.E176:.L176])>0;[.B176];0) -> 41931 | D176: of:=[.C176]/[.C$401] -> 1.57928691260497 | H176: 1 | L176: 1 | M176: of:=[.E176]*[.AC$11]+[.F176]*[.AC$13]+[.G176]*[.AC$15]+[.H176]*[.AC$17]+[.I176]*[.AC$19]+[.J176]*[.AC$21]+[.K176]*[.AC$23]+[.L176]*[.AC$25] -> 1.02390704070172 | N176: of:=IF([.E176]>0;1;0) -> 0 | O176: of:=IF([.F176]>0;1;0) -> 0 | P176: of:=IF([.G176]>0;1;0) -> 0 | Q176: of:=IF([.H176]>0;1;0) -> 1 | R176: of:=IF([.I176]>0;1;0) -> 0 | S176: of:=IF([.J176]>0;1;0) -> 0 | T176: of:=IF([.K176]>0;1;0) -> 0 | U176: of:=IF([.L176]>0;1;0) -> 1 | V176: of:=[.N176]*[.N$402]+[.O176]*[.O$402]+[.P176]*[.P$402]+[.Q176]*[.Q$402]+[.R176]*[.R$402]+[.S176]*[.S$402]+[.T176]*[.T$402]+[.U176]*[.U$402] -> 0.308633066549229 | W176: 42462 | Y176: of:=[.W176]+[.X176] -> 42462 | Z176: of:=[.Y176]/[.Y$401] -> 13.5202910954847 | AA176: of:=[.D176]+[.M176]+[.V176]+[.Z176] -> 16.4321181153406 | AB176: of:=RANK([.AA176];[.AA$2:.AA$399];0) -> 175
A177: Norwich | B177: 99147 | C177: of:=IF(SUM([.E177:.L177])>0;[.B177];0) -> 99147 | D177: of:=[.C177]/[.C$401] -> 3.73426723722414 | G177: 1 | H177: 1 | I177: 1 | K177: 1 | L177: 1 | M177: of:=[.E177]*[.AC$11]+[.F177]*[.AC$13]+[.G177]*[.AC$15]+[.H177]*[.AC$17]+[.I177]*[.AC$19]+[.J177]*[.AC$21]+[.K177]*[.AC$23]+[.L177]*[.AC$25] -> 4.1770743494719 | N177: of:=IF([.E177]>0;1;0) -> 0 | O177: of:=IF([.F177]>0;1;0) -> 0 | P177: of:=IF([.G177]>0;1;0) -> 1 | Q177: of:=IF([.H177]>0;1;0) -> 1 | R177: of:=IF([.I177]>0;1;0) -> 1 | S177: of:=IF([.J177]>0;1;0) -> 0 | T177: of:=IF([.K177]>0;1;0) -> 1 | U177: of:=IF([.L177]>0;1;0) -> 1 | V177: of:=[.N177]*[.N$402]+[.O177]*[.O$402]+[.P177]*[.P$402]+[.Q177]*[.Q$402]+[.R177]*[.R$402]+[.S177]*[.S$402]+[.T177]*[.T$402]+[.U177]*[.U$402] -> 2.03350799196213 | W177: of:=4346+15905 -> 20251 | Y177: of:=[.W177]+[.X177] -> 20251 | Z177: of:=[.Y177]/[.Y$401] -> 6.44810453993358 | AA177: of:=[.D177]+[.M177]+[.V177]+[.Z177] -> 16.3929541185917 | AB177: of:=RANK([.AA177];[.AA$2:.AA$399];0) -> 176
A178: Eden | B178: 42107 | C178: of:=IF(SUM([.E178:.L178])>0;[.B178];0) -> 42107 | D178: of:=[.C178]/[.C$401] -> 1.58591576707108 | H178: 1 | L178: 1 | M178: of:=[.E178]*[.AC$11]+[.F178]*[.AC$13]+[.G178]*[.AC$15]+[.H178]*[.AC$17]+[.I178]*[.AC$19]+[.J178]*[.AC$21]+[.K178]*[.AC$23]+[.L178]*[.AC$25] -> 1.02390704070172 | N178: of:=IF([.E178]>0;1;0) -> 0 | O178: of:=IF([.F178]>0;1;0) -> 0 | P178: of:=IF([.G178]>0;1;0) -> 0 | Q178: of:=IF([.H178]>0;1;0) -> 1 | R178: of:=IF([.I178]>0;1;0) -> 0 | S178: of:=IF([.J178]>0;1;0) -> 0 | T178: of:=IF([.K178]>0;1;0) -> 0 | U178: of:=IF([.L178]>0;1;0) -> 1 | V178: of:=[.N178]*[.N$402]+[.O178]*[.O$402]+[.P178]*[.P$402]+[.Q178]*[.Q$402]+[.R178]*[.R$402]+[.S178]*[.S$402]+[.T178]*[.T$402]+[.U178]*[.U$402] -> 0.308633066549229 | W178: 42279 | Y178: of:=[.W178]+[.X178] -> 42279 | Z178: of:=[.Y178]/[.Y$401] -> 13.4620222134142 | AA178: of:=[.D178]+[.M178]+[.V178]+[.Z178] -> 16.3804780877363 | AB178: of:=RANK([.AA178];[.AA$2:.AA$399];0) -> 177
A179: Melton | B179: 38876 | C179: of:=IF(SUM([.E179:.L179])>0;[.B179];0) -> 38876 | D179: of:=[.C179]/[.C$401] -> 1.4642235580938 | H179: 1 | L179: 1 | M179: of:=[.E179]*[.AC$11]+[.F179]*[.AC$13]+[.G179]*[.AC$15]+[.H179]*[.AC$17]+[.I179]*[.AC$19]+[.J179]*[.AC$21]+[.K179]*[.AC$23]+[.L179]*[.AC$25] -> 1.02390704070172 | N179: of:=IF([.E179]>0;1;0) -> 0 | O179: of:=IF([.F179]>0;1;0) -> 0 | P179: of:=IF([.G179]>0;1;0) -> 0 | Q179: of:=IF([.H179]>0;1;0) -> 1 | R179: of:=IF([.I179]>0;1;0) -> 0 | S179: of:=IF([.J179]>0;1;0) -> 0 | T179: of:=IF([.K179]>0;1;0) -> 0 | U179: of:=IF([.L179]>0;1;0) -> 1 | V179: of:=[.N179]*[.N$402]+[.O179]*[.O$402]+[.P179]*[.P$402]+[.Q179]*[.Q$402]+[.R179]*[.R$402]+[.S179]*[.S$402]+[.T179]*[.T$402]+[.U179]*[.U$402] -> 0.308633066549229 | W179: 42645 | Y179: of:=[.W179]+[.X179] -> 42645 | Z179: of:=[.Y179]/[.Y$401] -> 13.5785599775551 | AA179: of:=[.D179]+[.M179]+[.V179]+[.Z179] -> 16.3753236428998 | AB179: of:=RANK([.AA179];[.AA$2:.AA$399];0) -> 178
A180: Derbys Dales | B180: 57287 | C180: of:=IF(SUM([.E180:.L180])>0;[.B180];0) -> 57287 | D180: of:=[.C180]/[.C$401] -> 2.15765446477311 | H180: 1 | L180: 1 | M180: of:=[.E180]*[.AC$11]+[.F180]*[.AC$13]+[.G180]*[.AC$15]+[.H180]*[.AC$17]+[.I180]*[.AC$19]+[.J180]*[.AC$21]+[.K180]*[.AC$23]+[.L180]*[.AC$25] -> 1.02390704070172 | N180: of:=IF([.E180]>0;1;0) -> 0 | O180: of:=IF([.F180]>0;1;0) -> 0 | P180: of:=IF([.G180]>0;1;0) -> 0 | Q180: of:=IF([.H180]>0;1;0) -> 1 | R180: of:=IF([.I180]>0;1;0) -> 0 | S180: of:=IF([.J180]>0;1;0) -> 0 | T180: of:=IF([.K180]>0;1;0) -> 0 | U180: of:=IF([.L180]>0;1;0) -> 1 | V180: of:=[.N180]*[.N$402]+[.O180]*[.O$402]+[.P180]*[.P$402]+[.Q180]*[.Q$402]+[.R180]*[.R$402]+[.S180]*[.S$402]+[.T180]*[.T$402]+[.U180]*[.U$402] -> 0.308633066549229 | W180: 40465 | Y180: of:=[.W180]+[.X180] -> 40465 | Z180: of:=[.Y180]/[.Y$401] -> 12.8844279397764 | AA180: of:=[.D180]+[.M180]+[.V180]+[.Z180] -> 16.3746225118005 | AB180: of:=RANK([.AA180];[.AA$2:.AA$399];0) -> 179
A181: Torridge | B181: 52550 | C181: of:=IF(SUM([.E181:.L181])>0;[.B181];0) -> 52550 | D181: of:=[.C181]/[.C$401] -> 1.97924035337558 | H181: 1 | L181: 1 | M181: of:=[.E181]*[.AC$11]+[.F181]*[.AC$13]+[.G181]*[.AC$15]+[.H181]*[.AC$17]+[.I181]*[.AC$19]+[.J181]*[.AC$21]+[.K181]*[.AC$23]+[.L181]*[.AC$25] -> 1.02390704070172 | N181: of:=IF([.E181]>0;1;0) -> 0 | O181: of:=IF([.F181]>0;1;0) -> 0 | P181: of:=IF([.G181]>0;1;0) -> 0 | Q181: of:=IF([.H181]>0;1;0) -> 1 | R181: of:=IF([.I181]>0;1;0) -> 0 | S181: of:=IF([.J181]>0;1;0) -> 0 | T181: of:=IF([.K181]>0;1;0) -> 0 | U181: of:=IF([.L181]>0;1;0) -> 1 | V181: of:=[.N181]*[.N$402]+[.O181]*[.O$402]+[.P181]*[.P$402]+[.Q181]*[.Q$402]+[.R181]*[.R$402]+[.S181]*[.S$402]+[.T181]*[.T$402]+[.U181]*[.U$402] -> 0.308633066549229 | W181: 41007 | Y181: of:=[.W181]+[.X181] -> 41007 | Z181: of:=[.Y181]/[.Y$401] -> 13.0570057216462 | AA181: of:=[.D181]+[.M181]+[.V181]+[.Z181] -> 16.3687861822727 | AB181: of:=RANK([.AA181];[.AA$2:.AA$399];0) -> 180
A182: N Warks | B182: 49088 | C182: of:=IF(SUM([.E182:.L182])>0;[.B182];0) -> 49088 | D182: of:=[.C182]/[.C$401] -> 1.84884777291152 | H182: 1 | L182: 1 | M182: of:=[.E182]*[.AC$11]+[.F182]*[.AC$13]+[.G182]*[.AC$15]+[.H182]*[.AC$17]+[.I182]*[.AC$19]+[.J182]*[.AC$21]+[.K182]*[.AC$23]+[.L182]*[.AC$25] -> 1.02390704070172 | N182: of:=IF([.E182]>0;1;0) -> 0 | O182: of:=IF([.F182]>0;1;0) -> 0 | P182: of:=IF([.G182]>0;1;0) -> 0 | Q182: of:=IF([.H182]>0;1;0) -> 1 | R182: of:=IF([.I182]>0;1;0) -> 0 | S182: of:=IF([.J182]>0;1;0) -> 0 | T182: of:=IF([.K182]>0;1;0) -> 0 | U182: of:=IF([.L182]>0;1;0) -> 1 | V182: of:=[.N182]*[.N$402]+[.O182]*[.O$402]+[.P182]*[.P$402]+[.Q182]*[.Q$402]+[.R182]*[.R$402]+[.S182]*[.S$402]+[.T182]*[.T$402]+[.U182]*[.U$402] -> 0.308633066549229 | W182: 41370 | Y182: of:=[.W182]+[.X182] -> 41370 | Z182: of:=[.Y182]/[.Y$401] -> 13.1725882582121 | AA182: of:=[.D182]+[.M182]+[.V182]+[.Z182] -> 16.3539761383745 | AB182: of:=RANK([.AA182];[.AA$2:.AA$399];0) -> 181
A183: Boston | B183: 47500 | C183: of:=IF(SUM([.E183:.L183])>0;[.B183];0) -> 47500 | D183: of:=[.C183]/[.C$401] -> 1.7890374269332 | H183: 1 | L183: 1 | M183: of:=[.E183]*[.AC$11]+[.F183]*[.AC$13]+[.G183]*[.AC$15]+[.H183]*[.AC$17]+[.I183]*[.AC$19]+[.J183]*[.AC$21]+[.K183]*[.AC$23]+[.L183]*[.AC$25] -> 1.02390704070172 | N183: of:=IF([.E183]>0;1;0) -> 0 | O183: of:=IF([.F183]>0;1;0) -> 0 | P183: of:=IF([.G183]>0;1;0) -> 0 | Q183: of:=IF([.H183]>0;1;0) -> 1 | R183: of:=IF([.I183]>0;1;0) -> 0 | S183: of:=IF([.J183]>0;1;0) -> 0 | T183: of:=IF([.K183]>0;1;0) -> 0 | U183: of:=IF([.L183]>0;1;0) -> 1 | V183: of:=[.N183]*[.N$402]+[.O183]*[.O$402]+[.P183]*[.P$402]+[.Q183]*[.Q$402]+[.R183]*[.R$402]+[.S183]*[.S$402]+[.T183]*[.T$402]+[.U183]*[.U$402] -> 0.308633066549229 | W183: 41551 | Y183: of:=[.W183]+[.X183] -> 41551 | Z183: of:=[.Y183]/[.Y$401] -> 13.2302203218992 | AA183: of:=[.D183]+[.M183]+[.V183]+[.Z183] -> 16.3517978560833 | AB183: of:=RANK([.AA183];[.AA$2:.AA$399];0) -> 182
A184: Epsom and Ewell | B184: 58173 | C184: of:=IF(SUM([.E184:.L184])>0;[.B184];0) -> 58173 | D184: of:=[.C184]/[.C$401] -> 2.19102472077864 | H184: 1 | L184: 1 | M184: of:=[.E184]*[.AC$11]+[.F184]*[.AC$13]+[.G184]*[.AC$15]+[.H184]*[.AC$17]+[.I184]*[.AC$19]+[.J184]*[.AC$21]+[.K184]*[.AC$23]+[.L184]*[.AC$25] -> 1.02390704070172 | N184: of:=IF([.E184]>0;1;0) -> 0 | O184: of:=IF([.F184]>0;1;0) -> 0 | P184: of:=IF([.G184]>0;1;0) -> 0 | Q184: of:=IF([.H184]>0;1;0) -> 1 | R184: of:=IF([.I184]>0;1;0) -> 0 | S184: of:=IF([.J184]>0;1;0) -> 0 | T184: of:=IF([.K184]>0;1;0) -> 0 | U184: of:=IF([.L184]>0;1;0) -> 1 | V184: of:=[.N184]*[.N$402]+[.O184]*[.O$402]+[.P184]*[.P$402]+[.Q184]*[.Q$402]+[.R184]*[.R$402]+[.S184]*[.S$402]+[.T184]*[.T$402]+[.U184]*[.U$402] -> 0.308633066549229 | W184: 40285 | Y184: of:=[.W184]+[.X184] -> 40285 | Z184: of:=[.Y184]/[.Y$401] -> 12.8271142852809 | AA184: of:=[.D184]+[.M184]+[.V184]+[.Z184] -> 16.3506791133105 | AB184: of:=RANK([.AA184];[.AA$2:.AA$399];0) -> 183
A185: W Devon | B185: 42710 | C185: of:=IF(SUM([.E185:.L185])>0;[.B185];0) -> 42710 | D185: of:=[.C185]/[.C$401] -> 1.60862712640668 | H185: 1 | L185: 1 | M185: of:=[.E185]*[.AC$11]+[.F185]*[.AC$13]+[.G185]*[.AC$15]+[.H185]*[.AC$17]+[.I185]*[.AC$19]+[.J185]*[.AC$21]+[.K185]*[.AC$23]+[.L185]*[.AC$25] -> 1.02390704070172 | N185: of:=IF([.E185]>0;1;0) -> 0 | O185: of:=IF([.F185]>0;1;0) -> 0 | P185: of:=IF([.G185]>0;1;0) -> 0 | Q185: of:=IF([.H185]>0;1;0) -> 1 | R185: of:=IF([.I185]>0;1;0) -> 0 | S185: of:=IF([.J185]>0;1;0) -> 0 | T185: of:=IF([.K185]>0;1;0) -> 0 | U185: of:=IF([.L185]>0;1;0) -> 1 | V185: of:=[.N185]*[.N$402]+[.O185]*[.O$402]+[.P185]*[.P$402]+[.Q185]*[.Q$402]+[.R185]*[.R$402]+[.S185]*[.S$402]+[.T185]*[.T$402]+[.U185]*[.U$402] -> 0.308633066549229 | W185: 42097 | Y185: of:=[.W185]+[.X185] -> 42097 | Z185: of:=[.Y185]/[.Y$401] -> 13.4040717405355 | AA185: of:=[.D185]+[.M185]+[.V185]+[.Z185] -> 16.3452389741931 | AB185: of:=RANK([.AA185];[.AA$2:.AA$399];0) -> 184
A186: Ribble Valley | B186: 45744 | C186: of:=IF(SUM([.E186:.L186])>0;[.B186];0) -> 45744 | D186: of:=[.C186]/[.C$401] -> 1.72289953805542 | H186: 1 | L186: 1 | M186: of:=[.E186]*[.AC$11]+[.F186]*[.AC$13]+[.G186]*[.AC$15]+[.H186]*[.AC$17]+[.I186]*[.AC$19]+[.J186]*[.AC$21]+[.K186]*[.AC$23]+[.L186]*[.AC$25] -> 1.02390704070172 | N186: of:=IF([.E186]>0;1;0) -> 0 | O186: of:=IF([.F186]>0;1;0) -> 0 | P186: of:=IF([.G186]>0;1;0) -> 0 | Q186: of:=IF([.H186]>0;1;0) -> 1 | R186: of:=IF([.I186]>0;1;0) -> 0 | S186: of:=IF([.J186]>0;1;0) -> 0 | T186: of:=IF([.K186]>0;1;0) -> 0 | U186: of:=IF([.L186]>0;1;0) -> 1 | V186: of:=[.N186]*[.N$402]+[.O186]*[.O$402]+[.P186]*[.P$402]+[.Q186]*[.Q$402]+[.R186]*[.R$402]+[.S186]*[.S$402]+[.T186]*[.T$402]+[.U186]*[.U$402] -> 0.308633066549229 | W186: 41733 | Y186: of:=[.W186]+[.X186] -> 41733 | Z186: of:=[.Y186]/[.Y$401] -> 13.2881707947779 | AA186: of:=[.D186]+[.M186]+[.V186]+[.Z186] -> 16.3436104400843 | AB186: of:=RANK([.AA186];[.AA$2:.AA$399];0) -> 185
A187: Maldon | B187: 50134 | C187: of:=IF(SUM([.E187:.L187])>0;[.B187];0) -> 50134 | D187: of:=[.C187]/[.C$401] -> 1.88824426024988 | H187: 1 | L187: 1 | M187: of:=[.E187]*[.AC$11]+[.F187]*[.AC$13]+[.G187]*[.AC$15]+[.H187]*[.AC$17]+[.I187]*[.AC$19]+[.J187]*[.AC$21]+[.K187]*[.AC$23]+[.L187]*[.AC$25] -> 1.02390704070172 | N187: of:=IF([.E187]>0;1;0) -> 0 | O187: of:=IF([.F187]>0;1;0) -> 0 | P187: of:=IF([.G187]>0;1;0) -> 0 | Q187: of:=IF([.H187]>0;1;0) -> 1 | R187: of:=IF([.I187]>0;1;0) -> 0 | S187: of:=IF([.J187]>0;1;0) -> 0 | T187: of:=IF([.K187]>0;1;0) -> 0 | U187: of:=IF([.L187]>0;1;0) -> 1 | V187: of:=[.N187]*[.N$402]+[.O187]*[.O$402]+[.P187]*[.P$402]+[.Q187]*[.Q$402]+[.R187]*[.R$402]+[.S187]*[.S$402]+[.T187]*[.T$402]+[.U187]*[.U$402] -> 0.308633066549229 | W187: 41188 | Y187: of:=[.W187]+[.X187] -> 41188 | Z187: of:=[.Y187]/[.Y$401] -> 13.1146377853333 | AA187: of:=[.D187]+[.M187]+[.V187]+[.Z187] -> 16.3354221528341 | AB187: of:=RANK([.AA187];[.AA$2:.AA$399];0) -> 186
A188: Barrow-in-Furness | B188: 52947 | C188: of:=IF(SUM([.E188:.L188])>0;[.B188];0) -> 52947 | D188: of:=[.C188]/[.C$401] -> 1.99419293987016 | H188: 1 | L188: 1 | M188: of:=[.E188]*[.AC$11]+[.F188]*[.AC$13]+[.G188]*[.AC$15]+[.H188]*[.AC$17]+[.I188]*[.AC$19]+[.J188]*[.AC$21]+[.K188]*[.AC$23]+[.L188]*[.AC$25] -> 1.02390704070172 | N188: of:=IF([.E188]>0;1;0) -> 0 | O188: of:=IF([.F188]>0;1;0) -> 0 | P188: of:=IF([.G188]>0;1;0) -> 0 | Q188: of:=IF([.H188]>0;1;0) -> 1 | R188: of:=IF([.I188]>0;1;0) -> 0 | S188: of:=IF([.J188]>0;1;0) -> 0 | T188: of:=IF([.K188]>0;1;0) -> 0 | U188: of:=IF([.L188]>0;1;0) -> 1 | V188: of:=[.N188]*[.N$402]+[.O188]*[.O$402]+[.P188]*[.P$402]+[.Q188]*[.Q$402]+[.R188]*[.R$402]+[.S188]*[.S$402]+[.T188]*[.T$402]+[.U188]*[.U$402] -> 0.308633066549229 | W188: 40826 | Y188: of:=[.W188]+[.X188] -> 40826 | Z188: of:=[.Y188]/[.Y$401] -> 12.999373657959 | AA188: of:=[.D188]+[.M188]+[.V188]+[.Z188] -> 16.3261067050801 | AB188: of:=RANK([.AA188];[.AA$2:.AA$399];0) -> 187
A189: Uttlesford | B189: 66410 | C189: of:=IF(SUM([.E189:.L189])>0;[.B189];0) -> 66410 | D189: of:=[.C189]/[.C$401] -> 2.50126264258177 | H189: 1 | L189: 1 | M189: of:=[.E189]*[.AC$11]+[.F189]*[.AC$13]+[.G189]*[.AC$15]+[.H189]*[.AC$17]+[.I189]*[.AC$19]+[.J189]*[.AC$21]+[.K189]*[.AC$23]+[.L189]*[.AC$25] -> 1.02390704070172 | N189: of:=IF([.E189]>0;1;0) -> 0 | O189: of:=IF([.F189]>0;1;0) -> 0 | P189: of:=IF([.G189]>0;1;0) -> 0 | Q189: of:=IF([.H189]>0;1;0) -> 1 | R189: of:=IF([.I189]>0;1;0) -> 0 | S189: of:=IF([.J189]>0;1;0) -> 0 | T189: of:=IF([.K189]>0;1;0) -> 0 | U189: of:=IF([.L189]>0;1;0) -> 1 | V189: of:=[.N189]*[.N$402]+[.O189]*[.O$402]+[.P189]*[.P$402]+[.Q189]*[.Q$402]+[.R189]*[.R$402]+[.S189]*[.S$402]+[.T189]*[.T$402]+[.U189]*[.U$402] -> 0.308633066549229 | W189: 39209 | Y189: of:=[.W189]+[.X189] -> 39209 | Z189: of:=[.Y189]/[.Y$401] -> 12.4845059950746 | AA189: of:=[.D189]+[.M189]+[.V189]+[.Z189] -> 16.3183087449073 | AB189: of:=RANK([.AA189];[.AA$2:.AA$399];0) -> 188
A190: Bolsover | B190: 58833 | C190: of:=IF(SUM([.E190:.L190])>0;[.B190];0) -> 58833 | D190: of:=[.C190]/[.C$401] -> 2.21588292502655 | H190: 1 | L190: 1 | M190: of:=[.E190]*[.AC$11]+[.F190]*[.AC$13]+[.G190]*[.AC$15]+[.H190]*[.AC$17]+[.I190]*[.AC$19]+[.J190]*[.AC$21]+[.K190]*[.AC$23]+[.L190]*[.AC$25] -> 1.02390704070172 | N190: of:=IF([.E190]>0;1;0) -> 0 | O190: of:=IF([.F190]>0;1;0) -> 0 | P190: of:=IF([.G190]>0;1;0) -> 0 | Q190: of:=IF([.H190]>0;1;0) -> 1 | R190: of:=IF([.I190]>0;1;0) -> 0 | S190: of:=IF([.J190]>0;1;0) -> 0 | T190: of:=IF([.K190]>0;1;0) -> 0 | U190: of:=IF([.L190]>0;1;0) -> 1 | V190: of:=[.N190]*[.N$402]+[.O190]*[.O$402]+[.P190]*[.P$402]+[.Q190]*[.Q$402]+[.R190]*[.R$402]+[.S190]*[.S$402]+[.T190]*[.T$402]+[.U190]*[.U$402] -> 0.308633066549229 | W190: 40105 | Y190: of:=[.W190]+[.X190] -> 40105 | Z190: of:=[.Y190]/[.Y$401] -> 12.7698006307855 | AA190: of:=[.D190]+[.M190]+[.V190]+[.Z190] -> 16.318223663063 | AB190: of:=RANK([.AA190];[.AA$2:.AA$399];0) -> 189
A191: E Cambs | B191: 64875 | C191: of:=IF(SUM([.E191:.L191])>0;[.B191];0) -> 64875 | D191: of:=[.C191]/[.C$401] -> 2.44344848573246 | H191: 1 | L191: 1 | M191: of:=[.E191]*[.AC$11]+[.F191]*[.AC$13]+[.G191]*[.AC$15]+[.H191]*[.AC$17]+[.I191]*[.AC$19]+[.J191]*[.AC$21]+[.K191]*[.AC$23]+[.L191]*[.AC$25] -> 1.02390704070172 | N191: of:=IF([.E191]>0;1;0) -> 0 | O191: of:=IF([.F191]>0;1;0) -> 0 | P191: of:=IF([.G191]>0;1;0) -> 0 | Q191: of:=IF([.H191]>0;1;0) -> 1 | R191: of:=IF([.I191]>0;1;0) -> 0 | S191: of:=IF([.J191]>0;1;0) -> 0 | T191: of:=IF([.K191]>0;1;0) -> 0 | U191: of:=IF([.L191]>0;1;0) -> 1 | V191: of:=[.N191]*[.N$402]+[.O191]*[.O$402]+[.P191]*[.P$402]+[.Q191]*[.Q$402]+[.R191]*[.R$402]+[.S191]*[.S$402]+[.T191]*[.T$402]+[.U191]*[.U$402] -> 0.308633066549229 | W191: 39387 | Y191: of:=[.W191]+[.X191] -> 39387 | Z191: of:=[.Y191]/[.Y$401] -> 12.5411828311868 | AA191: of:=[.D191]+[.M191]+[.V191]+[.Z191] -> 16.3171714241702 | AB191: of:=RANK([.AA191];[.AA$2:.AA$399];0) -> 190
A192: Malvern Hills | B192: 60070 | C192: of:=IF(SUM([.E192:.L192])>0;[.B192];0) -> 60070 | D192: of:=[.C192]/[.C$401] -> 2.26247322601848 | H192: 1 | L192: 1 | M192: of:=[.E192]*[.AC$11]+[.F192]*[.AC$13]+[.G192]*[.AC$15]+[.H192]*[.AC$17]+[.I192]*[.AC$19]+[.J192]*[.AC$21]+[.K192]*[.AC$23]+[.L192]*[.AC$25] -> 1.02390704070172 | N192: of:=IF([.E192]>0;1;0) -> 0 | O192: of:=IF([.F192]>0;1;0) -> 0 | P192: of:=IF([.G192]>0;1;0) -> 0 | Q192: of:=IF([.H192]>0;1;0) -> 1 | R192: of:=IF([.I192]>0;1;0) -> 0 | S192: of:=IF([.J192]>0;1;0) -> 0 | T192: of:=IF([.K192]>0;1;0) -> 0 | U192: of:=IF([.L192]>0;1;0) -> 1 | V192: of:=[.N192]*[.N$402]+[.O192]*[.O$402]+[.P192]*[.P$402]+[.Q192]*[.Q$402]+[.R192]*[.R$402]+[.S192]*[.S$402]+[.T192]*[.T$402]+[.U192]*[.U$402] -> 0.308633066549229 | W192: 39925 | Y192: of:=[.W192]+[.X192] -> 39925 | Z192: of:=[.Y192]/[.Y$401] -> 12.71248697629 | AA192: of:=[.D192]+[.M192]+[.V192]+[.Z192] -> 16.3075003095594 | AB192: of:=RANK([.AA192];[.AA$2:.AA$399];0) -> 191
A193: Oadby and Wigston | B193: 42848 | C193: of:=IF(SUM([.E193:.L193])>0;[.B193];0) -> 42848 | D193: of:=[.C193]/[.C$401] -> 1.61382475093124 | H193: 1 | L193: 1 | M193: of:=[.E193]*[.AC$11]+[.F193]*[.AC$13]+[.G193]*[.AC$15]+[.H193]*[.AC$17]+[.I193]*[.AC$19]+[.J193]*[.AC$21]+[.K193]*[.AC$23]+[.L193]*[.AC$25] -> 1.02390704070172 | N193: of:=IF([.E193]>0;1;0) -> 0 | O193: of:=IF([.F193]>0;1;0) -> 0 | P193: of:=IF([.G193]>0;1;0) -> 0 | Q193: of:=IF([.H193]>0;1;0) -> 1 | R193: of:=IF([.I193]>0;1;0) -> 0 | S193: of:=IF([.J193]>0;1;0) -> 0 | T193: of:=IF([.K193]>0;1;0) -> 0 | U193: of:=IF([.L193]>0;1;0) -> 1 | V193: of:=[.N193]*[.N$402]+[.O193]*[.O$402]+[.P193]*[.P$402]+[.Q193]*[.Q$402]+[.R193]*[.R$402]+[.S193]*[.S$402]+[.T193]*[.T$402]+[.U193]*[.U$402] -> 0.308633066549229 | W193: 41915 | Y193: of:=[.W193]+[.X193] -> 41915 | Z193: of:=[.Y193]/[.Y$401] -> 13.3461212676567 | AA193: of:=[.D193]+[.M193]+[.V193]+[.Z193] -> 16.2924861258389 | AB193: of:=RANK([.AA193];[.AA$2:.AA$399];0) -> 192
A194: Fylde | B194: 61069 | C194: of:=IF(SUM([.E194:.L194])>0;[.B194];0) -> 61069 | D194: of:=[.C194]/[.C$401] -> 2.30009950790282 | H194: 1 | L194: 1 | M194: of:=[.E194]*[.AC$11]+[.F194]*[.AC$13]+[.G194]*[.AC$15]+[.H194]*[.AC$17]+[.I194]*[.AC$19]+[.J194]*[.AC$21]+[.K194]*[.AC$23]+[.L194]*[.AC$25] -> 1.02390704070172 | N194: of:=IF([.E194]>0;1;0) -> 0 | O194: of:=IF([.F194]>0;1;0) -> 0 | P194: of:=IF([.G194]>0;1;0) -> 0 | Q194: of:=IF([.H194]>0;1;0) -> 1 | R194: of:=IF([.I194]>0;1;0) -> 0 | S194: of:=IF([.J194]>0;1;0) -> 0 | T194: of:=IF([.K194]>0;1;0) -> 0 | U194: of:=IF([.L194]>0;1;0) -> 1 | V194: of:=[.N194]*[.N$402]+[.O194]*[.O$402]+[.P194]*[.P$402]+[.Q194]*[.Q$402]+[.R194]*[.R$402]+[.S194]*[.S$402]+[.T194]*[.T$402]+[.U194]*[.U$402] -> 0.308633066549229 | W194: 39746 | Y194: of:=[.W194]+[.X194] -> 39746 | Z194: of:=[.Y194]/[.Y$401] -> 12.6554917309861 | AA194: of:=[.D194]+[.M194]+[.V194]+[.Z194] -> 16.2881313461399 | AB194: of:=RANK([.AA194];[.AA$2:.AA$399];0) -> 193
A195: Copeland | B195: 53297 | C195: of:=IF(SUM([.E195:.L195])>0;[.B195];0) -> 53297 | D195: of:=[.C195]/[.C$401] -> 2.00737532091072 | H195: 1 | L195: 1 | M195: of:=[.E195]*[.AC$11]+[.F195]*[.AC$13]+[.G195]*[.AC$15]+[.H195]*[.AC$17]+[.I195]*[.AC$19]+[.J195]*[.AC$21]+[.K195]*[.AC$23]+[.L195]*[.AC$25] -> 1.02390704070172 | N195: of:=IF([.E195]>0;1;0) -> 0 | O195: of:=IF([.F195]>0;1;0) -> 0 | P195: of:=IF([.G195]>0;1;0) -> 0 | Q195: of:=IF([.H195]>0;1;0) -> 1 | R195: of:=IF([.I195]>0;1;0) -> 0 | S195: of:=IF([.J195]>0;1;0) -> 0 | T195: of:=IF([.K195]>0;1;0) -> 0 | U195: of:=IF([.L195]>0;1;0) -> 1 | V195: of:=[.N195]*[.N$402]+[.O195]*[.O$402]+[.P195]*[.P$402]+[.Q195]*[.Q$402]+[.R195]*[.R$402]+[.S195]*[.S$402]+[.T195]*[.T$402]+[.U195]*[.U$402] -> 0.308633066549229 | W195: 40646 | Y195: of:=[.W195]+[.X195] -> 40646 | Z195: of:=[.Y195]/[.Y$401] -> 12.9420600034635 | AA195: of:=[.D195]+[.M195]+[.V195]+[.Z195] -> 16.2819754316252 | AB195: of:=RANK([.AA195];[.AA$2:.AA$399];0) -> 194
A196: Richmondshire | B196: 36404 | C196: of:=IF(SUM([.E196:.L196])>0;[.B196];0) -> 36404 | D196: of:=[.C196]/[.C$401] -> 1.37111828400161 | H196: 1 | L196: 1 | M196: of:=[.E196]*[.AC$11]+[.F196]*[.AC$13]+[.G196]*[.AC$15]+[.H196]*[.AC$17]+[.I196]*[.AC$19]+[.J196]*[.AC$21]+[.K196]*[.AC$23]+[.L196]*[.AC$25] -> 1.02390704070172 | N196: of:=IF([.E196]>0;1;0) -> 0 | O196: of:=IF([.F196]>0;1;0) -> 0 | P196: of:=IF([.G196]>0;1;0) -> 0 | Q196: of:=IF([.H196]>0;1;0) -> 1 | R196: of:=IF([.I196]>0;1;0) -> 0 | S196: of:=IF([.J196]>0;1;0) -> 0 | T196: of:=IF([.K196]>0;1;0) -> 0 | U196: of:=IF([.L196]>0;1;0) -> 1 | V196: of:=[.N196]*[.N$402]+[.O196]*[.O$402]+[.P196]*[.P$402]+[.Q196]*[.Q$402]+[.R196]*[.R$402]+[.S196]*[.S$402]+[.T196]*[.T$402]+[.U196]*[.U$402] -> 0.308633066549229 | W196: 42628 | Y196: of:=[.W196]+[.X196] -> 42628 | Z196: of:=[.Y196]/[.Y$401] -> 13.5731470212972 | AA196: of:=[.D196]+[.M196]+[.V196]+[.Z196] -> 16.2768054125497 | AB196: of:=RANK([.AA196];[.AA$2:.AA$399];0) -> 195
A197: M Devon | B197: 62125 | C197: of:=IF(SUM([.E197:.L197])>0;[.B197];0) -> 62125 | D197: of:=[.C197]/[.C$401] -> 2.33987263469948 | H197: 1 | L197: 1 | M197: of:=[.E197]*[.AC$11]+[.F197]*[.AC$13]+[.G197]*[.AC$15]+[.H197]*[.AC$17]+[.I197]*[.AC$19]+[.J197]*[.AC$21]+[.K197]*[.AC$23]+[.L197]*[.AC$25] -> 1.02390704070172 | N197: of:=IF([.E197]>0;1;0) -> 0 | O197: of:=IF([.F197]>0;1;0) -> 0 | P197: of:=IF([.G197]>0;1;0) -> 0 | Q197: of:=IF([.H197]>0;1;0) -> 1 | R197: of:=IF([.I197]>0;1;0) -> 0 | S197: of:=IF([.J197]>0;1;0) -> 0 | T197: of:=IF([.K197]>0;1;0) -> 0 | U197: of:=IF([.L197]>0;1;0) -> 1 | V197: of:=[.N197]*[.N$402]+[.O197]*[.O$402]+[.P197]*[.P$402]+[.Q197]*[.Q$402]+[.R197]*[.R$402]+[.S197]*[.S$402]+[.T197]*[.T$402]+[.U197]*[.U$402] -> 0.308633066549229 | W197: 39566 | Y197: of:=[.W197]+[.X197] -> 39566 | Z197: of:=[.Y197]/[.Y$401] -> 12.5981780764906 | AA197: of:=[.D197]+[.M197]+[.V197]+[.Z197] -> 16.2705908184411 | AB197: of:=RANK([.AA197];[.AA$2:.AA$399];0) -> 196
A198: Amber Valley | B198: 97780 | C198: of:=IF(SUM([.E198:.L198])>0;[.B198];0) -> 97780 | D198: of:=[.C198]/[.C$401] -> 3.68278062327429 | G198: 1 | H198: 1 | I198: 1 | K198: 1 | L198: 1 | M198: of:=[.E198]*[.AC$11]+[.F198]*[.AC$13]+[.G198]*[.AC$15]+[.H198]*[.AC$17]+[.I198]*[.AC$19]+[.J198]*[.AC$21]+[.K198]*[.AC$23]+[.L198]*[.AC$25] -> 4.1770743494719 | N198: of:=IF([.E198]>0;1;0) -> 0 | O198: of:=IF([.F198]>0;1;0) -> 0 | P198: of:=IF([.G198]>0;1;0) -> 1 | Q198: of:=IF([.H198]>0;1;0) -> 1 | R198: of:=IF([.I198]>0;1;0) -> 1 | S198: of:=IF([.J198]>0;1;0) -> 0 | T198: of:=IF([.K198]>0;1;0) -> 1 | U198: of:=IF([.L198]>0;1;0) -> 1 | V198: of:=[.N198]*[.N$402]+[.O198]*[.O$402]+[.P198]*[.P$402]+[.Q198]*[.Q$402]+[.R198]*[.R$402]+[.S198]*[.S$402]+[.T198]*[.T$402]+[.U198]*[.U$402] -> 2.03350799196213 | W198: of:=4396+15632 -> 20028 | Y198: of:=[.W198]+[.X198] -> 20028 | Z198: of:=[.Y198]/[.Y$401] -> 6.37709929019751 | AA198: of:=[.D198]+[.M198]+[.V198]+[.Z198] -> 16.2704622549058 | AB198: of:=RANK([.AA198];[.AA$2:.AA$399];0) -> 197
A199: Surrey Heath | B199: 66526 | C199: of:=IF(SUM([.E199:.L199])>0;[.B199];0) -> 66526 | D199: of:=[.C199]/[.C$401] -> 2.50563166029807 | H199: 1 | L199: 1 | M199: of:=[.E199]*[.AC$11]+[.F199]*[.AC$13]+[.G199]*[.AC$15]+[.H199]*[.AC$17]+[.I199]*[.AC$19]+[.J199]*[.AC$21]+[.K199]*[.AC$23]+[.L199]*[.AC$25] -> 1.02390704070172 | N199: of:=IF([.E199]>0;1;0) -> 0 | O199: of:=IF([.F199]>0;1;0) -> 0 | P199: of:=IF([.G199]>0;1;0) -> 0 | Q199: of:=IF([.H199]>0;1;0) -> 1 | R199: of:=IF([.I199]>0;1;0) -> 0 | S199: of:=IF([.J199]>0;1;0) -> 0 | T199: of:=IF([.K199]>0;1;0) -> 0 | U199: of:=IF([.L199]>0;1;0) -> 1 | V199: of:=[.N199]*[.N$402]+[.O199]*[.O$402]+[.P199]*[.P$402]+[.Q199]*[.Q$402]+[.R199]*[.R$402]+[.S199]*[.S$402]+[.T199]*[.T$402]+[.U199]*[.U$402] -> 0.308633066549229 | W199: 39030 | Y199: of:=[.W199]+[.X199] -> 39030 | Z199: of:=[.Y199]/[.Y$401] -> 12.4275107497708 | AA199: of:=[.D199]+[.M199]+[.V199]+[.Z199] -> 16.2656825173198 | AB199: of:=RANK([.AA199];[.AA$2:.AA$399];0) -> 198
A200: S Hams | B200: 66989 | C200: of:=IF(SUM([.E200:.L200])>0;[.B200];0) -> 66989 | D200: of:=[.C200]/[.C$401] -> 2.52307006721744 | H200: 1 | L200: 1 | M200: of:=[.E200]*[.AC$11]+[.F200]*[.AC$13]+[.G200]*[.AC$15]+[.H200]*[.AC$17]+[.I200]*[.AC$19]+[.J200]*[.AC$21]+[.K200]*[.AC$23]+[.L200]*[.AC$25] -> 1.02390704070172 | N200: of:=IF([.E200]>0;1;0) -> 0 | O200: of:=IF([.F200]>0;1;0) -> 0 | P200: of:=IF([.G200]>0;1;0) -> 0 | Q200: of:=IF([.H200]>0;1;0) -> 1 | R200: of:=IF([.I200]>0;1;0) -> 0 | S200: of:=IF([.J200]>0;1;0) -> 0 | T200: of:=IF([.K200]>0;1;0) -> 0 | U200: of:=IF([.L200]>0;1;0) -> 1 | V200: of:=[.N200]*[.N$402]+[.O200]*[.O$402]+[.P200]*[.P$402]+[.Q200]*[.Q$402]+[.R200]*[.R$402]+[.S200]*[.S$402]+[.T200]*[.T$402]+[.U200]*[.U$402] -> 0.308633066549229 | W200: 38852 | Y200: of:=[.W200]+[.X200] -> 38852 | Z200: of:=[.Y200]/[.Y$401] -> 12.3708339136586 | AA200: of:=[.D200]+[.M200]+[.V200]+[.Z200] -> 16.226444088127 | AB200: of:=RANK([.AA200];[.AA$2:.AA$399];0) -> 199
A201: Cornwall | B201: 422434 | C201: of:=IF(SUM([.E201:.L201])>0;[.B201];0) -> 422434 | D201: of:=[.C201]/[.C$401] -> 15.9105312928232 | J201: 1 | M201: of:=[.E201]*[.AC$11]+[.F201]*[.AC$13]+[.G201]*[.AC$15]+[.H201]*[.AC$17]+[.I201]*[.AC$19]+[.J201]*[.AC$21]+[.K201]*[.AC$23]+[.L201]*[.AC$25] -> 0.136078386768712 | N201: of:=IF([.E201]>0;1;0) -> 0 | O201: of:=IF([.F201]>0;1;0) -> 0 | P201: of:=IF([.G201]>0;1;0) -> 0 | Q201: of:=IF([.H201]>0;1;0) -> 0 | R201: of:=IF([.I201]>0;1;0) -> 0 | S201: of:=IF([.J201]>0;1;0) -> 1 | T201: of:=IF([.K201]>0;1;0) -> 0 | U201: of:=IF([.L201]>0;1;0) -> 0 | V201: of:=[.N201]*[.N$402]+[.O201]*[.O$402]+[.P201]*[.P$402]+[.Q201]*[.Q$402]+[.R201]*[.R$402]+[.S201]*[.S$402]+[.T201]*[.T$402]+[.U201]*[.U$402] -> 0.174691403761665 | Y201: of:=[.W201]+[.X201] -> 0 | Z201: of:=[.Y201]/[.Y$401] -> 0 | AA201: of:=[.D201]+[.M201]+[.V201]+[.Z201] -> 16.2213010833536 | AB201: of:=RANK([.AA201];[.AA$2:.AA$399];0) -> 200
A202: Wolverhampton | B202: 177612 | C202: of:=IF(SUM([.E202:.L202])>0;[.B202];0) -> 177612 | D202: of:=[.C202]/[.C$401] -> 6.68956874678864 | G202: 1 | H202: 1 | I202: 1 | K202: 1 | L202: 1 | M202: of:=[.E202]*[.AC$11]+[.F202]*[.AC$13]+[.G202]*[.AC$15]+[.H202]*[.AC$17]+[.I202]*[.AC$19]+[.J202]*[.AC$21]+[.K202]*[.AC$23]+[.L202]*[.AC$25] -> 4.1770743494719 | N202: of:=IF([.E202]>0;1;0) -> 0 | O202: of:=IF([.F202]>0;1;0) -> 0 | P202: of:=IF([.G202]>0;1;0) -> 1 | Q202: of:=IF([.H202]>0;1;0) -> 1 | R202: of:=IF([.I202]>0;1;0) -> 1 | S202: of:=IF([.J202]>0;1;0) -> 0 | T202: of:=IF([.K202]>0;1;0) -> 1 | U202: of:=IF([.L202]>0;1;0) -> 1 | V202: of:=[.N202]*[.N$402]+[.O202]*[.O$402]+[.P202]*[.P$402]+[.Q202]*[.Q$402]+[.R202]*[.R$402]+[.S202]*[.S$402]+[.T202]*[.T$402]+[.U202]*[.U$402] -> 2.03350799196213 | W202: of:=320+9994 -> 10314 | Y202: of:=[.W202]+[.X202] -> 10314 | Z202: of:=[.Y202]/[.Y$401] -> 3.28407240259123 | AA202: of:=[.D202]+[.M202]+[.V202]+[.Z202] -> 16.1842234908139 | AB202: of:=RANK([.AA202];[.AA$2:.AA$399];0) -> 201
A203: Epping Forest | B203: 101727 | C203: of:=IF(SUM([.E203:.L203])>0;[.B203];0) -> 101727 | D203: of:=[.C203]/[.C$401] -> 3.83144021746598 | G203: 1 | H203: 1 | I203: 1 | K203: 1 | L203: 1 | M203: of:=[.E203]*[.AC$11]+[.F203]*[.AC$13]+[.G203]*[.AC$15]+[.H203]*[.AC$17]+[.I203]*[.AC$19]+[.J203]*[.AC$21]+[.K203]*[.AC$23]+[.L203]*[.AC$25] -> 4.1770743494719 | N203: of:=IF([.E203]>0;1;0) -> 0 | O203: of:=IF([.F203]>0;1;0) -> 0 | P203: of:=IF([.G203]>0;1;0) -> 1 | Q203: of:=IF([.H203]>0;1;0) -> 1 | R203: of:=IF([.I203]>0;1;0) -> 1 | S203: of:=IF([.J203]>0;1;0) -> 0 | T203: of:=IF([.K203]>0;1;0) -> 1 | U203: of:=IF([.L203]>0;1;0) -> 1 | V203: of:=[.N203]*[.N$402]+[.O203]*[.O$402]+[.P203]*[.P$402]+[.Q203]*[.Q$402]+[.R203]*[.R$402]+[.S203]*[.S$402]+[.T203]*[.T$402]+[.U203]*[.U$402] -> 2.03350799196213 | W203: of:=1728+17495 -> 19223 | Y203: of:=[.W203]+[.X203] -> 19223 | Z203: of:=[.Y203]/[.Y$401] -> 6.12077989092604 | AA203: of:=[.D203]+[.M203]+[.V203]+[.Z203] -> 16.1628024498261 | AB203: of:=RANK([.AA203];[.AA$2:.AA$399];0) -> 202
A204: Harborough | B204: 69195 | C204: of:=IF(SUM([.E204:.L204])>0;[.B204];0) -> 69195 | D204: of:=[.C204]/[.C$401] -> 2.6061567317188 | H204: 1 | L204: 1 | M204: of:=[.E204]*[.AC$11]+[.F204]*[.AC$13]+[.G204]*[.AC$15]+[.H204]*[.AC$17]+[.I204]*[.AC$19]+[.J204]*[.AC$21]+[.K204]*[.AC$23]+[.L204]*[.AC$25] -> 1.02390704070172 | N204: of:=IF([.E204]>0;1;0) -> 0 | O204: of:=IF([.F204]>0;1;0) -> 0 | P204: of:=IF([.G204]>0;1;0) -> 0 | Q204: of:=IF([.H204]>0;1;0) -> 1 | R204: of:=IF([.I204]>0;1;0) -> 0 | S204: of:=IF([.J204]>0;1;0) -> 0 | T204: of:=IF([.K204]>0;1;0) -> 0 | U204: of:=IF([.L204]>0;1;0) -> 1 | V204: of:=[.N204]*[.N$402]+[.O204]*[.O$402]+[.P204]*[.P$402]+[.Q204]*[.Q$402]+[.R204]*[.R$402]+[.S204]*[.S$402]+[.T204]*[.T$402]+[.U204]*[.U$402] -> 0.308633066549229 | W204: 38318 | Y204: of:=[.W204]+[.X204] -> 38318 | Z204: of:=[.Y204]/[.Y$401] -> 12.200803405322 | AA204: of:=[.D204]+[.M204]+[.V204]+[.Z204] -> 16.1395002442917 | AB204: of:=RANK([.AA204];[.AA$2:.AA$399];0) -> 203
A205: Rutland | B205: 29421 | C205: of:=IF(SUM([.E205:.L205])>0;[.B205];0) -> 29421 | D205: of:=[.C205]/[.C$401] -> 1.10811095026951 | H205: 1 | L205: 1 | M205: of:=[.E205]*[.AC$11]+[.F205]*[.AC$13]+[.G205]*[.AC$15]+[.H205]*[.AC$17]+[.I205]*[.AC$19]+[.J205]*[.AC$21]+[.K205]*[.AC$23]+[.L205]*[.AC$25] -> 1.02390704070172 | N205: of:=IF([.E205]>0;1;0) -> 0 | O205: of:=IF([.F205]>0;1;0) -> 0 | P205: of:=IF([.G205]>0;1;0) -> 0 | Q205: of:=IF([.H205]>0;1;0) -> 1 | R205: of:=IF([.I205]>0;1;0) -> 0 | S205: of:=IF([.J205]>0;1;0) -> 0 | T205: of:=IF([.K205]>0;1;0) -> 0 | U205: of:=IF([.L205]>0;1;0) -> 1 | V205: of:=[.N205]*[.N$402]+[.O205]*[.O$402]+[.P205]*[.P$402]+[.Q205]*[.Q$402]+[.R205]*[.R$402]+[.S205]*[.S$402]+[.T205]*[.T$402]+[.U205]*[.U$402] -> 0.308633066549229 | W205: 43009 | Y205: of:=[.W205]+[.X205] -> 43009 | Z205: of:=[.Y205]/[.Y$401] -> 13.6944609233126 | AA205: of:=[.D205]+[.M205]+[.V205]+[.Z205] -> 16.1351119808331 | AB205: of:=RANK([.AA205];[.AA$2:.AA$399];0) -> 204
A206: Selby | B206: 67407 | C206: of:=IF(SUM([.E206:.L206])>0;[.B206];0) -> 67407 | D206: of:=[.C206]/[.C$401] -> 2.53881359657445 | H206: 1 | L206: 1 | M206: of:=[.E206]*[.AC$11]+[.F206]*[.AC$13]+[.G206]*[.AC$15]+[.H206]*[.AC$17]+[.I206]*[.AC$19]+[.J206]*[.AC$21]+[.K206]*[.AC$23]+[.L206]*[.AC$25] -> 1.02390704070172 | N206: of:=IF([.E206]>0;1;0) -> 0 | O206: of:=IF([.F206]>0;1;0) -> 0 | P206: of:=IF([.G206]>0;1;0) -> 0 | Q206: of:=IF([.H206]>0;1;0) -> 1 | R206: of:=IF([.I206]>0;1;0) -> 0 | S206: of:=IF([.J206]>0;1;0) -> 0 | T206: of:=IF([.K206]>0;1;0) -> 0 | U206: of:=IF([.L206]>0;1;0) -> 1 | V206: of:=[.N206]*[.N$402]+[.O206]*[.O$402]+[.P206]*[.P$402]+[.Q206]*[.Q$402]+[.R206]*[.R$402]+[.S206]*[.S$402]+[.T206]*[.T$402]+[.U206]*[.U$402] -> 0.308633066549229 | W206: 38495 | Y206: of:=[.W206]+[.X206] -> 38495 | Z206: of:=[.Y206]/[.Y$401] -> 12.2571618322425 | AA206: of:=[.D206]+[.M206]+[.V206]+[.Z206] -> 16.1285155360679 | AB206: of:=RANK([.AA206];[.AA$2:.AA$399];0) -> 205
A207: Cotswold | B207: 69824 | C207: of:=IF(SUM([.E207:.L207])>0;[.B207];0) -> 69824 | D207: of:=[.C207]/[.C$401] -> 2.62984735364598 | H207: 1 | L207: 1 | M207: of:=[.E207]*[.AC$11]+[.F207]*[.AC$13]+[.G207]*[.AC$15]+[.H207]*[.AC$17]+[.I207]*[.AC$19]+[.J207]*[.AC$21]+[.K207]*[.AC$23]+[.L207]*[.AC$25] -> 1.02390704070172 | N207: of:=IF([.E207]>0;1;0) -> 0 | O207: of:=IF([.F207]>0;1;0) -> 0 | P207: of:=IF([.G207]>0;1;0) -> 0 | Q207: of:=IF([.H207]>0;1;0) -> 1 | R207: of:=IF([.I207]>0;1;0) -> 0 | S207: of:=IF([.J207]>0;1;0) -> 0 | T207: of:=IF([.K207]>0;1;0) -> 0 | U207: of:=IF([.L207]>0;1;0) -> 1 | V207: of:=[.N207]*[.N$402]+[.O207]*[.O$402]+[.P207]*[.P$402]+[.Q207]*[.Q$402]+[.R207]*[.R$402]+[.S207]*[.S$402]+[.T207]*[.T$402]+[.U207]*[.U$402] -> 0.308633066549229 | W207: 38140 | Y207: of:=[.W207]+[.X207] -> 38140 | Z207: of:=[.Y207]/[.Y$401] -> 12.1441265692098 | AA207: of:=[.D207]+[.M207]+[.V207]+[.Z207] -> 16.1065140301067 | AB207: of:=RANK([.AA207];[.AA$2:.AA$399];0) -> 206
A208: Tewkesbury | B208: 70856 | C208: of:=IF(SUM([.E208:.L208])>0;[.B208];0) -> 70856 | D208: of:=[.C208]/[.C$401] -> 2.66871654574272 | H208: 1 | L208: 1 | M208: of:=[.E208]*[.AC$11]+[.F208]*[.AC$13]+[.G208]*[.AC$15]+[.H208]*[.AC$17]+[.I208]*[.AC$19]+[.J208]*[.AC$21]+[.K208]*[.AC$23]+[.L208]*[.AC$25] -> 1.02390704070172 | N208: of:=IF([.E208]>0;1;0) -> 0 | O208: of:=IF([.F208]>0;1;0) -> 0 | P208: of:=IF([.G208]>0;1;0) -> 0 | Q208: of:=IF([.H208]>0;1;0) -> 1 | R208: of:=IF([.I208]>0;1;0) -> 0 | S208: of:=IF([.J208]>0;1;0) -> 0 | T208: of:=IF([.K208]>0;1;0) -> 0 | U208: of:=IF([.L208]>0;1;0) -> 1 | V208: of:=[.N208]*[.N$402]+[.O208]*[.O$402]+[.P208]*[.P$402]+[.Q208]*[.Q$402]+[.R208]*[.R$402]+[.S208]*[.S$402]+[.T208]*[.T$402]+[.U208]*[.U$402] -> 0.308633066549229 | W208: 37963 | Y208: of:=[.W208]+[.X208] -> 37963 | Z208: of:=[.Y208]/[.Y$401] -> 12.0877681422892 | AA208: of:=[.D208]+[.M208]+[.V208]+[.Z208] -> 16.0890247952829 | AB208: of:=RANK([.AA208];[.AA$2:.AA$399];0) -> 207
A209: Ipswich | B209: 96598 | C209: of:=IF(SUM([.E209:.L209])>0;[.B209];0) -> 96598 | D209: of:=[.C209]/[.C$401] -> 3.63826183930303 | G209: 1 | H209: 1 | I209: 1 | K209: 1 | L209: 1 | M209: of:=[.E209]*[.AC$11]+[.F209]*[.AC$13]+[.G209]*[.AC$15]+[.H209]*[.AC$17]+[.I209]*[.AC$19]+[.J209]*[.AC$21]+[.K209]*[.AC$23]+[.L209]*[.AC$25] -> 4.1770743494719 | N209: of:=IF([.E209]>0;1;0) -> 0 | O209: of:=IF([.F209]>0;1;0) -> 0 | P209: of:=IF([.G209]>0;1;0) -> 1 | Q209: of:=IF([.H209]>0;1;0) -> 1 | R209: of:=IF([.I209]>0;1;0) -> 1 | S209: of:=IF([.J209]>0;1;0) -> 0 | T209: of:=IF([.K209]>0;1;0) -> 1 | U209: of:=IF([.L209]>0;1;0) -> 1 | V209: of:=[.N209]*[.N$402]+[.O209]*[.O$402]+[.P209]*[.P$402]+[.Q209]*[.Q$402]+[.R209]*[.R$402]+[.S209]*[.S$402]+[.T209]*[.T$402]+[.U209]*[.U$402] -> 2.03350799196213 | W209: of:=4421+15091 -> 19512 | Y209: of:=[.W209]+[.X209] -> 19512 | Z209: of:=[.Y209]/[.Y$401] -> 6.21280014731046 | AA209: of:=[.D209]+[.M209]+[.V209]+[.Z209] -> 16.0616443280475 | AB209: of:=RANK([.AA209];[.AA$2:.AA$399];0) -> 208
A210: Babergh | B210: 71546 | C210: of:=IF(SUM([.E210:.L210])>0;[.B210];0) -> 71546 | D210: of:=[.C210]/[.C$401] -> 2.69470466836554 | H210: 1 | L210: 1 | M210: of:=[.E210]*[.AC$11]+[.F210]*[.AC$13]+[.G210]*[.AC$15]+[.H210]*[.AC$17]+[.I210]*[.AC$19]+[.J210]*[.AC$21]+[.K210]*[.AC$23]+[.L210]*[.AC$25] -> 1.02390704070172 | N210: of:=IF([.E210]>0;1;0) -> 0 | O210: of:=IF([.F210]>0;1;0) -> 0 | P210: of:=IF([.G210]>0;1;0) -> 0 | Q210: of:=IF([.H210]>0;1;0) -> 1 | R210: of:=IF([.I210]>0;1;0) -> 0 | S210: of:=IF([.J210]>0;1;0) -> 0 | T210: of:=IF([.K210]>0;1;0) -> 0 | U210: of:=IF([.L210]>0;1;0) -> 1 | V210: of:=[.N210]*[.N$402]+[.O210]*[.O$402]+[.P210]*[.P$402]+[.Q210]*[.Q$402]+[.R210]*[.R$402]+[.S210]*[.S$402]+[.T210]*[.T$402]+[.U210]*[.U$402] -> 0.308633066549229 | W210: 37786 | Y210: of:=[.W210]+[.X210] -> 37786 | Z210: of:=[.Y210]/[.Y$401] -> 12.0314097153686 | AA210: of:=[.D210]+[.M210]+[.V210]+[.Z210] -> 16.0586544909851 | AB210: of:=RANK([.AA210];[.AA$2:.AA$399];0) -> 209
A211: S Holland | B211: 71578 | C211: of:=IF(SUM([.E211:.L211])>0;[.B211];0) -> 71578 | D211: of:=[.C211]/[.C$401] -> 2.6959099146321 | H211: 1 | L211: 1 | M211: of:=[.E211]*[.AC$11]+[.F211]*[.AC$13]+[.G211]*[.AC$15]+[.H211]*[.AC$17]+[.I211]*[.AC$19]+[.J211]*[.AC$21]+[.K211]*[.AC$23]+[.L211]*[.AC$25] -> 1.02390704070172 | N211: of:=IF([.E211]>0;1;0) -> 0 | O211: of:=IF([.F211]>0;1;0) -> 0 | P211: of:=IF([.G211]>0;1;0) -> 0 | Q211: of:=IF([.H211]>0;1;0) -> 1 | R211: of:=IF([.I211]>0;1;0) -> 0 | S211: of:=IF([.J211]>0;1;0) -> 0 | T211: of:=IF([.K211]>0;1;0) -> 0 | U211: of:=IF([.L211]>0;1;0) -> 1 | V211: of:=[.N211]*[.N$402]+[.O211]*[.O$402]+[.P211]*[.P$402]+[.Q211]*[.Q$402]+[.R211]*[.R$402]+[.S211]*[.S$402]+[.T211]*[.T$402]+[.U211]*[.U$402] -> 0.308633066549229 | W211: 37609 | Y211: of:=[.W211]+[.X211] -> 37609 | Z211: of:=[.Y211]/[.Y$401] -> 11.9750512884481 | AA211: of:=[.D211]+[.M211]+[.V211]+[.Z211] -> 16.0035013103311 | AB211: of:=RANK([.AA211];[.AA$2:.AA$399];0) -> 210
A212: Bromsgrove | B212: 72135 | C212: of:=IF(SUM([.E212:.L212])>0;[.B212];0) -> 72135 | D212: of:=[.C212]/[.C$401] -> 2.71688873245951 | H212: 1 | L212: 1 | M212: of:=[.E212]*[.AC$11]+[.F212]*[.AC$13]+[.G212]*[.AC$15]+[.H212]*[.AC$17]+[.I212]*[.AC$19]+[.J212]*[.AC$21]+[.K212]*[.AC$23]+[.L212]*[.AC$25] -> 1.02390704070172 | N212: of:=IF([.E212]>0;1;0) -> 0 | O212: of:=IF([.F212]>0;1;0) -> 0 | P212: of:=IF([.G212]>0;1;0) -> 0 | Q212: of:=IF([.H212]>0;1;0) -> 1 | R212: of:=IF([.I212]>0;1;0) -> 0 | S212: of:=IF([.J212]>0;1;0) -> 0 | T212: of:=IF([.K212]>0;1;0) -> 0 | U212: of:=IF([.L212]>0;1;0) -> 1 | V212: of:=[.N212]*[.N$402]+[.O212]*[.O$402]+[.P212]*[.P$402]+[.Q212]*[.Q$402]+[.R212]*[.R$402]+[.S212]*[.S$402]+[.T212]*[.T$402]+[.U212]*[.U$402] -> 0.308633066549229 | W212: 37433 | Y212: of:=[.W212]+[.X212] -> 37433 | Z212: of:=[.Y212]/[.Y$401] -> 11.9190112707192 | AA212: of:=[.D212]+[.M212]+[.V212]+[.Z212] -> 15.9684401104296 | AB212: of:=RANK([.AA212];[.AA$2:.AA$399];0) -> 211
A213: Worthing | B213: 83748 | C213: of:=IF(SUM([.E213:.L213])>0;[.B213];0) -> 83748 | D213: of:=[.C213]/[.C$401] -> 3.15428013538531 | G213: 1 | H213: 1 | I213: 1 | K213: 1 | L213: 1 | M213: of:=[.E213]*[.AC$11]+[.F213]*[.AC$13]+[.G213]*[.AC$15]+[.H213]*[.AC$17]+[.I213]*[.AC$19]+[.J213]*[.AC$21]+[.K213]*[.AC$23]+[.L213]*[.AC$25] -> 4.1770743494719 | N213: of:=IF([.E213]>0;1;0) -> 0 | O213: of:=IF([.F213]>0;1;0) -> 0 | P213: of:=IF([.G213]>0;1;0) -> 1 | Q213: of:=IF([.H213]>0;1;0) -> 1 | R213: of:=IF([.I213]>0;1;0) -> 1 | S213: of:=IF([.J213]>0;1;0) -> 0 | T213: of:=IF([.K213]>0;1;0) -> 1 | U213: of:=IF([.L213]>0;1;0) -> 1 | V213: of:=[.N213]*[.N$402]+[.O213]*[.O$402]+[.P213]*[.P$402]+[.Q213]*[.Q$402]+[.R213]*[.R$402]+[.S213]*[.S$402]+[.T213]*[.T$402]+[.U213]*[.U$402] -> 2.03350799196213 | W213: of:=4472+16178 -> 20650 | Y213: of:=[.W213]+[.X213] -> 20650 | Z213: of:=[.Y213]/[.Y$401] -> 6.57514980739857 | AA213: of:=[.D213]+[.M213]+[.V213]+[.Z213] -> 15.9400122842179 | AB213: of:=RANK([.AA213];[.AA$2:.AA$399];0) -> 212
A214: High Peak | B214: 72332 | C214: of:=IF(SUM([.E214:.L214])>0;[.B214];0) -> 72332 | D214: of:=[.C214]/[.C$401] -> 2.72430852978805 | H214: 1 | L214: 1 | M214: of:=[.E214]*[.AC$11]+[.F214]*[.AC$13]+[.G214]*[.AC$15]+[.H214]*[.AC$17]+[.I214]*[.AC$19]+[.J214]*[.AC$21]+[.K214]*[.AC$23]+[.L214]*[.AC$25] -> 1.02390704070172 | N214: of:=IF([.E214]>0;1;0) -> 0 | O214: of:=IF([.F214]>0;1;0) -> 0 | P214: of:=IF([.G214]>0;1;0) -> 0 | Q214: of:=IF([.H214]>0;1;0) -> 1 | R214: of:=IF([.I214]>0;1;0) -> 0 | S214: of:=IF([.J214]>0;1;0) -> 0 | T214: of:=IF([.K214]>0;1;0) -> 0 | U214: of:=IF([.L214]>0;1;0) -> 1 | V214: of:=[.N214]*[.N$402]+[.O214]*[.O$402]+[.P214]*[.P$402]+[.Q214]*[.Q$402]+[.R214]*[.R$402]+[.S214]*[.S$402]+[.T214]*[.T$402]+[.U214]*[.U$402] -> 0.308633066549229 | W214: 37256 | Y214: of:=[.W214]+[.X214] -> 37256 | Z214: of:=[.Y214]/[.Y$401] -> 11.8626528437986 | AA214: of:=[.D214]+[.M214]+[.V214]+[.Z214] -> 15.9195014808376 | AB214: of:=RANK([.AA214];[.AA$2:.AA$399];0) -> 213
A215: Hambleton | B215: 72393 | C215: of:=IF(SUM([.E215:.L215])>0;[.B215];0) -> 72393 | D215: of:=[.C215]/[.C$401] -> 2.72660603048369 | H215: 1 | L215: 1 | M215: of:=[.E215]*[.AC$11]+[.F215]*[.AC$13]+[.G215]*[.AC$15]+[.H215]*[.AC$17]+[.I215]*[.AC$19]+[.J215]*[.AC$21]+[.K215]*[.AC$23]+[.L215]*[.AC$25] -> 1.02390704070172 | N215: of:=IF([.E215]>0;1;0) -> 0 | O215: of:=IF([.F215]>0;1;0) -> 0 | P215: of:=IF([.G215]>0;1;0) -> 0 | Q215: of:=IF([.H215]>0;1;0) -> 1 | R215: of:=IF([.I215]>0;1;0) -> 0 | S215: of:=IF([.J215]>0;1;0) -> 0 | T215: of:=IF([.K215]>0;1;0) -> 0 | U215: of:=IF([.L215]>0;1;0) -> 1 | V215: of:=[.N215]*[.N$402]+[.O215]*[.O$402]+[.P215]*[.P$402]+[.Q215]*[.Q$402]+[.R215]*[.R$402]+[.S215]*[.S$402]+[.T215]*[.T$402]+[.U215]*[.U$402] -> 0.308633066549229 | W215: 37080 | Y215: of:=[.W215]+[.X215] -> 37080 | Z215: of:=[.Y215]/[.Y$401] -> 11.8066128260697 | AA215: of:=[.D215]+[.M215]+[.V215]+[.Z215] -> 15.8657589638043 | AB215: of:=RANK([.AA215];[.AA$2:.AA$399];0) -> 214
A216: Rother | B216: 72898 | C216: of:=IF(SUM([.E216:.L216])>0;[.B216];0) -> 72898 | D216: of:=[.C216]/[.C$401] -> 2.74562632312793 | H216: 1 | L216: 1 | M216: of:=[.E216]*[.AC$11]+[.F216]*[.AC$13]+[.G216]*[.AC$15]+[.H216]*[.AC$17]+[.I216]*[.AC$19]+[.J216]*[.AC$21]+[.K216]*[.AC$23]+[.L216]*[.AC$25] -> 1.02390704070172 | N216: of:=IF([.E216]>0;1;0) -> 0 | O216: of:=IF([.F216]>0;1;0) -> 0 | P216: of:=IF([.G216]>0;1;0) -> 0 | Q216: of:=IF([.H216]>0;1;0) -> 1 | R216: of:=IF([.I216]>0;1;0) -> 0 | S216: of:=IF([.J216]>0;1;0) -> 0 | T216: of:=IF([.K216]>0;1;0) -> 0 | U216: of:=IF([.L216]>0;1;0) -> 1 | V216: of:=[.N216]*[.N$402]+[.O216]*[.O$402]+[.P216]*[.P$402]+[.Q216]*[.Q$402]+[.R216]*[.R$402]+[.S216]*[.S$402]+[.T216]*[.T$402]+[.U216]*[.U$402] -> 0.308633066549229 | W216: 36904 | Y216: of:=[.W216]+[.X216] -> 36904 | Z216: of:=[.Y216]/[.Y$401] -> 11.7505728083408 | AA216: of:=[.D216]+[.M216]+[.V216]+[.Z216] -> 15.8287392387197 | AB216: of:=RANK([.AA216];[.AA$2:.AA$399];0) -> 215
A217: W Lindsey | B217: 73057 | C217: of:=IF(SUM([.E217:.L217])>0;[.B217];0) -> 73057 | D217: of:=[.C217]/[.C$401] -> 2.75161489051493 | H217: 1 | L217: 1 | M217: of:=[.E217]*[.AC$11]+[.F217]*[.AC$13]+[.G217]*[.AC$15]+[.H217]*[.AC$17]+[.I217]*[.AC$19]+[.J217]*[.AC$21]+[.K217]*[.AC$23]+[.L217]*[.AC$25] -> 1.02390704070172 | N217: of:=IF([.E217]>0;1;0) -> 0 | O217: of:=IF([.F217]>0;1;0) -> 0 | P217: of:=IF([.G217]>0;1;0) -> 0 | Q217: of:=IF([.H217]>0;1;0) -> 1 | R217: of:=IF([.I217]>0;1;0) -> 0 | S217: of:=IF([.J217]>0;1;0) -> 0 | T217: of:=IF([.K217]>0;1;0) -> 0 | U217: of:=IF([.L217]>0;1;0) -> 1 | V217: of:=[.N217]*[.N$402]+[.O217]*[.O$402]+[.P217]*[.P$402]+[.Q217]*[.Q$402]+[.R217]*[.R$402]+[.S217]*[.S$402]+[.T217]*[.T$402]+[.U217]*[.U$402] -> 0.308633066549229 | W217: 36729 | Y217: of:=[.W217]+[.X217] -> 36729 | Z217: of:=[.Y217]/[.Y$401] -> 11.6948511998035 | AA217: of:=[.D217]+[.M217]+[.V217]+[.Z217] -> 15.7790061975694 | AB217: of:=RANK([.AA217];[.AA$2:.AA$399];0) -> 216
A218: E Sussex CC | B218: 410272 | C218: of:=IF(SUM([.E218:.L218])>0;[.B218];0) -> 410272 | D218: of:=[.C218]/[.C$401] -> 15.4524623836366 | J218: 1 | M218: of:=[.E218]*[.AC$11]+[.F218]*[.AC$13]+[.G218]*[.AC$15]+[.H218]*[.AC$17]+[.I218]*[.AC$19]+[.J218]*[.AC$21]+[.K218]*[.AC$23]+[.L218]*[.AC$25] -> 0.136078386768712 | N218: of:=IF([.E218]>0;1;0) -> 0 | O218: of:=IF([.F218]>0;1;0) -> 0 | P218: of:=IF([.G218]>0;1;0) -> 0 | Q218: of:=IF([.H218]>0;1;0) -> 0 | R218: of:=IF([.I218]>0;1;0) -> 0 | S218: of:=IF([.J218]>0;1;0) -> 1 | T218: of:=IF([.K218]>0;1;0) -> 0 | U218: of:=IF([.L218]>0;1;0) -> 0 | V218: of:=[.N218]*[.N$402]+[.O218]*[.O$402]+[.P218]*[.P$402]+[.Q218]*[.Q$402]+[.R218]*[.R$402]+[.S218]*[.S$402]+[.T218]*[.T$402]+[.U218]*[.U$402] -> 0.174691403761665 | Y218: of:=[.W218]+[.X218] -> 0 | Z218: of:=[.Y218]/[.Y$401] -> 0 | AA218: of:=[.D218]+[.M218]+[.V218]+[.Z218] -> 15.763232174167 | AB218: of:=RANK([.AA218];[.AA$2:.AA$399];0) -> 217
A219: Allerdale | B219: 73928 | C219: of:=IF(SUM([.E219:.L219])>0;[.B219];0) -> 73928 | D219: of:=[.C219]/[.C$401] -> 2.78442018733301 | H219: 1 | L219: 1 | M219: of:=[.E219]*[.AC$11]+[.F219]*[.AC$13]+[.G219]*[.AC$15]+[.H219]*[.AC$17]+[.I219]*[.AC$19]+[.J219]*[.AC$21]+[.K219]*[.AC$23]+[.L219]*[.AC$25] -> 1.02390704070172 | N219: of:=IF([.E219]>0;1;0) -> 0 | O219: of:=IF([.F219]>0;1;0) -> 0 | P219: of:=IF([.G219]>0;1;0) -> 0 | Q219: of:=IF([.H219]>0;1;0) -> 1 | R219: of:=IF([.I219]>0;1;0) -> 0 | S219: of:=IF([.J219]>0;1;0) -> 0 | T219: of:=IF([.K219]>0;1;0) -> 0 | U219: of:=IF([.L219]>0;1;0) -> 1 | V219: of:=[.N219]*[.N$402]+[.O219]*[.O$402]+[.P219]*[.P$402]+[.Q219]*[.Q$402]+[.R219]*[.R$402]+[.S219]*[.S$402]+[.T219]*[.T$402]+[.U219]*[.U$402] -> 0.308633066549229 | W219: 36553 | Y219: of:=[.W219]+[.X219] -> 36553 | Z219: of:=[.Y219]/[.Y$401] -> 11.6388111820746 | AA219: of:=[.D219]+[.M219]+[.V219]+[.Z219] -> 15.7557714766585 | AB219: of:=RANK([.AA219];[.AA$2:.AA$399];0) -> 218
A220: Eastbourne | B220: 74888 | C220: of:=IF(SUM([.E220:.L220])>0;[.B220];0) -> 74888 | D220: of:=[.C220]/[.C$401] -> 2.82057757532998 | H220: 1 | L220: 1 | M220: of:=[.E220]*[.AC$11]+[.F220]*[.AC$13]+[.G220]*[.AC$15]+[.H220]*[.AC$17]+[.I220]*[.AC$19]+[.J220]*[.AC$21]+[.K220]*[.AC$23]+[.L220]*[.AC$25] -> 1.02390704070172 | N220: of:=IF([.E220]>0;1;0) -> 0 | O220: of:=IF([.F220]>0;1;0) -> 0 | P220: of:=IF([.G220]>0;1;0) -> 0 | Q220: of:=IF([.H220]>0;1;0) -> 1 | R220: of:=IF([.I220]>0;1;0) -> 0 | S220: of:=IF([.J220]>0;1;0) -> 0 | T220: of:=IF([.K220]>0;1;0) -> 0 | U220: of:=IF([.L220]>0;1;0) -> 1 | V220: of:=[.N220]*[.N$402]+[.O220]*[.O$402]+[.P220]*[.P$402]+[.Q220]*[.Q$402]+[.R220]*[.R$402]+[.S220]*[.S$402]+[.T220]*[.T$402]+[.U220]*[.U$402] -> 0.308633066549229 | W220: 36378 | Y220: of:=[.W220]+[.X220] -> 36378 | Z220: of:=[.Y220]/[.Y$401] -> 11.5830895735373 | AA220: of:=[.D220]+[.M220]+[.V220]+[.Z220] -> 15.7362072561182 | AB220: of:=RANK([.AA220];[.AA$2:.AA$399];0) -> 219
A221: S Lakeland | B221: 82963 | C221: of:=IF(SUM([.E221:.L221])>0;[.B221];0) -> 82963 | D221: of:=[.C221]/[.C$401] -> 3.12471393790862 | G221: 1 | H221: 1 | I221: 1 | K221: 1 | L221: 1 | M221: of:=[.E221]*[.AC$11]+[.F221]*[.AC$13]+[.G221]*[.AC$15]+[.H221]*[.AC$17]+[.I221]*[.AC$19]+[.J221]*[.AC$21]+[.K221]*[.AC$23]+[.L221]*[.AC$25] -> 4.1770743494719 | N221: of:=IF([.E221]>0;1;0) -> 0 | O221: of:=IF([.F221]>0;1;0) -> 0 | P221: of:=IF([.G221]>0;1;0) -> 1 | Q221: of:=IF([.H221]>0;1;0) -> 1 | R221: of:=IF([.I221]>0;1;0) -> 1 | S221: of:=IF([.J221]>0;1;0) -> 0 | T221: of:=IF([.K221]>0;1;0) -> 1 | U221: of:=IF([.L221]>0;1;0) -> 1 | V221: of:=[.N221]*[.N$402]+[.O221]*[.O$402]+[.P221]*[.P$402]+[.Q221]*[.Q$402]+[.R221]*[.R$402]+[.S221]*[.S$402]+[.T221]*[.T$402]+[.U221]*[.U$402] -> 2.03350799196213 | W221: of:=66+20018 -> 20084 | Y221: of:=[.W221]+[.X221] -> 20084 | Z221: of:=[.Y221]/[.Y$401] -> 6.39493020492944 | AA221: of:=[.D221]+[.M221]+[.V221]+[.Z221] -> 15.7302264842721 | AB221: of:=RANK([.AA221];[.AA$2:.AA$399];0) -> 220
A222: Nottingham | B222: 207297 | C222: of:=IF(SUM([.E222:.L222])>0;[.B222];0) -> 207297 | D222: of:=[.C222]/[.C$401] -> 7.80762297875732 | H222: 1 | L222: 1 | M222: of:=[.E222]*[.AC$11]+[.F222]*[.AC$13]+[.G222]*[.AC$15]+[.H222]*[.AC$17]+[.I222]*[.AC$19]+[.J222]*[.AC$21]+[.K222]*[.AC$23]+[.L222]*[.AC$25] -> 1.02390704070172 | N222: of:=IF([.E222]>0;1;0) -> 0 | O222: of:=IF([.F222]>0;1;0) -> 0 | P222: of:=IF([.G222]>0;1;0) -> 0 | Q222: of:=IF([.H222]>0;1;0) -> 1 | R222: of:=IF([.I222]>0;1;0) -> 0 | S222: of:=IF([.J222]>0;1;0) -> 0 | T222: of:=IF([.K222]>0;1;0) -> 0 | U222: of:=IF([.L222]>0;1;0) -> 1 | V222: of:=[.N222]*[.N$402]+[.O222]*[.O$402]+[.P222]*[.P$402]+[.Q222]*[.Q$402]+[.R222]*[.R$402]+[.S222]*[.S$402]+[.T222]*[.T$402]+[.U222]*[.U$402] -> 0.308633066549229 | W222: 20672 | Y222: of:=[.W222]+[.X222] -> 20672 | Z222: of:=[.Y222]/[.Y$401] -> 6.58215480961469 | AA222: of:=[.D222]+[.M222]+[.V222]+[.Z222] -> 15.722317895623 | AB222: of:=RANK([.AA222];[.AA$2:.AA$399];0) -> 221
A223: Gravesham | B223: 75511 | C223: of:=IF(SUM([.E223:.L223])>0;[.B223];0) -> 75511 | D223: of:=[.C223]/[.C$401] -> 2.84404221358217 | H223: 1 | L223: 1 | M223: of:=[.E223]*[.AC$11]+[.F223]*[.AC$13]+[.G223]*[.AC$15]+[.H223]*[.AC$17]+[.I223]*[.AC$19]+[.J223]*[.AC$21]+[.K223]*[.AC$23]+[.L223]*[.AC$25] -> 1.02390704070172 | N223: of:=IF([.E223]>0;1;0) -> 0 | O223: of:=IF([.F223]>0;1;0) -> 0 | P223: of:=IF([.G223]>0;1;0) -> 0 | Q223: of:=IF([.H223]>0;1;0) -> 1 | R223: of:=IF([.I223]>0;1;0) -> 0 | S223: of:=IF([.J223]>0;1;0) -> 0 | T223: of:=IF([.K223]>0;1;0) -> 0 | U223: of:=IF([.L223]>0;1;0) -> 1 | V223: of:=[.N223]*[.N$402]+[.O223]*[.O$402]+[.P223]*[.P$402]+[.Q223]*[.Q$402]+[.R223]*[.R$402]+[.S223]*[.S$402]+[.T223]*[.T$402]+[.U223]*[.U$402] -> 0.308633066549229 | W223: 36203 | Y223: of:=[.W223]+[.X223] -> 36203 | Z223: of:=[.Y223]/[.Y$401] -> 11.527367965 | AA223: of:=[.D223]+[.M223]+[.V223]+[.Z223] -> 15.7039502858331 | AB223: of:=RANK([.AA223];[.AA$2:.AA$399];0) -> 222
A224: C Beds | B224: 210229 | C224: of:=IF(SUM([.E224:.L224])>0;[.B224];0) -> 210229 | D224: of:=[.C224]/[.C$401] -> 7.91805366793138 | H224: 1 | L224: 1 | M224: of:=[.E224]*[.AC$11]+[.F224]*[.AC$13]+[.G224]*[.AC$15]+[.H224]*[.AC$17]+[.I224]*[.AC$19]+[.J224]*[.AC$21]+[.K224]*[.AC$23]+[.L224]*[.AC$25] -> 1.02390704070172 | N224: of:=IF([.E224]>0;1;0) -> 0 | O224: of:=IF([.F224]>0;1;0) -> 0 | P224: of:=IF([.G224]>0;1;0) -> 0 | Q224: of:=IF([.H224]>0;1;0) -> 1 | R224: of:=IF([.I224]>0;1;0) -> 0 | S224: of:=IF([.J224]>0;1;0) -> 0 | T224: of:=IF([.K224]>0;1;0) -> 0 | U224: of:=IF([.L224]>0;1;0) -> 1 | V224: of:=[.N224]*[.N$402]+[.O224]*[.O$402]+[.P224]*[.P$402]+[.Q224]*[.Q$402]+[.R224]*[.R$402]+[.S224]*[.S$402]+[.T224]*[.T$402]+[.U224]*[.U$402] -> 0.308633066549229 | W224: 20197 | Y224: of:=[.W224]+[.X224] -> 20197 | Z224: of:=[.Y224]/[.Y$401] -> 6.43091044358494 | AA224: of:=[.D224]+[.M224]+[.V224]+[.Z224] -> 15.6815042187673 | AB224: of:=RANK([.AA224];[.AA$2:.AA$399];0) -> 223
A225: S Glos | B225: 208663 | C225: of:=IF(SUM([.E225:.L225])>0;[.B225];0) -> 208663 | D225: of:=[.C225]/[.C$401] -> 7.85907192876133 | H225: 1 | L225: 1 | M225: of:=[.E225]*[.AC$11]+[.F225]*[.AC$13]+[.G225]*[.AC$15]+[.H225]*[.AC$17]+[.I225]*[.AC$19]+[.J225]*[.AC$21]+[.K225]*[.AC$23]+[.L225]*[.AC$25] -> 1.02390704070172 | N225: of:=IF([.E225]>0;1;0) -> 0 | O225: of:=IF([.F225]>0;1;0) -> 0 | P225: of:=IF([.G225]>0;1;0) -> 0 | Q225: of:=IF([.H225]>0;1;0) -> 1 | R225: of:=IF([.I225]>0;1;0) -> 0 | S225: of:=IF([.J225]>0;1;0) -> 0 | T225: of:=IF([.K225]>0;1;0) -> 0 | U225: of:=IF([.L225]>0;1;0) -> 1 | V225: of:=[.N225]*[.N$402]+[.O225]*[.O$402]+[.P225]*[.P$402]+[.Q225]*[.Q$402]+[.R225]*[.R$402]+[.S225]*[.S$402]+[.T225]*[.T$402]+[.U225]*[.U$402] -> 0.308633066549229 | W225: 20344 | Y225: of:=[.W225]+[.X225] -> 20344 | Z225: of:=[.Y225]/[.Y$401] -> 6.47771659475625 | AA225: of:=[.D225]+[.M225]+[.V225]+[.Z225] -> 15.6693286307685 | AB225: of:=RANK([.AA225];[.AA$2:.AA$399];0) -> 224
A226: Lewes | B226: 75571 | C226: of:=IF(SUM([.E226:.L226])>0;[.B226];0) -> 75571 | D226: of:=[.C226]/[.C$401] -> 2.84630205033198 | H226: 1 | L226: 1 | M226: of:=[.E226]*[.AC$11]+[.F226]*[.AC$13]+[.G226]*[.AC$15]+[.H226]*[.AC$17]+[.I226]*[.AC$19]+[.J226]*[.AC$21]+[.K226]*[.AC$23]+[.L226]*[.AC$25] -> 1.02390704070172 | N226: of:=IF([.E226]>0;1;0) -> 0 | O226: of:=IF([.F226]>0;1;0) -> 0 | P226: of:=IF([.G226]>0;1;0) -> 0 | Q226: of:=IF([.H226]>0;1;0) -> 1 | R226: of:=IF([.I226]>0;1;0) -> 0 | S226: of:=IF([.J226]>0;1;0) -> 0 | T226: of:=IF([.K226]>0;1;0) -> 0 | U226: of:=IF([.L226]>0;1;0) -> 1 | V226: of:=[.N226]*[.N$402]+[.O226]*[.O$402]+[.P226]*[.P$402]+[.Q226]*[.Q$402]+[.R226]*[.R$402]+[.S226]*[.S$402]+[.T226]*[.T$402]+[.U226]*[.U$402] -> 0.308633066549229 | W226: 36029 | Y226: of:=[.W226]+[.X226] -> 36029 | Z226: of:=[.Y226]/[.Y$401] -> 11.4719647656544 | AA226: of:=[.D226]+[.M226]+[.V226]+[.Z226] -> 15.6508069232373 | AB226: of:=RANK([.AA226];[.AA$2:.AA$399];0) -> 225
A227: W Oxon | B227: 81181 | C227: of:=IF(SUM([.E227:.L227])>0;[.B227];0) -> 81181 | D227: of:=[.C227]/[.C$401] -> 3.05759678643925 | G227: 1 | H227: 1 | I227: 1 | K227: 1 | L227: 1 | M227: of:=[.E227]*[.AC$11]+[.F227]*[.AC$13]+[.G227]*[.AC$15]+[.H227]*[.AC$17]+[.I227]*[.AC$19]+[.J227]*[.AC$21]+[.K227]*[.AC$23]+[.L227]*[.AC$25] -> 4.1770743494719 | N227: of:=IF([.E227]>0;1;0) -> 0 | O227: of:=IF([.F227]>0;1;0) -> 0 | P227: of:=IF([.G227]>0;1;0) -> 1 | Q227: of:=IF([.H227]>0;1;0) -> 1 | R227: of:=IF([.I227]>0;1;0) -> 1 | S227: of:=IF([.J227]>0;1;0) -> 0 | T227: of:=IF([.K227]>0;1;0) -> 1 | U227: of:=IF([.L227]>0;1;0) -> 1 | V227: of:=[.N227]*[.N$402]+[.O227]*[.O$402]+[.P227]*[.P$402]+[.Q227]*[.Q$402]+[.R227]*[.R$402]+[.S227]*[.S$402]+[.T227]*[.T$402]+[.U227]*[.U$402] -> 2.03350799196213 | W227: of:=4548+15358 -> 19906 | Y227: of:=[.W227]+[.X227] -> 19906 | Z227: of:=[.Y227]/[.Y$401] -> 6.33825336881724 | AA227: of:=[.D227]+[.M227]+[.V227]+[.Z227] -> 15.6064324966905 | AB227: of:=RANK([.AA227];[.AA$2:.AA$399];0) -> 226
A228: Crawley | B228: 79250 | C228: of:=IF(SUM([.E228:.L228])>0;[.B228];0) -> 79250 | D228: of:=[.C228]/[.C$401] -> 2.98486770704119 | G228: 1 | H228: 1 | I228: 1 | K228: 1 | L228: 1 | M228: of:=[.E228]*[.AC$11]+[.F228]*[.AC$13]+[.G228]*[.AC$15]+[.H228]*[.AC$17]+[.I228]*[.AC$19]+[.J228]*[.AC$21]+[.K228]*[.AC$23]+[.L228]*[.AC$25] -> 4.1770743494719 | N228: of:=IF([.E228]>0;1;0) -> 0 | O228: of:=IF([.F228]>0;1;0) -> 0 | P228: of:=IF([.G228]>0;1;0) -> 1 | Q228: of:=IF([.H228]>0;1;0) -> 1 | R228: of:=IF([.I228]>0;1;0) -> 1 | S228: of:=IF([.J228]>0;1;0) -> 0 | T228: of:=IF([.K228]>0;1;0) -> 1 | U228: of:=IF([.L228]>0;1;0) -> 1 | V228: of:=[.N228]*[.N$402]+[.O228]*[.O$402]+[.P228]*[.P$402]+[.Q228]*[.Q$402]+[.R228]*[.R$402]+[.S228]*[.S$402]+[.T228]*[.T$402]+[.U228]*[.U$402] -> 2.03350799196213 | W228: of:=288+19835 -> 20123 | Y228: of:=[.W228]+[.X228] -> 20123 | Z228: of:=[.Y228]/[.Y$401] -> 6.40734816340346 | AA228: of:=[.D228]+[.M228]+[.V228]+[.Z228] -> 15.6027982118787 | AB228: of:=RANK([.AA228];[.AA$2:.AA$399];0) -> 227
A229: Spelthorne | B229: 75721 | C229: of:=IF(SUM([.E229:.L229])>0;[.B229];0) -> 75721 | D229: of:=[.C229]/[.C$401] -> 2.85195164220651 | H229: 1 | L229: 1 | M229: of:=[.E229]*[.AC$11]+[.F229]*[.AC$13]+[.G229]*[.AC$15]+[.H229]*[.AC$17]+[.I229]*[.AC$19]+[.J229]*[.AC$21]+[.K229]*[.AC$23]+[.L229]*[.AC$25] -> 1.02390704070172 | N229: of:=IF([.E229]>0;1;0) -> 0 | O229: of:=IF([.F229]>0;1;0) -> 0 | P229: of:=IF([.G229]>0;1;0) -> 0 | Q229: of:=IF([.H229]>0;1;0) -> 1 | R229: of:=IF([.I229]>0;1;0) -> 0 | S229: of:=IF([.J229]>0;1;0) -> 0 | T229: of:=IF([.K229]>0;1;0) -> 0 | U229: of:=IF([.L229]>0;1;0) -> 1 | V229: of:=[.N229]*[.N$402]+[.O229]*[.O$402]+[.P229]*[.P$402]+[.Q229]*[.Q$402]+[.R229]*[.R$402]+[.S229]*[.S$402]+[.T229]*[.T$402]+[.U229]*[.U$402] -> 0.308633066549229 | W229: 35854 | Y229: of:=[.W229]+[.X229] -> 35854 | Z229: of:=[.Y229]/[.Y$401] -> 11.4162431571171 | AA229: of:=[.D229]+[.M229]+[.V229]+[.Z229] -> 15.6007349065746 | AB229: of:=RANK([.AA229];[.AA$2:.AA$399];0) -> 228
A230: Medway | B230: 201662 | C230: of:=IF(SUM([.E230:.L230])>0;[.B230];0) -> 201662 | D230: of:=[.C230]/[.C$401] -> 7.59538664400429 | H230: 1 | L230: 1 | M230: of:=[.E230]*[.AC$11]+[.F230]*[.AC$13]+[.G230]*[.AC$15]+[.H230]*[.AC$17]+[.I230]*[.AC$19]+[.J230]*[.AC$21]+[.K230]*[.AC$23]+[.L230]*[.AC$25] -> 1.02390704070172 | N230: of:=IF([.E230]>0;1;0) -> 0 | O230: of:=IF([.F230]>0;1;0) -> 0 | P230: of:=IF([.G230]>0;1;0) -> 0 | Q230: of:=IF([.H230]>0;1;0) -> 1 | R230: of:=IF([.I230]>0;1;0) -> 0 | S230: of:=IF([.J230]>0;1;0) -> 0 | T230: of:=IF([.K230]>0;1;0) -> 0 | U230: of:=IF([.L230]>0;1;0) -> 1 | V230: of:=[.N230]*[.N$402]+[.O230]*[.O$402]+[.P230]*[.P$402]+[.Q230]*[.Q$402]+[.R230]*[.R$402]+[.S230]*[.S$402]+[.T230]*[.T$402]+[.U230]*[.U$402] -> 0.308633066549229 | W230: 20821 | Y230: of:=[.W230]+[.X230] -> 20821 | Z230: of:=[.Y230]/[.Y$401] -> 6.62959777916928 | AA230: of:=[.D230]+[.M230]+[.V230]+[.Z230] -> 15.5575245304245 | AB230: of:=RANK([.AA230];[.AA$2:.AA$399];0) -> 229
A231: Brighton and Hove | B231: 200330 | C231: of:=IF(SUM([.E231:.L231])>0;[.B231];0) -> 200330 | D231: of:=[.C231]/[.C$401] -> 7.5452182681585 | H231: 1 | L231: 1 | M231: of:=[.E231]*[.AC$11]+[.F231]*[.AC$13]+[.G231]*[.AC$15]+[.H231]*[.AC$17]+[.I231]*[.AC$19]+[.J231]*[.AC$21]+[.K231]*[.AC$23]+[.L231]*[.AC$25] -> 1.02390704070172 | N231: of:=IF([.E231]>0;1;0) -> 0 | O231: of:=IF([.F231]>0;1;0) -> 0 | P231: of:=IF([.G231]>0;1;0) -> 0 | Q231: of:=IF([.H231]>0;1;0) -> 1 | R231: of:=IF([.I231]>0;1;0) -> 0 | S231: of:=IF([.J231]>0;1;0) -> 0 | T231: of:=IF([.K231]>0;1;0) -> 0 | U231: of:=IF([.L231]>0;1;0) -> 1 | V231: of:=[.N231]*[.N$402]+[.O231]*[.O$402]+[.P231]*[.P$402]+[.Q231]*[.Q$402]+[.R231]*[.R$402]+[.S231]*[.S$402]+[.T231]*[.T$402]+[.U231]*[.U$402] -> 0.308633066549229 | W231: 20970 | Y231: of:=[.W231]+[.X231] -> 20970 | Z231: of:=[.Y231]/[.Y$401] -> 6.67704074872388 | AA231: of:=[.D231]+[.M231]+[.V231]+[.Z231] -> 15.5547991241333 | AB231: of:=RANK([.AA231];[.AA$2:.AA$399];0) -> 230
A232: Fenland | B232: 75828 | C232: of:=IF(SUM([.E232:.L232])>0;[.B232];0) -> 75828 | D232: of:=[.C232]/[.C$401] -> 2.85598168441034 | H232: 1 | L232: 1 | M232: of:=[.E232]*[.AC$11]+[.F232]*[.AC$13]+[.G232]*[.AC$15]+[.H232]*[.AC$17]+[.I232]*[.AC$19]+[.J232]*[.AC$21]+[.K232]*[.AC$23]+[.L232]*[.AC$25] -> 1.02390704070172 | N232: of:=IF([.E232]>0;1;0) -> 0 | O232: of:=IF([.F232]>0;1;0) -> 0 | P232: of:=IF([.G232]>0;1;0) -> 0 | Q232: of:=IF([.H232]>0;1;0) -> 1 | R232: of:=IF([.I232]>0;1;0) -> 0 | S232: of:=IF([.J232]>0;1;0) -> 0 | T232: of:=IF([.K232]>0;1;0) -> 0 | U232: of:=IF([.L232]>0;1;0) -> 1 | V232: of:=[.N232]*[.N$402]+[.O232]*[.O$402]+[.P232]*[.P$402]+[.Q232]*[.Q$402]+[.R232]*[.R$402]+[.S232]*[.S$402]+[.T232]*[.T$402]+[.U232]*[.U$402] -> 0.308633066549229 | W232: 35680 | Y232: of:=[.W232]+[.X232] -> 35680 | Z232: of:=[.Y232]/[.Y$401] -> 11.3608399577715 | AA232: of:=[.D232]+[.M232]+[.V232]+[.Z232] -> 15.5493617494328 | AB232: of:=RANK([.AA232];[.AA$2:.AA$399];0) -> 231
A233: Hertsmere | B233: 76011 | C233: of:=IF(SUM([.E233:.L233])>0;[.B233];0) -> 76011 | D233: of:=[.C233]/[.C$401] -> 2.86287418649726 | H233: 1 | L233: 1 | M233: of:=[.E233]*[.AC$11]+[.F233]*[.AC$13]+[.G233]*[.AC$15]+[.H233]*[.AC$17]+[.I233]*[.AC$19]+[.J233]*[.AC$21]+[.K233]*[.AC$23]+[.L233]*[.AC$25] -> 1.02390704070172 | N233: of:=IF([.E233]>0;1;0) -> 0 | O233: of:=IF([.F233]>0;1;0) -> 0 | P233: of:=IF([.G233]>0;1;0) -> 0 | Q233: of:=IF([.H233]>0;1;0) -> 1 | R233: of:=IF([.I233]>0;1;0) -> 0 | S233: of:=IF([.J233]>0;1;0) -> 0 | T233: of:=IF([.K233]>0;1;0) -> 0 | U233: of:=IF([.L233]>0;1;0) -> 1 | V233: of:=[.N233]*[.N$402]+[.O233]*[.O$402]+[.P233]*[.P$402]+[.Q233]*[.Q$402]+[.R233]*[.R$402]+[.S233]*[.S$402]+[.T233]*[.T$402]+[.U233]*[.U$402] -> 0.308633066549229 | W233: 35506 | Y233: of:=[.W233]+[.X233] -> 35506 | Z233: of:=[.Y233]/[.Y$401] -> 11.3054367584258 | AA233: of:=[.D233]+[.M233]+[.V233]+[.Z233] -> 15.5008510521741 | AB233: of:=RANK([.AA233];[.AA$2:.AA$399];0) -> 232
A234: Woking | B234: 72819 | C234: of:=IF(SUM([.E234:.L234])>0;[.B234];0) -> 72819 | D234: of:=[.C234]/[.C$401] -> 2.74265087140735 | G234: 1 | H234: 1 | I234: 1 | K234: 1 | L234: 1 | M234: of:=[.E234]*[.AC$11]+[.F234]*[.AC$13]+[.G234]*[.AC$15]+[.H234]*[.AC$17]+[.I234]*[.AC$19]+[.J234]*[.AC$21]+[.K234]*[.AC$23]+[.L234]*[.AC$25] -> 4.1770743494719 | N234: of:=IF([.E234]>0;1;0) -> 0 | O234: of:=IF([.F234]>0;1;0) -> 0 | P234: of:=IF([.G234]>0;1;0) -> 1 | Q234: of:=IF([.H234]>0;1;0) -> 1 | R234: of:=IF([.I234]>0;1;0) -> 1 | S234: of:=IF([.J234]>0;1;0) -> 0 | T234: of:=IF([.K234]>0;1;0) -> 1 | U234: of:=IF([.L234]>0;1;0) -> 1 | V234: of:=[.N234]*[.N$402]+[.O234]*[.O$402]+[.P234]*[.P$402]+[.Q234]*[.Q$402]+[.R234]*[.R$402]+[.S234]*[.S$402]+[.T234]*[.T$402]+[.U234]*[.U$402] -> 2.03350799196213 | W234: of:=55+20492 -> 20547 | Y234: of:=[.W234]+[.X234] -> 20547 | Z234: of:=[.Y234]/[.Y$401] -> 6.54235366065949 | AA234: of:=[.D234]+[.M234]+[.V234]+[.Z234] -> 15.4955868735009 | AB234: of:=RANK([.AA234];[.AA$2:.AA$399];0) -> 233
A235: E Suffolk | B235: of:=99608+93765 -> 193373 | C235: of:=IF(SUM([.E235:.L235])>0;[.B235];0) -> 193373 | D235: of:=[.C235]/[.C$401] -> 7.28319019701799 | H235: 1 | L235: 1 | M235: of:=[.E235]*[.AC$11]+[.F235]*[.AC$13]+[.G235]*[.AC$15]+[.H235]*[.AC$17]+[.I235]*[.AC$19]+[.J235]*[.AC$21]+[.K235]*[.AC$23]+[.L235]*[.AC$25] -> 1.02390704070172 | N235: of:=IF([.E235]>0;1;0) -> 0 | O235: of:=IF([.F235]>0;1;0) -> 0 | P235: of:=IF([.G235]>0;1;0) -> 0 | Q235: of:=IF([.H235]>0;1;0) -> 1 | R235: of:=IF([.I235]>0;1;0) -> 0 | S235: of:=IF([.J235]>0;1;0) -> 0 | T235: of:=IF([.K235]>0;1;0) -> 0 | U235: of:=IF([.L235]>0;1;0) -> 1 | V235: of:=[.N235]*[.N$402]+[.O235]*[.O$402]+[.P235]*[.P$402]+[.Q235]*[.Q$402]+[.R235]*[.R$402]+[.S235]*[.S$402]+[.T235]*[.T$402]+[.U235]*[.U$402] -> 0.308633066549229 | W235: 21482 | Y235: of:=[.W235]+[.X235] -> 21482 | Z235: of:=[.Y235]/[.Y$401] -> 6.84006625484436 | AA235: of:=[.D235]+[.M235]+[.V235]+[.Z235] -> 15.4557965591133 | AB235: of:=RANK([.AA235];[.AA$2:.AA$399];0) -> 234
A236: Blaby | B236: 76177 | C236: of:=IF(SUM([.E236:.L236])>0;[.B236];0) -> 76177 | D236: of:=[.C236]/[.C$401] -> 2.86912640150507 | H236: 1 | L236: 1 | M236: of:=[.E236]*[.AC$11]+[.F236]*[.AC$13]+[.G236]*[.AC$15]+[.H236]*[.AC$17]+[.I236]*[.AC$19]+[.J236]*[.AC$21]+[.K236]*[.AC$23]+[.L236]*[.AC$25] -> 1.02390704070172 | N236: of:=IF([.E236]>0;1;0) -> 0 | O236: of:=IF([.F236]>0;1;0) -> 0 | P236: of:=IF([.G236]>0;1;0) -> 0 | Q236: of:=IF([.H236]>0;1;0) -> 1 | R236: of:=IF([.I236]>0;1;0) -> 0 | S236: of:=IF([.J236]>0;1;0) -> 0 | T236: of:=IF([.K236]>0;1;0) -> 0 | U236: of:=IF([.L236]>0;1;0) -> 1 | V236: of:=[.N236]*[.N$402]+[.O236]*[.O$402]+[.P236]*[.P$402]+[.Q236]*[.Q$402]+[.R236]*[.R$402]+[.S236]*[.S$402]+[.T236]*[.T$402]+[.U236]*[.U$402] -> 0.308633066549229 | W236: 35332 | Y236: of:=[.W236]+[.X236] -> 35332 | Z236: of:=[.Y236]/[.Y$401] -> 11.2500335590802 | AA236: of:=[.D236]+[.M236]+[.V236]+[.Z236] -> 15.4517000678362 | AB236: of:=RANK([.AA236];[.AA$2:.AA$399];0) -> 235
A237: S Derbys | B237: 77538 | C237: of:=IF(SUM([.E237:.L237])>0;[.B237];0) -> 77538 | D237: of:=[.C237]/[.C$401] -> 2.92038703177993 | H237: 1 | L237: 1 | M237: of:=[.E237]*[.AC$11]+[.F237]*[.AC$13]+[.G237]*[.AC$15]+[.H237]*[.AC$17]+[.I237]*[.AC$19]+[.J237]*[.AC$21]+[.K237]*[.AC$23]+[.L237]*[.AC$25] -> 1.02390704070172 | N237: of:=IF([.E237]>0;1;0) -> 0 | O237: of:=IF([.F237]>0;1;0) -> 0 | P237: of:=IF([.G237]>0;1;0) -> 0 | Q237: of:=IF([.H237]>0;1;0) -> 1 | R237: of:=IF([.I237]>0;1;0) -> 0 | S237: of:=IF([.J237]>0;1;0) -> 0 | T237: of:=IF([.K237]>0;1;0) -> 0 | U237: of:=IF([.L237]>0;1;0) -> 1 | V237: of:=[.N237]*[.N$402]+[.O237]*[.O$402]+[.P237]*[.P$402]+[.Q237]*[.Q$402]+[.R237]*[.R$402]+[.S237]*[.S$402]+[.T237]*[.T$402]+[.U237]*[.U$402] -> 0.308633066549229 | W237: 35159 | Y237: of:=[.W237]+[.X237] -> 35159 | Z237: of:=[.Y237]/[.Y$401] -> 11.1949487689262 | AA237: of:=[.D237]+[.M237]+[.V237]+[.Z237] -> 15.4478759079571 | AB237: of:=RANK([.AA237];[.AA$2:.AA$399];0) -> 236
A238: Tandridge | B238: 64121 | C238: of:=IF(SUM([.E238:.L238])>0;[.B238];0) -> 64121 | D238: of:=[.C238]/[.C$401] -> 2.41504987057651 | G238: 1 | H238: 1 | I238: 1 | K238: 1 | L238: 1 | M238: of:=[.E238]*[.AC$11]+[.F238]*[.AC$13]+[.G238]*[.AC$15]+[.H238]*[.AC$17]+[.I238]*[.AC$19]+[.J238]*[.AC$21]+[.K238]*[.AC$23]+[.L238]*[.AC$25] -> 4.1770743494719 | N238: of:=IF([.E238]>0;1;0) -> 0 | O238: of:=IF([.F238]>0;1;0) -> 0 | P238: of:=IF([.G238]>0;1;0) -> 1 | Q238: of:=IF([.H238]>0;1;0) -> 1 | R238: of:=IF([.I238]>0;1;0) -> 1 | S238: of:=IF([.J238]>0;1;0) -> 0 | T238: of:=IF([.K238]>0;1;0) -> 1 | U238: of:=IF([.L238]>0;1;0) -> 1 | V238: of:=[.N238]*[.N$402]+[.O238]*[.O$402]+[.P238]*[.P$402]+[.Q238]*[.Q$402]+[.R238]*[.R$402]+[.S238]*[.S$402]+[.T238]*[.T$402]+[.U238]*[.U$402] -> 2.03350799196213 | W238: of:=20+21301 -> 21321 | Y238: of:=[.W238]+[.X238] -> 21321 | Z238: of:=[.Y238]/[.Y$401] -> 6.78880237499007 | AA238: of:=[.D238]+[.M238]+[.V238]+[.Z238] -> 15.4144345870006 | AB238: of:=RANK([.AA238];[.AA$2:.AA$399];0) -> 237
A239: Chesterfield | B239: 78043 | C239: of:=IF(SUM([.E239:.L239])>0;[.B239];0) -> 78043 | D239: of:=[.C239]/[.C$401] -> 2.93940732442417 | H239: 1 | L239: 1 | M239: of:=[.E239]*[.AC$11]+[.F239]*[.AC$13]+[.G239]*[.AC$15]+[.H239]*[.AC$17]+[.I239]*[.AC$19]+[.J239]*[.AC$21]+[.K239]*[.AC$23]+[.L239]*[.AC$25] -> 1.02390704070172 | N239: of:=IF([.E239]>0;1;0) -> 0 | O239: of:=IF([.F239]>0;1;0) -> 0 | P239: of:=IF([.G239]>0;1;0) -> 0 | Q239: of:=IF([.H239]>0;1;0) -> 1 | R239: of:=IF([.I239]>0;1;0) -> 0 | S239: of:=IF([.J239]>0;1;0) -> 0 | T239: of:=IF([.K239]>0;1;0) -> 0 | U239: of:=IF([.L239]>0;1;0) -> 1 | V239: of:=[.N239]*[.N$402]+[.O239]*[.O$402]+[.P239]*[.P$402]+[.Q239]*[.Q$402]+[.R239]*[.R$402]+[.S239]*[.S$402]+[.T239]*[.T$402]+[.U239]*[.U$402] -> 0.308633066549229 | W239: 34986 | Y239: of:=[.W239]+[.X239] -> 34986 | Z239: of:=[.Y239]/[.Y$401] -> 11.1398639787722 | AA239: of:=[.D239]+[.M239]+[.V239]+[.Z239] -> 15.4118114104473 | AB239: of:=RANK([.AA239];[.AA$2:.AA$399];0) -> 238
A240: Bucks CC | B240: 399971 | C240: of:=IF(SUM([.E240:.L240])>0;[.B240];0) -> 399971 | D240: of:=[.C240]/[.C$401] -> 15.06448607764 | J240: 1 | M240: of:=[.E240]*[.AC$11]+[.F240]*[.AC$13]+[.G240]*[.AC$15]+[.H240]*[.AC$17]+[.I240]*[.AC$19]+[.J240]*[.AC$21]+[.K240]*[.AC$23]+[.L240]*[.AC$25] -> 0.136078386768712 | N240: of:=IF([.E240]>0;1;0) -> 0 | O240: of:=IF([.F240]>0;1;0) -> 0 | P240: of:=IF([.G240]>0;1;0) -> 0 | Q240: of:=IF([.H240]>0;1;0) -> 0 | R240: of:=IF([.I240]>0;1;0) -> 0 | S240: of:=IF([.J240]>0;1;0) -> 1 | T240: of:=IF([.K240]>0;1;0) -> 0 | U240: of:=IF([.L240]>0;1;0) -> 0 | V240: of:=[.N240]*[.N$402]+[.O240]*[.O$402]+[.P240]*[.P$402]+[.Q240]*[.Q$402]+[.R240]*[.R$402]+[.S240]*[.S$402]+[.T240]*[.T$402]+[.U240]*[.U$402] -> 0.174691403761665 | Y240: of:=[.W240]+[.X240] -> 0 | Z240: of:=[.Y240]/[.Y$401] -> 0 | AA240: of:=[.D240]+[.M240]+[.V240]+[.Z240] -> 15.3752558681704 | AB240: of:=RANK([.AA240];[.AA$2:.AA$399];0) -> 239
A241: Darlington | B241: 78320 | C241: of:=IF(SUM([.E241:.L241])>0;[.B241];0) -> 78320 | D241: of:=[.C241]/[.C$401] -> 2.94984023741913 | H241: 1 | L241: 1 | M241: of:=[.E241]*[.AC$11]+[.F241]*[.AC$13]+[.G241]*[.AC$15]+[.H241]*[.AC$17]+[.I241]*[.AC$19]+[.J241]*[.AC$21]+[.K241]*[.AC$23]+[.L241]*[.AC$25] -> 1.02390704070172 | N241: of:=IF([.E241]>0;1;0) -> 0 | O241: of:=IF([.F241]>0;1;0) -> 0 | P241: of:=IF([.G241]>0;1;0) -> 0 | Q241: of:=IF([.H241]>0;1;0) -> 1 | R241: of:=IF([.I241]>0;1;0) -> 0 | S241: of:=IF([.J241]>0;1;0) -> 0 | T241: of:=IF([.K241]>0;1;0) -> 0 | U241: of:=IF([.L241]>0;1;0) -> 1 | V241: of:=[.N241]*[.N$402]+[.O241]*[.O$402]+[.P241]*[.P$402]+[.Q241]*[.Q$402]+[.R241]*[.R$402]+[.S241]*[.S$402]+[.T241]*[.T$402]+[.U241]*[.U$402] -> 0.308633066549229 | W241: 34813 | Y241: of:=[.W241]+[.X241] -> 34813 | Z241: of:=[.Y241]/[.Y$401] -> 11.0847791886182 | AA241: of:=[.D241]+[.M241]+[.V241]+[.Z241] -> 15.3671595332883 | AB241: of:=RANK([.AA241];[.AA$2:.AA$399];0) -> 240
A242: NE Derbys | B242: 78522 | C242: of:=IF(SUM([.E242:.L242])>0;[.B242];0) -> 78522 | D242: of:=[.C242]/[.C$401] -> 2.95744835447682 | H242: 1 | L242: 1 | M242: of:=[.E242]*[.AC$11]+[.F242]*[.AC$13]+[.G242]*[.AC$15]+[.H242]*[.AC$17]+[.I242]*[.AC$19]+[.J242]*[.AC$21]+[.K242]*[.AC$23]+[.L242]*[.AC$25] -> 1.02390704070172 | N242: of:=IF([.E242]>0;1;0) -> 0 | O242: of:=IF([.F242]>0;1;0) -> 0 | P242: of:=IF([.G242]>0;1;0) -> 0 | Q242: of:=IF([.H242]>0;1;0) -> 1 | R242: of:=IF([.I242]>0;1;0) -> 0 | S242: of:=IF([.J242]>0;1;0) -> 0 | T242: of:=IF([.K242]>0;1;0) -> 0 | U242: of:=IF([.L242]>0;1;0) -> 1 | V242: of:=[.N242]*[.N$402]+[.O242]*[.O$402]+[.P242]*[.P$402]+[.Q242]*[.Q$402]+[.R242]*[.R$402]+[.S242]*[.S$402]+[.T242]*[.T$402]+[.U242]*[.U$402] -> 0.308633066549229 | W242: 34640 | Y242: of:=[.W242]+[.X242] -> 34640 | Z242: of:=[.Y242]/[.Y$401] -> 11.0296943984642 | AA242: of:=[.D242]+[.M242]+[.V242]+[.Z242] -> 15.319682860192 | AB242: of:=RANK([.AA242];[.AA$2:.AA$399];0) -> 241
A243: Harlow | B243: 61726 | C243: of:=IF(SUM([.E243:.L243])>0;[.B243];0) -> 61726 | D243: of:=[.C243]/[.C$401] -> 2.32484472031324 | G243: 1 | H243: 1 | I243: 1 | K243: 1 | L243: 1 | M243: of:=[.E243]*[.AC$11]+[.F243]*[.AC$13]+[.G243]*[.AC$15]+[.H243]*[.AC$17]+[.I243]*[.AC$19]+[.J243]*[.AC$21]+[.K243]*[.AC$23]+[.L243]*[.AC$25] -> 4.1770743494719 | N243: of:=IF([.E243]>0;1;0) -> 0 | O243: of:=IF([.F243]>0;1;0) -> 0 | P243: of:=IF([.G243]>0;1;0) -> 1 | Q243: of:=IF([.H243]>0;1;0) -> 1 | R243: of:=IF([.I243]>0;1;0) -> 1 | S243: of:=IF([.J243]>0;1;0) -> 0 | T243: of:=IF([.K243]>0;1;0) -> 1 | U243: of:=IF([.L243]>0;1;0) -> 1 | V243: of:=[.N243]*[.N$402]+[.O243]*[.O$402]+[.P243]*[.P$402]+[.Q243]*[.Q$402]+[.R243]*[.R$402]+[.S243]*[.S$402]+[.T243]*[.T$402]+[.U243]*[.U$402] -> 2.03350799196213 | W243: of:=63+21120 -> 21183 | Y243: of:=[.W243]+[.X243] -> 21183 | Z243: of:=[.Y243]/[.Y$401] -> 6.74486190654353 | AA243: of:=[.D243]+[.M243]+[.V243]+[.Z243] -> 15.2802889682908 | AB243: of:=RANK([.AA243];[.AA$2:.AA$399];0) -> 242
A244: Staffs Moorlands | B244: 78920 | C244: of:=IF(SUM([.E244:.L244])>0;[.B244];0) -> 78920 | D244: of:=[.C244]/[.C$401] -> 2.97243860491723 | H244: 1 | L244: 1 | M244: of:=[.E244]*[.AC$11]+[.F244]*[.AC$13]+[.G244]*[.AC$15]+[.H244]*[.AC$17]+[.I244]*[.AC$19]+[.J244]*[.AC$21]+[.K244]*[.AC$23]+[.L244]*[.AC$25] -> 1.02390704070172 | N244: of:=IF([.E244]>0;1;0) -> 0 | O244: of:=IF([.F244]>0;1;0) -> 0 | P244: of:=IF([.G244]>0;1;0) -> 0 | Q244: of:=IF([.H244]>0;1;0) -> 1 | R244: of:=IF([.I244]>0;1;0) -> 0 | S244: of:=IF([.J244]>0;1;0) -> 0 | T244: of:=IF([.K244]>0;1;0) -> 0 | U244: of:=IF([.L244]>0;1;0) -> 1 | V244: of:=[.N244]*[.N$402]+[.O244]*[.O$402]+[.P244]*[.P$402]+[.Q244]*[.Q$402]+[.R244]*[.R$402]+[.S244]*[.S$402]+[.T244]*[.T$402]+[.U244]*[.U$402] -> 0.308633066549229 | W244: 34467 | Y244: of:=[.W244]+[.X244] -> 34467 | Z244: of:=[.Y244]/[.Y$401] -> 10.9746096083102 | AA244: of:=[.D244]+[.M244]+[.V244]+[.Z244] -> 15.2795883204784 | AB244: of:=RANK([.AA244];[.AA$2:.AA$399];0) -> 243
A245: NW Leics | B245: 79587 | C245: of:=IF(SUM([.E245:.L245])>0;[.B245];0) -> 79587 | D245: of:=[.C245]/[.C$401] -> 2.99756045678596 | H245: 1 | L245: 1 | M245: of:=[.E245]*[.AC$11]+[.F245]*[.AC$13]+[.G245]*[.AC$15]+[.H245]*[.AC$17]+[.I245]*[.AC$19]+[.J245]*[.AC$21]+[.K245]*[.AC$23]+[.L245]*[.AC$25] -> 1.02390704070172 | N245: of:=IF([.E245]>0;1;0) -> 0 | O245: of:=IF([.F245]>0;1;0) -> 0 | P245: of:=IF([.G245]>0;1;0) -> 0 | Q245: of:=IF([.H245]>0;1;0) -> 1 | R245: of:=IF([.I245]>0;1;0) -> 0 | S245: of:=IF([.J245]>0;1;0) -> 0 | T245: of:=IF([.K245]>0;1;0) -> 0 | U245: of:=IF([.L245]>0;1;0) -> 1 | V245: of:=[.N245]*[.N$402]+[.O245]*[.O$402]+[.P245]*[.P$402]+[.Q245]*[.Q$402]+[.R245]*[.R$402]+[.S245]*[.S$402]+[.T245]*[.T$402]+[.U245]*[.U$402] -> 0.308633066549229 | W245: 34295 | Y245: of:=[.W245]+[.X245] -> 34295 | Z245: of:=[.Y245]/[.Y$401] -> 10.9198432273479 | AA245: of:=[.D245]+[.M245]+[.V245]+[.Z245] -> 15.2499437913848 | AB245: of:=RANK([.AA245];[.AA$2:.AA$399];0) -> 244
A246: M Suffolk | B246: 80011 | C246: of:=IF(SUM([.E246:.L246])>0;[.B246];0) -> 80011 | D246: of:=[.C246]/[.C$401] -> 3.01352996981795 | H246: 1 | L246: 1 | M246: of:=[.E246]*[.AC$11]+[.F246]*[.AC$13]+[.G246]*[.AC$15]+[.H246]*[.AC$17]+[.I246]*[.AC$19]+[.J246]*[.AC$21]+[.K246]*[.AC$23]+[.L246]*[.AC$25] -> 1.02390704070172 | N246: of:=IF([.E246]>0;1;0) -> 0 | O246: of:=IF([.F246]>0;1;0) -> 0 | P246: of:=IF([.G246]>0;1;0) -> 0 | Q246: of:=IF([.H246]>0;1;0) -> 1 | R246: of:=IF([.I246]>0;1;0) -> 0 | S246: of:=IF([.J246]>0;1;0) -> 0 | T246: of:=IF([.K246]>0;1;0) -> 0 | U246: of:=IF([.L246]>0;1;0) -> 1 | V246: of:=[.N246]*[.N$402]+[.O246]*[.O$402]+[.P246]*[.P$402]+[.Q246]*[.Q$402]+[.R246]*[.R$402]+[.S246]*[.S$402]+[.T246]*[.T$402]+[.U246]*[.U$402] -> 0.308633066549229 | W246: 34123 | Y246: of:=[.W246]+[.X246] -> 34123 | Z246: of:=[.Y246]/[.Y$401] -> 10.8650768463855 | AA246: of:=[.D246]+[.M246]+[.V246]+[.Z246] -> 15.2111469234544 | AB246: of:=RANK([.AA246];[.AA$2:.AA$399];0) -> 245
A247: Dartford | B247: 80199 | C247: of:=IF(SUM([.E247:.L247])>0;[.B247];0) -> 80199 | D247: of:=[.C247]/[.C$401] -> 3.02061079163402 | H247: 1 | L247: 1 | M247: of:=[.E247]*[.AC$11]+[.F247]*[.AC$13]+[.G247]*[.AC$15]+[.H247]*[.AC$17]+[.I247]*[.AC$19]+[.J247]*[.AC$21]+[.K247]*[.AC$23]+[.L247]*[.AC$25] -> 1.02390704070172 | N247: of:=IF([.E247]>0;1;0) -> 0 | O247: of:=IF([.F247]>0;1;0) -> 0 | P247: of:=IF([.G247]>0;1;0) -> 0 | Q247: of:=IF([.H247]>0;1;0) -> 1 | R247: of:=IF([.I247]>0;1;0) -> 0 | S247: of:=IF([.J247]>0;1;0) -> 0 | T247: of:=IF([.K247]>0;1;0) -> 0 | U247: of:=IF([.L247]>0;1;0) -> 1 | V247: of:=[.N247]*[.N$402]+[.O247]*[.O$402]+[.P247]*[.P$402]+[.Q247]*[.Q$402]+[.R247]*[.R$402]+[.S247]*[.S$402]+[.T247]*[.T$402]+[.U247]*[.U$402] -> 0.308633066549229 | W247: 33951 | Y247: of:=[.W247]+[.X247] -> 33951 | Z247: of:=[.Y247]/[.Y$401] -> 10.8103104654232 | AA247: of:=[.D247]+[.M247]+[.V247]+[.Z247] -> 15.1634613643082 | AB247: of:=RANK([.AA247];[.AA$2:.AA$399];0) -> 246
A248: Southampton | B248: 165698 | C248: of:=IF(SUM([.E248:.L248])>0;[.B248];0) -> 165698 | D248: of:=[.C248]/[.C$401] -> 6.24084049616796 | H248: 1 | I248: 1 | K248: 1 | L248: 1 | M248: of:=[.E248]*[.AC$11]+[.F248]*[.AC$13]+[.G248]*[.AC$15]+[.H248]*[.AC$17]+[.I248]*[.AC$19]+[.J248]*[.AC$21]+[.K248]*[.AC$23]+[.L248]*[.AC$25] -> 1.44386688758112 | N248: of:=IF([.E248]>0;1;0) -> 0 | O248: of:=IF([.F248]>0;1;0) -> 0 | P248: of:=IF([.G248]>0;1;0) -> 0 | Q248: of:=IF([.H248]>0;1;0) -> 1 | R248: of:=IF([.I248]>0;1;0) -> 1 | S248: of:=IF([.J248]>0;1;0) -> 0 | T248: of:=IF([.K248]>0;1;0) -> 1 | U248: of:=IF([.L248]>0;1;0) -> 1 | V248: of:=[.N248]*[.N$402]+[.O248]*[.O$402]+[.P248]*[.P$402]+[.Q248]*[.Q$402]+[.R248]*[.R$402]+[.S248]*[.S$402]+[.T248]*[.T$402]+[.U248]*[.U$402] -> 0.548043049303238 | W248: 21634 | Y248: of:=[.W248]+[.X248] -> 21634 | Z248: of:=[.Y248]/[.Y$401] -> 6.88846445197388 | AA248: of:=[.D248]+[.M248]+[.V248]+[.Z248] -> 15.1212148850262 | AB248: of:=RANK([.AA248];[.AA$2:.AA$399];0) -> 247
A249: Lichfield | B249: 80317 | C249: of:=IF(SUM([.E249:.L249])>0;[.B249];0) -> 80317 | D249: of:=[.C249]/[.C$401] -> 3.02505513724198 | H249: 1 | L249: 1 | M249: of:=[.E249]*[.AC$11]+[.F249]*[.AC$13]+[.G249]*[.AC$15]+[.H249]*[.AC$17]+[.I249]*[.AC$19]+[.J249]*[.AC$21]+[.K249]*[.AC$23]+[.L249]*[.AC$25] -> 1.02390704070172 | N249: of:=IF([.E249]>0;1;0) -> 0 | O249: of:=IF([.F249]>0;1;0) -> 0 | P249: of:=IF([.G249]>0;1;0) -> 0 | Q249: of:=IF([.H249]>0;1;0) -> 1 | R249: of:=IF([.I249]>0;1;0) -> 0 | S249: of:=IF([.J249]>0;1;0) -> 0 | T249: of:=IF([.K249]>0;1;0) -> 0 | U249: of:=IF([.L249]>0;1;0) -> 1 | V249: of:=[.N249]*[.N$402]+[.O249]*[.O$402]+[.P249]*[.P$402]+[.Q249]*[.Q$402]+[.R249]*[.R$402]+[.S249]*[.S$402]+[.T249]*[.T$402]+[.U249]*[.U$402] -> 0.308633066549229 | W249: 33779 | Y249: of:=[.W249]+[.X249] -> 33779 | Z249: of:=[.Y249]/[.Y$401] -> 10.7555440844608 | AA249: of:=[.D249]+[.M249]+[.V249]+[.Z249] -> 15.1131393289538 | AB249: of:=RANK([.AA249];[.AA$2:.AA$399];0) -> 248
A250: Stoke-on-Trent | B250: 181473 | C250: of:=IF(SUM([.E250:.L250])>0;[.B250];0) -> 181473 | D250: of:=[.C250]/[.C$401] -> 6.83498924163894 | H250: 1 | L250: 1 | M250: of:=[.E250]*[.AC$11]+[.F250]*[.AC$13]+[.G250]*[.AC$15]+[.H250]*[.AC$17]+[.I250]*[.AC$19]+[.J250]*[.AC$21]+[.K250]*[.AC$23]+[.L250]*[.AC$25] -> 1.02390704070172 | N250: of:=IF([.E250]>0;1;0) -> 0 | O250: of:=IF([.F250]>0;1;0) -> 0 | P250: of:=IF([.G250]>0;1;0) -> 0 | Q250: of:=IF([.H250]>0;1;0) -> 1 | R250: of:=IF([.I250]>0;1;0) -> 0 | S250: of:=IF([.J250]>0;1;0) -> 0 | T250: of:=IF([.K250]>0;1;0) -> 0 | U250: of:=IF([.L250]>0;1;0) -> 1 | V250: of:=[.N250]*[.N$402]+[.O250]*[.O$402]+[.P250]*[.P$402]+[.Q250]*[.Q$402]+[.R250]*[.R$402]+[.S250]*[.S$402]+[.T250]*[.T$402]+[.U250]*[.U$402] -> 0.308633066549229 | W250: 21796 | Y250: of:=[.W250]+[.X250] -> 21796 | Z250: of:=[.Y250]/[.Y$401] -> 6.94004674101982 | AA250: of:=[.D250]+[.M250]+[.V250]+[.Z250] -> 15.1075760899097 | AB250: of:=RANK([.AA250];[.AA$2:.AA$399];0) -> 249
A251: Rugby | B251: 79280 | C251: of:=IF(SUM([.E251:.L251])>0;[.B251];0) -> 79280 | D251: of:=[.C251]/[.C$401] -> 2.98599762541609 | G251: 1 | H251: 1 | I251: 1 | K251: 1 | L251: 1 | M251: of:=[.E251]*[.AC$11]+[.F251]*[.AC$13]+[.G251]*[.AC$15]+[.H251]*[.AC$17]+[.I251]*[.AC$19]+[.J251]*[.AC$21]+[.K251]*[.AC$23]+[.L251]*[.AC$25] -> 4.1770743494719 | N251: of:=IF([.E251]>0;1;0) -> 0 | O251: of:=IF([.F251]>0;1;0) -> 0 | P251: of:=IF([.G251]>0;1;0) -> 1 | Q251: of:=IF([.H251]>0;1;0) -> 1 | R251: of:=IF([.I251]>0;1;0) -> 1 | S251: of:=IF([.J251]>0;1;0) -> 0 | T251: of:=IF([.K251]>0;1;0) -> 1 | U251: of:=IF([.L251]>0;1;0) -> 1 | V251: of:=[.N251]*[.N$402]+[.O251]*[.O$402]+[.P251]*[.P$402]+[.Q251]*[.Q$402]+[.R251]*[.R$402]+[.S251]*[.S$402]+[.T251]*[.T$402]+[.U251]*[.U$402] -> 2.03350799196213 | W251: of:=4599+13939 -> 18538 | Y251: of:=[.W251]+[.X251] -> 18538 | Z251: of:=[.Y251]/[.Y$401] -> 5.90266959465156 | AA251: of:=[.D251]+[.M251]+[.V251]+[.Z251] -> 15.0992495615017 | AB251: of:=RANK([.AA251];[.AA$2:.AA$399];0) -> 250
A252: Mansfield | B252: 80638 | C252: of:=IF(SUM([.E252:.L252])>0;[.B252];0) -> 80638 | D252: of:=[.C252]/[.C$401] -> 3.03714526385347 | H252: 1 | L252: 1 | M252: of:=[.E252]*[.AC$11]+[.F252]*[.AC$13]+[.G252]*[.AC$15]+[.H252]*[.AC$17]+[.I252]*[.AC$19]+[.J252]*[.AC$21]+[.K252]*[.AC$23]+[.L252]*[.AC$25] -> 1.02390704070172 | N252: of:=IF([.E252]>0;1;0) -> 0 | O252: of:=IF([.F252]>0;1;0) -> 0 | P252: of:=IF([.G252]>0;1;0) -> 0 | Q252: of:=IF([.H252]>0;1;0) -> 1 | R252: of:=IF([.I252]>0;1;0) -> 0 | S252: of:=IF([.J252]>0;1;0) -> 0 | T252: of:=IF([.K252]>0;1;0) -> 0 | U252: of:=IF([.L252]>0;1;0) -> 1 | V252: of:=[.N252]*[.N$402]+[.O252]*[.O$402]+[.P252]*[.P$402]+[.Q252]*[.Q$402]+[.R252]*[.R$402]+[.S252]*[.S$402]+[.T252]*[.T$402]+[.U252]*[.U$402] -> 0.308633066549229 | W252: 33608 | Y252: of:=[.W252]+[.X252] -> 33608 | Z252: of:=[.Y252]/[.Y$401] -> 10.7010961126901 | AA252: of:=[.D252]+[.M252]+[.V252]+[.Z252] -> 15.0707814837945 | AB252: of:=RANK([.AA252];[.AA$2:.AA$399];0) -> 251
A253: Scarborough | B253: 82053 | C253: of:=IF(SUM([.E253:.L253])>0;[.B253];0) -> 82053 | D253: of:=[.C253]/[.C$401] -> 3.09043974720316 | H253: 1 | L253: 1 | M253: of:=[.E253]*[.AC$11]+[.F253]*[.AC$13]+[.G253]*[.AC$15]+[.H253]*[.AC$17]+[.I253]*[.AC$19]+[.J253]*[.AC$21]+[.K253]*[.AC$23]+[.L253]*[.AC$25] -> 1.02390704070172 | N253: of:=IF([.E253]>0;1;0) -> 0 | O253: of:=IF([.F253]>0;1;0) -> 0 | P253: of:=IF([.G253]>0;1;0) -> 0 | Q253: of:=IF([.H253]>0;1;0) -> 1 | R253: of:=IF([.I253]>0;1;0) -> 0 | S253: of:=IF([.J253]>0;1;0) -> 0 | T253: of:=IF([.K253]>0;1;0) -> 0 | U253: of:=IF([.L253]>0;1;0) -> 1 | V253: of:=[.N253]*[.N$402]+[.O253]*[.O$402]+[.P253]*[.P$402]+[.Q253]*[.Q$402]+[.R253]*[.R$402]+[.S253]*[.S$402]+[.T253]*[.T$402]+[.U253]*[.U$402] -> 0.308633066549229 | W253: 33437 | Y253: of:=[.W253]+[.X253] -> 33437 | Z253: of:=[.Y253]/[.Y$401] -> 10.6466481409194 | AA253: of:=[.D253]+[.M253]+[.V253]+[.Z253] -> 15.0696279953735 | AB253: of:=RANK([.AA253];[.AA$2:.AA$399];0) -> 252
A254: E Staffs | B254: 86096 | C254: of:=IF(SUM([.E254:.L254])>0;[.B254];0) -> 86096 | D254: of:=[.C254]/[.C$401] -> 3.24271508019455 | H254: 1 | L254: 1 | M254: of:=[.E254]*[.AC$11]+[.F254]*[.AC$13]+[.G254]*[.AC$15]+[.H254]*[.AC$17]+[.I254]*[.AC$19]+[.J254]*[.AC$21]+[.K254]*[.AC$23]+[.L254]*[.AC$25] -> 1.02390704070172 | N254: of:=IF([.E254]>0;1;0) -> 0 | O254: of:=IF([.F254]>0;1;0) -> 0 | P254: of:=IF([.G254]>0;1;0) -> 0 | Q254: of:=IF([.H254]>0;1;0) -> 1 | R254: of:=IF([.I254]>0;1;0) -> 0 | S254: of:=IF([.J254]>0;1;0) -> 0 | T254: of:=IF([.K254]>0;1;0) -> 0 | U254: of:=IF([.L254]>0;1;0) -> 1 | V254: of:=[.N254]*[.N$402]+[.O254]*[.O$402]+[.P254]*[.P$402]+[.Q254]*[.Q$402]+[.R254]*[.R$402]+[.S254]*[.S$402]+[.T254]*[.T$402]+[.U254]*[.U$402] -> 0.308633066549229 | W254: 32925 | Y254: of:=[.W254]+[.X254] -> 32925 | Z254: of:=[.Y254]/[.Y$401] -> 10.4836226347989 | AA254: of:=[.D254]+[.M254]+[.V254]+[.Z254] -> 15.0588778222444 | AB254: of:=RANK([.AA254];[.AA$2:.AA$399];0) -> 253
A255: Barnet | B255: 258038 | C255: of:=IF(SUM([.E255:.L255])>0;[.B255];0) -> 258038 | D255: of:=[.C255]/[.C$401] -> 9.71872925412611 | G255: 1 | K255: 1 | M255: of:=[.E255]*[.AC$11]+[.F255]*[.AC$13]+[.G255]*[.AC$15]+[.H255]*[.AC$17]+[.I255]*[.AC$19]+[.J255]*[.AC$21]+[.K255]*[.AC$23]+[.L255]*[.AC$25] -> 2.78326790277077 | N255: of:=IF([.E255]>0;1;0) -> 0 | O255: of:=IF([.F255]>0;1;0) -> 0 | P255: of:=IF([.G255]>0;1;0) -> 1 | Q255: of:=IF([.H255]>0;1;0) -> 0 | R255: of:=IF([.I255]>0;1;0) -> 0 | S255: of:=IF([.J255]>0;1;0) -> 0 | T255: of:=IF([.K255]>0;1;0) -> 1 | U255: of:=IF([.L255]>0;1;0) -> 0 | V255: of:=[.N255]*[.N$402]+[.O255]*[.O$402]+[.P255]*[.P$402]+[.Q255]*[.Q$402]+[.R255]*[.R$402]+[.S255]*[.S$402]+[.T255]*[.T$402]+[.U255]*[.U$402] -> 1.5062883605785 | W255: 3287 | Y255: of:=[.W255]+[.X255] -> 3287 | Z255: of:=[.Y255]/[.Y$401] -> 1.04661101292586 | AA255: of:=[.D255]+[.M255]+[.V255]+[.Z255] -> 15.0548965304012 | AB255: of:=RANK([.AA255];[.AA$2:.AA$399];0) -> 254
A256: N Norfolk | B256: 82575 | C256: of:=IF(SUM([.E256:.L256])>0;[.B256];0) -> 82575 | D256: of:=[.C256]/[.C$401] -> 3.11010032692651 | H256: 1 | L256: 1 | M256: of:=[.E256]*[.AC$11]+[.F256]*[.AC$13]+[.G256]*[.AC$15]+[.H256]*[.AC$17]+[.I256]*[.AC$19]+[.J256]*[.AC$21]+[.K256]*[.AC$23]+[.L256]*[.AC$25] -> 1.02390704070172 | N256: of:=IF([.E256]>0;1;0) -> 0 | O256: of:=IF([.F256]>0;1;0) -> 0 | P256: of:=IF([.G256]>0;1;0) -> 0 | Q256: of:=IF([.H256]>0;1;0) -> 1 | R256: of:=IF([.I256]>0;1;0) -> 0 | S256: of:=IF([.J256]>0;1;0) -> 0 | T256: of:=IF([.K256]>0;1;0) -> 0 | U256: of:=IF([.L256]>0;1;0) -> 1 | V256: of:=[.N256]*[.N$402]+[.O256]*[.O$402]+[.P256]*[.P$402]+[.Q256]*[.Q$402]+[.R256]*[.R$402]+[.S256]*[.S$402]+[.T256]*[.T$402]+[.U256]*[.U$402] -> 0.308633066549229 | W256: 33266 | Y256: of:=[.W256]+[.X256] -> 33266 | Z256: of:=[.Y256]/[.Y$401] -> 10.5922001691487 | AA256: of:=[.D256]+[.M256]+[.V256]+[.Z256] -> 15.0348406033262 | AB256: of:=RANK([.AA256];[.AA$2:.AA$399];0) -> 255
A257: Dover | B257: 86572 | C257: of:=IF(SUM([.E257:.L257])>0;[.B257];0) -> 86572 | D257: of:=[.C257]/[.C$401] -> 3.26064311840971 | H257: 1 | L257: 1 | M257: of:=[.E257]*[.AC$11]+[.F257]*[.AC$13]+[.G257]*[.AC$15]+[.H257]*[.AC$17]+[.I257]*[.AC$19]+[.J257]*[.AC$21]+[.K257]*[.AC$23]+[.L257]*[.AC$25] -> 1.02390704070172 | N257: of:=IF([.E257]>0;1;0) -> 0 | O257: of:=IF([.F257]>0;1;0) -> 0 | P257: of:=IF([.G257]>0;1;0) -> 0 | Q257: of:=IF([.H257]>0;1;0) -> 1 | R257: of:=IF([.I257]>0;1;0) -> 0 | S257: of:=IF([.J257]>0;1;0) -> 0 | T257: of:=IF([.K257]>0;1;0) -> 0 | U257: of:=IF([.L257]>0;1;0) -> 1 | V257: of:=[.N257]*[.N$402]+[.O257]*[.O$402]+[.P257]*[.P$402]+[.Q257]*[.Q$402]+[.R257]*[.R$402]+[.S257]*[.S$402]+[.T257]*[.T$402]+[.U257]*[.U$402] -> 0.308633066549229 | W257: 32755 | Y257: of:=[.W257]+[.X257] -> 32755 | Z257: of:=[.Y257]/[.Y$401] -> 10.4294930722199 | AA257: of:=[.D257]+[.M257]+[.V257]+[.Z257] -> 15.0226762978805 | AB257: of:=RANK([.AA257];[.AA$2:.AA$399];0) -> 256
A258: Folkestone and Hythe | B258: 83403 | C258: of:=IF(SUM([.E258:.L258])>0;[.B258];0) -> 83403 | D258: of:=[.C258]/[.C$401] -> 3.1412860740739 | H258: 1 | L258: 1 | M258: of:=[.E258]*[.AC$11]+[.F258]*[.AC$13]+[.G258]*[.AC$15]+[.H258]*[.AC$17]+[.I258]*[.AC$19]+[.J258]*[.AC$21]+[.K258]*[.AC$23]+[.L258]*[.AC$25] -> 1.02390704070172 | N258: of:=IF([.E258]>0;1;0) -> 0 | O258: of:=IF([.F258]>0;1;0) -> 0 | P258: of:=IF([.G258]>0;1;0) -> 0 | Q258: of:=IF([.H258]>0;1;0) -> 1 | R258: of:=IF([.I258]>0;1;0) -> 0 | S258: of:=IF([.J258]>0;1;0) -> 0 | T258: of:=IF([.K258]>0;1;0) -> 0 | U258: of:=IF([.L258]>0;1;0) -> 1 | V258: of:=[.N258]*[.N$402]+[.O258]*[.O$402]+[.P258]*[.P$402]+[.Q258]*[.Q$402]+[.R258]*[.R$402]+[.S258]*[.S$402]+[.T258]*[.T$402]+[.U258]*[.U$402] -> 0.308633066549229 | W258: 33096 | Y258: of:=[.W258]+[.X258] -> 33096 | Z258: of:=[.Y258]/[.Y$401] -> 10.5380706065696 | AA258: of:=[.D258]+[.M258]+[.V258]+[.Z258] -> 15.0118967878945 | AB258: of:=RANK([.AA258];[.AA$2:.AA$399];0) -> 257
A259: Cumbria CC | B259: 390146 | C259: of:=IF(SUM([.E259:.L259])>0;[.B259];0) -> 390146 | D259: of:=[.C259]/[.C$401] -> 14.6944378098586 | J259: 1 | M259: of:=[.E259]*[.AC$11]+[.F259]*[.AC$13]+[.G259]*[.AC$15]+[.H259]*[.AC$17]+[.I259]*[.AC$19]+[.J259]*[.AC$21]+[.K259]*[.AC$23]+[.L259]*[.AC$25] -> 0.136078386768712 | N259: of:=IF([.E259]>0;1;0) -> 0 | O259: of:=IF([.F259]>0;1;0) -> 0 | P259: of:=IF([.G259]>0;1;0) -> 0 | Q259: of:=IF([.H259]>0;1;0) -> 0 | R259: of:=IF([.I259]>0;1;0) -> 0 | S259: of:=IF([.J259]>0;1;0) -> 1 | T259: of:=IF([.K259]>0;1;0) -> 0 | U259: of:=IF([.L259]>0;1;0) -> 0 | V259: of:=[.N259]*[.N$402]+[.O259]*[.O$402]+[.P259]*[.P$402]+[.Q259]*[.Q$402]+[.R259]*[.R$402]+[.S259]*[.S$402]+[.T259]*[.T$402]+[.U259]*[.U$402] -> 0.174691403761665 | Y259: of:=[.W259]+[.X259] -> 0 | Z259: of:=[.Y259]/[.Y$401] -> 0 | AA259: of:=[.D259]+[.M259]+[.V259]+[.Z259] -> 15.005207600389 | AB259: of:=RANK([.AA259];[.AA$2:.AA$399];0) -> 258
A260: Rushcliffe | B260: 86782 | C260: of:=IF(SUM([.E260:.L260])>0;[.B260];0) -> 86782 | D260: of:=[.C260]/[.C$401] -> 3.26855254703405 | H260: 1 | L260: 1 | M260: of:=[.E260]*[.AC$11]+[.F260]*[.AC$13]+[.G260]*[.AC$15]+[.H260]*[.AC$17]+[.I260]*[.AC$19]+[.J260]*[.AC$21]+[.K260]*[.AC$23]+[.L260]*[.AC$25] -> 1.02390704070172 | N260: of:=IF([.E260]>0;1;0) -> 0 | O260: of:=IF([.F260]>0;1;0) -> 0 | P260: of:=IF([.G260]>0;1;0) -> 0 | Q260: of:=IF([.H260]>0;1;0) -> 1 | R260: of:=IF([.I260]>0;1;0) -> 0 | S260: of:=IF([.J260]>0;1;0) -> 0 | T260: of:=IF([.K260]>0;1;0) -> 0 | U260: of:=IF([.L260]>0;1;0) -> 1 | V260: of:=[.N260]*[.N$402]+[.O260]*[.O$402]+[.P260]*[.P$402]+[.Q260]*[.Q$402]+[.R260]*[.R$402]+[.S260]*[.S$402]+[.T260]*[.T$402]+[.U260]*[.U$402] -> 0.308633066549229 | W260: 32585 | Y260: of:=[.W260]+[.X260] -> 32585 | Z260: of:=[.Y260]/[.Y$401] -> 10.3753635096408 | AA260: of:=[.D260]+[.M260]+[.V260]+[.Z260] -> 14.9764561639258 | AB260: of:=RANK([.AA260];[.AA$2:.AA$399];0) -> 259
A261: Erewash | B261: 86823 | C261: of:=IF(SUM([.E261:.L261])>0;[.B261];0) -> 86823 | D261: of:=[.C261]/[.C$401] -> 3.27009676881309 | H261: 1 | L261: 1 | M261: of:=[.E261]*[.AC$11]+[.F261]*[.AC$13]+[.G261]*[.AC$15]+[.H261]*[.AC$17]+[.I261]*[.AC$19]+[.J261]*[.AC$21]+[.K261]*[.AC$23]+[.L261]*[.AC$25] -> 1.02390704070172 | N261: of:=IF([.E261]>0;1;0) -> 0 | O261: of:=IF([.F261]>0;1;0) -> 0 | P261: of:=IF([.G261]>0;1;0) -> 0 | Q261: of:=IF([.H261]>0;1;0) -> 1 | R261: of:=IF([.I261]>0;1;0) -> 0 | S261: of:=IF([.J261]>0;1;0) -> 0 | T261: of:=IF([.K261]>0;1;0) -> 0 | U261: of:=IF([.L261]>0;1;0) -> 1 | V261: of:=[.N261]*[.N$402]+[.O261]*[.O$402]+[.P261]*[.P$402]+[.Q261]*[.Q$402]+[.R261]*[.R$402]+[.S261]*[.S$402]+[.T261]*[.T$402]+[.U261]*[.U$402] -> 0.308633066549229 | W261: 32415 | Y261: of:=[.W261]+[.X261] -> 32415 | Z261: of:=[.Y261]/[.Y$401] -> 10.3212339470617 | AA261: of:=[.D261]+[.M261]+[.V261]+[.Z261] -> 14.9238708231258 | AB261: of:=RANK([.AA261];[.AA$2:.AA$399];0) -> 260
A262: Bassetlaw | B262: 86880 | C262: of:=IF(SUM([.E262:.L262])>0;[.B262];0) -> 86880 | D262: of:=[.C262]/[.C$401] -> 3.27224361372541 | H262: 1 | L262: 1 | M262: of:=[.E262]*[.AC$11]+[.F262]*[.AC$13]+[.G262]*[.AC$15]+[.H262]*[.AC$17]+[.I262]*[.AC$19]+[.J262]*[.AC$21]+[.K262]*[.AC$23]+[.L262]*[.AC$25] -> 1.02390704070172 | N262: of:=IF([.E262]>0;1;0) -> 0 | O262: of:=IF([.F262]>0;1;0) -> 0 | P262: of:=IF([.G262]>0;1;0) -> 0 | Q262: of:=IF([.H262]>0;1;0) -> 1 | R262: of:=IF([.I262]>0;1;0) -> 0 | S262: of:=IF([.J262]>0;1;0) -> 0 | T262: of:=IF([.K262]>0;1;0) -> 0 | U262: of:=IF([.L262]>0;1;0) -> 1 | V262: of:=[.N262]*[.N$402]+[.O262]*[.O$402]+[.P262]*[.P$402]+[.Q262]*[.Q$402]+[.R262]*[.R$402]+[.S262]*[.S$402]+[.T262]*[.T$402]+[.U262]*[.U$402] -> 0.308633066549229 | W262: 32246 | Y262: of:=[.W262]+[.X262] -> 32246 | Z262: of:=[.Y262]/[.Y$401] -> 10.2674227936743 | AA262: of:=[.D262]+[.M262]+[.V262]+[.Z262] -> 14.8722065146507 | AB262: of:=RANK([.AA262];[.AA$2:.AA$399];0) -> 261
A263: Cannock Chase | B263: 74212 | C263: of:=IF(SUM([.E263:.L263])>0;[.B263];0) -> 74212 | D263: of:=[.C263]/[.C$401] -> 2.79511674794878 | G263: 1 | H263: 1 | I263: 1 | K263: 1 | L263: 1 | M263: of:=[.E263]*[.AC$11]+[.F263]*[.AC$13]+[.G263]*[.AC$15]+[.H263]*[.AC$17]+[.I263]*[.AC$19]+[.J263]*[.AC$21]+[.K263]*[.AC$23]+[.L263]*[.AC$25] -> 4.1770743494719 | N263: of:=IF([.E263]>0;1;0) -> 0 | O263: of:=IF([.F263]>0;1;0) -> 0 | P263: of:=IF([.G263]>0;1;0) -> 1 | Q263: of:=IF([.H263]>0;1;0) -> 1 | R263: of:=IF([.I263]>0;1;0) -> 1 | S263: of:=IF([.J263]>0;1;0) -> 0 | T263: of:=IF([.K263]>0;1;0) -> 1 | U263: of:=IF([.L263]>0;1;0) -> 1 | V263: of:=[.N263]*[.N$402]+[.O263]*[.O$402]+[.P263]*[.P$402]+[.Q263]*[.Q$402]+[.R263]*[.R$402]+[.S263]*[.S$402]+[.T263]*[.T$402]+[.U263]*[.U$402] -> 2.03350799196213 | W263: of:=4650+13679 -> 18329 | Y263: of:=[.W263]+[.X263] -> 18329 | Z263: of:=[.Y263]/[.Y$401] -> 5.83612207359847 | AA263: of:=[.D263]+[.M263]+[.V263]+[.Z263] -> 14.8418211629813 | AB263: of:=RANK([.AA263];[.AA$2:.AA$399];0) -> 262
A264: Croydon | B264: 267516 | C264: of:=IF(SUM([.E264:.L264])>0;[.B264];0) -> 267516 | D264: of:=[.C264]/[.C$401] -> 10.0757081327045 | G264: 1 | K264: 1 | M264: of:=[.E264]*[.AC$11]+[.F264]*[.AC$13]+[.G264]*[.AC$15]+[.H264]*[.AC$17]+[.I264]*[.AC$19]+[.J264]*[.AC$21]+[.K264]*[.AC$23]+[.L264]*[.AC$25] -> 2.78326790277077 | N264: of:=IF([.E264]>0;1;0) -> 0 | O264: of:=IF([.F264]>0;1;0) -> 0 | P264: of:=IF([.G264]>0;1;0) -> 1 | Q264: of:=IF([.H264]>0;1;0) -> 0 | R264: of:=IF([.I264]>0;1;0) -> 0 | S264: of:=IF([.J264]>0;1;0) -> 0 | T264: of:=IF([.K264]>0;1;0) -> 1 | U264: of:=IF([.L264]>0;1;0) -> 0 | V264: of:=[.N264]*[.N$402]+[.O264]*[.O$402]+[.P264]*[.P$402]+[.Q264]*[.Q$402]+[.R264]*[.R$402]+[.S264]*[.S$402]+[.T264]*[.T$402]+[.U264]*[.U$402] -> 1.5062883605785 | W264: 1473 | Y264: of:=[.W264]+[.X264] -> 1473 | Z264: of:=[.Y264]/[.Y$401] -> 0.469016739288043 | AA264: of:=[.D264]+[.M264]+[.V264]+[.Z264] -> 14.8342811353418 | AB264: of:=RANK([.AA264];[.AA$2:.AA$399];0) -> 263
A265: Mendip | B265: 87221 | C265: of:=IF(SUM([.E265:.L265])>0;[.B265];0) -> 87221 | D265: of:=[.C265]/[.C$401] -> 3.2850870192535 | H265: 1 | L265: 1 | M265: of:=[.E265]*[.AC$11]+[.F265]*[.AC$13]+[.G265]*[.AC$15]+[.H265]*[.AC$17]+[.I265]*[.AC$19]+[.J265]*[.AC$21]+[.K265]*[.AC$23]+[.L265]*[.AC$25] -> 1.02390704070172 | N265: of:=IF([.E265]>0;1;0) -> 0 | O265: of:=IF([.F265]>0;1;0) -> 0 | P265: of:=IF([.G265]>0;1;0) -> 0 | Q265: of:=IF([.H265]>0;1;0) -> 1 | R265: of:=IF([.I265]>0;1;0) -> 0 | S265: of:=IF([.J265]>0;1;0) -> 0 | T265: of:=IF([.K265]>0;1;0) -> 0 | U265: of:=IF([.L265]>0;1;0) -> 1 | V265: of:=[.N265]*[.N$402]+[.O265]*[.O$402]+[.P265]*[.P$402]+[.Q265]*[.Q$402]+[.R265]*[.R$402]+[.S265]*[.S$402]+[.T265]*[.T$402]+[.U265]*[.U$402] -> 0.308633066549229 | W265: 32077 | Y265: of:=[.W265]+[.X265] -> 32077 | Z265: of:=[.Y265]/[.Y$401] -> 10.2136116402869 | AA265: of:=[.D265]+[.M265]+[.V265]+[.Z265] -> 14.8312387667913 | AB265: of:=RANK([.AA265];[.AA$2:.AA$399];0) -> 264
A266: Hinckley and Bosworth | B266: 87274 | C266: of:=IF(SUM([.E266:.L266])>0;[.B266];0) -> 87274 | D266: of:=[.C266]/[.C$401] -> 3.2870832083825 | H266: 1 | L266: 1 | M266: of:=[.E266]*[.AC$11]+[.F266]*[.AC$13]+[.G266]*[.AC$15]+[.H266]*[.AC$17]+[.I266]*[.AC$19]+[.J266]*[.AC$21]+[.K266]*[.AC$23]+[.L266]*[.AC$25] -> 1.02390704070172 | N266: of:=IF([.E266]>0;1;0) -> 0 | O266: of:=IF([.F266]>0;1;0) -> 0 | P266: of:=IF([.G266]>0;1;0) -> 0 | Q266: of:=IF([.H266]>0;1;0) -> 1 | R266: of:=IF([.I266]>0;1;0) -> 0 | S266: of:=IF([.J266]>0;1;0) -> 0 | T266: of:=IF([.K266]>0;1;0) -> 0 | U266: of:=IF([.L266]>0;1;0) -> 1 | V266: of:=[.N266]*[.N$402]+[.O266]*[.O$402]+[.P266]*[.P$402]+[.Q266]*[.Q$402]+[.R266]*[.R$402]+[.S266]*[.S$402]+[.T266]*[.T$402]+[.U266]*[.U$402] -> 0.308633066549229 | W266: 31908 | Y266: of:=[.W266]+[.X266] -> 31908 | Z266: of:=[.Y266]/[.Y$401] -> 10.1598004868994 | AA266: of:=[.D266]+[.M266]+[.V266]+[.Z266] -> 14.7794238025329 | AB266: of:=RANK([.AA266];[.AA$2:.AA$399];0) -> 265
A267: Bracknell Forest | B267: 88653 | C267: of:=IF(SUM([.E267:.L267])>0;[.B267];0) -> 88653 | D267: of:=[.C267]/[.C$401] -> 3.3390217896823 | H267: 1 | L267: 1 | M267: of:=[.E267]*[.AC$11]+[.F267]*[.AC$13]+[.G267]*[.AC$15]+[.H267]*[.AC$17]+[.I267]*[.AC$19]+[.J267]*[.AC$21]+[.K267]*[.AC$23]+[.L267]*[.AC$25] -> 1.02390704070172 | N267: of:=IF([.E267]>0;1;0) -> 0 | O267: of:=IF([.F267]>0;1;0) -> 0 | P267: of:=IF([.G267]>0;1;0) -> 0 | Q267: of:=IF([.H267]>0;1;0) -> 1 | R267: of:=IF([.I267]>0;1;0) -> 0 | S267: of:=IF([.J267]>0;1;0) -> 0 | T267: of:=IF([.K267]>0;1;0) -> 0 | U267: of:=IF([.L267]>0;1;0) -> 1 | V267: of:=[.N267]*[.N$402]+[.O267]*[.O$402]+[.P267]*[.P$402]+[.Q267]*[.Q$402]+[.R267]*[.R$402]+[.S267]*[.S$402]+[.T267]*[.T$402]+[.U267]*[.U$402] -> 0.308633066549229 | W267: 31739 | Y267: of:=[.W267]+[.X267] -> 31739 | Z267: of:=[.Y267]/[.Y$401] -> 10.105989333512 | AA267: of:=[.D267]+[.M267]+[.V267]+[.Z267] -> 14.7775512304453 | AB267: of:=RANK([.AA267];[.AA$2:.AA$399];0) -> 266
A268: Carlisle | B268: 84904 | C268: of:=IF(SUM([.E268:.L268])>0;[.B268];0) -> 84904 | D268: of:=[.C268]/[.C$401] -> 3.19781965676499 | G268: 1 | H268: 1 | I268: 1 | K268: 1 | L268: 1 | M268: of:=[.E268]*[.AC$11]+[.F268]*[.AC$13]+[.G268]*[.AC$15]+[.H268]*[.AC$17]+[.I268]*[.AC$19]+[.J268]*[.AC$21]+[.K268]*[.AC$23]+[.L268]*[.AC$25] -> 4.1770743494719 | N268: of:=IF([.E268]>0;1;0) -> 0 | O268: of:=IF([.F268]>0;1;0) -> 0 | P268: of:=IF([.G268]>0;1;0) -> 1 | Q268: of:=IF([.H268]>0;1;0) -> 1 | R268: of:=IF([.I268]>0;1;0) -> 1 | S268: of:=IF([.J268]>0;1;0) -> 0 | T268: of:=IF([.K268]>0;1;0) -> 1 | U268: of:=IF([.L268]>0;1;0) -> 1 | V268: of:=[.N268]*[.N$402]+[.O268]*[.O$402]+[.P268]*[.P$402]+[.Q268]*[.Q$402]+[.R268]*[.R$402]+[.S268]*[.S$402]+[.T268]*[.T$402]+[.U268]*[.U$402] -> 2.03350799196213 | W268: of:=4866+11921 -> 16787 | Y268: of:=[.W268]+[.X268] -> 16787 | Z268: of:=[.Y268]/[.Y$401] -> 5.34513510008716 | AA268: of:=[.D268]+[.M268]+[.V268]+[.Z268] -> 14.7535370982862 | AB268: of:=RANK([.AA268];[.AA$2:.AA$399];0) -> 267
A269: Wyre | B269: 88819 | C269: of:=IF(SUM([.E269:.L269])>0;[.B269];0) -> 88819 | D269: of:=[.C269]/[.C$401] -> 3.34527400469011 | H269: 1 | L269: 1 | M269: of:=[.E269]*[.AC$11]+[.F269]*[.AC$13]+[.G269]*[.AC$15]+[.H269]*[.AC$17]+[.I269]*[.AC$19]+[.J269]*[.AC$21]+[.K269]*[.AC$23]+[.L269]*[.AC$25] -> 1.02390704070172 | N269: of:=IF([.E269]>0;1;0) -> 0 | O269: of:=IF([.F269]>0;1;0) -> 0 | P269: of:=IF([.G269]>0;1;0) -> 0 | Q269: of:=IF([.H269]>0;1;0) -> 1 | R269: of:=IF([.I269]>0;1;0) -> 0 | S269: of:=IF([.J269]>0;1;0) -> 0 | T269: of:=IF([.K269]>0;1;0) -> 0 | U269: of:=IF([.L269]>0;1;0) -> 1 | V269: of:=[.N269]*[.N$402]+[.O269]*[.O$402]+[.P269]*[.P$402]+[.Q269]*[.Q$402]+[.R269]*[.R$402]+[.S269]*[.S$402]+[.T269]*[.T$402]+[.U269]*[.U$402] -> 0.308633066549229 | W269: 31571 | Y269: of:=[.W269]+[.X269] -> 31571 | Z269: of:=[.Y269]/[.Y$401] -> 10.0524965893162 | AA269: of:=[.D269]+[.M269]+[.V269]+[.Z269] -> 14.7303107012573 | AB269: of:=RANK([.AA269];[.AA$2:.AA$399];0) -> 268
A270: Newark and Sherwood | B270: 88909 | C270: of:=IF(SUM([.E270:.L270])>0;[.B270];0) -> 88909 | D270: of:=[.C270]/[.C$401] -> 3.34866375981483 | H270: 1 | L270: 1 | M270: of:=[.E270]*[.AC$11]+[.F270]*[.AC$13]+[.G270]*[.AC$15]+[.H270]*[.AC$17]+[.I270]*[.AC$19]+[.J270]*[.AC$21]+[.K270]*[.AC$23]+[.L270]*[.AC$25] -> 1.02390704070172 | N270: of:=IF([.E270]>0;1;0) -> 0 | O270: of:=IF([.F270]>0;1;0) -> 0 | P270: of:=IF([.G270]>0;1;0) -> 0 | Q270: of:=IF([.H270]>0;1;0) -> 1 | R270: of:=IF([.I270]>0;1;0) -> 0 | S270: of:=IF([.J270]>0;1;0) -> 0 | T270: of:=IF([.K270]>0;1;0) -> 0 | U270: of:=IF([.L270]>0;1;0) -> 1 | V270: of:=[.N270]*[.N$402]+[.O270]*[.O$402]+[.P270]*[.P$402]+[.Q270]*[.Q$402]+[.R270]*[.R$402]+[.S270]*[.S$402]+[.T270]*[.T$402]+[.U270]*[.U$402] -> 0.308633066549229 | W270: 31403 | Y270: of:=[.W270]+[.X270] -> 31403 | Z270: of:=[.Y270]/[.Y$401] -> 9.99900384512045 | AA270: of:=[.D270]+[.M270]+[.V270]+[.Z270] -> 14.6802077121862 | AB270: of:=RANK([.AA270];[.AA$2:.AA$399];0) -> 269
A271: Great Yarmouth | B271: 71439 | C271: of:=IF(SUM([.E271:.L271])>0;[.B271];0) -> 71439 | D271: of:=[.C271]/[.C$401] -> 2.69067462616171 | G271: 1 | H271: 1 | L271: 1 | M271: of:=[.E271]*[.AC$11]+[.F271]*[.AC$13]+[.G271]*[.AC$15]+[.H271]*[.AC$17]+[.I271]*[.AC$19]+[.J271]*[.AC$21]+[.K271]*[.AC$23]+[.L271]*[.AC$25] -> 3.7571145025925 | N271: of:=IF([.E271]>0;1;0) -> 0 | O271: of:=IF([.F271]>0;1;0) -> 0 | P271: of:=IF([.G271]>0;1;0) -> 1 | Q271: of:=IF([.H271]>0;1;0) -> 1 | R271: of:=IF([.I271]>0;1;0) -> 0 | S271: of:=IF([.J271]>0;1;0) -> 0 | T271: of:=IF([.K271]>0;1;0) -> 0 | U271: of:=IF([.L271]>0;1;0) -> 1 | V271: of:=[.N271]*[.N$402]+[.O271]*[.O$402]+[.P271]*[.P$402]+[.Q271]*[.Q$402]+[.R271]*[.R$402]+[.S271]*[.S$402]+[.T271]*[.T$402]+[.U271]*[.U$402] -> 1.79409800920812 | W271: of:=624+19498 -> 20122 | Y271: of:=[.W271]+[.X271] -> 20122 | Z271: of:=[.Y271]/[.Y$401] -> 6.40702975421182 | AA271: of:=[.D271]+[.M271]+[.V271]+[.Z271] -> 14.6489168921741 | AB271: of:=RANK([.AA271];[.AA$2:.AA$399];0) -> 270
A272: Sevenoaks | B272: 88997 | C272: of:=IF(SUM([.E272:.L272])>0;[.B272];0) -> 88997 | D272: of:=[.C272]/[.C$401] -> 3.35197818704788 | H272: 1 | L272: 1 | M272: of:=[.E272]*[.AC$11]+[.F272]*[.AC$13]+[.G272]*[.AC$15]+[.H272]*[.AC$17]+[.I272]*[.AC$19]+[.J272]*[.AC$21]+[.K272]*[.AC$23]+[.L272]*[.AC$25] -> 1.02390704070172 | N272: of:=IF([.E272]>0;1;0) -> 0 | O272: of:=IF([.F272]>0;1;0) -> 0 | P272: of:=IF([.G272]>0;1;0) -> 0 | Q272: of:=IF([.H272]>0;1;0) -> 1 | R272: of:=IF([.I272]>0;1;0) -> 0 | S272: of:=IF([.J272]>0;1;0) -> 0 | T272: of:=IF([.K272]>0;1;0) -> 0 | U272: of:=IF([.L272]>0;1;0) -> 1 | V272: of:=[.N272]*[.N$402]+[.O272]*[.O$402]+[.P272]*[.P$402]+[.Q272]*[.Q$402]+[.R272]*[.R$402]+[.S272]*[.S$402]+[.T272]*[.T$402]+[.U272]*[.U$402] -> 0.308633066549229 | W272: 31235 | Y272: of:=[.W272]+[.X272] -> 31235 | Z272: of:=[.Y272]/[.Y$401] -> 9.94551110092466 | AA272: of:=[.D272]+[.M272]+[.V272]+[.Z272] -> 14.6300293952235 | AB272: of:=RANK([.AA272];[.AA$2:.AA$399];0) -> 271
A273: Chichester | B273: 91406 | C273: of:=IF(SUM([.E273:.L273])>0;[.B273];0) -> 91406 | D273: of:=[.C273]/[.C$401] -> 3.44271063255277 | H273: 1 | L273: 1 | M273: of:=[.E273]*[.AC$11]+[.F273]*[.AC$13]+[.G273]*[.AC$15]+[.H273]*[.AC$17]+[.I273]*[.AC$19]+[.J273]*[.AC$21]+[.K273]*[.AC$23]+[.L273]*[.AC$25] -> 1.02390704070172 | N273: of:=IF([.E273]>0;1;0) -> 0 | O273: of:=IF([.F273]>0;1;0) -> 0 | P273: of:=IF([.G273]>0;1;0) -> 0 | Q273: of:=IF([.H273]>0;1;0) -> 1 | R273: of:=IF([.I273]>0;1;0) -> 0 | S273: of:=IF([.J273]>0;1;0) -> 0 | T273: of:=IF([.K273]>0;1;0) -> 0 | U273: of:=IF([.L273]>0;1;0) -> 1 | V273: of:=[.N273]*[.N$402]+[.O273]*[.O$402]+[.P273]*[.P$402]+[.Q273]*[.Q$402]+[.R273]*[.R$402]+[.S273]*[.S$402]+[.T273]*[.T$402]+[.U273]*[.U$402] -> 0.308633066549229 | W273: 30900 | Y273: of:=[.W273]+[.X273] -> 30900 | Z273: of:=[.Y273]/[.Y$401] -> 9.83884402172474 | AA273: of:=[.D273]+[.M273]+[.V273]+[.Z273] -> 14.6140947615285 | AB273: of:=RANK([.AA273];[.AA$2:.AA$399];0) -> 272
A274: E Hants | B274: 92341 | C274: of:=IF(SUM([.E274:.L274])>0;[.B274];0) -> 92341 | D274: of:=[.C274]/[.C$401] -> 3.47792642190398 | H274: 1 | L274: 1 | M274: of:=[.E274]*[.AC$11]+[.F274]*[.AC$13]+[.G274]*[.AC$15]+[.H274]*[.AC$17]+[.I274]*[.AC$19]+[.J274]*[.AC$21]+[.K274]*[.AC$23]+[.L274]*[.AC$25] -> 1.02390704070172 | N274: of:=IF([.E274]>0;1;0) -> 0 | O274: of:=IF([.F274]>0;1;0) -> 0 | P274: of:=IF([.G274]>0;1;0) -> 0 | Q274: of:=IF([.H274]>0;1;0) -> 1 | R274: of:=IF([.I274]>0;1;0) -> 0 | S274: of:=IF([.J274]>0;1;0) -> 0 | T274: of:=IF([.K274]>0;1;0) -> 0 | U274: of:=IF([.L274]>0;1;0) -> 1 | V274: of:=[.N274]*[.N$402]+[.O274]*[.O$402]+[.P274]*[.P$402]+[.Q274]*[.Q$402]+[.R274]*[.R$402]+[.S274]*[.S$402]+[.T274]*[.T$402]+[.U274]*[.U$402] -> 0.308633066549229 | W274: 30733 | Y274: of:=[.W274]+[.X274] -> 30733 | Z274: of:=[.Y274]/[.Y$401] -> 9.78566968672059 | AA274: of:=[.D274]+[.M274]+[.V274]+[.Z274] -> 14.5961362158755 | AB274: of:=RANK([.AA274];[.AA$2:.AA$399];0) -> 273
A275: Brent | B275: 231347 | C275: of:=IF(SUM([.E275:.L275])>0;[.B275];0) -> 231347 | D275: of:=[.C275]/[.C$401] -> 8.71344087597297 | G275: 1 | K275: 1 | M275: of:=[.E275]*[.AC$11]+[.F275]*[.AC$13]+[.G275]*[.AC$15]+[.H275]*[.AC$17]+[.I275]*[.AC$19]+[.J275]*[.AC$21]+[.K275]*[.AC$23]+[.L275]*[.AC$25] -> 2.78326790277077 | N275: of:=IF([.E275]>0;1;0) -> 0 | O275: of:=IF([.F275]>0;1;0) -> 0 | P275: of:=IF([.G275]>0;1;0) -> 1 | Q275: of:=IF([.H275]>0;1;0) -> 0 | R275: of:=IF([.I275]>0;1;0) -> 0 | S275: of:=IF([.J275]>0;1;0) -> 0 | T275: of:=IF([.K275]>0;1;0) -> 1 | U275: of:=IF([.L275]>0;1;0) -> 0 | V275: of:=[.N275]*[.N$402]+[.O275]*[.O$402]+[.P275]*[.P$402]+[.Q275]*[.Q$402]+[.R275]*[.R$402]+[.S275]*[.S$402]+[.T275]*[.T$402]+[.U275]*[.U$402] -> 1.5062883605785 | W275: 4959 | Y275: of:=[.W275]+[.X275] -> 4959 | Z275: of:=[.Y275]/[.Y$401] -> 1.57899118135058 | AA275: of:=[.D275]+[.M275]+[.V275]+[.Z275] -> 14.5819883206728 | AB275: of:=RANK([.AA275];[.AA$2:.AA$399];0) -> 274
A276: Gedling | B276: 89093 | C276: of:=IF(SUM([.E276:.L276])>0;[.B276];0) -> 89093 | D276: of:=[.C276]/[.C$401] -> 3.35559392584758 | H276: 1 | L276: 1 | M276: of:=[.E276]*[.AC$11]+[.F276]*[.AC$13]+[.G276]*[.AC$15]+[.H276]*[.AC$17]+[.I276]*[.AC$19]+[.J276]*[.AC$21]+[.K276]*[.AC$23]+[.L276]*[.AC$25] -> 1.02390704070172 | N276: of:=IF([.E276]>0;1;0) -> 0 | O276: of:=IF([.F276]>0;1;0) -> 0 | P276: of:=IF([.G276]>0;1;0) -> 0 | Q276: of:=IF([.H276]>0;1;0) -> 1 | R276: of:=IF([.I276]>0;1;0) -> 0 | S276: of:=IF([.J276]>0;1;0) -> 0 | T276: of:=IF([.K276]>0;1;0) -> 0 | U276: of:=IF([.L276]>0;1;0) -> 1 | V276: of:=[.N276]*[.N$402]+[.O276]*[.O$402]+[.P276]*[.P$402]+[.Q276]*[.Q$402]+[.R276]*[.R$402]+[.S276]*[.S$402]+[.T276]*[.T$402]+[.U276]*[.U$402] -> 0.308633066549229 | W276: 31057 | Y276: of:=[.W276]+[.X276] -> 31057 | Z276: of:=[.Y276]/[.Y$401] -> 9.88883426481246 | AA276: of:=[.D276]+[.M276]+[.V276]+[.Z276] -> 14.576968297911 | AB276: of:=RANK([.AA276];[.AA$2:.AA$399];0) -> 275
A277: Waverley | B277: 92459 | C277: of:=IF(SUM([.E277:.L277])>0;[.B277];0) -> 92459 | D277: of:=[.C277]/[.C$401] -> 3.48237076751194 | H277: 1 | L277: 1 | M277: of:=[.E277]*[.AC$11]+[.F277]*[.AC$13]+[.G277]*[.AC$15]+[.H277]*[.AC$17]+[.I277]*[.AC$19]+[.J277]*[.AC$21]+[.K277]*[.AC$23]+[.L277]*[.AC$25] -> 1.02390704070172 | N277: of:=IF([.E277]>0;1;0) -> 0 | O277: of:=IF([.F277]>0;1;0) -> 0 | P277: of:=IF([.G277]>0;1;0) -> 0 | Q277: of:=IF([.H277]>0;1;0) -> 1 | R277: of:=IF([.I277]>0;1;0) -> 0 | S277: of:=IF([.J277]>0;1;0) -> 0 | T277: of:=IF([.K277]>0;1;0) -> 0 | U277: of:=IF([.L277]>0;1;0) -> 1 | V277: of:=[.N277]*[.N$402]+[.O277]*[.O$402]+[.P277]*[.P$402]+[.Q277]*[.Q$402]+[.R277]*[.R$402]+[.S277]*[.S$402]+[.T277]*[.T$402]+[.U277]*[.U$402] -> 0.308633066549229 | W277: 30566 | Y277: of:=[.W277]+[.X277] -> 30566 | Z277: of:=[.Y277]/[.Y$401] -> 9.73249535171645 | AA277: of:=[.D277]+[.M277]+[.V277]+[.Z277] -> 14.5474062264793 | AB277: of:=RANK([.AA277];[.AA$2:.AA$399];0) -> 276
A278: Mole Valley | B278: 67111 | C278: of:=IF(SUM([.E278:.L278])>0;[.B278];0) -> 67111 | D278: of:=[.C278]/[.C$401] -> 2.52766506860872 | G278: 1 | H278: 1 | I278: 1 | K278: 1 | L278: 1 | M278: of:=[.E278]*[.AC$11]+[.F278]*[.AC$13]+[.G278]*[.AC$15]+[.H278]*[.AC$17]+[.I278]*[.AC$19]+[.J278]*[.AC$21]+[.K278]*[.AC$23]+[.L278]*[.AC$25] -> 4.1770743494719 | N278: of:=IF([.E278]>0;1;0) -> 0 | O278: of:=IF([.F278]>0;1;0) -> 0 | P278: of:=IF([.G278]>0;1;0) -> 1 | Q278: of:=IF([.H278]>0;1;0) -> 1 | R278: of:=IF([.I278]>0;1;0) -> 1 | S278: of:=IF([.J278]>0;1;0) -> 0 | T278: of:=IF([.K278]>0;1;0) -> 1 | U278: of:=IF([.L278]>0;1;0) -> 1 | V278: of:=[.N278]*[.N$402]+[.O278]*[.O$402]+[.P278]*[.P$402]+[.Q278]*[.Q$402]+[.R278]*[.R$402]+[.S278]*[.S$402]+[.T278]*[.T$402]+[.U278]*[.U$402] -> 2.03350799196213 | W278: of:=4752+13419 -> 18171 | Y278: of:=[.W278]+[.X278] -> 18171 | Z278: of:=[.Y278]/[.Y$401] -> 5.7858134213191 | AA278: of:=[.D278]+[.M278]+[.V278]+[.Z278] -> 14.5240608313619 | AB278: of:=RANK([.AA278];[.AA$2:.AA$399];0) -> 277
A279: Sedgemoor | B279: 92651 | C279: of:=IF(SUM([.E279:.L279])>0;[.B279];0) -> 92651 | D279: of:=[.C279]/[.C$401] -> 3.48960224511133 | H279: 1 | L279: 1 | M279: of:=[.E279]*[.AC$11]+[.F279]*[.AC$13]+[.G279]*[.AC$15]+[.H279]*[.AC$17]+[.I279]*[.AC$19]+[.J279]*[.AC$21]+[.K279]*[.AC$23]+[.L279]*[.AC$25] -> 1.02390704070172 | N279: of:=IF([.E279]>0;1;0) -> 0 | O279: of:=IF([.F279]>0;1;0) -> 0 | P279: of:=IF([.G279]>0;1;0) -> 0 | Q279: of:=IF([.H279]>0;1;0) -> 1 | R279: of:=IF([.I279]>0;1;0) -> 0 | S279: of:=IF([.J279]>0;1;0) -> 0 | T279: of:=IF([.K279]>0;1;0) -> 0 | U279: of:=IF([.L279]>0;1;0) -> 1 | V279: of:=[.N279]*[.N$402]+[.O279]*[.O$402]+[.P279]*[.P$402]+[.Q279]*[.Q$402]+[.R279]*[.R$402]+[.S279]*[.S$402]+[.T279]*[.T$402]+[.U279]*[.U$402] -> 0.308633066549229 | W279: 30399 | Y279: of:=[.W279]+[.X279] -> 30399 | Z279: of:=[.Y279]/[.Y$401] -> 9.67932101671231 | AA279: of:=[.D279]+[.M279]+[.V279]+[.Z279] -> 14.5014633690746 | AB279: of:=RANK([.AA279];[.AA$2:.AA$399];0) -> 278
A280: Middlesbrough | B280: 93329 | C280: of:=IF(SUM([.E280:.L280])>0;[.B280];0) -> 93329 | D280: of:=[.C280]/[.C$401] -> 3.51513840038419 | H280: 1 | L280: 1 | M280: of:=[.E280]*[.AC$11]+[.F280]*[.AC$13]+[.G280]*[.AC$15]+[.H280]*[.AC$17]+[.I280]*[.AC$19]+[.J280]*[.AC$21]+[.K280]*[.AC$23]+[.L280]*[.AC$25] -> 1.02390704070172 | N280: of:=IF([.E280]>0;1;0) -> 0 | O280: of:=IF([.F280]>0;1;0) -> 0 | P280: of:=IF([.G280]>0;1;0) -> 0 | Q280: of:=IF([.H280]>0;1;0) -> 1 | R280: of:=IF([.I280]>0;1;0) -> 0 | S280: of:=IF([.J280]>0;1;0) -> 0 | T280: of:=IF([.K280]>0;1;0) -> 0 | U280: of:=IF([.L280]>0;1;0) -> 1 | V280: of:=[.N280]*[.N$402]+[.O280]*[.O$402]+[.P280]*[.P$402]+[.Q280]*[.Q$402]+[.R280]*[.R$402]+[.S280]*[.S$402]+[.T280]*[.T$402]+[.U280]*[.U$402] -> 0.308633066549229 | W280: 30233 | Y280: of:=[.W280]+[.X280] -> 30233 | Z280: of:=[.Y280]/[.Y$401] -> 9.6264650908998 | AA280: of:=[.D280]+[.M280]+[.V280]+[.Z280] -> 14.4741435985349 | AB280: of:=RANK([.AA280];[.AA$2:.AA$399];0) -> 279
A281: N Somerset | B281: 163219 | C281: of:=IF(SUM([.E281:.L281])>0;[.B281];0) -> 163219 | D281: of:=[.C281]/[.C$401] -> 6.14747157445496 | H281: 1 | L281: 1 | M281: of:=[.E281]*[.AC$11]+[.F281]*[.AC$13]+[.G281]*[.AC$15]+[.H281]*[.AC$17]+[.I281]*[.AC$19]+[.J281]*[.AC$21]+[.K281]*[.AC$23]+[.L281]*[.AC$25] -> 1.02390704070172 | N281: of:=IF([.E281]>0;1;0) -> 0 | O281: of:=IF([.F281]>0;1;0) -> 0 | P281: of:=IF([.G281]>0;1;0) -> 0 | Q281: of:=IF([.H281]>0;1;0) -> 1 | R281: of:=IF([.I281]>0;1;0) -> 0 | S281: of:=IF([.J281]>0;1;0) -> 0 | T281: of:=IF([.K281]>0;1;0) -> 0 | U281: of:=IF([.L281]>0;1;0) -> 1 | V281: of:=[.N281]*[.N$402]+[.O281]*[.O$402]+[.P281]*[.P$402]+[.Q281]*[.Q$402]+[.R281]*[.R$402]+[.S281]*[.S$402]+[.T281]*[.T$402]+[.U281]*[.U$402] -> 0.308633066549229 | W281: 21938 | Y281: of:=[.W281]+[.X281] -> 21938 | Z281: of:=[.Y281]/[.Y$401] -> 6.98526084623292 | AA281: of:=[.D281]+[.M281]+[.V281]+[.Z281] -> 14.4652725279388 | AB281: of:=RANK([.AA281];[.AA$2:.AA$399];0) -> 280
A282: Ashford | B282: 93899 | C282: of:=IF(SUM([.E282:.L282])>0;[.B282];0) -> 93899 | D282: of:=[.C282]/[.C$401] -> 3.53660684950739 | H282: 1 | L282: 1 | M282: of:=[.E282]*[.AC$11]+[.F282]*[.AC$13]+[.G282]*[.AC$15]+[.H282]*[.AC$17]+[.I282]*[.AC$19]+[.J282]*[.AC$21]+[.K282]*[.AC$23]+[.L282]*[.AC$25] -> 1.02390704070172 | N282: of:=IF([.E282]>0;1;0) -> 0 | O282: of:=IF([.F282]>0;1;0) -> 0 | P282: of:=IF([.G282]>0;1;0) -> 0 | Q282: of:=IF([.H282]>0;1;0) -> 1 | R282: of:=IF([.I282]>0;1;0) -> 0 | S282: of:=IF([.J282]>0;1;0) -> 0 | T282: of:=IF([.K282]>0;1;0) -> 0 | U282: of:=IF([.L282]>0;1;0) -> 1 | V282: of:=[.N282]*[.N$402]+[.O282]*[.O$402]+[.P282]*[.P$402]+[.Q282]*[.Q$402]+[.R282]*[.R$402]+[.S282]*[.S$402]+[.T282]*[.T$402]+[.U282]*[.U$402] -> 0.308633066549229 | W282: 30066 | Y282: of:=[.W282]+[.X282] -> 30066 | Z282: of:=[.Y282]/[.Y$401] -> 9.57329075589566 | AA282: of:=[.D282]+[.M282]+[.V282]+[.Z282] -> 14.442437712654 | AB282: of:=RANK([.AA282];[.AA$2:.AA$399];0) -> 281
A283: Ashfield | B283: 94720 | C283: of:=IF(SUM([.E283:.L283])>0;[.B283];0) -> 94720 | D283: of:=[.C283]/[.C$401] -> 3.56752894903396 | H283: 1 | L283: 1 | M283: of:=[.E283]*[.AC$11]+[.F283]*[.AC$13]+[.G283]*[.AC$15]+[.H283]*[.AC$17]+[.I283]*[.AC$19]+[.J283]*[.AC$21]+[.K283]*[.AC$23]+[.L283]*[.AC$25] -> 1.02390704070172 | N283: of:=IF([.E283]>0;1;0) -> 0 | O283: of:=IF([.F283]>0;1;0) -> 0 | P283: of:=IF([.G283]>0;1;0) -> 0 | Q283: of:=IF([.H283]>0;1;0) -> 1 | R283: of:=IF([.I283]>0;1;0) -> 0 | S283: of:=IF([.J283]>0;1;0) -> 0 | T283: of:=IF([.K283]>0;1;0) -> 0 | U283: of:=IF([.L283]>0;1;0) -> 1 | V283: of:=[.N283]*[.N$402]+[.O283]*[.O$402]+[.P283]*[.P$402]+[.Q283]*[.Q$402]+[.R283]*[.R$402]+[.S283]*[.S$402]+[.T283]*[.T$402]+[.U283]*[.U$402] -> 0.308633066549229 | W283: 29901 | Y283: of:=[.W283]+[.X283] -> 29901 | Z283: of:=[.Y283]/[.Y$401] -> 9.5207532392748 | AA283: of:=[.D283]+[.M283]+[.V283]+[.Z283] -> 14.4208222955597 | AB283: of:=RANK([.AA283];[.AA$2:.AA$399];0) -> 282
A284: Tonbridge and Malling | B284: 97198 | C284: of:=IF(SUM([.E284:.L284])>0;[.B284];0) -> 97198 | D284: of:=[.C284]/[.C$401] -> 3.66086020680113 | H284: 1 | L284: 1 | M284: of:=[.E284]*[.AC$11]+[.F284]*[.AC$13]+[.G284]*[.AC$15]+[.H284]*[.AC$17]+[.I284]*[.AC$19]+[.J284]*[.AC$21]+[.K284]*[.AC$23]+[.L284]*[.AC$25] -> 1.02390704070172 | N284: of:=IF([.E284]>0;1;0) -> 0 | O284: of:=IF([.F284]>0;1;0) -> 0 | P284: of:=IF([.G284]>0;1;0) -> 0 | Q284: of:=IF([.H284]>0;1;0) -> 1 | R284: of:=IF([.I284]>0;1;0) -> 0 | S284: of:=IF([.J284]>0;1;0) -> 0 | T284: of:=IF([.K284]>0;1;0) -> 0 | U284: of:=IF([.L284]>0;1;0) -> 1 | V284: of:=[.N284]*[.N$402]+[.O284]*[.O$402]+[.P284]*[.P$402]+[.Q284]*[.Q$402]+[.R284]*[.R$402]+[.S284]*[.S$402]+[.T284]*[.T$402]+[.U284]*[.U$402] -> 0.308633066549229 | W284: 29569 | Y284: of:=[.W284]+[.X284] -> 29569 | Z284: of:=[.Y284]/[.Y$401] -> 9.4150413876498 | AA284: of:=[.D284]+[.M284]+[.V284]+[.Z284] -> 14.4084417017019 | AB284: of:=RANK([.AA284];[.AA$2:.AA$399];0) -> 283
A285: Bury | B285: 142560 | C285: of:=IF(SUM([.E285:.L285])>0;[.B285];0) -> 142560 | D285: of:=[.C285]/[.C$401] -> 5.36937211754943 | H285: 1 | I285: 1 | K285: 1 | L285: 1 | M285: of:=[.E285]*[.AC$11]+[.F285]*[.AC$13]+[.G285]*[.AC$15]+[.H285]*[.AC$17]+[.I285]*[.AC$19]+[.J285]*[.AC$21]+[.K285]*[.AC$23]+[.L285]*[.AC$25] -> 1.44386688758112 | N285: of:=IF([.E285]>0;1;0) -> 0 | O285: of:=IF([.F285]>0;1;0) -> 0 | P285: of:=IF([.G285]>0;1;0) -> 0 | Q285: of:=IF([.H285]>0;1;0) -> 1 | R285: of:=IF([.I285]>0;1;0) -> 1 | S285: of:=IF([.J285]>0;1;0) -> 0 | T285: of:=IF([.K285]>0;1;0) -> 1 | U285: of:=IF([.L285]>0;1;0) -> 1 | V285: of:=[.N285]*[.N$402]+[.O285]*[.O$402]+[.P285]*[.P$402]+[.Q285]*[.Q$402]+[.R285]*[.R$402]+[.S285]*[.S$402]+[.T285]*[.T$402]+[.U285]*[.U$402] -> 0.548043049303238 | W285: 22081 | Y285: of:=[.W285]+[.X285] -> 22081 | Z285: of:=[.Y285]/[.Y$401] -> 7.03079336063767 | AA285: of:=[.D285]+[.M285]+[.V285]+[.Z285] -> 14.3920754150715 | AB285: of:=RANK([.AA285];[.AA$2:.AA$399];0) -> 284
A286: Test Valley | B286: 95063 | C286: of:=IF(SUM([.E286:.L286])>0;[.B286];0) -> 95063 | D286: of:=[.C286]/[.C$401] -> 3.58044768245371 | H286: 1 | L286: 1 | M286: of:=[.E286]*[.AC$11]+[.F286]*[.AC$13]+[.G286]*[.AC$15]+[.H286]*[.AC$17]+[.I286]*[.AC$19]+[.J286]*[.AC$21]+[.K286]*[.AC$23]+[.L286]*[.AC$25] -> 1.02390704070172 | N286: of:=IF([.E286]>0;1;0) -> 0 | O286: of:=IF([.F286]>0;1;0) -> 0 | P286: of:=IF([.G286]>0;1;0) -> 0 | Q286: of:=IF([.H286]>0;1;0) -> 1 | R286: of:=IF([.I286]>0;1;0) -> 0 | S286: of:=IF([.J286]>0;1;0) -> 0 | T286: of:=IF([.K286]>0;1;0) -> 0 | U286: of:=IF([.L286]>0;1;0) -> 1 | V286: of:=[.N286]*[.N$402]+[.O286]*[.O$402]+[.P286]*[.P$402]+[.Q286]*[.Q$402]+[.R286]*[.R$402]+[.S286]*[.S$402]+[.T286]*[.T$402]+[.U286]*[.U$402] -> 0.308633066549229 | W286: 29735 | Y286: of:=[.W286]+[.X286] -> 29735 | Z286: of:=[.Y286]/[.Y$401] -> 9.4678973134623 | AA286: of:=[.D286]+[.M286]+[.V286]+[.Z286] -> 14.380885103167 | AB286: of:=RANK([.AA286];[.AA$2:.AA$399];0) -> 285
A287: Rushmoor | B287: 65038 | C287: of:=IF(SUM([.E287:.L287])>0;[.B287];0) -> 65038 | D287: of:=[.C287]/[.C$401] -> 2.44958770890277 | G287: 1 | H287: 1 | I287: 1 | K287: 1 | L287: 1 | M287: of:=[.E287]*[.AC$11]+[.F287]*[.AC$13]+[.G287]*[.AC$15]+[.H287]*[.AC$17]+[.I287]*[.AC$19]+[.J287]*[.AC$21]+[.K287]*[.AC$23]+[.L287]*[.AC$25] -> 4.1770743494719 | N287: of:=IF([.E287]>0;1;0) -> 0 | O287: of:=IF([.F287]>0;1;0) -> 0 | P287: of:=IF([.G287]>0;1;0) -> 1 | Q287: of:=IF([.H287]>0;1;0) -> 1 | R287: of:=IF([.I287]>0;1;0) -> 1 | S287: of:=IF([.J287]>0;1;0) -> 0 | T287: of:=IF([.K287]>0;1;0) -> 1 | U287: of:=IF([.L287]>0;1;0) -> 1 | V287: of:=[.N287]*[.N$402]+[.O287]*[.O$402]+[.P287]*[.P$402]+[.Q287]*[.Q$402]+[.R287]*[.R$402]+[.S287]*[.S$402]+[.T287]*[.T$402]+[.U287]*[.U$402] -> 2.03350799196213 | W287: of:=4778+13161 -> 17939 | Y287: of:=[.W287]+[.X287] -> 17939 | Z287: of:=[.Y287]/[.Y$401] -> 5.71194248885825 | AA287: of:=[.D287]+[.M287]+[.V287]+[.Z287] -> 14.3721125391951 | AB287: of:=RANK([.AA287];[.AA$2:.AA$399];0) -> 286
A288: Vale of White Horse | B288: 97548 | C288: of:=IF(SUM([.E288:.L288])>0;[.B288];0) -> 97548 | D288: of:=[.C288]/[.C$401] -> 3.67404258784169 | H288: 1 | L288: 1 | M288: of:=[.E288]*[.AC$11]+[.F288]*[.AC$13]+[.G288]*[.AC$15]+[.H288]*[.AC$17]+[.I288]*[.AC$19]+[.J288]*[.AC$21]+[.K288]*[.AC$23]+[.L288]*[.AC$25] -> 1.02390704070172 | N288: of:=IF([.E288]>0;1;0) -> 0 | O288: of:=IF([.F288]>0;1;0) -> 0 | P288: of:=IF([.G288]>0;1;0) -> 0 | Q288: of:=IF([.H288]>0;1;0) -> 1 | R288: of:=IF([.I288]>0;1;0) -> 0 | S288: of:=IF([.J288]>0;1;0) -> 0 | T288: of:=IF([.K288]>0;1;0) -> 0 | U288: of:=IF([.L288]>0;1;0) -> 1 | V288: of:=[.N288]*[.N$402]+[.O288]*[.O$402]+[.P288]*[.P$402]+[.Q288]*[.Q$402]+[.R288]*[.R$402]+[.S288]*[.S$402]+[.T288]*[.T$402]+[.U288]*[.U$402] -> 0.308633066549229 | W288: 29404 | Y288: of:=[.W288]+[.X288] -> 29404 | Z288: of:=[.Y288]/[.Y$401] -> 9.36250387102894 | AA288: of:=[.D288]+[.M288]+[.V288]+[.Z288] -> 14.3690865661216 | AB288: of:=RANK([.AA288];[.AA$2:.AA$399];0) -> 287
A289: Wychavon | B289: 98857 | C289: of:=IF(SUM([.E289:.L289])>0;[.B289];0) -> 98857 | D289: of:=[.C289]/[.C$401] -> 3.72334469293339 | H289: 1 | L289: 1 | M289: of:=[.E289]*[.AC$11]+[.F289]*[.AC$13]+[.G289]*[.AC$15]+[.H289]*[.AC$17]+[.I289]*[.AC$19]+[.J289]*[.AC$21]+[.K289]*[.AC$23]+[.L289]*[.AC$25] -> 1.02390704070172 | N289: of:=IF([.E289]>0;1;0) -> 0 | O289: of:=IF([.F289]>0;1;0) -> 0 | P289: of:=IF([.G289]>0;1;0) -> 0 | Q289: of:=IF([.H289]>0;1;0) -> 1 | R289: of:=IF([.I289]>0;1;0) -> 0 | S289: of:=IF([.J289]>0;1;0) -> 0 | T289: of:=IF([.K289]>0;1;0) -> 0 | U289: of:=IF([.L289]>0;1;0) -> 1 | V289: of:=[.N289]*[.N$402]+[.O289]*[.O$402]+[.P289]*[.P$402]+[.Q289]*[.Q$402]+[.R289]*[.R$402]+[.S289]*[.S$402]+[.T289]*[.T$402]+[.U289]*[.U$402] -> 0.308633066549229 | W289: 29239 | Y289: of:=[.W289]+[.X289] -> 29239 | Z289: of:=[.Y289]/[.Y$401] -> 9.30996635440808 | AA289: of:=[.D289]+[.M289]+[.V289]+[.Z289] -> 14.3658511545924 | AB289: of:=RANK([.AA289];[.AA$2:.AA$399];0) -> 288
A290: Stratford-on-Avon | B290: 99695 | C290: of:=IF(SUM([.E290:.L290])>0;[.B290];0) -> 99695 | D290: of:=[.C290]/[.C$401] -> 3.75490707953907 | H290: 1 | L290: 1 | M290: of:=[.E290]*[.AC$11]+[.F290]*[.AC$13]+[.G290]*[.AC$15]+[.H290]*[.AC$17]+[.I290]*[.AC$19]+[.J290]*[.AC$21]+[.K290]*[.AC$23]+[.L290]*[.AC$25] -> 1.02390704070172 | N290: of:=IF([.E290]>0;1;0) -> 0 | O290: of:=IF([.F290]>0;1;0) -> 0 | P290: of:=IF([.G290]>0;1;0) -> 0 | Q290: of:=IF([.H290]>0;1;0) -> 1 | R290: of:=IF([.I290]>0;1;0) -> 0 | S290: of:=IF([.J290]>0;1;0) -> 0 | T290: of:=IF([.K290]>0;1;0) -> 0 | U290: of:=IF([.L290]>0;1;0) -> 1 | V290: of:=[.N290]*[.N$402]+[.O290]*[.O$402]+[.P290]*[.P$402]+[.Q290]*[.Q$402]+[.R290]*[.R$402]+[.S290]*[.S$402]+[.T290]*[.T$402]+[.U290]*[.U$402] -> 0.308633066549229 | W290: 29075 | Y290: of:=[.W290]+[.X290] -> 29075 | Z290: of:=[.Y290]/[.Y$401] -> 9.25774724697886 | AA290: of:=[.D290]+[.M290]+[.V290]+[.Z290] -> 14.3451944337689 | AB290: of:=RANK([.AA290];[.AA$2:.AA$399];0) -> 289
A291: S Tyneside | B291: 115163 | C291: of:=IF(SUM([.E291:.L291])>0;[.B291];0) -> 115163 | D291: of:=[.C291]/[.C$401] -> 4.33749299364018 | G291: 1 | H291: 1 | I291: 1 | K291: 1 | L291: 1 | M291: of:=[.E291]*[.AC$11]+[.F291]*[.AC$13]+[.G291]*[.AC$15]+[.H291]*[.AC$17]+[.I291]*[.AC$19]+[.J291]*[.AC$21]+[.K291]*[.AC$23]+[.L291]*[.AC$25] -> 4.1770743494719 | N291: of:=IF([.E291]>0;1;0) -> 0 | O291: of:=IF([.F291]>0;1;0) -> 0 | P291: of:=IF([.G291]>0;1;0) -> 1 | Q291: of:=IF([.H291]>0;1;0) -> 1 | R291: of:=IF([.I291]>0;1;0) -> 1 | S291: of:=IF([.J291]>0;1;0) -> 0 | T291: of:=IF([.K291]>0;1;0) -> 1 | U291: of:=IF([.L291]>0;1;0) -> 1 | V291: of:=[.N291]*[.N$402]+[.O291]*[.O$402]+[.P291]*[.P$402]+[.Q291]*[.Q$402]+[.R291]*[.R$402]+[.S291]*[.S$402]+[.T291]*[.T$402]+[.U291]*[.U$402] -> 2.03350799196213 | W291: of:=239+11628 -> 11867 | Y291: of:=[.W291]+[.X291] -> 11867 | Z291: of:=[.Y291]/[.Y$401] -> 3.7785618772106 | AA291: of:=[.D291]+[.M291]+[.V291]+[.Z291] -> 14.3266372122848 | AB291: of:=RANK([.AA291];[.AA$2:.AA$399];0) -> 290
A292: Broadland | B292: 99732 | C292: of:=IF(SUM([.E292:.L292])>0;[.B292];0) -> 99732 | D292: of:=[.C292]/[.C$401] -> 3.75630064553479 | H292: 1 | L292: 1 | M292: of:=[.E292]*[.AC$11]+[.F292]*[.AC$13]+[.G292]*[.AC$15]+[.H292]*[.AC$17]+[.I292]*[.AC$19]+[.J292]*[.AC$21]+[.K292]*[.AC$23]+[.L292]*[.AC$25] -> 1.02390704070172 | N292: of:=IF([.E292]>0;1;0) -> 0 | O292: of:=IF([.F292]>0;1;0) -> 0 | P292: of:=IF([.G292]>0;1;0) -> 0 | Q292: of:=IF([.H292]>0;1;0) -> 1 | R292: of:=IF([.I292]>0;1;0) -> 0 | S292: of:=IF([.J292]>0;1;0) -> 0 | T292: of:=IF([.K292]>0;1;0) -> 0 | U292: of:=IF([.L292]>0;1;0) -> 1 | V292: of:=[.N292]*[.N$402]+[.O292]*[.O$402]+[.P292]*[.P$402]+[.Q292]*[.Q$402]+[.R292]*[.R$402]+[.S292]*[.S$402]+[.T292]*[.T$402]+[.U292]*[.U$402] -> 0.308633066549229 | W292: 28910 | Y292: of:=[.W292]+[.X292] -> 28910 | Z292: of:=[.Y292]/[.Y$401] -> 9.205209730358 | AA292: of:=[.D292]+[.M292]+[.V292]+[.Z292] -> 14.2940504831437 | AB292: of:=RANK([.AA292];[.AA$2:.AA$399];0) -> 291
A293: Thanet | B293: 100403 | C293: of:=IF(SUM([.E293:.L293])>0;[.B293];0) -> 100403 | D293: of:=[.C293]/[.C$401] -> 3.78157315318683 | H293: 1 | L293: 1 | M293: of:=[.E293]*[.AC$11]+[.F293]*[.AC$13]+[.G293]*[.AC$15]+[.H293]*[.AC$17]+[.I293]*[.AC$19]+[.J293]*[.AC$21]+[.K293]*[.AC$23]+[.L293]*[.AC$25] -> 1.02390704070172 | N293: of:=IF([.E293]>0;1;0) -> 0 | O293: of:=IF([.F293]>0;1;0) -> 0 | P293: of:=IF([.G293]>0;1;0) -> 0 | Q293: of:=IF([.H293]>0;1;0) -> 1 | R293: of:=IF([.I293]>0;1;0) -> 0 | S293: of:=IF([.J293]>0;1;0) -> 0 | T293: of:=IF([.K293]>0;1;0) -> 0 | U293: of:=IF([.L293]>0;1;0) -> 1 | V293: of:=[.N293]*[.N$402]+[.O293]*[.O$402]+[.P293]*[.P$402]+[.Q293]*[.Q$402]+[.R293]*[.R$402]+[.S293]*[.S$402]+[.T293]*[.T$402]+[.U293]*[.U$402] -> 0.308633066549229 | W293: 28746 | Y293: of:=[.W293]+[.X293] -> 28746 | Z293: of:=[.Y293]/[.Y$401] -> 9.15299062292878 | AA293: of:=[.D293]+[.M293]+[.V293]+[.Z293] -> 14.2671038833666 | AB293: of:=RANK([.AA293];[.AA$2:.AA$399];0) -> 292
A294: Basildon | B294: 137642 | C294: of:=IF(SUM([.E294:.L294])>0;[.B294];0) -> 137642 | D294: of:=[.C294]/[.C$401] -> 5.18414083195664 | H294: 1 | I294: 1 | K294: 1 | L294: 1 | M294: of:=[.E294]*[.AC$11]+[.F294]*[.AC$13]+[.G294]*[.AC$15]+[.H294]*[.AC$17]+[.I294]*[.AC$19]+[.J294]*[.AC$21]+[.K294]*[.AC$23]+[.L294]*[.AC$25] -> 1.44386688758112 | N294: of:=IF([.E294]>0;1;0) -> 0 | O294: of:=IF([.F294]>0;1;0) -> 0 | P294: of:=IF([.G294]>0;1;0) -> 0 | Q294: of:=IF([.H294]>0;1;0) -> 1 | R294: of:=IF([.I294]>0;1;0) -> 1 | S294: of:=IF([.J294]>0;1;0) -> 0 | T294: of:=IF([.K294]>0;1;0) -> 1 | U294: of:=IF([.L294]>0;1;0) -> 1 | V294: of:=[.N294]*[.N$402]+[.O294]*[.O$402]+[.P294]*[.P$402]+[.Q294]*[.Q$402]+[.R294]*[.R$402]+[.S294]*[.S$402]+[.T294]*[.T$402]+[.U294]*[.U$402] -> 0.548043049303238 | W294: 22244 | Y294: of:=[.W294]+[.X294] -> 22244 | Z294: of:=[.Y294]/[.Y$401] -> 7.08269405887524 | AA294: of:=[.D294]+[.M294]+[.V294]+[.Z294] -> 14.2587448277162 | AB294: of:=RANK([.AA294];[.AA$2:.AA$399];0) -> 293
A295: Cherwell | B295: 110028 | C295: of:=IF(SUM([.E295:.L295])>0;[.B295];0) -> 110028 | D295: of:=[.C295]/[.C$401] -> 4.14408863180225 | G295: 1 | H295: 1 | I295: 1 | K295: 1 | L295: 1 | M295: of:=[.E295]*[.AC$11]+[.F295]*[.AC$13]+[.G295]*[.AC$15]+[.H295]*[.AC$17]+[.I295]*[.AC$19]+[.J295]*[.AC$21]+[.K295]*[.AC$23]+[.L295]*[.AC$25] -> 4.1770743494719 | N295: of:=IF([.E295]>0;1;0) -> 0 | O295: of:=IF([.F295]>0;1;0) -> 0 | P295: of:=IF([.G295]>0;1;0) -> 1 | Q295: of:=IF([.H295]>0;1;0) -> 1 | R295: of:=IF([.I295]>0;1;0) -> 1 | S295: of:=IF([.J295]>0;1;0) -> 0 | T295: of:=IF([.K295]>0;1;0) -> 1 | U295: of:=IF([.L295]>0;1;0) -> 1 | V295: of:=[.N295]*[.N$402]+[.O295]*[.O$402]+[.P295]*[.P$402]+[.Q295]*[.Q$402]+[.R295]*[.R$402]+[.S295]*[.S$402]+[.T295]*[.T$402]+[.U295]*[.U$402] -> 2.03350799196213 | W295: of:=44+12170 -> 12214 | Y295: of:=[.W295]+[.X295] -> 12214 | Z295: of:=[.Y295]/[.Y$401] -> 3.88904986671022 | AA295: of:=[.D295]+[.M295]+[.V295]+[.Z295] -> 14.2437208399465 | AB295: of:=RANK([.AA295];[.AA$2:.AA$399];0) -> 294
A296: Breckland | B296: 100602 | C296: of:=IF(SUM([.E296:.L296])>0;[.B296];0) -> 100602 | D296: of:=[.C296]/[.C$401] -> 3.78906827840704 | H296: 1 | L296: 1 | M296: of:=[.E296]*[.AC$11]+[.F296]*[.AC$13]+[.G296]*[.AC$15]+[.H296]*[.AC$17]+[.I296]*[.AC$19]+[.J296]*[.AC$21]+[.K296]*[.AC$23]+[.L296]*[.AC$25] -> 1.02390704070172 | N296: of:=IF([.E296]>0;1;0) -> 0 | O296: of:=IF([.F296]>0;1;0) -> 0 | P296: of:=IF([.G296]>0;1;0) -> 0 | Q296: of:=IF([.H296]>0;1;0) -> 1 | R296: of:=IF([.I296]>0;1;0) -> 0 | S296: of:=IF([.J296]>0;1;0) -> 0 | T296: of:=IF([.K296]>0;1;0) -> 0 | U296: of:=IF([.L296]>0;1;0) -> 1 | V296: of:=[.N296]*[.N$402]+[.O296]*[.O$402]+[.P296]*[.P$402]+[.Q296]*[.Q$402]+[.R296]*[.R$402]+[.S296]*[.S$402]+[.T296]*[.T$402]+[.U296]*[.U$402] -> 0.308633066549229 | W296: 28582 | Y296: of:=[.W296]+[.X296] -> 28582 | Z296: of:=[.Y296]/[.Y$401] -> 9.10077151549956 | AA296: of:=[.D296]+[.M296]+[.V296]+[.Z296] -> 14.2223799011576 | AB296: of:=RANK([.AA296];[.AA$2:.AA$399];0) -> 295
A297: Torbay | B297: 100653 | C297: of:=IF(SUM([.E297:.L297])>0;[.B297];0) -> 100653 | D297: of:=[.C297]/[.C$401] -> 3.79098913964438 | H297: 1 | L297: 1 | M297: of:=[.E297]*[.AC$11]+[.F297]*[.AC$13]+[.G297]*[.AC$15]+[.H297]*[.AC$17]+[.I297]*[.AC$19]+[.J297]*[.AC$21]+[.K297]*[.AC$23]+[.L297]*[.AC$25] -> 1.02390704070172 | N297: of:=IF([.E297]>0;1;0) -> 0 | O297: of:=IF([.F297]>0;1;0) -> 0 | P297: of:=IF([.G297]>0;1;0) -> 0 | Q297: of:=IF([.H297]>0;1;0) -> 1 | R297: of:=IF([.I297]>0;1;0) -> 0 | S297: of:=IF([.J297]>0;1;0) -> 0 | T297: of:=IF([.K297]>0;1;0) -> 0 | U297: of:=IF([.L297]>0;1;0) -> 1 | V297: of:=[.N297]*[.N$402]+[.O297]*[.O$402]+[.P297]*[.P$402]+[.Q297]*[.Q$402]+[.R297]*[.R$402]+[.S297]*[.S$402]+[.T297]*[.T$402]+[.U297]*[.U$402] -> 0.308633066549229 | W297: 28419 | Y297: of:=[.W297]+[.X297] -> 28419 | Z297: of:=[.Y297]/[.Y$401] -> 9.04887081726198 | AA297: of:=[.D297]+[.M297]+[.V297]+[.Z297] -> 14.1724000641573 | AB297: of:=RANK([.AA297];[.AA$2:.AA$399];0) -> 296
A298: Guildford | B298: 100852 | C298: of:=IF(SUM([.E298:.L298])>0;[.B298];0) -> 100852 | D298: of:=[.C298]/[.C$401] -> 3.79848426486458 | H298: 1 | L298: 1 | M298: of:=[.E298]*[.AC$11]+[.F298]*[.AC$13]+[.G298]*[.AC$15]+[.H298]*[.AC$17]+[.I298]*[.AC$19]+[.J298]*[.AC$21]+[.K298]*[.AC$23]+[.L298]*[.AC$25] -> 1.02390704070172 | N298: of:=IF([.E298]>0;1;0) -> 0 | O298: of:=IF([.F298]>0;1;0) -> 0 | P298: of:=IF([.G298]>0;1;0) -> 0 | Q298: of:=IF([.H298]>0;1;0) -> 1 | R298: of:=IF([.I298]>0;1;0) -> 0 | S298: of:=IF([.J298]>0;1;0) -> 0 | T298: of:=IF([.K298]>0;1;0) -> 0 | U298: of:=IF([.L298]>0;1;0) -> 1 | V298: of:=[.N298]*[.N$402]+[.O298]*[.O$402]+[.P298]*[.P$402]+[.Q298]*[.Q$402]+[.R298]*[.R$402]+[.S298]*[.S$402]+[.T298]*[.T$402]+[.U298]*[.U$402] -> 0.308633066549229 | W298: 28255 | Y298: of:=[.W298]+[.X298] -> 28255 | Z298: of:=[.Y298]/[.Y$401] -> 8.99665170983277 | AA298: of:=[.D298]+[.M298]+[.V298]+[.Z298] -> 14.1276760819483 | AB298: of:=RANK([.AA298];[.AA$2:.AA$399];0) -> 297
A299: Stafford | B299: 101424 | C299: of:=IF(SUM([.E299:.L299])>0;[.B299];0) -> 101424 | D299: of:=[.C299]/[.C$401] -> 3.82002804187944 | H299: 1 | L299: 1 | M299: of:=[.E299]*[.AC$11]+[.F299]*[.AC$13]+[.G299]*[.AC$15]+[.H299]*[.AC$17]+[.I299]*[.AC$19]+[.J299]*[.AC$21]+[.K299]*[.AC$23]+[.L299]*[.AC$25] -> 1.02390704070172 | N299: of:=IF([.E299]>0;1;0) -> 0 | O299: of:=IF([.F299]>0;1;0) -> 0 | P299: of:=IF([.G299]>0;1;0) -> 0 | Q299: of:=IF([.H299]>0;1;0) -> 1 | R299: of:=IF([.I299]>0;1;0) -> 0 | S299: of:=IF([.J299]>0;1;0) -> 0 | T299: of:=IF([.K299]>0;1;0) -> 0 | U299: of:=IF([.L299]>0;1;0) -> 1 | V299: of:=[.N299]*[.N$402]+[.O299]*[.O$402]+[.P299]*[.P$402]+[.Q299]*[.Q$402]+[.R299]*[.R$402]+[.S299]*[.S$402]+[.T299]*[.T$402]+[.U299]*[.U$402] -> 0.308633066549229 | W299: 28092 | Y299: of:=[.W299]+[.X299] -> 28092 | Z299: of:=[.Y299]/[.Y$401] -> 8.94475101159519 | AA299: of:=[.D299]+[.M299]+[.V299]+[.Z299] -> 14.0973191607256 | AB299: of:=RANK([.AA299];[.AA$2:.AA$399];0) -> 298
A300: Redditch | B300: 60868 | C300: of:=IF(SUM([.E300:.L300])>0;[.B300];0) -> 60868 | D300: of:=[.C300]/[.C$401] -> 2.29252905479095 | G300: 1 | H300: 1 | I300: 1 | K300: 1 | L300: 1 | M300: of:=[.E300]*[.AC$11]+[.F300]*[.AC$13]+[.G300]*[.AC$15]+[.H300]*[.AC$17]+[.I300]*[.AC$19]+[.J300]*[.AC$21]+[.K300]*[.AC$23]+[.L300]*[.AC$25] -> 4.1770743494719 | N300: of:=IF([.E300]>0;1;0) -> 0 | O300: of:=IF([.F300]>0;1;0) -> 0 | P300: of:=IF([.G300]>0;1;0) -> 1 | Q300: of:=IF([.H300]>0;1;0) -> 1 | R300: of:=IF([.I300]>0;1;0) -> 1 | S300: of:=IF([.J300]>0;1;0) -> 0 | T300: of:=IF([.K300]>0;1;0) -> 1 | U300: of:=IF([.L300]>0;1;0) -> 1 | V300: of:=[.N300]*[.N$402]+[.O300]*[.O$402]+[.P300]*[.P$402]+[.Q300]*[.Q$402]+[.R300]*[.R$402]+[.S300]*[.S$402]+[.T300]*[.T$402]+[.U300]*[.U$402] -> 2.03350799196213 | W300: of:=4881+12545 -> 17426 | Y300: of:=[.W300]+[.X300] -> 17426 | Z300: of:=[.Y300]/[.Y$401] -> 5.54859857354612 | AA300: of:=[.D300]+[.M300]+[.V300]+[.Z300] -> 14.0517099697711 | AB300: of:=RANK([.AA300];[.AA$2:.AA$399];0) -> 299
A301: Blackpool | B301: 101511 | C301: of:=IF(SUM([.E301:.L301])>0;[.B301];0) -> 101511 | D301: of:=[.C301]/[.C$401] -> 3.82330480516666 | H301: 1 | L301: 1 | M301: of:=[.E301]*[.AC$11]+[.F301]*[.AC$13]+[.G301]*[.AC$15]+[.H301]*[.AC$17]+[.I301]*[.AC$19]+[.J301]*[.AC$21]+[.K301]*[.AC$23]+[.L301]*[.AC$25] -> 1.02390704070172 | N301: of:=IF([.E301]>0;1;0) -> 0 | O301: of:=IF([.F301]>0;1;0) -> 0 | P301: of:=IF([.G301]>0;1;0) -> 0 | Q301: of:=IF([.H301]>0;1;0) -> 1 | R301: of:=IF([.I301]>0;1;0) -> 0 | S301: of:=IF([.J301]>0;1;0) -> 0 | T301: of:=IF([.K301]>0;1;0) -> 0 | U301: of:=IF([.L301]>0;1;0) -> 1 | V301: of:=[.N301]*[.N$402]+[.O301]*[.O$402]+[.P301]*[.P$402]+[.Q301]*[.Q$402]+[.R301]*[.R$402]+[.S301]*[.S$402]+[.T301]*[.T$402]+[.U301]*[.U$402] -> 0.308633066549229 | W301: 27929 | Y301: of:=[.W301]+[.X301] -> 27929 | Z301: of:=[.Y301]/[.Y$401] -> 8.89285031335761 | AA301: of:=[.D301]+[.M301]+[.V301]+[.Z301] -> 14.0486952257752 | AB301: of:=RANK([.AA301];[.AA$2:.AA$399];0) -> 300
A302: W Lancs | B302: 84555 | C302: of:=IF(SUM([.E302:.L302])>0;[.B302];0) -> 84555 | D302: of:=[.C302]/[.C$401] -> 3.18467493967026 | H302: 1 | I302: 1 | K302: 1 | L302: 1 | M302: of:=[.E302]*[.AC$11]+[.F302]*[.AC$13]+[.G302]*[.AC$15]+[.H302]*[.AC$17]+[.I302]*[.AC$19]+[.J302]*[.AC$21]+[.K302]*[.AC$23]+[.L302]*[.AC$25] -> 1.44386688758112 | N302: of:=IF([.E302]>0;1;0) -> 0 | O302: of:=IF([.F302]>0;1;0) -> 0 | P302: of:=IF([.G302]>0;1;0) -> 0 | Q302: of:=IF([.H302]>0;1;0) -> 1 | R302: of:=IF([.I302]>0;1;0) -> 1 | S302: of:=IF([.J302]>0;1;0) -> 0 | T302: of:=IF([.K302]>0;1;0) -> 1 | U302: of:=IF([.L302]>0;1;0) -> 1 | V302: of:=[.N302]*[.N$402]+[.O302]*[.O$402]+[.P302]*[.P$402]+[.Q302]*[.Q$402]+[.R302]*[.R$402]+[.S302]*[.S$402]+[.T302]*[.T$402]+[.U302]*[.U$402] -> 0.548043049303238 | W302: 27767 | Y302: of:=[.W302]+[.X302] -> 27767 | Z302: of:=[.Y302]/[.Y$401] -> 8.84126802431168 | AA302: of:=[.D302]+[.M302]+[.V302]+[.Z302] -> 14.0178529008663 | AB302: of:=RANK([.AA302];[.AA$2:.AA$399];0) -> 301
A303: Redcar and Cleveland | B303: 103139 | C303: of:=IF(SUM([.E303:.L303])>0;[.B303];0) -> 103139 | D303: of:=[.C303]/[.C$401] -> 3.88462170897819 | H303: 1 | L303: 1 | M303: of:=[.E303]*[.AC$11]+[.F303]*[.AC$13]+[.G303]*[.AC$15]+[.H303]*[.AC$17]+[.I303]*[.AC$19]+[.J303]*[.AC$21]+[.K303]*[.AC$23]+[.L303]*[.AC$25] -> 1.02390704070172 | N303: of:=IF([.E303]>0;1;0) -> 0 | O303: of:=IF([.F303]>0;1;0) -> 0 | P303: of:=IF([.G303]>0;1;0) -> 0 | Q303: of:=IF([.H303]>0;1;0) -> 1 | R303: of:=IF([.I303]>0;1;0) -> 0 | S303: of:=IF([.J303]>0;1;0) -> 0 | T303: of:=IF([.K303]>0;1;0) -> 0 | U303: of:=IF([.L303]>0;1;0) -> 1 | V303: of:=[.N303]*[.N$402]+[.O303]*[.O$402]+[.P303]*[.P$402]+[.Q303]*[.Q$402]+[.R303]*[.R$402]+[.S303]*[.S$402]+[.T303]*[.T$402]+[.U303]*[.U$402] -> 0.308633066549229 | W303: 27604 | Y303: of:=[.W303]+[.X303] -> 27604 | Z303: of:=[.Y303]/[.Y$401] -> 8.7893673260741 | AA303: of:=[.D303]+[.M303]+[.V303]+[.Z303] -> 14.0065291423032 | AB303: of:=RANK([.AA303];[.AA$2:.AA$399];0) -> 302
A304: Swale | B304: 105224 | C304: of:=IF(SUM([.E304:.L304])>0;[.B304];0) -> 105224 | D304: of:=[.C304]/[.C$401] -> 3.9631510360341 | H304: 1 | L304: 1 | M304: of:=[.E304]*[.AC$11]+[.F304]*[.AC$13]+[.G304]*[.AC$15]+[.H304]*[.AC$17]+[.I304]*[.AC$19]+[.J304]*[.AC$21]+[.K304]*[.AC$23]+[.L304]*[.AC$25] -> 1.02390704070172 | N304: of:=IF([.E304]>0;1;0) -> 0 | O304: of:=IF([.F304]>0;1;0) -> 0 | P304: of:=IF([.G304]>0;1;0) -> 0 | Q304: of:=IF([.H304]>0;1;0) -> 1 | R304: of:=IF([.I304]>0;1;0) -> 0 | S304: of:=IF([.J304]>0;1;0) -> 0 | T304: of:=IF([.K304]>0;1;0) -> 0 | U304: of:=IF([.L304]>0;1;0) -> 1 | V304: of:=[.N304]*[.N$402]+[.O304]*[.O$402]+[.P304]*[.P$402]+[.Q304]*[.Q$402]+[.R304]*[.R$402]+[.S304]*[.S$402]+[.T304]*[.T$402]+[.U304]*[.U$402] -> 0.308633066549229 | W304: 27281 | Y304: of:=[.W304]+[.X304] -> 27281 | Z304: of:=[.Y304]/[.Y$401] -> 8.68652115717387 | AA304: of:=[.D304]+[.M304]+[.V304]+[.Z304] -> 13.9822123004589 | AB304: of:=RANK([.AA304];[.AA$2:.AA$399];0) -> 303
A305: Southwark | B305: 215077 | C305: of:=IF(SUM([.E305:.L305])>0;[.B305];0) -> 215077 | D305: of:=[.C305]/[.C$401] -> 8.10064847731606 | G305: 1 | K305: 1 | M305: of:=[.E305]*[.AC$11]+[.F305]*[.AC$13]+[.G305]*[.AC$15]+[.H305]*[.AC$17]+[.I305]*[.AC$19]+[.J305]*[.AC$21]+[.K305]*[.AC$23]+[.L305]*[.AC$25] -> 2.78326790277077 | N305: of:=IF([.E305]>0;1;0) -> 0 | O305: of:=IF([.F305]>0;1;0) -> 0 | P305: of:=IF([.G305]>0;1;0) -> 1 | Q305: of:=IF([.H305]>0;1;0) -> 0 | R305: of:=IF([.I305]>0;1;0) -> 0 | S305: of:=IF([.J305]>0;1;0) -> 0 | T305: of:=IF([.K305]>0;1;0) -> 1 | U305: of:=IF([.L305]>0;1;0) -> 0 | V305: of:=[.N305]*[.N$402]+[.O305]*[.O$402]+[.P305]*[.P$402]+[.Q305]*[.Q$402]+[.R305]*[.R$402]+[.S305]*[.S$402]+[.T305]*[.T$402]+[.U305]*[.U$402] -> 1.5062883605785 | W305: 4985 | Y305: of:=[.W305]+[.X305] -> 4985 | Z305: of:=[.Y305]/[.Y$401] -> 1.58726982033326 | AA305: of:=[.D305]+[.M305]+[.V305]+[.Z305] -> 13.9774745609986 | AB305: of:=RANK([.AA305];[.AA$2:.AA$399];0) -> 304
A306: Teignbridge | B306: 103410 | C306: of:=IF(SUM([.E306:.L306])>0;[.B306];0) -> 103410 | D306: of:=[.C306]/[.C$401] -> 3.89482863829816 | H306: 1 | L306: 1 | M306: of:=[.E306]*[.AC$11]+[.F306]*[.AC$13]+[.G306]*[.AC$15]+[.H306]*[.AC$17]+[.I306]*[.AC$19]+[.J306]*[.AC$21]+[.K306]*[.AC$23]+[.L306]*[.AC$25] -> 1.02390704070172 | N306: of:=IF([.E306]>0;1;0) -> 0 | O306: of:=IF([.F306]>0;1;0) -> 0 | P306: of:=IF([.G306]>0;1;0) -> 0 | Q306: of:=IF([.H306]>0;1;0) -> 1 | R306: of:=IF([.I306]>0;1;0) -> 0 | S306: of:=IF([.J306]>0;1;0) -> 0 | T306: of:=IF([.K306]>0;1;0) -> 0 | U306: of:=IF([.L306]>0;1;0) -> 1 | V306: of:=[.N306]*[.N$402]+[.O306]*[.O$402]+[.P306]*[.P$402]+[.Q306]*[.Q$402]+[.R306]*[.R$402]+[.S306]*[.S$402]+[.T306]*[.T$402]+[.U306]*[.U$402] -> 0.308633066549229 | W306: 27442 | Y306: of:=[.W306]+[.X306] -> 27442 | Z306: of:=[.Y306]/[.Y$401] -> 8.73778503702816 | AA306: of:=[.D306]+[.M306]+[.V306]+[.Z306] -> 13.9651537825773 | AB306: of:=RANK([.AA306];[.AA$2:.AA$399];0) -> 305
A307: S Oxon | B307: 105717 | C307: of:=IF(SUM([.E307:.L307])>0;[.B307];0) -> 105717 | D307: of:=[.C307]/[.C$401] -> 3.98171936132837 | H307: 1 | L307: 1 | M307: of:=[.E307]*[.AC$11]+[.F307]*[.AC$13]+[.G307]*[.AC$15]+[.H307]*[.AC$17]+[.I307]*[.AC$19]+[.J307]*[.AC$21]+[.K307]*[.AC$23]+[.L307]*[.AC$25] -> 1.02390704070172 | N307: of:=IF([.E307]>0;1;0) -> 0 | O307: of:=IF([.F307]>0;1;0) -> 0 | P307: of:=IF([.G307]>0;1;0) -> 0 | Q307: of:=IF([.H307]>0;1;0) -> 1 | R307: of:=IF([.I307]>0;1;0) -> 0 | S307: of:=IF([.J307]>0;1;0) -> 0 | T307: of:=IF([.K307]>0;1;0) -> 0 | U307: of:=IF([.L307]>0;1;0) -> 1 | V307: of:=[.N307]*[.N$402]+[.O307]*[.O$402]+[.P307]*[.P$402]+[.Q307]*[.Q$402]+[.R307]*[.R$402]+[.S307]*[.S$402]+[.T307]*[.T$402]+[.U307]*[.U$402] -> 0.308633066549229 | W307: 27119 | Y307: of:=[.W307]+[.X307] -> 27119 | Z307: of:=[.Y307]/[.Y$401] -> 8.63493886812793 | AA307: of:=[.D307]+[.M307]+[.V307]+[.Z307] -> 13.9491983367073 | AB307: of:=RANK([.AA307];[.AA$2:.AA$399];0) -> 306
A308: S Kesteven | B308: 106685 | C308: of:=IF(SUM([.E308:.L308])>0;[.B308];0) -> 106685 | D308: of:=[.C308]/[.C$401] -> 4.01817806089198 | H308: 1 | L308: 1 | M308: of:=[.E308]*[.AC$11]+[.F308]*[.AC$13]+[.G308]*[.AC$15]+[.H308]*[.AC$17]+[.I308]*[.AC$19]+[.J308]*[.AC$21]+[.K308]*[.AC$23]+[.L308]*[.AC$25] -> 1.02390704070172 | N308: of:=IF([.E308]>0;1;0) -> 0 | O308: of:=IF([.F308]>0;1;0) -> 0 | P308: of:=IF([.G308]>0;1;0) -> 0 | Q308: of:=IF([.H308]>0;1;0) -> 1 | R308: of:=IF([.I308]>0;1;0) -> 0 | S308: of:=IF([.J308]>0;1;0) -> 0 | T308: of:=IF([.K308]>0;1;0) -> 0 | U308: of:=IF([.L308]>0;1;0) -> 1 | V308: of:=[.N308]*[.N$402]+[.O308]*[.O$402]+[.P308]*[.P$402]+[.Q308]*[.Q$402]+[.R308]*[.R$402]+[.S308]*[.S$402]+[.T308]*[.T$402]+[.U308]*[.U$402] -> 0.308633066549229 | W308: 26958 | Y308: of:=[.W308]+[.X308] -> 26958 | Z308: of:=[.Y308]/[.Y$401] -> 8.58367498827364 | AA308: of:=[.D308]+[.M308]+[.V308]+[.Z308] -> 13.9343931564166 | AB308: of:=RANK([.AA308];[.AA$2:.AA$399];0) -> 307
A309: New Forest | B309: 142494 | C309: of:=IF(SUM([.E309:.L309])>0;[.B309];0) -> 142494 | D309: of:=[.C309]/[.C$401] -> 5.36688629712463 | H309: 1 | L309: 1 | M309: of:=[.E309]*[.AC$11]+[.F309]*[.AC$13]+[.G309]*[.AC$15]+[.H309]*[.AC$17]+[.I309]*[.AC$19]+[.J309]*[.AC$21]+[.K309]*[.AC$23]+[.L309]*[.AC$25] -> 1.02390704070172 | N309: of:=IF([.E309]>0;1;0) -> 0 | O309: of:=IF([.F309]>0;1;0) -> 0 | P309: of:=IF([.G309]>0;1;0) -> 0 | Q309: of:=IF([.H309]>0;1;0) -> 1 | R309: of:=IF([.I309]>0;1;0) -> 0 | S309: of:=IF([.J309]>0;1;0) -> 0 | T309: of:=IF([.K309]>0;1;0) -> 0 | U309: of:=IF([.L309]>0;1;0) -> 1 | V309: of:=[.N309]*[.N$402]+[.O309]*[.O$402]+[.P309]*[.P$402]+[.Q309]*[.Q$402]+[.R309]*[.R$402]+[.S309]*[.S$402]+[.T309]*[.T$402]+[.U309]*[.U$402] -> 0.308633066549229 | W309: 22704 | Y309: of:=[.W309]+[.X309] -> 22704 | Z309: of:=[.Y309]/[.Y$401] -> 7.22916228703037 | AA309: of:=[.D309]+[.M309]+[.V309]+[.Z309] -> 13.928588691406 | AB309: of:=RANK([.AA309];[.AA$2:.AA$399];0) -> 308
A310: York | B310: 144389 | C310: of:=IF(SUM([.E310:.L310])>0;[.B310];0) -> 144389 | D310: of:=[.C310]/[.C$401] -> 5.43825947447281 | H310: 1 | L310: 1 | M310: of:=[.E310]*[.AC$11]+[.F310]*[.AC$13]+[.G310]*[.AC$15]+[.H310]*[.AC$17]+[.I310]*[.AC$19]+[.J310]*[.AC$21]+[.K310]*[.AC$23]+[.L310]*[.AC$25] -> 1.02390704070172 | N310: of:=IF([.E310]>0;1;0) -> 0 | O310: of:=IF([.F310]>0;1;0) -> 0 | P310: of:=IF([.G310]>0;1;0) -> 0 | Q310: of:=IF([.H310]>0;1;0) -> 1 | R310: of:=IF([.I310]>0;1;0) -> 0 | S310: of:=IF([.J310]>0;1;0) -> 0 | T310: of:=IF([.K310]>0;1;0) -> 0 | U310: of:=IF([.L310]>0;1;0) -> 1 | V310: of:=[.N310]*[.N$402]+[.O310]*[.O$402]+[.P310]*[.P$402]+[.Q310]*[.Q$402]+[.R310]*[.R$402]+[.S310]*[.S$402]+[.T310]*[.T$402]+[.U310]*[.U$402] -> 0.308633066549229 | W310: 22397 | Y310: of:=[.W310]+[.X310] -> 22397 | Z310: of:=[.Y310]/[.Y$401] -> 7.13141066519641 | AA310: of:=[.D310]+[.M310]+[.V310]+[.Z310] -> 13.9022102469202 | AB310: of:=RANK([.AA310];[.AA$2:.AA$399];0) -> 309
A311: Luton | B311: 142921 | C311: of:=IF(SUM([.E311:.L311])>0;[.B311];0) -> 142921 | D311: of:=[.C311]/[.C$401] -> 5.38296880199412 | H311: 1 | L311: 1 | M311: of:=[.E311]*[.AC$11]+[.F311]*[.AC$13]+[.G311]*[.AC$15]+[.H311]*[.AC$17]+[.I311]*[.AC$19]+[.J311]*[.AC$21]+[.K311]*[.AC$23]+[.L311]*[.AC$25] -> 1.02390704070172 | N311: of:=IF([.E311]>0;1;0) -> 0 | O311: of:=IF([.F311]>0;1;0) -> 0 | P311: of:=IF([.G311]>0;1;0) -> 0 | Q311: of:=IF([.H311]>0;1;0) -> 1 | R311: of:=IF([.I311]>0;1;0) -> 0 | S311: of:=IF([.J311]>0;1;0) -> 0 | T311: of:=IF([.K311]>0;1;0) -> 0 | U311: of:=IF([.L311]>0;1;0) -> 1 | V311: of:=[.N311]*[.N$402]+[.O311]*[.O$402]+[.P311]*[.P$402]+[.Q311]*[.Q$402]+[.R311]*[.R$402]+[.S311]*[.S$402]+[.T311]*[.T$402]+[.U311]*[.U$402] -> 0.308633066549229 | W311: 22550 | Y311: of:=[.W311]+[.X311] -> 22550 | Z311: of:=[.Y311]/[.Y$401] -> 7.18012727151757 | AA311: of:=[.D311]+[.M311]+[.V311]+[.Z311] -> 13.8956361807626 | AB311: of:=RANK([.AA311];[.AA$2:.AA$399];0) -> 310
A312: S Norfolk | B312: 106822 | C312: of:=IF(SUM([.E312:.L312])>0;[.B312];0) -> 106822 | D312: of:=[.C312]/[.C$401] -> 4.02333802147071 | H312: 1 | L312: 1 | M312: of:=[.E312]*[.AC$11]+[.F312]*[.AC$13]+[.G312]*[.AC$15]+[.H312]*[.AC$17]+[.I312]*[.AC$19]+[.J312]*[.AC$21]+[.K312]*[.AC$23]+[.L312]*[.AC$25] -> 1.02390704070172 | N312: of:=IF([.E312]>0;1;0) -> 0 | O312: of:=IF([.F312]>0;1;0) -> 0 | P312: of:=IF([.G312]>0;1;0) -> 0 | Q312: of:=IF([.H312]>0;1;0) -> 1 | R312: of:=IF([.I312]>0;1;0) -> 0 | S312: of:=IF([.J312]>0;1;0) -> 0 | T312: of:=IF([.K312]>0;1;0) -> 0 | U312: of:=IF([.L312]>0;1;0) -> 1 | V312: of:=[.N312]*[.N$402]+[.O312]*[.O$402]+[.P312]*[.P$402]+[.Q312]*[.Q$402]+[.R312]*[.R$402]+[.S312]*[.S$402]+[.T312]*[.T$402]+[.U312]*[.U$402] -> 0.308633066549229 | W312: 26797 | Y312: of:=[.W312]+[.X312] -> 26797 | Z312: of:=[.Y312]/[.Y$401] -> 8.53241110841934 | AA312: of:=[.D312]+[.M312]+[.V312]+[.Z312] -> 13.888289237141 | AB312: of:=RANK([.AA312];[.AA$2:.AA$399];0) -> 311
A313: Tamworth | B313: 57355 | C313: of:=IF(SUM([.E313:.L313])>0;[.B313];0) -> 57355 | D313: of:=[.C313]/[.C$401] -> 2.16021561308956 | G313: 1 | H313: 1 | I313: 1 | K313: 1 | L313: 1 | M313: of:=[.E313]*[.AC$11]+[.F313]*[.AC$13]+[.G313]*[.AC$15]+[.H313]*[.AC$17]+[.I313]*[.AC$19]+[.J313]*[.AC$21]+[.K313]*[.AC$23]+[.L313]*[.AC$25] -> 4.1770743494719 | N313: of:=IF([.E313]>0;1;0) -> 0 | O313: of:=IF([.F313]>0;1;0) -> 0 | P313: of:=IF([.G313]>0;1;0) -> 1 | Q313: of:=IF([.H313]>0;1;0) -> 1 | R313: of:=IF([.I313]>0;1;0) -> 1 | S313: of:=IF([.J313]>0;1;0) -> 0 | T313: of:=IF([.K313]>0;1;0) -> 1 | U313: of:=IF([.L313]>0;1;0) -> 1 | V313: of:=[.N313]*[.N$402]+[.O313]*[.O$402]+[.P313]*[.P$402]+[.Q313]*[.Q$402]+[.R313]*[.R$402]+[.S313]*[.S$402]+[.T313]*[.T$402]+[.U313]*[.U$402] -> 2.03350799196213 | W313: of:=5037+12287 -> 17324 | Y313: of:=[.W313]+[.X313] -> 17324 | Z313: of:=[.Y313]/[.Y$401] -> 5.51612083599868 | AA313: of:=[.D313]+[.M313]+[.V313]+[.Z313] -> 13.8869187905223 | AB313: of:=RANK([.AA313];[.AA$2:.AA$399];0) -> 312
A314: Stockton-on-Tees | B314: 139603 | C314: of:=IF(SUM([.E314:.L314])>0;[.B314];0) -> 139603 | D314: of:=[.C314]/[.C$401] -> 5.2579998297296 | H314: 1 | L314: 1 | M314: of:=[.E314]*[.AC$11]+[.F314]*[.AC$13]+[.G314]*[.AC$15]+[.H314]*[.AC$17]+[.I314]*[.AC$19]+[.J314]*[.AC$21]+[.K314]*[.AC$23]+[.L314]*[.AC$25] -> 1.02390704070172 | N314: of:=IF([.E314]>0;1;0) -> 0 | O314: of:=IF([.F314]>0;1;0) -> 0 | P314: of:=IF([.G314]>0;1;0) -> 0 | Q314: of:=IF([.H314]>0;1;0) -> 1 | R314: of:=IF([.I314]>0;1;0) -> 0 | S314: of:=IF([.J314]>0;1;0) -> 0 | T314: of:=IF([.K314]>0;1;0) -> 0 | U314: of:=IF([.L314]>0;1;0) -> 1 | V314: of:=[.N314]*[.N$402]+[.O314]*[.O$402]+[.P314]*[.P$402]+[.Q314]*[.Q$402]+[.R314]*[.R$402]+[.S314]*[.S$402]+[.T314]*[.T$402]+[.U314]*[.U$402] -> 0.308633066549229 | W314: 22858 | Y314: of:=[.W314]+[.X314] -> 22858 | Z314: of:=[.Y314]/[.Y$401] -> 7.27819730254317 | AA314: of:=[.D314]+[.M314]+[.V314]+[.Z314] -> 13.8687372395237 | AB314: of:=RANK([.AA314];[.AA$2:.AA$399];0) -> 313
A315: Warwick | B315: 107236 | C315: of:=IF(SUM([.E315:.L315])>0;[.B315];0) -> 107236 | D315: of:=[.C315]/[.C$401] -> 4.0389308950444 | H315: 1 | L315: 1 | M315: of:=[.E315]*[.AC$11]+[.F315]*[.AC$13]+[.G315]*[.AC$15]+[.H315]*[.AC$17]+[.I315]*[.AC$19]+[.J315]*[.AC$21]+[.K315]*[.AC$23]+[.L315]*[.AC$25] -> 1.02390704070172 | N315: of:=IF([.E315]>0;1;0) -> 0 | O315: of:=IF([.F315]>0;1;0) -> 0 | P315: of:=IF([.G315]>0;1;0) -> 0 | Q315: of:=IF([.H315]>0;1;0) -> 1 | R315: of:=IF([.I315]>0;1;0) -> 0 | S315: of:=IF([.J315]>0;1;0) -> 0 | T315: of:=IF([.K315]>0;1;0) -> 0 | U315: of:=IF([.L315]>0;1;0) -> 1 | V315: of:=[.N315]*[.N$402]+[.O315]*[.O$402]+[.P315]*[.P$402]+[.Q315]*[.Q$402]+[.R315]*[.R$402]+[.S315]*[.S$402]+[.T315]*[.T$402]+[.U315]*[.U$402] -> 0.308633066549229 | W315: 26636 | Y315: of:=[.W315]+[.X315] -> 26636 | Z315: of:=[.Y315]/[.Y$401] -> 8.48114722856505 | AA315: of:=[.D315]+[.M315]+[.V315]+[.Z315] -> 13.8526182308604 | AB315: of:=RANK([.AA315];[.AA$2:.AA$399];0) -> 314
A316: Rossendale | B316: 51302 | C316: of:=IF(SUM([.E316:.L316])>0;[.B316];0) -> 51302 | D316: of:=[.C316]/[.C$401] -> 1.93223574897952 | G316: 1 | H316: 1 | I316: 1 | K316: 1 | L316: 1 | M316: of:=[.E316]*[.AC$11]+[.F316]*[.AC$13]+[.G316]*[.AC$15]+[.H316]*[.AC$17]+[.I316]*[.AC$19]+[.J316]*[.AC$21]+[.K316]*[.AC$23]+[.L316]*[.AC$25] -> 4.1770743494719 | N316: of:=IF([.E316]>0;1;0) -> 0 | O316: of:=IF([.F316]>0;1;0) -> 0 | P316: of:=IF([.G316]>0;1;0) -> 1 | Q316: of:=IF([.H316]>0;1;0) -> 1 | R316: of:=IF([.I316]>0;1;0) -> 1 | S316: of:=IF([.J316]>0;1;0) -> 0 | T316: of:=IF([.K316]>0;1;0) -> 1 | U316: of:=IF([.L316]>0;1;0) -> 1 | V316: of:=[.N316]*[.N$402]+[.O316]*[.O$402]+[.P316]*[.P$402]+[.Q316]*[.Q$402]+[.R316]*[.R$402]+[.S316]*[.S$402]+[.T316]*[.T$402]+[.U316]*[.U$402] -> 2.03350799196213 | W316: of:=4907+12902 -> 17809 | Y316: of:=[.W316]+[.X316] -> 17809 | Z316: of:=[.Y316]/[.Y$401] -> 5.67054929394485 | AA316: of:=[.D316]+[.M316]+[.V316]+[.Z316] -> 13.8133673843584 | AB316: of:=RANK([.AA316];[.AA$2:.AA$399];0) -> 315
A317: Windsor and Maidenhead | B317: 107497 | C317: of:=IF(SUM([.E317:.L317])>0;[.B317];0) -> 107497 | D317: of:=[.C317]/[.C$401] -> 4.04876118490608 | H317: 1 | L317: 1 | M317: of:=[.E317]*[.AC$11]+[.F317]*[.AC$13]+[.G317]*[.AC$15]+[.H317]*[.AC$17]+[.I317]*[.AC$19]+[.J317]*[.AC$21]+[.K317]*[.AC$23]+[.L317]*[.AC$25] -> 1.02390704070172 | N317: of:=IF([.E317]>0;1;0) -> 0 | O317: of:=IF([.F317]>0;1;0) -> 0 | P317: of:=IF([.G317]>0;1;0) -> 0 | Q317: of:=IF([.H317]>0;1;0) -> 1 | R317: of:=IF([.I317]>0;1;0) -> 0 | S317: of:=IF([.J317]>0;1;0) -> 0 | T317: of:=IF([.K317]>0;1;0) -> 0 | U317: of:=IF([.L317]>0;1;0) -> 1 | V317: of:=[.N317]*[.N$402]+[.O317]*[.O$402]+[.P317]*[.P$402]+[.Q317]*[.Q$402]+[.R317]*[.R$402]+[.S317]*[.S$402]+[.T317]*[.T$402]+[.U317]*[.U$402] -> 0.308633066549229 | W317: 26475 | Y317: of:=[.W317]+[.X317] -> 26475 | Z317: of:=[.Y317]/[.Y$401] -> 8.42988334871076 | AA317: of:=[.D317]+[.M317]+[.V317]+[.Z317] -> 13.8111846408678 | AB317: of:=RANK([.AA317];[.AA$2:.AA$399];0) -> 316
A318: Sunderland | B318: 204991 | C318: of:=IF(SUM([.E318:.L318])>0;[.B318];0) -> 204991 | D318: of:=[.C318]/[.C$401] -> 7.72076991967294 | H318: 1 | I318: 1 | K318: 1 | L318: 1 | M318: of:=[.E318]*[.AC$11]+[.F318]*[.AC$13]+[.G318]*[.AC$15]+[.H318]*[.AC$17]+[.I318]*[.AC$19]+[.J318]*[.AC$21]+[.K318]*[.AC$23]+[.L318]*[.AC$25] -> 1.44386688758112 | N318: of:=IF([.E318]>0;1;0) -> 0 | O318: of:=IF([.F318]>0;1;0) -> 0 | P318: of:=IF([.G318]>0;1;0) -> 0 | Q318: of:=IF([.H318]>0;1;0) -> 1 | R318: of:=IF([.I318]>0;1;0) -> 1 | S318: of:=IF([.J318]>0;1;0) -> 0 | T318: of:=IF([.K318]>0;1;0) -> 1 | U318: of:=IF([.L318]>0;1;0) -> 1 | V318: of:=[.N318]*[.N$402]+[.O318]*[.O$402]+[.P318]*[.P$402]+[.Q318]*[.Q$402]+[.R318]*[.R$402]+[.S318]*[.S$402]+[.T318]*[.T$402]+[.U318]*[.U$402] -> 0.548043049303238 | W318: 12801 | Y318: of:=[.W318]+[.X318] -> 12801 | Z318: of:=[.Y318]/[.Y$401] -> 4.07595606220383 | AA318: of:=[.D318]+[.M318]+[.V318]+[.Z318] -> 13.7886359187611 | AB318: of:=RANK([.AA318];[.AA$2:.AA$399];0) -> 317
A319: Canterbury | B319: 107503 | C319: of:=IF(SUM([.E319:.L319])>0;[.B319];0) -> 107503 | D319: of:=[.C319]/[.C$401] -> 4.04898716858106 | H319: 1 | L319: 1 | M319: of:=[.E319]*[.AC$11]+[.F319]*[.AC$13]+[.G319]*[.AC$15]+[.H319]*[.AC$17]+[.I319]*[.AC$19]+[.J319]*[.AC$21]+[.K319]*[.AC$23]+[.L319]*[.AC$25] -> 1.02390704070172 | N319: of:=IF([.E319]>0;1;0) -> 0 | O319: of:=IF([.F319]>0;1;0) -> 0 | P319: of:=IF([.G319]>0;1;0) -> 0 | Q319: of:=IF([.H319]>0;1;0) -> 1 | R319: of:=IF([.I319]>0;1;0) -> 0 | S319: of:=IF([.J319]>0;1;0) -> 0 | T319: of:=IF([.K319]>0;1;0) -> 0 | U319: of:=IF([.L319]>0;1;0) -> 1 | V319: of:=[.N319]*[.N$402]+[.O319]*[.O$402]+[.P319]*[.P$402]+[.Q319]*[.Q$402]+[.R319]*[.R$402]+[.S319]*[.S$402]+[.T319]*[.T$402]+[.U319]*[.U$402] -> 0.308633066549229 | W319: 26315 | Y319: of:=[.W319]+[.X319] -> 26315 | Z319: of:=[.Y319]/[.Y$401] -> 8.3789378780481 | AA319: of:=[.D319]+[.M319]+[.V319]+[.Z319] -> 13.7604651538801 | AB319: of:=RANK([.AA319];[.AA$2:.AA$399];0) -> 318
A320: Charnwood | B320: 132566 | C320: of:=IF(SUM([.E320:.L320])>0;[.B320];0) -> 132566 | D320: of:=[.C320]/[.C$401] -> 4.99295864292268 | H320: 1 | L320: 1 | M320: of:=[.E320]*[.AC$11]+[.F320]*[.AC$13]+[.G320]*[.AC$15]+[.H320]*[.AC$17]+[.I320]*[.AC$19]+[.J320]*[.AC$21]+[.K320]*[.AC$23]+[.L320]*[.AC$25] -> 1.02390704070172 | N320: of:=IF([.E320]>0;1;0) -> 0 | O320: of:=IF([.F320]>0;1;0) -> 0 | P320: of:=IF([.G320]>0;1;0) -> 0 | Q320: of:=IF([.H320]>0;1;0) -> 1 | R320: of:=IF([.I320]>0;1;0) -> 0 | S320: of:=IF([.J320]>0;1;0) -> 0 | T320: of:=IF([.K320]>0;1;0) -> 0 | U320: of:=IF([.L320]>0;1;0) -> 1 | V320: of:=[.N320]*[.N$402]+[.O320]*[.O$402]+[.P320]*[.P$402]+[.Q320]*[.Q$402]+[.R320]*[.R$402]+[.S320]*[.S$402]+[.T320]*[.T$402]+[.U320]*[.U$402] -> 0.308633066549229 | W320: 23322 | Y320: of:=[.W320]+[.X320] -> 23322 | Z320: of:=[.Y320]/[.Y$401] -> 7.42593916746486 | AA320: of:=[.D320]+[.M320]+[.V320]+[.Z320] -> 13.7514379176385 | AB320: of:=RANK([.AA320];[.AA$2:.AA$399];0) -> 319
A321: Telford and Wrekin | B321: 127908 | C321: of:=IF(SUM([.E321:.L321])>0;[.B321];0) -> 127908 | D321: of:=[.C321]/[.C$401] -> 4.81751998324573 | H321: 1 | L321: 1 | M321: of:=[.E321]*[.AC$11]+[.F321]*[.AC$13]+[.G321]*[.AC$15]+[.H321]*[.AC$17]+[.I321]*[.AC$19]+[.J321]*[.AC$21]+[.K321]*[.AC$23]+[.L321]*[.AC$25] -> 1.02390704070172 | N321: of:=IF([.E321]>0;1;0) -> 0 | O321: of:=IF([.F321]>0;1;0) -> 0 | P321: of:=IF([.G321]>0;1;0) -> 0 | Q321: of:=IF([.H321]>0;1;0) -> 1 | R321: of:=IF([.I321]>0;1;0) -> 0 | S321: of:=IF([.J321]>0;1;0) -> 0 | T321: of:=IF([.K321]>0;1;0) -> 0 | U321: of:=IF([.L321]>0;1;0) -> 1 | V321: of:=[.N321]*[.N$402]+[.O321]*[.O$402]+[.P321]*[.P$402]+[.Q321]*[.Q$402]+[.R321]*[.R$402]+[.S321]*[.S$402]+[.T321]*[.T$402]+[.U321]*[.U$402] -> 0.308633066549229 | W321: 23788 | Y321: of:=[.W321]+[.X321] -> 23788 | Z321: of:=[.Y321]/[.Y$401] -> 7.57431785076984 | AA321: of:=[.D321]+[.M321]+[.V321]+[.Z321] -> 13.7243779412665 | AB321: of:=RANK([.AA321];[.AA$2:.AA$399];0) -> 320
A322: Bedford | B322: 129224 | C322: of:=IF(SUM([.E322:.L322])>0;[.B322];0) -> 129224 | D322: of:=[.C322]/[.C$401] -> 4.86708573595824 | H322: 1 | L322: 1 | M322: of:=[.E322]*[.AC$11]+[.F322]*[.AC$13]+[.G322]*[.AC$15]+[.H322]*[.AC$17]+[.I322]*[.AC$19]+[.J322]*[.AC$21]+[.K322]*[.AC$23]+[.L322]*[.AC$25] -> 1.02390704070172 | N322: of:=IF([.E322]>0;1;0) -> 0 | O322: of:=IF([.F322]>0;1;0) -> 0 | P322: of:=IF([.G322]>0;1;0) -> 0 | Q322: of:=IF([.H322]>0;1;0) -> 1 | R322: of:=IF([.I322]>0;1;0) -> 0 | S322: of:=IF([.J322]>0;1;0) -> 0 | T322: of:=IF([.K322]>0;1;0) -> 0 | U322: of:=IF([.L322]>0;1;0) -> 1 | V322: of:=[.N322]*[.N$402]+[.O322]*[.O$402]+[.P322]*[.P$402]+[.Q322]*[.Q$402]+[.R322]*[.R$402]+[.S322]*[.S$402]+[.T322]*[.T$402]+[.U322]*[.U$402] -> 0.308633066549229 | W322: 23632 | Y322: of:=[.W322]+[.X322] -> 23632 | Z322: of:=[.Y322]/[.Y$401] -> 7.52464601687375 | AA322: of:=[.D322]+[.M322]+[.V322]+[.Z322] -> 13.7242718600829 | AB322: of:=RANK([.AA322];[.AA$2:.AA$399];0) -> 321
A323: W Berks | B323: 121238 | C323: of:=IF(SUM([.E323:.L323])>0;[.B323];0) -> 121238 | D323: of:=[.C323]/[.C$401] -> 4.56630146455848 | H323: 1 | L323: 1 | M323: of:=[.E323]*[.AC$11]+[.F323]*[.AC$13]+[.G323]*[.AC$15]+[.H323]*[.AC$17]+[.I323]*[.AC$19]+[.J323]*[.AC$21]+[.K323]*[.AC$23]+[.L323]*[.AC$25] -> 1.02390704070172 | N323: of:=IF([.E323]>0;1;0) -> 0 | O323: of:=IF([.F323]>0;1;0) -> 0 | P323: of:=IF([.G323]>0;1;0) -> 0 | Q323: of:=IF([.H323]>0;1;0) -> 1 | R323: of:=IF([.I323]>0;1;0) -> 0 | S323: of:=IF([.J323]>0;1;0) -> 0 | T323: of:=IF([.K323]>0;1;0) -> 0 | U323: of:=IF([.L323]>0;1;0) -> 1 | V323: of:=[.N323]*[.N$402]+[.O323]*[.O$402]+[.P323]*[.P$402]+[.Q323]*[.Q$402]+[.R323]*[.R$402]+[.S323]*[.S$402]+[.T323]*[.T$402]+[.U323]*[.U$402] -> 0.308633066549229 | W323: 24570 | Y323: of:=[.W323]+[.X323] -> 24570 | Z323: of:=[.Y323]/[.Y$401] -> 7.82331383863355 | AA323: of:=[.D323]+[.M323]+[.V323]+[.Z323] -> 13.722155410443 | AB323: of:=RANK([.AA323];[.AA$2:.AA$399];0) -> 322
A324: S Somerset | B324: 126528 | C324: of:=IF(SUM([.E324:.L324])>0;[.B324];0) -> 126528 | D324: of:=[.C324]/[.C$401] -> 4.7655437380001 | H324: 1 | L324: 1 | M324: of:=[.E324]*[.AC$11]+[.F324]*[.AC$13]+[.G324]*[.AC$15]+[.H324]*[.AC$17]+[.I324]*[.AC$19]+[.J324]*[.AC$21]+[.K324]*[.AC$23]+[.L324]*[.AC$25] -> 1.02390704070172 | N324: of:=IF([.E324]>0;1;0) -> 0 | O324: of:=IF([.F324]>0;1;0) -> 0 | P324: of:=IF([.G324]>0;1;0) -> 0 | Q324: of:=IF([.H324]>0;1;0) -> 1 | R324: of:=IF([.I324]>0;1;0) -> 0 | S324: of:=IF([.J324]>0;1;0) -> 0 | T324: of:=IF([.K324]>0;1;0) -> 0 | U324: of:=IF([.L324]>0;1;0) -> 1 | V324: of:=[.N324]*[.N$402]+[.O324]*[.O$402]+[.P324]*[.P$402]+[.Q324]*[.Q$402]+[.R324]*[.R$402]+[.S324]*[.S$402]+[.T324]*[.T$402]+[.U324]*[.U$402] -> 0.308633066549229 | W324: 23944 | Y324: of:=[.W324]+[.X324] -> 23944 | Z324: of:=[.Y324]/[.Y$401] -> 7.62398968466593 | AA324: of:=[.D324]+[.M324]+[.V324]+[.Z324] -> 13.722073529917 | AB324: of:=RANK([.AA324];[.AA$2:.AA$399];0) -> 323
A325: Bath and NE Somerset | B325: 134147 | C325: of:=IF(SUM([.E325:.L325])>0;[.B325];0) -> 134147 | D325: of:=[.C325]/[.C$401] -> 5.05250534128018 | H325: 1 | L325: 1 | M325: of:=[.E325]*[.AC$11]+[.F325]*[.AC$13]+[.G325]*[.AC$15]+[.H325]*[.AC$17]+[.I325]*[.AC$19]+[.J325]*[.AC$21]+[.K325]*[.AC$23]+[.L325]*[.AC$25] -> 1.02390704070172 | N325: of:=IF([.E325]>0;1;0) -> 0 | O325: of:=IF([.F325]>0;1;0) -> 0 | P325: of:=IF([.G325]>0;1;0) -> 0 | Q325: of:=IF([.H325]>0;1;0) -> 1 | R325: of:=IF([.I325]>0;1;0) -> 0 | S325: of:=IF([.J325]>0;1;0) -> 0 | T325: of:=IF([.K325]>0;1;0) -> 0 | U325: of:=IF([.L325]>0;1;0) -> 1 | V325: of:=[.N325]*[.N$402]+[.O325]*[.O$402]+[.P325]*[.P$402]+[.Q325]*[.Q$402]+[.R325]*[.R$402]+[.S325]*[.S$402]+[.T325]*[.T$402]+[.U325]*[.U$402] -> 0.308633066549229 | W325: 23012 | Y325: of:=[.W325]+[.X325] -> 23012 | Z325: of:=[.Y325]/[.Y$401] -> 7.32723231805598 | AA325: of:=[.D325]+[.M325]+[.V325]+[.Z325] -> 13.7122777665871 | AB325: of:=RANK([.AA325];[.AA$2:.AA$399];0) -> 324
A326: Lancaster | B326: 107523 | C326: of:=IF(SUM([.E326:.L326])>0;[.B326];0) -> 107523 | D326: of:=[.C326]/[.C$401] -> 4.04974044749766 | H326: 1 | L326: 1 | M326: of:=[.E326]*[.AC$11]+[.F326]*[.AC$13]+[.G326]*[.AC$15]+[.H326]*[.AC$17]+[.I326]*[.AC$19]+[.J326]*[.AC$21]+[.K326]*[.AC$23]+[.L326]*[.AC$25] -> 1.02390704070172 | N326: of:=IF([.E326]>0;1;0) -> 0 | O326: of:=IF([.F326]>0;1;0) -> 0 | P326: of:=IF([.G326]>0;1;0) -> 0 | Q326: of:=IF([.H326]>0;1;0) -> 1 | R326: of:=IF([.I326]>0;1;0) -> 0 | S326: of:=IF([.J326]>0;1;0) -> 0 | T326: of:=IF([.K326]>0;1;0) -> 0 | U326: of:=IF([.L326]>0;1;0) -> 1 | V326: of:=[.N326]*[.N$402]+[.O326]*[.O$402]+[.P326]*[.P$402]+[.Q326]*[.Q$402]+[.R326]*[.R$402]+[.S326]*[.S$402]+[.T326]*[.T$402]+[.U326]*[.U$402] -> 0.308633066549229 | W326: 26155 | Y326: of:=[.W326]+[.X326] -> 26155 | Z326: of:=[.Y326]/[.Y$401] -> 8.32799240738545 | AA326: of:=[.D326]+[.M326]+[.V326]+[.Z326] -> 13.7102729621341 | AB326: of:=RANK([.AA326];[.AA$2:.AA$399];0) -> 325
A327: W Suffolk | B327: of:=40260+81904 -> 122164 | C327: of:=IF(SUM([.E327:.L327])>0;[.B327];0) -> 122164 | D327: of:=[.C327]/[.C$401] -> 4.60117827839722 | H327: 1 | L327: 1 | M327: of:=[.E327]*[.AC$11]+[.F327]*[.AC$13]+[.G327]*[.AC$15]+[.H327]*[.AC$17]+[.I327]*[.AC$19]+[.J327]*[.AC$21]+[.K327]*[.AC$23]+[.L327]*[.AC$25] -> 1.02390704070172 | N327: of:=IF([.E327]>0;1;0) -> 0 | O327: of:=IF([.F327]>0;1;0) -> 0 | P327: of:=IF([.G327]>0;1;0) -> 0 | Q327: of:=IF([.H327]>0;1;0) -> 1 | R327: of:=IF([.I327]>0;1;0) -> 0 | S327: of:=IF([.J327]>0;1;0) -> 0 | T327: of:=IF([.K327]>0;1;0) -> 0 | U327: of:=IF([.L327]>0;1;0) -> 1 | V327: of:=[.N327]*[.N$402]+[.O327]*[.O$402]+[.P327]*[.P$402]+[.Q327]*[.Q$402]+[.R327]*[.R$402]+[.S327]*[.S$402]+[.T327]*[.T$402]+[.U327]*[.U$402] -> 0.308633066549229 | W327: 24413 | Y327: of:=[.W327]+[.X327] -> 24413 | Z327: of:=[.Y327]/[.Y$401] -> 7.77332359554582 | AA327: of:=[.D327]+[.M327]+[.V327]+[.Z327] -> 13.707041981194 | AB327: of:=RANK([.AA327];[.AA$2:.AA$399];0) -> 326
A328: N Lincs | B328: 132652 | C328: of:=IF(SUM([.E328:.L328])>0;[.B328];0) -> 132652 | D328: of:=[.C328]/[.C$401] -> 4.99619774226407 | H328: 1 | L328: 1 | M328: of:=[.E328]*[.AC$11]+[.F328]*[.AC$13]+[.G328]*[.AC$15]+[.H328]*[.AC$17]+[.I328]*[.AC$19]+[.J328]*[.AC$21]+[.K328]*[.AC$23]+[.L328]*[.AC$25] -> 1.02390704070172 | N328: of:=IF([.E328]>0;1;0) -> 0 | O328: of:=IF([.F328]>0;1;0) -> 0 | P328: of:=IF([.G328]>0;1;0) -> 0 | Q328: of:=IF([.H328]>0;1;0) -> 1 | R328: of:=IF([.I328]>0;1;0) -> 0 | S328: of:=IF([.J328]>0;1;0) -> 0 | T328: of:=IF([.K328]>0;1;0) -> 0 | U328: of:=IF([.L328]>0;1;0) -> 1 | V328: of:=[.N328]*[.N$402]+[.O328]*[.O$402]+[.P328]*[.P$402]+[.Q328]*[.Q$402]+[.R328]*[.R$402]+[.S328]*[.S$402]+[.T328]*[.T$402]+[.U328]*[.U$402] -> 0.308633066549229 | W328: 23167 | Y328: of:=[.W328]+[.X328] -> 23167 | Z328: of:=[.Y328]/[.Y$401] -> 7.37658574276042 | AA328: of:=[.D328]+[.M328]+[.V328]+[.Z328] -> 13.7053235922754 | AB328: of:=RANK([.AA328];[.AA$2:.AA$399];0) -> 327
A329: Arun | B329: 123357 | C329: of:=IF(SUM([.E329:.L329])>0;[.B329];0) -> 123357 | D329: of:=[.C329]/[.C$401] -> 4.64611136577262 | H329: 1 | L329: 1 | M329: of:=[.E329]*[.AC$11]+[.F329]*[.AC$13]+[.G329]*[.AC$15]+[.H329]*[.AC$17]+[.I329]*[.AC$19]+[.J329]*[.AC$21]+[.K329]*[.AC$23]+[.L329]*[.AC$25] -> 1.02390704070172 | N329: of:=IF([.E329]>0;1;0) -> 0 | O329: of:=IF([.F329]>0;1;0) -> 0 | P329: of:=IF([.G329]>0;1;0) -> 0 | Q329: of:=IF([.H329]>0;1;0) -> 1 | R329: of:=IF([.I329]>0;1;0) -> 0 | S329: of:=IF([.J329]>0;1;0) -> 0 | T329: of:=IF([.K329]>0;1;0) -> 0 | U329: of:=IF([.L329]>0;1;0) -> 1 | V329: of:=[.N329]*[.N$402]+[.O329]*[.O$402]+[.P329]*[.P$402]+[.Q329]*[.Q$402]+[.R329]*[.R$402]+[.S329]*[.S$402]+[.T329]*[.T$402]+[.U329]*[.U$402] -> 0.308633066549229 | W329: 24256 | Y329: of:=[.W329]+[.X329] -> 24256 | Z329: of:=[.Y329]/[.Y$401] -> 7.7233333524581 | AA329: of:=[.D329]+[.M329]+[.V329]+[.Z329] -> 13.7019848254817 | AB329: of:=RANK([.AA329];[.AA$2:.AA$399];0) -> 328
A330: Horsham | B330: 108615 | C330: of:=IF(SUM([.E330:.L330])>0;[.B330];0) -> 108615 | D330: of:=[.C330]/[.C$401] -> 4.09086947634421 | H330: 1 | L330: 1 | M330: of:=[.E330]*[.AC$11]+[.F330]*[.AC$13]+[.G330]*[.AC$15]+[.H330]*[.AC$17]+[.I330]*[.AC$19]+[.J330]*[.AC$21]+[.K330]*[.AC$23]+[.L330]*[.AC$25] -> 1.02390704070172 | N330: of:=IF([.E330]>0;1;0) -> 0 | O330: of:=IF([.F330]>0;1;0) -> 0 | P330: of:=IF([.G330]>0;1;0) -> 0 | Q330: of:=IF([.H330]>0;1;0) -> 1 | R330: of:=IF([.I330]>0;1;0) -> 0 | S330: of:=IF([.J330]>0;1;0) -> 0 | T330: of:=IF([.K330]>0;1;0) -> 0 | U330: of:=IF([.L330]>0;1;0) -> 1 | V330: of:=[.N330]*[.N$402]+[.O330]*[.O$402]+[.P330]*[.P$402]+[.Q330]*[.Q$402]+[.R330]*[.R$402]+[.S330]*[.S$402]+[.T330]*[.T$402]+[.U330]*[.U$402] -> 0.308633066549229 | W330: 25995 | Y330: of:=[.W330]+[.X330] -> 25995 | Z330: of:=[.Y330]/[.Y$401] -> 8.2770469367228 | AA330: of:=[.D330]+[.M330]+[.V330]+[.Z330] -> 13.700456520318 | AB330: of:=RANK([.AA330];[.AA$2:.AA$399];0) -> 329
A331: Chelmsford | B331: 129628 | C331: of:=IF(SUM([.E331:.L331])>0;[.B331];0) -> 129628 | D331: of:=[.C331]/[.C$401] -> 4.88230197007363 | H331: 1 | L331: 1 | M331: of:=[.E331]*[.AC$11]+[.F331]*[.AC$13]+[.G331]*[.AC$15]+[.H331]*[.AC$17]+[.I331]*[.AC$19]+[.J331]*[.AC$21]+[.K331]*[.AC$23]+[.L331]*[.AC$25] -> 1.02390704070172 | N331: of:=IF([.E331]>0;1;0) -> 0 | O331: of:=IF([.F331]>0;1;0) -> 0 | P331: of:=IF([.G331]>0;1;0) -> 0 | Q331: of:=IF([.H331]>0;1;0) -> 1 | R331: of:=IF([.I331]>0;1;0) -> 0 | S331: of:=IF([.J331]>0;1;0) -> 0 | T331: of:=IF([.K331]>0;1;0) -> 0 | U331: of:=IF([.L331]>0;1;0) -> 1 | V331: of:=[.N331]*[.N$402]+[.O331]*[.O$402]+[.P331]*[.P$402]+[.Q331]*[.Q$402]+[.R331]*[.R$402]+[.S331]*[.S$402]+[.T331]*[.T$402]+[.U331]*[.U$402] -> 0.308633066549229 | W331: 23477 | Y331: of:=[.W331]+[.X331] -> 23477 | Z331: of:=[.Y331]/[.Y$401] -> 7.47529259216931 | AA331: of:=[.D331]+[.M331]+[.V331]+[.Z331] -> 13.6901346694939 | AB331: of:=RANK([.AA331];[.AA$2:.AA$399];0) -> 330
A332: Bromley | B332: 242612 | C332: of:=IF(SUM([.E332:.L332])>0;[.B332];0) -> 242612 | D332: of:=[.C332]/[.C$401] -> 9.13772522574987 | G332: 1 | K332: 1 | M332: of:=[.E332]*[.AC$11]+[.F332]*[.AC$13]+[.G332]*[.AC$15]+[.H332]*[.AC$17]+[.I332]*[.AC$19]+[.J332]*[.AC$21]+[.K332]*[.AC$23]+[.L332]*[.AC$25] -> 2.78326790277077 | N332: of:=IF([.E332]>0;1;0) -> 0 | O332: of:=IF([.F332]>0;1;0) -> 0 | P332: of:=IF([.G332]>0;1;0) -> 1 | Q332: of:=IF([.H332]>0;1;0) -> 0 | R332: of:=IF([.I332]>0;1;0) -> 0 | S332: of:=IF([.J332]>0;1;0) -> 0 | T332: of:=IF([.K332]>0;1;0) -> 1 | U332: of:=IF([.L332]>0;1;0) -> 0 | V332: of:=[.N332]*[.N$402]+[.O332]*[.O$402]+[.P332]*[.P$402]+[.Q332]*[.Q$402]+[.R332]*[.R$402]+[.S332]*[.S$402]+[.T332]*[.T$402]+[.U332]*[.U$402] -> 1.5062883605785 | W332: 755 | Y332: of:=[.W332]+[.X332] -> 755 | Z332: of:=[.Y332]/[.Y$401] -> 0.240398939689391 | AA332: of:=[.D332]+[.M332]+[.V332]+[.Z332] -> 13.6676804287885 | AB332: of:=RANK([.AA332];[.AA$2:.AA$399];0) -> 331
A333: E Herts | B333: 109028 | C333: of:=IF(SUM([.E333:.L333])>0;[.B333];0) -> 109028 | D333: of:=[.C333]/[.C$401] -> 4.10642468597207 | H333: 1 | L333: 1 | M333: of:=[.E333]*[.AC$11]+[.F333]*[.AC$13]+[.G333]*[.AC$15]+[.H333]*[.AC$17]+[.I333]*[.AC$19]+[.J333]*[.AC$21]+[.K333]*[.AC$23]+[.L333]*[.AC$25] -> 1.02390704070172 | N333: of:=IF([.E333]>0;1;0) -> 0 | O333: of:=IF([.F333]>0;1;0) -> 0 | P333: of:=IF([.G333]>0;1;0) -> 0 | Q333: of:=IF([.H333]>0;1;0) -> 1 | R333: of:=IF([.I333]>0;1;0) -> 0 | S333: of:=IF([.J333]>0;1;0) -> 0 | T333: of:=IF([.K333]>0;1;0) -> 0 | U333: of:=IF([.L333]>0;1;0) -> 1 | V333: of:=[.N333]*[.N$402]+[.O333]*[.O$402]+[.P333]*[.P$402]+[.Q333]*[.Q$402]+[.R333]*[.R$402]+[.S333]*[.S$402]+[.T333]*[.T$402]+[.U333]*[.U$402] -> 0.308633066549229 | W333: 25836 | Y333: of:=[.W333]+[.X333] -> 25836 | Z333: of:=[.Y333]/[.Y$401] -> 8.22641987525179 | AA333: of:=[.D333]+[.M333]+[.V333]+[.Z333] -> 13.6653846684748 | AB333: of:=RANK([.AA333];[.AA$2:.AA$399];0) -> 332
A334: E Devon | B334: 118318 | C334: of:=IF(SUM([.E334:.L334])>0;[.B334];0) -> 118318 | D334: of:=[.C334]/[.C$401] -> 4.45632274273438 | H334: 1 | L334: 1 | M334: of:=[.E334]*[.AC$11]+[.F334]*[.AC$13]+[.G334]*[.AC$15]+[.H334]*[.AC$17]+[.I334]*[.AC$19]+[.J334]*[.AC$21]+[.K334]*[.AC$23]+[.L334]*[.AC$25] -> 1.02390704070172 | N334: of:=IF([.E334]>0;1;0) -> 0 | O334: of:=IF([.F334]>0;1;0) -> 0 | P334: of:=IF([.G334]>0;1;0) -> 0 | Q334: of:=IF([.H334]>0;1;0) -> 1 | R334: of:=IF([.I334]>0;1;0) -> 0 | S334: of:=IF([.J334]>0;1;0) -> 0 | T334: of:=IF([.K334]>0;1;0) -> 0 | U334: of:=IF([.L334]>0;1;0) -> 1 | V334: of:=[.N334]*[.N$402]+[.O334]*[.O$402]+[.P334]*[.P$402]+[.Q334]*[.Q$402]+[.R334]*[.R$402]+[.S334]*[.S$402]+[.T334]*[.T$402]+[.U334]*[.U$402] -> 0.308633066549229 | W334: 24727 | Y334: of:=[.W334]+[.X334] -> 24727 | Z334: of:=[.Y334]/[.Y$401] -> 7.87330408172128 | AA334: of:=[.D334]+[.M334]+[.V334]+[.Z334] -> 13.6621669317066 | AB334: of:=RANK([.AA334];[.AA$2:.AA$399];0) -> 333
A335: Wealden | B335: 123548 | C335: of:=IF(SUM([.E335:.L335])>0;[.B335];0) -> 123548 | D335: of:=[.C335]/[.C$401] -> 4.65330517942618 | H335: 1 | L335: 1 | M335: of:=[.E335]*[.AC$11]+[.F335]*[.AC$13]+[.G335]*[.AC$15]+[.H335]*[.AC$17]+[.I335]*[.AC$19]+[.J335]*[.AC$21]+[.K335]*[.AC$23]+[.L335]*[.AC$25] -> 1.02390704070172 | N335: of:=IF([.E335]>0;1;0) -> 0 | O335: of:=IF([.F335]>0;1;0) -> 0 | P335: of:=IF([.G335]>0;1;0) -> 0 | Q335: of:=IF([.H335]>0;1;0) -> 1 | R335: of:=IF([.I335]>0;1;0) -> 0 | S335: of:=IF([.J335]>0;1;0) -> 0 | T335: of:=IF([.K335]>0;1;0) -> 0 | U335: of:=IF([.L335]>0;1;0) -> 1 | V335: of:=[.N335]*[.N$402]+[.O335]*[.O$402]+[.P335]*[.P$402]+[.Q335]*[.Q$402]+[.R335]*[.R$402]+[.S335]*[.S$402]+[.T335]*[.T$402]+[.U335]*[.U$402] -> 0.308633066549229 | W335: 24100 | Y335: of:=[.W335]+[.X335] -> 24100 | Z335: of:=[.Y335]/[.Y$401] -> 7.67366151856201 | AA335: of:=[.D335]+[.M335]+[.V335]+[.Z335] -> 13.6595068052391 | AB335: of:=RANK([.AA335];[.AA$2:.AA$399];0) -> 334
A336: Dacorum | B336: 111340 | C336: of:=IF(SUM([.E336:.L336])>0;[.B336];0) -> 111340 | D336: of:=[.C336]/[.C$401] -> 4.19350372873143 | H336: 1 | L336: 1 | M336: of:=[.E336]*[.AC$11]+[.F336]*[.AC$13]+[.G336]*[.AC$15]+[.H336]*[.AC$17]+[.I336]*[.AC$19]+[.J336]*[.AC$21]+[.K336]*[.AC$23]+[.L336]*[.AC$25] -> 1.02390704070172 | N336: of:=IF([.E336]>0;1;0) -> 0 | O336: of:=IF([.F336]>0;1;0) -> 0 | P336: of:=IF([.G336]>0;1;0) -> 0 | Q336: of:=IF([.H336]>0;1;0) -> 1 | R336: of:=IF([.I336]>0;1;0) -> 0 | S336: of:=IF([.J336]>0;1;0) -> 0 | T336: of:=IF([.K336]>0;1;0) -> 0 | U336: of:=IF([.L336]>0;1;0) -> 1 | V336: of:=[.N336]*[.N$402]+[.O336]*[.O$402]+[.P336]*[.P$402]+[.Q336]*[.Q$402]+[.R336]*[.R$402]+[.S336]*[.S$402]+[.T336]*[.T$402]+[.U336]*[.U$402] -> 0.308633066549229 | W336: 25518 | Y336: of:=[.W336]+[.X336] -> 25518 | Z336: of:=[.Y336]/[.Y$401] -> 8.12516575230977 | AA336: of:=[.D336]+[.M336]+[.V336]+[.Z336] -> 13.6512095882922 | AB336: of:=RANK([.AA336];[.AA$2:.AA$399];0) -> 335
A337: Braintree | B337: 112671 | C337: of:=IF(SUM([.E337:.L337])>0;[.B337];0) -> 112671 | D337: of:=[.C337]/[.C$401] -> 4.24363444063139 | H337: 1 | L337: 1 | M337: of:=[.E337]*[.AC$11]+[.F337]*[.AC$13]+[.G337]*[.AC$15]+[.H337]*[.AC$17]+[.I337]*[.AC$19]+[.J337]*[.AC$21]+[.K337]*[.AC$23]+[.L337]*[.AC$25] -> 1.02390704070172 | N337: of:=IF([.E337]>0;1;0) -> 0 | O337: of:=IF([.F337]>0;1;0) -> 0 | P337: of:=IF([.G337]>0;1;0) -> 0 | Q337: of:=IF([.H337]>0;1;0) -> 1 | R337: of:=IF([.I337]>0;1;0) -> 0 | S337: of:=IF([.J337]>0;1;0) -> 0 | T337: of:=IF([.K337]>0;1;0) -> 0 | U337: of:=IF([.L337]>0;1;0) -> 1 | V337: of:=[.N337]*[.N$402]+[.O337]*[.O$402]+[.P337]*[.P$402]+[.Q337]*[.Q$402]+[.R337]*[.R$402]+[.S337]*[.S$402]+[.T337]*[.T$402]+[.U337]*[.U$402] -> 0.308633066549229 | W337: 25359 | Y337: of:=[.W337]+[.X337] -> 25359 | Z337: of:=[.Y337]/[.Y$401] -> 8.07453869083876 | AA337: of:=[.D337]+[.M337]+[.V337]+[.Z337] -> 13.6507132387211 | AB337: of:=RANK([.AA337];[.AA$2:.AA$399];0) -> 336
A338: Kings Lynn and West Norfolk | B338: 116501 | C338: of:=IF(SUM([.E338:.L338])>0;[.B338];0) -> 116501 | D338: of:=[.C338]/[.C$401] -> 4.38788735316095 | H338: 1 | L338: 1 | M338: of:=[.E338]*[.AC$11]+[.F338]*[.AC$13]+[.G338]*[.AC$15]+[.H338]*[.AC$17]+[.I338]*[.AC$19]+[.J338]*[.AC$21]+[.K338]*[.AC$23]+[.L338]*[.AC$25] -> 1.02390704070172 | N338: of:=IF([.E338]>0;1;0) -> 0 | O338: of:=IF([.F338]>0;1;0) -> 0 | P338: of:=IF([.G338]>0;1;0) -> 0 | Q338: of:=IF([.H338]>0;1;0) -> 1 | R338: of:=IF([.I338]>0;1;0) -> 0 | S338: of:=IF([.J338]>0;1;0) -> 0 | T338: of:=IF([.K338]>0;1;0) -> 0 | U338: of:=IF([.L338]>0;1;0) -> 1 | V338: of:=[.N338]*[.N$402]+[.O338]*[.O$402]+[.P338]*[.P$402]+[.Q338]*[.Q$402]+[.R338]*[.R$402]+[.S338]*[.S$402]+[.T338]*[.T$402]+[.U338]*[.U$402] -> 0.308633066549229 | W338: 24885 | Y338: of:=[.W338]+[.X338] -> 24885 | Z338: of:=[.Y338]/[.Y$401] -> 7.92361273400065 | AA338: of:=[.D338]+[.M338]+[.V338]+[.Z338] -> 13.6440401944126 | AB338: of:=RANK([.AA338];[.AA$2:.AA$399];0) -> 337
A339: E Lindsey | B339: 109353 | C339: of:=IF(SUM([.E339:.L339])>0;[.B339];0) -> 109353 | D339: of:=[.C339]/[.C$401] -> 4.11866546836688 | H339: 1 | L339: 1 | M339: of:=[.E339]*[.AC$11]+[.F339]*[.AC$13]+[.G339]*[.AC$15]+[.H339]*[.AC$17]+[.I339]*[.AC$19]+[.J339]*[.AC$21]+[.K339]*[.AC$23]+[.L339]*[.AC$25] -> 1.02390704070172 | N339: of:=IF([.E339]>0;1;0) -> 0 | O339: of:=IF([.F339]>0;1;0) -> 0 | P339: of:=IF([.G339]>0;1;0) -> 0 | Q339: of:=IF([.H339]>0;1;0) -> 1 | R339: of:=IF([.I339]>0;1;0) -> 0 | S339: of:=IF([.J339]>0;1;0) -> 0 | T339: of:=IF([.K339]>0;1;0) -> 0 | U339: of:=IF([.L339]>0;1;0) -> 1 | V339: of:=[.N339]*[.N$402]+[.O339]*[.O$402]+[.P339]*[.P$402]+[.Q339]*[.Q$402]+[.R339]*[.R$402]+[.S339]*[.S$402]+[.T339]*[.T$402]+[.U339]*[.U$402] -> 0.308633066549229 | W339: 25677 | Y339: of:=[.W339]+[.X339] -> 25677 | Z339: of:=[.Y339]/[.Y$401] -> 8.17579281378078 | AA339: of:=[.D339]+[.M339]+[.V339]+[.Z339] -> 13.6269983893986 | AB339: of:=RANK([.AA339];[.AA$2:.AA$399];0) -> 338
A340: M Sussex | B340: 112869 | C340: of:=IF(SUM([.E340:.L340])>0;[.B340];0) -> 112869 | D340: of:=[.C340]/[.C$401] -> 4.25109190190577 | H340: 1 | L340: 1 | M340: of:=[.E340]*[.AC$11]+[.F340]*[.AC$13]+[.G340]*[.AC$15]+[.H340]*[.AC$17]+[.I340]*[.AC$19]+[.J340]*[.AC$21]+[.K340]*[.AC$23]+[.L340]*[.AC$25] -> 1.02390704070172 | N340: of:=IF([.E340]>0;1;0) -> 0 | O340: of:=IF([.F340]>0;1;0) -> 0 | P340: of:=IF([.G340]>0;1;0) -> 0 | Q340: of:=IF([.H340]>0;1;0) -> 1 | R340: of:=IF([.I340]>0;1;0) -> 0 | S340: of:=IF([.J340]>0;1;0) -> 0 | T340: of:=IF([.K340]>0;1;0) -> 0 | U340: of:=IF([.L340]>0;1;0) -> 1 | V340: of:=[.N340]*[.N$402]+[.O340]*[.O$402]+[.P340]*[.P$402]+[.Q340]*[.Q$402]+[.R340]*[.R$402]+[.S340]*[.S$402]+[.T340]*[.T$402]+[.U340]*[.U$402] -> 0.308633066549229 | W340: 25201 | Y340: of:=[.W340]+[.X340] -> 25201 | Z340: of:=[.Y340]/[.Y$401] -> 8.02423003855939 | AA340: of:=[.D340]+[.M340]+[.V340]+[.Z340] -> 13.6078620477161 | AB340: of:=RANK([.AA340];[.AA$2:.AA$399];0) -> 339
A341: Somerset W & Taunton | B341: of:=85743+27601 -> 113344 | C341: of:=IF(SUM([.E341:.L341])>0;[.B341];0) -> 113344 | D341: of:=[.C341]/[.C$401] -> 4.2689822761751 | H341: 1 | L341: 1 | M341: of:=[.E341]*[.AC$11]+[.F341]*[.AC$13]+[.G341]*[.AC$15]+[.H341]*[.AC$17]+[.I341]*[.AC$19]+[.J341]*[.AC$21]+[.K341]*[.AC$23]+[.L341]*[.AC$25] -> 1.02390704070172 | N341: of:=IF([.E341]>0;1;0) -> 0 | O341: of:=IF([.F341]>0;1;0) -> 0 | P341: of:=IF([.G341]>0;1;0) -> 0 | Q341: of:=IF([.H341]>0;1;0) -> 1 | R341: of:=IF([.I341]>0;1;0) -> 0 | S341: of:=IF([.J341]>0;1;0) -> 0 | T341: of:=IF([.K341]>0;1;0) -> 0 | U341: of:=IF([.L341]>0;1;0) -> 1 | V341: of:=[.N341]*[.N$402]+[.O341]*[.O$402]+[.P341]*[.P$402]+[.Q341]*[.Q$402]+[.R341]*[.R$402]+[.S341]*[.S$402]+[.T341]*[.T$402]+[.U341]*[.U$402] -> 0.308633066549229 | W341: 25043 | Y341: of:=[.W341]+[.X341] -> 25043 | Z341: of:=[.Y341]/[.Y$401] -> 7.97392138628002 | AA341: of:=[.D341]+[.M341]+[.V341]+[.Z341] -> 13.5754437697061 | AB341: of:=RANK([.AA341];[.AA$2:.AA$399];0) -> 340
A342: Ealing | B342: 239592 | C342: of:=IF(SUM([.E342:.L342])>0;[.B342];0) -> 239592 | D342: of:=[.C342]/[.C$401] -> 9.02398010934275 | G342: 1 | K342: 1 | M342: of:=[.E342]*[.AC$11]+[.F342]*[.AC$13]+[.G342]*[.AC$15]+[.H342]*[.AC$17]+[.I342]*[.AC$19]+[.J342]*[.AC$21]+[.K342]*[.AC$23]+[.L342]*[.AC$25] -> 2.78326790277077 | N342: of:=IF([.E342]>0;1;0) -> 0 | O342: of:=IF([.F342]>0;1;0) -> 0 | P342: of:=IF([.G342]>0;1;0) -> 1 | Q342: of:=IF([.H342]>0;1;0) -> 0 | R342: of:=IF([.I342]>0;1;0) -> 0 | S342: of:=IF([.J342]>0;1;0) -> 0 | T342: of:=IF([.K342]>0;1;0) -> 1 | U342: of:=IF([.L342]>0;1;0) -> 0 | V342: of:=[.N342]*[.N$402]+[.O342]*[.O$402]+[.P342]*[.P$402]+[.Q342]*[.Q$402]+[.R342]*[.R$402]+[.S342]*[.S$402]+[.T342]*[.T$402]+[.U342]*[.U$402] -> 1.5062883605785 | W342: 703 | Y342: of:=[.W342]+[.X342] -> 703 | Z342: of:=[.Y342]/[.Y$401] -> 0.223841661724029 | AA342: of:=[.D342]+[.M342]+[.V342]+[.Z342] -> 13.537378034416 | AB342: of:=RANK([.AA342];[.AA$2:.AA$399];0) -> 341
A343: Watford | B343: 70368 | C343: of:=IF(SUM([.E343:.L343])>0;[.B343];0) -> 70368 | D343: of:=[.C343]/[.C$401] -> 2.65033654017759 | G343: 1 | H343: 1 | I343: 1 | K343: 1 | L343: 1 | M343: of:=[.E343]*[.AC$11]+[.F343]*[.AC$13]+[.G343]*[.AC$15]+[.H343]*[.AC$17]+[.I343]*[.AC$19]+[.J343]*[.AC$21]+[.K343]*[.AC$23]+[.L343]*[.AC$25] -> 4.1770743494719 | N343: of:=IF([.E343]>0;1;0) -> 0 | O343: of:=IF([.F343]>0;1;0) -> 0 | P343: of:=IF([.G343]>0;1;0) -> 1 | Q343: of:=IF([.H343]>0;1;0) -> 1 | R343: of:=IF([.I343]>0;1;0) -> 1 | S343: of:=IF([.J343]>0;1;0) -> 0 | T343: of:=IF([.K343]>0;1;0) -> 1 | U343: of:=IF([.L343]>0;1;0) -> 1 | V343: of:=[.N343]*[.N$402]+[.O343]*[.O$402]+[.P343]*[.P$402]+[.Q343]*[.Q$402]+[.R343]*[.R$402]+[.S343]*[.S$402]+[.T343]*[.T$402]+[.U343]*[.U$402] -> 2.03350799196213 | W343: of:=80+14200 -> 14280 | Y343: of:=[.W343]+[.X343] -> 14280 | Z343: of:=[.Y343]/[.Y$401] -> 4.54688325664172 | AA343: of:=[.D343]+[.M343]+[.V343]+[.Z343] -> 13.4078021382533 | AB343: of:=RANK([.AA343];[.AA$2:.AA$399];0) -> 342
A344: Lambeth | B344: 224574 | C344: of:=IF(SUM([.E344:.L344])>0;[.B344];0) -> 224574 | D344: of:=[.C344]/[.C$401] -> 8.45834297086521 | G344: 1 | K344: 1 | M344: of:=[.E344]*[.AC$11]+[.F344]*[.AC$13]+[.G344]*[.AC$15]+[.H344]*[.AC$17]+[.I344]*[.AC$19]+[.J344]*[.AC$21]+[.K344]*[.AC$23]+[.L344]*[.AC$25] -> 2.78326790277077 | N344: of:=IF([.E344]>0;1;0) -> 0 | O344: of:=IF([.F344]>0;1;0) -> 0 | P344: of:=IF([.G344]>0;1;0) -> 1 | Q344: of:=IF([.H344]>0;1;0) -> 0 | R344: of:=IF([.I344]>0;1;0) -> 0 | S344: of:=IF([.J344]>0;1;0) -> 0 | T344: of:=IF([.K344]>0;1;0) -> 1 | U344: of:=IF([.L344]>0;1;0) -> 0 | V344: of:=[.N344]*[.N$402]+[.O344]*[.O$402]+[.P344]*[.P$402]+[.Q344]*[.Q$402]+[.R344]*[.R$402]+[.S344]*[.S$402]+[.T344]*[.T$402]+[.U344]*[.U$402] -> 1.5062883605785 | W344: 1196 | Y344: of:=[.W344]+[.X344] -> 1196 | Z344: of:=[.Y344]/[.Y$401] -> 0.380817393203326 | AA344: of:=[.D344]+[.M344]+[.V344]+[.Z344] -> 13.1287166274178 | AB344: of:=RANK([.AA344];[.AA$2:.AA$399];0) -> 343
A345: Cambridge | B345: 89167 | C345: of:=IF(SUM([.E345:.L345])>0;[.B345];0) -> 89167 | D345: of:=[.C345]/[.C$401] -> 3.35838105783901 | G345: 1 | H345: 1 | I345: 1 | K345: 1 | L345: 1 | M345: of:=[.E345]*[.AC$11]+[.F345]*[.AC$13]+[.G345]*[.AC$15]+[.H345]*[.AC$17]+[.I345]*[.AC$19]+[.J345]*[.AC$21]+[.K345]*[.AC$23]+[.L345]*[.AC$25] -> 4.1770743494719 | N345: of:=IF([.E345]>0;1;0) -> 0 | O345: of:=IF([.F345]>0;1;0) -> 0 | P345: of:=IF([.G345]>0;1;0) -> 1 | Q345: of:=IF([.H345]>0;1;0) -> 1 | R345: of:=IF([.I345]>0;1;0) -> 1 | S345: of:=IF([.J345]>0;1;0) -> 0 | T345: of:=IF([.K345]>0;1;0) -> 1 | U345: of:=IF([.L345]>0;1;0) -> 1 | V345: of:=[.N345]*[.N$402]+[.O345]*[.O$402]+[.P345]*[.P$402]+[.Q345]*[.Q$402]+[.R345]*[.R$402]+[.S345]*[.S$402]+[.T345]*[.T$402]+[.U345]*[.U$402] -> 2.03350799196213 | W345: of:=204+10737 -> 10941 | Y345: of:=[.W345]+[.X345] -> 10941 | Z345: of:=[.Y345]/[.Y$401] -> 3.4837149657505 | AA345: of:=[.D345]+[.M345]+[.V345]+[.Z345] -> 13.0526783650235 | AB345: of:=RANK([.AA345];[.AA$2:.AA$399];0) -> 344
A346: Redbridge | B346: 200766 | C346: of:=IF(SUM([.E346:.L346])>0;[.B346];0) -> 200766 | D346: of:=[.C346]/[.C$401] -> 7.56163974854046 | G346: 1 | K346: 1 | M346: of:=[.E346]*[.AC$11]+[.F346]*[.AC$13]+[.G346]*[.AC$15]+[.H346]*[.AC$17]+[.I346]*[.AC$19]+[.J346]*[.AC$21]+[.K346]*[.AC$23]+[.L346]*[.AC$25] -> 2.78326790277077 | N346: of:=IF([.E346]>0;1;0) -> 0 | O346: of:=IF([.F346]>0;1;0) -> 0 | P346: of:=IF([.G346]>0;1;0) -> 1 | Q346: of:=IF([.H346]>0;1;0) -> 0 | R346: of:=IF([.I346]>0;1;0) -> 0 | S346: of:=IF([.J346]>0;1;0) -> 0 | T346: of:=IF([.K346]>0;1;0) -> 1 | U346: of:=IF([.L346]>0;1;0) -> 0 | V346: of:=[.N346]*[.N$402]+[.O346]*[.O$402]+[.P346]*[.P$402]+[.Q346]*[.Q$402]+[.R346]*[.R$402]+[.S346]*[.S$402]+[.T346]*[.T$402]+[.U346]*[.U$402] -> 1.5062883605785 | W346: 3494 | Y346: of:=[.W346]+[.X346] -> 3494 | Z346: of:=[.Y346]/[.Y$401] -> 1.11252171559567 | AA346: of:=[.D346]+[.M346]+[.V346]+[.Z346] -> 12.9637177274854 | AB346: of:=RANK([.AA346];[.AA$2:.AA$399];0) -> 345
A347: Hillingdon | B347: 198937 | C347: of:=IF(SUM([.E347:.L347])>0;[.B347];0) -> 198937 | D347: of:=[.C347]/[.C$401] -> 7.49275239161707 | G347: 1 | K347: 1 | M347: of:=[.E347]*[.AC$11]+[.F347]*[.AC$13]+[.G347]*[.AC$15]+[.H347]*[.AC$17]+[.I347]*[.AC$19]+[.J347]*[.AC$21]+[.K347]*[.AC$23]+[.L347]*[.AC$25] -> 2.78326790277077 | N347: of:=IF([.E347]>0;1;0) -> 0 | O347: of:=IF([.F347]>0;1;0) -> 0 | P347: of:=IF([.G347]>0;1;0) -> 1 | Q347: of:=IF([.H347]>0;1;0) -> 0 | R347: of:=IF([.I347]>0;1;0) -> 0 | S347: of:=IF([.J347]>0;1;0) -> 0 | T347: of:=IF([.K347]>0;1;0) -> 1 | U347: of:=IF([.L347]>0;1;0) -> 0 | V347: of:=[.N347]*[.N$402]+[.O347]*[.O$402]+[.P347]*[.P$402]+[.Q347]*[.Q$402]+[.R347]*[.R$402]+[.S347]*[.S$402]+[.T347]*[.T$402]+[.U347]*[.U$402] -> 1.5062883605785 | W347: 3541 | Y347: of:=[.W347]+[.X347] -> 3541 | Z347: of:=[.Y347]/[.Y$401] -> 1.12748694760282 | AA347: of:=[.D347]+[.M347]+[.V347]+[.Z347] -> 12.9097956025692 | AB347: of:=RANK([.AA347];[.AA$2:.AA$399];0) -> 346
A348: Bristol | B348: 324786 | C348: of:=IF(SUM([.E348:.L348])>0;[.B348];0) -> 324786 | D348: of:=[.C348]/[.C$401] -> 12.2327223103985 | I348: 1 | M348: of:=[.E348]*[.AC$11]+[.F348]*[.AC$13]+[.G348]*[.AC$15]+[.H348]*[.AC$17]+[.I348]*[.AC$19]+[.J348]*[.AC$21]+[.K348]*[.AC$23]+[.L348]*[.AC$25] -> 0.369899405999412 | N348: of:=IF([.E348]>0;1;0) -> 0 | O348: of:=IF([.F348]>0;1;0) -> 0 | P348: of:=IF([.G348]>0;1;0) -> 0 | Q348: of:=IF([.H348]>0;1;0) -> 0 | R348: of:=IF([.I348]>0;1;0) -> 1 | S348: of:=IF([.J348]>0;1;0) -> 0 | T348: of:=IF([.K348]>0;1;0) -> 0 | U348: of:=IF([.L348]>0;1;0) -> 0 | V348: of:=[.N348]*[.N$402]+[.O348]*[.O$402]+[.P348]*[.P$402]+[.Q348]*[.Q$402]+[.R348]*[.R$402]+[.S348]*[.S$402]+[.T348]*[.T$402]+[.U348]*[.U$402] -> 0.218586564834393 | Y348: of:=[.W348]+[.X348] -> 0 | Z348: of:=[.Y348]/[.Y$401] -> 0 | AA348: of:=[.D348]+[.M348]+[.V348]+[.Z348] -> 12.8212082812323 | AB348: of:=RANK([.AA348];[.AA$2:.AA$399];0) -> 347
A349: Portsmouth | B349: 145176 | C349: of:=IF(SUM([.E349:.L349])>0;[.B349];0) -> 145176 | D349: of:=[.C349]/[.C$401] -> 5.46790099984116 | H349: 1 | I349: 1 | K349: 1 | L349: 1 | M349: of:=[.E349]*[.AC$11]+[.F349]*[.AC$13]+[.G349]*[.AC$15]+[.H349]*[.AC$17]+[.I349]*[.AC$19]+[.J349]*[.AC$21]+[.K349]*[.AC$23]+[.L349]*[.AC$25] -> 1.44386688758112 | N349: of:=IF([.E349]>0;1;0) -> 0 | O349: of:=IF([.F349]>0;1;0) -> 0 | P349: of:=IF([.G349]>0;1;0) -> 0 | Q349: of:=IF([.H349]>0;1;0) -> 1 | R349: of:=IF([.I349]>0;1;0) -> 1 | S349: of:=IF([.J349]>0;1;0) -> 0 | T349: of:=IF([.K349]>0;1;0) -> 1 | U349: of:=IF([.L349]>0;1;0) -> 1 | V349: of:=[.N349]*[.N$402]+[.O349]*[.O$402]+[.P349]*[.P$402]+[.Q349]*[.Q$402]+[.R349]*[.R$402]+[.S349]*[.S$402]+[.T349]*[.T$402]+[.U349]*[.U$402] -> 0.548043049303238 | W349: 16630 | Y349: of:=[.W349]+[.X349] -> 16630 | Z349: of:=[.Y349]/[.Y$401] -> 5.29514485699943 | AA349: of:=[.D349]+[.M349]+[.V349]+[.Z349] -> 12.7549557937249 | AB349: of:=RANK([.AA349];[.AA$2:.AA$399];0) -> 348
A350: Welwyn Hatfield | B350: 80064 | C350: of:=IF(SUM([.E350:.L350])>0;[.B350];0) -> 80064 | D350: of:=[.C350]/[.C$401] -> 3.01552615894695 | G350: 1 | H350: 1 | I350: 1 | K350: 1 | L350: 1 | M350: of:=[.E350]*[.AC$11]+[.F350]*[.AC$13]+[.G350]*[.AC$15]+[.H350]*[.AC$17]+[.I350]*[.AC$19]+[.J350]*[.AC$21]+[.K350]*[.AC$23]+[.L350]*[.AC$25] -> 4.1770743494719 | N350: of:=IF([.E350]>0;1;0) -> 0 | O350: of:=IF([.F350]>0;1;0) -> 0 | P350: of:=IF([.G350]>0;1;0) -> 1 | Q350: of:=IF([.H350]>0;1;0) -> 1 | R350: of:=IF([.I350]>0;1;0) -> 1 | S350: of:=IF([.J350]>0;1;0) -> 0 | T350: of:=IF([.K350]>0;1;0) -> 1 | U350: of:=IF([.L350]>0;1;0) -> 1 | V350: of:=[.N350]*[.N$402]+[.O350]*[.O$402]+[.P350]*[.P$402]+[.Q350]*[.Q$402]+[.R350]*[.R$402]+[.S350]*[.S$402]+[.T350]*[.T$402]+[.U350]*[.U$402] -> 2.03350799196213 | W350: of:=333+10625 -> 10958 | Y350: of:=[.W350]+[.X350] -> 10958 | Z350: of:=[.Y350]/[.Y$401] -> 3.4891279220084 | AA350: of:=[.D350]+[.M350]+[.V350]+[.Z350] -> 12.7152364223894 | AB350: of:=RANK([.AA350];[.AA$2:.AA$399];0) -> 349
A351: Hounslow | B351: 188294 | C351: of:=IF(SUM([.E351:.L351])>0;[.B351];0) -> 188294 | D351: of:=[.C351]/[.C$401] -> 7.09189501614654 | G351: 1 | K351: 1 | M351: of:=[.E351]*[.AC$11]+[.F351]*[.AC$13]+[.G351]*[.AC$15]+[.H351]*[.AC$17]+[.I351]*[.AC$19]+[.J351]*[.AC$21]+[.K351]*[.AC$23]+[.L351]*[.AC$25] -> 2.78326790277077 | N351: of:=IF([.E351]>0;1;0) -> 0 | O351: of:=IF([.F351]>0;1;0) -> 0 | P351: of:=IF([.G351]>0;1;0) -> 1 | Q351: of:=IF([.H351]>0;1;0) -> 0 | R351: of:=IF([.I351]>0;1;0) -> 0 | S351: of:=IF([.J351]>0;1;0) -> 0 | T351: of:=IF([.K351]>0;1;0) -> 1 | U351: of:=IF([.L351]>0;1;0) -> 0 | V351: of:=[.N351]*[.N$402]+[.O351]*[.O$402]+[.P351]*[.P$402]+[.Q351]*[.Q$402]+[.R351]*[.R$402]+[.S351]*[.S$402]+[.T351]*[.T$402]+[.U351]*[.U$402] -> 1.5062883605785 | W351: 3636 | Y351: of:=[.W351]+[.X351] -> 3636 | Z351: of:=[.Y351]/[.Y$401] -> 1.15773582080878 | AA351: of:=[.D351]+[.M351]+[.V351]+[.Z351] -> 12.5391871003046 | AB351: of:=RANK([.AA351];[.AA$2:.AA$399];0) -> 350
A352: Harrow | B352: 185436 | C352: of:=IF(SUM([.E352:.L352])>0;[.B352];0) -> 185436 | D352: of:=[.C352]/[.C$401] -> 6.98425145896391 | G352: 1 | K352: 1 | M352: of:=[.E352]*[.AC$11]+[.F352]*[.AC$13]+[.G352]*[.AC$15]+[.H352]*[.AC$17]+[.I352]*[.AC$19]+[.J352]*[.AC$21]+[.K352]*[.AC$23]+[.L352]*[.AC$25] -> 2.78326790277077 | N352: of:=IF([.E352]>0;1;0) -> 0 | O352: of:=IF([.F352]>0;1;0) -> 0 | P352: of:=IF([.G352]>0;1;0) -> 1 | Q352: of:=IF([.H352]>0;1;0) -> 0 | R352: of:=IF([.I352]>0;1;0) -> 0 | S352: of:=IF([.J352]>0;1;0) -> 0 | T352: of:=IF([.K352]>0;1;0) -> 1 | U352: of:=IF([.L352]>0;1;0) -> 0 | V352: of:=[.N352]*[.N$402]+[.O352]*[.O$402]+[.P352]*[.P$402]+[.Q352]*[.Q$402]+[.R352]*[.R$402]+[.S352]*[.S$402]+[.T352]*[.T$402]+[.U352]*[.U$402] -> 1.5062883605785 | W352: 3684 | Y352: of:=[.W352]+[.X352] -> 3684 | Z352: of:=[.Y352]/[.Y$401] -> 1.17301946200757 | AA352: of:=[.D352]+[.M352]+[.V352]+[.Z352] -> 12.4468271843208 | AB352: of:=RANK([.AA352];[.AA$2:.AA$399];0) -> 351
A353: Greenwich | B353: 183678 | C353: of:=IF(SUM([.E353:.L353])>0;[.B353];0) -> 183678 | D353: of:=[.C353]/[.C$401] -> 6.91803824219447 | G353: 1 | K353: 1 | M353: of:=[.E353]*[.AC$11]+[.F353]*[.AC$13]+[.G353]*[.AC$15]+[.H353]*[.AC$17]+[.I353]*[.AC$19]+[.J353]*[.AC$21]+[.K353]*[.AC$23]+[.L353]*[.AC$25] -> 2.78326790277077 | N353: of:=IF([.E353]>0;1;0) -> 0 | O353: of:=IF([.F353]>0;1;0) -> 0 | P353: of:=IF([.G353]>0;1;0) -> 1 | Q353: of:=IF([.H353]>0;1;0) -> 0 | R353: of:=IF([.I353]>0;1;0) -> 0 | S353: of:=IF([.J353]>0;1;0) -> 0 | T353: of:=IF([.K353]>0;1;0) -> 1 | U353: of:=IF([.L353]>0;1;0) -> 0 | V353: of:=[.N353]*[.N$402]+[.O353]*[.O$402]+[.P353]*[.P$402]+[.Q353]*[.Q$402]+[.R353]*[.R$402]+[.S353]*[.S$402]+[.T353]*[.T$402]+[.U353]*[.U$402] -> 1.5062883605785 | W353: 3708 | Y353: of:=[.W353]+[.X353] -> 3708 | Z353: of:=[.Y353]/[.Y$401] -> 1.18066128260697 | AA353: of:=[.D353]+[.M353]+[.V353]+[.Z353] -> 12.3882557881507 | AB353: of:=RANK([.AA353];[.AA$2:.AA$399];0) -> 352
A354: Enfield | B354: 209805 | C354: of:=IF(SUM([.E354:.L354])>0;[.B354];0) -> 209805 | D354: of:=[.C354]/[.C$401] -> 7.90208415489939 | G354: 1 | K354: 1 | M354: of:=[.E354]*[.AC$11]+[.F354]*[.AC$13]+[.G354]*[.AC$15]+[.H354]*[.AC$17]+[.I354]*[.AC$19]+[.J354]*[.AC$21]+[.K354]*[.AC$23]+[.L354]*[.AC$25] -> 2.78326790277077 | N354: of:=IF([.E354]>0;1;0) -> 0 | O354: of:=IF([.F354]>0;1;0) -> 0 | P354: of:=IF([.G354]>0;1;0) -> 1 | Q354: of:=IF([.H354]>0;1;0) -> 0 | R354: of:=IF([.I354]>0;1;0) -> 0 | S354: of:=IF([.J354]>0;1;0) -> 0 | T354: of:=IF([.K354]>0;1;0) -> 1 | U354: of:=IF([.L354]>0;1;0) -> 0 | V354: of:=[.N354]*[.N$402]+[.O354]*[.O$402]+[.P354]*[.P$402]+[.Q354]*[.Q$402]+[.R354]*[.R$402]+[.S354]*[.S$402]+[.T354]*[.T$402]+[.U354]*[.U$402] -> 1.5062883605785 | W354: 592 | Y354: of:=[.W354]+[.X354] -> 592 | Z354: of:=[.Y354]/[.Y$401] -> 0.188498241451814 | AA354: of:=[.D354]+[.M354]+[.V354]+[.Z354] -> 12.3801386597005 | AB354: of:=RANK([.AA354];[.AA$2:.AA$399];0) -> 353
A355: Waltham Forest | B355: 182033 | C355: of:=IF(SUM([.E355:.L355])>0;[.B355];0) -> 182033 | D355: of:=[.C355]/[.C$401] -> 6.85608105130383 | G355: 1 | K355: 1 | M355: of:=[.E355]*[.AC$11]+[.F355]*[.AC$13]+[.G355]*[.AC$15]+[.H355]*[.AC$17]+[.I355]*[.AC$19]+[.J355]*[.AC$21]+[.K355]*[.AC$23]+[.L355]*[.AC$25] -> 2.78326790277077 | N355: of:=IF([.E355]>0;1;0) -> 0 | O355: of:=IF([.F355]>0;1;0) -> 0 | P355: of:=IF([.G355]>0;1;0) -> 1 | Q355: of:=IF([.H355]>0;1;0) -> 0 | R355: of:=IF([.I355]>0;1;0) -> 0 | S355: of:=IF([.J355]>0;1;0) -> 0 | T355: of:=IF([.K355]>0;1;0) -> 1 | U355: of:=IF([.L355]>0;1;0) -> 0 | V355: of:=[.N355]*[.N$402]+[.O355]*[.O$402]+[.P355]*[.P$402]+[.Q355]*[.Q$402]+[.R355]*[.R$402]+[.S355]*[.S$402]+[.T355]*[.T$402]+[.U355]*[.U$402] -> 1.5062883605785 | W355: 3732 | Y355: of:=[.W355]+[.X355] -> 3732 | Z355: of:=[.Y355]/[.Y$401] -> 1.18830310320637 | AA355: of:=[.D355]+[.M355]+[.V355]+[.Z355] -> 12.3339404178595 | AB355: of:=RANK([.AA355];[.AA$2:.AA$399];0) -> 354
A356: Newham | B356: 205802 | C356: of:=IF(SUM([.E356:.L356])>0;[.B356];0) -> 205802 | D356: of:=[.C356]/[.C$401] -> 7.75131537974121 | G356: 1 | K356: 1 | M356: of:=[.E356]*[.AC$11]+[.F356]*[.AC$13]+[.G356]*[.AC$15]+[.H356]*[.AC$17]+[.I356]*[.AC$19]+[.J356]*[.AC$21]+[.K356]*[.AC$23]+[.L356]*[.AC$25] -> 2.78326790277077 | N356: of:=IF([.E356]>0;1;0) -> 0 | O356: of:=IF([.F356]>0;1;0) -> 0 | P356: of:=IF([.G356]>0;1;0) -> 1 | Q356: of:=IF([.H356]>0;1;0) -> 0 | R356: of:=IF([.I356]>0;1;0) -> 0 | S356: of:=IF([.J356]>0;1;0) -> 0 | T356: of:=IF([.K356]>0;1;0) -> 1 | U356: of:=IF([.L356]>0;1;0) -> 0 | V356: of:=[.N356]*[.N$402]+[.O356]*[.O$402]+[.P356]*[.P$402]+[.Q356]*[.Q$402]+[.R356]*[.R$402]+[.S356]*[.S$402]+[.T356]*[.T$402]+[.U356]*[.U$402] -> 1.5062883605785 | W356: 398 | Y356: of:=[.W356]+[.X356] -> 398 | Z356: of:=[.Y356]/[.Y$401] -> 0.126726858273348 | AA356: of:=[.D356]+[.M356]+[.V356]+[.Z356] -> 12.1675985013638 | AB356: of:=RANK([.AA356];[.AA$2:.AA$399];0) -> 355
A357: Bexley | B357: 173409 | C357: of:=IF(SUM([.E357:.L357])>0;[.B357];0) -> 173409 | D357: of:=[.C357]/[.C$401] -> 6.53126718246442 | G357: 1 | K357: 1 | M357: of:=[.E357]*[.AC$11]+[.F357]*[.AC$13]+[.G357]*[.AC$15]+[.H357]*[.AC$17]+[.I357]*[.AC$19]+[.J357]*[.AC$21]+[.K357]*[.AC$23]+[.L357]*[.AC$25] -> 2.78326790277077 | N357: of:=IF([.E357]>0;1;0) -> 0 | O357: of:=IF([.F357]>0;1;0) -> 0 | P357: of:=IF([.G357]>0;1;0) -> 1 | Q357: of:=IF([.H357]>0;1;0) -> 0 | R357: of:=IF([.I357]>0;1;0) -> 0 | S357: of:=IF([.J357]>0;1;0) -> 0 | T357: of:=IF([.K357]>0;1;0) -> 1 | U357: of:=IF([.L357]>0;1;0) -> 0 | V357: of:=[.N357]*[.N$402]+[.O357]*[.O$402]+[.P357]*[.P$402]+[.Q357]*[.Q$402]+[.R357]*[.R$402]+[.S357]*[.S$402]+[.T357]*[.T$402]+[.U357]*[.U$402] -> 1.5062883605785 | W357: 3828 | Y357: of:=[.W357]+[.X357] -> 3828 | Z357: of:=[.Y357]/[.Y$401] -> 1.21887038560396 | AA357: of:=[.D357]+[.M357]+[.V357]+[.Z357] -> 12.0396938314177 | AB357: of:=RANK([.AA357];[.AA$2:.AA$399];0) -> 356
A358: Thurrock | B358: 118885 | C358: of:=IF(SUM([.E358:.L358])>0;[.B358];0) -> 118885 | D358: of:=[.C358]/[.C$401] -> 4.47767820002009 | H358: 1 | I358: 1 | K358: 1 | L358: 1 | M358: of:=[.E358]*[.AC$11]+[.F358]*[.AC$13]+[.G358]*[.AC$15]+[.H358]*[.AC$17]+[.I358]*[.AC$19]+[.J358]*[.AC$21]+[.K358]*[.AC$23]+[.L358]*[.AC$25] -> 1.44386688758112 | N358: of:=IF([.E358]>0;1;0) -> 0 | O358: of:=IF([.F358]>0;1;0) -> 0 | P358: of:=IF([.G358]>0;1;0) -> 0 | Q358: of:=IF([.H358]>0;1;0) -> 1 | R358: of:=IF([.I358]>0;1;0) -> 1 | S358: of:=IF([.J358]>0;1;0) -> 0 | T358: of:=IF([.K358]>0;1;0) -> 1 | U358: of:=IF([.L358]>0;1;0) -> 1 | V358: of:=[.N358]*[.N$402]+[.O358]*[.O$402]+[.P358]*[.P$402]+[.Q358]*[.Q$402]+[.R358]*[.R$402]+[.S358]*[.S$402]+[.T358]*[.T$402]+[.U358]*[.U$402] -> 0.548043049303238 | W358: 16752 | Y358: of:=[.W358]+[.X358] -> 16752 | Z358: of:=[.Y358]/[.Y$401] -> 5.3339907783797 | AA358: of:=[.D358]+[.M358]+[.V358]+[.Z358] -> 11.8035789152841 | AB358: of:=RANK([.AA358];[.AA$2:.AA$399];0) -> 357
A359: Tower Hamlets | B359: 188615 | C359: of:=IF(SUM([.E359:.L359])>0;[.B359];0) -> 188615 | D359: of:=[.C359]/[.C$401] -> 7.10398514275803 | G359: 1 | K359: 1 | M359: of:=[.E359]*[.AC$11]+[.F359]*[.AC$13]+[.G359]*[.AC$15]+[.H359]*[.AC$17]+[.I359]*[.AC$19]+[.J359]*[.AC$21]+[.K359]*[.AC$23]+[.L359]*[.AC$25] -> 2.78326790277077 | N359: of:=IF([.E359]>0;1;0) -> 0 | O359: of:=IF([.F359]>0;1;0) -> 0 | P359: of:=IF([.G359]>0;1;0) -> 1 | Q359: of:=IF([.H359]>0;1;0) -> 0 | R359: of:=IF([.I359]>0;1;0) -> 0 | S359: of:=IF([.J359]>0;1;0) -> 0 | T359: of:=IF([.K359]>0;1;0) -> 1 | U359: of:=IF([.L359]>0;1;0) -> 0 | V359: of:=[.N359]*[.N$402]+[.O359]*[.O$402]+[.P359]*[.P$402]+[.Q359]*[.Q$402]+[.R359]*[.R$402]+[.S359]*[.S$402]+[.T359]*[.T$402]+[.U359]*[.U$402] -> 1.5062883605785 | W359: 611 | Y359: of:=[.W359]+[.X359] -> 611 | Z359: of:=[.Y359]/[.Y$401] -> 0.194548016093004 | AA359: of:=[.D359]+[.M359]+[.V359]+[.Z359] -> 11.5880894222003 | AB359: of:=RANK([.AA359];[.AA$2:.AA$399];0) -> 358
A360: Merton | B360: 151599 | C360: of:=IF(SUM([.E360:.L360])>0;[.B360];0) -> 151599 | D360: of:=[.C360]/[.C$401] -> 5.70981652390836 | G360: 1 | K360: 1 | M360: of:=[.E360]*[.AC$11]+[.F360]*[.AC$13]+[.G360]*[.AC$15]+[.H360]*[.AC$17]+[.I360]*[.AC$19]+[.J360]*[.AC$21]+[.K360]*[.AC$23]+[.L360]*[.AC$25] -> 2.78326790277077 | N360: of:=IF([.E360]>0;1;0) -> 0 | O360: of:=IF([.F360]>0;1;0) -> 0 | P360: of:=IF([.G360]>0;1;0) -> 1 | Q360: of:=IF([.H360]>0;1;0) -> 0 | R360: of:=IF([.I360]>0;1;0) -> 0 | S360: of:=IF([.J360]>0;1;0) -> 0 | T360: of:=IF([.K360]>0;1;0) -> 1 | U360: of:=IF([.L360]>0;1;0) -> 0 | V360: of:=[.N360]*[.N$402]+[.O360]*[.O$402]+[.P360]*[.P$402]+[.Q360]*[.Q$402]+[.R360]*[.R$402]+[.S360]*[.S$402]+[.T360]*[.T$402]+[.U360]*[.U$402] -> 1.5062883605785 | W360: 3999 | Y360: of:=[.W360]+[.X360] -> 3999 | Z360: of:=[.Y360]/[.Y$401] -> 1.27331835737467 | AA360: of:=[.D360]+[.M360]+[.V360]+[.Z360] -> 11.2726911446323 | AB360: of:=RANK([.AA360];[.AA$2:.AA$399];0) -> 359
A361: Islington | B361: 149018 | C361: of:=IF(SUM([.E361:.L361])>0;[.B361];0) -> 149018 | D361: of:=[.C361]/[.C$401] -> 5.61260587972068 | G361: 1 | K361: 1 | M361: of:=[.E361]*[.AC$11]+[.F361]*[.AC$13]+[.G361]*[.AC$15]+[.H361]*[.AC$17]+[.I361]*[.AC$19]+[.J361]*[.AC$21]+[.K361]*[.AC$23]+[.L361]*[.AC$25] -> 2.78326790277077 | N361: of:=IF([.E361]>0;1;0) -> 0 | O361: of:=IF([.F361]>0;1;0) -> 0 | P361: of:=IF([.G361]>0;1;0) -> 1 | Q361: of:=IF([.H361]>0;1;0) -> 0 | R361: of:=IF([.I361]>0;1;0) -> 0 | S361: of:=IF([.J361]>0;1;0) -> 0 | T361: of:=IF([.K361]>0;1;0) -> 1 | U361: of:=IF([.L361]>0;1;0) -> 0 | V361: of:=[.N361]*[.N$402]+[.O361]*[.O$402]+[.P361]*[.P$402]+[.Q361]*[.Q$402]+[.R361]*[.R$402]+[.S361]*[.S$402]+[.T361]*[.T$402]+[.U361]*[.U$402] -> 1.5062883605785 | W361: 3974 | Y361: of:=[.W361]+[.X361] -> 3974 | Z361: of:=[.Y361]/[.Y$401] -> 1.26535812758363 | AA361: of:=[.D361]+[.M361]+[.V361]+[.Z361] -> 11.1675202706536 | AB361: of:=RANK([.AA361];[.AA$2:.AA$399];0) -> 360
A362: Haringey | B362: 172609 | C362: of:=IF(SUM([.E362:.L362])>0;[.B362];0) -> 172609 | D362: of:=[.C362]/[.C$401] -> 6.50113602580029 | G362: 1 | K362: 1 | M362: of:=[.E362]*[.AC$11]+[.F362]*[.AC$13]+[.G362]*[.AC$15]+[.H362]*[.AC$17]+[.I362]*[.AC$19]+[.J362]*[.AC$21]+[.K362]*[.AC$23]+[.L362]*[.AC$25] -> 2.78326790277077 | N362: of:=IF([.E362]>0;1;0) -> 0 | O362: of:=IF([.F362]>0;1;0) -> 0 | P362: of:=IF([.G362]>0;1;0) -> 1 | Q362: of:=IF([.H362]>0;1;0) -> 0 | R362: of:=IF([.I362]>0;1;0) -> 0 | S362: of:=IF([.J362]>0;1;0) -> 0 | T362: of:=IF([.K362]>0;1;0) -> 1 | U362: of:=IF([.L362]>0;1;0) -> 0 | V362: of:=[.N362]*[.N$402]+[.O362]*[.O$402]+[.P362]*[.P$402]+[.Q362]*[.Q$402]+[.R362]*[.R$402]+[.S362]*[.S$402]+[.T362]*[.T$402]+[.U362]*[.U$402] -> 1.5062883605785 | W362: 712 | Y362: of:=[.W362]+[.X362] -> 712 | Z362: of:=[.Y362]/[.Y$401] -> 0.226707344448803 | AA362: of:=[.D362]+[.M362]+[.V362]+[.Z362] -> 11.0173996335984 | AB362: of:=RANK([.AA362];[.AA$2:.AA$399];0) -> 361
A363: Camden | B363: 143981 | C363: of:=IF(SUM([.E363:.L363])>0;[.B363];0) -> 143981 | D363: of:=[.C363]/[.C$401] -> 5.4228925845741 | G363: 1 | K363: 1 | M363: of:=[.E363]*[.AC$11]+[.F363]*[.AC$13]+[.G363]*[.AC$15]+[.H363]*[.AC$17]+[.I363]*[.AC$19]+[.J363]*[.AC$21]+[.K363]*[.AC$23]+[.L363]*[.AC$25] -> 2.78326790277077 | N363: of:=IF([.E363]>0;1;0) -> 0 | O363: of:=IF([.F363]>0;1;0) -> 0 | P363: of:=IF([.G363]>0;1;0) -> 1 | Q363: of:=IF([.H363]>0;1;0) -> 0 | R363: of:=IF([.I363]>0;1;0) -> 0 | S363: of:=IF([.J363]>0;1;0) -> 0 | T363: of:=IF([.K363]>0;1;0) -> 1 | U363: of:=IF([.L363]>0;1;0) -> 0 | V363: of:=[.N363]*[.N$402]+[.O363]*[.O$402]+[.P363]*[.P$402]+[.Q363]*[.Q$402]+[.R363]*[.R$402]+[.S363]*[.S$402]+[.T363]*[.T$402]+[.U363]*[.U$402] -> 1.5062883605785 | W363: 3950 | Y363: of:=[.W363]+[.X363] -> 3950 | Z363: of:=[.Y363]/[.Y$401] -> 1.25771630698423 | AA363: of:=[.D363]+[.M363]+[.V363]+[.Z363] -> 10.9701651549076 | AB363: of:=RANK([.AA363];[.AA$2:.AA$399];0) -> 362
A364: Hackney | B364: 174143 | C364: of:=IF(SUM([.E364:.L364])>0;[.B364];0) -> 174143 | D364: of:=[.C364]/[.C$401] -> 6.55891251870377 | G364: 1 | K364: 1 | M364: of:=[.E364]*[.AC$11]+[.F364]*[.AC$13]+[.G364]*[.AC$15]+[.H364]*[.AC$17]+[.I364]*[.AC$19]+[.J364]*[.AC$21]+[.K364]*[.AC$23]+[.L364]*[.AC$25] -> 2.78326790277077 | N364: of:=IF([.E364]>0;1;0) -> 0 | O364: of:=IF([.F364]>0;1;0) -> 0 | P364: of:=IF([.G364]>0;1;0) -> 1 | Q364: of:=IF([.H364]>0;1;0) -> 0 | R364: of:=IF([.I364]>0;1;0) -> 0 | S364: of:=IF([.J364]>0;1;0) -> 0 | T364: of:=IF([.K364]>0;1;0) -> 1 | U364: of:=IF([.L364]>0;1;0) -> 0 | V364: of:=[.N364]*[.N$402]+[.O364]*[.O$402]+[.P364]*[.P$402]+[.Q364]*[.Q$402]+[.R364]*[.R$402]+[.S364]*[.S$402]+[.T364]*[.T$402]+[.U364]*[.U$402] -> 1.5062883605785 | W364: 214 | Y364: of:=[.W364]+[.X364] -> 214 | Z364: of:=[.Y364]/[.Y$401] -> 0.0681395670112975 | AA364: of:=[.D364]+[.M364]+[.V364]+[.Z364] -> 10.9166083490643 | AB364: of:=RANK([.AA364];[.AA$2:.AA$399];0) -> 363
A365: Richmond upon Thames | B365: 140762 | C365: of:=IF(SUM([.E365:.L365])>0;[.B365];0) -> 140762 | D365: of:=[.C365]/[.C$401] -> 5.30165234294678 | G365: 1 | K365: 1 | M365: of:=[.E365]*[.AC$11]+[.F365]*[.AC$13]+[.G365]*[.AC$15]+[.H365]*[.AC$17]+[.I365]*[.AC$19]+[.J365]*[.AC$21]+[.K365]*[.AC$23]+[.L365]*[.AC$25] -> 2.78326790277077 | N365: of:=IF([.E365]>0;1;0) -> 0 | O365: of:=IF([.F365]>0;1;0) -> 0 | P365: of:=IF([.G365]>0;1;0) -> 1 | Q365: of:=IF([.H365]>0;1;0) -> 0 | R365: of:=IF([.I365]>0;1;0) -> 0 | S365: of:=IF([.J365]>0;1;0) -> 0 | T365: of:=IF([.K365]>0;1;0) -> 1 | U365: of:=IF([.L365]>0;1;0) -> 0 | V365: of:=[.N365]*[.N$402]+[.O365]*[.O$402]+[.P365]*[.P$402]+[.Q365]*[.Q$402]+[.R365]*[.R$402]+[.S365]*[.S$402]+[.T365]*[.T$402]+[.U365]*[.U$402] -> 1.5062883605785 | W365: 4048 | Y365: of:=[.W365]+[.X365] -> 4048 | Z365: of:=[.Y365]/[.Y$401] -> 1.2889204077651 | AA365: of:=[.D365]+[.M365]+[.V365]+[.Z365] -> 10.8801290140612 | AB365: of:=RANK([.AA365];[.AA$2:.AA$399];0) -> 364
A366: Havant | B366: 94912 | C366: of:=IF(SUM([.E366:.L366])>0;[.B366];0) -> 94912 | D366: of:=[.C366]/[.C$401] -> 3.57476042663335 | H366: 1 | I366: 1 | K366: 1 | L366: 1 | M366: of:=[.E366]*[.AC$11]+[.F366]*[.AC$13]+[.G366]*[.AC$15]+[.H366]*[.AC$17]+[.I366]*[.AC$19]+[.J366]*[.AC$21]+[.K366]*[.AC$23]+[.L366]*[.AC$25] -> 1.44386688758112 | N366: of:=IF([.E366]>0;1;0) -> 0 | O366: of:=IF([.F366]>0;1;0) -> 0 | P366: of:=IF([.G366]>0;1;0) -> 0 | Q366: of:=IF([.H366]>0;1;0) -> 1 | R366: of:=IF([.I366]>0;1;0) -> 1 | S366: of:=IF([.J366]>0;1;0) -> 0 | T366: of:=IF([.K366]>0;1;0) -> 1 | U366: of:=IF([.L366]>0;1;0) -> 1 | V366: of:=[.N366]*[.N$402]+[.O366]*[.O$402]+[.P366]*[.P$402]+[.Q366]*[.Q$402]+[.R366]*[.R$402]+[.S366]*[.S$402]+[.T366]*[.T$402]+[.U366]*[.U$402] -> 0.548043049303238 | W366: 16684 | Y366: of:=[.W366]+[.X366] -> 16684 | Z366: of:=[.Y366]/[.Y$401] -> 5.31233895334808 | AA366: of:=[.D366]+[.M366]+[.V366]+[.Z366] -> 10.8790093168658 | AB366: of:=RANK([.AA366];[.AA$2:.AA$399];0) -> 365
A367: Barking and Dagenham | B367: 138464 | C367: of:=IF(SUM([.E367:.L367])>0;[.B367];0) -> 138464 | D367: of:=[.C367]/[.C$401] -> 5.21510059542904 | G367: 1 | K367: 1 | M367: of:=[.E367]*[.AC$11]+[.F367]*[.AC$13]+[.G367]*[.AC$15]+[.H367]*[.AC$17]+[.I367]*[.AC$19]+[.J367]*[.AC$21]+[.K367]*[.AC$23]+[.L367]*[.AC$25] -> 2.78326790277077 | N367: of:=IF([.E367]>0;1;0) -> 0 | O367: of:=IF([.F367]>0;1;0) -> 0 | P367: of:=IF([.G367]>0;1;0) -> 1 | Q367: of:=IF([.H367]>0;1;0) -> 0 | R367: of:=IF([.I367]>0;1;0) -> 0 | S367: of:=IF([.J367]>0;1;0) -> 0 | T367: of:=IF([.K367]>0;1;0) -> 1 | U367: of:=IF([.L367]>0;1;0) -> 0 | V367: of:=[.N367]*[.N$402]+[.O367]*[.O$402]+[.P367]*[.P$402]+[.Q367]*[.Q$402]+[.R367]*[.R$402]+[.S367]*[.S$402]+[.T367]*[.T$402]+[.U367]*[.U$402] -> 1.5062883605785 | W367: 4147 | Y367: of:=[.W367]+[.X367] -> 4147 | Z367: of:=[.Y367]/[.Y$401] -> 1.32044291773762 | AA367: of:=[.D367]+[.M367]+[.V367]+[.Z367] -> 10.8250997765159 | AB367: of:=RANK([.AA367];[.AA$2:.AA$399];0) -> 366
A368: Hunts | B368: 132081 | C368: of:=IF(SUM([.E368:.L368])>0;[.B368];0) -> 132081 | D368: of:=[.C368]/[.C$401] -> 4.97469162919504 | G368: 1 | K368: 1 | M368: of:=[.E368]*[.AC$11]+[.F368]*[.AC$13]+[.G368]*[.AC$15]+[.H368]*[.AC$17]+[.I368]*[.AC$19]+[.J368]*[.AC$21]+[.K368]*[.AC$23]+[.L368]*[.AC$25] -> 2.78326790277077 | N368: of:=IF([.E368]>0;1;0) -> 0 | O368: of:=IF([.F368]>0;1;0) -> 0 | P368: of:=IF([.G368]>0;1;0) -> 1 | Q368: of:=IF([.H368]>0;1;0) -> 0 | R368: of:=IF([.I368]>0;1;0) -> 0 | S368: of:=IF([.J368]>0;1;0) -> 0 | T368: of:=IF([.K368]>0;1;0) -> 1 | U368: of:=IF([.L368]>0;1;0) -> 0 | V368: of:=[.N368]*[.N$402]+[.O368]*[.O$402]+[.P368]*[.P$402]+[.Q368]*[.Q$402]+[.R368]*[.R$402]+[.S368]*[.S$402]+[.T368]*[.T$402]+[.U368]*[.U$402] -> 1.5062883605785 | W368: 4171 | Y368: of:=[.W368]+[.X368] -> 4171 | Z368: of:=[.Y368]/[.Y$401] -> 1.32808473833702 | AA368: of:=[.D368]+[.M368]+[.V368]+[.Z368] -> 10.5923326308813 | AB368: of:=RANK([.AA368];[.AA$2:.AA$399];0) -> 367
A369: Hammersmith and Fulham | B369: 126651 | C369: of:=IF(SUM([.E369:.L369])>0;[.B369];0) -> 126651 | D369: of:=[.C369]/[.C$401] -> 4.77017640333721 | G369: 1 | K369: 1 | M369: of:=[.E369]*[.AC$11]+[.F369]*[.AC$13]+[.G369]*[.AC$15]+[.H369]*[.AC$17]+[.I369]*[.AC$19]+[.J369]*[.AC$21]+[.K369]*[.AC$23]+[.L369]*[.AC$25] -> 2.78326790277077 | N369: of:=IF([.E369]>0;1;0) -> 0 | O369: of:=IF([.F369]>0;1;0) -> 0 | P369: of:=IF([.G369]>0;1;0) -> 1 | Q369: of:=IF([.H369]>0;1;0) -> 0 | R369: of:=IF([.I369]>0;1;0) -> 0 | S369: of:=IF([.J369]>0;1;0) -> 0 | T369: of:=IF([.K369]>0;1;0) -> 1 | U369: of:=IF([.L369]>0;1;0) -> 0 | V369: of:=[.N369]*[.N$402]+[.O369]*[.O$402]+[.P369]*[.P$402]+[.Q369]*[.Q$402]+[.R369]*[.R$402]+[.S369]*[.S$402]+[.T369]*[.T$402]+[.U369]*[.U$402] -> 1.5062883605785 | W369: 4196 | Y369: of:=[.W369]+[.X369] -> 4196 | Z369: of:=[.Y369]/[.Y$401] -> 1.33604496812806 | AA369: of:=[.D369]+[.M369]+[.V369]+[.Z369] -> 10.3957776348145 | AB369: of:=RANK([.AA369];[.AA$2:.AA$399];0) -> 368
A370: Sutton | B370: 153117 | C370: of:=IF(SUM([.E370:.L370])>0;[.B370];0) -> 153117 | D370: of:=[.C370]/[.C$401] -> 5.76699039367856 | G370: 1 | K370: 1 | M370: of:=[.E370]*[.AC$11]+[.F370]*[.AC$13]+[.G370]*[.AC$15]+[.H370]*[.AC$17]+[.I370]*[.AC$19]+[.J370]*[.AC$21]+[.K370]*[.AC$23]+[.L370]*[.AC$25] -> 2.78326790277077 | N370: of:=IF([.E370]>0;1;0) -> 0 | O370: of:=IF([.F370]>0;1;0) -> 0 | P370: of:=IF([.G370]>0;1;0) -> 1 | Q370: of:=IF([.H370]>0;1;0) -> 0 | R370: of:=IF([.I370]>0;1;0) -> 0 | S370: of:=IF([.J370]>0;1;0) -> 0 | T370: of:=IF([.K370]>0;1;0) -> 1 | U370: of:=IF([.L370]>0;1;0) -> 0 | V370: of:=[.N370]*[.N$402]+[.O370]*[.O$402]+[.P370]*[.P$402]+[.Q370]*[.Q$402]+[.R370]*[.R$402]+[.S370]*[.S$402]+[.T370]*[.T$402]+[.U370]*[.U$402] -> 1.5062883605785 | W370: 624 | Y370: of:=[.W370]+[.X370] -> 624 | Z370: of:=[.Y370]/[.Y$401] -> 0.198687335584344 | AA370: of:=[.D370]+[.M370]+[.V370]+[.Z370] -> 10.2552339926122 | AB370: of:=RANK([.AA370];[.AA$2:.AA$399];0) -> 369
A371: Hart | B371: 73275 | C371: of:=IF(SUM([.E371:.L371])>0;[.B371];0) -> 73275 | D371: of:=[.C371]/[.C$401] -> 2.75982563070591 | H371: 1 | I371: 1 | K371: 1 | L371: 1 | M371: of:=[.E371]*[.AC$11]+[.F371]*[.AC$13]+[.G371]*[.AC$15]+[.H371]*[.AC$17]+[.I371]*[.AC$19]+[.J371]*[.AC$21]+[.K371]*[.AC$23]+[.L371]*[.AC$25] -> 1.44386688758112 | N371: of:=IF([.E371]>0;1;0) -> 0 | O371: of:=IF([.F371]>0;1;0) -> 0 | P371: of:=IF([.G371]>0;1;0) -> 0 | Q371: of:=IF([.H371]>0;1;0) -> 1 | R371: of:=IF([.I371]>0;1;0) -> 1 | S371: of:=IF([.J371]>0;1;0) -> 0 | T371: of:=IF([.K371]>0;1;0) -> 1 | U371: of:=IF([.L371]>0;1;0) -> 1 | V371: of:=[.N371]*[.N$402]+[.O371]*[.O$402]+[.P371]*[.P$402]+[.Q371]*[.Q$402]+[.R371]*[.R$402]+[.S371]*[.S$402]+[.T371]*[.T$402]+[.U371]*[.U$402] -> 0.548043049303238 | W371: 17012 | Y371: of:=[.W371]+[.X371] -> 17012 | Z371: of:=[.Y371]/[.Y$401] -> 5.41677716820651 | AA371: of:=[.D371]+[.M371]+[.V371]+[.Z371] -> 10.1685127357968 | AB371: of:=RANK([.AA371];[.AA$2:.AA$399];0) -> 370
A372: Harrogate | B372: 119680 | C372: of:=IF(SUM([.E372:.L372])>0;[.B372];0) -> 119680 | D372: of:=[.C372]/[.C$401] -> 4.50762103695507 | G372: 1 | K372: 1 | M372: of:=[.E372]*[.AC$11]+[.F372]*[.AC$13]+[.G372]*[.AC$15]+[.H372]*[.AC$17]+[.I372]*[.AC$19]+[.J372]*[.AC$21]+[.K372]*[.AC$23]+[.L372]*[.AC$25] -> 2.78326790277077 | N372: of:=IF([.E372]>0;1;0) -> 0 | O372: of:=IF([.F372]>0;1;0) -> 0 | P372: of:=IF([.G372]>0;1;0) -> 1 | Q372: of:=IF([.H372]>0;1;0) -> 0 | R372: of:=IF([.I372]>0;1;0) -> 0 | S372: of:=IF([.J372]>0;1;0) -> 0 | T372: of:=IF([.K372]>0;1;0) -> 1 | U372: of:=IF([.L372]>0;1;0) -> 0 | V372: of:=[.N372]*[.N$402]+[.O372]*[.O$402]+[.P372]*[.P$402]+[.Q372]*[.Q$402]+[.R372]*[.R$402]+[.S372]*[.S$402]+[.T372]*[.T$402]+[.U372]*[.U$402] -> 1.5062883605785 | W372: 4221 | Y372: of:=[.W372]+[.X372] -> 4221 | Z372: of:=[.Y372]/[.Y$401] -> 1.3440051979191 | AA372: of:=[.D372]+[.M372]+[.V372]+[.Z372] -> 10.1411824982234 | AB372: of:=RANK([.AA372];[.AA$2:.AA$399];0) -> 371
A373: Kingston upon Thames | B373: 115368 | C373: of:=IF(SUM([.E373:.L373])>0;[.B373];0) -> 115368 | D373: of:=[.C373]/[.C$401] -> 4.34521410253537 | G373: 1 | K373: 1 | M373: of:=[.E373]*[.AC$11]+[.F373]*[.AC$13]+[.G373]*[.AC$15]+[.H373]*[.AC$17]+[.I373]*[.AC$19]+[.J373]*[.AC$21]+[.K373]*[.AC$23]+[.L373]*[.AC$25] -> 2.78326790277077 | N373: of:=IF([.E373]>0;1;0) -> 0 | O373: of:=IF([.F373]>0;1;0) -> 0 | P373: of:=IF([.G373]>0;1;0) -> 1 | Q373: of:=IF([.H373]>0;1;0) -> 0 | R373: of:=IF([.I373]>0;1;0) -> 0 | S373: of:=IF([.J373]>0;1;0) -> 0 | T373: of:=IF([.K373]>0;1;0) -> 1 | U373: of:=IF([.L373]>0;1;0) -> 0 | V373: of:=[.N373]*[.N$402]+[.O373]*[.O$402]+[.P373]*[.P$402]+[.Q373]*[.Q$402]+[.R373]*[.R$402]+[.S373]*[.S$402]+[.T373]*[.T$402]+[.U373]*[.U$402] -> 1.5062883605785 | W373: 4271 | Y373: of:=[.W373]+[.X373] -> 4271 | Z373: of:=[.Y373]/[.Y$401] -> 1.35992565750118 | AA373: of:=[.D373]+[.M373]+[.V373]+[.Z373] -> 9.99469602338582 | AB373: of:=RANK([.AA373];[.AA$2:.AA$399];0) -> 372
A374: Westminster | B374: 134774 | C374: of:=IF(SUM([.E374:.L374])>0;[.B374];0) -> 134774 | D374: of:=[.C374]/[.C$401] -> 5.0761206353157 | G374: 1 | K374: 1 | M374: of:=[.E374]*[.AC$11]+[.F374]*[.AC$13]+[.G374]*[.AC$15]+[.H374]*[.AC$17]+[.I374]*[.AC$19]+[.J374]*[.AC$21]+[.K374]*[.AC$23]+[.L374]*[.AC$25] -> 2.78326790277077 | N374: of:=IF([.E374]>0;1;0) -> 0 | O374: of:=IF([.F374]>0;1;0) -> 0 | P374: of:=IF([.G374]>0;1;0) -> 1 | Q374: of:=IF([.H374]>0;1;0) -> 0 | R374: of:=IF([.I374]>0;1;0) -> 0 | S374: of:=IF([.J374]>0;1;0) -> 0 | T374: of:=IF([.K374]>0;1;0) -> 1 | U374: of:=IF([.L374]>0;1;0) -> 0 | V374: of:=[.N374]*[.N$402]+[.O374]*[.O$402]+[.P374]*[.P$402]+[.Q374]*[.Q$402]+[.R374]*[.R$402]+[.S374]*[.S$402]+[.T374]*[.T$402]+[.U374]*[.U$402] -> 1.5062883605785 | W374: 1634 | Y374: of:=[.W374]+[.X374] -> 1634 | Z374: of:=[.Y374]/[.Y$401] -> 0.520280619142337 | AA374: of:=[.D374]+[.M374]+[.V374]+[.Z374] -> 9.88595751780731 | AB374: of:=RANK([.AA374];[.AA$2:.AA$399];0) -> 373
A375: Shropshire | B375: 240773 | C375: of:=IF(SUM([.E375:.L375])>0;[.B375];0) -> 240773 | D375: of:=[.C375]/[.C$401] -> 9.06846122936818 | J375: 1 | M375: of:=[.E375]*[.AC$11]+[.F375]*[.AC$13]+[.G375]*[.AC$15]+[.H375]*[.AC$17]+[.I375]*[.AC$19]+[.J375]*[.AC$21]+[.K375]*[.AC$23]+[.L375]*[.AC$25] -> 0.136078386768712 | N375: of:=IF([.E375]>0;1;0) -> 0 | O375: of:=IF([.F375]>0;1;0) -> 0 | P375: of:=IF([.G375]>0;1;0) -> 0 | Q375: of:=IF([.H375]>0;1;0) -> 0 | R375: of:=IF([.I375]>0;1;0) -> 0 | S375: of:=IF([.J375]>0;1;0) -> 1 | T375: of:=IF([.K375]>0;1;0) -> 0 | U375: of:=IF([.L375]>0;1;0) -> 0 | V375: of:=[.N375]*[.N$402]+[.O375]*[.O$402]+[.P375]*[.P$402]+[.Q375]*[.Q$402]+[.R375]*[.R$402]+[.S375]*[.S$402]+[.T375]*[.T$402]+[.U375]*[.U$402] -> 0.174691403761665 | Y375: of:=[.W375]+[.X375] -> 0 | Z375: of:=[.Y375]/[.Y$401] -> 0 | AA375: of:=[.D375]+[.M375]+[.V375]+[.Z375] -> 9.37923101989856 | AB375: of:=RANK([.AA375];[.AA$2:.AA$399];0) -> 374
A376: Kensington and Chelsea | B376: 94534 | C376: of:=IF(SUM([.E376:.L376])>0;[.B376];0) -> 94534 | D376: of:=[.C376]/[.C$401] -> 3.56052345510955 | G376: 1 | K376: 1 | M376: of:=[.E376]*[.AC$11]+[.F376]*[.AC$13]+[.G376]*[.AC$15]+[.H376]*[.AC$17]+[.I376]*[.AC$19]+[.J376]*[.AC$21]+[.K376]*[.AC$23]+[.L376]*[.AC$25] -> 2.78326790277077 | N376: of:=IF([.E376]>0;1;0) -> 0 | O376: of:=IF([.F376]>0;1;0) -> 0 | P376: of:=IF([.G376]>0;1;0) -> 1 | Q376: of:=IF([.H376]>0;1;0) -> 0 | R376: of:=IF([.I376]>0;1;0) -> 0 | S376: of:=IF([.J376]>0;1;0) -> 0 | T376: of:=IF([.K376]>0;1;0) -> 1 | U376: of:=IF([.L376]>0;1;0) -> 0 | V376: of:=[.N376]*[.N$402]+[.O376]*[.O$402]+[.P376]*[.P$402]+[.Q376]*[.Q$402]+[.R376]*[.R$402]+[.S376]*[.S$402]+[.T376]*[.T$402]+[.U376]*[.U$402] -> 1.5062883605785 | W376: 416 | Y376: of:=[.W376]+[.X376] -> 416 | Z376: of:=[.Y376]/[.Y$401] -> 0.132458223722896 | AA376: of:=[.D376]+[.M376]+[.V376]+[.Z376] -> 7.98253794218172 | AB376: of:=RANK([.AA376];[.AA$2:.AA$399];0) -> 375
A377: Rotherham | B377: 194631 | C377: of:=IF(SUM([.E377:.L377])>0;[.B377];0) -> 194631 | D377: of:=[.C377]/[.C$401] -> 7.33057144087235 | I377: 1 | M377: of:=[.E377]*[.AC$11]+[.F377]*[.AC$13]+[.G377]*[.AC$15]+[.H377]*[.AC$17]+[.I377]*[.AC$19]+[.J377]*[.AC$21]+[.K377]*[.AC$23]+[.L377]*[.AC$25] -> 0.369899405999412 | N377: of:=IF([.E377]>0;1;0) -> 0 | O377: of:=IF([.F377]>0;1;0) -> 0 | P377: of:=IF([.G377]>0;1;0) -> 0 | Q377: of:=IF([.H377]>0;1;0) -> 0 | R377: of:=IF([.I377]>0;1;0) -> 1 | S377: of:=IF([.J377]>0;1;0) -> 0 | T377: of:=IF([.K377]>0;1;0) -> 0 | U377: of:=IF([.L377]>0;1;0) -> 0 | V377: of:=[.N377]*[.N$402]+[.O377]*[.O$402]+[.P377]*[.P$402]+[.Q377]*[.Q$402]+[.R377]*[.R$402]+[.S377]*[.S$402]+[.T377]*[.T$402]+[.U377]*[.U$402] -> 0.218586564834393 | Y377: of:=[.W377]+[.X377] -> 0 | Z377: of:=[.Y377]/[.Y$401] -> 0 | AA377: of:=[.D377]+[.M377]+[.V377]+[.Z377] -> 7.91905741170615 | AB377: of:=RANK([.AA377];[.AA$2:.AA$399];0) -> 376
A378: Northampton | B378: 162936 | C378: of:=IF(SUM([.E378:.L378])>0;[.B378];0) -> 162936 | D378: of:=[.C378]/[.C$401] -> 6.13681267778502 | I378: 1 | M378: of:=[.E378]*[.AC$11]+[.F378]*[.AC$13]+[.G378]*[.AC$15]+[.H378]*[.AC$17]+[.I378]*[.AC$19]+[.J378]*[.AC$21]+[.K378]*[.AC$23]+[.L378]*[.AC$25] -> 0.369899405999412 | N378: of:=IF([.E378]>0;1;0) -> 0 | O378: of:=IF([.F378]>0;1;0) -> 0 | P378: of:=IF([.G378]>0;1;0) -> 0 | Q378: of:=IF([.H378]>0;1;0) -> 0 | R378: of:=IF([.I378]>0;1;0) -> 1 | S378: of:=IF([.J378]>0;1;0) -> 0 | T378: of:=IF([.K378]>0;1;0) -> 0 | U378: of:=IF([.L378]>0;1;0) -> 0 | V378: of:=[.N378]*[.N$402]+[.O378]*[.O$402]+[.P378]*[.P$402]+[.Q378]*[.Q$402]+[.R378]*[.R$402]+[.S378]*[.S$402]+[.T378]*[.T$402]+[.U378]*[.U$402] -> 0.218586564834393 | Y378: of:=[.W378]+[.X378] -> 0 | Z378: of:=[.Y378]/[.Y$401] -> 0 | AA378: of:=[.D378]+[.M378]+[.V378]+[.Z378] -> 6.72529864861883 | AB378: of:=RANK([.AA378];[.AA$2:.AA$399];0) -> 377
A379: Herefs | B379: 142853 | C379: of:=IF(SUM([.E379:.L379])>0;[.B379];0) -> 142853 | D379: of:=[.C379]/[.C$401] -> 5.38040765367767 | H379: 1 | L379: 1 | M379: of:=[.E379]*[.AC$11]+[.F379]*[.AC$13]+[.G379]*[.AC$15]+[.H379]*[.AC$17]+[.I379]*[.AC$19]+[.J379]*[.AC$21]+[.K379]*[.AC$23]+[.L379]*[.AC$25] -> 1.02390704070172 | N379: of:=IF([.E379]>0;1;0) -> 0 | O379: of:=IF([.F379]>0;1;0) -> 0 | P379: of:=IF([.G379]>0;1;0) -> 0 | Q379: of:=IF([.H379]>0;1;0) -> 1 | R379: of:=IF([.I379]>0;1;0) -> 0 | S379: of:=IF([.J379]>0;1;0) -> 0 | T379: of:=IF([.K379]>0;1;0) -> 0 | U379: of:=IF([.L379]>0;1;0) -> 1 | V379: of:=[.N379]*[.N$402]+[.O379]*[.O$402]+[.P379]*[.P$402]+[.Q379]*[.Q$402]+[.R379]*[.R$402]+[.S379]*[.S$402]+[.T379]*[.T$402]+[.U379]*[.U$402] -> 0.308633066549229 | W379: 43192 | X379: of:=-[.$AD$1] -> -44717 | Y379: of:=[.W379]+[.X379] -> -1525 | Z379: of:=[.Y379]/[.Y$401] -> -0.485574017253405 | AA379: of:=[.D379]+[.M379]+[.V379]+[.Z379] -> 6.22737374367521 | AB379: of:=RANK([.AA379];[.AA$2:.AA$399];0) -> 378
A380: Aylesbury Vale | B380: 143129 | C380: of:=IF(SUM([.E380:.L380])>0;[.B380];0) -> 143129 | D380: of:=[.C380]/[.C$401] -> 5.39080290272679 | I380: 1 | M380: of:=[.E380]*[.AC$11]+[.F380]*[.AC$13]+[.G380]*[.AC$15]+[.H380]*[.AC$17]+[.I380]*[.AC$19]+[.J380]*[.AC$21]+[.K380]*[.AC$23]+[.L380]*[.AC$25] -> 0.369899405999412 | N380: of:=IF([.E380]>0;1;0) -> 0 | O380: of:=IF([.F380]>0;1;0) -> 0 | P380: of:=IF([.G380]>0;1;0) -> 0 | Q380: of:=IF([.H380]>0;1;0) -> 0 | R380: of:=IF([.I380]>0;1;0) -> 1 | S380: of:=IF([.J380]>0;1;0) -> 0 | T380: of:=IF([.K380]>0;1;0) -> 0 | U380: of:=IF([.L380]>0;1;0) -> 0 | V380: of:=[.N380]*[.N$402]+[.O380]*[.O$402]+[.P380]*[.P$402]+[.Q380]*[.Q$402]+[.R380]*[.R$402]+[.S380]*[.S$402]+[.T380]*[.T$402]+[.U380]*[.U$402] -> 0.218586564834393 | Y380: of:=[.W380]+[.X380] -> 0 | Z380: of:=[.Y380]/[.Y$401] -> 0 | AA380: of:=[.D380]+[.M380]+[.V380]+[.Z380] -> 5.9792888735606 | AB380: of:=RANK([.AA380];[.AA$2:.AA$399];0) -> 379
A381: Wycombe | B381: 129553 | C381: of:=IF(SUM([.E381:.L381])>0;[.B381];0) -> 129553 | D381: of:=[.C381]/[.C$401] -> 4.87947717413637 | I381: 1 | M381: of:=[.E381]*[.AC$11]+[.F381]*[.AC$13]+[.G381]*[.AC$15]+[.H381]*[.AC$17]+[.I381]*[.AC$19]+[.J381]*[.AC$21]+[.K381]*[.AC$23]+[.L381]*[.AC$25] -> 0.369899405999412 | N381: of:=IF([.E381]>0;1;0) -> 0 | O381: of:=IF([.F381]>0;1;0) -> 0 | P381: of:=IF([.G381]>0;1;0) -> 0 | Q381: of:=IF([.H381]>0;1;0) -> 0 | R381: of:=IF([.I381]>0;1;0) -> 1 | S381: of:=IF([.J381]>0;1;0) -> 0 | T381: of:=IF([.K381]>0;1;0) -> 0 | U381: of:=IF([.L381]>0;1;0) -> 0 | V381: of:=[.N381]*[.N$402]+[.O381]*[.O$402]+[.P381]*[.P$402]+[.Q381]*[.Q$402]+[.R381]*[.R$402]+[.S381]*[.S$402]+[.T381]*[.T$402]+[.U381]*[.U$402] -> 0.218586564834393 | Y381: of:=[.W381]+[.X381] -> 0 | Z381: of:=[.Y381]/[.Y$401] -> 0 | AA381: of:=[.D381]+[.M381]+[.V381]+[.Z381] -> 5.46796314497017 | AB381: of:=RANK([.AA381];[.AA$2:.AA$399];0) -> 380
A382: Tendring | B382: 110498 | C382: of:=IF(SUM([.E382:.L382])>0;[.B382];0) -> 110498 | D382: of:=[.C382]/[.C$401] -> 4.16179068634243 | H382: 1 | L382: 1 | M382: of:=[.E382]*[.AC$11]+[.F382]*[.AC$13]+[.G382]*[.AC$15]+[.H382]*[.AC$17]+[.I382]*[.AC$19]+[.J382]*[.AC$21]+[.K382]*[.AC$23]+[.L382]*[.AC$25] -> 1.02390704070172 | N382: of:=IF([.E382]>0;1;0) -> 0 | O382: of:=IF([.F382]>0;1;0) -> 0 | P382: of:=IF([.G382]>0;1;0) -> 0 | Q382: of:=IF([.H382]>0;1;0) -> 1 | R382: of:=IF([.I382]>0;1;0) -> 0 | S382: of:=IF([.J382]>0;1;0) -> 0 | T382: of:=IF([.K382]>0;1;0) -> 0 | U382: of:=IF([.L382]>0;1;0) -> 1 | V382: of:=[.N382]*[.N$402]+[.O382]*[.O$402]+[.P382]*[.P$402]+[.Q382]*[.Q$402]+[.R382]*[.R$402]+[.S382]*[.S$402]+[.T382]*[.T$402]+[.U382]*[.U$402] -> 0.308633066549229 | W382: 43376 | X382: of:=-[.$AD$1] -> -44717 | Y382: of:=[.W382]+[.X382] -> -1341 | Z382: of:=[.Y382]/[.Y$401] -> -0.426986725991355 | AA382: of:=[.D382]+[.M382]+[.V382]+[.Z382] -> 5.06734406760202 | AB382: of:=RANK([.AA382];[.AA$2:.AA$399];0) -> 381
A383: Flintshire | B383: 118176 | C383: of:=IF(SUM([.E383:.L383])>0;[.B383];0) -> 118176 | D383: of:=[.C383]/[.C$401] -> 4.45097446242649 | J383: 1 | M383: of:=[.E383]*[.AC$11]+[.F383]*[.AC$13]+[.G383]*[.AC$15]+[.H383]*[.AC$17]+[.I383]*[.AC$19]+[.J383]*[.AC$21]+[.K383]*[.AC$23]+[.L383]*[.AC$25] -> 0.136078386768712 | N383: of:=IF([.E383]>0;1;0) -> 0 | O383: of:=IF([.F383]>0;1;0) -> 0 | P383: of:=IF([.G383]>0;1;0) -> 0 | Q383: of:=IF([.H383]>0;1;0) -> 0 | R383: of:=IF([.I383]>0;1;0) -> 0 | S383: of:=IF([.J383]>0;1;0) -> 1 | T383: of:=IF([.K383]>0;1;0) -> 0 | U383: of:=IF([.L383]>0;1;0) -> 0 | V383: of:=[.N383]*[.N$402]+[.O383]*[.O$402]+[.P383]*[.P$402]+[.Q383]*[.Q$402]+[.R383]*[.R$402]+[.S383]*[.S$402]+[.T383]*[.T$402]+[.U383]*[.U$402] -> 0.174691403761665 | Y383: of:=[.W383]+[.X383] -> 0 | Z383: of:=[.Y383]/[.Y$401] -> 0 | AA383: of:=[.D383]+[.M383]+[.V383]+[.Z383] -> 4.76174425295687 | AB383: of:=RANK([.AA383];[.AA$2:.AA$399];0) -> 382
A384: Newport | B384: 109196 | C384: of:=IF(SUM([.E384:.L384])>0;[.B384];0) -> 109196 | D384: of:=[.C384]/[.C$401] -> 4.11275222887154 | J384: 1 | M384: of:=[.E384]*[.AC$11]+[.F384]*[.AC$13]+[.G384]*[.AC$15]+[.H384]*[.AC$17]+[.I384]*[.AC$19]+[.J384]*[.AC$21]+[.K384]*[.AC$23]+[.L384]*[.AC$25] -> 0.136078386768712 | N384: of:=IF([.E384]>0;1;0) -> 0 | O384: of:=IF([.F384]>0;1;0) -> 0 | P384: of:=IF([.G384]>0;1;0) -> 0 | Q384: of:=IF([.H384]>0;1;0) -> 0 | R384: of:=IF([.I384]>0;1;0) -> 0 | S384: of:=IF([.J384]>0;1;0) -> 1 | T384: of:=IF([.K384]>0;1;0) -> 0 | U384: of:=IF([.L384]>0;1;0) -> 0 | V384: of:=[.N384]*[.N$402]+[.O384]*[.O$402]+[.P384]*[.P$402]+[.Q384]*[.Q$402]+[.R384]*[.R$402]+[.S384]*[.S$402]+[.T384]*[.T$402]+[.U384]*[.U$402] -> 0.174691403761665 | Y384: of:=[.W384]+[.X384] -> 0 | Z384: of:=[.Y384]/[.Y$401] -> 0 | AA384: of:=[.D384]+[.M384]+[.V384]+[.Z384] -> 4.42352201940192 | AB384: of:=RANK([.AA384];[.AA$2:.AA$399];0) -> 383
A385: N Kesteven | B385: 89031 | C385: of:=IF(SUM([.E385:.L385])>0;[.B385];0) -> 89031 | D385: of:=[.C385]/[.C$401] -> 3.35325876120611 | H385: 1 | L385: 1 | M385: of:=[.E385]*[.AC$11]+[.F385]*[.AC$13]+[.G385]*[.AC$15]+[.H385]*[.AC$17]+[.I385]*[.AC$19]+[.J385]*[.AC$21]+[.K385]*[.AC$23]+[.L385]*[.AC$25] -> 1.02390704070172 | N385: of:=IF([.E385]>0;1;0) -> 0 | O385: of:=IF([.F385]>0;1;0) -> 0 | P385: of:=IF([.G385]>0;1;0) -> 0 | Q385: of:=IF([.H385]>0;1;0) -> 1 | R385: of:=IF([.I385]>0;1;0) -> 0 | S385: of:=IF([.J385]>0;1;0) -> 0 | T385: of:=IF([.K385]>0;1;0) -> 0 | U385: of:=IF([.L385]>0;1;0) -> 1 | V385: of:=[.N385]*[.N$402]+[.O385]*[.O$402]+[.P385]*[.P$402]+[.Q385]*[.Q$402]+[.R385]*[.R$402]+[.S385]*[.S$402]+[.T385]*[.T$402]+[.U385]*[.U$402] -> 0.308633066549229 | W385: 43560 | X385: of:=-[.$AD$1] -> -44717 | Y385: of:=[.W385]+[.X385] -> -1157 | Z385: of:=[.Y385]/[.Y$401] -> -0.368399434729305 | AA385: of:=[.D385]+[.M385]+[.V385]+[.Z385] -> 4.31739943372775 | AB385: of:=RANK([.AA385];[.AA$2:.AA$399];0) -> 384
A386: S Ribble | B386: 83957 | C386: of:=IF(SUM([.E386:.L386])>0;[.B386];0) -> 83957 | D386: of:=[.C386]/[.C$401] -> 3.16215190006381 | H386: 1 | L386: 1 | M386: of:=[.E386]*[.AC$11]+[.F386]*[.AC$13]+[.G386]*[.AC$15]+[.H386]*[.AC$17]+[.I386]*[.AC$19]+[.J386]*[.AC$21]+[.K386]*[.AC$23]+[.L386]*[.AC$25] -> 1.02390704070172 | N386: of:=IF([.E386]>0;1;0) -> 0 | O386: of:=IF([.F386]>0;1;0) -> 0 | P386: of:=IF([.G386]>0;1;0) -> 0 | Q386: of:=IF([.H386]>0;1;0) -> 1 | R386: of:=IF([.I386]>0;1;0) -> 0 | S386: of:=IF([.J386]>0;1;0) -> 0 | T386: of:=IF([.K386]>0;1;0) -> 0 | U386: of:=IF([.L386]>0;1;0) -> 1 | V386: of:=[.N386]*[.N$402]+[.O386]*[.O$402]+[.P386]*[.P$402]+[.Q386]*[.Q$402]+[.R386]*[.R$402]+[.S386]*[.S$402]+[.T386]*[.T$402]+[.U386]*[.U$402] -> 0.308633066549229 | W386: 44113 | X386: of:=-[.$AD$1] -> -44717 | Y386: of:=[.W386]+[.X386] -> -604 | Z386: of:=[.Y386]/[.Y$401] -> -0.192319151751513 | AA386: of:=[.D386]+[.M386]+[.V386]+[.Z386] -> 4.30237285556325 | AB386: of:=RANK([.AA386];[.AA$2:.AA$399];0) -> 385
A387: Broxtowe | B387: 84637 | C387: of:=IF(SUM([.E387:.L387])>0;[.B387];0) -> 84637 | D387: of:=[.C387]/[.C$401] -> 3.18776338322833 | H387: 1 | L387: 1 | M387: of:=[.E387]*[.AC$11]+[.F387]*[.AC$13]+[.G387]*[.AC$15]+[.H387]*[.AC$17]+[.I387]*[.AC$19]+[.J387]*[.AC$21]+[.K387]*[.AC$23]+[.L387]*[.AC$25] -> 1.02390704070172 | N387: of:=IF([.E387]>0;1;0) -> 0 | O387: of:=IF([.F387]>0;1;0) -> 0 | P387: of:=IF([.G387]>0;1;0) -> 0 | Q387: of:=IF([.H387]>0;1;0) -> 1 | R387: of:=IF([.I387]>0;1;0) -> 0 | S387: of:=IF([.J387]>0;1;0) -> 0 | T387: of:=IF([.K387]>0;1;0) -> 0 | U387: of:=IF([.L387]>0;1;0) -> 1 | V387: of:=[.N387]*[.N$402]+[.O387]*[.O$402]+[.P387]*[.P$402]+[.Q387]*[.Q$402]+[.R387]*[.R$402]+[.S387]*[.S$402]+[.T387]*[.T$402]+[.U387]*[.U$402] -> 0.308633066549229 | W387: 43928 | X387: of:=-[.$AD$1] -> -44717 | Y387: of:=[.W387]+[.X387] -> -789 | Z387: of:=[.Y387]/[.Y$401] -> -0.251224852205204 | AA387: of:=[.D387]+[.M387]+[.V387]+[.Z387] -> 4.26907863827408 | AB387: of:=RANK([.AA387];[.AA$2:.AA$399];0) -> 386
A388: S Staffs | B388: 85147 | C388: of:=IF(SUM([.E388:.L388])>0;[.B388];0) -> 85147 | D388: of:=[.C388]/[.C$401] -> 3.20697199560172 | H388: 1 | L388: 1 | M388: of:=[.E388]*[.AC$11]+[.F388]*[.AC$13]+[.G388]*[.AC$15]+[.H388]*[.AC$17]+[.I388]*[.AC$19]+[.J388]*[.AC$21]+[.K388]*[.AC$23]+[.L388]*[.AC$25] -> 1.02390704070172 | N388: of:=IF([.E388]>0;1;0) -> 0 | O388: of:=IF([.F388]>0;1;0) -> 0 | P388: of:=IF([.G388]>0;1;0) -> 0 | Q388: of:=IF([.H388]>0;1;0) -> 1 | R388: of:=IF([.I388]>0;1;0) -> 0 | S388: of:=IF([.J388]>0;1;0) -> 0 | T388: of:=IF([.K388]>0;1;0) -> 0 | U388: of:=IF([.L388]>0;1;0) -> 1 | V388: of:=[.N388]*[.N$402]+[.O388]*[.O$402]+[.P388]*[.P$402]+[.Q388]*[.Q$402]+[.R388]*[.R$402]+[.S388]*[.S$402]+[.T388]*[.T$402]+[.U388]*[.U$402] -> 0.308633066549229 | W388: 43744 | X388: of:=-[.$AD$1] -> -44717 | Y388: of:=[.W388]+[.X388] -> -973 | Z388: of:=[.Y388]/[.Y$401] -> -0.309812143467255 | AA388: of:=[.D388]+[.M388]+[.V388]+[.Z388] -> 4.22969995938541 | AB388: of:=RANK([.AA388];[.AA$2:.AA$399];0) -> 387
A389: Stroud | B389: 93833 | C389: of:=IF(SUM([.E389:.L389])>0;[.B389];0) -> 93833 | D389: of:=[.C389]/[.C$401] -> 3.5341210290826 | I389: 1 | M389: of:=[.E389]*[.AC$11]+[.F389]*[.AC$13]+[.G389]*[.AC$15]+[.H389]*[.AC$17]+[.I389]*[.AC$19]+[.J389]*[.AC$21]+[.K389]*[.AC$23]+[.L389]*[.AC$25] -> 0.369899405999412 | N389: of:=IF([.E389]>0;1;0) -> 0 | O389: of:=IF([.F389]>0;1;0) -> 0 | P389: of:=IF([.G389]>0;1;0) -> 0 | Q389: of:=IF([.H389]>0;1;0) -> 0 | R389: of:=IF([.I389]>0;1;0) -> 1 | S389: of:=IF([.J389]>0;1;0) -> 0 | T389: of:=IF([.K389]>0;1;0) -> 0 | U389: of:=IF([.L389]>0;1;0) -> 0 | V389: of:=[.N389]*[.N$402]+[.O389]*[.O$402]+[.P389]*[.P$402]+[.Q389]*[.Q$402]+[.R389]*[.R$402]+[.S389]*[.S$402]+[.T389]*[.T$402]+[.U389]*[.U$402] -> 0.218586564834393 | Y389: of:=[.W389]+[.X389] -> 0 | Z389: of:=[.Y389]/[.Y$401] -> 0 | AA389: of:=[.D389]+[.M389]+[.V389]+[.Z389] -> 4.1226069999164 | AB389: of:=RANK([.AA389];[.AA$2:.AA$399];0) -> 388
A390: N Devon | B390: 74191 | C390: of:=IF(SUM([.E390:.L390])>0;[.B390];0) -> 74191 | D390: of:=[.C390]/[.C$401] -> 2.79432580508635 | H390: 1 | L390: 1 | M390: of:=[.E390]*[.AC$11]+[.F390]*[.AC$13]+[.G390]*[.AC$15]+[.H390]*[.AC$17]+[.I390]*[.AC$19]+[.J390]*[.AC$21]+[.K390]*[.AC$23]+[.L390]*[.AC$25] -> 1.02390704070172 | N390: of:=IF([.E390]>0;1;0) -> 0 | O390: of:=IF([.F390]>0;1;0) -> 0 | P390: of:=IF([.G390]>0;1;0) -> 0 | Q390: of:=IF([.H390]>0;1;0) -> 1 | R390: of:=IF([.I390]>0;1;0) -> 0 | S390: of:=IF([.J390]>0;1;0) -> 0 | T390: of:=IF([.K390]>0;1;0) -> 0 | U390: of:=IF([.L390]>0;1;0) -> 1 | V390: of:=[.N390]*[.N$402]+[.O390]*[.O$402]+[.P390]*[.P$402]+[.Q390]*[.Q$402]+[.R390]*[.R$402]+[.S390]*[.S$402]+[.T390]*[.T$402]+[.U390]*[.U$402] -> 0.308633066549229 | W390: 44298 | X390: of:=-[.$AD$1] -> -44717 | Y390: of:=[.W390]+[.X390] -> -419 | Z390: of:=[.Y390]/[.Y$401] -> -0.133413451297821 | AA390: of:=[.D390]+[.M390]+[.V390]+[.Z390] -> 3.99345246103947 | AB390: of:=RANK([.AA390];[.AA$2:.AA$399];0) -> 389
A391: Scottish Borders | B391: 89923 | C391: of:=IF(SUM([.E391:.L391])>0;[.B391];0) -> 89923 | D391: of:=[.C391]/[.C$401] -> 3.38685500088662 | K391: 1 | M391: of:=[.E391]*[.AC$11]+[.F391]*[.AC$13]+[.G391]*[.AC$15]+[.H391]*[.AC$17]+[.I391]*[.AC$19]+[.J391]*[.AC$21]+[.K391]*[.AC$23]+[.L391]*[.AC$25] -> 0.0500604408799853 | N391: of:=IF([.E391]>0;1;0) -> 0 | O391: of:=IF([.F391]>0;1;0) -> 0 | P391: of:=IF([.G391]>0;1;0) -> 0 | Q391: of:=IF([.H391]>0;1;0) -> 0 | R391: of:=IF([.I391]>0;1;0) -> 0 | S391: of:=IF([.J391]>0;1;0) -> 0 | T391: of:=IF([.K391]>0;1;0) -> 1 | U391: of:=IF([.L391]>0;1;0) -> 0 | V391: of:=[.N391]*[.N$402]+[.O391]*[.O$402]+[.P391]*[.P$402]+[.Q391]*[.Q$402]+[.R391]*[.R$402]+[.S391]*[.S$402]+[.T391]*[.T$402]+[.U391]*[.U$402] -> 0.0208234179196155 | Y391: of:=[.W391]+[.X391] -> 0 | Z391: of:=[.Y391]/[.Y$401] -> 0 | AA391: of:=[.D391]+[.M391]+[.V391]+[.Z391] -> 3.45773885968622 | AB391: of:=RANK([.AA391];[.AA$2:.AA$399];0) -> 390
A392: Kettering | B392: 74226 | C392: of:=IF(SUM([.E392:.L392])>0;[.B392];0) -> 74226 | D392: of:=[.C392]/[.C$401] -> 2.7956440431904 | I392: 1 | M392: of:=[.E392]*[.AC$11]+[.F392]*[.AC$13]+[.G392]*[.AC$15]+[.H392]*[.AC$17]+[.I392]*[.AC$19]+[.J392]*[.AC$21]+[.K392]*[.AC$23]+[.L392]*[.AC$25] -> 0.369899405999412 | N392: of:=IF([.E392]>0;1;0) -> 0 | O392: of:=IF([.F392]>0;1;0) -> 0 | P392: of:=IF([.G392]>0;1;0) -> 0 | Q392: of:=IF([.H392]>0;1;0) -> 0 | R392: of:=IF([.I392]>0;1;0) -> 1 | S392: of:=IF([.J392]>0;1;0) -> 0 | T392: of:=IF([.K392]>0;1;0) -> 0 | U392: of:=IF([.L392]>0;1;0) -> 0 | V392: of:=[.N392]*[.N$402]+[.O392]*[.O$402]+[.P392]*[.P$402]+[.Q392]*[.Q$402]+[.R392]*[.R$402]+[.S392]*[.S$402]+[.T392]*[.T$402]+[.U392]*[.U$402] -> 0.218586564834393 | Y392: of:=[.W392]+[.X392] -> 0 | Z392: of:=[.Y392]/[.Y$401] -> 0 | AA392: of:=[.D392]+[.M392]+[.V392]+[.Z392] -> 3.38413001402421 | AB392: of:=RANK([.AA392];[.AA$2:.AA$399];0) -> 391
A393: Chiltern | B393: 73576 | C393: of:=IF(SUM([.E393:.L393])>0;[.B393];0) -> 73576 | D393: of:=[.C393]/[.C$401] -> 2.77116247840079 | I393: 1 | M393: of:=[.E393]*[.AC$11]+[.F393]*[.AC$13]+[.G393]*[.AC$15]+[.H393]*[.AC$17]+[.I393]*[.AC$19]+[.J393]*[.AC$21]+[.K393]*[.AC$23]+[.L393]*[.AC$25] -> 0.369899405999412 | N393: of:=IF([.E393]>0;1;0) -> 0 | O393: of:=IF([.F393]>0;1;0) -> 0 | P393: of:=IF([.G393]>0;1;0) -> 0 | Q393: of:=IF([.H393]>0;1;0) -> 0 | R393: of:=IF([.I393]>0;1;0) -> 1 | S393: of:=IF([.J393]>0;1;0) -> 0 | T393: of:=IF([.K393]>0;1;0) -> 0 | U393: of:=IF([.L393]>0;1;0) -> 0 | V393: of:=[.N393]*[.N$402]+[.O393]*[.O$402]+[.P393]*[.P$402]+[.Q393]*[.Q$402]+[.R393]*[.R$402]+[.S393]*[.S$402]+[.T393]*[.T$402]+[.U393]*[.U$402] -> 0.218586564834393 | Y393: of:=[.W393]+[.X393] -> 0 | Z393: of:=[.Y393]/[.Y$401] -> 0 | AA393: of:=[.D393]+[.M393]+[.V393]+[.Z393] -> 3.35964844923459 | AB393: of:=RANK([.AA393];[.AA$2:.AA$399];0) -> 392
A394: S Northants | B394: 71161 | C394: of:=IF(SUM([.E394:.L394])>0;[.B394];0) -> 71161 | D394: of:=[.C394]/[.C$401] -> 2.68020404922092 | I394: 1 | M394: of:=[.E394]*[.AC$11]+[.F394]*[.AC$13]+[.G394]*[.AC$15]+[.H394]*[.AC$17]+[.I394]*[.AC$19]+[.J394]*[.AC$21]+[.K394]*[.AC$23]+[.L394]*[.AC$25] -> 0.369899405999412 | N394: of:=IF([.E394]>0;1;0) -> 0 | O394: of:=IF([.F394]>0;1;0) -> 0 | P394: of:=IF([.G394]>0;1;0) -> 0 | Q394: of:=IF([.H394]>0;1;0) -> 0 | R394: of:=IF([.I394]>0;1;0) -> 1 | S394: of:=IF([.J394]>0;1;0) -> 0 | T394: of:=IF([.K394]>0;1;0) -> 0 | U394: of:=IF([.L394]>0;1;0) -> 0 | V394: of:=[.N394]*[.N$402]+[.O394]*[.O$402]+[.P394]*[.P$402]+[.Q394]*[.Q$402]+[.R394]*[.R$402]+[.S394]*[.S$402]+[.T394]*[.T$402]+[.U394]*[.U$402] -> 0.218586564834393 | Y394: of:=[.W394]+[.X394] -> 0 | Z394: of:=[.Y394]/[.Y$401] -> 0 | AA394: of:=[.D394]+[.M394]+[.V394]+[.Z394] -> 3.26869002005473 | AB394: of:=RANK([.AA394];[.AA$2:.AA$399];0) -> 393
A395: E Northants | B395: 69463 | C395: of:=IF(SUM([.E395:.L395])>0;[.B395];0) -> 69463 | D395: of:=[.C395]/[.C$401] -> 2.61625066920129 | I395: 1 | M395: of:=[.E395]*[.AC$11]+[.F395]*[.AC$13]+[.G395]*[.AC$15]+[.H395]*[.AC$17]+[.I395]*[.AC$19]+[.J395]*[.AC$21]+[.K395]*[.AC$23]+[.L395]*[.AC$25] -> 0.369899405999412 | N395: of:=IF([.E395]>0;1;0) -> 0 | O395: of:=IF([.F395]>0;1;0) -> 0 | P395: of:=IF([.G395]>0;1;0) -> 0 | Q395: of:=IF([.H395]>0;1;0) -> 0 | R395: of:=IF([.I395]>0;1;0) -> 1 | S395: of:=IF([.J395]>0;1;0) -> 0 | T395: of:=IF([.K395]>0;1;0) -> 0 | U395: of:=IF([.L395]>0;1;0) -> 0 | V395: of:=[.N395]*[.N$402]+[.O395]*[.O$402]+[.P395]*[.P$402]+[.Q395]*[.Q$402]+[.R395]*[.R$402]+[.S395]*[.S$402]+[.T395]*[.T$402]+[.U395]*[.U$402] -> 0.218586564834393 | Y395: of:=[.W395]+[.X395] -> 0 | Z395: of:=[.Y395]/[.Y$401] -> 0 | AA395: of:=[.D395]+[.M395]+[.V395]+[.Z395] -> 3.20473664003509 | AB395: of:=RANK([.AA395];[.AA$2:.AA$399];0) -> 394
A396: Wellingborough | B396: 60555 | C396: of:=IF(SUM([.E396:.L396])>0;[.B396];0) -> 60555 | D396: of:=[.C396]/[.C$401] -> 2.28074023974611 | I396: 1 | M396: of:=[.E396]*[.AC$11]+[.F396]*[.AC$13]+[.G396]*[.AC$15]+[.H396]*[.AC$17]+[.I396]*[.AC$19]+[.J396]*[.AC$21]+[.K396]*[.AC$23]+[.L396]*[.AC$25] -> 0.369899405999412 | N396: of:=IF([.E396]>0;1;0) -> 0 | O396: of:=IF([.F396]>0;1;0) -> 0 | P396: of:=IF([.G396]>0;1;0) -> 0 | Q396: of:=IF([.H396]>0;1;0) -> 0 | R396: of:=IF([.I396]>0;1;0) -> 1 | S396: of:=IF([.J396]>0;1;0) -> 0 | T396: of:=IF([.K396]>0;1;0) -> 0 | U396: of:=IF([.L396]>0;1;0) -> 0 | V396: of:=[.N396]*[.N$402]+[.O396]*[.O$402]+[.P396]*[.P$402]+[.Q396]*[.Q$402]+[.R396]*[.R$402]+[.S396]*[.S$402]+[.T396]*[.T$402]+[.U396]*[.U$402] -> 0.218586564834393 | Y396: of:=[.W396]+[.X396] -> 0 | Z396: of:=[.Y396]/[.Y$401] -> 0 | AA396: of:=[.D396]+[.M396]+[.V396]+[.Z396] -> 2.86922621057991 | AB396: of:=RANK([.AA396];[.AA$2:.AA$399];0) -> 395
A397: S Bucks | B397: 53713 | C397: of:=IF(SUM([.E397:.L397])>0;[.B397];0) -> 53713 | D397: of:=[.C397]/[.C$401] -> 2.02304352237607 | I397: 1 | M397: of:=[.E397]*[.AC$11]+[.F397]*[.AC$13]+[.G397]*[.AC$15]+[.H397]*[.AC$17]+[.I397]*[.AC$19]+[.J397]*[.AC$21]+[.K397]*[.AC$23]+[.L397]*[.AC$25] -> 0.369899405999412 | N397: of:=IF([.E397]>0;1;0) -> 0 | O397: of:=IF([.F397]>0;1;0) -> 0 | P397: of:=IF([.G397]>0;1;0) -> 0 | Q397: of:=IF([.H397]>0;1;0) -> 0 | R397: of:=IF([.I397]>0;1;0) -> 1 | S397: of:=IF([.J397]>0;1;0) -> 0 | T397: of:=IF([.K397]>0;1;0) -> 0 | U397: of:=IF([.L397]>0;1;0) -> 0 | V397: of:=[.N397]*[.N$402]+[.O397]*[.O$402]+[.P397]*[.P$402]+[.Q397]*[.Q$402]+[.R397]*[.R$402]+[.S397]*[.S$402]+[.T397]*[.T$402]+[.U397]*[.U$402] -> 0.218586564834393 | Y397: of:=[.W397]+[.X397] -> 0 | Z397: of:=[.Y397]/[.Y$401] -> 0 | AA397: of:=[.D397]+[.M397]+[.V397]+[.Z397] -> 2.61152949320987 | AB397: of:=RANK([.AA397];[.AA$2:.AA$399];0) -> 396
A398: Corby | B398: 50580 | C398: of:=IF(SUM([.E398:.L398])>0;[.B398];0) -> 50580 | D398: of:=[.C398]/[.C$401] -> 1.90504238009014 | I398: 1 | M398: of:=[.E398]*[.AC$11]+[.F398]*[.AC$13]+[.G398]*[.AC$15]+[.H398]*[.AC$17]+[.I398]*[.AC$19]+[.J398]*[.AC$21]+[.K398]*[.AC$23]+[.L398]*[.AC$25] -> 0.369899405999412 | N398: of:=IF([.E398]>0;1;0) -> 0 | O398: of:=IF([.F398]>0;1;0) -> 0 | P398: of:=IF([.G398]>0;1;0) -> 0 | Q398: of:=IF([.H398]>0;1;0) -> 0 | R398: of:=IF([.I398]>0;1;0) -> 1 | S398: of:=IF([.J398]>0;1;0) -> 0 | T398: of:=IF([.K398]>0;1;0) -> 0 | U398: of:=IF([.L398]>0;1;0) -> 0 | V398: of:=[.N398]*[.N$402]+[.O398]*[.O$402]+[.P398]*[.P$402]+[.Q398]*[.Q$402]+[.R398]*[.R$402]+[.S398]*[.S$402]+[.T398]*[.T$402]+[.U398]*[.U$402] -> 0.218586564834393 | Y398: of:=[.W398]+[.X398] -> 0 | Z398: of:=[.Y398]/[.Y$401] -> 0 | AA398: of:=[.D398]+[.M398]+[.V398]+[.Z398] -> 2.49352835092394 | AB398: of:=RANK([.AA398];[.AA$2:.AA$399];0) -> 397
A399: Forest of Dean | B399: 67348 | C399: of:=IF(SUM([.E399:.L399])>0;[.B399];0) -> 67348 | D399: of:=[.C399]/[.C$401] -> 2.53659142377047 | H399: 1 | L399: 1 | M399: of:=[.E399]*[.AC$11]+[.F399]*[.AC$13]+[.G399]*[.AC$15]+[.H399]*[.AC$17]+[.I399]*[.AC$19]+[.J399]*[.AC$21]+[.K399]*[.AC$23]+[.L399]*[.AC$25] -> 1.02390704070172 | N399: of:=IF([.E399]>0;1;0) -> 0 | O399: of:=IF([.F399]>0;1;0) -> 0 | P399: of:=IF([.G399]>0;1;0) -> 0 | Q399: of:=IF([.H399]>0;1;0) -> 1 | R399: of:=IF([.I399]>0;1;0) -> 0 | S399: of:=IF([.J399]>0;1;0) -> 0 | T399: of:=IF([.K399]>0;1;0) -> 0 | U399: of:=IF([.L399]>0;1;0) -> 1 | V399: of:=[.N399]*[.N$402]+[.O399]*[.O$402]+[.P399]*[.P$402]+[.Q399]*[.Q$402]+[.R399]*[.R$402]+[.S399]*[.S$402]+[.T399]*[.T$402]+[.U399]*[.U$402] -> 0.308633066549229 | W399: 38673 | X399: of:=-[.$AD$1] -> -44717 | Y399: of:=[.W399]+[.X399] -> -6044 | Z399: of:=[.Y399]/[.Y$401] -> -1.92446515428169 | AA399: of:=[.D399]+[.M399]+[.V399]+[.Z399] -> 1.94466637673973 | AB399: of:=RANK([.AA399];[.AA$2:.AA$399];0) -> 398
B400: of:=SUM([.B2:.B399]) -> 63139406 | C400: of:=SUM([.C2:.C399]) -> 63139406 | D400: of:=SUM([.D2:.D399]) -> 2378.07916733328 | E400: of:=SUM([.E2:.E399])*[.AC11] -> 1211.74939595561 | F400: of:=SUM([.F2:.F399])*[.AC13] -> 475.496203332249 | G400: of:=SUM([.G2:.G399])*[.AC15] -> 374.449422279037 | H400: of:=SUM([.H2:.H399])*[.AC17] -> 248.356235920441 | I400: of:=SUM([.I2:.I399])*[.AC19] -> 46.607325155926 | J400: of:=SUM([.J2:.J399])*[.AC21] -> 7.89254643258531 | K400: of:=SUM([.K2:.K399])*[.AC23] -> 8.96081891751736 | L400: of:=SUM([.L2:.L399])*[.AC25] -> 4.5672193398998 | M400: of:=SUM([.M2:.M399]) -> 2378.07916733328 | N400: of:=SUM([.N2:.N399]) -> 60 | O400: of:=SUM([.O2:.O399]) -> 64 | P400: of:=SUM([.P2:.P399]) -> 137 | Q400: of:=SUM([.Q2:.Q399]) -> 247 | R400: of:=SUM([.R2:.R399]) -> 126 | S400: of:=SUM([.S2:.S399]) -> 58 | T400: of:=SUM([.T2:.T399]) -> 179 | U400: of:=SUM([.U2:.U399]) -> 248 | V400: of:=SUM([.V2:.V399]) -> 2378.07916733328 | W400: of:=SUM([.W2:.W399]) -> 6127116 | Y400: of:=SUM([.Y2:.Y399]) -> 7468626 | Z400: of:=SUM([.Z2:.Z399]) -> 2378.07916733327 | AA400: of:=SUM([.AA2:.AA399]) -> 9512.31666933311
B401: of:=[.B400]/[.M400] -> 26550.5904375769 | C401: of:=[.C400]/[.M400] -> 26550.5904375769 | L401: of:=SUM([.E400:.L400]) -> 2378.07916733327 | M401: of:=[.M400]/60 -> 39.6346527888881 | N401: of:=[.M400]*[.AC11]/[.AC27] -> 1503.73717981928 | O401: of:=[.M400]*[.AC13]/[.AC27] -> 553.193993380639 | P401: of:=[.M400]*[.AC15]/[.AC27] -> 203.508697144268 | Q401: of:=[.M400]*[.AC17]/[.AC27] -> 74.8666657789615 | R401: of:=[.M400]*[.AC19]/[.AC27] -> 27.5419071691335 | S401: of:=[.M400]*[.AC21]/[.AC27] -> 10.1321014181766 | T401: of:=[.M400]*[.AC23]/[.AC27] -> 3.72739180761118 | U401: of:=[.M400]*[.AC25]/[.AC27] -> 1.37123081521101 | Y401: of:=[.Y400]/[.L401] -> 3140.6128536819
E402: of:=SUM([.E2:.E399]) -> 60 | F402: of:=SUM([.F2:.F399]) -> 64 | G402: of:=SUM([.G2:.G399]) -> 137 | H402: of:=SUM([.H2:.H399]) -> 247 | I402: of:=SUM([.I2:.I399]) -> 126 | J402: of:=SUM([.J2:.J399]) -> 58 | K402: of:=SUM([.K2:.K399]) -> 179 | L402: of:=SUM([.L2:.L399]) -> 248 | N402: of:=[.N401]/[.N400] -> 25.0622863303214 | O402: of:=[.O401]/[.O400] -> 8.64365614657248 | P402: of:=[.P401]/[.P400] -> 1.48546494265889 | Q402: of:=[.Q401]/[.Q400] -> 0.303103910036281 | R402: of:=[.R401]/[.R400] -> 0.218586564834393 | S402: of:=[.S401]/[.S400] -> 0.174691403761665 | T402: of:=[.T401]/[.T400] -> 0.0208234179196155 | U402: of:=[.U401]/[.U400] -> 0.00552915651294763
N403: /124 | O403: /90 | P403: /150
N405: of:=1-[.N400]/124 -> 0.516129032258065 | O405: of:=1-[.O400]/90 -> 0.288888888888889 | P405: of:=1-[.P400]/150 -> 0.0866666666666667
N406: of:=124-[.N400] -> 64 | O406: of:=90-[.O400] -> 26 | P406: of:=150-[.P400] -> 13