Sheet: 2012 Scotland
A1: Date | B1: Council | C1: Ward | D1: By-election votes | K1: 2012 votes | R1: Seats | Y1: Change %
D2: C | E2: Lab | F2: LD | G2: Grn | H2: UKIP | I2: SNP | J2: Ind/Other | K2: C | L2: Lab | M2: LD | N2: Grn | O2: UKIP | P2: SNP | Q2: Ind/Other | R2: C | S2: Lab | T2: LD | U2: Grn | V2: UKIP | W2: SNP | X2: Ind/Other | Y2: C | Z2: Lab | AA2: LD | AB2: Grn | AC2: UKIP | AD2: SNP | AE2: Ind/Other
A3: 2015-07-09 | B3: N Lanarks | C3: Thorniewood | D3: 149 | E3: 1410 | G3: 51 | H3: 29 | I3: 1555 | J3: of:=81+33 -> 114 | K3: 225 | L3: 3066 | P3: 1057 | Y3: of:=[.D3]/SUM([.$D3:.$J3])-[.K3]/SUM([.$K3:.$Q3]) -> -0.0067056084382985 | Z3: of:=[.E3]/SUM([.$D3:.$J3])-[.L3]/SUM([.$K3:.$Q3]) -> -0.278912374339367 | AB3: of:=[.G3]/SUM([.$D3:.$J3])-[.N3]/SUM([.$K3:.$Q3]) -> 0.0154171704957678 | AC3: of:=[.H3]/SUM([.$D3:.$J3])-[.O3]/SUM([.$K3:.$Q3]) -> 0.00876662636033857 | AD3: of:=[.I3]/SUM([.$D3:.$J3])-[.P3]/SUM([.$K3:.$Q3]) -> 0.226972275401608 | AE3: of:=[.J3]/SUM([.$D3:.$J3])-[.Q3]/SUM([.$K3:.$Q3]) -> 0.0344619105199516
A4: 2015-07-30 | B4: Aberdeen | C4: Hilton/Woodside/Stockethill | D4: 350 | E4: 771 | F4: 125 | G4: 130 | I4: 1690 | K4: 203 | L4: 1692 | M4: 145 | N4: 99 | P4: 1335 | Q4: of:=243+41 -> 284 | Y4: of:=[.D4]/SUM([.$D4:.$J4])-[.K4]/SUM([.$K4:.$Q4]) -> 0.0601371564103125 | Z4: of:=[.E4]/SUM([.$D4:.$J4])-[.L4]/SUM([.$K4:.$Q4]) -> -0.198771778718121 | AA4: of:=[.F4]/SUM([.$D4:.$J4])-[.M4]/SUM([.$K4:.$Q4]) -> 0.00218537917109731 | AB4: of:=[.G4]/SUM([.$D4:.$J4])-[.N4]/SUM([.$K4:.$Q4]) -> 0.0160567219590162 | AD4: of:=[.I4]/SUM([.$D4:.$J4])-[.P4]/SUM([.$K4:.$Q4]) -> 0.195964634003667 | AE4: of:=[.J4]/SUM([.$D4:.$J4])-[.Q4]/SUM([.$K4:.$Q4]) -> -0.0755721128259713
A5: 2015-07-30 | B5: Aberdeen | C5: Kincorth/Nigg/Cove | D5: 313 | E5: 606 | F5: 207 | G5: 114 | I5: 1939 | K5: 219 | L5: 1541 | M5: 331 | P5: 1389 | Q5: of:=591 -> 591 | Y5: of:=[.D5]/SUM([.$D5:.$J5])-[.K5]/SUM([.$K5:.$Q5]) -> 0.0446634984606747 | Z5: of:=[.E5]/SUM([.$D5:.$J5])-[.L5]/SUM([.$K5:.$Q5]) -> -0.187905090432801 | AA5: of:=[.F5]/SUM([.$D5:.$J5])-[.M5]/SUM([.$K5:.$Q5]) -> -0.0161919882451382 | AB5: of:=[.G5]/SUM([.$D5:.$J5])-[.N5]/SUM([.$K5:.$Q5]) -> 0.0358603334381881 | AD5: of:=[.I5]/SUM([.$D5:.$J5])-[.P5]/SUM([.$K5:.$Q5]) -> 0.268746422902879 | AE5: of:=[.J5]/SUM([.$D5:.$J5])-[.Q5]/SUM([.$K5:.$Q5]) -> -0.145173176123803
A6: 2015-08-06 | B6: Glasgow | C6: Anderston/City | D6: 164 | E6: 857 | F6: 66 | G6: 414 | H6: 43 | I6: 1441 | J6: 12 | K6: 249 | L6: 2674 | M6: 89 | N6: 558 | P6: 1573 | Q6: of:=89+46+20+17 -> 172 | Y6: of:=[.D6]/SUM([.$D6:.$J6])-[.K6]/SUM([.$K6:.$Q6]) -> 0.00787284619206852 | Z6: of:=[.E6]/SUM([.$D6:.$J6])-[.L6]/SUM([.$K6:.$Q6]) -> -0.217151802162777 | AA6: of:=[.F6]/SUM([.$D6:.$J6])-[.M6]/SUM([.$K6:.$Q6]) -> 0.00527696087432682 | AB6: of:=[.G6]/SUM([.$D6:.$J6])-[.N6]/SUM([.$K6:.$Q6]) -> 0.0331522491447233 | AC6: of:=[.H6]/SUM([.$D6:.$J6])-[.O6]/SUM([.$K6:.$Q6]) -> 0.0143476810143477 | AD6: of:=[.I6]/SUM([.$D6:.$J6])-[.P6]/SUM([.$K6:.$Q6]) -> 0.184859302701887 | AE6: of:=[.J6]/SUM([.$D6:.$J6])-[.Q6]/SUM([.$K6:.$Q6]) -> -0.0283572377645755
A7: 2015-08-06 | B7: Glasgow | C7: Calton | D7: 129 | E7: 814 | F7: 18 | G7: 99 | H7: 103 | I7: 1507 | J7: 47 | K7: 120 | L7: 2487 | M7: 43 | N7: 135 | P7: 1378 | Q7: of:=131+109+71+43+41+9 -> 404 | Y7: of:=[.D7]/SUM([.$D7:.$J7])-[.K7]/SUM([.$K7:.$Q7]) -> 0.0212033826061231 | Z7: of:=[.E7]/SUM([.$D7:.$J7])-[.L7]/SUM([.$K7:.$Q7]) -> -0.244963649628695 | AA7: of:=[.F7]/SUM([.$D7:.$J7])-[.M7]/SUM([.$K7:.$Q7]) -> -0.0027904171474176 | AB7: of:=[.G7]/SUM([.$D7:.$J7])-[.N7]/SUM([.$K7:.$Q7]) -> 0.00687736082386492 | AC7: of:=[.H7]/SUM([.$D7:.$J7])-[.O7]/SUM([.$K7:.$Q7]) -> 0.0379094589620905 | AD7: of:=[.I7]/SUM([.$D7:.$J7])-[.P7]/SUM([.$K7:.$Q7]) -> 0.252926069700873 | AE7: of:=[.J7]/SUM([.$D7:.$J7])-[.Q7]/SUM([.$K7:.$Q7]) -> -0.0711622053168387
A8: 2015-08-06 | B8: Glasgow | C8: Craigton | D8: 300 | E8: 1643 | F8: 87 | G8: 136 | H8: 95 | I8: 2674 | K8: 292 | L8: 4381 | M8: 76 | N8: 169 | O8: 86 | P8: 2576 | Q8: of:=472+147 -> 619 | Y8: of:=[.D8]/SUM([.$D8:.$J8])-[.K8]/SUM([.$K8:.$Q8]) -> 0.025176174275831 | Z8: of:=[.E8]/SUM([.$D8:.$J8])-[.L8]/SUM([.$K8:.$Q8]) -> -0.201405390456468 | AA8: of:=[.F8]/SUM([.$D8:.$J8])-[.M8]/SUM([.$K8:.$Q8]) -> 0.00835975623092889 | AB8: of:=[.G8]/SUM([.$D8:.$J8])-[.N8]/SUM([.$K8:.$Q8]) -> 0.00694598755649273 | AC8: of:=[.H8]/SUM([.$D8:.$J8])-[.O8]/SUM([.$K8:.$Q8]) -> 0.00876116925816812 | AD8: of:=[.I8]/SUM([.$D8:.$J8])-[.P8]/SUM([.$K8:.$Q8]) -> 0.227659314965759 | AE8: of:=[.J8]/SUM([.$D8:.$J8])-[.Q8]/SUM([.$K8:.$Q8]) -> -0.0754970118307111
A9: 2015-08-06 | B9: Glasgow | C9: Langside | D9: 379 | E9: 932 | F9: 125 | G9: 579 | H9: 65 | I9: 2134 | J9: 62 | K9: 498 | L9: 2441 | M9: 493 | N9: 618 | P9: 2582 | Q9: of:=162+70 -> 232 | U9: -1 | W9: 1 | Y9: of:=[.D9]/SUM([.$D9:.$J9])-[.K9]/SUM([.$K9:.$Q9]) -> 0.016081790052791 | Z9: of:=[.E9]/SUM([.$D9:.$J9])-[.L9]/SUM([.$K9:.$Q9]) -> -0.137662832178735 | AA9: of:=[.F9]/SUM([.$D9:.$J9])-[.M9]/SUM([.$K9:.$Q9]) -> -0.0425910813539439 | AB9: of:=[.G9]/SUM([.$D9:.$J9])-[.N9]/SUM([.$K9:.$Q9]) -> 0.0453719573223783 | AC9: of:=[.H9]/SUM([.$D9:.$J9])-[.O9]/SUM([.$K9:.$Q9]) -> 0.0152011225444341 | AD9: of:=[.I9]/SUM([.$D9:.$J9])-[.P9]/SUM([.$K9:.$Q9]) -> 0.122899045139457 | AE9: of:=[.J9]/SUM([.$D9:.$J9])-[.Q9]/SUM([.$K9:.$Q9]) -> -0.0193000015263813
A10: 2015-08-06 | B10: S Lanarks | C10: Hamilton S | D10: 349 | E10: 1396 | F10: 32 | G10: 127 | H10: 43 | I10: 1881 | J10: of:=77+13 -> 90 | K10: 496 | L10: 2775 | P10: 1757 | Q10: of:=199+165 -> 364 | Y10: of:=[.D10]/SUM([.$D10:.$J10])-[.K10]/SUM([.$K10:.$Q10]) -> -0.00291207134991359 | Z10: of:=[.E10]/SUM([.$D10:.$J10])-[.L10]/SUM([.$K10:.$Q10]) -> -0.158347098456034 | AA10: of:=[.F10]/SUM([.$D10:.$J10])-[.M10]/SUM([.$K10:.$Q10]) -> 0.00816743236345074 | AB10: of:=[.G10]/SUM([.$D10:.$J10])-[.N10]/SUM([.$K10:.$Q10]) -> 0.0324144971924451 | AC10: of:=[.H10]/SUM([.$D10:.$J10])-[.O10]/SUM([.$K10:.$Q10]) -> 0.0109749872383869 | AD10: of:=[.I10]/SUM([.$D10:.$J10])-[.P10]/SUM([.$K10:.$Q10]) -> 0.154238767887086 | AE10: of:=[.J10]/SUM([.$D10:.$J10])-[.Q10]/SUM([.$K10:.$Q10]) -> -0.0445365148754209
A11: 2015-08-13 | B11: Falkirk | C11: Denny/Banknock | D11: 431 | E11: 549 | G11: 170 | I11: 2576 | K11: 196 | L11: 1632 | P11: 2073 | Q11: of:=622+411+387 -> 1420 | Y11: of:=[.D11]/SUM([.$D11:.$J11])-[.K11]/SUM([.$K11:.$Q11]) -> 0.0788384633022641 | Z11: of:=[.E11]/SUM([.$D11:.$J11])-[.L11]/SUM([.$K11:.$Q11]) -> -0.159366270006637 | AB11: of:=[.G11]/SUM([.$D11:.$J11])-[.N11]/SUM([.$K11:.$Q11]) -> 0.0456253354804079 | AD11: of:=[.I11]/SUM([.$D11:.$J11])-[.P11]/SUM([.$K11:.$Q11]) -> 0.301769601462642 | AE11: of:=[.J11]/SUM([.$D11:.$J11])-[.Q11]/SUM([.$K11:.$Q11]) -> -0.266867130238677
A12: 2015-08-13 | B12: N Lanarks | C12: Wishaw | D12: 385 | E12: 1230 | F12: 37 | H12: 67 | I12: 1915 | J12: 117 | K12: 412 | L12: 3004 | P12: 1792 | Y12: of:=[.D12]/SUM([.$D12:.$J12])-[.K12]/SUM([.$K12:.$Q12]) -> 0.0235302332076526 | Z12: of:=[.E12]/SUM([.$D12:.$J12])-[.L12]/SUM([.$K12:.$Q12]) -> -0.248892358863033 | AA12: of:=[.F12]/SUM([.$D12:.$J12])-[.M12]/SUM([.$K12:.$Q12]) -> 0.00986403625699813 | AC12: of:=[.H12]/SUM([.$D12:.$J12])-[.O12]/SUM([.$K12:.$Q12]) -> 0.017861903492402 | AD12: of:=[.I12]/SUM([.$D12:.$J12])-[.P12]/SUM([.$K12:.$Q12]) -> 0.166444503687905 | AE12: of:=[.J12]/SUM([.$D12:.$J12])-[.Q12]/SUM([.$K12:.$Q12]) -> 0.0311916822180752
A13: 2015-09-17 | B13: South Ayrshire | C13: Ayr E | D13: 1527 | E13: 642 | G13: 76 | I13: 1507 | J13: 218 | K13: 1689 | L13: 1199 | P13: 1609 | Q13: 622 | Y13: of:=[.D13]/SUM([.$D13:.$J13])-[.K13]/SUM([.$K13:.$Q13]) -> 0.0546875053819844 | Z13: of:=[.E13]/SUM([.$D13:.$J13])-[.L13]/SUM([.$K13:.$Q13]) -> -0.072512588307599 | AB13: of:=[.G13]/SUM([.$D13:.$J13])-[.N13]/SUM([.$K13:.$Q13]) -> 0.0191435768261965 | AD13: of:=[.I13]/SUM([.$D13:.$J13])-[.P13]/SUM([.$K13:.$Q13]) -> 0.0652777743606449 | AE13: of:=[.J13]/SUM([.$D13:.$J13])-[.Q13]/SUM([.$K13:.$Q13]) -> -0.0665962682612266
A14: 2015-10-01 | B14: Aberdeen | C14: George St/Harbour | D14: 195 | E14: 490 | F14: 96 | G14: 136 | I14: 961 | K14: 178 | L14: 837 | M14: 262 | N14: 194 | P14: 896 | Q14: of:=262+29 -> 291 | Y14: of:=[.D14]/SUM([.$D14:.$J14])-[.K14]/SUM([.$K14:.$Q14]) -> 0.0368662209689478 | Z14: of:=[.E14]/SUM([.$D14:.$J14])-[.L14]/SUM([.$K14:.$Q14]) -> -0.0539825519199378 | AA14: of:=[.F14]/SUM([.$D14:.$J14])-[.M14]/SUM([.$K14:.$Q14]) -> -0.0474521427867406 | AB14: of:=[.G14]/SUM([.$D14:.$J14])-[.N14]/SUM([.$K14:.$Q14]) -> -0.000569743038677614 | AD14: of:=[.I14]/SUM([.$D14:.$J14])-[.P14]/SUM([.$K14:.$Q14]) -> 0.174619029417492 | AE14: of:=[.J14]/SUM([.$D14:.$J14])-[.Q14]/SUM([.$K14:.$Q14]) -> -0.109480812641084
A15: 2015-10-01 | B15: Aberdeen | C15: Midstocket/Rosemount | D15: 672 | E15: 605 | F15: 238 | G15: 170 | I15: 1168 | K15: 531 | L15: 1247 | M15: 245 | N15: 245 | P15: 1497 | Q15: 82 | R15: -1 | W15: 1 | Y15: of:=[.D15]/SUM([.$D15:.$J15])-[.K15]/SUM([.$K15:.$Q15]) -> 0.0975119017454436 | Z15: of:=[.E15]/SUM([.$D15:.$J15])-[.L15]/SUM([.$K15:.$Q15]) -> -0.112091203937938 | AA15: of:=[.F15]/SUM([.$D15:.$J15])-[.M15]/SUM([.$K15:.$Q15]) -> 0.0197349713101674 | AB15: of:=[.G15]/SUM([.$D15:.$J15])-[.N15]/SUM([.$K15:.$Q15]) -> -0.00409958880199528 | AD15: of:=[.I15]/SUM([.$D15:.$J15])-[.P15]/SUM([.$K15:.$Q15]) -> 0.0202592303159831 | AE15: of:=[.J15]/SUM([.$D15:.$J15])-[.Q15]/SUM([.$K15:.$Q15]) -> -0.021315310631661
A16: 2015-10-01 | B16: East Ayrshire | C16: Irvine Vy | D16: 865 | E16: 860 | G16: 88 | I16: 1797 | K16: 857 | L16: 1423 | P16: 2099 | Q16: 339 | Y16: of:=[.D16]/SUM([.$D16:.$J16])-[.K16]/SUM([.$K16:.$Q16]) -> 0.0579674236348328 | Z16: of:=[.E16]/SUM([.$D16:.$J16])-[.L16]/SUM([.$K16:.$Q16]) -> -0.0633837052415515 | AB16: of:=[.G16]/SUM([.$D16:.$J16])-[.N16]/SUM([.$K16:.$Q16]) -> 0.0243767313019391 | AD16: of:=[.I16]/SUM([.$D16:.$J16])-[.P16]/SUM([.$K16:.$Q16]) -> 0.0528920301691289 | AE16: of:=[.J16]/SUM([.$D16:.$J16])-[.Q16]/SUM([.$K16:.$Q16]) -> -0.0718524798643493
A17: 2015-11-05 | B17: Aberdeenshire | C17: Huntly/Strathbogie/Howe of Alford (2) | D17: 1469 | E17: 196 | F17: 928 | I17: 1433 | J17: 20 | K17: 1091 | M17: 752 | N17: 256 | P17: 1430 | Q17: 593 | R17: 1 | T17: -1 | Y17: of:=[.D17]/SUM([.$D17:.$J17])-[.K17]/SUM([.$K17:.$Q17]) -> 0.0983973005247994 | Z17: of:=[.E17]/SUM([.$D17:.$J17])-[.L17]/SUM([.$K17:.$Q17]) -> 0.0484429065743945 | AA17: of:=[.F17]/SUM([.$D17:.$J17])-[.M17]/SUM([.$K17:.$Q17]) -> 0.0469266223485713 | AB17: of:=[.G17]/SUM([.$D17:.$J17])-[.N17]/SUM([.$K17:.$Q17]) -> -0.0621057738961669 | AD17: of:=[.I17]/SUM([.$D17:.$J17])-[.P17]/SUM([.$K17:.$Q17]) -> 0.00725799353048867 | AE17: of:=[.J17]/SUM([.$D17:.$J17])-[.Q17]/SUM([.$K17:.$Q17]) -> -0.138919049082087
A18: 2015-09-10 | B18: Edinburgh | C18: Leith Walk (2) | D18: 501 | E18: 1623 | F18: 255 | G18: 1381 | H18: 102 | I18: 2290 | J18: of:=97+32+26+17 -> 172 | K18: 637 | L18: 2611 | M18: 400 | N18: 1593 | P18: 2237 | Q18: of:=200+109+69 -> 378 | S18: 1 | T18: -1 | Y18: of:=[.D18]/SUM([.$D18:.$J18])-[.K18]/SUM([.$K18:.$Q18]) -> -0.00186250999972948 | Z18: of:=[.E18]/SUM([.$D18:.$J18])-[.L18]/SUM([.$K18:.$Q18]) -> -0.0757160675846451 | AA18: of:=[.F18]/SUM([.$D18:.$J18])-[.M18]/SUM([.$K18:.$Q18]) -> -0.0105939162998489 | AB18: of:=[.G18]/SUM([.$D18:.$J18])-[.N18]/SUM([.$K18:.$Q18]) -> 0.0155994974693116 | AC18: of:=[.H18]/SUM([.$D18:.$J18])-[.O18]/SUM([.$K18:.$Q18]) -> 0.0161290322580645 | AD18: of:=[.I18]/SUM([.$D18:.$J18])-[.P18]/SUM([.$K18:.$Q18]) -> 0.0773620778053025 | AE18: of:=[.J18]/SUM([.$D18:.$J18])-[.Q18]/SUM([.$K18:.$Q18]) -> -0.0209181136484552
A19: 2015-09-10 | B19: Midlothian | C19: Midlothian W | D19: 524 | E19: 945 | F19: 162 | G19: 372 | I19: 1540 | J19: 25 | K19: 462 | L19: 1538 | M19: 246 | N19: 226 | P19: 1719 | Q19: of:=102+41 -> 143 | Y19: of:=[.D19]/SUM([.$D19:.$J19])-[.K19]/SUM([.$K19:.$Q19]) -> 0.0402620017755116 | Z19: of:=[.E19]/SUM([.$D19:.$J19])-[.L19]/SUM([.$K19:.$Q19]) -> -0.090014221682349 | AA19: of:=[.F19]/SUM([.$D19:.$J19])-[.M19]/SUM([.$K19:.$Q19]) -> -0.0113569109409177 | AB19: of:=[.G19]/SUM([.$D19:.$J19])-[.N19]/SUM([.$K19:.$Q19]) -> 0.0521142659666709 | AD19: of:=[.I19]/SUM([.$D19:.$J19])-[.P19]/SUM([.$K19:.$Q19]) -> 0.0349830622815531 | AE19: of:=[.J19]/SUM([.$D19:.$J19])-[.Q19]/SUM([.$K19:.$Q19]) -> -0.0259881974004689
A20: 2015-10-01 | B20: Moray | C20: Heldon/Laich | D20: 703 | G20: 192 | I20: 1003 | J20: 1323 | K20: 668 | N20: 262 | P20: 1475 | Q20: 1560 | Y20: of:=[.D20]/SUM([.$D20:.$J20])-[.K20]/SUM([.$K20:.$Q20]) -> 0.0497810514463524 | AB20: of:=[.G20]/SUM([.$D20:.$J20])-[.N20]/SUM([.$K20:.$Q20]) -> -0.00646936697343607 | AD20: of:=[.I20]/SUM([.$D20:.$J20])-[.P20]/SUM([.$K20:.$Q20]) -> -0.0606110671104233 | AE20: of:=[.J20]/SUM([.$D20:.$J20])-[.Q20]/SUM([.$K20:.$Q20]) -> 0.017299382637507
A21: 2015-10-01 | B21: Fife | C21: Glenrothes W/Kinglassie | D21: 234 | E21: 1207 | G21: 113 | I21: 2235 | K21: 155 | L21: 2132 | M21: 83 | P21: 2200 | Q21: of:=271+192+147 -> 610 | Y21: of:=[.D21]/SUM([.$D21:.$J21])-[.K21]/SUM([.$K21:.$Q21]) -> 0.0318349397921844 | Z21: of:=[.E21]/SUM([.$D21:.$J21])-[.L21]/SUM([.$K21:.$Q21]) -> -0.0930293034806099 | AA21: of:=[.F21]/SUM([.$D21:.$J21])-[.M21]/SUM([.$K21:.$Q21]) -> -0.016023166023166 | AB21: of:=[.G21]/SUM([.$D21:.$J21])-[.N21]/SUM([.$K21:.$Q21]) -> 0.0298231723409871 | AD21: of:=[.I21]/SUM([.$D21:.$J21])-[.P21]/SUM([.$K21:.$Q21]) -> 0.165154975131222 | AE21: of:=[.J21]/SUM([.$D21:.$J21])-[.Q21]/SUM([.$K21:.$Q21]) -> -0.117760617760618
A22: 2015-10-01 | B22: Stirling | C22: Stirling E | D22: 343 | E22: 1094 | G22: 152 | I22: 1311 | K22: 302 | L22: 1720 | M22: 403 | N22: 163 | P22: 1278 | Y22: of:=[.D22]/SUM([.$D22:.$J22])-[.K22]/SUM([.$K22:.$Q22]) -> 0.040158945359188 | Z22: of:=[.E22]/SUM([.$D22:.$J22])-[.L22]/SUM([.$K22:.$Q22]) -> -0.0676629145334213 | AA22: of:=[.F22]/SUM([.$D22:.$J22])-[.M22]/SUM([.$K22:.$Q22]) -> -0.104242110708743 | AB22: of:=[.G22]/SUM([.$D22:.$J22])-[.N22]/SUM([.$K22:.$Q22]) -> 0.0102513513031379 | AD22: of:=[.I22]/SUM([.$D22:.$J22])-[.P22]/SUM([.$K22:.$Q22]) -> 0.121494728579838 | AE22: of:=[.J22]/SUM([.$D22:.$J22])-[.Q22]/SUM([.$K22:.$Q22]) -> 0
A23: 2015-10-01 | B23: W Lothian | C23: Linlithgow | D23: 973 | E23: 1088 | F23: 133 | G23: 282 | I23: 2049 | J23: 230 | K23: 2112 | L23: 1292 | P23: 2656 | Q23: of:=280+25 -> 305 | Y23: of:=[.D23]/SUM([.$D23:.$J23])-[.K23]/SUM([.$K23:.$Q23]) -> -0.127187902427097 | Z23: of:=[.E23]/SUM([.$D23:.$J23])-[.L23]/SUM([.$K23:.$Q23]) -> 0.0258267024498957 | AA23: of:=[.F23]/SUM([.$D23:.$J23])-[.M23]/SUM([.$K23:.$Q23]) -> 0.0279705573080967 | AB23: of:=[.G23]/SUM([.$D23:.$J23])-[.N23]/SUM([.$K23:.$Q23]) -> 0.0593059936908517 | AD23: of:=[.I23]/SUM([.$D23:.$J23])-[.P23]/SUM([.$K23:.$Q23]) -> 0.0136328155007794 | AE23: of:=[.J23]/SUM([.$D23:.$J23])-[.Q23]/SUM([.$K23:.$Q23]) -> 0.00045183347747399
A24: 2015-10-08 | B24: Highland | C24: Aird/Loch Ness | D24: 467 | F24: 1029 | G24: 287 | I24: 1000 | J24: 293 | K24: 279 | L24: 221 | M24: 498 | O24: 66 | P24: 1127 | Q24: 1853 | T24: 1 | W24: -1 | Y24: of:=[.D24]/SUM([.$D24:.$J24])-[.K24]/SUM([.$K24:.$Q24]) -> 0.0828294482410005 | Z24: of:=[.E24]/SUM([.$D24:.$J24])-[.L24]/SUM([.$K24:.$Q24]) -> -0.054648862512364 | AA24: of:=[.F24]/SUM([.$D24:.$J24])-[.M24]/SUM([.$K24:.$Q24]) -> 0.21137995701381 | AB24: of:=[.G24]/SUM([.$D24:.$J24])-[.N24]/SUM([.$K24:.$Q24]) -> 0.0933029908972692 | AC24: of:=[.H24]/SUM([.$D24:.$J24])-[.O24]/SUM([.$K24:.$Q24]) -> -0.0163204747774481 | AD24: of:=[.I24]/SUM([.$D24:.$J24])-[.P24]/SUM([.$K24:.$Q24]) -> 0.0464130584378083 | AE24: of:=[.J24]/SUM([.$D24:.$J24])-[.Q24]/SUM([.$K24:.$Q24]) -> -0.362956117300076
A25: 2015-11-26 | B25: Fife | C25: Dunfermline N | D25: 304 | E25: 719 | F25: 230 | G25: 63 | H25: 58 | I25: 1056 | K25: 253 | L25: 1841 | M25: 518 | P25: 1204 | Y25: of:=[.D25]/SUM([.$D25:.$J25])-[.K25]/SUM([.$K25:.$Q25]) -> 0.0588030903020421 | Z25: of:=[.E25]/SUM([.$D25:.$J25])-[.L25]/SUM([.$K25:.$Q25]) -> -0.186557574345834 | AA25: of:=[.F25]/SUM([.$D25:.$J25])-[.M25]/SUM([.$K25:.$Q25]) -> -0.0410940290395217 | AB25: of:=[.G25]/SUM([.$D25:.$J25])-[.N25]/SUM([.$K25:.$Q25]) -> 0.0259259259259259 | AC25: of:=[.H25]/SUM([.$D25:.$J25])-[.O25]/SUM([.$K25:.$Q25]) -> 0.0238683127572016 | AD25: of:=[.I25]/SUM([.$D25:.$J25])-[.P25]/SUM([.$K25:.$Q25]) -> 0.119054274400186 | AE25: of:=[.J25]/SUM([.$D25:.$J25])-[.Q25]/SUM([.$K25:.$Q25]) -> 0
A26: 2015-11-26 | B26: Fife | C26: Rosyth | D26: 245 | E26: 926 | F26: 97 | G26: 51 | H26: 88 | I26: 1214 | J26: 66 | K26: 223 | L26: 1843 | M26: 275 | O26: 101 | P26: 1382 | Q26: 41 | Y26: of:=[.D26]/SUM([.$D26:.$J26])-[.K26]/SUM([.$K26:.$Q26]) -> 0.0334824710611343 | Z26: of:=[.E26]/SUM([.$D26:.$J26])-[.L26]/SUM([.$K26:.$Q26]) -> -0.132221211708331 | AA26: of:=[.F26]/SUM([.$D26:.$J26])-[.M26]/SUM([.$K26:.$Q26]) -> -0.0350516188576978 | AB26: of:=[.G26]/SUM([.$D26:.$J26])-[.N26]/SUM([.$K26:.$Q26]) -> 0.0189802754000744 | AC26: of:=[.H26]/SUM([.$D26:.$J26])-[.O26]/SUM([.$K26:.$Q26]) -> 0.00661832569349525 | AD26: of:=[.I26]/SUM([.$D26:.$J26])-[.P26]/SUM([.$K26:.$Q26]) -> 0.0942370697686287 | AE26: of:=[.J26]/SUM([.$D26:.$J26])-[.Q26]/SUM([.$K26:.$Q26]) -> 0.0139546886426958
A27: 2015-12-10 | B27: S Lanarks | C27: Blantyre | D27: 140 | E27: 1476 | F27: 92 | H27: 59 | I27: 1236 | J27: 112 | K27: 176 | L27: 2476 | M27: 32 | P27: 1399 | Q27: of:=234+209+40 -> 483 | Y27: of:=[.D27]/SUM([.$D27:.$J27])-[.K27]/SUM([.$K27:.$Q27]) -> 0.00639804711915624 | Z27: of:=[.E27]/SUM([.$D27:.$J27])-[.L27]/SUM([.$K27:.$Q27]) -> -0.0684326682879741 | AA27: of:=[.F27]/SUM([.$D27:.$J27])-[.M27]/SUM([.$K27:.$Q27]) -> 0.0225261880505572 | AC27: of:=[.H27]/SUM([.$D27:.$J27])-[.O27]/SUM([.$K27:.$Q27]) -> 0.0189406099518459 | AD27: of:=[.I27]/SUM([.$D27:.$J27])-[.P27]/SUM([.$K27:.$Q27]) -> 0.0903946329524737 | AE27: of:=[.J27]/SUM([.$D27:.$J27])-[.Q27]/SUM([.$K27:.$Q27]) -> -0.0698268097860592
R28: of:=SUM([.R3:.R27]) -> 0 | S28: of:=SUM([.S3:.S27]) -> 1 | T28: of:=SUM([.T3:.T27]) -> -1 | U28: of:=SUM([.U3:.U27]) -> -1 | V28: of:=SUM([.V3:.V27]) -> 0 | W28: of:=SUM([.W3:.W27]) -> 1 | X28: Average | Y28: of:=AVERAGE([.Y3:.Y27]) -> 0.0331126319858102 | Z28: of:=AVERAGE([.Z3:.Z27]) -> -0.126223412906706 | AA28: of:=AVERAGE([.AA3:.AA27]) -> 0.00175022397624348 | AB28: of:=AVERAGE([.AB3:.AB27]) -> 0.0223174313837119 | AC28: of:=AVERAGE([.AC3:.AC27]) -> 0.0135882295627773 | AD28: of:=AVERAGE([.AD3:.AD27]) -> 0.124996064935795 | AE28: of:=AVERAGE([.AE3:.AE27]) -> -0.0653887867753104
A29: 2016-01-21 | B29: S Lanarks | C29: Hamilton N/E | D29: 469 | E29: 855 | F29: 45 | G29: 83 | I29: 1089 | K29: 430 | L29: 1831 | N29: 133 | P29: 1721 | Q29: 141 | Y29: of:=[.D29]/SUM([.$D29:.$J29])-[.K29]/SUM([.$K29:.$Q29]) -> 0.0835391681683548 | Z29: of:=[.E29]/SUM([.$D29:.$J29])-[.L29]/SUM([.$K29:.$Q29]) -> -0.0937344652954701 | AA29: of:=[.F29]/SUM([.$D29:.$J29])-[.M29]/SUM([.$K29:.$Q29]) -> 0.0177095631641086 | AB29: of:=[.G29]/SUM([.$D29:.$J29])-[.N29]/SUM([.$K29:.$Q29]) -> 0.00141430539157812 | AD29: of:=[.I29]/SUM([.$D29:.$J29])-[.P29]/SUM([.$K29:.$Q29]) -> 0.0242011278195489 | AE29: of:=[.J29]/SUM([.$D29:.$J29])-[.Q29]/SUM([.$K29:.$Q29]) -> -0.0331296992481203
A30: 2016-02-18 | B30: Argyll/Bute | C30: Oban N/Lorn | D30: 609 | G30: 300 | I30: 1113 | J30: 608 | K30: 332 | M30: 188 | P30: 1117 | Q30: of:=807+421+361+222+125+58 -> 1994 | W30: 1 | X30: -1 | Y30: of:=[.D30]/SUM([.$D30:.$J30])-[.K30]/SUM([.$K30:.$Q30]) -> 0.140124068933235 | AA30: of:=[.F30]/SUM([.$D30:.$J30])-[.M30]/SUM([.$K30:.$Q30]) -> -0.0517763701459653 | AB30: of:=[.G30]/SUM([.$D30:.$J30])-[.N30]/SUM([.$K30:.$Q30]) -> 0.114068441064639 | AD30: of:=[.I30]/SUM([.$D30:.$J30])-[.P30]/SUM([.$K30:.$Q30]) -> 0.115565163940005 | AE30: of:=[.J30]/SUM([.$D30:.$J30])-[.Q30]/SUM([.$K30:.$Q30]) -> -0.317981303791914
A31: 2016-03-31 | B31: Dundee | C31: Maryfield | D31: 294 | E31: 634 | F31: 85 | G31: 116 | H31: 69 | I31: 1383 | J31: of:=142+73 -> 215 | K31: 249 | L31: 1251 | M31: 126 | P31: 1746 | Q31: 62 | Y31: of:=[.D31]/SUM([.$D31:.$J31])-[.K31]/SUM([.$K31:.$Q31]) -> 0.0326400223965845 | Z31: of:=[.E31]/SUM([.$D31:.$J31])-[.L31]/SUM([.$K31:.$Q31]) -> -0.137545690948797 | AA31: of:=[.F31]/SUM([.$D31:.$J31])-[.M31]/SUM([.$K31:.$Q31]) -> -0.0062913322385003 | AB31: of:=[.G31]/SUM([.$D31:.$J31])-[.N31]/SUM([.$K31:.$Q31]) -> 0.0414878397711016 | AC31: of:=[.H31]/SUM([.$D31:.$J31])-[.O31]/SUM([.$K31:.$Q31]) -> 0.0246781115879828 | AD31: of:=[.I31]/SUM([.$D31:.$J31])-[.P31]/SUM([.$K31:.$Q31]) -> -0.013809769010226 | AE31: of:=[.J31]/SUM([.$D31:.$J31])-[.Q31]/SUM([.$K31:.$Q31]) -> 0.0588408184418543
A32: 2016-04-07 | B32: Perth/Kinross | C32: Almond/Earn | D32: 1651 | E32: 219 | F32: 157 | H32: 77 | I32: 1327 | K32: 1112 | L32: 369 | M32: 244 | P32: 1520 | Q32: 444 | Y32: of:=[.D32]/SUM([.$D32:.$J32])-[.K32]/SUM([.$K32:.$Q32]) -> 0.17976411237486 | Z32: of:=[.E32]/SUM([.$D32:.$J32])-[.L32]/SUM([.$K32:.$Q32]) -> -0.0361973203831979 | AA32: of:=[.F32]/SUM([.$D32:.$J32])-[.M32]/SUM([.$K32:.$Q32]) -> -0.0203833322048369 | AC32: of:=[.H32]/SUM([.$D32:.$J32])-[.O32]/SUM([.$K32:.$Q32]) -> 0.0224424366074031 | AD32: of:=[.I32]/SUM([.$D32:.$J32])-[.P32]/SUM([.$K32:.$Q32]) -> -0.0252680758466548 | AE32: of:=[.J32]/SUM([.$D32:.$J32])-[.Q32]/SUM([.$K32:.$Q32]) -> -0.120357820547574
A33: 2016-06-02 | B33: Argyll/Bute | C33: Oban N/Lorn | D33: 591 | F33: 294 | I33: 1055 | J33: 711 | K33: 332 | M33: 188 | P33: 1117 | Q33: of:=807+421+361+222+125+58 -> 1994 | Y33: of:=[.D33]/SUM([.$D33:.$J33])-[.K33]/SUM([.$K33:.$Q33]) -> 0.13149987517896 | AA33: of:=[.F33]/SUM([.$D33:.$J33])-[.M33]/SUM([.$K33:.$Q33]) -> 0.0591251764402286 | AD33: of:=[.I33]/SUM([.$D33:.$J33])-[.P33]/SUM([.$K33:.$Q33]) -> 0.0903342804080001 | AE33: of:=[.J33]/SUM([.$D33:.$J33])-[.Q33]/SUM([.$K33:.$Q33]) -> -0.280959332027188
R34: of:=SUM([.R29:.R33]) -> 0 | S34: of:=SUM([.S29:.S33]) -> 0 | T34: of:=SUM([.T29:.T33]) -> 0 | U34: of:=SUM([.U29:.U33]) -> 0 | V34: of:=SUM([.V29:.V33]) -> 0 | W34: of:=SUM([.W29:.W33]) -> 1 | X34: Average | Y34: of:=AVERAGE([.Y29:.Y33]) -> 0.113513449410399 | Z34: of:=AVERAGE([.Z29:.Z33]) -> -0.0891591588758217 | AA34: of:=AVERAGE([.AA29:.AA33]) -> -0.000323258996993055 | AB34: of:=AVERAGE([.AB29:.AB33]) -> 0.0523235287424395 | AC34: of:=AVERAGE([.AC29:.AC33]) -> 0.023560274097693 | AD34: of:=AVERAGE([.AD29:.AD33]) -> 0.0382045454621347 | AE34: of:=AVERAGE([.AE29:.AE33]) -> -0.138717467434589
A35: 2016-08-11 | B35: N Ayrs | C35: Irvine W | D35: 639 | E35: 1029 | F35: 48 | G35: 94 | I35: 1264 | J35: 131 | K35: 614 | L35: 2065 | M35: 246 | P35: 1889 | Q35: of:=187+81+51 -> 319 | S35: 1 | W35: -1 | Y35: of:=[.D35]/SUM([.$D35:.$J35])-[.K35]/SUM([.$K35:.$Q35]) -> 0.0797578180158182 | Z35: of:=[.E35]/SUM([.$D35:.$J35])-[.L35]/SUM([.$K35:.$Q35]) -> -0.0812380081410153 | AA35: of:=[.F35]/SUM([.$D35:.$J35])-[.M35]/SUM([.$K35:.$Q35]) -> -0.0329485908834366 | AB35: of:=[.G35]/SUM([.$D35:.$J35])-[.N35]/SUM([.$K35:.$Q35]) -> 0.0293291731669267 | AD35: of:=[.I35]/SUM([.$D35:.$J35])-[.P35]/SUM([.$K35:.$Q35]) -> 0.0263728655516764 | AE35: of:=[.J35]/SUM([.$D35:.$J35])-[.Q35]/SUM([.$K35:.$Q35]) -> -0.0212732577099694
A36: 2016-08-11 | B36: Renfs | C36: Renfrew S/Gallowhill | D36: 366 | E36: 1012 | F36: 53 | I36: 1309 | K36: 197 | L36: 2098 | M36: 86 | P36: 1887 | Q36: 90 | S36: -1 | W36: 1 | Y36: of:=[.D36]/SUM([.$D36:.$J36])-[.K36]/SUM([.$K36:.$Q36]) -> 0.0883724202155278 | Z36: of:=[.E36]/SUM([.$D36:.$J36])-[.L36]/SUM([.$K36:.$Q36]) -> -0.112070426734288 | AD36: of:=[.I36]/SUM([.$D36:.$J36])-[.P36]/SUM([.$K36:.$Q36]) -> 0.0447404387601625 | AE36: of:=[.J36]/SUM([.$D36:.$J36])-[.Q36]/SUM([.$K36:.$Q36]) -> -0.0206516750803121
A37: 2016-08-25 | B37: Fife | C37: Lochs | D37: 270 | E37: 1318 | F37: 45 | I37: 1079 | J37: 86 | K37: 99 | L37: 1729 | P37: 708 | Q37: of:=1025+165 -> 1190 | S37: 1 | X37: -1 | Y37: of:=[.D37]/SUM([.$D37:.$J37])-[.K37]/SUM([.$K37:.$Q37]) -> 0.0699274499038305 | Z37: of:=[.E37]/SUM([.$D37:.$J37])-[.L37]/SUM([.$K37:.$Q37]) -> 0.00701425026771285 | AA37: of:=[.F37]/SUM([.$D37:.$J37])-[.M37]/SUM([.$K37:.$Q37]) -> 0.0160829163688349 | AD37: of:=[.I37]/SUM([.$D37:.$J37])-[.P37]/SUM([.$K37:.$Q37]) -> 0.195616491650926 | AE37: of:=[.J37]/SUM([.$D37:.$J37])-[.Q37]/SUM([.$K37:.$Q37]) -> -0.288641108191304
A38: 2016-09-22 | B38: N Lanarks | C38: Coatbridge N/Glenboig | D38: 366 | E38: 1350 | G38: 195 | H38: 63 | I38: 1261 | K38: 289 | L38: 2566 | P38: 1490 | Q38: 496 | S38: 1 | W38: -1 | Y38: of:=[.D38]/SUM([.$D38:.$J38])-[.K38]/SUM([.$K38:.$Q38]) -> 0.0534391485402731 | Z38: of:=[.E38]/SUM([.$D38:.$J38])-[.L38]/SUM([.$K38:.$Q38]) -> -0.112745108994622 | AB38: of:=[.G38]/SUM([.$D38:.$J38])-[.N38]/SUM([.$K38:.$Q38]) -> 0.0602782071097372 | AC38: of:=[.H38]/SUM([.$D38:.$J38])-[.O38]/SUM([.$K38:.$Q38]) -> 0.0194744976816074 | AD38: of:=[.I38]/SUM([.$D38:.$J38])-[.P38]/SUM([.$K38:.$Q38]) -> 0.0820114254626329 | AE38: of:=[.J38]/SUM([.$D38:.$J38])-[.Q38]/SUM([.$K38:.$Q38]) -> -0.102458169799628
A39: 2016-10-06 | B39: Glasgow | C39: Garscadden/Scotstounhill | D39: 510 | E39: 1944 | F39: 97 | G39: 242 | H39: 83 | I39: 2135 | K39: 215 | L39: 5056 | M39: 90 | N39: 221 | O39: 69 | P39: 2220 | Q39: of:=151+135+29+22 -> 337 | S39: -1 | W39: 1 | Y39: of:=[.D39]/SUM([.$D39:.$J39])-[.K39]/SUM([.$K39:.$Q39]) -> 0.0755821354812784 | Z39: of:=[.E39]/SUM([.$D39:.$J39])-[.L39]/SUM([.$K39:.$Q39]) -> -0.228037887796944 | AA39: of:=[.F39]/SUM([.$D39:.$J39])-[.M39]/SUM([.$K39:.$Q39]) -> 0.00839250140918051 | AB39: of:=[.G39]/SUM([.$D39:.$J39])-[.N39]/SUM([.$K39:.$Q39]) -> 0.0213688024747116 | AC39: of:=[.H39]/SUM([.$D39:.$J39])-[.O39]/SUM([.$K39:.$Q39]) -> 0.0081571274190932 | AD39: of:=[.I39]/SUM([.$D39:.$J39])-[.P39]/SUM([.$K39:.$Q39]) -> 0.155594825885975 | AE39: of:=[.J39]/SUM([.$D39:.$J39])-[.Q39]/SUM([.$K39:.$Q39]) -> -0.0410575048732944
A40: 2016-10-06 | B40: Highland | C40: Culloden/Ardersier | D40: 439 | E40: 163 | F40: 483 | G40: 180 | I40: 753 | J40: of:=315+274+158+23 -> 770 | K40: 154 | L40: 479 | M40: 475 | N40: 170 | P40: 941 | Q40: 1224 | Y40: of:=[.D40]/SUM([.$D40:.$J40])-[.K40]/SUM([.$K40:.$Q40]) -> 0.112732110688895 | Z40: of:=[.E40]/SUM([.$D40:.$J40])-[.L40]/SUM([.$K40:.$Q40]) -> -0.0806580086183223 | AA40: of:=[.F40]/SUM([.$D40:.$J40])-[.M40]/SUM([.$K40:.$Q40]) -> 0.0352813872657016 | AB40: of:=[.G40]/SUM([.$D40:.$J40])-[.N40]/SUM([.$K40:.$Q40]) -> 0.0151868657467733 | AD40: of:=[.I40]/SUM([.$D40:.$J40])-[.P40]/SUM([.$K40:.$Q40]) -> -0.0032220782733019 | AE40: of:=[.J40]/SUM([.$D40:.$J40])-[.Q40]/SUM([.$K40:.$Q40]) -> -0.0793202768097456
R41: of:=SUM([.R35:.R40]) -> 0 | S41: of:=SUM([.S35:.S40]) -> 1 | T41: of:=SUM([.T35:.T40]) -> 0 | U41: of:=SUM([.U35:.U40]) -> 0 | V41: of:=SUM([.V35:.V40]) -> 0 | W41: of:=SUM([.W35:.W40]) -> 0 | X41: Average | Y41: of:=AVERAGE([.Y35:.Y40]) -> 0.0799685138076038 | Z41: of:=AVERAGE([.Z35:.Z40]) -> -0.101289198336247 | AA41: of:=AVERAGE([.AA35:.AA40]) -> 0.00670205354007009 | AB41: of:=AVERAGE([.AB35:.AB40]) -> 0.0315407621245372 | AC41: of:=AVERAGE([.AC35:.AC40]) -> 0.0138158125503503 | AD41: of:=AVERAGE([.AD35:.AD40]) -> 0.0835189948396785 | AE41: of:=AVERAGE([.AE35:.AE40]) -> -0.092233665410709

Sheet: 2012 Wales
A1: Date | B1: Council | C1: Ward | D1: By-election votes | K1: 2012 votes | R1: Seats | Y1: Change %
D2: C | E2: Lab | F2: LD | G2: Grn | H2: UKIP | I2: PC | J2: Ind/Other | K2: C | L2: Lab | M2: LD | N2: Grn | O2: UKIP | P2: PC | Q2: Ind/Other | R2: C | S2: Lab | T2: LD | U2: Grn | V2: UKIP | W2: PC | X2: Ind/Other | Y2: C | Z2: Lab | AA2: LD | AB2: Grn | AC2: UKIP | AD2: PC | AE2: Ind/Other
A3: 2015-06-30 | B3: Cardiff | C3: Pentyrch | D3: 561 | E3: 234 | F3: 10 | G3: 22 | I3: 543 | J3: 24 | K3: 772 | L3: 413 | M3: 22 | N3: 40 | P3: 171 | Y3: of:=[.D3]/SUM([.$D3:.$J3])-[.K3]/SUM([.$K3:.$Q3]) -> -0.141989748529361 | Z3: of:=[.E3]/SUM([.$D3:.$J3])-[.L3]/SUM([.$K3:.$Q3]) -> -0.123393022281671 | AA3: of:=[.F3]/SUM([.$D3:.$J3])-[.M3]/SUM([.$K3:.$Q3]) -> -0.00834120844319702 | AB3: of:=[.G3]/SUM([.$D3:.$J3])-[.N3]/SUM([.$K3:.$Q3]) -> -0.0124268221857528 | AD3: of:=[.I3]/SUM([.$D3:.$J3])-[.P3]/SUM([.$K3:.$Q3]) -> 0.268934158685319 | AE3: of:=[.J3]/SUM([.$D3:.$J3])-[.Q3]/SUM([.$K3:.$Q3]) -> 0.0172166427546628
A4: 2015-07-09 | B4: Gwynedd | C4: Morfa Nefyn | I4: 315 | J4: 123 | P4: 378 | Q4: 110 | AD4: of:=[.I4]/SUM([.$D4:.$J4])-[.P4]/SUM([.$K4:.$Q4]) -> -0.0554120817426454 | AE4: of:=[.J4]/SUM([.$D4:.$J4])-[.Q4]/SUM([.$K4:.$Q4]) -> 0.0554120817426454
A5: 2015-07-16 | B5: Denbighshire | C5: Prestatyn E | D5: 528 | E5: 373 | I5: 60 | J5: 76 | K5: 524 | L5: 364 | N5: 50 | Q5: 322 | Y5: of:=[.D5]/SUM([.$D5:.$J5])-[.K5]/SUM([.$K5:.$Q5]) -> 0.0932880255927508 | Z5: of:=[.E5]/SUM([.$D5:.$J5])-[.L5]/SUM([.$K5:.$Q5]) -> 0.070802528661738 | AB5: of:=[.G5]/SUM([.$D5:.$J5])-[.N5]/SUM([.$K5:.$Q5]) -> -0.0396825396825397 | AD5: of:=[.I5]/SUM([.$D5:.$J5])-[.P5]/SUM([.$K5:.$Q5]) -> 0.0578592092574735 | AE5: of:=[.J5]/SUM([.$D5:.$J5])-[.Q5]/SUM([.$K5:.$Q5]) -> -0.182267223829422
A6: 2015-07-16 | B6: Wrexham | C6: Llay | D6: 64 | E6: 353 | F6: 700 | H6: 60 | J6: of:=124+41 -> 165 | L6: 825 | Q6: 450 | S6: -1 | T6: 1 | Y6: of:=[.D6]/SUM([.$D6:.$J6])-[.K6]/SUM([.$K6:.$Q6]) -> 0.0476900149031297 | Z6: of:=[.E6]/SUM([.$D6:.$J6])-[.L6]/SUM([.$K6:.$Q6]) -> -0.384018585079337 | AA6: of:=[.F6]/SUM([.$D6:.$J6])-[.M6]/SUM([.$K6:.$Q6]) -> 0.521609538002981 | AC6: of:=[.H6]/SUM([.$D6:.$J6])-[.O6]/SUM([.$K6:.$Q6]) -> 0.0447093889716841 | AE6: of:=[.J6]/SUM([.$D6:.$J6])-[.Q6]/SUM([.$K6:.$Q6]) -> -0.229990356798457
A7: 2015-07-23 | B7: Caerphilly | C7: New Tredegar | D7: 47 | E7: 648 | H7: 90 | L7: 965 | Q7: 362 | Y7: of:=[.D7]/SUM([.$D7:.$J7])-[.K7]/SUM([.$K7:.$Q7]) -> 0.0598726114649682 | Z7: of:=[.E7]/SUM([.$D7:.$J7])-[.L7]/SUM([.$K7:.$Q7]) -> 0.0982734869611547 | AC7: of:=[.H7]/SUM([.$D7:.$J7])-[.O7]/SUM([.$K7:.$Q7]) -> 0.114649681528662 | AE7: of:=[.J7]/SUM([.$D7:.$J7])-[.Q7]/SUM([.$K7:.$Q7]) -> -0.272795779954785
A8: 2015-08-13 | B8: Powys | C8: Glasbury | D8: 415 | F8: 457 | G8: 52 | J8: 106 | K8: 502 | Q8: of:=299+180 -> 479 | R8: -1 | T8: 1 | Y8: of:=[.D8]/SUM([.$D8:.$J8])-[.K8]/SUM([.$K8:.$Q8]) -> -0.108810110546995 | AA8: of:=[.F8]/SUM([.$D8:.$J8])-[.M8]/SUM([.$K8:.$Q8]) -> 0.443689320388349 | AB8: of:=[.G8]/SUM([.$D8:.$J8])-[.N8]/SUM([.$K8:.$Q8]) -> 0.0504854368932039 | AE8: of:=[.J8]/SUM([.$D8:.$J8])-[.Q8]/SUM([.$K8:.$Q8]) -> -0.385364646734559
A9: 2015-08-13 | B9: Caerphilly | C9: Crosskeys | E9: 354 | H9: 166 | I9: 179 | K9: 39 | L9: 543 | P9: 126 | Q9: 281 | Y9: of:=[.D9]/SUM([.$D9:.$J9])-[.K9]/SUM([.$K9:.$Q9]) -> -0.0394337714863498 | Z9: of:=[.E9]/SUM([.$D9:.$J9])-[.L9]/SUM([.$K9:.$Q9]) -> -0.042601665531143 | AC9: of:=[.H9]/SUM([.$D9:.$J9])-[.O9]/SUM([.$K9:.$Q9]) -> 0.237482117310443 | AD9: of:=[.I9]/SUM([.$D9:.$J9])-[.P9]/SUM([.$K9:.$Q9]) -> 0.128678698877929 | AE9: of:=[.J9]/SUM([.$D9:.$J9])-[.Q9]/SUM([.$K9:.$Q9]) -> -0.28412537917088
A10: 2015-09-03 | B10: Caerphilly | C10: Bedwas/Trethomas/Machen | D10: 119 | E10: 1002 | H10: 223 | I10: 509 | J10: of:=184+106 -> 290 | L10: 1854 | P10: 664 | Q10: 508 | Y10: of:=[.D10]/SUM([.$D10:.$J10])-[.K10]/SUM([.$K10:.$Q10]) -> 0.0555296313579095 | Z10: of:=[.E10]/SUM([.$D10:.$J10])-[.L10]/SUM([.$K10:.$Q10]) -> -0.145121191083406 | AC10: of:=[.H10]/SUM([.$D10:.$J10])-[.O10]/SUM([.$K10:.$Q10]) -> 0.104059729351377 | AD10: of:=[.I10]/SUM([.$D10:.$J10])-[.P10]/SUM([.$K10:.$Q10]) -> 0.0180859059715473 | AE10: of:=[.J10]/SUM([.$D10:.$J10])-[.Q10]/SUM([.$K10:.$Q10]) -> -0.0325540755974277
A11: 2015-10-07 | B11: Cardiff | C11: Riverside | D11: 155 | E11: 1071 | F11: 85 | G11: 109 | H11: 110 | I11: 780 | J11: 21 | K11: 286 | L11: 1731 | M11: 142 | N11: 294 | P11: 1153 | Q11: 99 | Y11: of:=[.D11]/SUM([.$D11:.$J11])-[.K11]/SUM([.$K11:.$Q11]) -> -0.0106979159610739 | Z11: of:=[.E11]/SUM([.$D11:.$J11])-[.L11]/SUM([.$K11:.$Q11]) -> -0.00774701827333402 | AA11: of:=[.F11]/SUM([.$D11:.$J11])-[.M11]/SUM([.$K11:.$Q11]) -> -0.00186154922997028 | AB11: of:=[.G11]/SUM([.$D11:.$J11])-[.N11]/SUM([.$K11:.$Q11]) -> -0.032591179959601 | AC11: of:=[.H11]/SUM([.$D11:.$J11])-[.O11]/SUM([.$K11:.$Q11]) -> 0.0471900471900472 | AD11: of:=[.I11]/SUM([.$D11:.$J11])-[.P11]/SUM([.$K11:.$Q11]) -> 0.0234192549982024 | AE11: of:=[.J11]/SUM([.$D11:.$J11])-[.Q11]/SUM([.$K11:.$Q11]) -> -0.0177116387642703
A12: 2015-10-22 | B12: Colchester | C12: Dedham/Langham | D12: 545 | E12: 38 | F12: 57 | H12: 60 | K12: 596 | L12: 81 | M12: 81 | N12: 78 | Y12: of:=[.D12]/SUM([.$D12:.$J12])-[.K12]/SUM([.$K12:.$Q12]) -> 0.0656527682843473 | Z12: of:=[.E12]/SUM([.$D12:.$J12])-[.L12]/SUM([.$K12:.$Q12]) -> -0.0426042378673958 | AA12: of:=[.F12]/SUM([.$D12:.$J12])-[.M12]/SUM([.$K12:.$Q12]) -> -0.0154613807245386 | AB12: of:=[.G12]/SUM([.$D12:.$J12])-[.N12]/SUM([.$K12:.$Q12]) -> -0.0933014354066986 | AC12: of:=[.H12]/SUM([.$D12:.$J12])-[.O12]/SUM([.$K12:.$Q12]) -> 0.0857142857142857
A13: 2015-11-12 | B13: Bridgend | C13: Ogmore Vale | D13: 47 | E13: 365 | H13: 32 | I13: 101 | J13: 203 | L13: 414 | Q13: 505 | S13: 1 | X13: -1 | Y13: of:=[.D13]/SUM([.$D13:.$J13])-[.K13]/SUM([.$K13:.$Q13]) -> 0.0628342245989305 | Z13: of:=[.E13]/SUM([.$D13:.$J13])-[.L13]/SUM([.$K13:.$Q13]) -> 0.0374782517616801 | AC13: of:=[.H13]/SUM([.$D13:.$J13])-[.O13]/SUM([.$K13:.$Q13]) -> 0.0427807486631016 | AD13: of:=[.I13]/SUM([.$D13:.$J13])-[.P13]/SUM([.$K13:.$Q13]) -> 0.135026737967914 | AE13: of:=[.J13]/SUM([.$D13:.$J13])-[.Q13]/SUM([.$K13:.$Q13]) -> -0.278119962991627
A14: 2015-11-19 | B14: Gwynedd | C14: Dewi | E14: 110 | F14: 19 | I14: 189 | L14: 154 | M14: 35 | P14: 254 | Z14: of:=[.E14]/SUM([.$D14:.$J14])-[.L14]/SUM([.$K14:.$Q14]) -> -0.00171784715419454 | AA14: of:=[.F14]/SUM([.$D14:.$J14])-[.M14]/SUM([.$K14:.$Q14]) -> -0.0192583443360734 | AD14: of:=[.I14]/SUM([.$D14:.$J14])-[.P14]/SUM([.$K14:.$Q14]) -> 0.0209761914902679
A15: 2015-11-19 | B15: Gwynedd | C15: Llanaelhaearn | I15: 200 | J15: of:=112+99 -> 211 | P15: 85 | Q15: of:=353+238+32 -> 623 | W15: 1 | X15: -1 | AD15: of:=[.I15]/SUM([.$D15:.$J15])-[.P15]/SUM([.$K15:.$Q15]) -> 0.366561507691039 | AE15: of:=[.J15]/SUM([.$D15:.$J15])-[.Q15]/SUM([.$K15:.$Q15]) -> -0.366561507691039
A16: 2015-11-19 | B16: Carmarthenshire | C16: Kidwelly | D16: 53 | E16: 288 | I16: 248 | J16: of:=177+58+28 -> 263 | L16: 571 | Q16: of:=300+238+117 -> 655 | Y16: of:=[.D16]/SUM([.$D16:.$J16])-[.K16]/SUM([.$K16:.$Q16]) -> 0.0622065727699531 | Z16: of:=[.E16]/SUM([.$D16:.$J16])-[.L16]/SUM([.$K16:.$Q16]) -> -0.127714082209407 | AD16: of:=[.I16]/SUM([.$D16:.$J16])-[.P16]/SUM([.$K16:.$Q16]) -> 0.291079812206573 | AE16: of:=[.J16]/SUM([.$D16:.$J16])-[.Q16]/SUM([.$K16:.$Q16]) -> -0.225572302767119
A17: 2015-11-26 | B17: Newport | C17: Bettws | D17: 114 | E17: 294 | F17: 7 | G17: 29 | J17: of:=336+275 -> 611 | L17: 616 | Q17: of:=840+158 -> 998 | Y17: of:=[.D17]/SUM([.$D17:.$J17])-[.K17]/SUM([.$K17:.$Q17]) -> 0.108056872037915 | Z17: of:=[.E17]/SUM([.$D17:.$J17])-[.L17]/SUM([.$K17:.$Q17]) -> -0.102987485097811 | AA17: of:=[.F17]/SUM([.$D17:.$J17])-[.M17]/SUM([.$K17:.$Q17]) -> 0.00663507109004739 | AB17: of:=[.G17]/SUM([.$D17:.$J17])-[.N17]/SUM([.$K17:.$Q17]) -> 0.0274881516587678 | AE17: of:=[.J17]/SUM([.$D17:.$J17])-[.Q17]/SUM([.$K17:.$Q17]) -> -0.0391926096889187
A18: 2015-11-26 | B18: Gwynedd | C18: Pwllheli S | I18: 168 | J18: of:=269+106+49 -> 424 | P18: 252 | Q18: 374 | AD18: of:=[.I18]/SUM([.$D18:.$J18])-[.P18]/SUM([.$K18:.$Q18]) -> -0.118772126759347 | AE18: of:=[.J18]/SUM([.$D18:.$J18])-[.Q18]/SUM([.$K18:.$Q18]) -> 0.118772126759347
A19: 2015-12-16 | B19: Conwy | C19: Gogarth | D19: 318 | E19: 187 | F19: 49 | I19: 167 | J19: 28 | K19: 317 | L19: 279 | P19: 220 | Q19: of:=368+212 -> 580 | Y19: of:=[.D19]/SUM([.$D19:.$J19])-[.K19]/SUM([.$K19:.$Q19]) -> 0.197488724220642 | Z19: of:=[.E19]/SUM([.$D19:.$J19])-[.L19]/SUM([.$K19:.$Q19]) -> 0.0498094881044832 | AA19: of:=[.F19]/SUM([.$D19:.$J19])-[.M19]/SUM([.$K19:.$Q19]) -> 0.0654205607476635 | AD19: of:=[.I19]/SUM([.$D19:.$J19])-[.P19]/SUM([.$K19:.$Q19]) -> 0.0653708287267455 | AE19: of:=[.J19]/SUM([.$D19:.$J19])-[.Q19]/SUM([.$K19:.$Q19]) -> -0.378089601799534
R20: of:=SUM([.R3:.R19]) -> -1 | S20: of:=SUM([.S3:.S19]) -> 0 | T20: of:=SUM([.T3:.T19]) -> 2 | U20: of:=SUM([.U3:.U19]) -> 0 | V20: of:=SUM([.V3:.V19]) -> 0 | W20: of:=SUM([.W3:.W19]) -> 1 | X20: Average | Y20: of:=AVERAGE([.Y3:.Y19]) -> 0.0347452229774435 | Z20: of:=AVERAGE([.Z3:.Z19]) -> -0.0555031830068187 | AA20: of:=AVERAGE([.AA3:.AA19]) -> 0.124054000936908 | AB20: of:=AVERAGE([.AB3:.AB19]) -> -0.0166713981137701 | AC20: of:=AVERAGE([.AC3:.AC19]) -> 0.0966551426756573 | AD20: of:=AVERAGE([.AD3:.AD19]) -> 0.100150674780918 | AE20: of:=AVERAGE([.AE3:.AE19]) -> -0.166729615635426
A21: 2016-02-18 | B21: Flintshire | C21: New Brighton | D21: 141 | E21: 241 | F21: 365 | J21: 60 | K21: 229 | L21: 334 | M21: 469 | Y21: of:=[.D21]/SUM([.$D21:.$J21])-[.K21]/SUM([.$K21:.$Q21]) -> -0.0471780352151235 | Z21: of:=[.E21]/SUM([.$D21:.$J21])-[.L21]/SUM([.$K21:.$Q21]) -> -0.0250064839629982 | AA21: of:=[.F21]/SUM([.$D21:.$J21])-[.M21]/SUM([.$K21:.$Q21]) -> -0.00216492320106049 | AE21: of:=[.J21]/SUM([.$D21:.$J21])-[.Q21]/SUM([.$K21:.$Q21]) -> 0.0743494423791822
A22: 2016-03-31 | B22: Caerphilly | C22: Moriah | D22: 7 | E22: 464 | H22: 77 | J22: of:=196+89 -> 285 | L22: 698 | P22: 420 | Q22: 363 | Y22: of:=[.D22]/SUM([.$D22:.$J22])-[.K22]/SUM([.$K22:.$Q22]) -> 0.00840336134453782 | Z22: of:=[.E22]/SUM([.$D22:.$J22])-[.L22]/SUM([.$K22:.$Q22]) -> 0.0857196355922517 | AC22: of:=[.H22]/SUM([.$D22:.$J22])-[.O22]/SUM([.$K22:.$Q22]) -> 0.092436974789916 | AD22: of:=[.I22]/SUM([.$D22:.$J22])-[.P22]/SUM([.$K22:.$Q22]) -> -0.283592167454423 | AE22: of:=[.J22]/SUM([.$D22:.$J22])-[.Q22]/SUM([.$K22:.$Q22]) -> 0.0970321957277172
A23: 2016-04-07 | B23: Caerphilly | C23: Ynysddu | E23: 502 | F23: 36 | H23: 180 | I23: 134 | K23: 70 | L23: 719 | P23: 382 | Y23: of:=[.D23]/SUM([.$D23:.$J23])-[.K23]/SUM([.$K23:.$Q23]) -> -0.0597779675491033 | Z23: of:=[.E23]/SUM([.$D23:.$J23])-[.L23]/SUM([.$K23:.$Q23]) -> -0.0248032458915177 | AA23: of:=[.F23]/SUM([.$D23:.$J23])-[.M23]/SUM([.$K23:.$Q23]) -> 0.0422535211267606 | AC23: of:=[.H23]/SUM([.$D23:.$J23])-[.O23]/SUM([.$K23:.$Q23]) -> 0.211267605633803 | AD23: of:=[.I23]/SUM([.$D23:.$J23])-[.P23]/SUM([.$K23:.$Q23]) -> -0.168939913319942
A24: 2016-06-02 | B24: Denbighshire | C24: Denbigh Lr | D24: 159 | E24: 108 | F24: 101 | I24: 315 | J24: of:=389 -> 389 | K24: 118 | M24: 138 | P24: 386 | Q24: 977 | Y24: of:=[.D24]/SUM([.$D24:.$J24])-[.K24]/SUM([.$K24:.$Q24]) -> 0.0754363989195468 | Z24: of:=[.E24]/SUM([.$D24:.$J24])-[.L24]/SUM([.$K24:.$Q24]) -> 0.100746268656716 | AA24: of:=[.F24]/SUM([.$D24:.$J24])-[.M24]/SUM([.$K24:.$Q24]) -> 0.00897861679865035 | AD24: of:=[.I24]/SUM([.$D24:.$J24])-[.P24]/SUM([.$K24:.$Q24]) -> 0.0554245065592359 | AE24: of:=[.J24]/SUM([.$D24:.$J24])-[.Q24]/SUM([.$K24:.$Q24]) -> -0.24058579093415
A25: 2016-06-02 | B25: Denbighshire | C25: Dyserth | D25: 140 | E25: 87 | F25: 107 | I25: 21 | J25: of:=177+159 -> 336 | K25: 369 | L25: 275 | M25: 84 | R25: -1 | X25: 1 | Y25: of:=[.D25]/SUM([.$D25:.$J25])-[.K25]/SUM([.$K25:.$Q25]) -> -0.304263211462922 | Z25: of:=[.E25]/SUM([.$D25:.$J25])-[.L25]/SUM([.$K25:.$Q25]) -> -0.251842766495444 | AA25: of:=[.F25]/SUM([.$D25:.$J25])-[.M25]/SUM([.$K25:.$Q25]) -> 0.0394634309250807 | AD25: of:=[.I25]/SUM([.$D25:.$J25])-[.P25]/SUM([.$K25:.$Q25]) -> 0.0303907380607815 | AE25: of:=[.J25]/SUM([.$D25:.$J25])-[.Q25]/SUM([.$K25:.$Q25]) -> 0.486251808972504
R26: of:=SUM([.R21:.R25]) -> -1 | S26: of:=SUM([.S21:.S25]) -> 0 | T26: of:=SUM([.T21:.T25]) -> 0 | U26: of:=SUM([.U21:.U25]) -> 0 | V26: of:=SUM([.V21:.V25]) -> 0 | W26: of:=SUM([.W21:.W25]) -> 0 | X26: Average | Y26: of:=AVERAGE([.Y21:.Y25]) -> -0.0654758907926128 | Z26: of:=AVERAGE([.Z21:.Z25]) -> -0.0230373184201983 | AA26: of:=AVERAGE([.AA21:.AA25]) -> 0.0221326614123578 | AB26: 0 | AC26: of:=AVERAGE([.AC21:.AC25]) -> 0.151852290211859 | AD26: of:=AVERAGE([.AD21:.AD25]) -> -0.0916792090385869 | AE26: of:=AVERAGE([.AE21:.AE25]) -> 0.104261914036313
A27: 2016-06-30 | B27: Vale of Glamorgan | C27: Rhoose | D27: 520 | E27: 401 | F27: 24 | I27: 104 | J27: of:=598+399+4 -> 1001 | K27: 810 | L27: 713 | Q27: 882 | Y27: of:=[.D27]/SUM([.$D27:.$J27])-[.K27]/SUM([.$K27:.$Q27]) -> -0.083139800212971 | Z27: of:=[.E27]/SUM([.$D27:.$J27])-[.L27]/SUM([.$K27:.$Q27]) -> -0.100855940368136 | AA27: of:=[.F27]/SUM([.$D27:.$J27])-[.M27]/SUM([.$K27:.$Q27]) -> 0.0117073170731707 | AD27: of:=[.I27]/SUM([.$D27:.$J27])-[.P27]/SUM([.$K27:.$Q27]) -> 0.0507317073170732 | AE27: of:=[.J27]/SUM([.$D27:.$J27])-[.Q27]/SUM([.$K27:.$Q27]) -> 0.121556716190863
A28: 2016-07-07 | B28: Conwy | C28: Mostyn | D28: 200 | E28: 248 | F28: 126 | H28: 75 | J28: of:=88+27 -> 115 | K28: 243 | L28: 436 | M28: 131 | Q28: 250 | Y28: of:=[.D28]/SUM([.$D28:.$J28])-[.K28]/SUM([.$K28:.$Q28]) -> 0.032534821693174 | Z28: of:=[.E28]/SUM([.$D28:.$J28])-[.L28]/SUM([.$K28:.$Q28]) -> -0.0867134248740492 | AA28: of:=[.F28]/SUM([.$D28:.$J28])-[.M28]/SUM([.$K28:.$Q28]) -> 0.041336560308209 | AC28: of:=[.H28]/SUM([.$D28:.$J28])-[.O28]/SUM([.$K28:.$Q28]) -> 0.0981675392670157 | AE28: of:=[.J28]/SUM([.$D28:.$J28])-[.Q28]/SUM([.$K28:.$Q28]) -> -0.0853254963943495
A29: 2016-07-14 | B29: Gwynedd | C29: Marchog | E29: 112 | J29: 211 | L29: 218 | Q29: 365 | Z29: of:=[.E29]/SUM([.$D29:.$J29])-[.L29]/SUM([.$K29:.$Q29]) -> -0.0271787328274273 | AE29: of:=[.J29]/SUM([.$D29:.$J29])-[.Q29]/SUM([.$K29:.$Q29]) -> 0.0271787328274272
A30: 2016-07-21 | B30: Gwynedd | C30: Waunfawr | E30: 114 | I30: 358 | P30: 388 | Q30: 290 | Z30: of:=[.E30]/SUM([.$D30:.$J30])-[.L30]/SUM([.$K30:.$Q30]) -> 0.241525423728814 | AD30: of:=[.I30]/SUM([.$D30:.$J30])-[.P30]/SUM([.$K30:.$Q30]) -> 0.186203189840508 | AE30: of:=[.J30]/SUM([.$D30:.$J30])-[.Q30]/SUM([.$K30:.$Q30]) -> -0.427728613569322
A31: 2016-07-28 | B31: Newport | C31: St Julians | D31: 135 | E31: 432 | F31: 948 | G31: 25 | H31: 156 | I31: 71 | K31: 299 | L31: 1020 | M31: 958 | Y31: of:=[.D31]/SUM([.$D31:.$J31])-[.K31]/SUM([.$K31:.$Q31]) -> -0.0549124521959836 | Z31: of:=[.E31]/SUM([.$D31:.$J31])-[.L31]/SUM([.$K31:.$Q31]) -> -0.203475666087314 | AA31: of:=[.F31]/SUM([.$D31:.$J31])-[.M31]/SUM([.$K31:.$Q31]) -> 0.115773517264622 | AB31: of:=[.G31]/SUM([.$D31:.$J31])-[.N31]/SUM([.$K31:.$Q31]) -> 0.0141482739105829 | AC31: of:=[.H31]/SUM([.$D31:.$J31])-[.O31]/SUM([.$K31:.$Q31]) -> 0.0882852292020374 | AD31: of:=[.I31]/SUM([.$D31:.$J31])-[.P31]/SUM([.$K31:.$Q31]) -> 0.0401810979060555
A32: 2016-09-20 | B32: Cardiff | C32: Plasnewydd | D32: 115 | E32: 910 | F32: 1258 | G32: 93 | H32: 62 | I32: 177 | K32: 232 | L32: 1535 | M32: 1362 | N32: 535 | P32: 505 | S32: -1 | T32: 1 | Y32: of:=[.D32]/SUM([.$D32:.$J32])-[.K32]/SUM([.$K32:.$Q32]) -> -0.0116717812021444 | Z32: of:=[.E32]/SUM([.$D32:.$J32])-[.L32]/SUM([.$K32:.$Q32]) -> -0.0202014596491357 | AA32: of:=[.F32]/SUM([.$D32:.$J32])-[.M32]/SUM([.$K32:.$Q32]) -> 0.154373696045702 | AB32: of:=[.G32]/SUM([.$D32:.$J32])-[.N32]/SUM([.$K32:.$Q32]) -> -0.0927640827064186 | AC32: of:=[.H32]/SUM([.$D32:.$J32])-[.O32]/SUM([.$K32:.$Q32]) -> 0.0237093690248566 | AD32: of:=[.I32]/SUM([.$D32:.$J32])-[.P32]/SUM([.$K32:.$Q32]) -> -0.0534457415128599
A33: 2016-09-22 | B33: Carmarthenshire | C33: Cilycwm | D33: 15 | E33: 123 | F33: 62 | I33: 201 | J33: of:=151+106+64 -> 321 | K33: 136 | Q33: of:=307+264 -> 571 | W33: 1 | X33: -1 | Y33: of:=[.D33]/SUM([.$D33:.$J33])-[.K33]/SUM([.$K33:.$Q33]) -> -0.171586470083494 | Z33: of:=[.E33]/SUM([.$D33:.$J33])-[.L33]/SUM([.$K33:.$Q33]) -> 0.170360110803324 | AA33: of:=[.F33]/SUM([.$D33:.$J33])-[.M33]/SUM([.$K33:.$Q33]) -> 0.0858725761772853 | AD33: of:=[.I33]/SUM([.$D33:.$J33])-[.P33]/SUM([.$K33:.$Q33]) -> 0.278393351800554 | AE33: of:=[.J33]/SUM([.$D33:.$J33])-[.Q33]/SUM([.$K33:.$Q33]) -> -0.363039568697669
A34: 2016-09-29 | B34: Blaenau Gwent | C34: Brynmawr | E34: 270 | J34: 1085 | L34: 708 | Q34: 943 | Z34: of:=[.E34]/SUM([.$D34:.$J34])-[.L34]/SUM([.$K34:.$Q34]) -> -0.229569018888251 | AE34: of:=[.J34]/SUM([.$D34:.$J34])-[.Q34]/SUM([.$K34:.$Q34]) -> 0.229569018888251
A35: 2016-10-06 | B35: Caerphilly | C35: Gilfach | E35: 254 | G35: 7 | H35: 28 | I35: 150 | L35: 553 | P35: 91 | Z35: of:=[.E35]/SUM([.$D35:.$J35])-[.L35]/SUM([.$K35:.$Q35]) -> -0.280107952857284 | AB35: of:=[.G35]/SUM([.$D35:.$J35])-[.N35]/SUM([.$K35:.$Q35]) -> 0.0159453302961276 | AC35: of:=[.H35]/SUM([.$D35:.$J35])-[.O35]/SUM([.$K35:.$Q35]) -> 0.0637813211845103 | AD35: of:=[.I35]/SUM([.$D35:.$J35])-[.P35]/SUM([.$K35:.$Q35]) -> 0.200381301376647
A36: 2016-10-06 | B36: Caerphilly | C36: Risca E | E36: 400 | F36: 32 | H36: 117 | I36: 120 | L36: 953 | P36: 312 | Q36: 399 | Z36: of:=[.E36]/SUM([.$D36:.$J36])-[.L36]/SUM([.$K36:.$Q36]) -> 0.0251909782108773 | AA36: of:=[.F36]/SUM([.$D36:.$J36])-[.M36]/SUM([.$K36:.$Q36]) -> 0.0478325859491779 | AC36: of:=[.H36]/SUM([.$D36:.$J36])-[.O36]/SUM([.$K36:.$Q36]) -> 0.174887892376682 | AD36: of:=[.I36]/SUM([.$D36:.$J36])-[.P36]/SUM([.$K36:.$Q36]) -> -0.00812780269058297 | AE36: of:=[.J36]/SUM([.$D36:.$J36])-[.Q36]/SUM([.$K36:.$Q36]) -> -0.239783653846154
A37: 2016-10-20 | B37: Neath Port Talbot | C37: Blaengwrach | D37: 4 | E37: 143 | H37: 39 | I37: 225 | J37: 58 | L37: 363 | P37: 290 | S37: -1 | W37: 1 | Y37: of:=[.D37]/SUM([.$D37:.$J37])-[.K37]/SUM([.$K37:.$Q37]) -> 0.00852878464818763 | Z37: of:=[.E37]/SUM([.$D37:.$J37])-[.L37]/SUM([.$K37:.$Q37]) -> -0.250991814064658 | AC37: of:=[.H37]/SUM([.$D37:.$J37])-[.O37]/SUM([.$K37:.$Q37]) -> 0.0831556503198294 | AD37: of:=[.I37]/SUM([.$D37:.$J37])-[.P37]/SUM([.$K37:.$Q37]) -> 0.0356400016979204 | AE37: of:=[.J37]/SUM([.$D37:.$J37])-[.Q37]/SUM([.$K37:.$Q37]) -> 0.123667377398721
A38: 2016-10-20 | B38: Conwy | C38: Abergele Pensarn | D38: 87 | E38: 136 | J38: of:=170+146 -> 316 | K38: 145 | L38: 407 | Q38: 186 | S38: -1 | X38: 1 | Y38: of:=[.D38]/SUM([.$D38:.$J38])-[.K38]/SUM([.$K38:.$Q38]) -> -0.035066946216772 | Z38: of:=[.E38]/SUM([.$D38:.$J38])-[.L38]/SUM([.$K38:.$Q38]) -> -0.299171405443182 | AE38: of:=[.J38]/SUM([.$D38:.$J38])-[.Q38]/SUM([.$K38:.$Q38]) -> 0.334238351659954
R39: of:=SUM([.R27:.R38]) -> 0 | S39: of:=SUM([.S27:.S38]) -> -3 | T39: of:=SUM([.T27:.T38]) -> 1 | U39: of:=SUM([.U27:.U38]) -> 0 | V39: of:=SUM([.V27:.V38]) -> 0 | W39: of:=SUM([.W27:.W38]) -> 2 | X39: Average | Y39: of:=AVERAGE([.Y27:.Y38]) -> -0.0450448347957148 | Z39: of:=AVERAGE([.Z27:.Z38]) -> -0.0884324085263686 | AA39: of:=AVERAGE([.AA27:.AA38]) -> 0.0761493754696945 | AB39: of:=AVERAGE([.AB27:.AB38]) -> -0.0208901594999027 | AC39: of:=AVERAGE([.AC27:.AC38]) -> 0.0886645002291552 | AD39: of:=AVERAGE([.AD27:.AD38]) -> 0.0912446382169143 | AE39: of:=AVERAGE([.AE27:.AE38]) -> -0.0310741261713643

Sheet: 2013
A1: Date | B1: Council | C1: Ward | D1: By-election votes | J1: 2013 votes | P1: Seats | V1: Change %
D2: C | E2: Lab | F2: LD | G2: Grn | H2: UKIP | I2: Ind/Other | J2: C | K2: Lab | L2: LD | M2: Grn | N2: UKIP | O2: Ind/Other | P2: C | Q2: Lab | R2: LD | S2: Grn | T2: UKIP | U2: Ind/Other | V2: C | W2: Lab | X2: LD | Y2: Grn | Z2: UKIP | AA2: Ind/Other
A3: 2015-06-04 | B3: Cambs | C3: Wisbech S | D3: 1020 | E3: 219 | F3: 61 | H3: 298 | J3: 636 | K3: 333 | L3: 281 | N3: 774 | P3: 1 | T3: -1 | V3: of:=[.D3]/SUM([.$D3:.$I3])-[.J3]/SUM([.$J3:.$O3]) -> 0.324068623328568 | W3: of:=[.E3]/SUM([.$D3:.$I3])-[.K3]/SUM([.$J3:.$O3]) -> -0.0274793838147487 | X3: of:=[.F3]/SUM([.$D3:.$I3])-[.L3]/SUM([.$J3:.$O3]) -> -0.100661276199993 | Y3: of:=[.G3]/SUM([.$D3:.$I3])-[.M3]/SUM([.$J3:.$O3]) -> 0 | Z3: of:=[.H3]/SUM([.$D3:.$I3])-[.N3]/SUM([.$J3:.$O3]) -> -0.195927963313826 | AA3: of:=[.I3]/SUM([.$D3:.$I3])-[.O3]/SUM([.$J3:.$O3]) -> 0
A4: 2015-06-25 | B4: Cambs | C4: Romsey | D4: 100 | E4: 829 | F4: 782 | G4: 467 | H4: 46 | J4: 103 | K4: 741 | L4: 1118 | M4: 138 | N4: 118 | O4: 118 | Q4: 1 | R4: -1 | V4: of:=[.D4]/SUM([.$D4:.$I4])-[.J4]/SUM([.$J4:.$O4]) -> 0.000871563023553755 | W4: of:=[.E4]/SUM([.$D4:.$I4])-[.K4]/SUM([.$J4:.$O4]) -> 0.0555428944515621 | X4: of:=[.F4]/SUM([.$D4:.$I4])-[.L4]/SUM([.$J4:.$O4]) -> -0.126977185374988 | Y4: of:=[.G4]/SUM([.$D4:.$I4])-[.M4]/SUM([.$J4:.$O4]) -> 0.150906671922736 | Z4: of:=[.H4]/SUM([.$D4:.$I4])-[.N4]/SUM([.$J4:.$O4]) -> -0.0298302453927269 | AA4: of:=[.I4]/SUM([.$D4:.$I4])-[.O4]/SUM([.$J4:.$O4]) -> -0.050513698630137
A5: 2015-07-02 | B5: Lincs | C5: Grantham Barrowby | D5: 579 | E5: 257 | H5: 179 | I5: 155 | J5: 558 | K5: 442 | O5: 476 | V5: of:=[.D5]/SUM([.$D5:.$I5])-[.J5]/SUM([.$J5:.$O5]) -> 0.11682301438399 | W5: of:=[.E5]/SUM([.$D5:.$I5])-[.K5]/SUM([.$J5:.$O5]) -> -0.0797998749218262 | Z5: of:=[.H5]/SUM([.$D5:.$I5])-[.N5]/SUM([.$J5:.$O5]) -> 0.152991452991453 | AA5: of:=[.I5]/SUM([.$D5:.$I5])-[.O5]/SUM([.$J5:.$O5]) -> -0.190014592453617
A6: 2015-07-09 | B6: E Sussex | C6: Old Hastings/Tressell | D6: 368 | E6: 961 | F6: 48 | G6: 149 | H6: 174 | J6: 342 | K6: 1076 | L6: 97 | M6: 182 | N6: 492 | V6: of:=[.D6]/SUM([.$D6:.$I6])-[.J6]/SUM([.$J6:.$O6]) -> 0.060234864160374 | W6: of:=[.E6]/SUM([.$D6:.$I6])-[.K6]/SUM([.$J6:.$O6]) -> 0.0737454652943864 | X6: of:=[.F6]/SUM([.$D6:.$I6])-[.L6]/SUM([.$J6:.$O6]) -> -0.0160771773305028 | Y6: of:=[.G6]/SUM([.$D6:.$I6])-[.M6]/SUM([.$J6:.$O6]) -> 0.00450407115792868 | Z6: of:=[.H6]/SUM([.$D6:.$I6])-[.N6]/SUM([.$J6:.$O6]) -> -0.122407223282186 | AA6: of:=[.I6]/SUM([.$D6:.$I6])-[.O6]/SUM([.$J6:.$O6]) -> 0
A7: 2015-07-16 | B7: Nofolk | C7: Gorleston St Andrews | D7: 876 | E7: 773 | F7: 66 | G7: 51 | H7: 285 | J7: 653 | K7: 854 | N7: 874 | P7: 1 | T7: -1 | V7: of:=[.D7]/SUM([.$D7:.$I7])-[.J7]/SUM([.$J7:.$O7]) -> 0.152854212540323 | W7: of:=[.E7]/SUM([.$D7:.$I7])-[.K7]/SUM([.$J7:.$O7]) -> 0.0182164957383447 | X7: of:=[.F7]/SUM([.$D7:.$I7])-[.L7]/SUM([.$J7:.$O7]) -> 0.0321794246708922 | Y7: of:=[.G7]/SUM([.$D7:.$I7])-[.M7]/SUM([.$J7:.$O7]) -> 0.0248659190638713 | Z7: of:=[.H7]/SUM([.$D7:.$I7])-[.N7]/SUM([.$J7:.$O7]) -> -0.228116052013431 | AA7: of:=[.I7]/SUM([.$D7:.$I7])-[.O7]/SUM([.$J7:.$O7]) -> 0
A8: 2015-07-16 | B8: Nofolk | C8: Mile Cross | D8: 279 | E8: 749 | F8: 62 | G8: 209 | H8: 148 | J8: 217 | K8: 913 | L8: 86 | M8: 435 | N8: 386 | V8: of:=[.D8]/SUM([.$D8:.$I8])-[.J8]/SUM([.$J8:.$O8]) -> 0.0862835063420705 | W8: of:=[.E8]/SUM([.$D8:.$I8])-[.K8]/SUM([.$J8:.$O8]) -> 0.0694145183490363 | X8: of:=[.F8]/SUM([.$D8:.$I8])-[.L8]/SUM([.$J8:.$O8]) -> 0.000628320778792067 | Y8: of:=[.G8]/SUM([.$D8:.$I8])-[.M8]/SUM([.$J8:.$O8]) -> -0.0691125715384936 | Z8: of:=[.H8]/SUM([.$D8:.$I8])-[.N8]/SUM([.$J8:.$O8]) -> -0.0872137739314051 | AA8: of:=[.I8]/SUM([.$D8:.$I8])-[.O8]/SUM([.$J8:.$O8]) -> 0
A9: 2015-07-16 | B9: Cumbria | C9: Greystoke/Hesket | D9: 635 | F9: 518 | J9: 723 | L9: 312 | N9: 331 | V9: of:=[.D9]/SUM([.$D9:.$I9])-[.J9]/SUM([.$J9:.$O9]) -> 0.0214546304185783 | X9: of:=[.F9]/SUM([.$D9:.$I9])-[.L9]/SUM([.$J9:.$O9]) -> 0.220858693153896 | Z9: of:=[.H9]/SUM([.$D9:.$I9])-[.N9]/SUM([.$J9:.$O9]) -> -0.242313323572474 | AA9: of:=[.I9]/SUM([.$D9:.$I9])-[.O9]/SUM([.$J9:.$O9]) -> 0
A10: 2015-07-30 | B10: Northd | C10: College | D10: 39 | E10: 508 | F10: 82 | H10: 102 | J10: 90 | K10: 878 | V10: of:=[.D10]/SUM([.$D10:.$I10])-[.J10]/SUM([.$J10:.$O10]) -> -0.0396236334241557 | W10: of:=[.E10]/SUM([.$D10:.$I10])-[.K10]/SUM([.$J10:.$O10]) -> -0.212086352895954 | X10: of:=[.F10]/SUM([.$D10:.$I10])-[.L10]/SUM([.$J10:.$O10]) -> 0.112175102599179 | Z10: of:=[.H10]/SUM([.$D10:.$I10])-[.N10]/SUM([.$J10:.$O10]) -> 0.13953488372093 | AA10: of:=[.I10]/SUM([.$D10:.$I10])-[.O10]/SUM([.$J10:.$O10]) -> 0
A11: 2015-08-13 | B11: Warks | C11: Nuneaton Whitestone | D11: 1281 | E11: 503 | G11: 119 | H11: 292 | J11: 1173 | K11: 697 | M11: 348 | V11: of:=[.D11]/SUM([.$D11:.$I11])-[.J11]/SUM([.$J11:.$O11]) -> 0.0547442646723536 | W11: of:=[.E11]/SUM([.$D11:.$I11])-[.K11]/SUM([.$J11:.$O11]) -> -0.0850898940332874 | Y11: of:=[.G11]/SUM([.$D11:.$I11])-[.M11]/SUM([.$J11:.$O11]) -> -0.10268398339533 | Z11: of:=[.H11]/SUM([.$D11:.$I11])-[.N11]/SUM([.$J11:.$O11]) -> 0.133029612756264 | AA11: of:=[.I11]/SUM([.$D11:.$I11])-[.O11]/SUM([.$J11:.$O11]) -> 0
A12: 2015-08-20 | B12: Cornwall | C12: Camborne Pendarves | D12: 325 | E12: 220 | F12: 311 | G12: 31 | H12: 89 | I12: of:=85+13 -> 98 | J12: 319 | K12: 200 | N12: 340 | O12: 211 | P12: 1 | T12: -1 | V12: of:=[.D12]/SUM([.$D12:.$I12])-[.J12]/SUM([.$J12:.$O12]) -> 0.00447623522859775 | W12: of:=[.E12]/SUM([.$D12:.$I12])-[.K12]/SUM([.$J12:.$O12]) -> 0.0179258253711342 | X12: of:=[.F12]/SUM([.$D12:.$I12])-[.L12]/SUM([.$J12:.$O12]) -> 0.289571694599628 | Y12: of:=[.G12]/SUM([.$D12:.$I12])-[.M12]/SUM([.$J12:.$O12]) -> 0.0288640595903166 | Z12: of:=[.H12]/SUM([.$D12:.$I12])-[.N12]/SUM([.$J12:.$O12]) -> -0.234889225360692 | AA12: of:=[.I12]/SUM([.$D12:.$I12])-[.O12]/SUM([.$J12:.$O12]) -> -0.105948589428984
A13: 2015-08-20 | B13: Durham | C13: Shotton/S Hetton | D13: 67 | E13: 595 | F13: 107 | G13: 19 | H13: 131 | I13: of:=214 -> 214 | K13: 893 | O13: of:=686+493 -> 1179 | V13: of:=[.D13]/SUM([.$D13:.$I13])-[.J13]/SUM([.$J13:.$O13]) -> 0.059135039717564 | W13: of:=[.E13]/SUM([.$D13:.$I13])-[.K13]/SUM([.$J13:.$O13]) -> 0.0941699012087361 | X13: of:=[.F13]/SUM([.$D13:.$I13])-[.L13]/SUM([.$J13:.$O13]) -> 0.0944395410414828 | Y13: of:=[.G13]/SUM([.$D13:.$I13])-[.M13]/SUM([.$J13:.$O13]) -> 0.0167696381288614 | Z13: of:=[.H13]/SUM([.$D13:.$I13])-[.N13]/SUM([.$J13:.$O13]) -> 0.115622241835834 | AA13: of:=[.I13]/SUM([.$D13:.$I13])-[.O13]/SUM([.$J13:.$O13]) -> -0.380136361932478
A14: 2015-09-24 | B14: Derbys | C14: Derwent Vy | D14: 1107 | E14: 466 | F14: 314 | H14: 285 | J14: 1674 | K14: 904 | L14: 387 | N14: 944 | V14: of:=[.D14]/SUM([.$D14:.$I14])-[.J14]/SUM([.$J14:.$O14]) -> 0.0814259910194494 | W14: of:=[.E14]/SUM([.$D14:.$I14])-[.K14]/SUM([.$J14:.$O14]) -> -0.016712389174154 | X14: of:=[.F14]/SUM([.$D14:.$I14])-[.L14]/SUM([.$J14:.$O14]) -> 0.0455649167737294 | Z14: of:=[.H14]/SUM([.$D14:.$I14])-[.N14]/SUM([.$J14:.$O14]) -> -0.110278518619025 | AA14: of:=[.I14]/SUM([.$D14:.$I14])-[.O14]/SUM([.$J14:.$O14]) -> 0
A15: 2015-09-24 | B15: Norfolk | C15: Loddon | D15: 1094 | E15: 357 | F15: 235 | H15: 233 | J15: 2001 | K15: 383 | L15: 163 | N15: 594 | V15: of:=[.D15]/SUM([.$D15:.$I15])-[.J15]/SUM([.$J15:.$O15]) -> -0.0669696738939465 | W15: of:=[.E15]/SUM([.$D15:.$I15])-[.K15]/SUM([.$J15:.$O15]) -> 0.0640987036420427 | X15: of:=[.F15]/SUM([.$D15:.$I15])-[.L15]/SUM([.$J15:.$O15]) -> 0.0705653132045221 | Z15: of:=[.H15]/SUM([.$D15:.$I15])-[.N15]/SUM([.$J15:.$O15]) -> -0.0676943429526183 | AA15: of:=[.I15]/SUM([.$D15:.$I15])-[.O15]/SUM([.$J15:.$O15]) -> 0
A16: 2015-10-15 | B16: Cambs | C16: Chatteris | D16: 590 | F16: 274 | H16: 600 | J16: 579 | K16: 159 | L16: 358 | N16: 584 | V16: of:=[.D16]/SUM([.$D16:.$I16])-[.J16]/SUM([.$J16:.$O16]) -> 0.0583626073380172 | W16: of:=[.E16]/SUM([.$D16:.$I16])-[.K16]/SUM([.$J16:.$O16]) -> -0.0946428571428571 | X16: of:=[.F16]/SUM([.$D16:.$I16])-[.L16]/SUM([.$J16:.$O16]) -> -0.0259367681498829 | Z16: of:=[.H16]/SUM([.$D16:.$I16])-[.N16]/SUM([.$J16:.$O16]) -> 0.0622170179547229 | AA16: of:=[.I16]/SUM([.$D16:.$I16])-[.O16]/SUM([.$J16:.$O16]) -> 0
A17: 2015-10-15 | B17: Cumbria | C17: Howgate | D17: 304 | E17: 435 | H17: 176 | J17: 354 | K17: 692 | M17: 98 | V17: of:=[.D17]/SUM([.$D17:.$I17])-[.J17]/SUM([.$J17:.$O17]) -> 0.0227998777179105 | W17: of:=[.E17]/SUM([.$D17:.$I17])-[.K17]/SUM([.$J17:.$O17]) -> -0.129485268829531 | Y17: of:=[.G17]/SUM([.$D17:.$I17])-[.M17]/SUM([.$J17:.$O17]) -> -0.0856643356643357 | Z17: of:=[.H17]/SUM([.$D17:.$I17])-[.N17]/SUM([.$J17:.$O17]) -> 0.192349726775956 | AA17: of:=[.I17]/SUM([.$D17:.$I17])-[.O17]/SUM([.$J17:.$O17]) -> 0
A18: 2015-10-22 | B18: Hants | C18: Chandler's Ford | D18: 2074 | E18: 285 | F18: 1493 | H18: 358 | J18: 1919 | K18: 238 | L18: 1557 | M18: 124 | N18: 1073 | V18: of:=[.D18]/SUM([.$D18:.$I18])-[.J18]/SUM([.$J18:.$O18]) -> 0.101881132616633 | W18: of:=[.E18]/SUM([.$D18:.$I18])-[.K18]/SUM([.$J18:.$O18]) -> 0.0192333270940073 | X18: of:=[.F18]/SUM([.$D18:.$I18])-[.L18]/SUM([.$J18:.$O18]) -> 0.0375884569566309 | Y18: of:=[.G18]/SUM([.$D18:.$I18])-[.M18]/SUM([.$J18:.$O18]) -> -0.0252494400325799 | Z18: of:=[.H18]/SUM([.$D18:.$I18])-[.N18]/SUM([.$J18:.$O18]) -> -0.133453476634691 | AA18: of:=[.I18]/SUM([.$D18:.$I18])-[.O18]/SUM([.$J18:.$O18]) -> 0
A19: 2015-11-12 | B19: Dorset | C19: Rodwell | D19: 561 | E19: 417 | F19: 87 | G19: 663 | H19: 174 | J19: 583 | K19: 722 | L19: 132 | M19: 565 | N19: 467 | Q19: -1 | S19: 1 | V19: of:=[.D19]/SUM([.$D19:.$I19])-[.J19]/SUM([.$J19:.$O19]) -> 0.0588246943487254 | W19: of:=[.E19]/SUM([.$D19:.$I19])-[.K19]/SUM([.$J19:.$O19]) -> -0.073183181226387 | X19: of:=[.F19]/SUM([.$D19:.$I19])-[.L19]/SUM([.$J19:.$O19]) -> -0.00772161554058975 | Y19: of:=[.G19]/SUM([.$D19:.$I19])-[.M19]/SUM([.$J19:.$O19]) -> 0.119742855573145 | Z19: of:=[.H19]/SUM([.$D19:.$I19])-[.N19]/SUM([.$J19:.$O19]) -> -0.0976627531548935 | AA19: of:=[.I19]/SUM([.$D19:.$I19])-[.O19]/SUM([.$J19:.$O19]) -> 0
A20: 2015-11-12 | B20: Shropshire | C20: Belle Vue | D20: 282 | E20: 546 | F20: 240 | G20: 75 | J20: 289 | K20: 939 | V20: of:=[.D20]/SUM([.$D20:.$I20])-[.J20]/SUM([.$J20:.$O20]) -> 0.0113771405610129 | W20: of:=[.E20]/SUM([.$D20:.$I20])-[.K20]/SUM([.$J20:.$O20]) -> -0.286967691742115 | X20: of:=[.F20]/SUM([.$D20:.$I20])-[.L20]/SUM([.$J20:.$O20]) -> 0.20997375328084 | Y20: of:=[.G20]/SUM([.$D20:.$I20])-[.M20]/SUM([.$J20:.$O20]) -> 0.0656167979002625 | AA20: of:=[.I20]/SUM([.$D20:.$I20])-[.O20]/SUM([.$J20:.$O20]) -> 0
A21: 2015-11-19 | B21: Norfolk | C21: S Smallburgh | D21: 697 | E21: 103 | F21: 1383 | G21: 52 | H21: 219 | J21: 844 | K21: 274 | L21: 879 | M21: 107 | N21: 768 | V21: of:=[.D21]/SUM([.$D21:.$I21])-[.J21]/SUM([.$J21:.$O21]) -> -0.00984578642566397 | W21: of:=[.E21]/SUM([.$D21:.$I21])-[.K21]/SUM([.$J21:.$O21]) -> -0.0534316095828992 | X21: of:=[.F21]/SUM([.$D21:.$I21])-[.L21]/SUM([.$J21:.$O21]) -> 0.257511186329862 | Y21: of:=[.G21]/SUM([.$D21:.$I21])-[.M21]/SUM([.$J21:.$O21]) -> -0.016066373358941 | Z21: of:=[.H21]/SUM([.$D21:.$I21])-[.N21]/SUM([.$J21:.$O21]) -> -0.178167416962358 | AA21: of:=[.I21]/SUM([.$D21:.$I21])-[.O21]/SUM([.$J21:.$O21]) -> 0
A22: 2015-11-19 | B22: Norfolk | C22: Watton | D22: 822 | E22: 105 | G22: 81 | I22: 793 | J22: 662 | K22: 270 | M22: 102 | N22: 808 | O22: 569 | P22: 1 | T22: -1 | V22: of:=[.D22]/SUM([.$D22:.$I22])-[.J22]/SUM([.$J22:.$O22]) -> 0.181838238630044 | W22: of:=[.E22]/SUM([.$D22:.$I22])-[.K22]/SUM([.$J22:.$O22]) -> -0.0536857835789187 | Y22: of:=[.G22]/SUM([.$D22:.$I22])-[.M22]/SUM([.$J22:.$O22]) -> 0.00266891682601329 | Z22: of:=[.H22]/SUM([.$D22:.$I22])-[.N22]/SUM([.$J22:.$O22]) -> -0.335130651182082 | AA22: of:=[.I22]/SUM([.$D22:.$I22])-[.O22]/SUM([.$J22:.$O22]) -> 0.204309279304944
A23: 2015-11-19 | B23: Surrey | C23: Epsom W | D23: 612 | E23: 578 | F23: 588 | G23: 58 | H23: 168 | I23: 591 | J23: 389 | K23: 616 | L23: 854 | N23: 494 | O23: 693 | P23: 1 | R23: -1 | V23: of:=[.D23]/SUM([.$D23:.$I23])-[.J23]/SUM([.$J23:.$O23]) -> 0.108129680164264 | W23: of:=[.E23]/SUM([.$D23:.$I23])-[.K23]/SUM([.$J23:.$O23]) -> 0.0205035948469011 | X23: of:=[.F23]/SUM([.$D23:.$I23])-[.L23]/SUM([.$J23:.$O23]) -> -0.0537780999624258 | Y23: of:=[.G23]/SUM([.$D23:.$I23])-[.M23]/SUM([.$J23:.$O23]) -> 0.0223506743737958 | Z23: of:=[.H23]/SUM([.$D23:.$I23])-[.N23]/SUM([.$J23:.$O23]) -> -0.0974400236831019 | AA23: of:=[.I23]/SUM([.$D23:.$I23])-[.O23]/SUM([.$J23:.$O23]) -> 0.000234174260567266
A24: 2015-11-26 | B24: Notts | C24: Selston | D24: 103 | E24: 355 | H24: 161 | I24: of:=2054+794 -> 2848 | K24: 794 | O24: of:=2427+161 -> 2588 | V24: of:=[.D24]/SUM([.$D24:.$I24])-[.J24]/SUM([.$J24:.$O24]) -> 0.0297086818575137 | W24: of:=[.E24]/SUM([.$D24:.$I24])-[.K24]/SUM([.$J24:.$O24]) -> -0.132378323491731 | Z24: of:=[.H24]/SUM([.$D24:.$I24])-[.N24]/SUM([.$J24:.$O24]) -> 0.0464378425151428 | AA24: of:=[.I24]/SUM([.$D24:.$I24])-[.O24]/SUM([.$J24:.$O24]) -> 0.0562317991190744
A25: 2015-11-26 | B25: Wilts | C25: Salisbury St Edmund/Milford | D25: 425 | E25: 232 | F25: 242 | G25: 215 | I25: 45 | J25: 281 | K25: 177 | L25: 526 | M25: 92 | N25: 148 | P25: 1 | R25: -1 | V25: of:=[.D25]/SUM([.$D25:.$I25])-[.J25]/SUM([.$J25:.$O25]) -> 0.137120263693628 | W25: of:=[.E25]/SUM([.$D25:.$I25])-[.K25]/SUM([.$J25:.$O25]) -> 0.0555647194166709 | X25: of:=[.F25]/SUM([.$D25:.$I25])-[.L25]/SUM([.$J25:.$O25]) -> -0.220937871841288 | Y25: of:=[.G25]/SUM([.$D25:.$I25])-[.M25]/SUM([.$J25:.$O25]) -> 0.110341346777423 | Z25: of:=[.H25]/SUM([.$D25:.$I25])-[.N25]/SUM([.$J25:.$O25]) -> -0.120915032679739 | AA25: of:=[.I25]/SUM([.$D25:.$I25])-[.O25]/SUM([.$J25:.$O25]) -> 0.0388265746333046
A26: 2015-12-03 | B26: Shropshire | C26: Meole | D26: 490 | E26: 303 | F26: 223 | G26: 56 | H26: 64 | J26: 689 | K26: 473 | L26: 92 | V26: of:=[.D26]/SUM([.$D26:.$I26])-[.J26]/SUM([.$J26:.$O26]) -> -0.118103758114877 | W26: of:=[.E26]/SUM([.$D26:.$I26])-[.K26]/SUM([.$J26:.$O26]) -> -0.110467630343464 | X26: of:=[.F26]/SUM([.$D26:.$I26])-[.L26]/SUM([.$J26:.$O26]) -> 0.12293758564144 | Y26: of:=[.G26]/SUM([.$D26:.$I26])-[.M26]/SUM([.$J26:.$O26]) -> 0.0492957746478873 | Z26: of:=[.H26]/SUM([.$D26:.$I26])-[.N26]/SUM([.$J26:.$O26]) -> 0.0563380281690141 | AA26: of:=[.I26]/SUM([.$D26:.$I26])-[.O26]/SUM([.$J26:.$O26]) -> 0
A27: 2015-12-17 | B27: Worcs | C27: Stourport-on-Severn | D27: 763 | E27: 581 | G27: 42 | H27: 547 | I27: 725 | J27: 984 | K27: 1141 | M27: 195 | N27: 1385 | O27: 1335 | P27: 1 | U27: -1 | V27: of:=[.D27]/SUM([.$D27:.$I27])-[.J27]/SUM([.$J27:.$O27]) -> 0.0918198430613781 | W27: of:=[.E27]/SUM([.$D27:.$I27])-[.K27]/SUM([.$J27:.$O27]) -> -0.00780348633057437 | Y27: of:=[.G27]/SUM([.$D27:.$I27])-[.M27]/SUM([.$J27:.$O27]) -> -0.0228891217886703 | Z27: of:=[.H27]/SUM([.$D27:.$I27])-[.N27]/SUM([.$J27:.$O27]) -> -0.0690077573542585 | AA27: of:=[.I27]/SUM([.$D27:.$I27])-[.O27]/SUM([.$J27:.$O27]) -> 0.00788052241212511
P28: of:=SUM([.P3:.P27]) -> 7 | Q28: of:=SUM([.Q3:.Q27]) -> 0 | R28: of:=SUM([.R3:.R27]) -> -3 | S28: of:=SUM([.S3:.S27]) -> 1 | T28: of:=SUM([.T3:.T27]) -> -4 | U28: Average | V28: of:=AVERAGE([.V3:.V27]) -> 0.0611876501186362 | W28: of:=AVERAGE([.W3:.W27]) -> -0.0364499284039844 | X28: of:=AVERAGE([.X3:.X27]) -> 0.049573894454275 | Y28: of:=AVERAGE([.Y3:.Y27]) -> 0.0152367166768827 | Z28: of:=AVERAGE([.Z3:.Z27]) -> -0.060496957223758 | AA28: of:=AVERAGE([.AA3:.AA27]) -> -0.016765235708608
A29: 2016-01-14 | B29: Cornwall | C29: Launceston C | D29: 226 | F29: 515 | G29: 65 | I29: 12 | J29: 134 | K29: 73 | L29: 551 | V29: of:=[.D29]/SUM([.$D29:.$I29])-[.J29]/SUM([.$J29:.$O29]) -> 0.0995026159433847 | W29: of:=[.E29]/SUM([.$D29:.$I29])-[.K29]/SUM([.$J29:.$O29]) -> -0.0963060686015831 | X29: of:=[.F29]/SUM([.$D29:.$I29])-[.L29]/SUM([.$J29:.$O29]) -> -0.0973285766816549 | Y29: of:=[.G29]/SUM([.$D29:.$I29])-[.M29]/SUM([.$J29:.$O29]) -> 0.0794621026894866 | AA29: of:=[.I29]/SUM([.$D29:.$I29])-[.O29]/SUM([.$J29:.$O29]) -> 0.0146699266503667
A30: 2016-01-21 | B30: Herts | C30: Bushey N | D30: 881 | E30: 286 | F30: 333 | H30: 176 | J30: 995 | K30: 437 | L30: 321 | N30: 524 | V30: of:=[.D30]/SUM([.$D30:.$I30])-[.J30]/SUM([.$J30:.$O30]) -> 0.0886778441255976 | W30: of:=[.E30]/SUM([.$D30:.$I30])-[.K30]/SUM([.$J30:.$O30]) -> -0.0212748005110774 | X30: of:=[.F30]/SUM([.$D30:.$I30])-[.L30]/SUM([.$J30:.$O30]) -> 0.0577123837733986 | Z30: of:=[.H30]/SUM([.$D30:.$I30])-[.N30]/SUM([.$J30:.$O30]) -> -0.125115427387919 | AA30: of:=[.I30]/SUM([.$D30:.$I30])-[.O30]/SUM([.$J30:.$O30]) -> 0
A31: 2016-02-04 | B31: Shropshire | C31: Oswestry S | D31: 367 | E31: 95 | F31: 81 | G31: 518 | J31: 488 | L31: 62 | M31: 337 | N31: 175 | P31: -1 | S31: 1 | V31: of:=[.D31]/SUM([.$D31:.$I31])-[.J31]/SUM([.$J31:.$O31]) -> -0.113610263564736 | W31: of:=[.E31]/SUM([.$D31:.$I31])-[.K31]/SUM([.$J31:.$O31]) -> 0.0895381715362865 | X31: of:=[.F31]/SUM([.$D31:.$I31])-[.L31]/SUM([.$J31:.$O31]) -> 0.0179626582604266 | Y31: of:=[.G31]/SUM([.$D31:.$I31])-[.M31]/SUM([.$J31:.$O31]) -> 0.170892861263314 | Z31: of:=[.H31]/SUM([.$D31:.$I31])-[.N31]/SUM([.$J31:.$O31]) -> -0.164783427495292 | AA31: of:=[.I31]/SUM([.$D31:.$I31])-[.O31]/SUM([.$J31:.$O31]) -> 0
A32: 2016-02-04 | B32: Northd | C32: Hexham W | D32: 454 | E32: 200 | G32: 89 | I32: of:=501+125 -> 626 | J32: 848 | K32: 261 | L32: 540 | N32: 105 | P32: -1 | U32: 1 | V32: of:=[.D32]/SUM([.$D32:.$I32])-[.J32]/SUM([.$J32:.$O32]) -> -0.151837436376251 | W32: of:=[.E32]/SUM([.$D32:.$I32])-[.K32]/SUM([.$J32:.$O32]) -> -0.00271069861812259 | X32: of:=[.F32]/SUM([.$D32:.$I32])-[.L32]/SUM([.$J32:.$O32]) -> -0.307867730900798 | Y32: of:=[.G32]/SUM([.$D32:.$I32])-[.M32]/SUM([.$J32:.$O32]) -> 0.0650109569028488 | Z32: of:=[.H32]/SUM([.$D32:.$I32])-[.N32]/SUM([.$J32:.$O32]) -> -0.0598631698973774 | AA32: of:=[.I32]/SUM([.$D32:.$I32])-[.O32]/SUM([.$J32:.$O32]) -> 0.457268078889701
A33: 2016-02-18 | B33: Cambs | C33: Sutton | D33: 651 | F33: 1063 | H33: 208 | I33: 102 | J33: 817 | K33: 295 | L33: 542 | P33: -1 | R33: 1 | V33: of:=[.D33]/SUM([.$D33:.$I33])-[.J33]/SUM([.$J33:.$O33]) -> -0.17231373458044 | W33: of:=[.E33]/SUM([.$D33:.$I33])-[.K33]/SUM([.$J33:.$O33]) -> -0.178355501813785 | X33: of:=[.F33]/SUM([.$D33:.$I33])-[.L33]/SUM([.$J33:.$O33]) -> 0.197507181058256 | Z33: of:=[.H33]/SUM([.$D33:.$I33])-[.N33]/SUM([.$J33:.$O33]) -> 0.102766798418972 | AA33: of:=[.I33]/SUM([.$D33:.$I33])-[.O33]/SUM([.$J33:.$O33]) -> 0.050395256916996
A34: 2016-02-18 | B34: Suffolk | C34: Newmarket/Red Lodge | D34: 644 | E34: 284 | F34: 76 | H34: 494 | I34: 123 | J34: 968 | K34: 450 | L34: 136 | N34: 615 | V34: of:=[.D34]/SUM([.$D34:.$I34])-[.J34]/SUM([.$J34:.$O34]) -> -0.0490029861070226 | W34: of:=[.E34]/SUM([.$D34:.$I34])-[.K34]/SUM([.$J34:.$O34]) -> -0.0322683861455328 | X34: of:=[.F34]/SUM([.$D34:.$I34])-[.L34]/SUM([.$J34:.$O34]) -> -0.0158170667435734 | Z34: of:=[.H34]/SUM([.$D34:.$I34])-[.N34]/SUM([.$J34:.$O34]) -> 0.0212093520127852 | AA34: of:=[.I34]/SUM([.$D34:.$I34])-[.O34]/SUM([.$J34:.$O34]) -> 0.0758790869833436
A35: 2016-03-10 | B35: Cumbria | C35: Kendal Strickland/Fell | D35: 172 | E35: 307 | F35: 1067 | G35: 128 | H35: 106 | J35: 191 | K35: 506 | L35: 980 | N35: 186 | O35: 15 | V35: of:=[.D35]/SUM([.$D35:.$I35])-[.J35]/SUM([.$J35:.$O35]) -> -0.00507472687894126 | W35: of:=[.E35]/SUM([.$D35:.$I35])-[.K35]/SUM([.$J35:.$O35]) -> -0.096963659642699 | X35: of:=[.F35]/SUM([.$D35:.$I35])-[.L35]/SUM([.$J35:.$O35]) -> 0.0776064663579471 | Y35: of:=[.G35]/SUM([.$D35:.$I35])-[.M35]/SUM([.$J35:.$O35]) -> 0.0719101123595506 | Z35: of:=[.H35]/SUM([.$D35:.$I35])-[.N35]/SUM([.$J35:.$O35]) -> -0.0394909717485731 | AA35: of:=[.I35]/SUM([.$D35:.$I35])-[.O35]/SUM([.$J35:.$O35]) -> -0.00798722044728434
A36: 2016-03-31 | B36: Essex | C36: Clacton E | D36: 628 | E36: 387 | F36: 49 | H36: 961 | I36: 1781 | J36: 1194 | K36: 477 | L36: 77 | M36: 70 | N36: 1106 | O36: of:=1528 -> 1528 | V36: of:=[.D36]/SUM([.$D36:.$I36])-[.J36]/SUM([.$J36:.$O36]) -> -0.103191442650489 | W36: of:=[.E36]/SUM([.$D36:.$I36])-[.K36]/SUM([.$J36:.$O36]) -> -0.00546130170407627 | X36: of:=[.F36]/SUM([.$D36:.$I36])-[.L36]/SUM([.$J36:.$O36]) -> -0.00442118865611068 | Y36: of:=[.G36]/SUM([.$D36:.$I36])-[.M36]/SUM([.$J36:.$O36]) -> -0.0157232704402516 | Z36: of:=[.H36]/SUM([.$D36:.$I36])-[.N36]/SUM([.$J36:.$O36]) -> 0.00406838589846553 | AA36: of:=[.I36]/SUM([.$D36:.$I36])-[.O36]/SUM([.$J36:.$O36]) -> 0.124728817552462
A37: 2016-04-14 | B37: Cornwall | C37: Menheniot | D37: 532 | E37: 67 | F37: 472 | G37: 65 | H37: 177 | J37: 549 | L37: 352 | M37: 93 | N37: 450 | V37: of:=[.D37]/SUM([.$D37:.$I37])-[.J37]/SUM([.$J37:.$O37]) -> 0.0249850736192307 | W37: of:=[.E37]/SUM([.$D37:.$I37])-[.K37]/SUM([.$J37:.$O37]) -> 0.051028179741051 | X37: of:=[.F37]/SUM([.$D37:.$I37])-[.L37]/SUM([.$J37:.$O37]) -> 0.115714789036969 | Y37: of:=[.G37]/SUM([.$D37:.$I37])-[.M37]/SUM([.$J37:.$O37]) -> -0.0148994816379145 | Z37: of:=[.H37]/SUM([.$D37:.$I37])-[.N37]/SUM([.$J37:.$O37]) -> -0.176828560759336 | AA37: of:=[.I37]/SUM([.$D37:.$I37])-[.O37]/SUM([.$J37:.$O37]) -> 0
A38: 2016-04-14 | B38: Cornwall | C38: Wadebridge W | D38: 356 | E38: 222 | F38: 604 | G38: 95 | I38: 111 | J38: 830 | K38: 129 | L38: 308 | P38: -1 | R38: 1 | V38: of:=[.D38]/SUM([.$D38:.$I38])-[.J38]/SUM([.$J38:.$O38]) -> -0.398606615732095 | W38: of:=[.E38]/SUM([.$D38:.$I38])-[.K38]/SUM([.$J38:.$O38]) -> 0.0581270513523288 | X38: of:=[.F38]/SUM([.$D38:.$I38])-[.L38]/SUM([.$J38:.$O38]) -> 0.192064578788988 | Y38: of:=[.G38]/SUM([.$D38:.$I38])-[.M38]/SUM([.$J38:.$O38]) -> 0.0684438040345821 | AA38: of:=[.I38]/SUM([.$D38:.$I38])-[.O38]/SUM([.$J38:.$O38]) -> 0.079971181556196
A39: 2016-05-26 | B39: N Yorks | C39: Northallerton | D39: 654 | E39: 233 | G39: 58 | H39: 278 | I39: 131 | J39: 825 | K39: 259 | N39: 489 | V39: of:=[.D39]/SUM([.$D39:.$I39])-[.J39]/SUM([.$J39:.$O39]) -> -0.0414622305316545 | W39: of:=[.E39]/SUM([.$D39:.$I39])-[.K39]/SUM([.$J39:.$O39]) -> 0.00742918958307703 | Y39: of:=[.G39]/SUM([.$D39:.$I39])-[.M39]/SUM([.$J39:.$O39]) -> 0.0428360413589365 | Z39: of:=[.H39]/SUM([.$D39:.$I39])-[.N39]/SUM([.$J39:.$O39]) -> -0.105553369686578 | AA39: of:=[.I39]/SUM([.$D39:.$I39])-[.O39]/SUM([.$J39:.$O39]) -> 0.0967503692762186
A40: 2016-06-02 | B40: Dorset | C40: Sherborne Rural | D40: 1212 | E40: 95 | F40: 1287 | J40: 1258 | K40: 85 | L40: 1168 | M40: 129 | N40: 746 | P40: -1 | R40: 1 | V40: of:=[.D40]/SUM([.$D40:.$I40])-[.J40]/SUM([.$J40:.$O40]) -> 0.095702245310524 | W40: of:=[.E40]/SUM([.$D40:.$I40])-[.K40]/SUM([.$J40:.$O40]) -> 0.0115196092942002 | X40: of:=[.F40]/SUM([.$D40:.$I40])-[.L40]/SUM([.$J40:.$O40]) -> 0.151195156617957 | Y40: of:=[.G40]/SUM([.$D40:.$I40])-[.M40]/SUM([.$J40:.$O40]) -> -0.0380980507974011 | Z40: of:=[.H40]/SUM([.$D40:.$I40])-[.N40]/SUM([.$J40:.$O40]) -> -0.220318960425281 | AA40: of:=[.I40]/SUM([.$D40:.$I40])-[.O40]/SUM([.$J40:.$O40]) -> 0
A41: 2016-06-09 | B41: Essex | C41: Basildon Laindon Pk/Fryerns | D41: 878 | E41: 1600 | G41: 264 | H41: 2034 | J41: 958 | K41: 2277 | L41: 215 | M41: 138 | N41: 2175 | O41: of:=171+119+73 -> 363 | Q41: -1 | T41: 1 | V41: of:=[.D41]/SUM([.$D41:.$I41])-[.J41]/SUM([.$J41:.$O41]) -> 0.0274532144890302 | W41: of:=[.E41]/SUM([.$D41:.$I41])-[.K41]/SUM([.$J41:.$O41]) -> -0.0366860420286217 | X41: of:=[.F41]/SUM([.$D41:.$I41])-[.L41]/SUM([.$J41:.$O41]) -> -0.035096310806399 | Y41: of:=[.G41]/SUM([.$D41:.$I41])-[.M41]/SUM([.$J41:.$O41]) -> 0.032749447531487 | Z41: of:=[.H41]/SUM([.$D41:.$I41])-[.N41]/SUM([.$J41:.$O41]) -> 0.070835322548098 | AA41: of:=[.I41]/SUM([.$D41:.$I41])-[.O41]/SUM([.$J41:.$O41]) -> -0.0592556317335945
P42: of:=SUM([.P29:.P41]) -> -5 | Q42: of:=SUM([.Q29:.Q41]) -> -1 | R42: of:=SUM([.R29:.R41]) -> 3 | S42: of:=SUM([.S29:.S41]) -> 1 | T42: of:=SUM([.T29:.T41]) -> 1 | U42: Average | V42: of:=AVERAGE([.V29:.V41]) -> -0.0537521879179894 | W42: of:=AVERAGE([.W29:.W41]) -> -0.0194141736583503 | X42: of:=AVERAGE([.X29:.X41]) -> 0.0291026950087839 | Y42: of:=AVERAGE([.Y29:.Y41]) -> 0.0462584523264639 | Z42: of:=AVERAGE([.Z29:.Z41]) -> -0.0630067298656395 | AA42: of:=AVERAGE([.AA29:.AA41]) -> 0.0640322973572619
A43: 2016-07-07 | B43: Suffolk | C43: Carlford | D43: 1142 | E43: 344 | F43: 228 | G43: 176 | J43: 1565 | K43: 374 | L43: 208 | N43: 504 | V43: of:=[.D43]/SUM([.$D43:.$I43])-[.J43]/SUM([.$J43:.$O43]) -> 0.0138895375409899 | W43: of:=[.E43]/SUM([.$D43:.$I43])-[.K43]/SUM([.$J43:.$O43]) -> 0.0409317438363082 | X43: of:=[.F43]/SUM([.$D43:.$I43])-[.L43]/SUM([.$J43:.$O43]) -> 0.0421739625059127 | Y43: of:=[.G43]/SUM([.$D43:.$I43])-[.M43]/SUM([.$J43:.$O43]) -> 0.0931216931216931 | Z43: of:=[.H43]/SUM([.$D43:.$I43])-[.N43]/SUM([.$J43:.$O43]) -> -0.190116937004904
A44: 2016-07-14 | B44: Wilts | C44: Trowbridge Grove | D44: 196 | E44: 77 | F44: 421 | G44: 27 | H44: 123 | I44: 74 | J44: 142 | O44: 842 | R44: 1 | U44: -1 | V44: of:=[.D44]/SUM([.$D44:.$I44])-[.J44]/SUM([.$J44:.$O44]) -> 0.0691986821829003 | W44: of:=[.E44]/SUM([.$D44:.$I44])-[.K44]/SUM([.$J44:.$O44]) -> 0.0838779956427015 | X44: of:=[.F44]/SUM([.$D44:.$I44])-[.L44]/SUM([.$J44:.$O44]) -> 0.458605664488017 | Y44: of:=[.G44]/SUM([.$D44:.$I44])-[.M44]/SUM([.$J44:.$O44]) -> 0.0294117647058823 | Z44: of:=[.H44]/SUM([.$D44:.$I44])-[.N44]/SUM([.$J44:.$O44]) -> 0.133986928104575 | AA44: of:=[.I44]/SUM([.$D44:.$I44])-[.O44]/SUM([.$J44:.$O44]) -> -0.775081035124077
A45: 2016-07-14 | B45: Cornwall | C45: Newquay Treviglas | D45: 210 | E45: 87 | F45: 486 | I45: 58 | J45: 237 | K45: 156 | L45: 218 | N45: 266 | R45: 1 | T45: -1 | V45: of:=[.D45]/SUM([.$D45:.$I45])-[.J45]/SUM([.$J45:.$O45]) -> -0.0205367178401127 | W45: of:=[.E45]/SUM([.$D45:.$I45])-[.K45]/SUM([.$J45:.$O45]) -> -0.0744308575472811 | X45: of:=[.F45]/SUM([.$D45:.$I45])-[.L45]/SUM([.$J45:.$O45]) -> 0.32930878562606 | Z45: of:=[.H45]/SUM([.$D45:.$I45])-[.N45]/SUM([.$J45:.$O45]) -> -0.303306727480046 | AA45: of:=[.I45]/SUM([.$D45:.$I45])-[.O45]/SUM([.$J45:.$O45]) -> 0.0689655172413793
A46: 2016-07-14 | B46: Cornwall | C46: St Teath/St Breward | D46: 202 | E46: 66 | F46: 620 | I46: of:=242+181+73 -> 496 | J46: 204 | L46: 388 | O46: 628 | R46: 1 | U46: -1 | V46: of:=[.D46]/SUM([.$D46:.$I46])-[.J46]/SUM([.$J46:.$O46]) -> -0.0212593575286648 | W46: of:=[.E46]/SUM([.$D46:.$I46])-[.K46]/SUM([.$J46:.$O46]) -> 0.0476878612716763 | X46: of:=[.F46]/SUM([.$D46:.$I46])-[.L46]/SUM([.$J46:.$O46]) -> 0.129944091727471 | AA46: of:=[.I46]/SUM([.$D46:.$I46])-[.O46]/SUM([.$J46:.$O46]) -> -0.156372595470482
A47: 2016-07-21 | B47: Lancs | C47: Chorley Rural N | D47: 1144 | E47: 1042 | F47: 125 | H47: 303 | J47: 1525 | K47: 1402 | L47: 140 | N47: 642 | V47: of:=[.D47]/SUM([.$D47:.$I47])-[.J47]/SUM([.$J47:.$O47]) -> 0.0264814200162016 | W47: of:=[.E47]/SUM([.$D47:.$I47])-[.K47]/SUM([.$J47:.$O47]) -> 0.020623339534947 | X47: of:=[.F47]/SUM([.$D47:.$I47])-[.L47]/SUM([.$J47:.$O47]) -> 0.0100734106310608 | Z47: of:=[.H47]/SUM([.$D47:.$I47])-[.N47]/SUM([.$J47:.$O47]) -> -0.0571781701822095
A48: 2016-07-28 | B48: Cornwall | C48: Newlyn/Goonhavern | D48: 234 | E48: 77 | F48: 247 | I48: of:=163+161+75+54 -> 453 | J48: 555 | K48: 118 | O48: 529 | P48: -1 | R48: 1 | V48: of:=[.D48]/SUM([.$D48:.$I48])-[.J48]/SUM([.$J48:.$O48]) -> -0.23027644331653 | W48: of:=[.E48]/SUM([.$D48:.$I48])-[.K48]/SUM([.$J48:.$O48]) -> -0.0220075015100122 | X48: of:=[.F48]/SUM([.$D48:.$I48])-[.L48]/SUM([.$J48:.$O48]) -> 0.24431256181998 | AA48: of:=[.I48]/SUM([.$D48:.$I48])-[.O48]/SUM([.$J48:.$O48]) -> 0.00797138300656175
A49: 2016-08-04 | B49: Notts | C49: Bingham | D49: 1270 | E49: 382 | I49: 1232 | J49: 1522 | K49: 738 | L49: 725 | N49: 656 | V49: of:=[.D49]/SUM([.$D49:.$I49])-[.J49]/SUM([.$J49:.$O49]) -> 0.0223435819745913 | W49: of:=[.E49]/SUM([.$D49:.$I49])-[.K49]/SUM([.$J49:.$O49]) -> -0.070236644533421 | X49: of:=[.F49]/SUM([.$D49:.$I49])-[.L49]/SUM([.$J49:.$O49]) -> -0.199121120571272 | Z49: of:=[.H49]/SUM([.$D49:.$I49])-[.N49]/SUM([.$J49:.$O49]) -> -0.180170282889316 | AA49: of:=[.I49]/SUM([.$D49:.$I49])-[.O49]/SUM([.$J49:.$O49]) -> 0.427184466019417
A50: 2016-08-11 | B50: Worcs | C50: Ombersley | D50: 956 | F50: 224 | H50: 212 | I50: 120 | J50: 1292 | K50: 231 | L50: 139 | M50: 137 | N50: 894 | V50: of:=[.D50]/SUM([.$D50:.$I50])-[.J50]/SUM([.$J50:.$O50]) -> 0.15251278545003 | W50: of:=[.E50]/SUM([.$D50:.$I50])-[.K50]/SUM([.$J50:.$O50]) -> -0.0857779428147048 | X50: of:=[.F50]/SUM([.$D50:.$I50])-[.L50]/SUM([.$J50:.$O50]) -> 0.0965328492250141 | Y50: of:=[.G50]/SUM([.$D50:.$I50])-[.M50]/SUM([.$J50:.$O50]) -> -0.0508726327515782 | Z50: of:=[.H50]/SUM([.$D50:.$I50])-[.N50]/SUM([.$J50:.$O50]) -> -0.191760138473841 | AA50: of:=[.I50]/SUM([.$D50:.$I50])-[.O50]/SUM([.$J50:.$O50]) -> 0.0793650793650794
A51: 2016-08-18 | B51: Surrey | C51: Farnham S | D51: 932 | E51: 77 | F51: 269 | H51: 89 | I51: of:=754+139 -> 893 | J51: 1677 | K51: 233 | N51: 542 | O51: of:=542+344 -> 886 | V51: of:=[.D51]/SUM([.$D51:.$I51])-[.J51]/SUM([.$J51:.$O51]) -> -0.0900072641664502 | W51: of:=[.E51]/SUM([.$D51:.$I51])-[.K51]/SUM([.$J51:.$O51]) -> -0.0357314803522856 | X51: of:=[.F51]/SUM([.$D51:.$I51])-[.L51]/SUM([.$J51:.$O51]) -> 0.119026548672566 | Z51: of:=[.H51]/SUM([.$D51:.$I51])-[.N51]/SUM([.$J51:.$O51]) -> -0.122992147276998 | AA51: of:=[.I51]/SUM([.$D51:.$I51])-[.O51]/SUM([.$J51:.$O51]) -> 0.129704343123167
A52: 2016-08-18 | B52: Kent | C52: Gravesham E | D52: 1758 | E52: 1538 | F52: 110 | G52: 209 | H52: 1272 | J52: 2786 | K52: 3659 | L52: 380 | N52: 2342 | O52: of:=663+265 -> 928 | P52: 1 | Q52: -1 | V52: of:=[.D52]/SUM([.$D52:.$I52])-[.J52]/SUM([.$J52:.$O52]) -> 0.0837516886083131 | W52: of:=[.E52]/SUM([.$D52:.$I52])-[.K52]/SUM([.$J52:.$O52]) -> -0.0477441591559132 | X52: of:=[.F52]/SUM([.$D52:.$I52])-[.L52]/SUM([.$J52:.$O52]) -> -0.015133700684504 | Y52: of:=[.G52]/SUM([.$D52:.$I52])-[.M52]/SUM([.$J52:.$O52]) -> 0.0427665234295069 | Z52: of:=[.H52]/SUM([.$D52:.$I52])-[.N52]/SUM([.$J52:.$O52]) -> 0.0282863441869459 | AA52: of:=[.I52]/SUM([.$D52:.$I52])-[.O52]/SUM([.$J52:.$O52]) -> -0.0919266963843487
A53: 2016-09-01 | B53: Dorset | C53: Ferndown | D53: 2046 | E53: 190 | F53: 260 | H53: 1092 | J53: 2187 | K53: 567 | N53: 2222 | V53: of:=[.D53]/SUM([.$D53:.$I53])-[.J53]/SUM([.$J53:.$O53]) -> 0.130724467410124 | W53: of:=[.E53]/SUM([.$D53:.$I53])-[.K53]/SUM([.$J53:.$O53]) -> -0.0609926532528937 | X53: of:=[.F53]/SUM([.$D53:.$I53])-[.L53]/SUM([.$J53:.$O53]) -> 0.072463768115942 | Z53: of:=[.H53]/SUM([.$D53:.$I53])-[.N53]/SUM([.$J53:.$O53]) -> -0.142195582273172
A54: 2016-09-01 | B54: Cornwall | C54: Four Lanes | D54: 128 | E54: 125 | F54: 300 | H54: 57 | I54: of:=144+111 -> 255 | J54: 173 | K54: 169 | N54: 239 | O54: of:=143+115 -> 258 | R54: 1 | T54: -1 | V54: of:=[.D54]/SUM([.$D54:.$I54])-[.J54]/SUM([.$J54:.$O54]) -> -0.0582209759760794 | W54: of:=[.E54]/SUM([.$D54:.$I54])-[.K54]/SUM([.$J54:.$O54]) -> -0.0569216036156448 | X54: of:=[.F54]/SUM([.$D54:.$I54])-[.L54]/SUM([.$J54:.$O54]) -> 0.346820809248555 | Z54: of:=[.H54]/SUM([.$D54:.$I54])-[.N54]/SUM([.$J54:.$O54]) -> -0.218966978304753 | AA54: of:=[.I54]/SUM([.$D54:.$I54])-[.O54]/SUM([.$J54:.$O54]) -> -0.0127112513520775
A55: 2016-09-15 | B55: Shropshire | C55: Bishop's Castle | D55: 430 | E55: 95 | F55: 862 | G55: 37 | J55: 449 | L55: 907 | M55: 107 | V55: of:=[.D55]/SUM([.$D55:.$I55])-[.J55]/SUM([.$J55:.$O55]) -> -0.00493733055826495 | W55: of:=[.E55]/SUM([.$D55:.$I55])-[.K55]/SUM([.$J55:.$O55]) -> 0.0667134831460674 | X55: of:=[.F55]/SUM([.$D55:.$I55])-[.L55]/SUM([.$J55:.$O55]) -> -0.0146219097283556 | Y55: of:=[.G55]/SUM([.$D55:.$I55])-[.M55]/SUM([.$J55:.$O55]) -> -0.0471542428594469
A56: 2016-09-22 | B56: Suffolk | C56: Hadleigh | D56: 460 | E56: 397 | F56: 642 | G56: 70 | H56: 204 | J56: 584 | K56: 308 | L56: 449 | M56: 90 | N56: 442 | P56: -1 | R56: 1 | V56: of:=[.D56]/SUM([.$D56:.$I56])-[.J56]/SUM([.$J56:.$O56]) -> -0.0523519880126318 | W56: of:=[.E56]/SUM([.$D56:.$I56])-[.K56]/SUM([.$J56:.$O56]) -> 0.0594721980565696 | X56: of:=[.F56]/SUM([.$D56:.$I56])-[.L56]/SUM([.$J56:.$O56]) -> 0.122375768219321 | Y56: of:=[.G56]/SUM([.$D56:.$I56])-[.M56]/SUM([.$J56:.$O56]) -> -0.00857014920069657 | Z56: of:=[.H56]/SUM([.$D56:.$I56])-[.N56]/SUM([.$J56:.$O56]) -> -0.120925829062562
A57: 2016-10-13 | B57: Cumbria | C57: Windermere | D57: 785 | E57: 88 | F57: 1009 | G57: 46 | J57: 350 | K57: 133 | L57: 1162 | N57: 227 | V57: of:=[.D57]/SUM([.$D57:.$I57])-[.J57]/SUM([.$J57:.$O57]) -> 0.220191864382736 | W57: of:=[.E57]/SUM([.$D57:.$I57])-[.K57]/SUM([.$J57:.$O57]) -> -0.0254038550200376 | X57: of:=[.F57]/SUM([.$D57:.$I57])-[.L57]/SUM([.$J57:.$O57]) -> -0.0973862467638401 | Y57: of:=[.G57]/SUM([.$D57:.$I57])-[.M57]/SUM([.$J57:.$O57]) -> 0.0238589211618257 | Z57: of:=[.H57]/SUM([.$D57:.$I57])-[.N57]/SUM([.$J57:.$O57]) -> -0.121260683760684
A58: 2016-10-13 | B58: Kent | C58: Swanley | D58: 717 | E58: 518 | F58: 362 | H58: 615 | J58: 1032 | K58: 812 | M58: 77 | N58: 501 | O58: of:=60+32 -> 92 | V58: of:=[.D58]/SUM([.$D58:.$I58])-[.J58]/SUM([.$J58:.$O58]) -> -0.0863601444928293 | W58: of:=[.E58]/SUM([.$D58:.$I58])-[.K58]/SUM([.$J58:.$O58]) -> -0.0888140338156954 | X58: of:=[.F58]/SUM([.$D58:.$I58])-[.L58]/SUM([.$J58:.$O58]) -> 0.163652802893309 | Y58: of:=[.G58]/SUM([.$D58:.$I58])-[.M58]/SUM([.$J58:.$O58]) -> -0.0306284805091488 | Z58: of:=[.H58]/SUM([.$D58:.$I58])-[.N58]/SUM([.$J58:.$O58]) -> 0.0787449235456848 | AA58: of:=[.I58]/SUM([.$D58:.$I58])-[.O58]/SUM([.$J58:.$O58]) -> -0.0365950676213206
P59: of:=SUM([.P43:.P58]) -> -1 | Q59: of:=SUM([.Q43:.Q58]) -> -1 | R59: of:=SUM([.R43:.R58]) -> 6 | S59: of:=SUM([.S43:.S58]) -> 0 | T59: of:=SUM([.T43:.T58]) -> -2 | U59: Average | V59: of:=AVERAGE([.V43:.V58]) -> 0.00969648785464518 | W59: of:=AVERAGE([.W43:.W58]) -> -0.0155471318831012 | X59: of:=AVERAGE([.X43:.X58]) -> 0.113064252839077 | Y59: of:=AVERAGE([.Y43:.Y58]) -> 0.00649167463725471 | Z59: of:=AVERAGE([.Z43:.Z58]) -> -0.108296560067021 | AA59: of:=AVERAGE([.AA43:.AA58]) -> -0.0359495857196701

Sheet: 2014
A1: Date | B1: Council | C1: Ward | D1: By-election votes | J1: 2014 votes | P1: Seats | V1: Change %
D2: C | E2: Lab | F2: LD | G2: Grn | H2: UKIP | I2: Ind/Other | J2: C | K2: Lab | L2: LD | M2: Grn | N2: UKIP | O2: Ind/Other | P2: C | Q2: Lab | R2: LD | S2: Grn | T2: UKIP | U2: Ind/Other | V2: C | W2: Lab | X2: LD | Y2: Grn | Z2: UKIP | AA2: Ind/Other
A3: 2015-06-11 | B3: Tower Hamlets | C3: Mayor | D3: 5940 | E3: 27255 | F3: 2152 | G3: 2678 | H3: 1669 | I3: of:=25763+1768+316+305+292 -> 28444 | J3: 7173 | K3: 27643 | L3: 1959 | M3: 4699 | N3: 4819 | O3: of:=36539+871+205+164+162 -> 37941 | V3: of:=[.D3]/SUM([.$D3:.$I3])-[.J3]/SUM([.$J3:.$O3]) -> 0.00202038725953578 | W3: of:=[.E3]/SUM([.$D3:.$I3])-[.K3]/SUM([.$J3:.$O3]) -> 0.071827916930262 | X3: of:=[.F3]/SUM([.$D3:.$I3])-[.L3]/SUM([.$J3:.$O3]) -> 0.00832632177387058 | Y3: of:=[.G3]/SUM([.$D3:.$I3])-[.M3]/SUM([.$J3:.$O3]) -> -0.0164824831113726 | Z3: of:=[.H3]/SUM([.$D3:.$I3])-[.N3]/SUM([.$J3:.$O3]) -> -0.0327152693958434 | AA3: of:=[.I3]/SUM([.$D3:.$I3])-[.O3]/SUM([.$J3:.$O3]) -> -0.0329768734564524
A4: 2015-06-11 | B4: Tower Hamlets | C4: Stepney Grn | D4: 158 | E4: 1643 | F4: 114 | G4: 272 | H4: 203 | I4: of:=1472+40 -> 1512 | J4: 209 | K4: 1568 | L4: 151 | M4: 411 | N4: 387 | O4: 2023 | V4: of:=[.D4]/SUM([.$D4:.$I4])-[.J4]/SUM([.$J4:.$O4]) -> -0.00351720975221631 | W4: of:=[.E4]/SUM([.$D4:.$I4])-[.K4]/SUM([.$J4:.$O4]) -> 0.090891346301938 | X4: of:=[.F4]/SUM([.$D4:.$I4])-[.L4]/SUM([.$J4:.$O4]) -> -0.00258038083822227 | Y4: of:=[.G4]/SUM([.$D4:.$I4])-[.M4]/SUM([.$J4:.$O4]) -> -0.0168366935594847 | Z4: of:=[.H4]/SUM([.$D4:.$I4])-[.N4]/SUM([.$J4:.$O4]) -> -0.029466237409068 | AA4: of:=[.I4]/SUM([.$D4:.$I4])-[.O4]/SUM([.$J4:.$O4]) -> -0.0384908247429468
A5: 2015-06-11 | B5: Sutton | C5: Wallington S | D5: 936 | E5: 181 | F5: 1251 | G5: 122 | H5: 164 | I5: 180 | J5: 825 | K5: 374 | L5: 1593 | M5: 301 | N5: 694 | O5: of:=377+110 -> 487 | V5: of:=[.D5]/SUM([.$D5:.$I5])-[.J5]/SUM([.$J5:.$O5]) -> 0.137247620560419 | W5: of:=[.E5]/SUM([.$D5:.$I5])-[.K5]/SUM([.$J5:.$O5]) -> -0.0236385239862635 | X5: of:=[.F5]/SUM([.$D5:.$I5])-[.L5]/SUM([.$J5:.$O5]) -> 0.0687067823068304 | Y5: of:=[.G5]/SUM([.$D5:.$I5])-[.M5]/SUM([.$J5:.$O5]) -> -0.0273771361788088 | Z5: of:=[.H5]/SUM([.$D5:.$I5])-[.N5]/SUM([.$J5:.$O5]) -> -0.104508427481128 | AA5: of:=[.I5]/SUM([.$D5:.$I5])-[.O5]/SUM([.$J5:.$O5]) -> -0.050430315221049
A6: 2015-07-02 | B6: Richmond upon Thames | C6: Hampton Wick | D6: 1081 | E6: 185 | F6: 1189 | G6: 234 | H6: 69 | I6: 7 | J6: 1870 | K6: 522 | L6: 676 | M6: 696 | P6: -1 | R6: 1 | V6: of:=[.D6]/SUM([.$D6:.$I6])-[.J6]/SUM([.$J6:.$O6]) -> -0.105853493551741 | W6: of:=[.E6]/SUM([.$D6:.$I6])-[.K6]/SUM([.$J6:.$O6]) -> -0.0717744771538877 | X6: of:=[.F6]/SUM([.$D6:.$I6])-[.L6]/SUM([.$J6:.$O6]) -> 0.250421908899962 | Y6: of:=[.G6]/SUM([.$D6:.$I6])-[.M6]/SUM([.$J6:.$O6]) -> -0.100280375807354 | Z6: of:=[.H6]/SUM([.$D6:.$I6])-[.N6]/SUM([.$J6:.$O6]) -> 0.0249547920433996 | AA6: of:=[.I6]/SUM([.$D6:.$I6])-[.O6]/SUM([.$J6:.$O6]) -> 0.00253164556962025
A7: 2015-07-09 | B7: Hounslow | C7: Brentford | D7: 664 | E7: 1292 | F7: 116 | G7: 209 | H7: 113 | J7: 733 | K7: 2326 | L7: 311 | M7: 683 | N7: 610 | O7: of:=229+152 -> 381 | V7: of:=[.D7]/SUM([.$D7:.$I7])-[.J7]/SUM([.$J7:.$O7]) -> 0.132038893162062 | W7: of:=[.E7]/SUM([.$D7:.$I7])-[.K7]/SUM([.$J7:.$O7]) -> 0.0785405888498671 | X7: of:=[.F7]/SUM([.$D7:.$I7])-[.L7]/SUM([.$J7:.$O7]) -> -0.0132029452430972 | Y7: of:=[.G7]/SUM([.$D7:.$I7])-[.M7]/SUM([.$J7:.$O7]) -> -0.0481068187253754 | Z7: of:=[.H7]/SUM([.$D7:.$I7])-[.N7]/SUM([.$J7:.$O7]) -> -0.0737344285906413 | AA7: of:=[.I7]/SUM([.$D7:.$I7])-[.O7]/SUM([.$J7:.$O7]) -> -0.0755352894528152
A8: 2015-07-16 | B8: Kingston upon Thames | C8: Grove | D8: 688 | E8: 223 | F8: 1577 | G8: 88 | H8: 58 | J8: 960 | K8: 699 | L8: 1041 | M8: 404 | V8: of:=[.D8]/SUM([.$D8:.$I8])-[.J8]/SUM([.$J8:.$O8]) -> -0.048078654236041 | W8: of:=[.E8]/SUM([.$D8:.$I8])-[.K8]/SUM([.$J8:.$O8]) -> -0.140531188111062 | X8: of:=[.F8]/SUM([.$D8:.$I8])-[.L8]/SUM([.$J8:.$O8]) -> 0.26333547620725 | Y8: of:=[.G8]/SUM([.$D8:.$I8])-[.M8]/SUM([.$J8:.$O8]) -> -0.0967453756976571 | Z8: of:=[.H8]/SUM([.$D8:.$I8])-[.N8]/SUM([.$J8:.$O8]) -> 0.0220197418375095 | AA8: of:=[.I8]/SUM([.$D8:.$I8])-[.O8]/SUM([.$J8:.$O8]) -> 0
A9: 2015-07-23 | B9: Westminster | C9: Harrow Rd | D9: 334 | E9: 1139 | H9: 38 | J9: 546 | K9: 1788 | M9: 464 | N9: 308 | V9: of:=[.D9]/SUM([.$D9:.$I9])-[.J9]/SUM([.$J9:.$O9]) -> 0.0452568692434915 | W9: of:=[.E9]/SUM([.$D9:.$I9])-[.K9]/SUM([.$J9:.$O9]) -> 0.178145413991323 | X9: of:=[.F9]/SUM([.$D9:.$I9])-[.L9]/SUM([.$J9:.$O9]) -> 0 | Y9: of:=[.G9]/SUM([.$D9:.$I9])-[.M9]/SUM([.$J9:.$O9]) -> -0.149388280746941 | Z9: of:=[.H9]/SUM([.$D9:.$I9])-[.N9]/SUM([.$J9:.$O9]) -> -0.0740140024878728 | AA9: of:=[.I9]/SUM([.$D9:.$I9])-[.O9]/SUM([.$J9:.$O9]) -> 0
A10: 2015-08-13 | B10: Exeter | C10: Pinhoe | D10: 755 | E10: 749 | F10: 63 | G10: 62 | H10: 143 | I10: 11 | J10: 828 | K10: 862 | L10: 71 | M10: 116 | N10: 460 | O10: 23 | P10: 1 | Q10: -1 | V10: of:=[.D10]/SUM([.$D10:.$I10])-[.J10]/SUM([.$J10:.$O10]) -> 0.0725961766970541 | W10: of:=[.E10]/SUM([.$D10:.$I10])-[.K10]/SUM([.$J10:.$O10]) -> 0.0548242820612755 | X10: of:=[.F10]/SUM([.$D10:.$I10])-[.L10]/SUM([.$J10:.$O10]) -> 0.00524896147228533 | Y10: of:=[.G10]/SUM([.$D10:.$I10])-[.M10]/SUM([.$J10:.$O10]) -> -0.0143796876336778 | Z10: of:=[.H10]/SUM([.$D10:.$I10])-[.N10]/SUM([.$J10:.$O10]) -> -0.114713347338802 | AA10: of:=[.I10]/SUM([.$D10:.$I10])-[.O10]/SUM([.$J10:.$O10]) -> -0.00357638525813474
A11: 2015-09-17 | B11: Haringey | C11: Noel Pk | D11: 178 | E11: 1005 | F11: 247 | G11: 124 | H11: 48 | I11: 38 | J11: 213 | K11: 1897 | L11: 492 | M11: 503 | N11: 220 | O11: 128 | V11: of:=[.D11]/SUM([.$D11:.$I11])-[.J11]/SUM([.$J11:.$O11]) -> 0.0468510944883558 | W11: of:=[.E11]/SUM([.$D11:.$I11])-[.K11]/SUM([.$J11:.$O11]) -> 0.0634275250224265 | X11: of:=[.F11]/SUM([.$D11:.$I11])-[.L11]/SUM([.$J11:.$O11]) -> 0.00812496026784767 | Y11: of:=[.G11]/SUM([.$D11:.$I11])-[.M11]/SUM([.$J11:.$O11]) -> -0.0700606754112719 | Z11: of:=[.H11]/SUM([.$D11:.$I11])-[.N11]/SUM([.$J11:.$O11]) -> -0.0344444208994653 | AA11: of:=[.I11]/SUM([.$D11:.$I11])-[.O11]/SUM([.$J11:.$O11]) -> -0.0138984834678929
A12: 2015-09-17 | B12: Haringey | C12: Woodside | D12: 141 | E12: 1279 | F12: 435 | G12: 122 | H12: 95 | J12: 271 | K12: 2018 | L12: 418 | M12: 406 | N12: 259 | O12: of:=100+61 -> 161 | V12: of:=[.D12]/SUM([.$D12:.$I12])-[.J12]/SUM([.$J12:.$O12]) -> -0.00865515651108631 | W12: of:=[.E12]/SUM([.$D12:.$I12])-[.K12]/SUM([.$J12:.$O12]) -> 0.046092031338281 | X12: of:=[.F12]/SUM([.$D12:.$I12])-[.L12]/SUM([.$J12:.$O12]) -> 0.0916290365412924 | Y12: of:=[.G12]/SUM([.$D12:.$I12])-[.M12]/SUM([.$J12:.$O12]) -> -0.0560361926764418 | Z12: of:=[.H12]/SUM([.$D12:.$I12])-[.N12]/SUM([.$J12:.$O12]) -> -0.0274593818678166 | AA12: of:=[.I12]/SUM([.$D12:.$I12])-[.O12]/SUM([.$J12:.$O12]) -> -0.0455703368242287
A13: 2015-10-08 | B13: Woking | C13: Goldsworth W | D13: 367 | E13: 105 | F13: 349 | H13: 97 | J13: 409 | K13: 126 | L13: 467 | N13: 238 | P13: 1 | R13: -1 | V13: of:=[.D13]/SUM([.$D13:.$I13])-[.J13]/SUM([.$J13:.$O13]) -> 0.0699434253988334 | W13: of:=[.E13]/SUM([.$D13:.$I13])-[.K13]/SUM([.$J13:.$O13]) -> 0.0127661817415138 | X13: of:=[.F13]/SUM([.$D13:.$I13])-[.L13]/SUM([.$J13:.$O13]) -> 0.00356138871319139 | Y13: of:=[.G13]/SUM([.$D13:.$I13])-[.M13]/SUM([.$J13:.$O13]) -> 0 | Z13: of:=[.H13]/SUM([.$D13:.$I13])-[.N13]/SUM([.$J13:.$O13]) -> -0.0862709958535385 | AA13: of:=[.I13]/SUM([.$D13:.$I13])-[.O13]/SUM([.$J13:.$O13]) -> 0
A14: 2015-10-15 | B14: Southwark | C14: S Camberwell | D14: 200 | E14: 1243 | F14: 223 | G14: 441 | I14: 39 | J14: 421 | K14: 1915 | L14: 315 | M14: 855 | O14: of:=176+96 -> 272 | V14: of:=[.D14]/SUM([.$D14:.$I14])-[.J14]/SUM([.$J14:.$O14]) -> -0.0182379765720705 | W14: of:=[.E14]/SUM([.$D14:.$I14])-[.K14]/SUM([.$J14:.$O14]) -> 0.0723352000619667 | X14: of:=[.F14]/SUM([.$D14:.$I14])-[.L14]/SUM([.$J14:.$O14]) -> 0.0205368107012838 | Y14: of:=[.G14]/SUM([.$D14:.$I14])-[.M14]/SUM([.$J14:.$O14]) -> -0.0208116149957299 | AA14: of:=[.I14]/SUM([.$D14:.$I14])-[.O14]/SUM([.$J14:.$O14]) -> -0.05382241919545
A15: 2015-10-22 | B15: Westminster | C15: Bryanston/Dorset Sq | D15: 582 | E15: 167 | F15: 46 | G15: 116 | H15: 42 | I15: of:=218 -> 218 | J15: 1207 | K15: 468 | L15: 286 | M15: 381 | V15: of:=[.D15]/SUM([.$D15:.$I15])-[.J15]/SUM([.$J15:.$O15]) -> -0.0183603757472245 | W15: of:=[.E15]/SUM([.$D15:.$I15])-[.K15]/SUM([.$J15:.$O15]) -> -0.0572160546541418 | X15: of:=[.F15]/SUM([.$D15:.$I15])-[.L15]/SUM([.$J15:.$O15]) -> -0.0828351836037575 | Y15: of:=[.G15]/SUM([.$D15:.$I15])-[.M15]/SUM([.$J15:.$O15]) -> -0.0636208368915457 | Z15: of:=[.H15]/SUM([.$D15:.$I15])-[.N15]/SUM([.$J15:.$O15]) -> 0.035866780529462 | AA15: of:=[.I15]/SUM([.$D15:.$I15])-[.O15]/SUM([.$J15:.$O15]) -> 0.186165670367208
A16: 2015-12-03 | B16: Newham | C16: Boleyn | D16: 171 | E16: 1440 | F16: 181 | G16: 117 | H16: 78 | I16: 10 | J16: 869 | K16: 2658 | O16: of:=342+270 -> 612 | V16: of:=[.D16]/SUM([.$D16:.$I16])-[.J16]/SUM([.$J16:.$O16]) -> -0.124325652528079 | W16: of:=[.E16]/SUM([.$D16:.$I16])-[.K16]/SUM([.$J16:.$O16]) -> 0.0788975199934475 | X16: of:=[.F16]/SUM([.$D16:.$I16])-[.L16]/SUM([.$J16:.$O16]) -> 0.0906359539308964 | Y16: of:=[.G16]/SUM([.$D16:.$I16])-[.M16]/SUM([.$J16:.$O16]) -> 0.0585878818227341 | Z16: of:=[.H16]/SUM([.$D16:.$I16])-[.N16]/SUM([.$J16:.$O16]) -> 0.0390585878818227 | AA16: of:=[.I16]/SUM([.$D16:.$I16])-[.O16]/SUM([.$J16:.$O16]) -> -0.142854291100821
A17: 2015-12-17 | B17: Brent | C17: Kensal Grn | D17: 255 | E17: 931 | F17: 417 | G17: 102 | H17: 38 | J17: 394 | K17: 1819 | L17: 510 | M17: 621 | V17: of:=[.D17]/SUM([.$D17:.$I17])-[.J17]/SUM([.$J17:.$O17]) -> 0.0284765171417042 | W17: of:=[.E17]/SUM([.$D17:.$I17])-[.K17]/SUM([.$J17:.$O17]) -> -0.00982278395880176 | X17: of:=[.F17]/SUM([.$D17:.$I17])-[.L17]/SUM([.$J17:.$O17]) -> 0.0867307233033295 | Y17: of:=[.G17]/SUM([.$D17:.$I17])-[.M17]/SUM([.$J17:.$O17]) -> -0.127185948167242 | Z17: of:=[.H17]/SUM([.$D17:.$I17])-[.N17]/SUM([.$J17:.$O17]) -> 0.0218014916810098 | AA17: of:=[.I17]/SUM([.$D17:.$I17])-[.O17]/SUM([.$J17:.$O17]) -> 0
P18: of:=SUM([.P3:.P17]) -> 1 | Q18: of:=SUM([.Q3:.Q17]) -> -1 | R18: of:=SUM([.R3:.R17]) -> 0 | S18: of:=SUM([.S3:.S17]) -> 0 | T18: of:=SUM([.T3:.T17]) -> 0 | U18: Average | V18: of:=AVERAGE([.V3:.V17]) -> 0.0138268310035331 | W18: of:=AVERAGE([.W3:.W17]) -> 0.0296509985618763 | X18: of:=AVERAGE([.X3:.X17]) -> 0.0532426542955309 | Y18: of:=AVERAGE([.Y3:.Y17]) -> -0.0499149491853445 | Z18: of:=AVERAGE([.Z3:.Z17]) -> -0.0309732226679266 | AA18: of:=AVERAGE([.AA3:.AA17]) -> -0.0178971935188642
A19: 2016-01-21 | B19: Southwark | C19: Faraday | D19: 117 | E19: 1072 | F19: 255 | G19: 138 | H19: 93 | I19: of:=47+38 -> 85 | J19: 245 | K19: 1590 | L19: 163 | M19: 302 | O19: of:=171+113 -> 284 | V19: of:=[.D19]/SUM([.$D19:.$I19])-[.J19]/SUM([.$J19:.$O19]) -> -0.0283369687587954 | W19: of:=[.E19]/SUM([.$D19:.$I19])-[.K19]/SUM([.$J19:.$O19]) -> -0.00623416830847168 | X19: of:=[.F19]/SUM([.$D19:.$I19])-[.L19]/SUM([.$J19:.$O19]) -> 0.0818058682803265 | Y19: of:=[.G19]/SUM([.$D19:.$I19])-[.M19]/SUM([.$J19:.$O19]) -> -0.038463974106389 | Z19: of:=[.H19]/SUM([.$D19:.$I19])-[.N19]/SUM([.$J19:.$O19]) -> 0.0528409090909091 | AA19: of:=[.I19]/SUM([.$D19:.$I19])-[.O19]/SUM([.$J19:.$O19]) -> -0.0616116661975795
A20: 2016-02-11 | B20: Hounslow | C20: Cranford | D20: 638 | E20: 1264 | F20: 265 | G20: 48 | H20: 96 | J20: 987 | K20: 2085 | L20: 235 | N20: 508 | V20: of:=[.D20]/SUM([.$D20:.$I20])-[.J20]/SUM([.$J20:.$O20]) -> 0.0173553686199627 | W20: of:=[.E20]/SUM([.$D20:.$I20])-[.K20]/SUM([.$J20:.$O20]) -> 0.000422504938203727 | X20: of:=[.F20]/SUM([.$D20:.$I20])-[.L20]/SUM([.$J20:.$O20]) -> 0.0530700229627181 | Y20: of:=[.G20]/SUM([.$D20:.$I20])-[.M20]/SUM([.$J20:.$O20]) -> 0.0207702293379489 | Z20: of:=[.H20]/SUM([.$D20:.$I20])-[.N20]/SUM([.$J20:.$O20]) -> -0.0916181258588334 | AA20: of:=[.I20]/SUM([.$D20:.$I20])-[.O20]/SUM([.$J20:.$O20]) -> 0
A21: 2016-05-19 | B21: Merton | C21: St Helier | D21: 282 | E21: 1436 | F21: 59 | G21: 55 | H21: 191 | J21: 505 | K21: 2010 | L21: 203 | N21: 663 | V21: of:=[.D21]/SUM([.$D21:.$I21])-[.J21]/SUM([.$J21:.$O21]) -> -0.00996715821878624 | W21: of:=[.E21]/SUM([.$D21:.$I21])-[.K21]/SUM([.$J21:.$O21]) -> 0.115338206894011 | X21: of:=[.F21]/SUM([.$D21:.$I21])-[.L21]/SUM([.$J21:.$O21]) -> -0.0308768008482165 | Y21: of:=[.G21]/SUM([.$D21:.$I21])-[.M21]/SUM([.$J21:.$O21]) -> 0.0271873455264459 | Z21: of:=[.H21]/SUM([.$D21:.$I21])-[.N21]/SUM([.$J21:.$O21]) -> -0.101681593353454 | AA21: of:=[.I21]/SUM([.$D21:.$I21])-[.O21]/SUM([.$J21:.$O21]) -> 0
A22: 2016-06-09 | B22: Lambeth | C22: Gipsy Hill | D22: 210 | E22: 1220 | F22: 84 | G22: 1184 | H22: 73 | I22: of:=24+19 -> 43 | J22: 436 | K22: 2242 | L22: 164 | M22: 376 | N22: 142 | V22: of:=[.D22]/SUM([.$D22:.$I22])-[.J22]/SUM([.$J22:.$O22]) -> -0.055135039090263 | W22: of:=[.E22]/SUM([.$D22:.$I22])-[.K22]/SUM([.$J22:.$O22]) -> -0.233715351812367 | X22: of:=[.F22]/SUM([.$D22:.$I22])-[.L22]/SUM([.$J22:.$O22]) -> -0.0189587775408671 | Y22: of:=[.G22]/SUM([.$D22:.$I22])-[.M22]/SUM([.$J22:.$O22]) -> 0.308848614072495 | Z22: of:=[.H22]/SUM([.$D22:.$I22])-[.N22]/SUM([.$J22:.$O22]) -> -0.016320184790334 | AA22: of:=[.I22]/SUM([.$D22:.$I22])-[.O22]/SUM([.$J22:.$O22]) -> 0.0152807391613362
A23: 2016-06-09 | B23: Southwark | C23: Surrey Docks | D23: 380 | E23: 619 | F23: 1523 | G23: 218 | H23: 187 | I23: 10 | J23: 655 | K23: 712 | L23: 1039 | M23: 486 | N23: 502 | V23: of:=[.D23]/SUM([.$D23:.$I23])-[.J23]/SUM([.$J23:.$O23]) -> -0.0636039003316354 | W23: of:=[.E23]/SUM([.$D23:.$I23])-[.K23]/SUM([.$J23:.$O23]) -> 0.000977309995868841 | X23: of:=[.F23]/SUM([.$D23:.$I23])-[.L23]/SUM([.$J23:.$O23]) -> 0.212427888025274 | Y23: of:=[.G23]/SUM([.$D23:.$I23])-[.M23]/SUM([.$J23:.$O23]) -> -0.0689684714699116 | Z23: of:=[.H23]/SUM([.$D23:.$I23])-[.N23]/SUM([.$J23:.$O23]) -> -0.084237661085105 | AA23: of:=[.I23]/SUM([.$D23:.$I23])-[.O23]/SUM([.$J23:.$O23]) -> 0.00340483486550902
U24: Average | V24: of:=AVERAGE([.V19:.V23]) -> -0.0279375395559034 | W24: of:=AVERAGE([.W19:.W23]) -> -0.024642299658551 | X24: of:=AVERAGE([.X19:.X23]) -> 0.059493640175847 | Y24: of:=AVERAGE([.Y19:.Y23]) -> 0.0498747486721178 | Z24: of:=AVERAGE([.Z19:.Z23]) -> -0.0482033311993635 | AA24: of:=AVERAGE([.AA19:.AA23]) -> -0.00858521843414686
A25: 2016-06-30 | B25: Bexley | C25: St Michael's | D25: 939 | E25: 840 | F25: 117 | G25: 54 | H25: 456 | I25: 105 | J25: 1352 | K25: 857 | N25: 1280 | O25: 407 | V25: of:=[.D25]/SUM([.$D25:.$I25])-[.J25]/SUM([.$J25:.$O25]) -> 0.0269320124920576 | W25: of:=[.E25]/SUM([.$D25:.$I25])-[.K25]/SUM([.$J25:.$O25]) -> 0.114558877284916 | X25: of:=[.F25]/SUM([.$D25:.$I25])-[.L25]/SUM([.$J25:.$O25]) -> 0.046594982078853 | Y25: of:=[.G25]/SUM([.$D25:.$I25])-[.M25]/SUM([.$J25:.$O25]) -> 0.021505376344086 | Z25: of:=[.H25]/SUM([.$D25:.$I25])-[.N25]/SUM([.$J25:.$O25]) -> -0.146941138661348 | AA25: of:=[.I25]/SUM([.$D25:.$I25])-[.O25]/SUM([.$J25:.$O25]) -> -0.0626501095385642
A26: 2016-07-14 | B26: Newham | C26: Forest Gate N | D26: 301 | E26: 1150 | F26: 57 | G26: 681 | J26: 548 | K26: 2324 | L26: 206 | M26: 562 | O26: of:=222+174 -> 396 | V26: of:=[.D26]/SUM([.$D26:.$I26])-[.J26]/SUM([.$J26:.$O26]) -> 0.00172771235219255 | W26: of:=[.E26]/SUM([.$D26:.$I26])-[.K26]/SUM([.$J26:.$O26]) -> -0.0504635982869569 | X26: of:=[.F26]/SUM([.$D26:.$I26])-[.L26]/SUM([.$J26:.$O26]) -> -0.0250013469455576 | Y26: of:=[.G26]/SUM([.$D26:.$I26])-[.M26]/SUM([.$J26:.$O26]) -> 0.171854180353067 | AA26: of:=[.I26]/SUM([.$D26:.$I26])-[.O26]/SUM([.$J26:.$O26]) -> -0.0981169474727453
A27: 2016-07-14 | B27: Islington | C27: Barnsbury | D27: 367 | E27: 1192 | F27: 409 | G27: 302 | I27: 40 | J27: 710 | K27: 2110 | L27: 400 | M27: 467 | O27: 100 | V27: of:=[.D27]/SUM([.$D27:.$I27])-[.J27]/SUM([.$J27:.$O27]) -> -0.0286090372966528 | W27: of:=[.E27]/SUM([.$D27:.$I27])-[.K27]/SUM([.$J27:.$O27]) -> -0.0411519472517624 | X27: of:=[.F27]/SUM([.$D27:.$I27])-[.L27]/SUM([.$J27:.$O27]) -> 0.0714317721711437 | Y27: of:=[.G27]/SUM([.$D27:.$I27])-[.M27]/SUM([.$J27:.$O27]) -> 0.00741932128253754 | AA27: of:=[.I27]/SUM([.$D27:.$I27])-[.O27]/SUM([.$J27:.$O27]) -> -0.00909010890526602
A28: 2016-07-21 | B28: Lewisham | C28: Bellingham | D28: 302 | E28: 940 | F28: 180 | H28: 104 | I28: 129 | J28: 432 | K28: 1819 | L28: 194 | M28: 329 | O28: of:=451+144 -> 595 | V28: of:=[.D28]/SUM([.$D28:.$I28])-[.J28]/SUM([.$J28:.$O28]) -> 0.0542493805704939 | W28: of:=[.E28]/SUM([.$D28:.$I28])-[.K28]/SUM([.$J28:.$O28]) -> 0.0280530050513883 | X28: of:=[.F28]/SUM([.$D28:.$I28])-[.L28]/SUM([.$J28:.$O28]) -> 0.0511774765298317 | Y28: of:=[.G28]/SUM([.$D28:.$I28])-[.M28]/SUM([.$J28:.$O28]) -> -0.0976550905313149 | Z28: of:=[.H28]/SUM([.$D28:.$I28])-[.N28]/SUM([.$J28:.$O28]) -> 0.0628398791540786 | AA28: of:=[.I28]/SUM([.$D28:.$I28])-[.O28]/SUM([.$J28:.$O28]) -> -0.0986646507744774
A29: 2016-07-21 | B29: Hackney | C29: Hackney C | D29: 101 | E29: 1354 | F29: 113 | G29: 178 | I29: 55 | J29: 190 | K29: 2094 | L29: 240 | M29: 751 | V29: of:=[.D29]/SUM([.$D29:.$I29])-[.J29]/SUM([.$J29:.$O29]) -> -0.00193531159533931 | W29: of:=[.E29]/SUM([.$D29:.$I29])-[.K29]/SUM([.$J29:.$O29]) -> 0.112415240048997 | X29: of:=[.F29]/SUM([.$D29:.$I29])-[.L29]/SUM([.$J29:.$O29]) -> -0.0105395221484248 | Y29: of:=[.G29]/SUM([.$D29:.$I29])-[.M29]/SUM([.$J29:.$O29]) -> -0.130478995977638 | AA29: of:=[.I29]/SUM([.$D29:.$I29])-[.O29]/SUM([.$J29:.$O29]) -> 0.0305385896724042
A30: 2016-07-28 | B30: Sutton | C30: Carshalton C | D30: 1061 | E30: 176 | F30: 1250 | G30: 211 | H30: 150 | I30: 29 | J30: 1077 | K30: 393 | L30: 1634 | M30: 324 | N30: 671 | O30: of:=90+74 -> 164 | V30: of:=[.D30]/SUM([.$D30:.$I30])-[.J30]/SUM([.$J30:.$O30]) -> 0.116147944201592 | W30: of:=[.E30]/SUM([.$D30:.$I30])-[.K30]/SUM([.$J30:.$O30]) -> -0.0310137646802995 | X30: of:=[.F30]/SUM([.$D30:.$I30])-[.L30]/SUM([.$J30:.$O30]) -> 0.0511822146427159 | Y30: of:=[.G30]/SUM([.$D30:.$I30])-[.M30]/SUM([.$J30:.$O30]) -> -0.00266252989995394 | Z30: of:=[.H30]/SUM([.$D30:.$I30])-[.N30]/SUM([.$J30:.$O30]) -> -0.10526324801252 | AA30: of:=[.I30]/SUM([.$D30:.$I30])-[.O30]/SUM([.$J30:.$O30]) -> -0.0283906162515346
A31: 2016-07-28 | B31: Haringey | C31: Harringay | D31: 99 | E31: 1054 | F31: 765 | G31: 325 | H31: 36 | J31: 219 | K31: 1683 | L31: 1182 | M31: 657 | O31: 219 | V31: of:=[.D31]/SUM([.$D31:.$I31])-[.J31]/SUM([.$J31:.$O31]) -> -0.0118629249936841 | W31: of:=[.E31]/SUM([.$D31:.$I31])-[.K31]/SUM([.$J31:.$O31]) -> 0.0374835454146555 | X31: of:=[.F31]/SUM([.$D31:.$I31])-[.L31]/SUM([.$J31:.$O31]) -> 0.0371886925419176 | Y31: of:=[.G31]/SUM([.$D31:.$I31])-[.M31]/SUM([.$J31:.$O31]) -> -0.0233026845905301 | Z31: of:=[.H31]/SUM([.$D31:.$I31])-[.N31]/SUM([.$J31:.$O31]) -> 0.0157964019306713 | AA31: of:=[.I31]/SUM([.$D31:.$I31])-[.O31]/SUM([.$J31:.$O31]) -> -0.0553030303030303
A32: 2016-08-18 | B32: Wandsworth | C32: Tooting | D32: 644 | E32: 1467 | F32: 267 | G32: 116 | I32: 15 | J32: 1538 | K32: 2499 | L32: 361 | M32: 622 | N32: 292 | O32: of:=115+112 -> 227 | V32: of:=[.D32]/SUM([.$D32:.$I32])-[.J32]/SUM([.$J32:.$O32]) -> -0.020991482477488 | W32: of:=[.E32]/SUM([.$D32:.$I32])-[.K32]/SUM([.$J32:.$O32]) -> 0.133530627527505 | X32: of:=[.F32]/SUM([.$D32:.$I32])-[.L32]/SUM([.$J32:.$O32]) -> 0.0412426799898772 | Y32: of:=[.G32]/SUM([.$D32:.$I32])-[.M32]/SUM([.$J32:.$O32]) -> -0.0660610788343764 | Z32: of:=[.H32]/SUM([.$D32:.$I32])-[.N32]/SUM([.$J32:.$O32]) -> -0.0527170969489077 | AA32: of:=[.I32]/SUM([.$D32:.$I32])-[.O32]/SUM([.$J32:.$O32]) -> -0.0350036492566101
A33: 2016-09-15 | B33: Hackney | C33: Mayor | D33: 3533 | E33: 22595 | F33: 1818 | G33: 4338 | I33: 494 | J33: 7853 | K33: 40858 | L33: 3840 | M33: 11849 | O33: 3265 | V33: of:=[.D33]/SUM([.$D33:.$I33])-[.J33]/SUM([.$J33:.$O33]) -> -0.00827133581265253 | W33: of:=[.E33]/SUM([.$D33:.$I33])-[.K33]/SUM([.$J33:.$O33]) -> 0.08550662911316 | X33: of:=[.F33]/SUM([.$D33:.$I33])-[.L33]/SUM([.$J33:.$O33]) -> -0.00128613550791883 | Y33: of:=[.G33]/SUM([.$D33:.$I33])-[.M33]/SUM([.$J33:.$O33]) -> -0.0427678220460791 | AA33: of:=[.I33]/SUM([.$D33:.$I33])-[.O33]/SUM([.$J33:.$O33]) -> -0.0331813357465096
A34: 2016-10-06 | B34: Haringey | C34: St Ann's | D34: 106 | E34: 1177 | F34: 189 | G34: 323 | H34: 54 | J34: 251 | K34: 1829 | L34: 243 | M34: 757 | N34: 212 | O34: 271 | V34: of:=[.D34]/SUM([.$D34:.$I34])-[.J34]/SUM([.$J34:.$O34]) -> -0.0131179675976895 | W34: of:=[.E34]/SUM([.$D34:.$I34])-[.K34]/SUM([.$J34:.$O34]) -> 0.123228840615502 | X34: of:=[.F34]/SUM([.$D34:.$I34])-[.L34]/SUM([.$J34:.$O34]) -> 0.0340164605667862 | Y34: of:=[.G34]/SUM([.$D34:.$I34])-[.M34]/SUM([.$J34:.$O34]) -> -0.0377723878325807 | Z34: of:=[.H34]/SUM([.$D34:.$I34])-[.N34]/SUM([.$J34:.$O34]) -> -0.0302954453310245 | AA34: of:=[.I34]/SUM([.$D34:.$I34])-[.O34]/SUM([.$J34:.$O34]) -> -0.0760595004209935
A35: 2016-10-13 | B35: Lewisham | C35: Brockley | D35: 195 | E35: 1190 | F35: 259 | G35: 631 | H35: 33 | I35: 173 | J35: 387 | K35: 2052 | L35: 279 | M35: 1495 | N35: 260 | O35: of:=677+181 -> 858 | V35: of:=[.D35]/SUM([.$D35:.$I35])-[.J35]/SUM([.$J35:.$O35]) -> 0.00600307979360075 | W35: of:=[.E35]/SUM([.$D35:.$I35])-[.K35]/SUM([.$J35:.$O35]) -> 0.0947269025119893 | X35: of:=[.F35]/SUM([.$D35:.$I35])-[.L35]/SUM([.$J35:.$O35]) -> 0.0520579930261206 | Y35: of:=[.G35]/SUM([.$D35:.$I35])-[.M35]/SUM([.$J35:.$O35]) -> -0.0261022601257458 | Z35: of:=[.H35]/SUM([.$D35:.$I35])-[.N35]/SUM([.$J35:.$O35]) -> -0.0354702491892803 | AA35: of:=[.I35]/SUM([.$D35:.$I35])-[.O35]/SUM([.$J35:.$O35]) -> -0.0912154660166846
A36: 2016-10-13 | B36: Lewisham | C36: Evelyn | D36: 183 | E36: 1028 | F36: 107 | G36: 119 | I36: of:=314+173 -> 487 | K36: 1930 | L36: 323 | M36: 546 | O36: of:=651+161 -> 812 | V36: of:=[.D36]/SUM([.$D36:.$I36])-[.J36]/SUM([.$J36:.$O36]) -> 0.0951143451143451 | W36: of:=[.E36]/SUM([.$D36:.$I36])-[.K36]/SUM([.$J36:.$O36]) -> -0.000174449634433027 | X36: of:=[.F36]/SUM([.$D36:.$I36])-[.L36]/SUM([.$J36:.$O36]) -> -0.0338356005068827 | Y36: of:=[.G36]/SUM([.$D36:.$I36])-[.M36]/SUM([.$J36:.$O36]) -> -0.0893543406005328 | AA36: of:=[.I36]/SUM([.$D36:.$I36])-[.O36]/SUM([.$J36:.$O36]) -> 0.0282500456275034
U37: Average | V37: of:=AVERAGE([.V25:.V36]) -> 0.017948867895898 | W37: of:=AVERAGE([.W25:.W36]) -> 0.0505583256428884 | X37: of:=AVERAGE([.X25:.X36]) -> 0.0261858055365385 | Y37: of:=AVERAGE([.Y25:.Y36]) -> -0.026281526038255 | Z37: of:=AVERAGE([.Z25:.Z36]) -> -0.0417215567226186 | AA37: of:=AVERAGE([.AA25:.AA36]) -> -0.044073898282209

Sheet: 2015
A1: Date | B1: Council | C1: Ward | D1: By-election votes | J1: 2015 votes | P1: Seats | V1: Change %
D2: C | E2: Lab | F2: LD | G2: Grn | H2: UKIP | I2: Ind/Other | J2: C | K2: Lab | L2: LD | M2: Grn | N2: UKIP | O2: Ind/Other | P2: C | Q2: Lab | R2: LD | S2: Grn | T2: UKIP | U2: Ind/Other | V2: C | W2: Lab | X2: LD | Y2: Grn | Z2: UKIP | AA2: Ind/Other
A3: 2015-07-16 | B3: Rother | C3: Battle Town | D3: 342 | E3: 100 | F3: 751 | H3: 107 | J3: 1199 | K3: 469 | L3: 1481 | P3: -1 | R3: 1 | V3: of:=[.D3]/SUM([.$D3:.$I3])-[.J3]/SUM([.$J3:.$O3]) -> -0.117678872413709 | W3: of:=[.E3]/SUM([.$D3:.$I3])-[.K3]/SUM([.$J3:.$O3]) -> -0.072013093289689 | X3: of:=[.F3]/SUM([.$D3:.$I3])-[.L3]/SUM([.$J3:.$O3]) -> 0.107384273395706 | Z3: of:=[.H3]/SUM([.$D3:.$I3])-[.N3]/SUM([.$J3:.$O3]) -> 0.0823076923076923 | AA3: of:=[.I3]/SUM([.$D3:.$I3])-[.O3]/SUM([.$J3:.$O3]) -> 0
A4: 2015-07-16 | B4: Tendring | C4: Rush Grn | D4: 290 | E4: 213 | H4: 338 | I4: 36 | J4: 540 | K4: 385 | N4: 870 | V4: of:=[.D4]/SUM([.$D4:.$I4])-[.J4]/SUM([.$J4:.$O4]) -> 0.0298370934084607 | W4: of:=[.E4]/SUM([.$D4:.$I4])-[.K4]/SUM([.$J4:.$O4]) -> 0.0283887524893359 | Z4: of:=[.H4]/SUM([.$D4:.$I4])-[.N4]/SUM([.$J4:.$O4]) -> -0.0992748766845698 | AA4: of:=[.I4]/SUM([.$D4:.$I4])-[.O4]/SUM([.$J4:.$O4]) -> 0.0410490307867731
A5: 2015-07-23 | B5: Elmbridge | C5: Long Ditton | D5: 611 | F5: 770 | G5: 79 | H5: 61 | J5: 1586 | L5: 1635 | N5: 313 | V5: of:=[.D5]/SUM([.$D5:.$I5])-[.J5]/SUM([.$J5:.$O5]) -> -0.0470738467342882 | X5: of:=[.F5]/SUM([.$D5:.$I5])-[.L5]/SUM([.$J5:.$O5]) -> 0.0435973339852144 | Y5: of:=[.G5]/SUM([.$D5:.$I5])-[.M5]/SUM([.$J5:.$O5]) -> 0.051939513477975 | Z5: of:=[.H5]/SUM([.$D5:.$I5])-[.N5]/SUM([.$J5:.$O5]) -> -0.0484630007289012 | AA5: of:=[.I5]/SUM([.$D5:.$I5])-[.O5]/SUM([.$J5:.$O5]) -> 0
A6: 2015-07-30 | B6: Wychavon | C6: Droitwich E | D6: 496 | E6: 175 | F6: 108 | H6: 171 | J6: 1587 | K6: 775 | L6: 534 | N6: 724 | V6: of:=[.D6]/SUM([.$D6:.$I6])-[.J6]/SUM([.$J6:.$O6]) -> 0.0837074731026461 | W6: of:=[.E6]/SUM([.$D6:.$I6])-[.K6]/SUM([.$J6:.$O6]) -> -0.0298778714742658 | X6: of:=[.F6]/SUM([.$D6:.$I6])-[.L6]/SUM([.$J6:.$O6]) -> -0.0338296016283803 | Z6: of:=[.H6]/SUM([.$D6:.$I6])-[.N6]/SUM([.$J6:.$O6]) -> -0.02 | AA6: of:=[.I6]/SUM([.$D6:.$I6])-[.O6]/SUM([.$J6:.$O6]) -> 0
A7: 2015-07-30 | B7: N Kesteven | C7: N Hykeham Mill | D7: 286 | E7: 161 | F7: 22 | G7: 64 | I7: 180 | J7: 1478 | O7: 1013 | P7: 1 | U7: -1 | V7: of:=[.D7]/SUM([.$D7:.$I7])-[.J7]/SUM([.$J7:.$O7]) -> -0.192213989999341 | W7: of:=[.E7]/SUM([.$D7:.$I7])-[.K7]/SUM([.$J7:.$O7]) -> 0.225806451612903 | X7: of:=[.F7]/SUM([.$D7:.$I7])-[.L7]/SUM([.$J7:.$O7]) -> 0.0308555399719495 | Y7: of:=[.G7]/SUM([.$D7:.$I7])-[.M7]/SUM([.$J7:.$O7]) -> 0.0897615708274895 | AA7: of:=[.I7]/SUM([.$D7:.$I7])-[.O7]/SUM([.$J7:.$O7]) -> -0.154209572413001
A8: 2015-09-10 | B8: Tunbridge Wells | C8: Southborough N | D8: 483 | F8: 434 | H8: 188 | J8: 1343 | K8: 372 | L8: 357 | N8: 256 | V8: of:=[.D8]/SUM([.$D8:.$I8])-[.J8]/SUM([.$J8:.$O8]) -> -0.139785961966071 | W8: of:=[.E8]/SUM([.$D8:.$I8])-[.K8]/SUM([.$J8:.$O8]) -> -0.15979381443299 | X8: of:=[.F8]/SUM([.$D8:.$I8])-[.L8]/SUM([.$J8:.$O8]) -> 0.239409665531558 | Z8: of:=[.H8]/SUM([.$D8:.$I8])-[.N8]/SUM([.$J8:.$O8]) -> 0.0601701108675032 | AA8: of:=[.I8]/SUM([.$D8:.$I8])-[.O8]/SUM([.$J8:.$O8]) -> 0
A9: 2015-09-17 | B9: Richmondshire | C9: Richmond E | D9: 307 | E9: 41 | F9: 136 | I9: 289 | J9: 513 | L9: 293 | M9: 224 | O9: of:=541+448 -> 989 | V9: of:=[.D9]/SUM([.$D9:.$I9])-[.J9]/SUM([.$J9:.$O9]) -> 0.143067764388375 | W9: of:=[.E9]/SUM([.$D9:.$I9])-[.K9]/SUM([.$J9:.$O9]) -> 0.0530401034928849 | X9: of:=[.F9]/SUM([.$D9:.$I9])-[.L9]/SUM([.$J9:.$O9]) -> 0.0308165570674966 | Y9: of:=[.G9]/SUM([.$D9:.$I9])-[.M9]/SUM([.$J9:.$O9]) -> -0.110946012877662 | AA9: of:=[.I9]/SUM([.$D9:.$I9])-[.O9]/SUM([.$J9:.$O9]) -> -0.115978412071094
A10: 2015-09-24 | B10: S Norfolk | C10: Chedgrave/Thurton | D10: 260 | E10: 93 | F10: 69 | G10: 64 | J10: 688 | K10: 299 | L10: 129 | N10: 243 | O10: 144 | V10: of:=[.D10]/SUM([.$D10:.$I10])-[.J10]/SUM([.$J10:.$O10]) -> 0.0772282595303221 | W10: of:=[.E10]/SUM([.$D10:.$I10])-[.K10]/SUM([.$J10:.$O10]) -> -0.0075774377171583 | X10: of:=[.F10]/SUM([.$D10:.$I10])-[.L10]/SUM([.$J10:.$O10]) -> 0.056146965328602 | Y10: of:=[.G10]/SUM([.$D10:.$I10])-[.M10]/SUM([.$J10:.$O10]) -> 0.131687242798354 | Z10: of:=[.H10]/SUM([.$D10:.$I10])-[.N10]/SUM([.$J10:.$O10]) -> -0.161676646706587 | AA10: of:=[.I10]/SUM([.$D10:.$I10])-[.O10]/SUM([.$J10:.$O10]) -> -0.0958083832335329
A11: 2015-10-01 | B11: Cherwell | C11: Banbury Grimsbury/Castle | D11: 661 | E11: 781 | F11: 73 | G11: 72 | H11: 150 | J11: 1460 | K11: 1533 | L11: 230 | M11: 330 | N11: 623 | P11: -1 | Q11: 1 | V11: of:=[.D11]/SUM([.$D11:.$I11])-[.J11]/SUM([.$J11:.$O11]) -> 0.0309243046870347 | W11: of:=[.E11]/SUM([.$D11:.$I11])-[.K11]/SUM([.$J11:.$O11]) -> 0.0825280904452782 | X11: of:=[.F11]/SUM([.$D11:.$I11])-[.L11]/SUM([.$J11:.$O11]) -> -0.0130501459115002 | Y11: of:=[.G11]/SUM([.$D11:.$I11])-[.M11]/SUM([.$J11:.$O11]) -> -0.0375722113036746 | Z11: of:=[.H11]/SUM([.$D11:.$I11])-[.N11]/SUM([.$J11:.$O11]) -> -0.0628300379171382 | AA11: of:=[.I11]/SUM([.$D11:.$I11])-[.O11]/SUM([.$J11:.$O11]) -> 0
A12: 2015-10-08 | B12: Woking | C12: Goldsworth E | D12: 562 | E12: 262 | F12: 594 | H12: 154 | J12: 1592 | K12: 766 | L12: 859 | N12: 377 | V12: of:=[.D12]/SUM([.$D12:.$I12])-[.J12]/SUM([.$J12:.$O12]) -> -0.0854541283819088 | W12: of:=[.E12]/SUM([.$D12:.$I12])-[.K12]/SUM([.$J12:.$O12]) -> -0.0464663327768503 | X12: of:=[.F12]/SUM([.$D12:.$I12])-[.L12]/SUM([.$J12:.$O12]) -> 0.138853135208384 | Z12: of:=[.H12]/SUM([.$D12:.$I12])-[.N12]/SUM([.$J12:.$O12]) -> -0.00693267404962469 | AA12: of:=[.I12]/SUM([.$D12:.$I12])-[.O12]/SUM([.$J12:.$O12]) -> 0
A13: 2015-10-08 | B13: S Oxon | C13: Sandford/Wittenhams | D13: 290 | E13: 89 | F13: 249 | G13: 50 | J13: 1030 | K13: 367 | L13: 445 | M13: 343 | V13: of:=[.D13]/SUM([.$D13:.$I13])-[.J13]/SUM([.$J13:.$O13]) -> -0.0436672674375435 | W13: of:=[.E13]/SUM([.$D13:.$I13])-[.K13]/SUM([.$J13:.$O13]) -> -0.0366949501495177 | X13: of:=[.F13]/SUM([.$D13:.$I13])-[.L13]/SUM([.$J13:.$O13]) -> 0.16359530993702 | Y13: of:=[.G13]/SUM([.$D13:.$I13])-[.M13]/SUM([.$J13:.$O13]) -> -0.0832330923499592 | AA13: of:=[.I13]/SUM([.$D13:.$I13])-[.O13]/SUM([.$J13:.$O13]) -> 0
A14: 2015-10-08 | B14: S Hams | C14: Totnes | D14: 268 | E14: 432 | F14: 558 | G14: 570 | I14: 63 | J14: 928 | K14: 1265 | L14: 1150 | M14: 2215 | N14: 693 | O14: 349 | V14: of:=[.D14]/SUM([.$D14:.$I14])-[.J14]/SUM([.$J14:.$O14]) -> 0.00111789497299811 | W14: of:=[.E14]/SUM([.$D14:.$I14])-[.K14]/SUM([.$J14:.$O14]) -> 0.0367838885950996 | X14: of:=[.F14]/SUM([.$D14:.$I14])-[.L14]/SUM([.$J14:.$O14]) -> 0.12083954297069 | Y14: of:=[.G14]/SUM([.$D14:.$I14])-[.M14]/SUM([.$J14:.$O14]) -> -0.0341782446356746 | Z14: of:=[.H14]/SUM([.$D14:.$I14])-[.N14]/SUM([.$J14:.$O14]) -> -0.105 | AA14: of:=[.I14]/SUM([.$D14:.$I14])-[.O14]/SUM([.$J14:.$O14]) -> -0.0195630819031136
A15: 2015-10-22 | B15: S Oxon | C15: Sonning Common | D15: 635 | E15: 200 | F15: 127 | J15: 2444 | K15: 651 | L15: 431 | M15: 519 | V15: of:=[.D15]/SUM([.$D15:.$I15])-[.J15]/SUM([.$J15:.$O15]) -> 0.0558804406764851 | W15: of:=[.E15]/SUM([.$D15:.$I15])-[.K15]/SUM([.$J15:.$O15]) -> 0.0469607765034218 | X15: of:=[.F15]/SUM([.$D15:.$I15])-[.L15]/SUM([.$J15:.$O15]) -> 0.0254653341179917 | Y15: of:=[.G15]/SUM([.$D15:.$I15])-[.M15]/SUM([.$J15:.$O15]) -> -0.128306551297899 | AA15: of:=[.I15]/SUM([.$D15:.$I15])-[.O15]/SUM([.$J15:.$O15]) -> 0
A16: 2015-10-29 | B16: Wealden | C16: Hellingly | D16: 222 | F16: 875 | I16: 154 | J16: 1722 | L16: 1253 | O16: 608 | P16: -1 | R16: 1 | V16: of:=[.D16]/SUM([.$D16:.$I16])-[.J16]/SUM([.$J16:.$O16]) -> -0.303144813203303 | X16: of:=[.F16]/SUM([.$D16:.$I16])-[.L16]/SUM([.$J16:.$O16]) -> 0.349733498158214 | AA16: of:=[.I16]/SUM([.$D16:.$I16])-[.O16]/SUM([.$J16:.$O16]) -> -0.0465886849549108
A17: 2015-10-29 | B17: Peterborough | C17: West | D17: 1174 | E17: 742 | F17: 103 | G17: 94 | H17: 415 | J17: 2312 | K17: 1619 | M17: 418 | N17: 755 | V17: of:=[.D17]/SUM([.$D17:.$I17])-[.J17]/SUM([.$J17:.$O17]) -> 0.0114206777508829 | W17: of:=[.E17]/SUM([.$D17:.$I17])-[.K17]/SUM([.$J17:.$O17]) -> -0.0236895361295187 | X17: of:=[.F17]/SUM([.$D17:.$I17])-[.L17]/SUM([.$J17:.$O17]) -> 0.0407436708860759 | Y17: of:=[.G17]/SUM([.$D17:.$I17])-[.M17]/SUM([.$J17:.$O17]) -> -0.0447130074203405 | Z17: of:=[.H17]/SUM([.$D17:.$I17])-[.N17]/SUM([.$J17:.$O17]) -> 0.0162381949129003 | AA17: of:=[.I17]/SUM([.$D17:.$I17])-[.O17]/SUM([.$J17:.$O17]) -> 0
A18: 2015-10-29 | B18: Ches E | C18: Congleton E | D18: 700 | E18: 409 | F18: 542 | H18: 266 | J18: 2969 | K18: 1506 | L18: 736 | N18: 1290 | O18: 1067 | V18: of:=[.D18]/SUM([.$D18:.$I18])-[.J18]/SUM([.$J18:.$O18]) -> -0.0271558388779156 | W18: of:=[.E18]/SUM([.$D18:.$I18])-[.K18]/SUM([.$J18:.$O18]) -> 0.014358427599502 | X18: of:=[.F18]/SUM([.$D18:.$I18])-[.L18]/SUM([.$J18:.$O18]) -> 0.185481852039336 | Z18: of:=[.H18]/SUM([.$D18:.$I18])-[.N18]/SUM([.$J18:.$O18]) -> -0.0316960686678996 | AA18: of:=[.I18]/SUM([.$D18:.$I18])-[.O18]/SUM([.$J18:.$O18]) -> -0.140988372093023
A19: 2015-10-29 | B19: Barrow-in-Furness | C19: Risedale | D19: 187 | E19: 428 | H19: 193 | K19: 1474 | N19: 438 | V19: of:=[.D19]/SUM([.$D19:.$I19])-[.J19]/SUM([.$J19:.$O19]) -> 0.231435643564356 | W19: of:=[.E19]/SUM([.$D19:.$I19])-[.K19]/SUM([.$J19:.$O19]) -> -0.24121753179502 | Z19: of:=[.H19]/SUM([.$D19:.$I19])-[.N19]/SUM([.$J19:.$O19]) -> 0.00978188823066406 | AA19: of:=[.I19]/SUM([.$D19:.$I19])-[.O19]/SUM([.$J19:.$O19]) -> 0
A20: 2015-11-05 | B20: Torbay | C20: Clifton/Maidenway | D20: 234 | E20: 53 | F20: 1096 | G20: 43 | H20: 158 | J20: 1108 | K20: 480 | L20: 1162 | M20: 370 | N20: 766 | V20: of:=[.D20]/SUM([.$D20:.$I20])-[.J20]/SUM([.$J20:.$O20]) -> -0.13739882094231 | W20: of:=[.E20]/SUM([.$D20:.$I20])-[.K20]/SUM([.$J20:.$O20]) -> -0.0900607334279491 | X20: of:=[.F20]/SUM([.$D20:.$I20])-[.L20]/SUM([.$J20:.$O20]) -> 0.39289706119351 | Y20: of:=[.G20]/SUM([.$D20:.$I20])-[.M20]/SUM([.$J20:.$O20]) -> -0.068067122589768 | Z20: of:=[.H20]/SUM([.$D20:.$I20])-[.N20]/SUM([.$J20:.$O20]) -> -0.0973703842334825 | AA20: of:=[.I20]/SUM([.$D20:.$I20])-[.O20]/SUM([.$J20:.$O20]) -> 0
A21: 2015-11-19 | B21: Ashford | C21: Aylesford Grn | D21: 110 | E21: 106 | F21: 42 | G21: 10 | H21: 109 | I21: 92 | J21: 592 | K21: 725 | P21: 1 | Q21: -1 | V21: of:=[.D21]/SUM([.$D21:.$I21])-[.J21]/SUM([.$J21:.$O21]) -> -0.214964876237103 | W21: of:=[.E21]/SUM([.$D21:.$I21])-[.K21]/SUM([.$J21:.$O21]) -> -0.324480752760765 | X21: of:=[.F21]/SUM([.$D21:.$I21])-[.L21]/SUM([.$J21:.$O21]) -> 0.0895522388059701 | Y21: of:=[.G21]/SUM([.$D21:.$I21])-[.M21]/SUM([.$J21:.$O21]) -> 0.0213219616204691 | Z21: of:=[.H21]/SUM([.$D21:.$I21])-[.N21]/SUM([.$J21:.$O21]) -> 0.232409381663113 | AA21: of:=[.I21]/SUM([.$D21:.$I21])-[.O21]/SUM([.$J21:.$O21]) -> 0.196162046908316
A22: 2015-11-26 | B22: Lancaster | C22: Carnforth/Millhead | D22: 545 | E22: 320 | F22: 38 | G22: 52 | H22: 37 | J22: 1405 | K22: 1027 | M22: 495 | V22: of:=[.D22]/SUM([.$D22:.$I22])-[.J22]/SUM([.$J22:.$O22]) -> 0.0693814954208317 | W22: of:=[.E22]/SUM([.$D22:.$I22])-[.K22]/SUM([.$J22:.$O22]) -> -0.0282905540187575 | X22: of:=[.F22]/SUM([.$D22:.$I22])-[.L22]/SUM([.$J22:.$O22]) -> 0.0383064516129032 | Y22: of:=[.G22]/SUM([.$D22:.$I22])-[.M22]/SUM([.$J22:.$O22]) -> -0.116695780111752 | Z22: of:=[.H22]/SUM([.$D22:.$I22])-[.N22]/SUM([.$J22:.$O22]) -> 0.0372983870967742 | AA22: of:=[.I22]/SUM([.$D22:.$I22])-[.O22]/SUM([.$J22:.$O22]) -> 0
A23: 2015-11-26 | B23: Ashfield | C23: Selston | D23: 52 | E23: 172 | H23: 77 | I23: of:=1180+294 -> 1474 | K23: 617 | L23: 306 | O23: of:=1977+1427+95 -> 3499 | V23: of:=[.D23]/SUM([.$D23:.$I23])-[.J23]/SUM([.$J23:.$O23]) -> 0.0292957746478873 | W23: of:=[.E23]/SUM([.$D23:.$I23])-[.K23]/SUM([.$J23:.$O23]) -> -0.0426282161535472 | X23: of:=[.F23]/SUM([.$D23:.$I23])-[.L23]/SUM([.$J23:.$O23]) -> -0.0691994572591588 | Z23: of:=[.H23]/SUM([.$D23:.$I23])-[.N23]/SUM([.$J23:.$O23]) -> 0.0433802816901409 | AA23: of:=[.I23]/SUM([.$D23:.$I23])-[.O23]/SUM([.$J23:.$O23]) -> 0.0391516170746778
A24: 2015-11-26 | B24: Rochford | C24: Rochford | D24: 328 | E24: 332 | F24: 114 | H24: 250 | J24: 1372 | K24: 998 | N24: 1047 | P24: -1 | Q24: 1 | V24: of:=[.D24]/SUM([.$D24:.$I24])-[.J24]/SUM([.$J24:.$O24]) -> -0.0812093027509511 | W24: of:=[.E24]/SUM([.$D24:.$I24])-[.K24]/SUM([.$J24:.$O24]) -> 0.0321496835674568 | X24: of:=[.F24]/SUM([.$D24:.$I24])-[.L24]/SUM([.$J24:.$O24]) -> 0.111328125 | Z24: of:=[.H24]/SUM([.$D24:.$I24])-[.N24]/SUM([.$J24:.$O24]) -> -0.0622685058165057 | AA24: of:=[.I24]/SUM([.$D24:.$I24])-[.O24]/SUM([.$J24:.$O24]) -> 0
A25: 2015-12-03 | B25: S Kesteven | C25: Belvoir | D25: 603 | E25: 175 | H25: 159 | I25: 212 | J25: 1749 | K25: 763 | V25: of:=[.D25]/SUM([.$D25:.$I25])-[.J25]/SUM([.$J25:.$O25]) -> -0.171453784237748 | W25: of:=[.E25]/SUM([.$D25:.$I25])-[.K25]/SUM([.$J25:.$O25]) -> -0.151435684865821 | Z25: of:=[.H25]/SUM([.$D25:.$I25])-[.N25]/SUM([.$J25:.$O25]) -> 0.138381201044386 | AA25: of:=[.I25]/SUM([.$D25:.$I25])-[.O25]/SUM([.$J25:.$O25]) -> 0.184508268059182
A26: 2015-12-03 | B26: Guildford | C26: Ash S/Tongham | D26: 540 | E26: 125 | F26: 286 | H26: 153 | I26: 145 | J26: 2299 | K26: 746 | L26: 900 | O26: 999 | V26: of:=[.D26]/SUM([.$D26:.$I26])-[.J26]/SUM([.$J26:.$O26]) -> -0.0326622139135256 | W26: of:=[.E26]/SUM([.$D26:.$I26])-[.K26]/SUM([.$J26:.$O26]) -> -0.0508099035862995 | X26: of:=[.F26]/SUM([.$D26:.$I26])-[.L26]/SUM([.$J26:.$O26]) -> 0.0469443515977831 | Z26: of:=[.H26]/SUM([.$D26:.$I26])-[.N26]/SUM([.$J26:.$O26]) -> 0.122497998398719 | AA26: of:=[.I26]/SUM([.$D26:.$I26])-[.O26]/SUM([.$J26:.$O26]) -> -0.0859702324966769
A27: 2015-12-03 | B27: Malvern Hills | C27: Teme Vy | D27: 268 | E27: 96 | H27: 56 | J27: 797 | N27: 306 | V27: of:=[.D27]/SUM([.$D27:.$I27])-[.J27]/SUM([.$J27:.$O27]) -> -0.0844795579156413 | W27: of:=[.E27]/SUM([.$D27:.$I27])-[.K27]/SUM([.$J27:.$O27]) -> 0.228571428571429 | Z27: of:=[.H27]/SUM([.$D27:.$I27])-[.N27]/SUM([.$J27:.$O27]) -> -0.144091870655787 | AA27: of:=[.I27]/SUM([.$D27:.$I27])-[.O27]/SUM([.$J27:.$O27]) -> 0
A28: 2015-12-10 | B28: Bournemouth | C28: Kinson S (2) | D28: 520 | E28: 471 | F28: 61 | G28: 63 | H28: 313 | I28: of:=168+8 -> 176 | J28: 1188 | K28: 1083 | L28: 378 | M28: 471 | N28: 1224 | O28: 489 | V28: of:=[.D28]/SUM([.$D28:.$I28])-[.J28]/SUM([.$J28:.$O28]) -> 0.0783794703186169 | W28: of:=[.E28]/SUM([.$D28:.$I28])-[.K28]/SUM([.$J28:.$O28]) -> 0.0695564781404651 | X28: of:=[.F28]/SUM([.$D28:.$I28])-[.L28]/SUM([.$J28:.$O28]) -> -0.0401823653157609 | Y28: of:=[.G28]/SUM([.$D28:.$I28])-[.M28]/SUM([.$J28:.$O28]) -> -0.0581781889162878 | Z28: of:=[.H28]/SUM([.$D28:.$I28])-[.N28]/SUM([.$J28:.$O28]) -> -0.0581216883303845 | AA28: of:=[.I28]/SUM([.$D28:.$I28])-[.O28]/SUM([.$J28:.$O28]) -> 0.00854629410335117
A29: 2015-12-10 | B29: Harborough | C29: Mkt Harborough-Logan | D29: 303 | E29: 82 | F29: 402 | G29: 56 | H29: 47 | J29: 975 | K29: 416 | L29: 996 | M29: 368 | V29: of:=[.D29]/SUM([.$D29:.$I29])-[.J29]/SUM([.$J29:.$O29]) -> -0.0134525581679887 | W29: of:=[.E29]/SUM([.$D29:.$I29])-[.K29]/SUM([.$J29:.$O29]) -> -0.0588633536572932 | X29: of:=[.F29]/SUM([.$D29:.$I29])-[.L29]/SUM([.$J29:.$O29]) -> 0.090160892350986 | Y29: of:=[.G29]/SUM([.$D29:.$I29])-[.M29]/SUM([.$J29:.$O29]) -> -0.070653969289749 | Z29: of:=[.H29]/SUM([.$D29:.$I29])-[.N29]/SUM([.$J29:.$O29]) -> 0.0528089887640449 | AA29: of:=[.I29]/SUM([.$D29:.$I29])-[.O29]/SUM([.$J29:.$O29]) -> 0
A30: 2015-12-10 | B30: NE Derbys | C30: Coal Aston | D30: 606 | E30: 304 | J30: 1034 | K30: 691 | N30: 283 | V30: of:=[.D30]/SUM([.$D30:.$I30])-[.J30]/SUM([.$J30:.$O30]) -> 0.150993826890241 | W30: of:=[.E30]/SUM([.$D30:.$I30])-[.K30]/SUM([.$J30:.$O30]) -> -0.0100575719101616 | Z30: of:=[.H30]/SUM([.$D30:.$I30])-[.N30]/SUM([.$J30:.$O30]) -> -0.14093625498008 | AA30: of:=[.I30]/SUM([.$D30:.$I30])-[.O30]/SUM([.$J30:.$O30]) -> 0
A31: 2015-12-10 | B31: NE Derbys | C31: Holmewood/Heath | D31: 75 | E31: 282 | J31: 376 | K31: 925 | V31: of:=[.D31]/SUM([.$D31:.$I31])-[.J31]/SUM([.$J31:.$O31]) -> -0.0789244214211434 | W31: of:=[.E31]/SUM([.$D31:.$I31])-[.K31]/SUM([.$J31:.$O31]) -> 0.0789244214211434 | AA31: of:=[.I31]/SUM([.$D31:.$I31])-[.O31]/SUM([.$J31:.$O31]) -> 0
A32: 2015-12-10 | B32: Fylde | C32: Clifton | D32: 576 | E32: 84 | F32: 53 | H32: 128 | I32: 122 | J32: 1385 | K32: 554 | O32: 1081 | V32: of:=[.D32]/SUM([.$D32:.$I32])-[.J32]/SUM([.$J32:.$O32]) -> 0.139521569598316 | W32: of:=[.E32]/SUM([.$D32:.$I32])-[.K32]/SUM([.$J32:.$O32]) -> -0.0962162942790535 | X32: of:=[.F32]/SUM([.$D32:.$I32])-[.L32]/SUM([.$J32:.$O32]) -> 0.0550363447559709 | Z32: of:=[.H32]/SUM([.$D32:.$I32])-[.N32]/SUM([.$J32:.$O32]) -> 0.132917964693666 | AA32: of:=[.I32]/SUM([.$D32:.$I32])-[.O32]/SUM([.$J32:.$O32]) -> -0.2312595847689
A33: 2015-12-15 | B33: Spelthorne | C33: Shepperton Tn | D33: 858 | E33: 123 | F33: 154 | G33: 68 | H33: 180 | J33: 2502 | K33: 612 | L33: 32 | N33: 823 | V33: of:=[.D33]/SUM([.$D33:.$I33])-[.J33]/SUM([.$J33:.$O33]) -> -0.00999503199689134 | W33: of:=[.E33]/SUM([.$D33:.$I33])-[.K33]/SUM([.$J33:.$O33]) -> -0.0652579180623804 | X33: of:=[.F33]/SUM([.$D33:.$I33])-[.L33]/SUM([.$J33:.$O33]) -> 0.103289648791147 | Y33: of:=[.G33]/SUM([.$D33:.$I33])-[.M33]/SUM([.$J33:.$O33]) -> 0.0491684743311641 | Z33: of:=[.H33]/SUM([.$D33:.$I33])-[.N33]/SUM([.$J33:.$O33]) -> -0.077205173063039 | AA33: of:=[.I33]/SUM([.$D33:.$I33])-[.O33]/SUM([.$J33:.$O33]) -> 0
A34: 2015-12-17 | B34: E Herts | C34: Hertford Heath | D34: 269 | E34: 56 | F34: 101 | G34: 21 | H34: 70 | J34: 739 | K34: 204 | M34: 96 | N34: 249 | O34: 344 | V34: of:=[.D34]/SUM([.$D34:.$I34])-[.J34]/SUM([.$J34:.$O34]) -> 0.0674908503053058 | W34: of:=[.E34]/SUM([.$D34:.$I34])-[.K34]/SUM([.$J34:.$O34]) -> -0.0166827852998066 | X34: of:=[.F34]/SUM([.$D34:.$I34])-[.L34]/SUM([.$J34:.$O34]) -> 0.195357833655706 | Y34: of:=[.G34]/SUM([.$D34:.$I34])-[.M34]/SUM([.$J34:.$O34]) -> -0.0182045738991922 | Z34: of:=[.H34]/SUM([.$D34:.$I34])-[.N34]/SUM([.$J34:.$O34]) -> -0.0171770110365229 | AA34: of:=[.I34]/SUM([.$D34:.$I34])-[.O34]/SUM([.$J34:.$O34]) -> -0.21078431372549
A35: 2015-12-17 | B35: Ryedale | C35: Derwent | D35: 278 | F35: 81 | I35: of:=283+124+32 -> 439 | J35: 1077 | L35: 574 | O35: 659 | P35: -1 | U35: 1 | V35: of:=[.D35]/SUM([.$D35:.$I35])-[.J35]/SUM([.$J35:.$O35]) -> -0.117862838915471 | X35: of:=[.F35]/SUM([.$D35:.$I35])-[.L35]/SUM([.$J35:.$O35]) -> -0.146981089086352 | AA35: of:=[.I35]/SUM([.$D35:.$I35])-[.O35]/SUM([.$J35:.$O35]) -> 0.264843928001823
A36: 2015-12-23 | B36: Aylesbury Vale | C36: Grendon Underwood/Brill | D36: 326 | F36: 275 | H36: 148 | J36: 1068 | L36: 213 | M36: 246 | N36: 427 | V36: of:=[.D36]/SUM([.$D36:.$I36])-[.J36]/SUM([.$J36:.$O36]) -> -0.111324140136354 | X36: of:=[.F36]/SUM([.$D36:.$I36])-[.L36]/SUM([.$J36:.$O36]) -> 0.25814904348753 | Y36: of:=[.G36]/SUM([.$D36:.$I36])-[.M36]/SUM([.$J36:.$O36]) -> -0.12589559877175 | Z36: of:=[.H36]/SUM([.$D36:.$I36])-[.N36]/SUM([.$J36:.$O36]) -> -0.0209293045794256 | AA36: of:=[.I36]/SUM([.$D36:.$I36])-[.O36]/SUM([.$J36:.$O36]) -> 0
P37: of:=SUM([.P3:.P36]) -> -3 | Q37: of:=SUM([.Q3:.Q36]) -> 1 | R37: of:=SUM([.R3:.R36]) -> 2 | S37: of:=SUM([.S3:.S36]) -> 0 | T37: of:=SUM([.T3:.T36]) -> 0 | U37: Average | V37: of:=AVERAGE([.V3:.V36]) -> -0.0238299919525425 | W37: of:=AVERAGE([.W3:.W36]) -> -0.0218348611115975 | X37: of:=AVERAGE([.X3:.X36]) -> 0.0932393575231639 | Y37: of:=AVERAGE([.Y3:.Y36]) -> -0.0325156229651916 | Z37: of:=AVERAGE([.Z3:.Z36]) -> -0.00836227436223495 | AA37: of:=AVERAGE([.AA3:.AA36]) -> -0.0107908662566359
A38: 2016-01-21 | B38: Thanet | C38: Newington | D38: 156 | E38: 288 | F38: 12 | G38: 20 | H38: 229 | I38: of:=49+10 -> 59 | J38: 390 | K38: 728 | N38: 884 | Q38: 1 | T38: -1 | V38: of:=[.D38]/SUM([.$D38:.$I38])-[.J38]/SUM([.$J38:.$O38]) -> 0.00938328687019785 | W38: of:=[.E38]/SUM([.$D38:.$I38])-[.K38]/SUM([.$J38:.$O38]) -> 0.0133269871489767 | X38: of:=[.F38]/SUM([.$D38:.$I38])-[.L38]/SUM([.$J38:.$O38]) -> 0.0157068062827225 | Y38: of:=[.G38]/SUM([.$D38:.$I38])-[.M38]/SUM([.$J38:.$O38]) -> 0.0261780104712042 | Z38: of:=[.H38]/SUM([.$D38:.$I38])-[.N38]/SUM([.$J38:.$O38]) -> -0.141820221663154 | AA38: of:=[.I38]/SUM([.$D38:.$I38])-[.O38]/SUM([.$J38:.$O38]) -> 0.0772251308900524
A39: 2016-01-21 | B39: Wealden | C39: Crowborough E | D39: 517 | E39: 93 | F39: 198 | J39: 1668 | L39: 885 | V39: of:=[.D39]/SUM([.$D39:.$I39])-[.J39]/SUM([.$J39:.$O39]) -> -0.0134975160265732 | W39: of:=[.E39]/SUM([.$D39:.$I39])-[.K39]/SUM([.$J39:.$O39]) -> 0.11509900990099 | X39: of:=[.F39]/SUM([.$D39:.$I39])-[.L39]/SUM([.$J39:.$O39]) -> -0.101601493874417 | AA39: of:=[.I39]/SUM([.$D39:.$I39])-[.O39]/SUM([.$J39:.$O39]) -> 0
A40: 2016-01-28 | B40: Stockton-on-Tees | C40: Parkfield/Oxbridge | D40: 363 | E40: 598 | F40: 65 | H40: 113 | J40: 950 | K40: 1608 | L40: 192 | M40: 285 | O40: of:=419+58 -> 477 | V40: of:=[.D40]/SUM([.$D40:.$I40])-[.J40]/SUM([.$J40:.$O40]) -> 0.0481994756220239 | W40: of:=[.E40]/SUM([.$D40:.$I40])-[.K40]/SUM([.$J40:.$O40]) -> 0.0671631791464758 | X40: of:=[.F40]/SUM([.$D40:.$I40])-[.L40]/SUM([.$J40:.$O40]) -> 0.00239789928822989 | Y40: of:=[.G40]/SUM([.$D40:.$I40])-[.M40]/SUM([.$J40:.$O40]) -> -0.0811503416856492 | Z40: of:=[.H40]/SUM([.$D40:.$I40])-[.N40]/SUM([.$J40:.$O40]) -> 0.0992098331870061 | AA40: of:=[.I40]/SUM([.$D40:.$I40])-[.O40]/SUM([.$J40:.$O40]) -> -0.135820045558087
A41: 2016-02-04 | B41: E Cambs | C41: Bottisham | D41: 421 | E41: 99 | F41: 403 | H41: 43 | J41: 1100 | K41: 347 | L41: 678 | V41: of:=[.D41]/SUM([.$D41:.$I41])-[.J41]/SUM([.$J41:.$O41]) -> -0.0818292534405067 | W41: of:=[.E41]/SUM([.$D41:.$I41])-[.K41]/SUM([.$J41:.$O41]) -> -0.0608096455973694 | X41: of:=[.F41]/SUM([.$D41:.$I41])-[.L41]/SUM([.$J41:.$O41]) -> 0.0981254414809402 | Z41: of:=[.H41]/SUM([.$D41:.$I41])-[.N41]/SUM([.$J41:.$O41]) -> 0.0445134575569358 | AA41: of:=[.I41]/SUM([.$D41:.$I41])-[.O41]/SUM([.$J41:.$O41]) -> 0
A42: 2016-02-04 | B42: NW Leics | C42: Measham S | D42: 202 | E42: 257 | H42: 141 | J42: 533 | K42: 654 | V42: of:=[.D42]/SUM([.$D42:.$I42])-[.J42]/SUM([.$J42:.$O42]) -> -0.11236450435271 | W42: of:=[.E42]/SUM([.$D42:.$I42])-[.K42]/SUM([.$J42:.$O42]) -> -0.12263549564729 | Z42: of:=[.H42]/SUM([.$D42:.$I42])-[.N42]/SUM([.$J42:.$O42]) -> 0.235 | AA42: of:=[.I42]/SUM([.$D42:.$I42])-[.O42]/SUM([.$J42:.$O42]) -> 0
A43: 2016-02-11 | B43: Eastleigh | C43: W End N | D43: 315 | E43: 58 | F43: 582 | G43: 28 | H43: 115 | J43: 1020 | K43: 280 | L43: 1156 | N43: 446 | V43: of:=[.D43]/SUM([.$D43:.$I43])-[.J43]/SUM([.$J43:.$O43]) -> -0.064596490831648 | W43: of:=[.E43]/SUM([.$D43:.$I43])-[.K43]/SUM([.$J43:.$O43]) -> -0.04366186751427 | X43: of:=[.F43]/SUM([.$D43:.$I43])-[.L43]/SUM([.$J43:.$O43]) -> 0.131708676511017 | Y43: of:=[.G43]/SUM([.$D43:.$I43])-[.M43]/SUM([.$J43:.$O43]) -> 0.0255009107468124 | Z43: of:=[.H43]/SUM([.$D43:.$I43])-[.N43]/SUM([.$J43:.$O43]) -> -0.0489512289119118 | AA43: of:=[.I43]/SUM([.$D43:.$I43])-[.O43]/SUM([.$J43:.$O43]) -> 0
A44: 2016-02-18 | B44: Chiltern | C44: Amersham Tn | D44: 489 | E44: 64 | F44: 354 | H44: 67 | J44: 1229 | K44: 450 | L44: 1052 | N44: 455 | P44: 1 | R44: -1 | V44: of:=[.D44]/SUM([.$D44:.$I44])-[.J44]/SUM([.$J44:.$O44]) -> 0.116303231153751 | W44: of:=[.E44]/SUM([.$D44:.$I44])-[.K44]/SUM([.$J44:.$O44]) -> -0.0755345189619369 | X44: of:=[.F44]/SUM([.$D44:.$I44])-[.L44]/SUM([.$J44:.$O44]) -> 0.0332550906107444 | Z44: of:=[.H44]/SUM([.$D44:.$I44])-[.N44]/SUM([.$J44:.$O44]) -> -0.0740238028025589 | AA44: of:=[.I44]/SUM([.$D44:.$I44])-[.O44]/SUM([.$J44:.$O44]) -> 0
A45: 2016-02-18 | B45: Lichfield | C45: Chadsmead | D45: 159 | E45: 195 | F45: 300 | G45: 23 | H45: 73 | J45: 747 | K45: 547 | L45: 563 | N45: 382 | V45: of:=[.D45]/SUM([.$D45:.$I45])-[.J45]/SUM([.$J45:.$O45]) -> -0.12163108530594 | W45: of:=[.E45]/SUM([.$D45:.$I45])-[.K45]/SUM([.$J45:.$O45]) -> 0.0156945064761054 | X45: of:=[.F45]/SUM([.$D45:.$I45])-[.L45]/SUM([.$J45:.$O45]) -> 0.148548459133542 | Y45: of:=[.G45]/SUM([.$D45:.$I45])-[.M45]/SUM([.$J45:.$O45]) -> 0.0306666666666667 | Z45: of:=[.H45]/SUM([.$D45:.$I45])-[.N45]/SUM([.$J45:.$O45]) -> -0.0732785469703737 | AA45: of:=[.I45]/SUM([.$D45:.$I45])-[.O45]/SUM([.$J45:.$O45]) -> 0
A46: 2016-02-18 | B46: Broxtowe | C46: Greasley | D46: 656 | E46: 300 | F46: 158 | H46: 230 | J46: 1933 | K46: 1036 | L46: 263 | N46: 795 | V46: of:=[.D46]/SUM([.$D46:.$I46])-[.J46]/SUM([.$J46:.$O46]) -> 0.00808530514266792 | W46: of:=[.E46]/SUM([.$D46:.$I46])-[.K46]/SUM([.$J46:.$O46]) -> -0.0340491858526375 | X46: of:=[.F46]/SUM([.$D46:.$I46])-[.L46]/SUM([.$J46:.$O46]) -> 0.0522503606607778 | Z46: of:=[.H46]/SUM([.$D46:.$I46])-[.N46]/SUM([.$J46:.$O46]) -> -0.0262864799508082 | AA46: of:=[.I46]/SUM([.$D46:.$I46])-[.O46]/SUM([.$J46:.$O46]) -> 0
A47: 2016-02-18 | B47: Broxtowe | C47: Toton/Chilwell Meadows | D47: 910 | E47: 368 | F47: 363 | G47: 111 | J47: 2631 | K47: 1243 | M47: 585 | N47: 773 | O47: 632 | V47: of:=[.D47]/SUM([.$D47:.$I47])-[.J47]/SUM([.$J47:.$O47]) -> 0.0707365427622768 | W47: of:=[.E47]/SUM([.$D47:.$I47])-[.K47]/SUM([.$J47:.$O47]) -> -0.00192568851345881 | X47: of:=[.F47]/SUM([.$D47:.$I47])-[.L47]/SUM([.$J47:.$O47]) -> 0.207191780821918 | Y47: of:=[.G47]/SUM([.$D47:.$I47])-[.M47]/SUM([.$J47:.$O47]) -> -0.0364050907324002 | Z47: of:=[.H47]/SUM([.$D47:.$I47])-[.N47]/SUM([.$J47:.$O47]) -> -0.131821282401091 | AA47: of:=[.I47]/SUM([.$D47:.$I47])-[.O47]/SUM([.$J47:.$O47]) -> -0.107776261937244
A48: 2016-02-25 | B48: Richmondshire | C48: Catterick | D48: 308 | I48: 203 | J48: 528 | M48: 208 | O48: 570 | V48: of:=[.D48]/SUM([.$D48:.$I48])-[.J48]/SUM([.$J48:.$O48]) -> 0.198451824036586 | Y48: of:=[.G48]/SUM([.$D48:.$I48])-[.M48]/SUM([.$J48:.$O48]) -> -0.159264931087289 | AA48: of:=[.I48]/SUM([.$D48:.$I48])-[.O48]/SUM([.$J48:.$O48]) -> -0.0391868929492962
A49: 2016-02-25 | B49: Stratford-on-Avon | C49: Studley/Sambourne | D49: 233 | E49: 156 | F49: 632 | H49: 55 | I49: 66 | J49: 655 | K49: 364 | L49: 628 | M49: 44 | N49: 207 | O49: 111 | P49: -1 | R49: 1 | V49: of:=[.D49]/SUM([.$D49:.$I49])-[.J49]/SUM([.$J49:.$O49]) -> -0.122004831149495 | W49: of:=[.E49]/SUM([.$D49:.$I49])-[.K49]/SUM([.$J49:.$O49]) -> -0.0445822171506679 | X49: of:=[.F49]/SUM([.$D49:.$I49])-[.L49]/SUM([.$J49:.$O49]) -> 0.240821731281039 | Y49: of:=[.G49]/SUM([.$D49:.$I49])-[.M49]/SUM([.$J49:.$O49]) -> -0.021901443504231 | Z49: of:=[.H49]/SUM([.$D49:.$I49])-[.N49]/SUM([.$J49:.$O49]) -> -0.0548752156451834 | AA49: of:=[.I49]/SUM([.$D49:.$I49])-[.O49]/SUM([.$J49:.$O49]) -> 0.00254197616853755
A50: 2016-03-03 | B50: Blackpool | C50: Bloomfield | D50: 150 | E50: 450 | F50: 31 | G50: 32 | H50: 118 | J50: 463 | K50: 1045 | M50: 202 | N50: 585 | O50: 37 | V50: of:=[.D50]/SUM([.$D50:.$I50])-[.J50]/SUM([.$J50:.$O50]) -> -0.00648056434662864 | W50: of:=[.E50]/SUM([.$D50:.$I50])-[.K50]/SUM([.$J50:.$O50]) -> 0.128071171454111 | X50: of:=[.F50]/SUM([.$D50:.$I50])-[.L50]/SUM([.$J50:.$O50]) -> 0.0396927016645326 | Y50: of:=[.G50]/SUM([.$D50:.$I50])-[.M50]/SUM([.$J50:.$O50]) -> -0.0456478148479211 | Z50: of:=[.H50]/SUM([.$D50:.$I50])-[.N50]/SUM([.$J50:.$O50]) -> -0.0997692846616578 | AA50: of:=[.I50]/SUM([.$D50:.$I50])-[.O50]/SUM([.$J50:.$O50]) -> -0.0158662092624357
A51: 2016-03-03 | B51: Rutland | C51: Whissendine | D51: 109 | F51: 265 | H51: 33 | J51: 265 | L51: 511 | V51: of:=[.D51]/SUM([.$D51:.$I51])-[.J51]/SUM([.$J51:.$O51]) -> -0.0736815775475569 | X51: of:=[.F51]/SUM([.$D51:.$I51])-[.L51]/SUM([.$J51:.$O51]) -> -0.00739950353352414 | Z51: of:=[.H51]/SUM([.$D51:.$I51])-[.N51]/SUM([.$J51:.$O51]) -> 0.0810810810810811 | AA51: of:=[.I51]/SUM([.$D51:.$I51])-[.O51]/SUM([.$J51:.$O51]) -> 0
A52: 2016-03-03 | B52: E Dorset | C52: Alderholt | D52: 384 | E52: 49 | F52: 376 | J52: 1113 | M52: 332 | N52: 338 | V52: of:=[.D52]/SUM([.$D52:.$I52])-[.J52]/SUM([.$J52:.$O52]) -> -0.149568753652647 | W52: of:=[.E52]/SUM([.$D52:.$I52])-[.K52]/SUM([.$J52:.$O52]) -> 0.0605686032138443 | X52: of:=[.F52]/SUM([.$D52:.$I52])-[.L52]/SUM([.$J52:.$O52]) -> 0.464771322620519 | Y52: of:=[.G52]/SUM([.$D52:.$I52])-[.M52]/SUM([.$J52:.$O52]) -> -0.186203028603477 | Z52: of:=[.H52]/SUM([.$D52:.$I52])-[.N52]/SUM([.$J52:.$O52]) -> -0.189568143578239 | AA52: of:=[.I52]/SUM([.$D52:.$I52])-[.O52]/SUM([.$J52:.$O52]) -> 0
A53: 2016-03-10 | B53: Windsor/Maidenhead | C53: Maidenhead Riverside | D53: 916 | E53: 144 | F53: 397 | H53: 95 | I53: 162 | J53: 2167 | K53: 562 | L53: 685 | M53: 517 | N53: 499 | V53: of:=[.D53]/SUM([.$D53:.$I53])-[.J53]/SUM([.$J53:.$O53]) -> 0.0452576181809083 | W53: of:=[.E53]/SUM([.$D53:.$I53])-[.K53]/SUM([.$J53:.$O53]) -> -0.0428483001493477 | X53: of:=[.F53]/SUM([.$D53:.$I53])-[.L53]/SUM([.$J53:.$O53]) -> 0.0769943974861123 | Y53: of:=[.G53]/SUM([.$D53:.$I53])-[.M53]/SUM([.$J53:.$O53]) -> -0.116704288939052 | Z53: of:=[.H53]/SUM([.$D53:.$I53])-[.N53]/SUM([.$J53:.$O53]) -> -0.0572151792040585 | AA53: of:=[.I53]/SUM([.$D53:.$I53])-[.O53]/SUM([.$J53:.$O53]) -> 0.0945157526254376
A54: 2016-03-17 | B54: Broadland | C54: Aylsham | D54: 654 | E54: 243 | F54: 829 | J54: 1588 | K54: 1082 | L54: 1521 | N54: 719 | V54: of:=[.D54]/SUM([.$D54:.$I54])-[.J54]/SUM([.$J54:.$O54]) -> 0.0554891877668248 | W54: of:=[.E54]/SUM([.$D54:.$I54])-[.K54]/SUM([.$J54:.$O54]) -> -0.0795786497629404 | X54: of:=[.F54]/SUM([.$D54:.$I54])-[.L54]/SUM([.$J54:.$O54]) -> 0.170525307209965 | Z54: of:=[.H54]/SUM([.$D54:.$I54])-[.N54]/SUM([.$J54:.$O54]) -> -0.146435845213849 | AA54: of:=[.I54]/SUM([.$D54:.$I54])-[.O54]/SUM([.$J54:.$O54]) -> 0
A55: 2016-03-17 | B55: N Kesteven | C55: Ashby de la Launde/Cranwell | D55: 296 | F55: 69 | I55: 457 | J55: 1789 | O55: 871 | P55: -1 | U55: 1 | V55: of:=[.D55]/SUM([.$D55:.$I55])-[.J55]/SUM([.$J55:.$O55]) -> -0.31245906737647 | X55: of:=[.F55]/SUM([.$D55:.$I55])-[.L55]/SUM([.$J55:.$O55]) -> 0.0839416058394161 | AA55: of:=[.I55]/SUM([.$D55:.$I55])-[.O55]/SUM([.$J55:.$O55]) -> 0.228517461537054
A56: 2016-03-17 | B56: Redcar/Cleveland | C56: Hutton | D56: 879 | E56: 368 | F56: 536 | H56: 116 | I56: 56 | J56: 1997 | K56: 1071 | L56: 643 | V56: of:=[.D56]/SUM([.$D56:.$I56])-[.J56]/SUM([.$J56:.$O56]) -> -0.0885135158418223 | W56: of:=[.E56]/SUM([.$D56:.$I56])-[.K56]/SUM([.$J56:.$O56]) -> -0.10036616101574 | X56: of:=[.F56]/SUM([.$D56:.$I56])-[.L56]/SUM([.$J56:.$O56]) -> 0.100900137215619 | Z56: of:=[.H56]/SUM([.$D56:.$I56])-[.N56]/SUM([.$J56:.$O56]) -> 0.0593350383631714 | AA56: of:=[.I56]/SUM([.$D56:.$I56])-[.O56]/SUM([.$J56:.$O56]) -> 0.0286445012787724
A57: 2016-03-24 | B57: Allerdale | C57: Dalton | D57: 93 | E57: 118 | G57: 22 | H57: 53 | I57: 133 | J57: 510 | L57: 226 | M57: 168 | N57: 153 | P57: -1 | U57: 1 | V57: of:=[.D57]/SUM([.$D57:.$I57])-[.J57]/SUM([.$J57:.$O57]) -> -0.260540594242723 | W57: of:=[.E57]/SUM([.$D57:.$I57])-[.K57]/SUM([.$J57:.$O57]) -> 0.281622911694511 | X57: of:=[.F57]/SUM([.$D57:.$I57])-[.L57]/SUM([.$J57:.$O57]) -> -0.213812677388836 | Y57: of:=[.G57]/SUM([.$D57:.$I57])-[.M57]/SUM([.$J57:.$O57]) -> -0.106434430763881 | Z57: of:=[.H57]/SUM([.$D57:.$I57])-[.N57]/SUM([.$J57:.$O57]) -> -0.0182576436666117 | AA57: of:=[.I57]/SUM([.$D57:.$I57])-[.O57]/SUM([.$J57:.$O57]) -> 0.317422434367542
A58: 2016-03-24 | B58: Kettering | C58: St Peter's | D58: 468 | E58: 180 | F58: 28 | G58: 93 | H58: 149 | J58: 1230 | K58: 768 | M58: 501 | N58: 563 | V58: of:=[.D58]/SUM([.$D58:.$I58])-[.J58]/SUM([.$J58:.$O58]) -> 0.108105685121861 | W58: of:=[.E58]/SUM([.$D58:.$I58])-[.K58]/SUM([.$J58:.$O58]) -> -0.0547380284576273 | X58: of:=[.F58]/SUM([.$D58:.$I58])-[.L58]/SUM([.$J58:.$O58]) -> 0.0305010893246187 | Y58: of:=[.G58]/SUM([.$D58:.$I58])-[.M58]/SUM([.$J58:.$O58]) -> -0.0623113604248579 | Z58: of:=[.H58]/SUM([.$D58:.$I58])-[.N58]/SUM([.$J58:.$O58]) -> -0.0215573855639941 | AA58: of:=[.I58]/SUM([.$D58:.$I58])-[.O58]/SUM([.$J58:.$O58]) -> 0
A59: 2016-03-31 | B59: Craven | C59: Embsay/Eastby | D59: 117 | I59: 466 | J59: 677 | K59: 249 | M59: 221 | P59: -1 | U59: 1 | V59: of:=[.D59]/SUM([.$D59:.$I59])-[.J59]/SUM([.$J59:.$O59]) -> -0.389549290340526 | W59: of:=[.E59]/SUM([.$D59:.$I59])-[.K59]/SUM([.$J59:.$O59]) -> -0.217088055797733 | Y59: of:=[.G59]/SUM([.$D59:.$I59])-[.M59]/SUM([.$J59:.$O59]) -> -0.192676547515257 | AA59: of:=[.I59]/SUM([.$D59:.$I59])-[.O59]/SUM([.$J59:.$O59]) -> 0.799313893653516
A60: 2016-03-31 | B60: Richmondshire | C60: Richmond C | D60: 156 | F60: 205 | G60: 77 | I60: 236 | J60: 411 | L60: 673 | M60: 298 | R60: -1 | U60: 1 | V60: of:=[.D60]/SUM([.$D60:.$I60])-[.J60]/SUM([.$J60:.$O60]) -> -0.0659410736600721 | X60: of:=[.F60]/SUM([.$D60:.$I60])-[.L60]/SUM([.$J60:.$O60]) -> -0.182821095303328 | Y60: of:=[.G60]/SUM([.$D60:.$I60])-[.M60]/SUM([.$J60:.$O60]) -> -0.101386198989123 | AA60: of:=[.I60]/SUM([.$D60:.$I60])-[.O60]/SUM([.$J60:.$O60]) -> 0.350148367952522
A61: 2016-04-07 | B61: E Riding | C61: Pocklington Provincial | D61: 980 | E61: 490 | H61: 215 | I61: 1032 | J61: 4542 | K61: 2054 | L61: 1684 | N61: 2001 | P61: -1 | U61: 1 | V61: of:=[.D61]/SUM([.$D61:.$I61])-[.J61]/SUM([.$J61:.$O61]) -> -0.0810938788608379 | W61: of:=[.E61]/SUM([.$D61:.$I61])-[.K61]/SUM([.$J61:.$O61]) -> -0.0194400432140975 | X61: of:=[.F61]/SUM([.$D61:.$I61])-[.L61]/SUM([.$J61:.$O61]) -> -0.163797295982881 | Y61: of:=[.G61]/SUM([.$D61:.$I61])-[.M61]/SUM([.$J61:.$O61]) -> 0 | Z61: of:=[.H61]/SUM([.$D61:.$I61])-[.N61]/SUM([.$J61:.$O61]) -> -0.115499477562353 | AA61: of:=[.I61]/SUM([.$D61:.$I61])-[.O61]/SUM([.$J61:.$O61]) -> 0.379830695620169
A62: 2016-04-14 | B62: Taunton Deane | C62: Taunton Halcon | D62: 222 | E62: 133 | F62: 389 | G62: 42 | H62: 118 | J62: 891 | L62: 1012 | M62: 605 | V62: of:=[.D62]/SUM([.$D62:.$I62])-[.J62]/SUM([.$J62:.$O62]) -> -0.109687936655799 | W62: of:=[.E62]/SUM([.$D62:.$I62])-[.K62]/SUM([.$J62:.$O62]) -> 0.14712389380531 | X62: of:=[.F62]/SUM([.$D62:.$I62])-[.L62]/SUM([.$J62:.$O62]) -> 0.0268009625834498 | Y62: of:=[.G62]/SUM([.$D62:.$I62])-[.M62]/SUM([.$J62:.$O62]) -> -0.194767893184288 | Z62: of:=[.H62]/SUM([.$D62:.$I62])-[.N62]/SUM([.$J62:.$O62]) -> 0.130530973451327 | AA62: of:=[.I62]/SUM([.$D62:.$I62])-[.O62]/SUM([.$J62:.$O62]) -> 0
A63: 2016-05-26 | B63: Hambleton | C63: Northallerton S | D63: 541 | E63: 232 | H63: 222 | I63: 133 | J63: 1414 | K63: 739 | N63: 762 | V63: of:=[.D63]/SUM([.$D63:.$I63])-[.J63]/SUM([.$J63:.$O63]) -> -0.00546725788596519 | W63: of:=[.E63]/SUM([.$D63:.$I63])-[.K63]/SUM([.$J63:.$O63]) -> -0.0478425361604808 | Y63: of:=[.G63]/SUM([.$D63:.$I63])-[.M63]/SUM([.$J63:.$O63]) -> 0 | Z63: of:=[.H63]/SUM([.$D63:.$I63])-[.N63]/SUM([.$J63:.$O63]) -> -0.0645980073719937 | AA63: of:=[.I63]/SUM([.$D63:.$I63])-[.O63]/SUM([.$J63:.$O63]) -> 0.11790780141844
A64: 2016-05-26 | B64: E Staffs | C64: Stapenhill | D64: 208 | E64: 536 | G64: 24 | H64: 348 | I64: 75 | J64: 963 | K64: 1251 | M64: 488 | N64: 1228 | Q64: 1 | T64: -1 | V64: of:=[.D64]/SUM([.$D64:.$I64])-[.J64]/SUM([.$J64:.$O64]) -> -0.0703950109280161 | W64: of:=[.E64]/SUM([.$D64:.$I64])-[.K64]/SUM([.$J64:.$O64]) -> 0.131721370841105 | Y64: of:=[.G64]/SUM([.$D64:.$I64])-[.M64]/SUM([.$J64:.$O64]) -> -0.104021894488562 | Z64: of:=[.H64]/SUM([.$D64:.$I64])-[.N64]/SUM([.$J64:.$O64]) -> -0.020276757615962 | AA64: of:=[.I64]/SUM([.$D64:.$I64])-[.O64]/SUM([.$J64:.$O64]) -> 0.0629722921914358
A65: 2016-06-02 | B65: Mid Suffolk | C65: Barking/Somersham | D65: 210 | E65: 154 | F65: 38 | G65: 212 | J65: 542 | L65: 154 | N65: 194 | O65: 411 | P65: -1 | S65: 1 | V65: of:=[.D65]/SUM([.$D65:.$I65])-[.J65]/SUM([.$J65:.$O65]) -> -0.0745830694003861 | W65: of:=[.E65]/SUM([.$D65:.$I65])-[.K65]/SUM([.$J65:.$O65]) -> 0.250814332247557 | X65: of:=[.F65]/SUM([.$D65:.$I65])-[.L65]/SUM([.$J65:.$O65]) -> -0.0564812334285578 | Y65: of:=[.G65]/SUM([.$D65:.$I65])-[.M65]/SUM([.$J65:.$O65]) -> 0.345276872964169 | Z65: of:=[.H65]/SUM([.$D65:.$I65])-[.N65]/SUM([.$J65:.$O65]) -> -0.149116064565719 | AA65: of:=[.I65]/SUM([.$D65:.$I65])-[.O65]/SUM([.$J65:.$O65]) -> -0.315910837817064
A66: 2016-06-02 | B66: Lewes | C66: Lewes Bridge | D66: 117 | E66: 212 | F66: 543 | G66: 345 | J66: 395 | K66: 529 | L66: 905 | M66: 677 | N66: 240 | O66: 540 | V66: of:=[.D66]/SUM([.$D66:.$I66])-[.J66]/SUM([.$J66:.$O66]) -> -0.0240688941556795 | W66: of:=[.E66]/SUM([.$D66:.$I66])-[.K66]/SUM([.$J66:.$O66]) -> 0.0132128484129528 | X66: of:=[.F66]/SUM([.$D66:.$I66])-[.L66]/SUM([.$J66:.$O66]) -> 0.170768295165216 | Y66: of:=[.G66]/SUM([.$D66:.$I66])-[.M66]/SUM([.$J66:.$O66]) -> 0.0774584139980825 | Z66: of:=[.H66]/SUM([.$D66:.$I66])-[.N66]/SUM([.$J66:.$O66]) -> -0.0730371272063299 | AA66: of:=[.I66]/SUM([.$D66:.$I66])-[.O66]/SUM([.$J66:.$O66]) -> -0.164333536214242
A67: 2016-06-16 | B67: King's Lynn/W Norfolk | C67: Valley Hill | D67: 266 | E67: 157 | F67: 102 | G67: 27 | H67: 96 | J67: 466 | O67: 899 | P67: 1 | U67: -1 | V67: of:=[.D67]/SUM([.$D67:.$I67])-[.J67]/SUM([.$J67:.$O67]) -> 0.0691018857685524 | W67: of:=[.E67]/SUM([.$D67:.$I67])-[.K67]/SUM([.$J67:.$O67]) -> 0.242283950617284 | X67: of:=[.F67]/SUM([.$D67:.$I67])-[.L67]/SUM([.$J67:.$O67]) -> 0.157407407407407 | Y67: of:=[.G67]/SUM([.$D67:.$I67])-[.M67]/SUM([.$J67:.$O67]) -> 0.0416666666666667 | Z67: of:=[.H67]/SUM([.$D67:.$I67])-[.N67]/SUM([.$J67:.$O67]) -> 0.148148148148148 | AA67: of:=[.I67]/SUM([.$D67:.$I67])-[.O67]/SUM([.$J67:.$O67]) -> -0.658608058608059
P68: of:=SUM([.P38:.P67]) -> -4 | Q68: of:=SUM([.Q38:.Q67]) -> 2 | R68: of:=SUM([.R38:.R67]) -> -1 | S68: of:=SUM([.S38:.S67]) -> 1 | T68: of:=SUM([.T38:.T67]) -> -2 | U68: Average | V68: of:=AVERAGE([.V38:.V67]) -> -0.0499613374525451 | W68: of:=AVERAGE([.W38:.W67]) -> 0.0200616296601394 | X68: of:=AVERAGE([.X38:.X67]) -> 0.0610558469230497 | Y68: of:=AVERAGE([.Y38:.Y67]) -> -0.0410537011072566 | Z68: of:=AVERAGE([.Z38:.Z67]) -> -0.0283427665107271 | AA68: of:=AVERAGE([.AA38:.AA67]) -> 0.0340512821785684
A69: 2016-06-30 | B69: Luton | C69: High Town | D69: 141 | E69: 505 | F69: 181 | G69: 273 | H69: 69 | I69: 102 | J69: 791 | K69: 1442 | M69: 479 | V69: of:=[.D69]/SUM([.$D69:.$I69])-[.J69]/SUM([.$J69:.$O69]) -> -0.180730396013638 | W69: of:=[.E69]/SUM([.$D69:.$I69])-[.K69]/SUM([.$J69:.$O69]) -> -0.134385973462932 | X69: of:=[.F69]/SUM([.$D69:.$I69])-[.L69]/SUM([.$J69:.$O69]) -> 0.142407553107789 | Y69: of:=[.G69]/SUM([.$D69:.$I69])-[.M69]/SUM([.$J69:.$O69]) -> 0.0381690838746811 | Z69: of:=[.H69]/SUM([.$D69:.$I69])-[.N69]/SUM([.$J69:.$O69]) -> 0.0542879622344611 | AA69: of:=[.I69]/SUM([.$D69:.$I69])-[.O69]/SUM([.$J69:.$O69]) -> 0.0802517702596381
A70: 2016-07-01 | B70: Thanet | C70: Newington | D70: 125 | E70: 281 | F70: 33 | H70: 295 | J70: 390 | K70: 728 | N70: 884 | V70: of:=[.D70]/SUM([.$D70:.$I70])-[.J70]/SUM([.$J70:.$O70]) -> -0.0245054672847589 | W70: of:=[.E70]/SUM([.$D70:.$I70])-[.K70]/SUM([.$J70:.$O70]) -> 0.0191974238295764 | X70: of:=[.F70]/SUM([.$D70:.$I70])-[.L70]/SUM([.$J70:.$O70]) -> 0.0449591280653951 | Z70: of:=[.H70]/SUM([.$D70:.$I70])-[.N70]/SUM([.$J70:.$O70]) -> -0.0396510846102127
A71: 2016-07-14 | B71: N Norfolk | C71: Astley | D71: 198 | E71: 51 | F71: 319 | G71: 81 | H71: 133 | J71: 734 | K71: 233 | M71: 344 | P71: -1 | R71: 1 | V71: of:=[.D71]/SUM([.$D71:.$I71])-[.J71]/SUM([.$J71:.$O71]) -> -0.306681024812671 | W71: of:=[.E71]/SUM([.$D71:.$I71])-[.K71]/SUM([.$J71:.$O71]) -> -0.112509534706331 | X71: of:=[.F71]/SUM([.$D71:.$I71])-[.L71]/SUM([.$J71:.$O71]) -> 0.407928388746803 | Y71: of:=[.G71]/SUM([.$D71:.$I71])-[.M71]/SUM([.$J71:.$O71]) -> -0.158814555570512 | Z71: of:=[.H71]/SUM([.$D71:.$I71])-[.N71]/SUM([.$J71:.$O71]) -> 0.170076726342711
A72: 2016-07-14 | B72: Selby | C72: Byram/Brotherton | D72: 251 | E72: 224 | I72: 91 | J72: 480 | K72: 648 | N72: 345 | P72: 1 | Q72: -1 | V72: of:=[.D72]/SUM([.$D72:.$I72])-[.J72]/SUM([.$J72:.$O72]) -> 0.117597317078437 | W72: of:=[.E72]/SUM([.$D72:.$I72])-[.K72]/SUM([.$J72:.$O72]) -> -0.0441588162904004 | Z72: of:=[.H72]/SUM([.$D72:.$I72])-[.N72]/SUM([.$J72:.$O72]) -> -0.234215885947047 | AA72: of:=[.I72]/SUM([.$D72:.$I72])-[.O72]/SUM([.$J72:.$O72]) -> 0.160777385159011
A73: 2016-07-21 | B73: Newark/Sherwood | C73: Balderton S | D73: 483 | F73: 103 | J73: 1265 | K73: 956 | V73: of:=[.D73]/SUM([.$D73:.$I73])-[.J73]/SUM([.$J73:.$O73]) -> 0.254668822118377 | W73: of:=[.E73]/SUM([.$D73:.$I73])-[.K73]/SUM([.$J73:.$O73]) -> -0.430436740207114 | X73: of:=[.F73]/SUM([.$D73:.$I73])-[.L73]/SUM([.$J73:.$O73]) -> 0.175767918088737
A74: 2016-07-21 | B74: Northampton | C74: Westone | D74: 319 | E74: 270 | F74: 583 | J74: 1318 | K74: 722 | L74: 315 | V74: of:=[.D74]/SUM([.$D74:.$I74])-[.J74]/SUM([.$J74:.$O74]) -> -0.287475996898618 | W74: of:=[.E74]/SUM([.$D74:.$I74])-[.K74]/SUM([.$J74:.$O74]) -> -0.076206314355485 | X74: of:=[.F74]/SUM([.$D74:.$I74])-[.L74]/SUM([.$J74:.$O74]) -> 0.363682311254103
A75: 2016-07-21 | B75: E Devon | C75: Exmouth Littleham | D75: 547 | E75: 193 | F75: 467 | J75: 1667 | L75: 1170 | M75: 1102 | N75: 1164 | O75: 1224 | V75: of:=[.D75]/SUM([.$D75:.$I75])-[.J75]/SUM([.$J75:.$O75]) -> 0.189715726278758 | W75: of:=[.E75]/SUM([.$D75:.$I75])-[.K75]/SUM([.$J75:.$O75]) -> 0.15990057995029 | X75: of:=[.F75]/SUM([.$D75:.$I75])-[.L75]/SUM([.$J75:.$O75]) -> 0.201987929585714 | Y75: of:=[.G75]/SUM([.$D75:.$I75])-[.M75]/SUM([.$J75:.$O75]) -> -0.174174174174174 | Z75: of:=[.H75]/SUM([.$D75:.$I75])-[.N75]/SUM([.$J75:.$O75]) -> -0.183973447131342 | AA75: of:=[.I75]/SUM([.$D75:.$I75])-[.O75]/SUM([.$J75:.$O75]) -> -0.193456614509246
A76: 2016-07-21 | B76: E Devon | C76: Honiton St Michael's | D76: 362 | E76: 197 | H76: 140 | I76: 211 | J76: 1400 | N76: 734 | O76: of:=723+690 -> 1413 | V76: of:=[.D76]/SUM([.$D76:.$I76])-[.J76]/SUM([.$J76:.$O76]) -> 0.00310245153774896 | W76: of:=[.E76]/SUM([.$D76:.$I76])-[.K76]/SUM([.$J76:.$O76]) -> 0.216483516483516 | Z76: of:=[.H76]/SUM([.$D76:.$I76])-[.N76]/SUM([.$J76:.$O76]) -> -0.0530892845524929 | AA76: of:=[.I76]/SUM([.$D76:.$I76])-[.O76]/SUM([.$J76:.$O76]) -> -0.166496683468773
A77: 2016-07-21 | B77: S Staffs | C77: Gt Wyrley Tn | D77: 357 | E77: 230 | H77: 114 | J77: 1787 | K77: 979 | N77: 825 | V77: of:=[.D77]/SUM([.$D77:.$I77])-[.J77]/SUM([.$J77:.$O77]) -> 0.0116394965858139 | W77: of:=[.E77]/SUM([.$D77:.$I77])-[.K77]/SUM([.$J77:.$O77]) -> 0.05547670094558 | Z77: of:=[.H77]/SUM([.$D77:.$I77])-[.N77]/SUM([.$J77:.$O77]) -> -0.0671161975313939
A78: 2016-07-26 | B78: E Hants | C78: Hangers/Forest | D78: 236 | E78: 17 | F78: 227 | I78: of:=41 -> 41 | J78: 983 | K78: 184 | O78: 257 | V78: of:=[.D78]/SUM([.$D78:.$I78])-[.J78]/SUM([.$J78:.$O78]) -> -0.2373339407794 | W78: of:=[.E78]/SUM([.$D78:.$I78])-[.K78]/SUM([.$J78:.$O78]) -> -0.0965839246048006 | X78: of:=[.F78]/SUM([.$D78:.$I78])-[.L78]/SUM([.$J78:.$O78]) -> 0.435700575815739 | AA78: of:=[.I78]/SUM([.$D78:.$I78])-[.O78]/SUM([.$J78:.$O78]) -> -0.101782710431538
A79: 2016-07-27 | B79: S Hams | C79: Totnes | D79: 137 | F79: 812 | G79: 499 | I79: 391 | J79: 928 | K79: 1265 | L79: 1150 | M79: 2215 | N79: 693 | O79: 349 | Q79: -1 | R79: 1 | V79: of:=[.D79]/SUM([.$D79:.$I79])-[.J79]/SUM([.$J79:.$O79]) -> -0.0661090513619062 | W79: of:=[.E79]/SUM([.$D79:.$I79])-[.K79]/SUM([.$J79:.$O79]) -> -0.191666666666667 | X79: of:=[.F79]/SUM([.$D79:.$I79])-[.L79]/SUM([.$J79:.$O79]) -> 0.267301893321469 | Y79: of:=[.G79]/SUM([.$D79:.$I79])-[.M79]/SUM([.$J79:.$O79]) -> -0.0642629393445054 | Z79: of:=[.H79]/SUM([.$D79:.$I79])-[.N79]/SUM([.$J79:.$O79]) -> -0.105 | AA79: of:=[.I79]/SUM([.$D79:.$I79])-[.O79]/SUM([.$J79:.$O79]) -> 0.159736764051609
A80: 2016-07-28 | B80: Wychavon | C80: Droitwich W | D80: 281 | E80: 161 | F80: 97 | H80: 132 | J80: 983 | K80: 829 | M80: 381 | V80: of:=[.D80]/SUM([.$D80:.$I80])-[.J80]/SUM([.$J80:.$O80]) -> -0.0294664706765803 | W80: of:=[.E80]/SUM([.$D80:.$I80])-[.K80]/SUM([.$J80:.$O80]) -> -0.138080588350822 | X80: of:=[.F80]/SUM([.$D80:.$I80])-[.L80]/SUM([.$J80:.$O80]) -> 0.144560357675112 | Y80: of:=[.G80]/SUM([.$D80:.$I80])-[.M80]/SUM([.$J80:.$O80]) -> -0.173734610123119 | Z80: of:=[.H80]/SUM([.$D80:.$I80])-[.N80]/SUM([.$J80:.$O80]) -> 0.19672131147541
A81: 2016-08-04 | B81: E Riding | C81: SE Holderness | D81: 917 | E81: 806 | F81: 98 | H81: 390 | I81: 173 | J81: 2406 | K81: 1783 | N81: 2043 | O81: 660 | V81: of:=[.D81]/SUM([.$D81:.$I81])-[.J81]/SUM([.$J81:.$O81]) -> 0.0355472447385744 | W81: of:=[.E81]/SUM([.$D81:.$I81])-[.K81]/SUM([.$J81:.$O81]) -> 0.0793815025299248 | X81: of:=[.F81]/SUM([.$D81:.$I81])-[.L81]/SUM([.$J81:.$O81]) -> 0.0411073825503356 | Z81: of:=[.H81]/SUM([.$D81:.$I81])-[.N81]/SUM([.$J81:.$O81]) -> -0.132840040198343 | AA81: of:=[.I81]/SUM([.$D81:.$I81])-[.O81]/SUM([.$J81:.$O81]) -> -0.0231960896204918
A82: 2016-08-04 | B82: Eden | C82: Alston Moor | D82: 251 | F82: 302 | J82: 487 | O82: 710 | V82: of:=[.D82]/SUM([.$D82:.$I82])-[.J82]/SUM([.$J82:.$O82]) -> 0.0470374247855927 | X82: of:=[.F82]/SUM([.$D82:.$I82])-[.L82]/SUM([.$J82:.$O82]) -> 0.546112115732369 | AA82: of:=[.I82]/SUM([.$D82:.$I82])-[.O82]/SUM([.$J82:.$O82]) -> -0.593149540517962
A83: 2016-08-04 | B83: Newcastle (Lyme) | C83: Silverdale/Parksite | D83: 80 | E83: 399 | H83: 174 | I83: 54 | J83: 416 | K83: 888 | M83: 100 | O83: of:=435+62 -> 497 | Q83: 1 | T83: -1 | V83: of:=[.D83]/SUM([.$D83:.$I83])-[.J83]/SUM([.$J83:.$O83]) -> -0.105678021022212 | W83: of:=[.E83]/SUM([.$D83:.$I83])-[.K83]/SUM([.$J83:.$O83]) -> 0.0972338685736011 | Y83: of:=[.G83]/SUM([.$D83:.$I83])-[.M83]/SUM([.$J83:.$O83]) -> -0.0526038926880589 | Z83: of:=[.H83]/SUM([.$D83:.$I83])-[.N83]/SUM([.$J83:.$O83]) -> 0.246110325318246 | AA83: of:=[.I83]/SUM([.$D83:.$I83])-[.O83]/SUM([.$J83:.$O83]) -> -0.185062280181576
A84: 2016-08-04 | B84: Rushcliffe | C84: Cranmer | D84: 318 | E84: 130 | I84: 138 | J84: 995 | K84: 410 | V84: of:=[.D84]/SUM([.$D84:.$I84])-[.J84]/SUM([.$J84:.$O84]) -> -0.165522937339827 | W84: of:=[.E84]/SUM([.$D84:.$I84])-[.K84]/SUM([.$J84:.$O84]) -> -0.0699719432062478 | AA84: of:=[.I84]/SUM([.$D84:.$I84])-[.O84]/SUM([.$J84:.$O84]) -> 0.235494880546075
A85: 2016-08-04 | B85: Ashford | C85: Beaver | D85: 240 | E85: 243 | G85: 31 | H85: 373 | J85: 715 | K85: 817 | M85: 195 | N85: 812 | O85: 126 | Q85: -1 | T85: 1 | V85: of:=[.D85]/SUM([.$D85:.$I85])-[.J85]/SUM([.$J85:.$O85]) -> 0.00228228888827781 | W85: of:=[.E85]/SUM([.$D85:.$I85])-[.K85]/SUM([.$J85:.$O85]) -> -0.0326094451647838 | Y85: of:=[.G85]/SUM([.$D85:.$I85])-[.M85]/SUM([.$J85:.$O85]) -> -0.0382214645145324 | Z85: of:=[.H85]/SUM([.$D85:.$I85])-[.N85]/SUM([.$J85:.$O85]) -> 0.115828170509612 | AA85: of:=[.I85]/SUM([.$D85:.$I85])-[.O85]/SUM([.$J85:.$O85]) -> -0.0472795497185741
A86: 2016-08-04 | B86: Brighton/Hove | C86: E Brighton | D86: 514 | E86: 1488 | F86: 116 | G86: 286 | H86: 152 | I86: 31 | J86: 1563 | K86: 3229 | L86: 546 | M86: 1357 | O86: 255 | V86: of:=[.D86]/SUM([.$D86:.$I86])-[.J86]/SUM([.$J86:.$O86]) -> -0.0262063499567567 | W86: of:=[.E86]/SUM([.$D86:.$I86])-[.K86]/SUM([.$J86:.$O86]) -> 0.110579293812727 | X86: of:=[.F86]/SUM([.$D86:.$I86])-[.L86]/SUM([.$J86:.$O86]) -> -0.033721568551112 | Y86: of:=[.G86]/SUM([.$D86:.$I86])-[.M86]/SUM([.$J86:.$O86]) -> -0.0846990347420556 | Z86: of:=[.H86]/SUM([.$D86:.$I86])-[.N86]/SUM([.$J86:.$O86]) -> 0.0587553150367221 | AA86: of:=[.I86]/SUM([.$D86:.$I86])-[.O86]/SUM([.$J86:.$O86]) -> -0.024707655599525
A87: 2016-08-18 | B87: Waverley | C87: Farnham Castle | D87: 229 | F87: 292 | H87: 43 | I87: 386 | J87: 797 | K87: 438 | L87: 736 | O87: 1043 | P87: -1 | U87: 1 | V87: of:=[.D87]/SUM([.$D87:.$I87])-[.J87]/SUM([.$J87:.$O87]) -> -0.0233800160653791 | W87: of:=[.E87]/SUM([.$D87:.$I87])-[.K87]/SUM([.$J87:.$O87]) -> -0.145321831453218 | X87: of:=[.F87]/SUM([.$D87:.$I87])-[.L87]/SUM([.$J87:.$O87]) -> 0.0631746586106939 | Z87: of:=[.H87]/SUM([.$D87:.$I87])-[.N87]/SUM([.$J87:.$O87]) -> 0.0452631578947368 | AA87: of:=[.I87]/SUM([.$D87:.$I87])-[.O87]/SUM([.$J87:.$O87]) -> 0.0602640310131666
A88: 2016-08-18 | B88: Waverley | C88: Farnham Shortheath/Boundstone | D88: 233 | F88: 90 | H88: 26 | I88: of:=356+43 -> 399 | J88: 1064 | K88: 337 | O88: 958 | P88: -1 | U88: 1 | V88: of:=[.D88]/SUM([.$D88:.$I88])-[.J88]/SUM([.$J88:.$O88]) -> -0.139541249464447 | W88: of:=[.E88]/SUM([.$D88:.$I88])-[.K88]/SUM([.$J88:.$O88]) -> -0.142857142857143 | X88: of:=[.F88]/SUM([.$D88:.$I88])-[.L88]/SUM([.$J88:.$O88]) -> 0.120320855614973 | Z88: of:=[.H88]/SUM([.$D88:.$I88])-[.N88]/SUM([.$J88:.$O88]) -> 0.0347593582887701 | AA88: of:=[.I88]/SUM([.$D88:.$I88])-[.O88]/SUM([.$J88:.$O88]) -> 0.127318178417847
A89: 2016-08-18 | B89: Thanet | C89: Northwood (2) | D89: 282 | E89: 356 | F89: 64 | H89: 488 | I89: of:=136+44 -> 180 | J89: 726 | K89: 830 | N89: 1351 | V89: of:=[.D89]/SUM([.$D89:.$I89])-[.J89]/SUM([.$J89:.$O89]) -> -0.0439025860055893 | W89: of:=[.E89]/SUM([.$D89:.$I89])-[.K89]/SUM([.$J89:.$O89]) -> -0.025663701259733 | X89: of:=[.F89]/SUM([.$D89:.$I89])-[.L89]/SUM([.$J89:.$O89]) -> 0.0467153284671533 | Z89: of:=[.H89]/SUM([.$D89:.$I89])-[.N89]/SUM([.$J89:.$O89]) -> -0.1085359025157 | AA89: of:=[.I89]/SUM([.$D89:.$I89])-[.O89]/SUM([.$J89:.$O89]) -> 0.131386861313869
A90: 2016-08-18 | B90: Gravesham | C90: Pelham | D90: 325 | E90: 494 | F90: 101 | G90: 35 | H90: 91 | I90: 24 | J90: 1246 | K90: 1792 | M90: 525 | V90: of:=[.D90]/SUM([.$D90:.$I90])-[.J90]/SUM([.$J90:.$O90]) -> -0.0459669867616547 | W90: of:=[.E90]/SUM([.$D90:.$I90])-[.K90]/SUM([.$J90:.$O90]) -> -0.0412647118227053 | X90: of:=[.F90]/SUM([.$D90:.$I90])-[.L90]/SUM([.$J90:.$O90]) -> 0.094392523364486 | Y90: of:=[.G90]/SUM([.$D90:.$I90])-[.M90]/SUM([.$J90:.$O90]) -> -0.114637460294145 | Z90: of:=[.H90]/SUM([.$D90:.$I90])-[.N90]/SUM([.$J90:.$O90]) -> 0.0850467289719626 | AA90: of:=[.I90]/SUM([.$D90:.$I90])-[.O90]/SUM([.$J90:.$O90]) -> 0.0224299065420561
A91: 2016-08-18 | B91: Redcar/Cleveland | C91: Ormesby | D91: 41 | E91: 126 | F91: 980 | H91: 138 | I91: 15 | J91: 413 | K91: 681 | L91: 1358 | N91: 621 | O91: 180 | V91: of:=[.D91]/SUM([.$D91:.$I91])-[.J91]/SUM([.$J91:.$O91]) -> -0.095421267942018 | W91: of:=[.E91]/SUM([.$D91:.$I91])-[.K91]/SUM([.$J91:.$O91]) -> -0.112422142874033 | X91: of:=[.F91]/SUM([.$D91:.$I91])-[.L91]/SUM([.$J91:.$O91]) -> 0.336385348435763 | Z91: of:=[.H91]/SUM([.$D91:.$I91])-[.N91]/SUM([.$J91:.$O91]) -> -0.0847468608858095 | AA91: of:=[.I91]/SUM([.$D91:.$I91])-[.O91]/SUM([.$J91:.$O91]) -> -0.0437950767339024
A92: 2016-08-18 | B92: Richmondshire | C92: Catterick | D92: 156 | F92: 205 | G92: 77 | I92: 236 | J92: 528 | M92: 208 | O92: 570 | R92: -1 | U92: 1 | V92: of:=[.D92]/SUM([.$D92:.$I92])-[.J92]/SUM([.$J92:.$O92]) -> -0.172833896056094 | X92: of:=[.F92]/SUM([.$D92:.$I92])-[.L92]/SUM([.$J92:.$O92]) -> 0.304154302670623 | Y92: of:=[.G92]/SUM([.$D92:.$I92])-[.M92]/SUM([.$J92:.$O92]) -> -0.0450216076451529 | AA92: of:=[.I92]/SUM([.$D92:.$I92])-[.O92]/SUM([.$J92:.$O92]) -> -0.0862987989693767
A93: 2016-09-01 | B93: Bournemouth | C93: Kinson N | D93: 556 | E93: 517 | F93: 116 | G93: 102 | H93: 313 | J93: 1638 | K93: 1060 | L93: 453 | M93: 526 | N93: 1362 | V93: of:=[.D93]/SUM([.$D93:.$I93])-[.J93]/SUM([.$J93:.$O93]) -> 0.02156891953486 | W93: of:=[.E93]/SUM([.$D93:.$I93])-[.K93]/SUM([.$J93:.$O93]) -> 0.111960003741391 | X93: of:=[.F93]/SUM([.$D93:.$I93])-[.L93]/SUM([.$J93:.$O93]) -> -0.0175795874473372 | Y93: of:=[.G93]/SUM([.$D93:.$I93])-[.M93]/SUM([.$J93:.$O93]) -> -0.0407947683876239 | Z93: of:=[.H93]/SUM([.$D93:.$I93])-[.N93]/SUM([.$J93:.$O93]) -> -0.0751545674412896
A94: 2016-09-01 | B94: E Dorset | C94: Parley | D94: 631 | E94: 52 | F94: 84 | H94: 369 | J94: 1899 | M94: 288 | N94: 859 | O94: 309 | V94: of:=[.D94]/SUM([.$D94:.$I94])-[.J94]/SUM([.$J94:.$O94]) -> -0.0105631179026469 | W94: of:=[.E94]/SUM([.$D94:.$I94])-[.K94]/SUM([.$J94:.$O94]) -> 0.0457746478873239 | X94: of:=[.F94]/SUM([.$D94:.$I94])-[.L94]/SUM([.$J94:.$O94]) -> 0.073943661971831 | Y94: of:=[.G94]/SUM([.$D94:.$I94])-[.M94]/SUM([.$J94:.$O94]) -> -0.0858420268256334 | Z94: of:=[.H94]/SUM([.$D94:.$I94])-[.N94]/SUM([.$J94:.$O94]) -> 0.0687881761507945 | AA94: of:=[.I94]/SUM([.$D94:.$I94])-[.O94]/SUM([.$J94:.$O94]) -> -0.0921013412816692
A95: 2016-09-01 | B95: Stockton-on-Tees | C95: Grangefield | D95: 807 | E95: 689 | F95: 44 | H95: 58 | J95: 1297 | K95: 1795 | L95: 143 | N95: 459 | P95: 1 | Q95: -1 | V95: of:=[.D95]/SUM([.$D95:.$I95])-[.J95]/SUM([.$J95:.$O95]) -> 0.153896349863426 | W95: of:=[.E95]/SUM([.$D95:.$I95])-[.K95]/SUM([.$J95:.$O95]) -> -0.0547591636269755 | X95: of:=[.F95]/SUM([.$D95:.$I95])-[.L95]/SUM([.$J95:.$O95]) -> -0.0111770059081703 | Z95: of:=[.H95]/SUM([.$D95:.$I95])-[.N95]/SUM([.$J95:.$O95]) -> -0.0879601803282799
A96: 2016-09-08 | B96: Barrow-in-Furness | C96: Parkside | D96: 257 | E96: 317 | H96: 34 | J96: 1026 | K96: 1259 | V96: of:=[.D96]/SUM([.$D96:.$I96])-[.J96]/SUM([.$J96:.$O96]) -> -0.0263179488655994 | W96: of:=[.E96]/SUM([.$D96:.$I96])-[.K96]/SUM([.$J96:.$O96]) -> -0.0296031037659794 | Z96: of:=[.H96]/SUM([.$D96:.$I96])-[.N96]/SUM([.$J96:.$O96]) -> 0.055921052631579
A97: 2016-09-08 | B97: Mansfield | C97: Yeoman Hill | D97: 41 | E97: 278 | H97: 105 | I97: of:=148+36 -> 184 | K97: 721 | O97: 716 | V97: of:=[.D97]/SUM([.$D97:.$I97])-[.J97]/SUM([.$J97:.$O97]) -> 0.0674342105263158 | W97: of:=[.E97]/SUM([.$D97:.$I97])-[.K97]/SUM([.$J97:.$O97]) -> -0.0445028934549316 | Z97: of:=[.H97]/SUM([.$D97:.$I97])-[.N97]/SUM([.$J97:.$O97]) -> 0.172697368421053 | AA97: of:=[.I97]/SUM([.$D97:.$I97])-[.O97]/SUM([.$J97:.$O97]) -> -0.195628685492437
A98: 2016-09-15 | B98: E Herts | C98: Puckeridge | D98: 179 | E98: 46 | F98: 75 | G98: 38 | H98: 79 | J98: 940 | K98: 277 | M98: 175 | V98: of:=[.D98]/SUM([.$D98:.$I98])-[.J98]/SUM([.$J98:.$O98]) -> -0.246030761597618 | W98: of:=[.E98]/SUM([.$D98:.$I98])-[.K98]/SUM([.$J98:.$O98]) -> -0.0886825022740429 | X98: of:=[.F98]/SUM([.$D98:.$I98])-[.L98]/SUM([.$J98:.$O98]) -> 0.179856115107914 | Y98: of:=[.G98]/SUM([.$D98:.$I98])-[.M98]/SUM([.$J98:.$O98]) -> -0.0345912924832548 | Z98: of:=[.H98]/SUM([.$D98:.$I98])-[.N98]/SUM([.$J98:.$O98]) -> 0.189448441247002
A99: 2016-09-15 | B99: NE Derbys | C99: Tupton | D99: 155 | E99: 308 | F99: 340 | H99: 79 | I99: 6 | J99: 567 | K99: 1158 | Q99: -1 | R99: 1 | V99: of:=[.D99]/SUM([.$D99:.$I99])-[.J99]/SUM([.$J99:.$O99]) -> -0.154146102624364 | W99: of:=[.E99]/SUM([.$D99:.$I99])-[.K99]/SUM([.$J99:.$O99]) -> -0.32445750097924 | X99: of:=[.F99]/SUM([.$D99:.$I99])-[.L99]/SUM([.$J99:.$O99]) -> 0.382882882882883 | Z99: of:=[.H99]/SUM([.$D99:.$I99])-[.N99]/SUM([.$J99:.$O99]) -> 0.088963963963964 | AA99: of:=[.I99]/SUM([.$D99:.$I99])-[.O99]/SUM([.$J99:.$O99]) -> 0.00675675675675676
A100: 2016-09-22 | B100: N Warks | C100: Arley/Whitacre | D100: 390 | E100: 577 | J100: 1342 | K100: 901 | M100: 446 | N100: 784 | P100: -1 | Q100: 1 | V100: of:=[.D100]/SUM([.$D100:.$I100])-[.J100]/SUM([.$J100:.$O100]) -> 0.0168997594383739 | W100: of:=[.E100]/SUM([.$D100:.$I100])-[.K100]/SUM([.$J100:.$O100]) -> 0.337260908571992 | Y100: of:=[.G100]/SUM([.$D100:.$I100])-[.M100]/SUM([.$J100:.$O100]) -> -0.128419234091563 | Z100: of:=[.H100]/SUM([.$D100:.$I100])-[.N100]/SUM([.$J100:.$O100]) -> -0.225741433918802
A101: 2016-09-22 | B101: Allerdale | C101: Christchurch | D101: 206 | E101: 324 | F101: 234 | H101: 32 | J101: 925 | K101: 714 | L101: 193 | M101: 216 | P101: -1 | Q101: 1 | V101: of:=[.D101]/SUM([.$D101:.$I101])-[.J101]/SUM([.$J101:.$O101]) -> -0.192866186400754 | W101: of:=[.E101]/SUM([.$D101:.$I101])-[.K101]/SUM([.$J101:.$O101]) -> 0.058402363379397 | X101: of:=[.F101]/SUM([.$D101:.$I101])-[.L101]/SUM([.$J101:.$O101]) -> 0.199731567996231 | Y101: of:=[.G101]/SUM([.$D101:.$I101])-[.M101]/SUM([.$J101:.$O101]) -> -0.10546875 | Z101: of:=[.H101]/SUM([.$D101:.$I101])-[.N101]/SUM([.$J101:.$O101]) -> 0.0402010050251256
A102: 2016-09-22 | B102: Teignbridge | C102: Teignmouth C | D102: 286 | E102: 72 | F102: 491 | H102: 111 | J102: 1271 | K102: 484 | L102: 684 | M102: 556 | P102: -1 | R102: 1 | V102: of:=[.D102]/SUM([.$D102:.$I102])-[.J102]/SUM([.$J102:.$O102]) -> -0.126457289927657 | W102: of:=[.E102]/SUM([.$D102:.$I102])-[.K102]/SUM([.$J102:.$O102]) -> -0.0866026711185309 | X102: of:=[.F102]/SUM([.$D102:.$I102])-[.L102]/SUM([.$J102:.$O102]) -> 0.283077698942682 | Y102: of:=[.G102]/SUM([.$D102:.$I102])-[.M102]/SUM([.$J102:.$O102]) -> -0.185642737896494 | Z102: of:=[.H102]/SUM([.$D102:.$I102])-[.N102]/SUM([.$J102:.$O102]) -> 0.115625
A103: 2016-09-29 | B103: W Lindsey | C103: Cherry Willingham | D103: 555 | E103: 288 | H103: 244 | J103: 1726 | K103: 1151 | O103: 1561 | V103: of:=[.D103]/SUM([.$D103:.$I103])-[.J103]/SUM([.$J103:.$O103]) -> 0.1216656516254 | W103: of:=[.E103]/SUM([.$D103:.$I103])-[.K103]/SUM([.$J103:.$O103]) -> 0.00559834298831741 | Z103: of:=[.H103]/SUM([.$D103:.$I103])-[.N103]/SUM([.$J103:.$O103]) -> 0.224471021159154 | AA103: of:=[.I103]/SUM([.$D103:.$I103])-[.O103]/SUM([.$J103:.$O103]) -> -0.351735015772871
A104: 2016-09-29 | B104: N Norfolk | C104: Glaven Vy | D104: 281 | E104: 23 | F104: 429 | G104: 12 | H104: 32 | J104: 438 | K104: 78 | L104: 634 | M104: 53 | N104: 149 | V104: of:=[.D104]/SUM([.$D104:.$I104])-[.J104]/SUM([.$J104:.$O104]) -> 0.0376828646059416 | W104: of:=[.E104]/SUM([.$D104:.$I104])-[.K104]/SUM([.$J104:.$O104]) -> -0.0280912780912781 | X104: of:=[.F104]/SUM([.$D104:.$I104])-[.L104]/SUM([.$J104:.$O104]) -> 0.0831886408809486 | Y104: of:=[.G104]/SUM([.$D104:.$I104])-[.M104]/SUM([.$J104:.$O104]) -> -0.0237571679879372 | Z104: of:=[.H104]/SUM([.$D104:.$I104])-[.N104]/SUM([.$J104:.$O104]) -> -0.0690230594076748
A105: 2016-09-29 | B105: Wellingborough | C105: Finedon | D105: 758 | E105: 235 | F105: 86 | H105: 137 | J105: 1250 | K105: 720 | N105: 698 | V105: of:=[.D105]/SUM([.$D105:.$I105])-[.J105]/SUM([.$J105:.$O105]) -> 0.154839521028959 | W105: of:=[.E105]/SUM([.$D105:.$I105])-[.K105]/SUM([.$J105:.$O105]) -> -0.0766084885188985 | X105: of:=[.F105]/SUM([.$D105:.$I105])-[.L105]/SUM([.$J105:.$O105]) -> 0.0707236842105263 | Z105: of:=[.H105]/SUM([.$D105:.$I105])-[.N105]/SUM([.$J105:.$O105]) -> -0.148954716720587
A106: 2016-09-29 | B106: Dacorum | C106: Adeyfield W | D106: 233 | E106: 166 | F106: 520 | G106: 17 | H106: 115 | J106: 763 | K106: 696 | L106: 715 | N106: 672 | P106: -1 | R106: 1 | V106: of:=[.D106]/SUM([.$D106:.$I106])-[.J106]/SUM([.$J106:.$O106]) -> -0.046401947614727 | W106: of:=[.E106]/SUM([.$D106:.$I106])-[.K106]/SUM([.$J106:.$O106]) -> -0.0866089452002677 | X106: of:=[.F106]/SUM([.$D106:.$I106])-[.L106]/SUM([.$J106:.$O106]) -> 0.24353709247225 | Y106: of:=[.G106]/SUM([.$D106:.$I106])-[.M106]/SUM([.$J106:.$O106]) -> 0.0161750713606089 | Z106: of:=[.H106]/SUM([.$D106:.$I106])-[.N106]/SUM([.$J106:.$O106]) -> -0.126701271017864
A107: 2016-09-29 | B107: Cotswold | C107: Stow | D107: 300 | F107: 555 | J107: 783 | L107: 613 | P107: -1 | R107: 1 | V107: of:=[.D107]/SUM([.$D107:.$I107])-[.J107]/SUM([.$J107:.$O107]) -> -0.210011059166541 | X107: of:=[.F107]/SUM([.$D107:.$I107])-[.L107]/SUM([.$J107:.$O107]) -> 0.210011059166541
A108: 2016-09-29 | B108: Blackpool | C108: Tyldesley | D108: 297 | E108: 535 | F108: 37 | H108: 238 | J108: 872 | K108: 1145 | L108: 167 | N108: 658 | O108: 144 | V108: of:=[.D108]/SUM([.$D108:.$I108])-[.J108]/SUM([.$J108:.$O108]) -> -0.0237367879372028 | W108: of:=[.E108]/SUM([.$D108:.$I108])-[.K108]/SUM([.$J108:.$O108]) -> 0.0998320376148615 | X108: of:=[.F108]/SUM([.$D108:.$I108])-[.L108]/SUM([.$J108:.$O108]) -> -0.0225039948546393 | Z108: of:=[.H108]/SUM([.$D108:.$I108])-[.N108]/SUM([.$J108:.$O108]) -> -0.00536620458859197 | AA108: of:=[.I108]/SUM([.$D108:.$I108])-[.O108]/SUM([.$J108:.$O108]) -> -0.0482250502344273
A109: 2016-10-06 | B109: E Devon | C109: Exmouth Brixington | D109: 425 | F109: 286 | I109: 324 | J109: 1644 | K109: 733 | L109: 855 | O109: 1281 | V109: of:=[.D109]/SUM([.$D109:.$I109])-[.J109]/SUM([.$J109:.$O109]) -> 0.0463470532257322 | W109: of:=[.E109]/SUM([.$D109:.$I109])-[.K109]/SUM([.$J109:.$O109]) -> -0.16241967649014 | X109: of:=[.F109]/SUM([.$D109:.$I109])-[.L109]/SUM([.$J109:.$O109]) -> 0.0868758101929905 | AA109: of:=[.I109]/SUM([.$D109:.$I109])-[.O109]/SUM([.$J109:.$O109]) -> 0.0291968130714169
A110: 2016-10-13 | B110: S Lakeland | C110: Windermere Bowness N | D110: 256 | F110: 441 | G110: 37 | J110: 463 | K110: 72 | L110: 582 | M110: 71 | V110: of:=[.D110]/SUM([.$D110:.$I110])-[.J110]/SUM([.$J110:.$O110]) -> -0.0409567977687869 | W110: of:=[.E110]/SUM([.$D110:.$I110])-[.K110]/SUM([.$J110:.$O110]) -> -0.0606060606060606 | X110: of:=[.F110]/SUM([.$D110:.$I110])-[.L110]/SUM([.$J110:.$O110]) -> 0.110918448793108 | Y110: of:=[.G110]/SUM([.$D110:.$I110])-[.M110]/SUM([.$J110:.$O110]) -> -0.00935559041826071
A111: 2016-10-13 | B111: Lancaster | C111: Westgate | D111: 178 | E111: 463 | F111: 41 | G111: 26 | H111: 183 | I111: of:=193 -> 193 | J111: 985 | K111: 1279 | N111: 970 | O111: 696 | V111: of:=[.D111]/SUM([.$D111:.$I111])-[.J111]/SUM([.$J111:.$O111]) -> -0.086429490249101 | W111: of:=[.E111]/SUM([.$D111:.$I111])-[.K111]/SUM([.$J111:.$O111]) -> 0.101676478596847 | X111: of:=[.F111]/SUM([.$D111:.$I111])-[.L111]/SUM([.$J111:.$O111]) -> 0.0378228782287823 | Y111: of:=[.G111]/SUM([.$D111:.$I111])-[.M111]/SUM([.$J111:.$O111]) -> 0.0239852398523985 | Z111: of:=[.H111]/SUM([.$D111:.$I111])-[.N111]/SUM([.$J111:.$O111]) -> -0.07800015023051 | AA111: of:=[.I111]/SUM([.$D111:.$I111])-[.O111]/SUM([.$J111:.$O111]) -> 0.000945043801583056
A112: 2016-10-13 | B112: N Kesteven | C112: Cliff Villages | D112: 372 | F112: 49 | I112: 721 | J112: 1165 | O112: 2083 | V112: of:=[.D112]/SUM([.$D112:.$I112])-[.J112]/SUM([.$J112:.$O112]) -> -0.0329379577786788 | X112: of:=[.F112]/SUM([.$D112:.$I112])-[.L112]/SUM([.$J112:.$O112]) -> 0.042907180385289 | AA112: of:=[.I112]/SUM([.$D112:.$I112])-[.O112]/SUM([.$J112:.$O112]) -> -0.00996922260661015
A113: 2016-10-13 | B113: Sevenoaks | C113: Swanley Christchurch/Swanley Village | D113: 311 | E113: 274 | F113: 183 | H113: 131 | J113: 1792 | K113: 862 | M113: 400 | V113: of:=[.D113]/SUM([.$D113:.$I113])-[.J113]/SUM([.$J113:.$O113]) -> -0.240831514023076 | W113: of:=[.E113]/SUM([.$D113:.$I113])-[.K113]/SUM([.$J113:.$O113]) -> 0.0225303090897038 | X113: of:=[.F113]/SUM([.$D113:.$I113])-[.L113]/SUM([.$J113:.$O113]) -> 0.203559510567297 | Y113: of:=[.G113]/SUM([.$D113:.$I113])-[.M113]/SUM([.$J113:.$O113]) -> -0.130975769482646 | Z113: of:=[.H113]/SUM([.$D113:.$I113])-[.N113]/SUM([.$J113:.$O113]) -> 0.145717463848721
A114: 2016-10-13 | B114: Tandridge | C114: Limpsfield | D114: 472 | E114: 25 | F114: 33 | I114: 713 | J114: 1560 | K114: 156 | L114: 271 | N114: 238 | P114: -1 | U114: 1 | V114: of:=[.D114]/SUM([.$D114:.$I114])-[.J114]/SUM([.$J114:.$O114]) -> -0.321397127283575 | W114: of:=[.E114]/SUM([.$D114:.$I114])-[.K114]/SUM([.$J114:.$O114]) -> -0.049999728818462 | X114: of:=[.F114]/SUM([.$D114:.$I114])-[.L114]/SUM([.$J114:.$O114]) -> -0.0952490802426171 | Z114: of:=[.H114]/SUM([.$D114:.$I114])-[.N114]/SUM([.$J114:.$O114]) -> -0.106966292134831 | AA114: of:=[.I114]/SUM([.$D114:.$I114])-[.O114]/SUM([.$J114:.$O114]) -> 0.573612228479485
A115: 2016-10-13 | B115: Poole | C115: Broadstone | D115: 733 | E115: 45 | F115: 2184 | G115: 57 | H115: 132 | J115: 2842 | L115: 3534 | M115: 519 | N115: 909 | P115: -1 | R115: 1 | V115: of:=[.D115]/SUM([.$D115:.$I115])-[.J115]/SUM([.$J115:.$O115]) -> -0.131547655744086 | W115: of:=[.E115]/SUM([.$D115:.$I115])-[.K115]/SUM([.$J115:.$O115]) -> 0.0142811805775944 | X115: of:=[.F115]/SUM([.$D115:.$I115])-[.L115]/SUM([.$J115:.$O115]) -> 0.240268602337725 | Y115: of:=[.G115]/SUM([.$D115:.$I115])-[.M115]/SUM([.$J115:.$O115]) -> -0.048414861341847 | Z115: of:=[.H115]/SUM([.$D115:.$I115])-[.N115]/SUM([.$J115:.$O115]) -> -0.0745872658293861
A116: 2016-10-20 | B116: Weymouth/Portland | C116: Wey Vy | D116: 475 | E116: 96 | F116: 118 | G116: 74 | J116: 1326 | K116: 480 | M116: 339 | V116: of:=[.D116]/SUM([.$D116:.$I116])-[.J116]/SUM([.$J116:.$O116]) -> 0.00436077683784109 | W116: of:=[.E116]/SUM([.$D116:.$I116])-[.K116]/SUM([.$J116:.$O116]) -> -0.0979570887827769 | X116: of:=[.F116]/SUM([.$D116:.$I116])-[.L116]/SUM([.$J116:.$O116]) -> 0.154652686762779 | Y116: of:=[.G116]/SUM([.$D116:.$I116])-[.M116]/SUM([.$J116:.$O116]) -> -0.0610563748178427
A117: 2016-10-20 | B117: Medway | C117: Strood S | D117: 724 | E117: 521 | F117: 62 | G117: 74 | H117: 480 | I117: 23 | J117: 2289 | K117: 1583 | N117: 2527 | O117: 141 | P117: 1 | T117: -1 | V117: of:=[.D117]/SUM([.$D117:.$I117])-[.J117]/SUM([.$J117:.$O117]) -> 0.0342887473460722 | W117: of:=[.E117]/SUM([.$D117:.$I117])-[.K117]/SUM([.$J117:.$O117]) -> 0.0344903484680263 | X117: of:=[.F117]/SUM([.$D117:.$I117])-[.L117]/SUM([.$J117:.$O117]) -> 0.0329087048832272 | Y117: of:=[.G117]/SUM([.$D117:.$I117])-[.M117]/SUM([.$J117:.$O117]) -> 0.0392781316348195 | Z117: of:=[.H117]/SUM([.$D117:.$I117])-[.N117]/SUM([.$J117:.$O117]) -> -0.131614367245174 | AA117: of:=[.I117]/SUM([.$D117:.$I117])-[.O117]/SUM([.$J117:.$O117]) -> -0.00935156508697092
A118: 2016-10-20 | B118: Bracknell Forest | C118: C Sandhurst | D118: 476 | E118: 211 | J118: 1717 | K118: 552 | L118: 456 | V118: of:=[.D118]/SUM([.$D118:.$I118])-[.J118]/SUM([.$J118:.$O118]) -> 0.062775796909846 | W118: of:=[.E118]/SUM([.$D118:.$I118])-[.K118]/SUM([.$J118:.$O118]) -> 0.104563652631438 | X118: of:=[.F118]/SUM([.$D118:.$I118])-[.L118]/SUM([.$J118:.$O118]) -> -0.167339449541284
A119: 2016-10-20 | B119: Braintree | C119: Bumpstead | D119: 350 | E119: 45 | F119: 40 | G119: 23 | H119: 84 | J119: 1082 | K119: 325 | N119: 343 | V119: of:=[.D119]/SUM([.$D119:.$I119])-[.J119]/SUM([.$J119:.$O119]) -> 0.0274707432788613 | W119: of:=[.E119]/SUM([.$D119:.$I119])-[.K119]/SUM([.$J119:.$O119]) -> -0.102688455455983 | X119: of:=[.F119]/SUM([.$D119:.$I119])-[.L119]/SUM([.$J119:.$O119]) -> 0.0738007380073801 | Y119: of:=[.G119]/SUM([.$D119:.$I119])-[.M119]/SUM([.$J119:.$O119]) -> 0.0424354243542435 | Z119: of:=[.H119]/SUM([.$D119:.$I119])-[.N119]/SUM([.$J119:.$O119]) -> -0.0410184501845018
A120: 2016-10-20 | B120: Braintree | C120: Witham N | D120: 308 | E120: 339 | F120: 31 | G120: 227 | J120: 1227 | K120: 992 | L120: 295 | M120: 645 | P120: -1 | Q120: 1 | V120: of:=[.D120]/SUM([.$D120:.$I120])-[.J120]/SUM([.$J120:.$O120]) -> -0.0480825633680146 | W120: of:=[.E120]/SUM([.$D120:.$I120])-[.K120]/SUM([.$J120:.$O120]) -> 0.0605622102245798 | X120: of:=[.F120]/SUM([.$D120:.$I120])-[.L120]/SUM([.$J120:.$O120]) -> -0.0591298386264623 | Y120: of:=[.G120]/SUM([.$D120:.$I120])-[.M120]/SUM([.$J120:.$O120]) -> 0.0466501917698971
A121: 2016-10-20 | B121: King's Lynn/W Norfolk | C121: Heacham | D121: 342 | E121: 74 | F121: 83 | H121: 83 | I121: of:=400+79 -> 479 | J121: 1817 | K121: 736 | P121: -1 | U121: 1 | V121: of:=[.D121]/SUM([.$D121:.$I121])-[.J121]/SUM([.$J121:.$O121]) -> -0.38937429418108 | W121: of:=[.E121]/SUM([.$D121:.$I121])-[.K121]/SUM([.$J121:.$O121]) -> -0.218542765196865 | X121: of:=[.F121]/SUM([.$D121:.$I121])-[.L121]/SUM([.$J121:.$O121]) -> 0.0782280867106503 | Z121: of:=[.H121]/SUM([.$D121:.$I121])-[.N121]/SUM([.$J121:.$O121]) -> 0.0782280867106503 | AA121: of:=[.I121]/SUM([.$D121:.$I121])-[.O121]/SUM([.$J121:.$O121]) -> 0.451460885956645
A122: 2016-10-20 | B122: Kettering | C122: Rothwell | D122: 700 | E122: 498 | F122: 67 | G122: 75 | H122: 108 | J122: 873 | K122: 951 | M122: 119 | N122: 370 | P122: 1 | Q122: -1 | V122: of:=[.D122]/SUM([.$D122:.$I122])-[.J122]/SUM([.$J122:.$O122]) -> 0.105993507749855 | W122: of:=[.E122]/SUM([.$D122:.$I122])-[.K122]/SUM([.$J122:.$O122]) -> -0.0672316930727834 | X122: of:=[.F122]/SUM([.$D122:.$I122])-[.L122]/SUM([.$J122:.$O122]) -> 0.0462707182320442 | Y122: of:=[.G122]/SUM([.$D122:.$I122])-[.M122]/SUM([.$J122:.$O122]) -> 0.000347244615469137 | Z122: of:=[.H122]/SUM([.$D122:.$I122])-[.N122]/SUM([.$J122:.$O122]) -> -0.0853797775245848
A123: 2016-10-20 | B123: E Riding | C123: St Mary's | D123: 947 | E123: 689 | F123: 1497 | H123: 101 | I123: of:=364+141 -> 505 | J123: 3069 | K123: 1910 | L123: 1215 | M123: 917 | N123: 1399 | O123: of:=1179+660 -> 1839 | V123: of:=[.D123]/SUM([.$D123:.$I123])-[.J123]/SUM([.$J123:.$O123]) -> -0.0432741142627256 | X123: of:=[.F123]/SUM([.$D123:.$I123])-[.L123]/SUM([.$J123:.$O123]) -> 0.282971784067419 | Y123: of:=[.G123]/SUM([.$D123:.$I123])-[.M123]/SUM([.$J123:.$O123]) -> -0.0886075949367089 | Z123: of:=[.H123]/SUM([.$D123:.$I123])-[.N123]/SUM([.$J123:.$O123]) -> -0.108169572996304 | AA123: of:=[.I123]/SUM([.$D123:.$I123])-[.O123]/SUM([.$J123:.$O123]) -> -0.0426354773112154
A124: 2016-10-20 | B124: Middlesbrough | C124: Central | D124: 70 | E124: 732 | F124: 53 | I124: 149 | K124: 1382 | N124: 395 | O124: 713 | V124: of:=[.D124]/SUM([.$D124:.$I124])-[.J124]/SUM([.$J124:.$O124]) -> 0.0697211155378486 | W124: of:=[.E124]/SUM([.$D124:.$I124])-[.K124]/SUM([.$J124:.$O124]) -> 0.17406358501736 | X124: of:=[.F124]/SUM([.$D124:.$I124])-[.L124]/SUM([.$J124:.$O124]) -> 0.0527888446215139 | Z124: of:=[.H124]/SUM([.$D124:.$I124])-[.N124]/SUM([.$J124:.$O124]) -> -0.15863453815261 | AA124: of:=[.I124]/SUM([.$D124:.$I124])-[.O124]/SUM([.$J124:.$O124]) -> -0.137939007024112
P125: of:=SUM([.P69:.P124]) -> -8 | Q125: of:=SUM([.Q69:.Q124]) -> -2 | R125: of:=SUM([.R69:.R124]) -> 6 | S125: of:=SUM([.S69:.S124]) -> 0 | T125: of:=SUM([.T69:.T124]) -> -1 | U125: Average | V125: of:=AVERAGE([.V69:.V124]) -> -0.0488496890288727 | W125: of:=AVERAGE([.W69:.W124]) -> -0.028710834074933 | X125: of:=AVERAGE([.X69:.X124]) -> 0.141323574855601 | Y125: of:=AVERAGE([.Y69:.Y124]) -> -0.0586448400108553 | Z125: of:=AVERAGE([.Z69:.Z124]) -> -0.00803557943866647 | AA125: of:=AVERAGE([.AA69:.AA124]) -> -0.0101025438449071
P126: of:=[.P125]+[.P68]+[.P37] -> -15 | Q126: of:=[.Q125]+[.Q68]+[.Q37] -> 1 | R126: of:=[.R125]+[.R68]+[.R37] -> 7 | S126: of:=[.S125]+[.S68]+[.S37] -> 1 | T126: of:=[.T125]+[.T68]+[.T37] -> -3

Sheet: 2016
A1: Date | B1: Council | C1: Ward | D1: By-election votes | J1: 2016 votes | P1: Seats | V1: Change %
D2: C | E2: Lab | F2: LD | G2: Grn | H2: UKIP | I2: Ind/Other | J2: C | K2: Lab | L2: LD | M2: Grn | N2: UKIP | O2: Ind/Other | P2: C | Q2: Lab | R2: LD | S2: Grn | T2: UKIP | U2: Ind/Other | V2: C | W2: Lab | X2: LD | Y2: Grn | Z2: UKIP | AA2: Ind/Other
A3: 2015-07-09 | B3: Sandwell | C3: Newton | D3: 452 | E3: 1152 | G3: 36 | H3: 310 | J3: 491 | K3: 1900 | V3: of:=[.D3]/SUM([.$D3:.$I3])-[.J3]/SUM([.$J3:.$O3]) -> 0.0264414631792298 | W3: of:=[.E3]/SUM([.$D3:.$I3])-[.K3]/SUM([.$J3:.$O3]) -> -0.203877360615127 | Y3: of:=[.G3]/SUM([.$D3:.$I3])-[.M3]/SUM([.$J3:.$O3]) -> 0.0184615384615385 | Z3: of:=[.H3]/SUM([.$D3:.$I3])-[.N3]/SUM([.$J3:.$O3]) -> 0.158974358974359
A4: 2015-07-09 | B4: Hastings | C4: C St Leonards | D4: 259 | E4: 481 | F4: 17 | G4: 75 | H4: 77 | I4: 184 | J4: 227 | K4: 622 | L4: 54 | M4: 116 | O4: 278 | V4: of:=[.D4]/SUM([.$D4:.$I4])-[.J4]/SUM([.$J4:.$O4]) -> 0.0619432133130082 | W4: of:=[.E4]/SUM([.$D4:.$I4])-[.K4]/SUM([.$J4:.$O4]) -> -0.0394950413403864 | X4: of:=[.F4]/SUM([.$D4:.$I4])-[.L4]/SUM([.$J4:.$O4]) -> -0.0260489429159083 | Y4: of:=[.G4]/SUM([.$D4:.$I4])-[.M4]/SUM([.$J4:.$O4]) -> -0.0208186814388331 | Z4: of:=[.H4]/SUM([.$D4:.$I4])-[.N4]/SUM([.$J4:.$O4]) -> 0.070448307410796 | AA4: of:=[.I4]/SUM([.$D4:.$I4])-[.O4]/SUM([.$J4:.$O4]) -> -0.139178116574501
A5: 2015-07-09 | B5: Hastings | C5: St Helens | D5: 663 | E5: 557 | F5: 136 | G5: 48 | H5: 120 | J5: 737 | K5: 931 | L5: 108 | M5: 76 | V5: of:=[.D5]/SUM([.$D5:.$I5])-[.J5]/SUM([.$J5:.$O5]) -> 0.0370912059318719 | W5: of:=[.E5]/SUM([.$D5:.$I5])-[.K5]/SUM([.$J5:.$O5]) -> -0.137214219712817 | X5: of:=[.F5]/SUM([.$D5:.$I5])-[.L5]/SUM([.$J5:.$O5]) -> 0.028530582075217 | Y5: of:=[.G5]/SUM([.$D5:.$I5])-[.M5]/SUM([.$J5:.$O5]) -> -0.009540654070509 | Z5: of:=[.H5]/SUM([.$D5:.$I5])-[.N5]/SUM([.$J5:.$O5]) -> 0.078740157480315
A6: 2015-07-09 | B6: Hyndburn | C6: Spring Hill | D6: 475 | E6: 778 | G6: 17 | H6: 137 | J6: 271 | K6: 998 | V6: of:=[.D6]/SUM([.$D6:.$I6])-[.J6]/SUM([.$J6:.$O6]) -> 0.124043746146001 | W6: of:=[.E6]/SUM([.$D6:.$I6])-[.K6]/SUM([.$J6:.$O6]) -> -0.233496482464409 | Y6: of:=[.G6]/SUM([.$D6:.$I6])-[.M6]/SUM([.$J6:.$O6]) -> 0.0120824449182658 | Z6: of:=[.H6]/SUM([.$D6:.$I6])-[.N6]/SUM([.$J6:.$O6]) -> 0.0973702914001422
A7: 2015-07-23 | B7: NE Lincs | C7: Croft Baker | D7: 513 | E7: 768 | F7: 323 | G7: 66 | H7: 318 | I7: 85 | J7: 389 | K7: 975 | L7: 348 | M7: 99 | N7: 551 | O7: of:=48 -> 48 | V7: of:=[.D7]/SUM([.$D7:.$I7])-[.J7]/SUM([.$J7:.$O7]) -> 0.0860566501131921 | W7: of:=[.E7]/SUM([.$D7:.$I7])-[.K7]/SUM([.$J7:.$O7]) -> -0.034086746611742 | X7: of:=[.F7]/SUM([.$D7:.$I7])-[.L7]/SUM([.$J7:.$O7]) -> 0.0114144913959963 | Y7: of:=[.G7]/SUM([.$D7:.$I7])-[.M7]/SUM([.$J7:.$O7]) -> -0.00924092211059803 | Z7: of:=[.H7]/SUM([.$D7:.$I7])-[.N7]/SUM([.$J7:.$O7]) -> -0.0752298370873891 | AA7: of:=[.I7]/SUM([.$D7:.$I7])-[.O7]/SUM([.$J7:.$O7]) -> 0.0210863643005406
A8: 2015-07-23 | B8: Blackburn/Darwen | C8: Mill Hill | D8: 106 | E8: 505 | F8: 69 | H8: 179 | J8: 152 | K8: 702 | N8: 309 | V8: of:=[.D8]/SUM([.$D8:.$I8])-[.J8]/SUM([.$J8:.$O8]) -> -0.00729717312117811 | W8: of:=[.E8]/SUM([.$D8:.$I8])-[.K8]/SUM([.$J8:.$O8]) -> -0.0157184512375665 | X8: of:=[.F8]/SUM([.$D8:.$I8])-[.L8]/SUM([.$J8:.$O8]) -> 0.080325960419092 | Z8: of:=[.H8]/SUM([.$D8:.$I8])-[.N8]/SUM([.$J8:.$O8]) -> -0.0573103360603473
A9: 2015-08-20 | B9: W Oxon | C9: Witney N | D9: 264 | E9: 114 | F9: 201 | G9: 136 | H9: 64 | J9: 442 | K9: 222 | L9: 158 | M9: 201 | V9: of:=[.D9]/SUM([.$D9:.$I9])-[.J9]/SUM([.$J9:.$O9]) -> -0.0931665405556664 | W9: of:=[.E9]/SUM([.$D9:.$I9])-[.K9]/SUM([.$J9:.$O9]) -> -0.0706673342393248 | X9: of:=[.F9]/SUM([.$D9:.$I9])-[.L9]/SUM([.$J9:.$O9]) -> 0.103575403712055 | Y9: of:=[.G9]/SUM([.$D9:.$I9])-[.M9]/SUM([.$J9:.$O9]) -> -0.0218981399568587 | Z9: of:=[.H9]/SUM([.$D9:.$I9])-[.N9]/SUM([.$J9:.$O9]) -> 0.0821566110397946
A10: 2015-08-27 | B10: Barnsley | C10: Dearne N | D10: 43 | E10: 817 | H10: 140 | I10: of:=115+55 -> 170 | J10: 220 | K10: 1420 | V10: of:=[.D10]/SUM([.$D10:.$I10])-[.J10]/SUM([.$J10:.$O10]) -> -0.0973942047112779 | W10: of:=[.E10]/SUM([.$D10:.$I10])-[.K10]/SUM([.$J10:.$O10]) -> -0.167563060245987 | Z10: of:=[.H10]/SUM([.$D10:.$I10])-[.N10]/SUM([.$J10:.$O10]) -> 0.11965811965812 | AA10: of:=[.I10]/SUM([.$D10:.$I10])-[.O10]/SUM([.$J10:.$O10]) -> 0.145299145299145
A11: 2015-09-10 | B11: Sandwell | C11: Blackheath | D11: 544 | E11: 915 | G11: 35 | H11: 287 | J11: 724 | K11: 1401 | V11: of:=[.D11]/SUM([.$D11:.$I11])-[.J11]/SUM([.$J11:.$O11]) -> -0.035259503913862 | W11: of:=[.E11]/SUM([.$D11:.$I11])-[.K11]/SUM([.$J11:.$O11]) -> -0.145537800971034 | Y11: of:=[.G11]/SUM([.$D11:.$I11])-[.M11]/SUM([.$J11:.$O11]) -> 0.0196518809657496 | Z11: of:=[.H11]/SUM([.$D11:.$I11])-[.N11]/SUM([.$J11:.$O11]) -> 0.161145423919147
A12: 2015-09-10 | B12: Maidstone | C12: Fant | D12: 477 | E12: 352 | F12: 424 | G12: 249 | H12: 180 | I12: 75 | J12: 567 | K12: 644 | L12: 573 | M12: 159 | N12: 287 | V12: of:=[.D12]/SUM([.$D12:.$I12])-[.J12]/SUM([.$J12:.$O12]) -> 0.0172253969388302 | W12: of:=[.E12]/SUM([.$D12:.$I12])-[.K12]/SUM([.$J12:.$O12]) -> -0.0884477464900169 | X12: of:=[.F12]/SUM([.$D12:.$I12])-[.L12]/SUM([.$J12:.$O12]) -> -0.0156302400902476 | Y12: of:=[.G12]/SUM([.$D12:.$I12])-[.M12]/SUM([.$J12:.$O12]) -> 0.0704183904995011 | Z12: of:=[.H12]/SUM([.$D12:.$I12])-[.N12]/SUM([.$J12:.$O12]) -> -0.0262521981261373 | AA12: of:=[.I12]/SUM([.$D12:.$I12])-[.O12]/SUM([.$J12:.$O12]) -> 0.0426863972680706
A13: 2015-09-10 | B13: Thurrock | C13: W Thurrock/S Stifford | D13: 384 | E13: 629 | H13: 450 | J13: 308 | K13: 984 | N13: 500 | V13: of:=[.D13]/SUM([.$D13:.$I13])-[.J13]/SUM([.$J13:.$O13]) -> 0.0905993677375256 | W13: of:=[.E13]/SUM([.$D13:.$I13])-[.K13]/SUM([.$J13:.$O13]) -> -0.119168660287081 | Z13: of:=[.H13]/SUM([.$D13:.$I13])-[.N13]/SUM([.$J13:.$O13]) -> 0.0285692925495557
A14: 2015-09-17 | B14: S Cambs | C14: Bourn | D14: 579 | E14: 235 | F14: 247 | G14: 64 | H14: 121 | J14: 868 | K14: 594 | L14: 352 | M14: 169 | N14: 236 | V14: of:=[.D14]/SUM([.$D14:.$I14])-[.J14]/SUM([.$J14:.$O14]) -> 0.0735198059658415 | W14: of:=[.E14]/SUM([.$D14:.$I14])-[.K14]/SUM([.$J14:.$O14]) -> -0.0790846165141702 | X14: of:=[.F14]/SUM([.$D14:.$I14])-[.L14]/SUM([.$J14:.$O14]) -> 0.0396043364001397 | Y14: of:=[.G14]/SUM([.$D14:.$I14])-[.M14]/SUM([.$J14:.$O14]) -> -0.024796066656202 | Z14: of:=[.H14]/SUM([.$D14:.$I14])-[.N14]/SUM([.$J14:.$O14]) -> -0.00924345919560891
A15: 2015-09-24 | B15: Wakefield | C15: Pontefract N | D15: 199 | E15: 909 | F15: 86 | H15: 453 | I15: of:=124+24 -> 148 | J15: 470 | K15: 1601 | N15: 762 | O15: 168 | V15: of:=[.D15]/SUM([.$D15:.$I15])-[.J15]/SUM([.$J15:.$O15]) -> -0.0457509520967477 | W15: of:=[.E15]/SUM([.$D15:.$I15])-[.K15]/SUM([.$J15:.$O15]) -> -0.0270821518175465 | X15: of:=[.F15]/SUM([.$D15:.$I15])-[.L15]/SUM([.$J15:.$O15]) -> 0.0479108635097493 | Z15: of:=[.H15]/SUM([.$D15:.$I15])-[.N15]/SUM([.$J15:.$O15]) -> -0.0015476735238672 | AA15: of:=[.I15]/SUM([.$D15:.$I15])-[.O15]/SUM([.$J15:.$O15]) -> 0.0264885619429201
A16: 2015-09-24 | B16: Wyre Forest | C16: Blakebrook/Habberley S | D16: 595 | E16: 247 | F16: 54 | G16: 173 | H16: 252 | I16: 167 | J16: 633 | K16: 414 | L16: 170 | M16: 169 | N16: 452 | V16: of:=[.D16]/SUM([.$D16:.$I16])-[.J16]/SUM([.$J16:.$O16]) -> 0.055469508699264 | W16: of:=[.E16]/SUM([.$D16:.$I16])-[.K16]/SUM([.$J16:.$O16]) -> -0.0592502076824973 | X16: of:=[.F16]/SUM([.$D16:.$I16])-[.L16]/SUM([.$J16:.$O16]) -> -0.0562015163747411 | Y16: of:=[.G16]/SUM([.$D16:.$I16])-[.M16]/SUM([.$J16:.$O16]) -> 0.0243156715457428 | Z16: of:=[.H16]/SUM([.$D16:.$I16])-[.N16]/SUM([.$J16:.$O16]) -> -0.0765646389834673 | AA16: of:=[.I16]/SUM([.$D16:.$I16])-[.O16]/SUM([.$J16:.$O16]) -> 0.112231182795699
A17: 2015-10-22 | B17: Bury | C17: Tottington | D17: 1046 | E17: 619 | F17: 87 | G17: 54 | H17: 198 | J17: 1367 | K17: 929 | L17: 116 | M17: 103 | N17: 417 | P17: 1 | Q17: -1 | V17: of:=[.D17]/SUM([.$D17:.$I17])-[.J17]/SUM([.$J17:.$O17]) -> 0.0557214357097538 | W17: of:=[.E17]/SUM([.$D17:.$I17])-[.K17]/SUM([.$J17:.$O17]) -> -0.00796633200175367 | X17: of:=[.F17]/SUM([.$D17:.$I17])-[.L17]/SUM([.$J17:.$O17]) -> 0.00384973572636446 | Y17: of:=[.G17]/SUM([.$D17:.$I17])-[.M17]/SUM([.$J17:.$O17]) -> -0.0081834965811896 | Z17: of:=[.H17]/SUM([.$D17:.$I17])-[.N17]/SUM([.$J17:.$O17]) -> -0.043421342853175
A18: 2015-10-22 | B18: Oxford | C18: Northfield Brook | D18: 47 | E18: 509 | G18: 28 | H18: 60 | I18: 9 | J18: 89 | K18: 573 | L18: 66 | M18: 52 | O18: 37 | V18: of:=[.D18]/SUM([.$D18:.$I18])-[.J18]/SUM([.$J18:.$O18]) -> -0.0369596308160622 | W18: of:=[.E18]/SUM([.$D18:.$I18])-[.K18]/SUM([.$J18:.$O18]) -> 0.0781329369579439 | X18: of:=[.F18]/SUM([.$D18:.$I18])-[.L18]/SUM([.$J18:.$O18]) -> -0.0807833537331701 | Y18: of:=[.G18]/SUM([.$D18:.$I18])-[.M18]/SUM([.$J18:.$O18]) -> -0.0207684709119571 | Z18: of:=[.H18]/SUM([.$D18:.$I18])-[.N18]/SUM([.$J18:.$O18]) -> 0.0918836140888208 | AA18: of:=[.I18]/SUM([.$D18:.$I18])-[.O18]/SUM([.$J18:.$O18]) -> -0.0315050955855753
A19: 2015-10-29 | B19: Brentwood | C19: Shenfield | D19: 852 | E19: 49 | F19: 483 | G19: 16 | H19: 85 | J19: 1016 | K19: 96 | L19: 430 | N19: 165 | V19: of:=[.D19]/SUM([.$D19:.$I19])-[.J19]/SUM([.$J19:.$O19]) -> -0.0214588769949051 | W19: of:=[.E19]/SUM([.$D19:.$I19])-[.K19]/SUM([.$J19:.$O19]) -> -0.0232423828205902 | X19: of:=[.F19]/SUM([.$D19:.$I19])-[.L19]/SUM([.$J19:.$O19]) -> 0.0733486002378796 | Y19: of:=[.G19]/SUM([.$D19:.$I19])-[.M19]/SUM([.$J19:.$O19]) -> 0.0107744107744108 | Z19: of:=[.H19]/SUM([.$D19:.$I19])-[.N19]/SUM([.$J19:.$O19]) -> -0.0394217511967951
A20: 2015-10-29 | B20: Chorley | C20: Euxton N | D20: 443 | E20: 697 | H20: 76 | J20: 254 | K20: 1108 | N20: 169 | V20: of:=[.D20]/SUM([.$D20:.$I20])-[.J20]/SUM([.$J20:.$O20]) -> 0.19840457303448 | W20: of:=[.E20]/SUM([.$D20:.$I20])-[.K20]/SUM([.$J20:.$O20]) -> -0.150519203994637 | Z20: of:=[.H20]/SUM([.$D20:.$I20])-[.N20]/SUM([.$J20:.$O20]) -> -0.0478853690398432
A21: 2015-12-10 | B21: Hunts | C21: Huntingdon E | D21: 596 | E21: 141 | F21: 844 | H21: 293 | J21: 610 | K21: 294 | L21: 1208 | N21: 375 | R21: 1 | T21: -1 | V21: of:=[.D21]/SUM([.$D21:.$I21])-[.J21]/SUM([.$J21:.$O21]) -> 0.0727608537715223 | W21: of:=[.E21]/SUM([.$D21:.$I21])-[.K21]/SUM([.$J21:.$O21]) -> -0.0429745884576318 | X21: of:=[.F21]/SUM([.$D21:.$I21])-[.L21]/SUM([.$J21:.$O21]) -> -0.0353522414742359 | Z21: of:=[.H21]/SUM([.$D21:.$I21])-[.N21]/SUM([.$J21:.$O21]) -> 0.00556597616034543
P22: of:=SUM([.P3:.P21]) -> 1 | Q22: of:=SUM([.Q3:.Q21]) -> -1 | R22: of:=SUM([.R3:.R21]) -> 1 | S22: of:=SUM([.S3:.S21]) -> 0 | T22: of:=SUM([.T3:.T21]) -> -1 | U22: Average | V22: of:=AVERAGE([.V3:.V21]) -> 0.0295784388595169 | W22: of:=AVERAGE([.W3:.W21]) -> -0.0824873395024408 | X22: of:=AVERAGE([.X3:.X21]) -> 0.0134264368375531 | Y22: of:=AVERAGE([.Y3:.Y21]) -> 0.00311214657223546 | Z22: of:=AVERAGE([.Z3:.Z21]) -> 0.0272439761376192 | AA22: of:=AVERAGE([.AA3:.AA21]) -> 0.0253012056351856
A23: 2016-01-07 | B23: Carlisle | C23: Botcherby | D23: 115 | E23: 250 | I23: 381 | J23: 157 | K23: 499 | M23: 27 | O23: 511 | Q23: -1 | U23: 1 | V23: of:=[.D23]/SUM([.$D23:.$I23])-[.J23]/SUM([.$J23:.$O23]) -> 0.0226647087088705 | W23: of:=[.E23]/SUM([.$D23:.$I23])-[.K23]/SUM([.$J23:.$O23]) -> -0.0828023046420664 | Y23: of:=[.G23]/SUM([.$D23:.$I23])-[.M23]/SUM([.$J23:.$O23]) -> -0.0226130653266332 | AA23: of:=[.I23]/SUM([.$D23:.$I23])-[.O23]/SUM([.$J23:.$O23]) -> 0.0827506612598291
A24: 2016-01-21 | B24: St Helens | C24: Thatto Heath | D24: 147 | E24: 964 | G24: 62 | H24: 182 | J24: 214 | K24: 1653 | N24: 399 | V24: of:=[.D24]/SUM([.$D24:.$I24])-[.J24]/SUM([.$J24:.$O24]) -> 0.0140475438293659 | W24: of:=[.E24]/SUM([.$D24:.$I24])-[.K24]/SUM([.$J24:.$O24]) -> -0.0180401442143283 | Y24: of:=[.G24]/SUM([.$D24:.$I24])-[.M24]/SUM([.$J24:.$O24]) -> 0.0457564575645756 | Z24: of:=[.H24]/SUM([.$D24:.$I24])-[.N24]/SUM([.$J24:.$O24]) -> -0.0417638571796133
A25: 2016-02-11 | B25: Bolton | C25: Crompton | D25: 302 | E25: 1961 | F25: 117 | G25: 65 | H25: 320 | J25: 338 | K25: 2432 | L25: 132 | N25: 702 | V25: of:=[.D25]/SUM([.$D25:.$I25])-[.J25]/SUM([.$J25:.$O25]) -> 0.0154377394616791 | W25: of:=[.E25]/SUM([.$D25:.$I25])-[.K25]/SUM([.$J25:.$O25]) -> 0.0344166517813239 | X25: of:=[.F25]/SUM([.$D25:.$I25])-[.L25]/SUM([.$J25:.$O25]) -> 0.00568867623476427 | Y25: of:=[.G25]/SUM([.$D25:.$I25])-[.M25]/SUM([.$J25:.$O25]) -> 0.0235081374321881 | Z25: of:=[.H25]/SUM([.$D25:.$I25])-[.N25]/SUM([.$J25:.$O25]) -> -0.0790512049099554
A26: 2016-02-11 | B26: Coventry | C26: Lr Stoke | D26: 344 | E26: 1235 | F26: 124 | G26: 165 | H26: 290 | J26: 675 | K26: 2005 | L26: 167 | M26: 227 | O26: 286 | V26: of:=[.D26]/SUM([.$D26:.$I26])-[.J26]/SUM([.$J26:.$O26]) -> -0.0414859989408182 | W26: of:=[.E26]/SUM([.$D26:.$I26])-[.K26]/SUM([.$J26:.$O26]) -> -0.0244370338496844 | X26: of:=[.F26]/SUM([.$D26:.$I26])-[.L26]/SUM([.$J26:.$O26]) -> 0.00775823072509819 | Y26: of:=[.G26]/SUM([.$D26:.$I26])-[.M26]/SUM([.$J26:.$O26]) -> 0.00890016108389603 | Z26: of:=[.H26]/SUM([.$D26:.$I26])-[.N26]/SUM([.$J26:.$O26]) -> 0.134383688600556 | AA26: of:=[.I26]/SUM([.$D26:.$I26])-[.O26]/SUM([.$J26:.$O26]) -> -0.0851190476190476
A27: 2016-02-18 | B27: Manchester | C27: Hr Blackley | D27: 130 | E27: 1062 | F27: 78 | G27: 40 | H27: 308 | J27: 202 | K27: 1569 | L27: 115 | M27: 104 | N27: 691 | V27: of:=[.D27]/SUM([.$D27:.$I27])-[.J27]/SUM([.$J27:.$O27]) -> 0.0050010857893458 | W27: of:=[.E27]/SUM([.$D27:.$I27])-[.K27]/SUM([.$J27:.$O27]) -> 0.0711364917892655 | X27: of:=[.F27]/SUM([.$D27:.$I27])-[.L27]/SUM([.$J27:.$O27]) -> 0.00531322141019831 | Y27: of:=[.G27]/SUM([.$D27:.$I27])-[.M27]/SUM([.$J27:.$O27]) -> -0.0140696168477622 | Z27: of:=[.H27]/SUM([.$D27:.$I27])-[.N27]/SUM([.$J27:.$O27]) -> -0.0673811821410475
A28: 2016-02-25 | B28: Dudley | C28: Kingswinford N/Wall Heath | D28: 1456 | E28: 934 | G28: 52 | H28: 262 | J28: 1342 | K28: 1549 | N28: 558 | V28: of:=[.D28]/SUM([.$D28:.$I28])-[.J28]/SUM([.$J28:.$O28]) -> 0.149363249102304 | W28: of:=[.E28]/SUM([.$D28:.$I28])-[.K28]/SUM([.$J28:.$O28]) -> -0.10370148452257 | X28: of:=[.F28]/SUM([.$D28:.$I28])-[.L28]/SUM([.$J28:.$O28]) -> 0 | Y28: of:=[.G28]/SUM([.$D28:.$I28])-[.M28]/SUM([.$J28:.$O28]) -> 0.0192307692307692 | Z28: of:=[.H28]/SUM([.$D28:.$I28])-[.N28]/SUM([.$J28:.$O28]) -> -0.0648925338105034 | AA28: of:=[.I28]/SUM([.$D28:.$I28])-[.O28]/SUM([.$J28:.$O28]) -> 0
A29: 2016-02-25 | B29: Dudley | C29: St James's | D29: 427 | E29: 847 | H29: 554 | J29: 546 | K29: 1053 | M29: 81 | N29: 734 | O29: 51 | V29: of:=[.D29]/SUM([.$D29:.$I29])-[.J29]/SUM([.$J29:.$O29]) -> 0.0120876072454184 | W29: of:=[.E29]/SUM([.$D29:.$I29])-[.K29]/SUM([.$J29:.$O29]) -> 0.0361673938420158 | X29: of:=[.F29]/SUM([.$D29:.$I29])-[.L29]/SUM([.$J29:.$O29]) -> 0 | Y29: of:=[.G29]/SUM([.$D29:.$I29])-[.M29]/SUM([.$J29:.$O29]) -> -0.0328600405679513 | Z29: of:=[.H29]/SUM([.$D29:.$I29])-[.N29]/SUM([.$J29:.$O29]) -> 0.00529469465293092 | AA29: of:=[.I29]/SUM([.$D29:.$I29])-[.O29]/SUM([.$J29:.$O29]) -> -0.0206896551724138
A30: 2016-03-04 | B30: Havant | C30: Bondfields | D30: 207 | E30: 148 | F30: 187 | H30: 143 | J30: 417 | K30: 209 | L30: 44 | N30: 251 | V30: of:=[.D30]/SUM([.$D30:.$I30])-[.J30]/SUM([.$J30:.$O30]) -> -0.150578948619796 | W30: of:=[.E30]/SUM([.$D30:.$I30])-[.K30]/SUM([.$J30:.$O30]) -> -0.0108688588253009 | X30: of:=[.F30]/SUM([.$D30:.$I30])-[.L30]/SUM([.$J30:.$O30]) -> 0.225218542206583 | Y30: of:=[.G30]/SUM([.$D30:.$I30])-[.M30]/SUM([.$J30:.$O30]) -> 0 | Z30: of:=[.H30]/SUM([.$D30:.$I30])-[.N30]/SUM([.$J30:.$O30]) -> -0.0637707347614859 | AA30: of:=[.I30]/SUM([.$D30:.$I30])-[.O30]/SUM([.$J30:.$O30]) -> 0
A31: 2016-06-09 | B31: NE Lincs | C31: South | D31: 312 | E31: 758 | G31: 40 | H31: 462 | I31: 26 | J31: 251 | K31: 913 | N31: 483 | O31: 54 | V31: of:=[.D31]/SUM([.$D31:.$I31])-[.J31]/SUM([.$J31:.$O31]) -> 0.0476837963974663 | W31: of:=[.E31]/SUM([.$D31:.$I31])-[.K31]/SUM([.$J31:.$O31]) -> -0.0624001636378218 | Y31: of:=[.G31]/SUM([.$D31:.$I31])-[.M31]/SUM([.$J31:.$O31]) -> 0.0250312891113892 | Z31: of:=[.H31]/SUM([.$D31:.$I31])-[.N31]/SUM([.$J31:.$O31]) -> 0.00516077195259507 | AA31: of:=[.I31]/SUM([.$D31:.$I31])-[.O31]/SUM([.$J31:.$O31]) -> -0.0154756938236287
P32: of:=SUM([.P23:.P31]) -> 0 | Q32: of:=SUM([.Q23:.Q31]) -> -1 | R32: of:=SUM([.R23:.R31]) -> 0 | S32: of:=SUM([.S23:.S31]) -> 0 | T32: of:=SUM([.T23:.T31]) -> 0 | U32: Average | V32: of:=AVERAGE([.V23:.V31]) -> 0.00824675366375951 | W32: of:=AVERAGE([.W23:.W31]) -> -0.0178366058087963 | X32: of:=AVERAGE([.X23:.X31]) -> 0.0406631117627739 | Y32: of:=AVERAGE([.Y23:.Y31]) -> 0.00587601018671905 | Z32: of:=AVERAGE([.Z23:.Z31]) -> -0.0215025446995654 | AA32: of:=AVERAGE([.AA23:.AA31]) -> -0.00642228922587684
A33: 2016-06-30 | B33: Mole Vy | C33: Leatherhead N | D33: 340 | E33: 135 | F33: 862 | G33: 28 | H33: 157 | J33: 453 | K33: 255 | L33: 528 | M33: 66 | N33: 279 | V33: of:=[.D33]/SUM([.$D33:.$I33])-[.J33]/SUM([.$J33:.$O33]) -> -0.0631372382788052 | W33: of:=[.E33]/SUM([.$D33:.$I33])-[.K33]/SUM([.$J33:.$O33]) -> -0.0725912424229579 | X33: of:=[.F33]/SUM([.$D33:.$I33])-[.L33]/SUM([.$J33:.$O33]) -> 0.232394208160141 | Y33: of:=[.G33]/SUM([.$D33:.$I33])-[.M33]/SUM([.$J33:.$O33]) -> -0.0233488842953569 | Z33: of:=[.H33]/SUM([.$D33:.$I33])-[.N33]/SUM([.$J33:.$O33]) -> -0.0733168431630208
A34: 2016-07-14 | B34: Bradford | C34: Wibsey | D34: 451 | E34: 1207 | F34: 70 | H34: 655 | J34: 547 | K34: 1651 | L34: 156 | M34: 121 | N34: 739 | O34: 310 | V34: of:=[.D34]/SUM([.$D34:.$I34])-[.J34]/SUM([.$J34:.$O34]) -> 0.0340358993875937 | W34: of:=[.E34]/SUM([.$D34:.$I34])-[.K34]/SUM([.$J34:.$O34]) -> 0.0380027035999891 | X34: of:=[.F34]/SUM([.$D34:.$I34])-[.L34]/SUM([.$J34:.$O34]) -> -0.0148931396864758 | Y34: of:=[.G34]/SUM([.$D34:.$I34])-[.M34]/SUM([.$J34:.$O34]) -> -0.0343359818388195 | Z34: of:=[.H34]/SUM([.$D34:.$I34])-[.N34]/SUM([.$J34:.$O34]) -> 0.0651587364718782 | AA34: of:=[.I34]/SUM([.$D34:.$I34])-[.O34]/SUM([.$J34:.$O34]) -> -0.0879682179341657
A35: 2016-07-21 | B35: Reading | C35: Southcote | D35: 381 | E35: 934 | F35: 77 | G35: 66 | J35: 515 | K35: 1325 | L35: 129 | M35: 106 | V35: of:=[.D35]/SUM([.$D35:.$I35])-[.J35]/SUM([.$J35:.$O35]) -> 0.0131241013436462 | W35: of:=[.E35]/SUM([.$D35:.$I35])-[.K35]/SUM([.$J35:.$O35]) -> 0.00204934966202264 | X35: of:=[.F35]/SUM([.$D35:.$I35])-[.L35]/SUM([.$J35:.$O35]) -> -0.00935660336820533 | Y35: of:=[.G35]/SUM([.$D35:.$I35])-[.M35]/SUM([.$J35:.$O35]) -> -0.00581684763746343
A36: 2016-07-21 | B36: Tandridge | C36: Warlingham W | D36: 367 | F36: 218 | H36: 64 | J36: 593 | K36: 82 | L36: 218 | N36: 144 | V36: of:=[.D36]/SUM([.$D36:.$I36])-[.J36]/SUM([.$J36:.$O36]) -> -0.00635648939916467 | W36: of:=[.E36]/SUM([.$D36:.$I36])-[.K36]/SUM([.$J36:.$O36]) -> -0.0790742526518804 | X36: of:=[.F36]/SUM([.$D36:.$I36])-[.L36]/SUM([.$J36:.$O36]) -> 0.125679593113357 | Z36: of:=[.H36]/SUM([.$D36:.$I36])-[.N36]/SUM([.$J36:.$O36]) -> -0.0402488510623123
A37: 2016-09-08 | B37: Sheffield | C37: Mosborough | D37: 229 | E37: 1279 | F37: 1711 | G37: 67 | H37: 466 | J37: 646 | K37: 1992 | L37: 636 | M37: 142 | N37: 1022 | O37: 159 | Q37: -1 | R37: 1 | V37: of:=[.D37]/SUM([.$D37:.$I37])-[.J37]/SUM([.$J37:.$O37]) -> -0.079492315142025 | W37: of:=[.E37]/SUM([.$D37:.$I37])-[.K37]/SUM([.$J37:.$O37]) -> -0.0924412208202903 | X37: of:=[.F37]/SUM([.$D37:.$I37])-[.L37]/SUM([.$J37:.$O37]) -> 0.317672355615255 | Y37: of:=[.G37]/SUM([.$D37:.$I37])-[.M37]/SUM([.$J37:.$O37]) -> -0.013032567823736 | Z37: of:=[.H37]/SUM([.$D37:.$I37])-[.N37]/SUM([.$J37:.$O37]) -> -0.0981184771935716 | AA37: of:=[.I37]/SUM([.$D37:.$I37])-[.O37]/SUM([.$J37:.$O37]) -> -0.0345877746356319
A38: 2016-09-08 | B38: Maidstone | C38: Shepway S | D38: 215 | E38: 183 | F38: 31 | H38: 432 | I38: 88 | J38: 325 | K38: 290 | L38: 69 | M38: 25 | N38: 448 | O38: 14 | V38: of:=[.D38]/SUM([.$D38:.$I38])-[.J38]/SUM([.$J38:.$O38]) -> -0.0509862959706788 | W38: of:=[.E38]/SUM([.$D38:.$I38])-[.K38]/SUM([.$J38:.$O38]) -> -0.0548170171487088 | X38: of:=[.F38]/SUM([.$D38:.$I38])-[.L38]/SUM([.$J38:.$O38]) -> -0.0262580324113026 | Y38: of:=[.G38]/SUM([.$D38:.$I38])-[.M38]/SUM([.$J38:.$O38]) -> -0.0213492741246798 | Z38: of:=[.H38]/SUM([.$D38:.$I38])-[.N38]/SUM([.$J38:.$O38]) -> 0.0726370245455912 | AA38: of:=[.I38]/SUM([.$D38:.$I38])-[.O38]/SUM([.$J38:.$O38]) -> 0.0807735951097789
A39: 2016-09-15 | B39: Carlisle | C39: Castle | D39: 228 | E39: 398 | F39: 88 | G39: 34 | H39: 107 | J39: 258 | K39: 544 | L39: 89 | M39: 50 | N39: 150 | V39: of:=[.D39]/SUM([.$D39:.$I39])-[.J39]/SUM([.$J39:.$O39]) -> 0.0301863733577757 | W39: of:=[.E39]/SUM([.$D39:.$I39])-[.K39]/SUM([.$J39:.$O39]) -> -0.0331280385503937 | X39: of:=[.F39]/SUM([.$D39:.$I39])-[.L39]/SUM([.$J39:.$O39]) -> 0.0213474413194612 | Y39: of:=[.G39]/SUM([.$D39:.$I39])-[.M39]/SUM([.$J39:.$O39]) -> -0.00606343233580437 | Z39: of:=[.H39]/SUM([.$D39:.$I39])-[.N39]/SUM([.$J39:.$O39]) -> -0.0123423437910389
A40: 2016-09-15 | B40: Newcastle (Tyne) | C40: Blakelaw | D40: 119 | E40: 1004 | F40: 654 | G40: 105 | H40: 443 | J40: 221 | K40: 1846 | L40: 267 | M40: 117 | N40: 470 | V40: of:=[.D40]/SUM([.$D40:.$I40])-[.J40]/SUM([.$J40:.$O40]) -> -0.0244762251843344 | W40: of:=[.E40]/SUM([.$D40:.$I40])-[.K40]/SUM([.$J40:.$O40]) -> -0.200147393917976 | X40: of:=[.F40]/SUM([.$D40:.$I40])-[.L40]/SUM([.$J40:.$O40]) -> 0.189883270201323 | Y40: of:=[.G40]/SUM([.$D40:.$I40])-[.M40]/SUM([.$J40:.$O40]) -> 0.00510651456085521 | Z40: of:=[.H40]/SUM([.$D40:.$I40])-[.N40]/SUM([.$J40:.$O40]) -> 0.0296338343401324
A41: 2016-09-22 | B41: Gateshead | C41: Chopwell/Rowlands Gill | D41: 156 | E41: 1066 | F41: 221 | G41: 79 | H41: 282 | J41: 302 | K41: 1733 | L41: 121 | M41: 209 | N41: 397 | V41: of:=[.D41]/SUM([.$D41:.$I41])-[.J41]/SUM([.$J41:.$O41]) -> -0.0228665560962765 | W41: of:=[.E41]/SUM([.$D41:.$I41])-[.K41]/SUM([.$J41:.$O41]) -> -0.0365347903363834 | X41: of:=[.F41]/SUM([.$D41:.$I41])-[.L41]/SUM([.$J41:.$O41]) -> 0.0786967090591188 | Y41: of:=[.G41]/SUM([.$D41:.$I41])-[.M41]/SUM([.$J41:.$O41]) -> -0.0318782302101212 | Z41: of:=[.H41]/SUM([.$D41:.$I41])-[.N41]/SUM([.$J41:.$O41]) -> 0.0125828675836623
A42: 2016-09-22 | B42: Cherwell | C42: Adderbury/Bloxham/Bodicote | D42: 1015 | E42: 286 | F42: 189 | G42: 278 | J42: 1321 | K42: 444 | L42: 364 | M42: 573 | V42: of:=[.D42]/SUM([.$D42:.$I42])-[.J42]/SUM([.$J42:.$O42]) -> 0.0851979093749895 | W42: of:=[.E42]/SUM([.$D42:.$I42])-[.K42]/SUM([.$J42:.$O42]) -> -0.0025580180258632 | X42: of:=[.F42]/SUM([.$D42:.$I42])-[.L42]/SUM([.$J42:.$O42]) -> -0.027814573418048 | Y42: of:=[.G42]/SUM([.$D42:.$I42])-[.M42]/SUM([.$J42:.$O42]) -> -0.0548253179310784
A43: 2016-09-29 | B43: Derby | C43: Allestree | D43: 2006 | E43: 409 | F43: 1053 | G43: 115 | H43: 91 | J43: 2820 | K43: 785 | L43: 645 | N43: 508 | V43: of:=[.D43]/SUM([.$D43:.$I43])-[.J43]/SUM([.$J43:.$O43]) -> -0.0466870912536957 | W43: of:=[.E43]/SUM([.$D43:.$I43])-[.K43]/SUM([.$J43:.$O43]) -> -0.0536624790085083 | X43: of:=[.F43]/SUM([.$D43:.$I43])-[.L43]/SUM([.$J43:.$O43]) -> 0.151047440828534 | Y43: of:=[.G43]/SUM([.$D43:.$I43])-[.M43]/SUM([.$J43:.$O43]) -> 0.0313010342950463 | Z43: of:=[.H43]/SUM([.$D43:.$I43])-[.N43]/SUM([.$J43:.$O43]) -> -0.0819989048613766
A44: 2016-10-06 | B44: Hartlepool | C44: Headland/Harbour | D44: 41 | E44: 255 | H44: 496 | I44: of:=155+36+26 -> 217 | J44: 117 | K44: 617 | N44: 619 | Q44: -1 | T44: 1 | V44: of:=[.D44]/SUM([.$D44:.$I44])-[.J44]/SUM([.$J44:.$O44]) -> -0.0458402097310459 | W44: of:=[.E44]/SUM([.$D44:.$I44])-[.K44]/SUM([.$J44:.$O44]) -> -0.203298180382471 | Z44: of:=[.H44]/SUM([.$D44:.$I44])-[.N44]/SUM([.$J44:.$O44]) -> 0.0340739698954787 | AA44: of:=[.I44]/SUM([.$D44:.$I44])-[.O44]/SUM([.$J44:.$O44]) -> 0.215064420218038
A45: 2016-10-06 | B45: Bolton | C45: Rumworth | D45: 167 | E45: 2125 | F45: 96 | G45: 126 | H45: 251 | J45: 373 | K45: 2568 | L45: 82 | M45: 179 | N45: 354 | V45: of:=[.D45]/SUM([.$D45:.$I45])-[.J45]/SUM([.$J45:.$O45]) -> -0.0444953083396221 | W45: of:=[.E45]/SUM([.$D45:.$I45])-[.K45]/SUM([.$J45:.$O45]) -> 0.0463755321724025 | X45: of:=[.F45]/SUM([.$D45:.$I45])-[.L45]/SUM([.$J45:.$O45]) -> 0.0116600931212712 | Y45: of:=[.G45]/SUM([.$D45:.$I45])-[.M45]/SUM([.$J45:.$O45]) -> -0.00476783756460822 | Z45: of:=[.H45]/SUM([.$D45:.$I45])-[.N45]/SUM([.$J45:.$O45]) -> -0.00877247938944341
A46: 2016-10-06 | B46: Basingstoke/Deane | C46: Basing | D46: 1051 | E46: 184 | F46: 323 | J46: 1594 | K46: 297 | L46: 311 | N46: 298 | V46: of:=[.D46]/SUM([.$D46:.$I46])-[.J46]/SUM([.$J46:.$O46]) -> 0.0369827984595636 | W46: of:=[.E46]/SUM([.$D46:.$I46])-[.K46]/SUM([.$J46:.$O46]) -> -0.000699871630295251 | X46: of:=[.F46]/SUM([.$D46:.$I46])-[.L46]/SUM([.$J46:.$O46]) -> 0.0829170731707317 | Z46: of:=[.H46]/SUM([.$D46:.$I46])-[.N46]/SUM([.$J46:.$O46]) -> -0.1192
A47: 2016-10-20 | B47: St Albans | C47: Clarence | D47: 388 | E47: 193 | F47: 916 | G47: 98 | H47: 16 | J47: 490 | K47: 397 | L47: 1178 | M47: 226 | O47: 23 | V47: of:=[.D47]/SUM([.$D47:.$I47])-[.J47]/SUM([.$J47:.$O47]) -> 0.0290896585542245 | W47: of:=[.E47]/SUM([.$D47:.$I47])-[.K47]/SUM([.$J47:.$O47]) -> -0.0517630250540928 | X47: of:=[.F47]/SUM([.$D47:.$I47])-[.L47]/SUM([.$J47:.$O47]) -> 0.0595157428375682 | Y47: of:=[.G47]/SUM([.$D47:.$I47])-[.M47]/SUM([.$J47:.$O47]) -> -0.0368345970630824 | Z47: of:=[.H47]/SUM([.$D47:.$I47])-[.N47]/SUM([.$J47:.$O47]) -> 0.00993171942892613 | AA47: of:=[.I47]/SUM([.$D47:.$I47])-[.O47]/SUM([.$J47:.$O47]) -> -0.00993949870354365
P48: of:=SUM([.P33:.P47]) -> 0 | Q48: of:=SUM([.Q33:.Q47]) -> -2 | R48: of:=SUM([.R33:.R47]) -> 1 | S48: of:=SUM([.S33:.S47]) -> 0 | T48: of:=SUM([.T33:.T47]) -> 1 | U48: Average | V48: of:=AVERAGE([.V33:.V47]) -> -0.0103813992611903 | W48: of:=AVERAGE([.W33:.W47]) -> -0.0529525296343604 | X48: of:=AVERAGE([.X33:.X47]) -> 0.0851779698959093 | Y48: of:=AVERAGE([.Y33:.Y47]) -> -0.0163204518307374 | Z48: of:=AVERAGE([.Z33:.Z47]) -> -0.0161522882457765 | AA48: of:=AVERAGE([.AA33:.AA47]) -> 0.032668504810895